,No.,Time,Source,Destination,Protocol,Length,Info
0,1,0.0,0a:00:27:00:00:00,5a:94:d2:14:5a:51,ARP,42,Who has ***.***.***.***? Tell ***.***.***.***
1,2,1.021749,0a:00:27:00:00:00,5a:94:d2:14:5a:51,ARP,42,Who has ***.***.***.***? Tell ***.***.***.***
2,3,2.044526,0a:00:27:00:00:00,5a:94:d2:14:5a:51,ARP,42,Who has ***.***.***.***? Tell ***.***.***.***
3,4,3.891148,0a:00:27:00:00:00,Broadcast,ARP,42,Who has ***.***.***.***? Tell ***.***.***.***
4,5,4.892067,0a:00:27:00:00:00,Broadcast,ARP,42,Who has ***.***.***.***? Tell ***.***.***.***
5,6,5.92046,0a:00:27:00:00:00,Broadcast,ARP,42,Who has ***.***.***.***? Tell ***.***.***.***
6,7,7.943766,0a:00:27:00:00:00,Broadcast,ARP,42,Who has ***.***.***.***? Tell ***.***.***.***
7,8,8.95629,0a:00:27:00:00:00,Broadcast,ARP,42,Who has ***.***.***.***? Tell ***.***.***.***
8,9,9.839106,5a:94:d2:14:5a:51,Broadcast,ARP,42,Who has ***.***.***.***? (ARP Probe)
9,10,9.839108,5a:94:d2:14:5a:51,Broadcast,ARP,42,Who has ***.***.***.***? (ARP Probe)
10,11,9.979967,0a:00:27:00:00:00,Broadcast,ARP,42,Who has ***.***.***.***? Tell ***.***.***.***
11,12,10.839842,5a:94:d2:14:5a:51,Broadcast,ARP,42,Who has ***.***.***.***? (ARP Probe)
12,13,10.839846,5a:94:d2:14:5a:51,Broadcast,ARP,42,Who has ***.***.***.***? (ARP Probe)
13,14,11.838995,5a:94:d2:14:5a:51,Broadcast,ARP,42,Who has ***.***.***.***? (ARP Probe)
14,15,11.838999,5a:94:d2:14:5a:51,Broadcast,ARP,42,Who has ***.***.***.***? (ARP Probe)
15,16,12.008162,0a:00:27:00:00:00,Broadcast,ARP,42,Who has ***.***.***.***? Tell ***.***.***.***
16,17,12.842976,5a:94:d2:14:5a:51,Broadcast,ARP,42,Who has ***.***.***.***? Tell ***.***.***.***
17,18,12.842979,5a:94:d2:14:5a:51,Broadcast,ARP,42,Who has ***.***.***.***? Tell ***.***.***.***
18,19,12.843011,0a:00:27:00:00:00,5a:94:d2:14:5a:51,ARP,42,***.***.***.*** is at 0a:00:27:00:00:00
19,20,12.851427,***.***.***.***,***.***.***.***,LLMNR,66,Standard query 0xd671 A isatap
20,21,12.851428,***.***.***.***,***.***.***.***,LLMNR,66,Standard query 0xd671 A isatap
21,22,12.852795,***.***.***.***,***.***.***.***,IGMPv3,54,Membership Report / Leave group ***.***.***.***
22,23,12.852796,***.***.***.***,***.***.***.***,IGMPv3,54,Membership Report / Leave group ***.***.***.***
23,24,12.876482,***.***.***.***,***.***.***.***,IGMPv3,54,Membership Report / Join group ***.***.***.*** for any sources
24,25,12.876484,***.***.***.***,***.***.***.***,IGMPv3,54,Membership Report / Join group ***.***.***.*** for any sources
25,26,12.878972,***.***.***.***,***.***.***.***,LLMNR,64,Standard query 0x4163 ANY None
26,27,12.878973,***.***.***.***,***.***.***.***,LLMNR,64,Standard query 0x4163 ANY None
27,28,12.929288,***.***.***.***,***.***.***.***,NBNS,110,Registration NB NONE<20>
28,29,12.929291,***.***.***.***,***.***.***.***,NBNS,110,Registration NB NONE<20>
29,30,12.930025,***.***.***.***,***.***.***.***,NBNS,110,Registration NB NONE<00>
30,31,12.930027,***.***.***.***,***.***.***.***,NBNS,110,Registration NB NONE<00>
31,32,12.930081,***.***.***.***,***.***.***.***,NBNS,110,Registration NB WORKGROUP<00>
32,33,12.930082,***.***.***.***,***.***.***.***,NBNS,110,Registration NB WORKGROUP<00>
33,34,12.937097,***.***.***.***,***.***.***.***,IGMPv3,54,Membership Report / Join group ***.***.***.*** for any sources
34,35,12.937099,***.***.***.***,***.***.***.***,IGMPv3,54,Membership Report / Join group ***.***.***.*** for any sources
35,36,12.950899,***.***.***.***,***.***.***.***,LLMNR,66,Standard query 0xd671 A isatap
36,37,12.950916,***.***.***.***,***.***.***.***,LLMNR,66,Standard query 0xd671 A isatap
37,38,12.965834,***.***.***.***,***.***.***.***,LLMNR,64,Standard query 0x4163 ANY None
38,39,12.965836,***.***.***.***,***.***.***.***,LLMNR,64,Standard query 0x4163 ANY None
39,40,13.014385,5a:94:d2:14:5a:51,Broadcast,ARP,42,Who has ***.***.***.***? Tell ***.***.***.***
40,41,13.014387,5a:94:d2:14:5a:51,Broadcast,ARP,42,Who has ***.***.***.***? Tell ***.***.***.***
41,42,13.014397,0a:00:27:00:00:00,5a:94:d2:14:5a:51,ARP,42,***.***.***.*** is at 0a:00:27:00:00:00
42,43,13.153015,***.***.***.***,***.***.***.***,NBNS,92,Name query NB ISATAP<00>
43,44,13.153019,***.***.***.***,***.***.***.***,NBNS,92,Name query NB ISATAP<00>
44,45,13.168359,***.***.***.***,***.***.***.***,SSDP,175,M-SEARCH * HTTP/1.1 
45,46,13.168363,***.***.***.***,***.***.***.***,SSDP,175,M-SEARCH * HTTP/1.1 
46,47,13.340774,***.***.***.***,***.***.***.***,IGMPv3,62,Membership Report / Join group ***.***.***.*** for any sources / Join group ***.***.***.*** for any sources
47,48,13.340778,***.***.***.***,***.***.***.***,IGMPv3,62,Membership Report / Join group ***.***.***.*** for any sources / Join group ***.***.***.*** for any sources
48,49,13.60654,***.***.***.***,***.***.***.***,SSDP,139,M-SEARCH * HTTP/1.1 
49,50,13.606541,***.***.***.***,***.***.***.***,SSDP,139,M-SEARCH * HTTP/1.1 
50,51,13.622059,***.***.***.***,***.***.***.***,SSDP,171,M-SEARCH * HTTP/1.1 
51,52,13.622061,***.***.***.***,***.***.***.***,SSDP,171,M-SEARCH * HTTP/1.1 
52,53,13.669647,***.***.***.***,***.***.***.***,NBNS,110,Registration NB WORKGROUP<00>
53,54,13.669652,***.***.***.***,***.***.***.***,NBNS,110,Registration NB WORKGROUP<00>
54,55,13.669717,***.***.***.***,***.***.***.***,NBNS,110,Registration NB NONE<00>
55,56,13.669718,***.***.***.***,***.***.***.***,NBNS,110,Registration NB NONE<00>
56,57,13.669756,***.***.***.***,***.***.***.***,NBNS,110,Registration NB NONE<20>
57,58,13.669757,***.***.***.***,***.***.***.***,NBNS,110,Registration NB NONE<20>
58,59,13.798921,***.***.***.***,***.***.***.***,UDP,666,57521  >  3702 Len=624
59,60,13.798925,***.***.***.***,***.***.***.***,UDP,666,57521  >  3702 Len=624
60,61,13.887161,***.***.***.***,***.***.***.***,UDP,666,57521  >  3702 Len=624
61,62,13.887168,***.***.***.***,***.***.***.***,UDP,666,57521  >  3702 Len=624
62,63,13.902262,***.***.***.***,***.***.***.***,NBNS,92,Name query NB ISATAP<00>
63,64,13.902266,***.***.***.***,***.***.***.***,NBNS,92,Name query NB ISATAP<00>
64,65,14.311526,***.***.***.***,***.***.***.***,LLMNR,64,Standard query 0x21c1 A wpad
65,66,14.311528,***.***.***.***,***.***.***.***,LLMNR,64,Standard query 0x21c1 A wpad
66,67,14.402994,***.***.***.***,***.***.***.***,LLMNR,64,Standard query 0x21c1 A wpad
67,68,14.402995,***.***.***.***,***.***.***.***,LLMNR,64,Standard query 0x21c1 A wpad
68,69,14.41718,***.***.***.***,***.***.***.***,NBNS,110,Registration NB NONE<20>
69,70,14.417184,***.***.***.***,***.***.***.***,NBNS,110,Registration NB NONE<20>
70,71,14.417276,***.***.***.***,***.***.***.***,NBNS,110,Registration NB NONE<00>
71,72,14.417278,***.***.***.***,***.***.***.***,NBNS,110,Registration NB NONE<00>
72,73,14.417317,***.***.***.***,***.***.***.***,NBNS,110,Registration NB WORKGROUP<00>
73,74,14.417318,***.***.***.***,***.***.***.***,NBNS,110,Registration NB WORKGROUP<00>
74,75,14.606472,***.***.***.***,***.***.***.***,NBNS,92,Name query NB WPAD<00>
75,76,14.606474,***.***.***.***,***.***.***.***,NBNS,92,Name query NB WPAD<00>
76,77,14.65815,***.***.***.***,***.***.***.***,NBNS,92,Name query NB ISATAP<00>
77,78,14.658154,***.***.***.***,***.***.***.***,NBNS,92,Name query NB ISATAP<00>
78,79,15.17217,***.***.***.***,***.***.***.***,NBNS,110,Registration NB WORKGROUP<00>
79,80,15.172174,***.***.***.***,***.***.***.***,NBNS,110,Registration NB WORKGROUP<00>
80,81,15.172233,***.***.***.***,***.***.***.***,NBNS,110,Registration NB NONE<00>
81,82,15.172234,***.***.***.***,***.***.***.***,NBNS,110,Registration NB NONE<00>
82,83,15.17227,***.***.***.***,***.***.***.***,NBNS,110,Registration NB NONE<20>
83,84,15.172271,***.***.***.***,***.***.***.***,NBNS,110,Registration NB NONE<20>
84,85,15.355954,***.***.***.***,***.***.***.***,NBNS,92,Name query NB WPAD<00>
85,86,15.355963,***.***.***.***,***.***.***.***,NBNS,92,Name query NB WPAD<00>
86,87,15.414031,***.***.***.***,***.***.***.***,LLMNR,66,Standard query 0xc4c8 A isatap
87,88,15.414032,***.***.***.***,***.***.***.***,LLMNR,66,Standard query 0xc4c8 A isatap
88,89,15.511544,***.***.***.***,***.***.***.***,LLMNR,66,Standard query 0xc4c8 A isatap
89,90,15.511546,***.***.***.***,***.***.***.***,LLMNR,66,Standard query 0xc4c8 A isatap
90,91,15.722824,***.***.***.***,***.***.***.***,NBNS,92,Name query NB ISATAP<00>
91,92,15.722828,***.***.***.***,***.***.***.***,NBNS,92,Name query NB ISATAP<00>
92,93,15.892909,***.***.***.***,***.***.***.***,DNS,85,Standard query 0x971a A teredo.ipv6.microsoft.com
93,94,15.914656,***.***.***.***,***.***.***.***,DNS,158,Standard query response 0x971a No such name A teredo.ipv6.microsoft.com SOA ns1-04.azure-dns.com
94,95,15.921307,***.***.***.***,***.***.***.***,NBNS,110,Registration NB WORKGROUP<1e>
95,96,15.921312,***.***.***.***,***.***.***.***,NBNS,110,Registration NB WORKGROUP<1e>
96,97,16.105163,***.***.***.***,***.***.***.***,NBNS,92,Name query NB WPAD<00>
97,98,16.105166,***.***.***.***,***.***.***.***,NBNS,92,Name query NB WPAD<00>
98,99,16.168892,***.***.***.***,***.***.***.***,SSDP,175,M-SEARCH * HTTP/1.1 
99,100,16.168896,***.***.***.***,***.***.***.***,SSDP,175,M-SEARCH * HTTP/1.1 
100,101,16.231756,***.***.***.***,***.***.***.***,SSDP,171,M-SEARCH * HTTP/1.1 
101,102,16.231758,***.***.***.***,***.***.***.***,SSDP,171,M-SEARCH * HTTP/1.1 
102,103,16.26311,***.***.***.***,***.***.***.***,SSDP,139,M-SEARCH * HTTP/1.1 
103,104,16.263112,***.***.***.***,***.***.***.***,SSDP,139,M-SEARCH * HTTP/1.1 
104,105,16.294607,***.***.***.***,***.***.***.***,SSDP,175,M-SEARCH * HTTP/1.1 
105,106,16.294609,***.***.***.***,***.***.***.***,SSDP,175,M-SEARCH * HTTP/1.1 
106,107,16.465701,***.***.***.***,***.***.***.***,NBNS,92,Name query NB ISATAP<00>
107,108,16.465705,***.***.***.***,***.***.***.***,NBNS,92,Name query NB ISATAP<00>
108,109,16.606772,***.***.***.***,***.***.***.***,SSDP,139,M-SEARCH * HTTP/1.1 
109,110,16.606774,***.***.***.***,***.***.***.***,SSDP,139,M-SEARCH * HTTP/1.1 
110,111,16.621845,***.***.***.***,***.***.***.***,SSDP,171,M-SEARCH * HTTP/1.1 
111,112,16.621847,***.***.***.***,***.***.***.***,SSDP,171,M-SEARCH * HTTP/1.1 
112,113,16.669954,***.***.***.***,***.***.***.***,NBNS,110,Registration NB WORKGROUP<1e>
113,114,16.669959,***.***.***.***,***.***.***.***,NBNS,110,Registration NB WORKGROUP<1e>
114,115,16.876037,***.***.***.***,***.***.***.***,DNS,76,Standard query 0xab76 A www.msftncsi.com
115,116,16.907991,***.***.***.***,***.***.***.***,DNS,182,Standard query response 0xab76 A www.msftncsi.com CNAME www.msftncsi.com.edgesuite.net CNAME a1961.g2.akamai.net A ***.***.***.*** A ***.***.***.***
116,117,16.916667,***.***.***.***,***.***.***.***,TCP,66,49160  >  80 [SYN] Seq=0 Win=8192 Len=0 MSS=1460 WS=256 SACK_PERM=1
117,118,16.933908,***.***.***.***,***.***.***.***,TCP,58,"80  >  49160 [SYN, ACK] Seq=0 Ack=1 Win=65535 Len=0 MSS=1460"
118,119,16.934088,***.***.***.***,***.***.***.***,TCP,54,49160  >  80 [ACK] Seq=1 Ack=1 Win=64240 Len=0
119,120,16.934983,***.***.***.***,***.***.***.***,HTTP,151,GET /ncsi.txt HTTP/1.1 
120,121,16.936666,***.***.***.***,***.***.***.***,TCP,54,80  >  49160 [ACK] Seq=1 Ack=98 Win=65535 Len=0
121,122,16.953229,***.***.***.***,***.***.***.***,HTTP,233,HTTP/1.1 200 OK  (text/plain)
122,123,16.95324,***.***.***.***,***.***.***.***,TCP,54,"80  >  49160 [FIN, ACK] Seq=180 Ack=98 Win=65535 Len=0"
123,124,16.953489,***.***.***.***,***.***.***.***,TCP,54,49160  >  80 [ACK] Seq=98 Ack=181 Win=64061 Len=0
124,125,16.95396,***.***.***.***,***.***.***.***,TCP,54,"49160  >  80 [FIN, ACK] Seq=98 Ack=181 Win=64061 Len=0"
125,126,16.954087,***.***.***.***,***.***.***.***,TCP,54,80  >  49160 [ACK] Seq=181 Ack=99 Win=65535 Len=0
126,127,17.216176,***.***.***.***,***.***.***.***,NBNS,92,Name query NB ISATAP<00>
127,128,17.21618,***.***.***.***,***.***.***.***,NBNS,92,Name query NB ISATAP<00>
128,129,17.420363,***.***.***.***,***.***.***.***,NBNS,110,Registration NB WORKGROUP<1e>
129,130,17.420365,***.***.***.***,***.***.***.***,NBNS,110,Registration NB WORKGROUP<1e>
130,131,17.971184,***.***.***.***,***.***.***.***,LLMNR,66,Standard query 0x025f A isatap
131,132,17.971186,***.***.***.***,***.***.***.***,LLMNR,66,Standard query 0x025f A isatap
132,133,18.008427,5a:94:d2:14:5a:51,Broadcast,ARP,42,Who has ***.***.***.***? Tell ***.***.***.***
133,134,18.008431,5a:94:d2:14:5a:51,Broadcast,ARP,42,Who has ***.***.***.***? Tell ***.***.***.***
134,135,18.008441,0a:00:27:00:00:00,5a:94:d2:14:5a:51,ARP,42,***.***.***.*** is at 0a:00:27:00:00:00
135,136,18.167296,***.***.***.***,***.***.***.***,NBNS,110,Registration NB WORKGROUP<1e>
136,137,18.1673,***.***.***.***,***.***.***.***,NBNS,110,Registration NB WORKGROUP<1e>
137,138,18.344043,***.***.***.***,***.***.***.***,LLMNR,66,Standard query 0x025f A isatap
138,139,18.344045,***.***.***.***,***.***.***.***,LLMNR,66,Standard query 0x025f A isatap
139,140,18.551977,***.***.***.***,***.***.***.***,NBNS,92,Name query NB ISATAP<00>
140,141,18.551981,***.***.***.***,***.***.***.***,NBNS,92,Name query NB ISATAP<00>
141,142,18.92042,***.***.***.***,***.***.***.***,BROWSER,217,Request Announcement NONE
142,143,18.920424,***.***.***.***,***.***.***.***,BROWSER,217,Request Announcement NONE
143,144,18.936403,***.***.***.***,***.***.***.***,BROWSER,243,"Host Announcement NONE, Workstation, Server, NT Workstation, Potential Browser"
144,145,18.936406,***.***.***.***,***.***.***.***,BROWSER,243,"Host Announcement NONE, Workstation, Server, NT Workstation, Potential Browser"
145,146,19.179293,***.***.***.***,***.***.***.***,SSDP,175,M-SEARCH * HTTP/1.1 
146,147,19.179297,***.***.***.***,***.***.***.***,SSDP,175,M-SEARCH * HTTP/1.1 
147,148,19.292423,***.***.***.***,***.***.***.***,NBNS,92,Name query NB ISATAP<00>
148,149,19.292427,***.***.***.***,***.***.***.***,NBNS,92,Name query NB ISATAP<00>
149,150,19.324681,***.***.***.***,***.***.***.***,SSDP,171,M-SEARCH * HTTP/1.1 
150,151,19.324683,***.***.***.***,***.***.***.***,SSDP,171,M-SEARCH * HTTP/1.1 
151,152,19.370823,***.***.***.***,***.***.***.***,SSDP,139,M-SEARCH * HTTP/1.1 
152,153,19.370825,***.***.***.***,***.***.***.***,SSDP,139,M-SEARCH * HTTP/1.1 
153,154,19.417823,***.***.***.***,***.***.***.***,SSDP,175,M-SEARCH * HTTP/1.1 
154,155,19.417827,***.***.***.***,***.***.***.***,SSDP,175,M-SEARCH * HTTP/1.1 
155,156,19.605739,***.***.***.***,***.***.***.***,SSDP,139,M-SEARCH * HTTP/1.1 
156,157,19.605741,***.***.***.***,***.***.***.***,SSDP,139,M-SEARCH * HTTP/1.1 
157,158,19.6206,***.***.***.***,***.***.***.***,SSDP,171,M-SEARCH * HTTP/1.1 
158,159,19.620602,***.***.***.***,***.***.***.***,SSDP,171,M-SEARCH * HTTP/1.1 
159,160,20.043068,***.***.***.***,***.***.***.***,NBNS,92,Name query NB ISATAP<00>
160,161,20.043072,***.***.***.***,***.***.***.***,NBNS,92,Name query NB ISATAP<00>
161,162,20.417462,***.***.***.***,***.***.***.***,BROWSER,217,Request Announcement NONE
162,163,20.417466,***.***.***.***,***.***.***.***,BROWSER,217,Request Announcement NONE
163,164,20.802656,***.***.***.***,***.***.***.***,LLMNR,66,Standard query 0xc9cb A isatap
164,165,20.802659,***.***.***.***,***.***.***.***,LLMNR,66,Standard query 0xc9cb A isatap
165,166,20.902777,***.***.***.***,***.***.***.***,LLMNR,66,Standard query 0xc9cb A isatap
166,167,20.902779,***.***.***.***,***.***.***.***,LLMNR,66,Standard query 0xc9cb A isatap
167,168,21.105555,***.***.***.***,***.***.***.***,NBNS,92,Name query NB ISATAP<00>
168,169,21.105556,***.***.***.***,***.***.***.***,NBNS,92,Name query NB ISATAP<00>
169,170,21.855288,***.***.***.***,***.***.***.***,NBNS,92,Name query NB ISATAP<00>
170,171,21.855292,***.***.***.***,***.***.***.***,NBNS,92,Name query NB ISATAP<00>
171,172,21.918086,***.***.***.***,***.***.***.***,BROWSER,217,Request Announcement NONE
172,173,21.91809,***.***.***.***,***.***.***.***,BROWSER,217,Request Announcement NONE
173,174,22.176193,***.***.***.***,***.***.***.***,SSDP,175,M-SEARCH * HTTP/1.1 
174,175,22.176197,***.***.***.***,***.***.***.***,SSDP,175,M-SEARCH * HTTP/1.1 
175,176,22.604917,***.***.***.***,***.***.***.***,NBNS,92,Name query NB ISATAP<00>
176,177,22.60492,***.***.***.***,***.***.***.***,NBNS,92,Name query NB ISATAP<00>
177,178,23.360504,***.***.***.***,***.***.***.***,LLMNR,66,Standard query 0x96f1 A isatap
178,179,23.360506,***.***.***.***,***.***.***.***,LLMNR,66,Standard query 0x96f1 A isatap
179,180,23.421372,***.***.***.***,***.***.***.***,BROWSER,217,Request Announcement NONE
180,181,23.421375,***.***.***.***,***.***.***.***,BROWSER,217,Request Announcement NONE
181,182,23.467602,***.***.***.***,***.***.***.***,LLMNR,66,Standard query 0x96f1 A isatap
182,183,23.467603,***.***.***.***,***.***.***.***,LLMNR,66,Standard query 0x96f1 A isatap
183,184,23.668338,***.***.***.***,***.***.***.***,NBNS,92,Name query NB ISATAP<00>
184,185,23.668342,***.***.***.***,***.***.***.***,NBNS,92,Name query NB ISATAP<00>
185,186,24.417301,***.***.***.***,***.***.***.***,NBNS,92,Name query NB ISATAP<00>
186,187,24.417305,***.***.***.***,***.***.***.***,NBNS,92,Name query NB ISATAP<00>
187,188,24.917389,***.***.***.***,***.***.***.***,BROWSER,229,Browser Election Request
188,189,24.917391,***.***.***.***,***.***.***.***,BROWSER,229,Browser Election Request
189,190,25.167983,***.***.***.***,***.***.***.***,NBNS,92,Name query NB ISATAP<00>
190,191,25.167987,***.***.***.***,***.***.***.***,NBNS,92,Name query NB ISATAP<00>
191,192,25.169524,***.***.***.***,***.***.***.***,SSDP,175,M-SEARCH * HTTP/1.1 
192,193,25.169526,***.***.***.***,***.***.***.***,SSDP,175,M-SEARCH * HTTP/1.1 
193,194,25.921083,***.***.***.***,***.***.***.***,BROWSER,229,Browser Election Request
194,195,25.921087,***.***.***.***,***.***.***.***,BROWSER,229,Browser Election Request
195,196,26.919055,***.***.***.***,***.***.***.***,BROWSER,229,Browser Election Request
196,197,26.919059,***.***.***.***,***.***.***.***,BROWSER,229,Browser Election Request
197,198,27.921437,***.***.***.***,***.***.***.***,BROWSER,229,Browser Election Request
198,199,27.921441,***.***.***.***,***.***.***.***,BROWSER,229,Browser Election Request
199,200,28.919281,***.***.***.***,***.***.***.***,NBNS,110,Registration NB WORKGROUP<1d>
200,201,28.919285,***.***.***.***,***.***.***.***,NBNS,110,Registration NB WORKGROUP<1d>
201,202,29.667895,***.***.***.***,***.***.***.***,NBNS,110,Registration NB WORKGROUP<1d>
202,203,29.667902,***.***.***.***,***.***.***.***,NBNS,110,Registration NB WORKGROUP<1d>
203,204,30.41791,***.***.***.***,***.***.***.***,NBNS,110,Registration NB WORKGROUP<1d>
204,205,30.417914,***.***.***.***,***.***.***.***,NBNS,110,Registration NB WORKGROUP<1d>
205,206,31.167176,***.***.***.***,***.***.***.***,NBNS,110,Registration NB WORKGROUP<1d>
206,207,31.16718,***.***.***.***,***.***.***.***,NBNS,110,Registration NB WORKGROUP<1d>
207,208,31.918998,***.***.***.***,***.***.***.***,NBNS,110,Registration NB <01><02>__MSBROWSE__<02><01>
208,209,31.919003,***.***.***.***,***.***.***.***,NBNS,110,Registration NB <01><02>__MSBROWSE__<02><01>
209,210,32.672528,***.***.***.***,***.***.***.***,NBNS,110,Registration NB <01><02>__MSBROWSE__<02><01>
210,211,32.672533,***.***.***.***,***.***.***.***,NBNS,110,Registration NB <01><02>__MSBROWSE__<02><01>
211,212,33.420715,***.***.***.***,***.***.***.***,NBNS,110,Registration NB <01><02>__MSBROWSE__<02><01>
212,213,33.420719,***.***.***.***,***.***.***.***,NBNS,110,Registration NB <01><02>__MSBROWSE__<02><01>
213,214,34.167159,***.***.***.***,***.***.***.***,NBNS,110,Registration NB <01><02>__MSBROWSE__<02><01>
214,215,34.167163,***.***.***.***,***.***.***.***,NBNS,110,Registration NB <01><02>__MSBROWSE__<02><01>
215,216,34.921011,***.***.***.***,***.***.***.***,BROWSER,217,Request Announcement NONE
216,217,34.921015,***.***.***.***,***.***.***.***,BROWSER,217,Request Announcement NONE
217,218,34.921106,***.***.***.***,***.***.***.***,BROWSER,217,Request Announcement NONE
218,219,34.921108,***.***.***.***,***.***.***.***,BROWSER,217,Request Announcement NONE
219,220,34.922054,***.***.***.***,***.***.***.***,BROWSER,247,"Domain/Workgroup Announcement WORKGROUP, NT Workstation, Domain Enum"
220,221,34.922056,***.***.***.***,***.***.***.***,BROWSER,247,"Domain/Workgroup Announcement WORKGROUP, NT Workstation, Domain Enum"
221,222,37.330897,***.***.***.***,***.***.***.***,BROWSER,243,"Local Master Announcement NONE, Workstation, Server, NT Workstation, Potential Browser, Master Browser"
222,223,37.330901,***.***.***.***,***.***.***.***,BROWSER,243,"Local Master Announcement NONE, Workstation, Server, NT Workstation, Potential Browser, Master Browser"
223,224,47.545101,***.***.***.***,***.***.***.***,SSDP,175,M-SEARCH * HTTP/1.1 
224,225,47.545105,***.***.***.***,***.***.***.***,SSDP,175,M-SEARCH * HTTP/1.1 
225,226,48.520014,***.***.***.***,***.***.***.***,LLMNR,64,Standard query 0x6e6e A wpad
226,227,48.520016,***.***.***.***,***.***.***.***,LLMNR,64,Standard query 0x6e6e A wpad
227,228,48.62463,***.***.***.***,***.***.***.***,LLMNR,64,Standard query 0x6e6e A wpad
228,229,48.624631,***.***.***.***,***.***.***.***,LLMNR,64,Standard query 0x6e6e A wpad
229,230,48.832441,***.***.***.***,***.***.***.***,NBNS,92,Name query NB WPAD<00>
230,231,48.832444,***.***.***.***,***.***.***.***,NBNS,92,Name query NB WPAD<00>
231,232,49.574074,***.***.***.***,***.***.***.***,NBNS,92,Name query NB WPAD<00>
232,233,49.574078,***.***.***.***,***.***.***.***,NBNS,92,Name query NB WPAD<00>
233,234,50.328525,***.***.***.***,***.***.***.***,NBNS,92,Name query NB WPAD<00>
234,235,50.328529,***.***.***.***,***.***.***.***,NBNS,92,Name query NB WPAD<00>
235,236,50.543865,***.***.***.***,***.***.***.***,SSDP,175,M-SEARCH * HTTP/1.1 
236,237,50.543869,***.***.***.***,***.***.***.***,SSDP,175,M-SEARCH * HTTP/1.1 
237,238,51.085434,***.***.***.***,***.***.***.***,DNS,79,Standard query 0x6cfb A clients2.google.com
238,239,51.108304,***.***.***.***,***.***.***.***,DNS,199,Standard query response 0x6cfb A clients2.google.com CNAME clients.l.google.com A ***.***.***.*** A ***.***.***.*** A ***.***.***.*** A ***.***.***.*** A ***.***.***.*** A ***.***.***.***
239,240,51.235423,***.***.***.***,***.***.***.***,TCP,66,49167  >  443 [SYN] Seq=0 Win=8192 Len=0 MSS=1460 WS=256 SACK_PERM=1
240,241,51.254592,***.***.***.***,***.***.***.***,TCP,58,"443  >  49167 [SYN, ACK] Seq=0 Ack=1 Win=65535 Len=0 MSS=1460"
241,242,51.254969,***.***.***.***,***.***.***.***,TCP,54,49167  >  443 [ACK] Seq=1 Ack=1 Win=64240 Len=0
242,243,51.375902,***.***.***.***,***.***.***.***,TLSv1.2,215,Client Hello
243,244,51.376389,***.***.***.***,***.***.***.***,TCP,54,443  >  49167 [ACK] Seq=1 Ack=162 Win=65535 Len=0
244,245,51.397377,***.***.***.***,***.***.***.***,TLSv1.2,1466,Server Hello
245,246,51.397872,***.***.***.***,***.***.***.***,TCP,1466,"443  >  49167 [PSH, ACK] Seq=1413 Ack=162 Win=65535 Len=1412 [TCP segment of a reassembled PDU]"
246,247,51.398018,***.***.***.***,***.***.***.***,TCP,54,49167  >  443 [ACK] Seq=162 Ack=2825 Win=64240 Len=0
247,248,51.398192,***.***.***.***,***.***.***.***,TCP,1514,443  >  49167 [ACK] Seq=2825 Ack=162 Win=65535 Len=1460 [TCP segment of a reassembled PDU]
248,249,51.398205,***.***.***.***,***.***.***.***,TCP,1514,443  >  49167 [ACK] Seq=4285 Ack=162 Win=65535 Len=1460 [TCP segment of a reassembled PDU]
249,250,51.398206,***.***.***.***,***.***.***.***,TLSv1.2,970,"Certificate, Server Key Exchange, Server Hello Done"
250,251,51.398307,***.***.***.***,***.***.***.***,TCP,54,49167  >  443 [ACK] Seq=162 Ack=6661 Win=64240 Len=0
251,252,51.432109,***.***.***.***,***.***.***.***,TLSv1.2,180,"Client Key Exchange, Change Cipher Spec, Encrypted Handshake Message"
252,253,51.432293,***.***.***.***,***.***.***.***,TCP,54,443  >  49167 [ACK] Seq=6661 Ack=288 Win=65535 Len=0
253,254,51.457467,***.***.***.***,***.***.***.***,TLSv1.2,105,"Change Cipher Spec, Encrypted Handshake Message"
254,255,51.667416,***.***.***.***,***.***.***.***,TCP,54,49167  >  443 [ACK] Seq=288 Ack=6712 Win=64189 Len=0
255,256,51.863649,***.***.***.***,***.***.***.***,TLSv1.2,577,Application Data
256,257,51.864002,***.***.***.***,***.***.***.***,TCP,54,443  >  49167 [ACK] Seq=6712 Ack=811 Win=65535 Len=0
257,258,51.893493,***.***.***.***,***.***.***.***,TLSv1.2,333,Application Data
258,259,51.922313,***.***.***.***,***.***.***.***,TCP,54,"49167  >  443 [RST, ACK] Seq=811 Ack=6991 Win=0 Len=0"
259,260,53.543308,***.***.***.***,***.***.***.***,SSDP,175,M-SEARCH * HTTP/1.1 
260,261,53.543311,***.***.***.***,***.***.***.***,SSDP,175,M-SEARCH * HTTP/1.1 
261,262,94.92264,***.***.***.***,***.***.***.***,BROWSER,247,"Domain/Workgroup Announcement WORKGROUP, NT Workstation, Domain Enum"
262,263,94.922643,***.***.***.***,***.***.***.***,BROWSER,247,"Domain/Workgroup Announcement WORKGROUP, NT Workstation, Domain Enum"
263,264,107.396769,***.***.***.***,***.***.***.***,DNS,76,Standard query 0x09c0 A time.windows.com
264,265,107.44004,***.***.***.***,***.***.***.***,DNS,128,Standard query response 0x09c0 A time.windows.com CNAME twc.trafficmanager.net A ***.***.***.***
265,266,107.525242,***.***.***.***,***.***.***.***,NTP,90,"NTP Version 3, client"
266,267,107.54594,***.***.***.***,***.***.***.***,NTP,90,"NTP Version 3, server"
267,268,155.01303,***.***.***.***,***.***.***.***,BROWSER,247,"Domain/Workgroup Announcement WORKGROUP, NT Workstation, Domain Enum"
268,269,155.013032,***.***.***.***,***.***.***.***,BROWSER,247,"Domain/Workgroup Announcement WORKGROUP, NT Workstation, Domain Enum"
269,270,182.606796,***.***.***.***,***.***.***.***,TCP,66,49230  >  9001 [SYN] Seq=0 Win=8192 Len=0 MSS=1460 WS=256 SACK_PERM=1
270,271,182.608788,***.***.***.***,***.***.***.***,TCP,66,49231  >  9101 [SYN] Seq=0 Win=8192 Len=0 MSS=1460 WS=256 SACK_PERM=1
271,272,182.671221,***.***.***.***,***.***.***.***,TCP,58,"9101  >  49231 [SYN, ACK] Seq=0 Ack=1 Win=65535 Len=0 MSS=1460"
272,273,182.671413,***.***.***.***,***.***.***.***,TCP,54,49231  >  9101 [ACK] Seq=1 Ack=1 Win=64240 Len=0
273,274,182.69987,***.***.***.***,***.***.***.***,TLSv1.2,267,Client Hello
274,275,182.700062,***.***.***.***,***.***.***.***,TCP,54,9101  >  49231 [ACK] Seq=1 Ack=214 Win=65535 Len=0
275,276,182.752025,***.***.***.***,***.***.***.***,TLSv1.2,1072,"Server Hello, Certificate, Server Key Exchange, Server Hello Done"
276,277,182.758181,***.***.***.***,***.***.***.***,TLSv1.2,180,"Client Key Exchange, Change Cipher Spec, Encrypted Handshake Message"
277,278,182.758353,***.***.***.***,***.***.***.***,TCP,54,9101  >  49231 [ACK] Seq=1019 Ack=340 Win=65535 Len=0
278,279,182.810703,***.***.***.***,***.***.***.***,TLSv1.2,105,"Change Cipher Spec, Encrypted Handshake Message"
279,280,182.813967,***.***.***.***,***.***.***.***,TLSv1.2,92,Application Data
280,281,182.814102,***.***.***.***,***.***.***.***,TCP,54,9101  >  49231 [ACK] Seq=1070 Ack=378 Win=65535 Len=0
281,282,182.864548,***.***.***.***,***.***.***.***,TCP,1514,9101  >  49231 [ACK] Seq=1070 Ack=378 Win=65535 Len=1460 [TCP segment of a reassembled PDU]
282,283,182.864562,***.***.***.***,***.***.***.***,TLSv1.2,680,Application Data
283,284,182.864754,***.***.***.***,***.***.***.***,TCP,54,49231  >  9101 [ACK] Seq=378 Ack=3156 Win=64240 Len=0
284,285,182.871463,***.***.***.***,***.***.***.***,TLSv1.2,1111,Application Data
285,286,182.871615,***.***.***.***,***.***.***.***,TCP,54,9101  >  49231 [ACK] Seq=3156 Ack=1435 Win=65535 Len=0
286,287,182.928986,***.***.***.***,***.***.***.***,TLSv1.2,597,Application Data
287,288,182.951762,***.***.***.***,***.***.***.***,TLSv1.2,1111,Application Data
288,289,182.95191,***.***.***.***,***.***.***.***,TCP,54,9101  >  49231 [ACK] Seq=3699 Ack=2492 Win=65535 Len=0
289,290,183.009064,***.***.***.***,***.***.***.***,TCP,1514,"9101  >  49231 [PSH, ACK] Seq=3699 Ack=2492 Win=65535 Len=1460 [TCP segment of a reassembled PDU]"
290,291,183.009175,***.***.***.***,***.***.***.***,TCP,1514,"9101  >  49231 [PSH, ACK] Seq=5159 Ack=2492 Win=65535 Len=1460 [TCP segment of a reassembled PDU]"
291,292,183.009266,***.***.***.***,***.***.***.***,TCP,54,49231  >  9101 [ACK] Seq=2492 Ack=6619 Win=64240 Len=0
292,293,183.009417,***.***.***.***,***.***.***.***,TLSv1.2,1211,Application Data
293,294,183.009525,***.***.***.***,***.***.***.***,TCP,1514,"9101  >  49231 [PSH, ACK] Seq=7776 Ack=2492 Win=65535 Len=1460 [TCP segment of a reassembled PDU]"
294,295,183.009618,***.***.***.***,***.***.***.***,TCP,54,49231  >  9101 [ACK] Seq=2492 Ack=9236 Win=64240 Len=0
295,296,183.009701,***.***.***.***,***.***.***.***,TCP,1514,"9101  >  49231 [PSH, ACK] Seq=9236 Ack=2492 Win=65535 Len=1460 [TCP segment of a reassembled PDU]"
296,297,183.009984,***.***.***.***,***.***.***.***,TLSv1.2,1514,Application Data [TCP segment of a reassembled PDU]
297,298,183.010105,***.***.***.***,***.***.***.***,TCP,1514,"9101  >  49231 [PSH, ACK] Seq=12156 Ack=2492 Win=65535 Len=1460 [TCP segment of a reassembled PDU]"
298,299,183.010305,***.***.***.***,***.***.***.***,TCP,1514,"9101  >  49231 [PSH, ACK] Seq=13616 Ack=2492 Win=65535 Len=1460 [TCP segment of a reassembled PDU]"
299,300,183.010339,***.***.***.***,***.***.***.***,TCP,54,49231  >  9101 [ACK] Seq=2492 Ack=12156 Win=64240 Len=0
300,301,183.010477,***.***.***.***,***.***.***.***,TLSv1.2,1514,Application Data [TCP segment of a reassembled PDU]
301,302,183.010698,***.***.***.***,***.***.***.***,TLSv1.2,1514,Application Data [TCP segment of a reassembled PDU]
302,303,183.010879,***.***.***.***,***.***.***.***,TCP,54,49231  >  9101 [ACK] Seq=2492 Ack=17996 Win=58400 Len=0
303,304,183.01117,***.***.***.***,***.***.***.***,TCP,54,[TCP Window Update] 49231  >  9101 [ACK] Seq=2492 Ack=17996 Win=64240 Len=0
304,305,183.061756,***.***.***.***,***.***.***.***,TCP,1514,"9101  >  49231 [PSH, ACK] Seq=17996 Ack=2492 Win=65535 Len=1460 [TCP segment of a reassembled PDU]"
305,306,183.061878,***.***.***.***,***.***.***.***,TLSv1.2,1514,Application Data [TCP segment of a reassembled PDU]
306,307,183.062032,***.***.***.***,***.***.***.***,TCP,1514,"9101  >  49231 [PSH, ACK] Seq=20916 Ack=2492 Win=65535 Len=1460 [TCP segment of a reassembled PDU]"
307,308,183.062192,***.***.***.***,***.***.***.***,TCP,54,49231  >  9101 [ACK] Seq=2492 Ack=20916 Win=64240 Len=0
308,309,183.062246,***.***.***.***,***.***.***.***,TLSv1.2,1514,Application Data [TCP segment of a reassembled PDU]
309,310,183.062413,***.***.***.***,***.***.***.***,TCP,54,49231  >  9101 [ACK] Seq=2492 Ack=23836 Win=64240 Len=0
310,311,183.062433,***.***.***.***,***.***.***.***,TCP,1514,"9101  >  49231 [PSH, ACK] Seq=23836 Ack=2492 Win=65535 Len=1460 [TCP segment of a reassembled PDU]"
311,312,183.06262,***.***.***.***,***.***.***.***,TCP,1514,"9101  >  49231 [PSH, ACK] Seq=25296 Ack=2492 Win=65535 Len=1460 [TCP segment of a reassembled PDU]"
312,313,183.062807,***.***.***.***,***.***.***.***,TLSv1.2,1514,Application Data [TCP segment of a reassembled PDU]
313,314,183.062884,***.***.***.***,***.***.***.***,TCP,54,49231  >  9101 [ACK] Seq=2492 Ack=26756 Win=64240 Len=0
314,315,183.063048,***.***.***.***,***.***.***.***,TCP,1514,"9101  >  49231 [PSH, ACK] Seq=28216 Ack=2492 Win=65535 Len=1460 [TCP segment of a reassembled PDU]"
315,316,183.063204,***.***.***.***,***.***.***.***,TLSv1.2,1514,Application Data [TCP segment of a reassembled PDU]
316,317,183.063224,***.***.***.***,***.***.***.***,TCP,54,49231  >  9101 [ACK] Seq=2492 Ack=29676 Win=64240 Len=0
317,318,183.063409,***.***.***.***,***.***.***.***,TLSv1.2,1177,"Application Data, Application Data"
318,319,183.063506,***.***.***.***,***.***.***.***,TCP,54,49231  >  9101 [ACK] Seq=2492 Ack=32259 Win=61657 Len=0
319,320,183.066678,***.***.***.***,***.***.***.***,TCP,54,[TCP Window Update] 49231  >  9101 [ACK] Seq=2492 Ack=32259 Win=64240 Len=0
320,321,183.067411,***.***.***.***,***.***.***.***,TCP,1514,"9101  >  49231 [PSH, ACK] Seq=32259 Ack=2492 Win=65535 Len=1460 [TCP segment of a reassembled PDU]"
321,322,183.067581,***.***.***.***,***.***.***.***,TCP,1514,"9101  >  49231 [PSH, ACK] Seq=33719 Ack=2492 Win=65535 Len=1460 [TCP segment of a reassembled PDU]"
322,323,183.067672,***.***.***.***,***.***.***.***,TCP,54,49231  >  9101 [ACK] Seq=2492 Ack=35179 Win=61320 Len=0
323,324,183.067799,***.***.***.***,***.***.***.***,TLSv1.2,1514,Application Data [TCP segment of a reassembled PDU]
324,325,183.067993,***.***.***.***,***.***.***.***,TCP,1514,"9101  >  49231 [PSH, ACK] Seq=36639 Ack=2492 Win=65535 Len=1460 [TCP segment of a reassembled PDU]"
325,326,183.068156,***.***.***.***,***.***.***.***,TCP,1514,"9101  >  49231 [PSH, ACK] Seq=38099 Ack=2492 Win=65535 Len=1460 [TCP segment of a reassembled PDU]"
326,327,183.068272,***.***.***.***,***.***.***.***,TCP,54,49231  >  9101 [ACK] Seq=2492 Ack=39559 Win=56940 Len=0
327,328,183.068979,***.***.***.***,***.***.***.***,TLSv1.2,1514,Application Data [TCP segment of a reassembled PDU]
328,329,183.070697,***.***.***.***,***.***.***.***,TCP,54,49231  >  9101 [ACK] Seq=2492 Ack=41019 Win=58952 Len=0
329,330,183.075421,***.***.***.***,***.***.***.***,TCP,54,[TCP Window Update] 49231  >  9101 [ACK] Seq=2492 Ack=41019 Win=64240 Len=0
330,331,183.07606,***.***.***.***,***.***.***.***,TCP,1514,"9101  >  49231 [PSH, ACK] Seq=41019 Ack=2492 Win=65535 Len=1460 [TCP segment of a reassembled PDU]"
331,332,183.07625,***.***.***.***,***.***.***.***,TCP,1514,"9101  >  49231 [PSH, ACK] Seq=42479 Ack=2492 Win=65535 Len=1460 [TCP segment of a reassembled PDU]"
332,333,183.076415,***.***.***.***,***.***.***.***,TLSv1.2,1514,"Application Data, Application Data"
333,334,183.076561,***.***.***.***,***.***.***.***,TCP,54,49231  >  9101 [ACK] Seq=2492 Ack=43939 Win=61320 Len=0
334,335,183.076637,***.***.***.***,***.***.***.***,TCP,1514,"9101  >  49231 [PSH, ACK] Seq=45399 Ack=2492 Win=65535 Len=1460 [TCP segment of a reassembled PDU]"
335,336,183.076776,***.***.***.***,***.***.***.***,TCP,54,49231  >  9101 [ACK] Seq=2492 Ack=46859 Win=58400 Len=0
336,337,183.082027,***.***.***.***,***.***.***.***,TLSv1.2,597,Application Data
337,338,183.082122,***.***.***.***,***.***.***.***,TCP,54,9101  >  49231 [ACK] Seq=46859 Ack=3035 Win=65535 Len=0
338,339,183.085016,***.***.***.***,***.***.***.***,TCP,54,[TCP Window Update] 49231  >  9101 [ACK] Seq=3035 Ack=46859 Win=64240 Len=0
339,340,183.117967,***.***.***.***,***.***.***.***,TCP,1514,"9101  >  49231 [PSH, ACK] Seq=46859 Ack=3035 Win=65535 Len=1460 [TCP segment of a reassembled PDU]"
340,341,183.118892,***.***.***.***,***.***.***.***,TLSv1.2,1514,Application Data [TCP segment of a reassembled PDU]
341,342,183.118904,***.***.***.***,***.***.***.***,TCP,1514,9101  >  49231 [ACK] Seq=49779 Ack=3035 Win=65535 Len=1460 [TCP segment of a reassembled PDU]
342,343,183.118905,***.***.***.***,***.***.***.***,TCP,1514,9101  >  49231 [ACK] Seq=51239 Ack=3035 Win=65535 Len=1460 [TCP segment of a reassembled PDU]
343,344,183.118906,***.***.***.***,***.***.***.***,TLSv1.2,1514,Application Data [TCP segment of a reassembled PDU]
344,345,183.118907,***.***.***.***,***.***.***.***,TCP,1514,"9101  >  49231 [PSH, ACK] Seq=54159 Ack=3035 Win=65535 Len=1460 [TCP segment of a reassembled PDU]"
345,346,183.11916,***.***.***.***,***.***.***.***,TCP,54,49231  >  9101 [ACK] Seq=3035 Ack=55619 Win=64240 Len=0
346,347,183.119801,***.***.***.***,***.***.***.***,TCP,1514,9101  >  49231 [ACK] Seq=55619 Ack=3035 Win=65535 Len=1460 [TCP segment of a reassembled PDU]
347,348,183.119811,***.***.***.***,***.***.***.***,TLSv1.2,1514,Application Data [TCP segment of a reassembled PDU]
348,349,183.119812,***.***.***.***,***.***.***.***,TCP,1514,9101  >  49231 [ACK] Seq=58539 Ack=3035 Win=65535 Len=1460 [TCP segment of a reassembled PDU]
349,350,183.119813,***.***.***.***,***.***.***.***,TCP,1514,9101  >  49231 [ACK] Seq=59999 Ack=3035 Win=65535 Len=1460 [TCP segment of a reassembled PDU]
350,351,183.119813,***.***.***.***,***.***.***.***,TLSv1.2,1514,"Application Data, Application Data"
351,352,183.120001,***.***.***.***,***.***.***.***,TCP,54,49231  >  9101 [ACK] Seq=3035 Ack=62919 Win=56940 Len=0
352,353,183.12186,***.***.***.***,***.***.***.***,TCP,1514,9101  >  49231 [ACK] Seq=62919 Ack=3035 Win=65535 Len=1460 [TCP segment of a reassembled PDU]
353,354,183.121868,***.***.***.***,***.***.***.***,TLSv1.2,1514,Application Data [TCP segment of a reassembled PDU]
354,355,183.121869,***.***.***.***,***.***.***.***,TLSv1.2,1514,Application Data [TCP segment of a reassembled PDU]
355,356,183.121959,***.***.***.***,***.***.***.***,TCP,54,49231  >  9101 [ACK] Seq=3035 Ack=67299 Win=52560 Len=0
356,357,183.122799,***.***.***.***,***.***.***.***,TCP,1514,9101  >  49231 [ACK] Seq=67299 Ack=3035 Win=65535 Len=1460 [TCP segment of a reassembled PDU]
357,358,183.122808,***.***.***.***,***.***.***.***,TCP,1514,9101  >  49231 [ACK] Seq=68759 Ack=3035 Win=65535 Len=1460 [TCP segment of a reassembled PDU]
358,359,183.122809,***.***.***.***,***.***.***.***,TLSv1.2,1514,Application Data [TCP segment of a reassembled PDU]
359,360,183.12281,***.***.***.***,***.***.***.***,TCP,1514,9101  >  49231 [ACK] Seq=71679 Ack=3035 Win=65535 Len=1460 [TCP segment of a reassembled PDU]
360,361,183.12281,***.***.***.***,***.***.***.***,TCP,1514,"9101  >  49231 [PSH, ACK] Seq=73139 Ack=3035 Win=65535 Len=1460 [TCP segment of a reassembled PDU]"
361,362,183.122971,***.***.***.***,***.***.***.***,TCP,54,49231  >  9101 [ACK] Seq=3035 Ack=74599 Win=45260 Len=0
362,363,183.127694,***.***.***.***,***.***.***.***,TLSv1.2,1325,"Application Data, Application Data, Application Data"
363,364,183.128651,***.***.***.***,***.***.***.***,TCP,1514,9101  >  49231 [ACK] Seq=75870 Ack=3035 Win=65535 Len=1460 [TCP segment of a reassembled PDU]
364,365,183.128661,***.***.***.***,***.***.***.***,TCP,1514,9101  >  49231 [ACK] Seq=77330 Ack=3035 Win=65535 Len=1460 [TCP segment of a reassembled PDU]
365,366,183.128662,***.***.***.***,***.***.***.***,TLSv1.2,1514,Application Data [TCP segment of a reassembled PDU]
366,367,183.128663,***.***.***.***,***.***.***.***,TLSv1.2,1514,Application Data [TCP segment of a reassembled PDU]
367,368,183.128663,***.***.***.***,***.***.***.***,TCP,1514,"9101  >  49231 [PSH, ACK] Seq=81710 Ack=3035 Win=65535 Len=1460 [TCP segment of a reassembled PDU]"
368,369,183.128861,***.***.***.***,***.***.***.***,TCP,54,49231  >  9101 [ACK] Seq=3035 Ack=83170 Win=36689 Len=0
369,370,183.129611,***.***.***.***,***.***.***.***,TCP,1514,9101  >  49231 [ACK] Seq=83170 Ack=3035 Win=65535 Len=1460 [TCP segment of a reassembled PDU]
370,371,183.12962,***.***.***.***,***.***.***.***,TLSv1.2,1514,Application Data [TCP segment of a reassembled PDU]
371,372,183.129621,***.***.***.***,***.***.***.***,TCP,1514,9101  >  49231 [ACK] Seq=86090 Ack=3035 Win=65535 Len=1460 [TCP segment of a reassembled PDU]
372,373,183.129622,***.***.***.***,***.***.***.***,TCP,1514,9101  >  49231 [ACK] Seq=87550 Ack=3035 Win=65535 Len=1460 [TCP segment of a reassembled PDU]
373,374,183.129623,***.***.***.***,***.***.***.***,TLSv1.2,1514,Application Data [TCP segment of a reassembled PDU]
374,375,183.129788,***.***.***.***,***.***.***.***,TCP,54,49231  >  9101 [ACK] Seq=3035 Ack=90470 Win=29389 Len=0
375,376,183.13389,***.***.***.***,***.***.***.***,TCP,1514,9101  >  49231 [ACK] Seq=90470 Ack=3035 Win=65535 Len=1460 [TCP segment of a reassembled PDU]
376,377,183.133899,***.***.***.***,***.***.***.***,TCP,1514,"9101  >  49231 [PSH, ACK] Seq=91930 Ack=3035 Win=65535 Len=1460 [TCP segment of a reassembled PDU]"
377,378,183.134011,***.***.***.***,***.***.***.***,TCP,54,49231  >  9101 [ACK] Seq=3035 Ack=93390 Win=26469 Len=0
378,379,183.134453,***.***.***.***,***.***.***.***,TLSv1.2,1514,Application Data [TCP segment of a reassembled PDU]
379,380,183.134463,***.***.***.***,***.***.***.***,TLSv1.2,1514,Application Data [TCP segment of a reassembled PDU]
380,381,183.134464,***.***.***.***,***.***.***.***,TCP,1514,9101  >  49231 [ACK] Seq=96310 Ack=3035 Win=65535 Len=1460 [TCP segment of a reassembled PDU]
381,382,183.134465,***.***.***.***,***.***.***.***,TLSv1.2,1514,Application Data [TCP segment of a reassembled PDU]
382,383,183.134559,***.***.***.***,***.***.***.***,TCP,54,49231  >  9101 [ACK] Seq=3035 Ack=99230 Win=20629 Len=0
383,384,183.137399,***.***.***.***,***.***.***.***,TCP,1514,9101  >  49231 [ACK] Seq=99230 Ack=3035 Win=65535 Len=1460 [TCP segment of a reassembled PDU]
384,385,183.137408,***.***.***.***,***.***.***.***,TCP,1514,9101  >  49231 [ACK] Seq=100690 Ack=3035 Win=65535 Len=1460 [TCP segment of a reassembled PDU]
385,386,183.137409,***.***.***.***,***.***.***.***,TLSv1.2,1514,Application Data [TCP segment of a reassembled PDU]
386,387,183.13741,***.***.***.***,***.***.***.***,TCP,1514,"9101  >  49231 [PSH, ACK] Seq=103610 Ack=3035 Win=65535 Len=1460 [TCP segment of a reassembled PDU]"
387,388,183.137582,***.***.***.***,***.***.***.***,TCP,54,49231  >  9101 [ACK] Seq=3035 Ack=105070 Win=14789 Len=0
388,389,183.137764,***.***.***.***,***.***.***.***,TCP,54,[TCP Window Update] 49231  >  9101 [ACK] Seq=3035 Ack=105070 Win=18261 Len=0
389,390,183.140243,***.***.***.***,***.***.***.***,TCP,54,[TCP Window Update] 49231  >  9101 [ACK] Seq=3035 Ack=105070 Win=64240 Len=0
390,391,183.150504,***.***.***.***,***.***.***.***,TLSv1.2,1111,Application Data
391,392,183.150591,***.***.***.***,***.***.***.***,TCP,54,9101  >  49231 [ACK] Seq=105070 Ack=4092 Win=65535 Len=0
392,393,183.178532,***.***.***.***,***.***.***.***,TLSv1.2,1514,Application Data [TCP segment of a reassembled PDU]
393,394,183.17942,***.***.***.***,***.***.***.***,TCP,1514,9101  >  49231 [ACK] Seq=106530 Ack=4092 Win=65535 Len=1460 [TCP segment of a reassembled PDU]
394,395,183.179432,***.***.***.***,***.***.***.***,TCP,1514,9101  >  49231 [ACK] Seq=107990 Ack=4092 Win=65535 Len=1460 [TCP segment of a reassembled PDU]
395,396,183.179433,***.***.***.***,***.***.***.***,TLSv1.2,1514,Application Data [TCP segment of a reassembled PDU]
396,397,183.179434,***.***.***.***,***.***.***.***,TLSv1.2,1514,Application Data [TCP segment of a reassembled PDU]
397,398,183.179434,***.***.***.***,***.***.***.***,TCP,1514,"9101  >  49231 [PSH, ACK] Seq=112370 Ack=4092 Win=65535 Len=1460 [TCP segment of a reassembled PDU]"
398,399,183.179537,***.***.***.***,***.***.***.***,TCP,54,49231  >  9101 [ACK] Seq=4092 Ack=113830 Win=55480 Len=0
399,400,183.180551,***.***.***.***,***.***.***.***,TCP,1514,9101  >  49231 [ACK] Seq=113830 Ack=4092 Win=65535 Len=1460 [TCP segment of a reassembled PDU]
400,401,183.180563,***.***.***.***,***.***.***.***,TLSv1.2,1514,Application Data [TCP segment of a reassembled PDU]
401,402,183.18058,***.***.***.***,***.***.***.***,TLSv1.2,1514,Application Data [TCP segment of a reassembled PDU]
402,403,183.180588,***.***.***.***,***.***.***.***,TLSv1.2,1514,Application Data [TCP segment of a reassembled PDU]
403,404,183.180589,***.***.***.***,***.***.***.***,TCP,1514,"9101  >  49231 [PSH, ACK] Seq=119670 Ack=4092 Win=65535 Len=1460 [TCP segment of a reassembled PDU]"
404,405,183.180681,***.***.***.***,***.***.***.***,TCP,54,49231  >  9101 [ACK] Seq=4092 Ack=121130 Win=48180 Len=0
405,406,183.181507,***.***.***.***,***.***.***.***,TCP,1514,9101  >  49231 [ACK] Seq=121130 Ack=4092 Win=65535 Len=1460 [TCP segment of a reassembled PDU]
406,407,183.181519,***.***.***.***,***.***.***.***,TLSv1.2,1514,Application Data [TCP segment of a reassembled PDU]
407,408,183.18152,***.***.***.***,***.***.***.***,TCP,1514,9101  >  49231 [ACK] Seq=124050 Ack=4092 Win=65535 Len=1460 [TCP segment of a reassembled PDU]
408,409,183.181521,***.***.***.***,***.***.***.***,TCP,1514,9101  >  49231 [ACK] Seq=125510 Ack=4092 Win=65535 Len=1460 [TCP segment of a reassembled PDU]
409,410,183.181521,***.***.***.***,***.***.***.***,TLSv1.2,1514,Application Data [TCP segment of a reassembled PDU]
410,411,183.181609,***.***.***.***,***.***.***.***,TCP,54,49231  >  9101 [ACK] Seq=4092 Ack=128430 Win=40880 Len=0
411,412,183.182356,***.***.***.***,***.***.***.***,TCP,1514,9101  >  49231 [ACK] Seq=128430 Ack=4092 Win=65535 Len=1460 [TCP segment of a reassembled PDU]
412,413,183.182367,***.***.***.***,***.***.***.***,TCP,1514,9101  >  49231 [ACK] Seq=129890 Ack=4092 Win=65535 Len=1460 [TCP segment of a reassembled PDU]
413,414,183.182368,***.***.***.***,***.***.***.***,TLSv1.2,1514,Application Data [TCP segment of a reassembled PDU]
414,415,183.182369,***.***.***.***,***.***.***.***,TCP,1514,"9101  >  49231 [PSH, ACK] Seq=132810 Ack=4092 Win=65535 Len=1460 [TCP segment of a reassembled PDU]"
415,416,183.182452,***.***.***.***,***.***.***.***,TCP,54,49231  >  9101 [ACK] Seq=4092 Ack=134270 Win=35040 Len=0
416,417,183.183421,***.***.***.***,***.***.***.***,TCP,1514,9101  >  49231 [ACK] Seq=134270 Ack=4092 Win=65535 Len=1460 [TCP segment of a reassembled PDU]
417,418,183.183432,***.***.***.***,***.***.***.***,TLSv1.2,1514,"Application Data, Application Data"
418,419,183.183446,***.***.***.***,***.***.***.***,TCP,1514,9101  >  49231 [ACK] Seq=137190 Ack=4092 Win=65535 Len=1460 [TCP segment of a reassembled PDU]
419,420,183.183457,***.***.***.***,***.***.***.***,TLSv1.2,1514,Application Data [TCP segment of a reassembled PDU]
420,421,183.183458,***.***.***.***,***.***.***.***,TCP,1514,9101  >  49231 [ACK] Seq=140110 Ack=4092 Win=65535 Len=1460 [TCP segment of a reassembled PDU]
421,422,183.183459,***.***.***.***,***.***.***.***,TCP,1514,"9101  >  49231 [PSH, ACK] Seq=141570 Ack=4092 Win=65535 Len=1460 [TCP segment of a reassembled PDU]"
422,423,183.183551,***.***.***.***,***.***.***.***,TCP,54,49231  >  9101 [ACK] Seq=4092 Ack=143030 Win=26280 Len=0
423,424,183.184273,***.***.***.***,***.***.***.***,TLSv1.2,1514,"Application Data, Application Data"
424,425,183.184305,***.***.***.***,***.***.***.***,TLSv1.2,1514,Application Data [TCP segment of a reassembled PDU]
425,426,183.184306,***.***.***.***,***.***.***.***,TCP,1514,9101  >  49231 [ACK] Seq=145950 Ack=4092 Win=65535 Len=1460 [TCP segment of a reassembled PDU]
426,427,183.184307,***.***.***.***,***.***.***.***,TCP,1514,9101  >  49231 [ACK] Seq=147410 Ack=4092 Win=65535 Len=1460 [TCP segment of a reassembled PDU]
427,428,183.184308,***.***.***.***,***.***.***.***,TLSv1.2,1514,Application Data [TCP segment of a reassembled PDU]
428,429,183.18439,***.***.***.***,***.***.***.***,TCP,54,49231  >  9101 [ACK] Seq=4092 Ack=150330 Win=18980 Len=0
429,430,183.185419,***.***.***.***,***.***.***.***,TCP,1514,9101  >  49231 [ACK] Seq=150330 Ack=4092 Win=65535 Len=1460 [TCP segment of a reassembled PDU]
430,431,183.185431,***.***.***.***,***.***.***.***,TCP,1514,9101  >  49231 [ACK] Seq=151790 Ack=4092 Win=65535 Len=1460 [TCP segment of a reassembled PDU]
431,432,183.185432,***.***.***.***,***.***.***.***,TLSv1.2,1514,Application Data [TCP segment of a reassembled PDU]
432,433,183.185446,***.***.***.***,***.***.***.***,TCP,1514,9101  >  49231 [ACK] Seq=154710 Ack=4092 Win=65535 Len=1460 [TCP segment of a reassembled PDU]
433,434,183.185447,***.***.***.***,***.***.***.***,TCP,1514,9101  >  49231 [ACK] Seq=156170 Ack=4092 Win=65535 Len=1460 [TCP segment of a reassembled PDU]
434,435,183.185449,***.***.***.***,***.***.***.***,TLSv1.2,1514,Application Data [TCP segment of a reassembled PDU]
435,436,183.185529,***.***.***.***,***.***.***.***,TCP,54,49231  >  9101 [ACK] Seq=4092 Ack=159090 Win=10220 Len=0
436,437,183.186407,***.***.***.***,***.***.***.***,TCP,1514,9101  >  49231 [ACK] Seq=159090 Ack=4092 Win=65535 Len=1460 [TCP segment of a reassembled PDU]
437,438,183.186418,***.***.***.***,***.***.***.***,TLSv1.2,1514,"Application Data, Application Data"
438,439,183.186419,***.***.***.***,***.***.***.***,TLSv1.2,1514,"Application Data, Application Data"
439,440,183.18642,***.***.***.***,***.***.***.***,TCP,1514,9101  >  49231 [ACK] Seq=163470 Ack=4092 Win=65535 Len=1460 [TCP segment of a reassembled PDU]
440,441,183.186421,***.***.***.***,***.***.***.***,TCP,1514,"9101  >  49231 [PSH, ACK] Seq=164930 Ack=4092 Win=65535 Len=1460 [TCP segment of a reassembled PDU]"
441,442,183.186537,***.***.***.***,***.***.***.***,TCP,54,49231  >  9101 [ACK] Seq=4092 Ack=166390 Win=2920 Len=0
442,443,183.187249,***.***.***.***,***.***.***.***,TLSv1.2,1514,Application Data [TCP segment of a reassembled PDU]
443,444,183.187259,***.***.***.***,***.***.***.***,TCP,1514,[TCP Window Full] 9101  >  49231 [ACK] Seq=167850 Ack=4092 Win=65535 Len=1460 [TCP segment of a reassembled PDU]
444,445,183.18754,***.***.***.***,***.***.***.***,TCP,54,[TCP ZeroWindow] 49231  >  9101 [ACK] Seq=4092 Ack=169310 Win=0 Len=0
445,446,183.306204,***.***.***.***,***.***.***.***,TLSv1.2,597,"[TCP ZeroWindow] , Application Data"
446,447,183.306348,***.***.***.***,***.***.***.***,TCP,54,9101  >  49231 [ACK] Seq=169310 Ack=4635 Win=65535 Len=0
447,448,183.314054,***.***.***.***,***.***.***.***,TCP,54,[TCP Window Update] 49231  >  9101 [ACK] Seq=4635 Ack=169310 Win=3472 Len=0
448,449,183.314223,***.***.***.***,***.***.***.***,TCP,1514,9101  >  49231 [ACK] Seq=169310 Ack=4635 Win=65535 Len=1460 [TCP segment of a reassembled PDU]
449,450,183.314232,***.***.***.***,***.***.***.***,TLSv1.2,1514,Application Data [TCP segment of a reassembled PDU]
450,451,183.314424,***.***.***.***,***.***.***.***,TCP,54,49231  >  9101 [ACK] Seq=4635 Ack=172230 Win=552 Len=0
451,452,183.3205,***.***.***.***,***.***.***.***,TCP,54,[TCP Window Update] 49231  >  9101 [ACK] Seq=4635 Ack=172230 Win=61320 Len=0
452,453,183.320618,***.***.***.***,***.***.***.***,TCP,1514,9101  >  49231 [ACK] Seq=172230 Ack=4635 Win=65535 Len=1460 [TCP segment of a reassembled PDU]
453,454,183.320627,***.***.***.***,***.***.***.***,TCP,1514,9101  >  49231 [ACK] Seq=173690 Ack=4635 Win=65535 Len=1460 [TCP segment of a reassembled PDU]
454,455,183.320627,***.***.***.***,***.***.***.***,TLSv1.2,1514,Application Data [TCP segment of a reassembled PDU]
455,456,183.320628,***.***.***.***,***.***.***.***,TCP,1514,9101  >  49231 [ACK] Seq=176610 Ack=4635 Win=65535 Len=1460 [TCP segment of a reassembled PDU]
456,457,183.320658,***.***.***.***,***.***.***.***,TLSv1.2,1514,Application Data [TCP segment of a reassembled PDU]
457,458,183.32066,***.***.***.***,***.***.***.***,TLSv1.2,1514,Application Data [TCP segment of a reassembled PDU]
458,459,183.32066,***.***.***.***,***.***.***.***,TCP,1514,9101  >  49231 [ACK] Seq=180990 Ack=4635 Win=65535 Len=1460 [TCP segment of a reassembled PDU]
459,460,183.320661,***.***.***.***,***.***.***.***,TLSv1.2,1514,Application Data [TCP segment of a reassembled PDU]
460,461,183.320663,***.***.***.***,***.***.***.***,TCP,1514,9101  >  49231 [ACK] Seq=183910 Ack=4635 Win=65535 Len=1460 [TCP segment of a reassembled PDU]
461,462,183.320664,***.***.***.***,***.***.***.***,TCP,1514,9101  >  49231 [ACK] Seq=185370 Ack=4635 Win=65535 Len=1460 [TCP segment of a reassembled PDU]
462,463,183.320665,***.***.***.***,***.***.***.***,TLSv1.2,1514,Application Data [TCP segment of a reassembled PDU]
463,464,183.320666,***.***.***.***,***.***.***.***,TCP,1514,9101  >  49231 [ACK] Seq=188290 Ack=4635 Win=65535 Len=1460 [TCP segment of a reassembled PDU]
464,465,183.320716,***.***.***.***,***.***.***.***,TCP,1514,9101  >  49231 [ACK] Seq=189750 Ack=4635 Win=65535 Len=1460 [TCP segment of a reassembled PDU]
465,466,183.320724,***.***.***.***,***.***.***.***,TLSv1.2,1514,Application Data [TCP segment of a reassembled PDU]
466,467,183.320725,***.***.***.***,***.***.***.***,TCP,1514,9101  >  49231 [ACK] Seq=192670 Ack=4635 Win=65535 Len=1460 [TCP segment of a reassembled PDU]
467,468,183.320725,***.***.***.***,***.***.***.***,TCP,1514,9101  >  49231 [ACK] Seq=194130 Ack=4635 Win=65535 Len=1460 [TCP segment of a reassembled PDU]
468,469,183.320726,***.***.***.***,***.***.***.***,TLSv1.2,1514,"Application Data, Application Data"
469,470,183.320727,***.***.***.***,***.***.***.***,TCP,1514,9101  >  49231 [ACK] Seq=197050 Ack=4635 Win=65535 Len=1460 [TCP segment of a reassembled PDU]
470,471,183.320728,***.***.***.***,***.***.***.***,TLSv1.2,1514,Application Data [TCP segment of a reassembled PDU]
471,472,183.320728,***.***.***.***,***.***.***.***,TCP,1514,9101  >  49231 [ACK] Seq=199970 Ack=4635 Win=65535 Len=1460 [TCP segment of a reassembled PDU]
472,473,183.320729,***.***.***.***,***.***.***.***,TCP,1514,9101  >  49231 [ACK] Seq=201430 Ack=4635 Win=65535 Len=1460 [TCP segment of a reassembled PDU]
473,474,183.32073,***.***.***.***,***.***.***.***,TLSv1.2,1514,Application Data [TCP segment of a reassembled PDU]
474,475,183.320731,***.***.***.***,***.***.***.***,TCP,1514,9101  >  49231 [ACK] Seq=204350 Ack=4635 Win=65535 Len=1460 [TCP segment of a reassembled PDU]
475,476,183.320778,***.***.***.***,***.***.***.***,TCP,1514,9101  >  49231 [ACK] Seq=205810 Ack=4635 Win=65535 Len=1460 [TCP segment of a reassembled PDU]
476,477,183.320783,***.***.***.***,***.***.***.***,TLSv1.2,1514,Application Data [TCP segment of a reassembled PDU]
477,478,183.320785,***.***.***.***,***.***.***.***,TCP,1514,9101  >  49231 [ACK] Seq=208730 Ack=4635 Win=65535 Len=1460 [TCP segment of a reassembled PDU]
478,479,183.320786,***.***.***.***,***.***.***.***,TCP,1514,9101  >  49231 [ACK] Seq=210190 Ack=4635 Win=65535 Len=1460 [TCP segment of a reassembled PDU]
479,480,183.320786,***.***.***.***,***.***.***.***,TLSv1.2,1514,"Application Data, Application Data"
480,481,183.320788,***.***.***.***,***.***.***.***,TCP,1514,9101  >  49231 [ACK] Seq=213110 Ack=4635 Win=65535 Len=1460 [TCP segment of a reassembled PDU]
481,482,183.320788,***.***.***.***,***.***.***.***,TCP,1514,9101  >  49231 [ACK] Seq=214570 Ack=4635 Win=65535 Len=1460 [TCP segment of a reassembled PDU]
482,483,183.320789,***.***.***.***,***.***.***.***,TLSv1.2,1514,Application Data [TCP segment of a reassembled PDU]
483,484,183.32079,***.***.***.***,***.***.***.***,TCP,1514,9101  >  49231 [ACK] Seq=217490 Ack=4635 Win=65535 Len=1460 [TCP segment of a reassembled PDU]
484,485,183.320791,***.***.***.***,***.***.***.***,TLSv1.2,1514,Application Data [TCP segment of a reassembled PDU]
485,486,183.320791,***.***.***.***,***.***.***.***,TCP,1514,9101  >  49231 [ACK] Seq=220410 Ack=4635 Win=65535 Len=1460 [TCP segment of a reassembled PDU]
486,487,183.320792,***.***.***.***,***.***.***.***,TCP,1514,9101  >  49231 [ACK] Seq=221870 Ack=4635 Win=65535 Len=1460 [TCP segment of a reassembled PDU]
487,488,183.320793,***.***.***.***,***.***.***.***,TLSv1.2,1514,Application Data [TCP segment of a reassembled PDU]
488,489,183.320794,***.***.***.***,***.***.***.***,TCP,1514,9101  >  49231 [ACK] Seq=224790 Ack=4635 Win=65535 Len=1460 [TCP segment of a reassembled PDU]
489,490,183.320797,***.***.***.***,***.***.***.***,TCP,1514,9101  >  49231 [ACK] Seq=226250 Ack=4635 Win=65535 Len=1460 [TCP segment of a reassembled PDU]
490,491,183.320799,***.***.***.***,***.***.***.***,TLSv1.2,1514,Application Data [TCP segment of a reassembled PDU]
491,492,183.321041,***.***.***.***,***.***.***.***,TCP,54,49231  >  9101 [ACK] Seq=4635 Ack=218950 Win=14600 Len=0
492,493,183.321136,***.***.***.***,***.***.***.***,TLSv1.2,1514,Application Data [TCP segment of a reassembled PDU]
493,494,183.321147,***.***.***.***,***.***.***.***,TCP,1514,9101  >  49231 [ACK] Seq=230630 Ack=4635 Win=65535 Len=1460 [TCP segment of a reassembled PDU]
494,495,183.321148,***.***.***.***,***.***.***.***,TLSv1.2,1514,"[TCP Window Full] , Application Data [TCP segment of a reassembled PDU]"
495,496,183.321162,***.***.***.***,***.***.***.***,TCP,54,49231  >  9101 [ACK] Seq=4635 Ack=229170 Win=4380 Len=0
496,497,183.32131,***.***.***.***,***.***.***.***,TCP,54,[TCP ZeroWindow] 49231  >  9101 [ACK] Seq=4635 Ack=233550 Win=0 Len=0
497,498,183.335348,***.***.***.***,***.***.***.***,TLSv1.2,1111,"[TCP ZeroWindow] , Application Data"
498,499,183.335462,***.***.***.***,***.***.***.***,TCP,54,9101  >  49231 [ACK] Seq=233550 Ack=5692 Win=65535 Len=0
499,500,183.432424,***.***.***.***,***.***.***.***,TLSv1.2,597,"[TCP ZeroWindow] , Application Data"
500,501,183.432563,***.***.***.***,***.***.***.***,TCP,54,9101  >  49231 [ACK] Seq=233550 Ack=6235 Win=65535 Len=0
501,502,183.45503,***.***.***.***,***.***.***.***,TCP,54,[TCP Window Update] 49231  >  9101 [ACK] Seq=6235 Ack=233550 Win=3472 Len=0
502,503,183.455161,***.***.***.***,***.***.***.***,TCP,1514,9101  >  49231 [ACK] Seq=233550 Ack=6235 Win=65535 Len=1460 [TCP segment of a reassembled PDU]
503,504,183.455169,***.***.***.***,***.***.***.***,TCP,1514,9101  >  49231 [ACK] Seq=235010 Ack=6235 Win=65535 Len=1460 [TCP segment of a reassembled PDU]
504,505,183.456231,***.***.***.***,***.***.***.***,TCP,54,49231  >  9101 [ACK] Seq=6235 Ack=236470 Win=552 Len=0
505,506,183.460842,***.***.***.***,***.***.***.***,TLSv1.2,1111,Application Data
506,507,183.460982,***.***.***.***,***.***.***.***,TLSv1.2,606,"[TCP Window Full] , Application Data [TCP segment of a reassembled PDU]"
507,508,183.467075,***.***.***.***,***.***.***.***,TCP,54,49231  >  9101 [ACK] Seq=7292 Ack=237022 Win=60768 Len=0
508,509,183.467188,***.***.***.***,***.***.***.***,TCP,1514,9101  >  49231 [ACK] Seq=237022 Ack=7292 Win=65535 Len=1460 [TCP segment of a reassembled PDU]
509,510,183.467197,***.***.***.***,***.***.***.***,TCP,1514,9101  >  49231 [ACK] Seq=238482 Ack=7292 Win=65535 Len=1460 [TCP segment of a reassembled PDU]
510,511,183.467198,***.***.***.***,***.***.***.***,TLSv1.2,1514,Application Data [TCP segment of a reassembled PDU]
511,512,183.467199,***.***.***.***,***.***.***.***,TLSv1.2,1514,Application Data [TCP segment of a reassembled PDU]
512,513,183.4672,***.***.***.***,***.***.***.***,TCP,1514,9101  >  49231 [ACK] Seq=242862 Ack=7292 Win=65535 Len=1460 [TCP segment of a reassembled PDU]
513,514,183.467251,***.***.***.***,***.***.***.***,TCP,1514,9101  >  49231 [ACK] Seq=244322 Ack=7292 Win=65535 Len=1460 [TCP segment of a reassembled PDU]
514,515,183.467258,***.***.***.***,***.***.***.***,TLSv1.2,1514,Application Data [TCP segment of a reassembled PDU]
515,516,183.467259,***.***.***.***,***.***.***.***,TCP,1514,9101  >  49231 [ACK] Seq=247242 Ack=7292 Win=65535 Len=1460 [TCP segment of a reassembled PDU]
516,517,183.467259,***.***.***.***,***.***.***.***,TLSv1.2,1514,Application Data [TCP segment of a reassembled PDU]
517,518,183.46726,***.***.***.***,***.***.***.***,TCP,1514,9101  >  49231 [ACK] Seq=250162 Ack=7292 Win=65535 Len=1460 [TCP segment of a reassembled PDU]
518,519,183.467261,***.***.***.***,***.***.***.***,TLSv1.2,1514,Application Data [TCP segment of a reassembled PDU]
519,520,183.467262,***.***.***.***,***.***.***.***,TCP,1514,9101  >  49231 [ACK] Seq=253082 Ack=7292 Win=65535 Len=1460 [TCP segment of a reassembled PDU]
520,521,183.467263,***.***.***.***,***.***.***.***,TLSv1.2,1514,Application Data [TCP segment of a reassembled PDU]
521,522,183.467264,***.***.***.***,***.***.***.***,TCP,1514,9101  >  49231 [ACK] Seq=256002 Ack=7292 Win=65535 Len=1460 [TCP segment of a reassembled PDU]
522,523,183.467264,***.***.***.***,***.***.***.***,TCP,1514,9101  >  49231 [ACK] Seq=257462 Ack=7292 Win=65535 Len=1460 [TCP segment of a reassembled PDU]
523,524,183.467265,***.***.***.***,***.***.***.***,TLSv1.2,1514,Application Data [TCP segment of a reassembled PDU]
524,525,183.467303,***.***.***.***,***.***.***.***,TLSv1.2,1514,Application Data [TCP segment of a reassembled PDU]
525,526,183.467309,***.***.***.***,***.***.***.***,TCP,1514,9101  >  49231 [ACK] Seq=261842 Ack=7292 Win=65535 Len=1460 [TCP segment of a reassembled PDU]
526,527,183.467309,***.***.***.***,***.***.***.***,TCP,1514,9101  >  49231 [ACK] Seq=263302 Ack=7292 Win=65535 Len=1460 [TCP segment of a reassembled PDU]
527,528,183.46731,***.***.***.***,***.***.***.***,TLSv1.2,1514,Application Data [TCP segment of a reassembled PDU]
528,529,183.467311,***.***.***.***,***.***.***.***,TLSv1.2,1514,Application Data [TCP segment of a reassembled PDU]
529,530,183.467312,***.***.***.***,***.***.***.***,TCP,1514,9101  >  49231 [ACK] Seq=267682 Ack=7292 Win=65535 Len=1460 [TCP segment of a reassembled PDU]
530,531,183.467313,***.***.***.***,***.***.***.***,TCP,1514,9101  >  49231 [ACK] Seq=269142 Ack=7292 Win=65535 Len=1460 [TCP segment of a reassembled PDU]
531,532,183.467313,***.***.***.***,***.***.***.***,TLSv1.2,1514,Application Data [TCP segment of a reassembled PDU]
532,533,183.467314,***.***.***.***,***.***.***.***,TCP,1514,9101  >  49231 [ACK] Seq=272062 Ack=7292 Win=65535 Len=1460 [TCP segment of a reassembled PDU]
533,534,183.467315,***.***.***.***,***.***.***.***,TLSv1.2,1514,Application Data [TCP segment of a reassembled PDU]
534,535,183.467316,***.***.***.***,***.***.***.***,TCP,1514,9101  >  49231 [ACK] Seq=274982 Ack=7292 Win=65535 Len=1460 [TCP segment of a reassembled PDU]
535,536,183.467317,***.***.***.***,***.***.***.***,TCP,1514,9101  >  49231 [ACK] Seq=276442 Ack=7292 Win=65535 Len=1460 [TCP segment of a reassembled PDU]
536,537,183.467318,***.***.***.***,***.***.***.***,TLSv1.2,1514,Application Data [TCP segment of a reassembled PDU]
537,538,183.467318,***.***.***.***,***.***.***.***,TCP,1514,9101  >  49231 [ACK] Seq=279362 Ack=7292 Win=65535 Len=1460 [TCP segment of a reassembled PDU]
538,539,183.467319,***.***.***.***,***.***.***.***,TCP,1514,9101  >  49231 [ACK] Seq=280822 Ack=7292 Win=65535 Len=1460 [TCP segment of a reassembled PDU]
539,540,183.467359,***.***.***.***,***.***.***.***,TLSv1.2,1514,"Application Data, Application Data"
540,541,183.467363,***.***.***.***,***.***.***.***,TCP,1514,9101  >  49231 [ACK] Seq=283742 Ack=7292 Win=65535 Len=1460 [TCP segment of a reassembled PDU]
541,542,183.467364,***.***.***.***,***.***.***.***,TCP,1514,9101  >  49231 [ACK] Seq=285202 Ack=7292 Win=65535 Len=1460 [TCP segment of a reassembled PDU]
542,543,183.467365,***.***.***.***,***.***.***.***,TLSv1.2,1514,Application Data [TCP segment of a reassembled PDU]
543,544,183.467366,***.***.***.***,***.***.***.***,TCP,1514,9101  >  49231 [ACK] Seq=288122 Ack=7292 Win=65535 Len=1460 [TCP segment of a reassembled PDU]
544,545,183.467366,***.***.***.***,***.***.***.***,TLSv1.2,1514,Application Data [TCP segment of a reassembled PDU]
545,546,183.467367,***.***.***.***,***.***.***.***,TCP,1514,9101  >  49231 [ACK] Seq=291042 Ack=7292 Win=65535 Len=1460 [TCP segment of a reassembled PDU]
546,547,183.467368,***.***.***.***,***.***.***.***,TLSv1.2,1514,Application Data [TCP segment of a reassembled PDU]
547,548,183.467369,***.***.***.***,***.***.***.***,TLSv1.2,1514,Application Data [TCP segment of a reassembled PDU]
548,549,183.46737,***.***.***.***,***.***.***.***,TCP,1514,9101  >  49231 [ACK] Seq=295422 Ack=7292 Win=65535 Len=1460 [TCP segment of a reassembled PDU]
549,550,183.467913,***.***.***.***,***.***.***.***,TCP,54,49231  >  9101 [ACK] Seq=7292 Ack=283742 Win=14048 Len=0
550,551,183.467961,***.***.***.***,***.***.***.***,TCP,54,49231  >  9101 [ACK] Seq=7292 Ack=296882 Win=908 Len=0
551,552,183.671163,***.***.***.***,***.***.***.***,TLSv1.2,597,Application Data
552,553,183.671349,***.***.***.***,***.***.***.***,TCP,962,[TCP Window Full] 9101  >  49231 [ACK] Seq=296882 Ack=7835 Win=65535 Len=908 [TCP segment of a reassembled PDU]
553,554,183.710695,***.***.***.***,***.***.***.***,TLSv1.2,1111,"[TCP ZeroWindow] , Application Data"
554,555,183.710844,***.***.***.***,***.***.***.***,TCP,54,9101  >  49231 [ACK] Seq=297790 Ack=8892 Win=65535 Len=0
555,556,183.721137,***.***.***.***,***.***.***.***,TCP,54,[TCP Window Update] 49231  >  9101 [ACK] Seq=8892 Ack=297790 Win=3472 Len=0
556,557,183.721244,***.***.***.***,***.***.***.***,TCP,1514,9101  >  49231 [ACK] Seq=297790 Ack=8892 Win=65535 Len=1460 [TCP segment of a reassembled PDU]
557,558,183.721253,***.***.***.***,***.***.***.***,TLSv1.2,1514,Application Data [TCP segment of a reassembled PDU]
558,559,183.721395,***.***.***.***,***.***.***.***,TCP,54,49231  >  9101 [ACK] Seq=8892 Ack=300710 Win=552 Len=0
559,560,183.725065,***.***.***.***,***.***.***.***,TCP,54,[TCP Window Update] 49231  >  9101 [ACK] Seq=8892 Ack=300710 Win=61320 Len=0
560,561,183.725179,***.***.***.***,***.***.***.***,TCP,1514,9101  >  49231 [ACK] Seq=300710 Ack=8892 Win=65535 Len=1460 [TCP segment of a reassembled PDU]
561,562,183.725186,***.***.***.***,***.***.***.***,TLSv1.2,1514,Application Data [TCP segment of a reassembled PDU]
562,563,183.725187,***.***.***.***,***.***.***.***,TLSv1.2,1514,Application Data [TCP segment of a reassembled PDU]
563,564,183.725188,***.***.***.***,***.***.***.***,TCP,1514,9101  >  49231 [ACK] Seq=305090 Ack=8892 Win=65535 Len=1460 [TCP segment of a reassembled PDU]
564,565,183.725189,***.***.***.***,***.***.***.***,TCP,1514,9101  >  49231 [ACK] Seq=306550 Ack=8892 Win=65535 Len=1460 [TCP segment of a reassembled PDU]
565,566,183.72519,***.***.***.***,***.***.***.***,TLSv1.2,1514,Application Data [TCP segment of a reassembled PDU]
566,567,183.725254,***.***.***.***,***.***.***.***,TCP,1514,9101  >  49231 [ACK] Seq=309470 Ack=8892 Win=65535 Len=1460 [TCP segment of a reassembled PDU]
567,568,183.725259,***.***.***.***,***.***.***.***,TCP,1514,9101  >  49231 [ACK] Seq=310930 Ack=8892 Win=65535 Len=1460 [TCP segment of a reassembled PDU]
568,569,183.72526,***.***.***.***,***.***.***.***,TLSv1.2,1514,Application Data [TCP segment of a reassembled PDU]
569,570,183.72526,***.***.***.***,***.***.***.***,TCP,1514,9101  >  49231 [ACK] Seq=313850 Ack=8892 Win=65535 Len=1460 [TCP segment of a reassembled PDU]
570,571,183.725261,***.***.***.***,***.***.***.***,TLSv1.2,1514,Application Data [TCP segment of a reassembled PDU]
571,572,183.725262,***.***.***.***,***.***.***.***,TCP,1514,9101  >  49231 [ACK] Seq=316770 Ack=8892 Win=65535 Len=1460 [TCP segment of a reassembled PDU]
572,573,183.725263,***.***.***.***,***.***.***.***,TLSv1.2,1514,Application Data [TCP segment of a reassembled PDU]
573,574,183.725264,***.***.***.***,***.***.***.***,TCP,1514,9101  >  49231 [ACK] Seq=319690 Ack=8892 Win=65535 Len=1460 [TCP segment of a reassembled PDU]
574,575,183.725264,***.***.***.***,***.***.***.***,TLSv1.2,1514,Application Data [TCP segment of a reassembled PDU]
575,576,183.725265,***.***.***.***,***.***.***.***,TCP,1514,9101  >  49231 [ACK] Seq=322610 Ack=8892 Win=65535 Len=1460 [TCP segment of a reassembled PDU]
576,577,183.725266,***.***.***.***,***.***.***.***,TCP,1514,9101  >  49231 [ACK] Seq=324070 Ack=8892 Win=65535 Len=1460 [TCP segment of a reassembled PDU]
577,578,183.725267,***.***.***.***,***.***.***.***,TLSv1.2,1514,Application Data [TCP segment of a reassembled PDU]
578,579,183.725267,***.***.***.***,***.***.***.***,TCP,1514,9101  >  49231 [ACK] Seq=326990 Ack=8892 Win=65535 Len=1460 [TCP segment of a reassembled PDU]
579,580,183.725268,***.***.***.***,***.***.***.***,TCP,1514,9101  >  49231 [ACK] Seq=328450 Ack=8892 Win=65535 Len=1460 [TCP segment of a reassembled PDU]
580,581,183.725269,***.***.***.***,***.***.***.***,TLSv1.2,1514,Application Data [TCP segment of a reassembled PDU]
581,582,183.72527,***.***.***.***,***.***.***.***,TCP,1514,9101  >  49231 [ACK] Seq=331370 Ack=8892 Win=65535 Len=1460 [TCP segment of a reassembled PDU]
582,583,183.725271,***.***.***.***,***.***.***.***,TLSv1.2,1514,Application Data [TCP segment of a reassembled PDU]
583,584,183.725271,***.***.***.***,***.***.***.***,TCP,1514,9101  >  49231 [ACK] Seq=334290 Ack=8892 Win=65535 Len=1460 [TCP segment of a reassembled PDU]
584,585,183.725272,***.***.***.***,***.***.***.***,TCP,1514,9101  >  49231 [ACK] Seq=335750 Ack=8892 Win=65535 Len=1460 [TCP segment of a reassembled PDU]
585,586,183.725273,***.***.***.***,***.***.***.***,TLSv1.2,1514,"Application Data, Application Data"
586,587,183.725329,***.***.***.***,***.***.***.***,TCP,1514,9101  >  49231 [ACK] Seq=338670 Ack=8892 Win=65535 Len=1460 [TCP segment of a reassembled PDU]
587,588,183.725333,***.***.***.***,***.***.***.***,TLSv1.2,1514,Application Data [TCP segment of a reassembled PDU]
588,589,183.725334,***.***.***.***,***.***.***.***,TCP,1514,9101  >  49231 [ACK] Seq=341590 Ack=8892 Win=65535 Len=1460 [TCP segment of a reassembled PDU]
589,590,183.725335,***.***.***.***,***.***.***.***,TCP,1514,9101  >  49231 [ACK] Seq=343050 Ack=8892 Win=65535 Len=1460 [TCP segment of a reassembled PDU]
590,591,183.725335,***.***.***.***,***.***.***.***,TLSv1.2,1514,Application Data [TCP segment of a reassembled PDU]
591,592,183.725336,***.***.***.***,***.***.***.***,TCP,1514,9101  >  49231 [ACK] Seq=345970 Ack=8892 Win=65535 Len=1460 [TCP segment of a reassembled PDU]
592,593,183.725337,***.***.***.***,***.***.***.***,TCP,1514,9101  >  49231 [ACK] Seq=347430 Ack=8892 Win=65535 Len=1460 [TCP segment of a reassembled PDU]
593,594,183.725338,***.***.***.***,***.***.***.***,TLSv1.2,1514,Application Data [TCP segment of a reassembled PDU]
594,595,183.725338,***.***.***.***,***.***.***.***,TCP,1514,9101  >  49231 [ACK] Seq=350350 Ack=8892 Win=65535 Len=1460 [TCP segment of a reassembled PDU]
595,596,183.725339,***.***.***.***,***.***.***.***,TCP,1514,9101  >  49231 [ACK] Seq=351810 Ack=8892 Win=65535 Len=1460 [TCP segment of a reassembled PDU]
596,597,183.72534,***.***.***.***,***.***.***.***,TLSv1.2,1514,Application Data [TCP segment of a reassembled PDU]
597,598,183.725341,***.***.***.***,***.***.***.***,TCP,1514,9101  >  49231 [ACK] Seq=354730 Ack=8892 Win=65535 Len=1460 [TCP segment of a reassembled PDU]
598,599,183.725341,***.***.***.***,***.***.***.***,TCP,1514,9101  >  49231 [ACK] Seq=356190 Ack=8892 Win=65535 Len=1460 [TCP segment of a reassembled PDU]
599,600,183.725342,***.***.***.***,***.***.***.***,TLSv1.2,1514,"Application Data, Application Data"
600,601,183.725343,***.***.***.***,***.***.***.***,TCP,1514,9101  >  49231 [ACK] Seq=359110 Ack=8892 Win=65535 Len=1460 [TCP segment of a reassembled PDU]
601,602,183.725344,***.***.***.***,***.***.***.***,TLSv1.2,1514,"[TCP Window Full] , Application Data [TCP segment of a reassembled PDU]"
602,603,183.725875,***.***.***.***,***.***.***.***,TCP,54,49231  >  9101 [ACK] Seq=8892 Ack=347430 Win=14600 Len=0
603,604,183.725957,***.***.***.***,***.***.***.***,TCP,54,[TCP ZeroWindow] 49231  >  9101 [ACK] Seq=8892 Ack=362030 Win=0 Len=0
604,605,183.741256,***.***.***.***,***.***.***.***,TLSv1.2,597,"[TCP ZeroWindow] , Application Data"
605,606,183.74139,***.***.***.***,***.***.***.***,TCP,54,9101  >  49231 [ACK] Seq=362030 Ack=9435 Win=65535 Len=0
606,607,183.833875,***.***.***.***,***.***.***.***,TLSv1.2,1111,"[TCP ZeroWindow] , Application Data"
607,608,183.834013,***.***.***.***,***.***.***.***,TCP,54,9101  >  49231 [ACK] Seq=362030 Ack=10492 Win=65535 Len=0
608,609,183.874326,***.***.***.***,***.***.***.***,TCP,54,[TCP Window Update] 49231  >  9101 [ACK] Seq=10492 Ack=362030 Win=3472 Len=0
609,610,183.874444,***.***.***.***,***.***.***.***,TCP,1514,9101  >  49231 [ACK] Seq=362030 Ack=10492 Win=65535 Len=1460 [TCP segment of a reassembled PDU]
610,611,183.874451,***.***.***.***,***.***.***.***,TCP,1514,9101  >  49231 [ACK] Seq=363490 Ack=10492 Win=65535 Len=1460 [TCP segment of a reassembled PDU]
611,612,183.874598,***.***.***.***,***.***.***.***,TCP,54,49231  >  9101 [ACK] Seq=10492 Ack=364950 Win=552 Len=0
612,613,183.877922,***.***.***.***,***.***.***.***,TCP,54,[TCP Window Update] 49231  >  9101 [ACK] Seq=10492 Ack=364950 Win=61320 Len=0
613,614,183.878065,***.***.***.***,***.***.***.***,TLSv1.2,1514,Application Data [TCP segment of a reassembled PDU]
614,615,183.878073,***.***.***.***,***.***.***.***,TLSv1.2,1514,Application Data [TCP segment of a reassembled PDU]
615,616,183.878074,***.***.***.***,***.***.***.***,TCP,1514,9101  >  49231 [ACK] Seq=367870 Ack=10492 Win=65535 Len=1460 [TCP segment of a reassembled PDU]
616,617,183.878075,***.***.***.***,***.***.***.***,TCP,1514,9101  >  49231 [ACK] Seq=369330 Ack=10492 Win=65535 Len=1460 [TCP segment of a reassembled PDU]
617,618,183.878076,***.***.***.***,***.***.***.***,TLSv1.2,1514,Application Data [TCP segment of a reassembled PDU]
618,619,183.878126,***.***.***.***,***.***.***.***,TCP,1514,9101  >  49231 [ACK] Seq=372250 Ack=10492 Win=65535 Len=1460 [TCP segment of a reassembled PDU]
619,620,183.878135,***.***.***.***,***.***.***.***,TCP,1514,9101  >  49231 [ACK] Seq=373710 Ack=10492 Win=65535 Len=1460 [TCP segment of a reassembled PDU]
620,621,183.878135,***.***.***.***,***.***.***.***,TLSv1.2,1514,Application Data [TCP segment of a reassembled PDU]
621,622,183.878136,***.***.***.***,***.***.***.***,TCP,1514,9101  >  49231 [ACK] Seq=376630 Ack=10492 Win=65535 Len=1460 [TCP segment of a reassembled PDU]
622,623,183.878137,***.***.***.***,***.***.***.***,TCP,1514,9101  >  49231 [ACK] Seq=378090 Ack=10492 Win=65535 Len=1460 [TCP segment of a reassembled PDU]
623,624,183.878138,***.***.***.***,***.***.***.***,TLSv1.2,1514,Application Data [TCP segment of a reassembled PDU]
624,625,183.878139,***.***.***.***,***.***.***.***,TCP,1514,9101  >  49231 [ACK] Seq=381010 Ack=10492 Win=65535 Len=1460 [TCP segment of a reassembled PDU]
625,626,183.878139,***.***.***.***,***.***.***.***,TLSv1.2,1514,Application Data [TCP segment of a reassembled PDU]
626,627,183.87814,***.***.***.***,***.***.***.***,TLSv1.2,1514,Application Data [TCP segment of a reassembled PDU]
627,628,183.878176,***.***.***.***,***.***.***.***,TCP,1514,9101  >  49231 [ACK] Seq=385390 Ack=10492 Win=65535 Len=1460 [TCP segment of a reassembled PDU]
628,629,183.87818,***.***.***.***,***.***.***.***,TLSv1.2,1514,Application Data [TCP segment of a reassembled PDU]
629,630,183.878181,***.***.***.***,***.***.***.***,TCP,1514,9101  >  49231 [ACK] Seq=388310 Ack=10492 Win=65535 Len=1460 [TCP segment of a reassembled PDU]
630,631,183.878182,***.***.***.***,***.***.***.***,TCP,1514,9101  >  49231 [ACK] Seq=389770 Ack=10492 Win=65535 Len=1460 [TCP segment of a reassembled PDU]
631,632,183.878182,***.***.***.***,***.***.***.***,TLSv1.2,1514,Application Data [TCP segment of a reassembled PDU]
632,633,183.878183,***.***.***.***,***.***.***.***,TLSv1.2,1514,Application Data [TCP segment of a reassembled PDU]
633,634,183.878184,***.***.***.***,***.***.***.***,TCP,1514,9101  >  49231 [ACK] Seq=394150 Ack=10492 Win=65535 Len=1460 [TCP segment of a reassembled PDU]
634,635,183.878185,***.***.***.***,***.***.***.***,TCP,1514,9101  >  49231 [ACK] Seq=395610 Ack=10492 Win=65535 Len=1460 [TCP segment of a reassembled PDU]
635,636,183.878185,***.***.***.***,***.***.***.***,TLSv1.2,1514,Application Data [TCP segment of a reassembled PDU]
636,637,183.878186,***.***.***.***,***.***.***.***,TCP,1514,9101  >  49231 [ACK] Seq=398530 Ack=10492 Win=65535 Len=1460 [TCP segment of a reassembled PDU]
637,638,183.878187,***.***.***.***,***.***.***.***,TLSv1.2,1514,Application Data [TCP segment of a reassembled PDU]
638,639,183.878188,***.***.***.***,***.***.***.***,TCP,1514,9101  >  49231 [ACK] Seq=401450 Ack=10492 Win=65535 Len=1460 [TCP segment of a reassembled PDU]
639,640,183.878225,***.***.***.***,***.***.***.***,TCP,1514,9101  >  49231 [ACK] Seq=402910 Ack=10492 Win=65535 Len=1460 [TCP segment of a reassembled PDU]
640,641,183.878229,***.***.***.***,***.***.***.***,TLSv1.2,1514,Application Data [TCP segment of a reassembled PDU]
641,642,183.87823,***.***.***.***,***.***.***.***,TCP,1514,9101  >  49231 [ACK] Seq=405830 Ack=10492 Win=65535 Len=1460 [TCP segment of a reassembled PDU]
642,643,183.878231,***.***.***.***,***.***.***.***,TCP,1514,9101  >  49231 [ACK] Seq=407290 Ack=10492 Win=65535 Len=1460 [TCP segment of a reassembled PDU]
643,644,183.878232,***.***.***.***,***.***.***.***,TLSv1.2,1514,Application Data [TCP segment of a reassembled PDU]
644,645,183.878233,***.***.***.***,***.***.***.***,TCP,1514,9101  >  49231 [ACK] Seq=410210 Ack=10492 Win=65535 Len=1460 [TCP segment of a reassembled PDU]
645,646,183.878234,***.***.***.***,***.***.***.***,TCP,1514,9101  >  49231 [ACK] Seq=411670 Ack=10492 Win=65535 Len=1460 [TCP segment of a reassembled PDU]
646,647,183.878235,***.***.***.***,***.***.***.***,TLSv1.2,1514,Application Data [TCP segment of a reassembled PDU]
647,648,183.878235,***.***.***.***,***.***.***.***,TCP,1514,9101  >  49231 [ACK] Seq=414590 Ack=10492 Win=65535 Len=1460 [TCP segment of a reassembled PDU]
648,649,183.878236,***.***.***.***,***.***.***.***,TLSv1.2,1514,Application Data [TCP segment of a reassembled PDU]
649,650,183.878237,***.***.***.***,***.***.***.***,TLSv1.2,1514,Application Data [TCP segment of a reassembled PDU]
650,651,183.878238,***.***.***.***,***.***.***.***,TLSv1.2,1514,Application Data [TCP segment of a reassembled PDU]
651,652,183.878239,***.***.***.***,***.***.***.***,TCP,1514,9101  >  49231 [ACK] Seq=420430 Ack=10492 Win=65535 Len=1460 [TCP segment of a reassembled PDU]
652,653,183.87824,***.***.***.***,***.***.***.***,TCP,1514,9101  >  49231 [ACK] Seq=421890 Ack=10492 Win=65535 Len=1460 [TCP segment of a reassembled PDU]
653,654,183.878351,***.***.***.***,***.***.***.***,TLSv1.2,1514,Application Data [TCP segment of a reassembled PDU]
654,655,183.878357,***.***.***.***,***.***.***.***,TCP,1514,[TCP Window Full] 9101  >  49231 [ACK] Seq=424810 Ack=10492 Win=65535 Len=1460 [TCP segment of a reassembled PDU]
655,656,183.878986,***.***.***.***,***.***.***.***,TCP,54,49231  >  9101 [ACK] Seq=10492 Ack=411670 Win=14600 Len=0
656,657,183.879096,***.***.***.***,***.***.***.***,TCP,54,[TCP ZeroWindow] 49231  >  9101 [ACK] Seq=10492 Ack=426270 Win=0 Len=0
657,658,183.881562,***.***.***.***,***.***.***.***,TLSv1.2,597,"[TCP ZeroWindow] , Application Data"
658,659,183.882013,***.***.***.***,***.***.***.***,TCP,54,9101  >  49231 [ACK] Seq=426270 Ack=11035 Win=65535 Len=0
659,660,183.91201,***.***.***.***,***.***.***.***,TLSv1.2,1111,"[TCP ZeroWindow] , Application Data"
660,661,183.912156,***.***.***.***,***.***.***.***,TCP,54,9101  >  49231 [ACK] Seq=426270 Ack=12092 Win=65535 Len=0
661,662,183.967144,***.***.***.***,***.***.***.***,TLSv1.2,597,"[TCP ZeroWindow] , Application Data"
662,663,183.967296,***.***.***.***,***.***.***.***,TCP,54,9101  >  49231 [ACK] Seq=426270 Ack=12635 Win=65535 Len=0
663,664,183.97979,***.***.***.***,***.***.***.***,TCP,54,[TCP Window Update] 49231  >  9101 [ACK] Seq=12635 Ack=426270 Win=64240 Len=0
664,665,183.979941,***.***.***.***,***.***.***.***,TLSv1.2,1514,"Application Data, Application Data"
665,666,183.979952,***.***.***.***,***.***.***.***,TCP,1514,9101  >  49231 [ACK] Seq=427730 Ack=12635 Win=65535 Len=1460 [TCP segment of a reassembled PDU]
666,667,183.979953,***.***.***.***,***.***.***.***,TCP,1514,9101  >  49231 [ACK] Seq=429190 Ack=12635 Win=65535 Len=1460 [TCP segment of a reassembled PDU]
667,668,183.979955,***.***.***.***,***.***.***.***,TLSv1.2,1514,Application Data [TCP segment of a reassembled PDU]
668,669,183.98,***.***.***.***,***.***.***.***,TCP,1514,9101  >  49231 [ACK] Seq=432110 Ack=12635 Win=65535 Len=1460 [TCP segment of a reassembled PDU]
669,670,183.980004,***.***.***.***,***.***.***.***,TCP,1514,9101  >  49231 [ACK] Seq=433570 Ack=12635 Win=65535 Len=1460 [TCP segment of a reassembled PDU]
670,671,183.980005,***.***.***.***,***.***.***.***,TLSv1.2,1514,Application Data [TCP segment of a reassembled PDU]
671,672,183.980006,***.***.***.***,***.***.***.***,TCP,1514,9101  >  49231 [ACK] Seq=436490 Ack=12635 Win=65535 Len=1460 [TCP segment of a reassembled PDU]
672,673,183.980006,***.***.***.***,***.***.***.***,TCP,1514,9101  >  49231 [ACK] Seq=437950 Ack=12635 Win=65535 Len=1460 [TCP segment of a reassembled PDU]
673,674,183.980007,***.***.***.***,***.***.***.***,TLSv1.2,1514,Application Data [TCP segment of a reassembled PDU]
674,675,183.980008,***.***.***.***,***.***.***.***,TCP,1514,9101  >  49231 [ACK] Seq=440870 Ack=12635 Win=65535 Len=1460 [TCP segment of a reassembled PDU]
675,676,183.980009,***.***.***.***,***.***.***.***,TCP,1514,9101  >  49231 [ACK] Seq=442330 Ack=12635 Win=65535 Len=1460 [TCP segment of a reassembled PDU]
676,677,183.98001,***.***.***.***,***.***.***.***,TLSv1.2,1514,"Application Data, Application Data"
677,678,183.980011,***.***.***.***,***.***.***.***,TLSv1.2,1514,Application Data [TCP segment of a reassembled PDU]
678,679,183.980011,***.***.***.***,***.***.***.***,TCP,1514,9101  >  49231 [ACK] Seq=446710 Ack=12635 Win=65535 Len=1460 [TCP segment of a reassembled PDU]
679,680,183.980012,***.***.***.***,***.***.***.***,TLSv1.2,1514,Application Data [TCP segment of a reassembled PDU]
680,681,183.980013,***.***.***.***,***.***.***.***,TCP,1514,9101  >  49231 [ACK] Seq=449630 Ack=12635 Win=65535 Len=1460 [TCP segment of a reassembled PDU]
681,682,183.980049,***.***.***.***,***.***.***.***,TCP,1514,9101  >  49231 [ACK] Seq=451090 Ack=12635 Win=65535 Len=1460 [TCP segment of a reassembled PDU]
682,683,183.980054,***.***.***.***,***.***.***.***,TLSv1.2,1514,Application Data [TCP segment of a reassembled PDU]
683,684,183.980058,***.***.***.***,***.***.***.***,TLSv1.2,1514,Application Data [TCP segment of a reassembled PDU]
684,685,183.980059,***.***.***.***,***.***.***.***,TCP,1514,9101  >  49231 [ACK] Seq=455470 Ack=12635 Win=65535 Len=1460 [TCP segment of a reassembled PDU]
685,686,183.98006,***.***.***.***,***.***.***.***,TLSv1.2,1514,Application Data [TCP segment of a reassembled PDU]
686,687,183.98006,***.***.***.***,***.***.***.***,TCP,1514,9101  >  49231 [ACK] Seq=458390 Ack=12635 Win=65535 Len=1460 [TCP segment of a reassembled PDU]
687,688,183.980061,***.***.***.***,***.***.***.***,TCP,1514,9101  >  49231 [ACK] Seq=459850 Ack=12635 Win=65535 Len=1460 [TCP segment of a reassembled PDU]
688,689,183.980062,***.***.***.***,***.***.***.***,TLSv1.2,1514,Application Data [TCP segment of a reassembled PDU]
689,690,183.980063,***.***.***.***,***.***.***.***,TCP,1514,9101  >  49231 [ACK] Seq=462770 Ack=12635 Win=65535 Len=1460 [TCP segment of a reassembled PDU]
690,691,183.980064,***.***.***.***,***.***.***.***,TCP,1514,9101  >  49231 [ACK] Seq=464230 Ack=12635 Win=65535 Len=1460 [TCP segment of a reassembled PDU]
691,692,183.980065,***.***.***.***,***.***.***.***,TLSv1.2,1514,Application Data [TCP segment of a reassembled PDU]
692,693,183.980097,***.***.***.***,***.***.***.***,TCP,1514,9101  >  49231 [ACK] Seq=467150 Ack=12635 Win=65535 Len=1460 [TCP segment of a reassembled PDU]
693,694,183.9801,***.***.***.***,***.***.***.***,TCP,1514,9101  >  49231 [ACK] Seq=468610 Ack=12635 Win=65535 Len=1460 [TCP segment of a reassembled PDU]
694,695,183.980101,***.***.***.***,***.***.***.***,TLSv1.2,1514,"Application Data, Application Data, Application Data"
695,696,183.980102,***.***.***.***,***.***.***.***,TCP,1514,9101  >  49231 [ACK] Seq=471530 Ack=12635 Win=65535 Len=1460 [TCP segment of a reassembled PDU]
696,697,183.980103,***.***.***.***,***.***.***.***,TCP,1514,9101  >  49231 [ACK] Seq=472990 Ack=12635 Win=65535 Len=1460 [TCP segment of a reassembled PDU]
697,698,183.980103,***.***.***.***,***.***.***.***,TLSv1.2,1514,Application Data [TCP segment of a reassembled PDU]
698,699,183.980104,***.***.***.***,***.***.***.***,TCP,1514,9101  >  49231 [ACK] Seq=475910 Ack=12635 Win=65535 Len=1460 [TCP segment of a reassembled PDU]
699,700,183.980105,***.***.***.***,***.***.***.***,TCP,1514,9101  >  49231 [ACK] Seq=477370 Ack=12635 Win=65535 Len=1460 [TCP segment of a reassembled PDU]
700,701,183.980106,***.***.***.***,***.***.***.***,TLSv1.2,1514,Application Data [TCP segment of a reassembled PDU]
701,702,183.980106,***.***.***.***,***.***.***.***,TCP,1514,9101  >  49231 [ACK] Seq=480290 Ack=12635 Win=65535 Len=1460 [TCP segment of a reassembled PDU]
702,703,183.980107,***.***.***.***,***.***.***.***,TCP,1514,9101  >  49231 [ACK] Seq=481750 Ack=12635 Win=65535 Len=1460 [TCP segment of a reassembled PDU]
703,704,183.980108,***.***.***.***,***.***.***.***,TLSv1.2,1514,Application Data [TCP segment of a reassembled PDU]
704,705,183.980109,***.***.***.***,***.***.***.***,TCP,1514,9101  >  49231 [ACK] Seq=484670 Ack=12635 Win=65535 Len=1460 [TCP segment of a reassembled PDU]
705,706,183.98011,***.***.***.***,***.***.***.***,TLSv1.2,1514,Application Data [TCP segment of a reassembled PDU]
706,707,183.980532,***.***.***.***,***.***.***.***,TLSv1.2,1514,Application Data [TCP segment of a reassembled PDU]
707,708,183.980537,***.***.***.***,***.***.***.***,TCP,1514,[TCP Window Full] 9101  >  49231 [ACK] Seq=489050 Ack=12635 Win=65535 Len=1460 [TCP segment of a reassembled PDU]
708,709,183.980692,***.***.***.***,***.***.***.***,TCP,54,49231  >  9101 [ACK] Seq=12635 Ack=465690 Win=24820 Len=0
709,710,183.981165,***.***.***.***,***.***.***.***,TCP,54,[TCP ZeroWindow] 49231  >  9101 [ACK] Seq=12635 Ack=490510 Win=0 Len=0
710,711,184.172036,***.***.***.***,***.***.***.***,TLSv1.2,1111,"[TCP ZeroWindow] , Application Data"
711,712,184.1723,***.***.***.***,***.***.***.***,TCP,54,9101  >  49231 [ACK] Seq=490510 Ack=13692 Win=65535 Len=0
712,713,184.34406,***.***.***.***,***.***.***.***,TLSv1.2,597,"[TCP ZeroWindow] , Application Data"
713,714,184.344229,***.***.***.***,***.***.***.***,TCP,54,9101  >  49231 [ACK] Seq=490510 Ack=14235 Win=65535 Len=0
714,715,184.383548,***.***.***.***,***.***.***.***,TCP,54,[TCP Window Update] 49231  >  9101 [ACK] Seq=14235 Ack=490510 Win=3472 Len=0
715,716,184.383671,***.***.***.***,***.***.***.***,TLSv1.2,1514,Application Data [TCP segment of a reassembled PDU]
716,717,184.383676,***.***.***.***,***.***.***.***,TCP,1514,9101  >  49231 [ACK] Seq=491970 Ack=14235 Win=65535 Len=1460 [TCP segment of a reassembled PDU]
717,718,184.383893,***.***.***.***,***.***.***.***,TCP,54,49231  >  9101 [ACK] Seq=14235 Ack=493430 Win=552 Len=0
718,719,184.392111,***.***.***.***,***.***.***.***,TCP,54,[TCP Window Update] 49231  >  9101 [ACK] Seq=14235 Ack=493430 Win=61320 Len=0
719,720,184.392234,***.***.***.***,***.***.***.***,TCP,1514,9101  >  49231 [ACK] Seq=493430 Ack=14235 Win=65535 Len=1460 [TCP segment of a reassembled PDU]
720,721,184.392243,***.***.***.***,***.***.***.***,TLSv1.2,1514,Application Data [TCP segment of a reassembled PDU]
721,722,184.392243,***.***.***.***,***.***.***.***,TLSv1.2,1514,Application Data [TCP segment of a reassembled PDU]
722,723,184.392244,***.***.***.***,***.***.***.***,TCP,1514,9101  >  49231 [ACK] Seq=497810 Ack=14235 Win=65535 Len=1460 [TCP segment of a reassembled PDU]
723,724,184.392245,***.***.***.***,***.***.***.***,TCP,1514,9101  >  49231 [ACK] Seq=499270 Ack=14235 Win=65535 Len=1460 [TCP segment of a reassembled PDU]
724,725,184.392246,***.***.***.***,***.***.***.***,TLSv1.2,1514,Application Data [TCP segment of a reassembled PDU]
725,726,184.392291,***.***.***.***,***.***.***.***,TCP,1514,9101  >  49231 [ACK] Seq=502190 Ack=14235 Win=65535 Len=1460 [TCP segment of a reassembled PDU]
726,727,184.392295,***.***.***.***,***.***.***.***,TCP,1514,9101  >  49231 [ACK] Seq=503650 Ack=14235 Win=65535 Len=1460 [TCP segment of a reassembled PDU]
727,728,184.392295,***.***.***.***,***.***.***.***,TLSv1.2,1514,Application Data [TCP segment of a reassembled PDU]
728,729,184.392296,***.***.***.***,***.***.***.***,TCP,1514,9101  >  49231 [ACK] Seq=506570 Ack=14235 Win=65535 Len=1460 [TCP segment of a reassembled PDU]
729,730,184.392297,***.***.***.***,***.***.***.***,TLSv1.2,1514,Application Data [TCP segment of a reassembled PDU]
730,731,184.392298,***.***.***.***,***.***.***.***,TCP,1514,9101  >  49231 [ACK] Seq=509490 Ack=14235 Win=65535 Len=1460 [TCP segment of a reassembled PDU]
731,732,184.392299,***.***.***.***,***.***.***.***,TCP,1514,9101  >  49231 [ACK] Seq=510950 Ack=14235 Win=65535 Len=1460 [TCP segment of a reassembled PDU]
732,733,184.392299,***.***.***.***,***.***.***.***,TLSv1.2,1514,"Application Data, Application Data"
733,734,184.392301,***.***.***.***,***.***.***.***,TCP,1514,9101  >  49231 [ACK] Seq=513870 Ack=14235 Win=65535 Len=1460 [TCP segment of a reassembled PDU]
734,735,184.392301,***.***.***.***,***.***.***.***,TCP,1514,9101  >  49231 [ACK] Seq=515330 Ack=14235 Win=65535 Len=1460 [TCP segment of a reassembled PDU]
735,736,184.392302,***.***.***.***,***.***.***.***,TLSv1.2,1514,Application Data [TCP segment of a reassembled PDU]
736,737,184.392303,***.***.***.***,***.***.***.***,TCP,1514,9101  >  49231 [ACK] Seq=518250 Ack=14235 Win=65535 Len=1460 [TCP segment of a reassembled PDU]
737,738,184.392304,***.***.***.***,***.***.***.***,TCP,1514,9101  >  49231 [ACK] Seq=519710 Ack=14235 Win=65535 Len=1460 [TCP segment of a reassembled PDU]
738,739,184.392306,***.***.***.***,***.***.***.***,TLSv1.2,1514,Application Data [TCP segment of a reassembled PDU]
739,740,184.392378,***.***.***.***,***.***.***.***,TLSv1.2,1514,Application Data [TCP segment of a reassembled PDU]
740,741,184.392386,***.***.***.***,***.***.***.***,TCP,1514,9101  >  49231 [ACK] Seq=524090 Ack=14235 Win=65535 Len=1460 [TCP segment of a reassembled PDU]
741,742,184.392387,***.***.***.***,***.***.***.***,TCP,1514,9101  >  49231 [ACK] Seq=525550 Ack=14235 Win=65535 Len=1460 [TCP segment of a reassembled PDU]
742,743,184.392388,***.***.***.***,***.***.***.***,TLSv1.2,1514,Application Data [TCP segment of a reassembled PDU]
743,744,184.392389,***.***.***.***,***.***.***.***,TCP,1514,9101  >  49231 [ACK] Seq=528470 Ack=14235 Win=65535 Len=1460 [TCP segment of a reassembled PDU]
744,745,184.392389,***.***.***.***,***.***.***.***,TLSv1.2,1514,Application Data [TCP segment of a reassembled PDU]
745,746,184.39239,***.***.***.***,***.***.***.***,TCP,1514,9101  >  49231 [ACK] Seq=531390 Ack=14235 Win=65535 Len=1460 [TCP segment of a reassembled PDU]
746,747,184.392391,***.***.***.***,***.***.***.***,TCP,1514,9101  >  49231 [ACK] Seq=532850 Ack=14235 Win=65535 Len=1460 [TCP segment of a reassembled PDU]
747,748,184.392391,***.***.***.***,***.***.***.***,TLSv1.2,1514,Application Data [TCP segment of a reassembled PDU]
748,749,184.392392,***.***.***.***,***.***.***.***,TCP,1514,9101  >  49231 [ACK] Seq=535770 Ack=14235 Win=65535 Len=1460 [TCP segment of a reassembled PDU]
749,750,184.392393,***.***.***.***,***.***.***.***,TCP,1514,9101  >  49231 [ACK] Seq=537230 Ack=14235 Win=65535 Len=1460 [TCP segment of a reassembled PDU]
750,751,184.392393,***.***.***.***,***.***.***.***,TLSv1.2,1514,"Application Data, Application Data"
751,752,184.392395,***.***.***.***,***.***.***.***,TCP,1514,9101  >  49231 [ACK] Seq=540150 Ack=14235 Win=65535 Len=1460 [TCP segment of a reassembled PDU]
752,753,184.392395,***.***.***.***,***.***.***.***,TCP,1514,9101  >  49231 [ACK] Seq=541610 Ack=14235 Win=65535 Len=1460 [TCP segment of a reassembled PDU]
753,754,184.392396,***.***.***.***,***.***.***.***,TLSv1.2,1514,Application Data [TCP segment of a reassembled PDU]
754,755,184.392397,***.***.***.***,***.***.***.***,TCP,1514,9101  >  49231 [ACK] Seq=544530 Ack=14235 Win=65535 Len=1460 [TCP segment of a reassembled PDU]
755,756,184.392397,***.***.***.***,***.***.***.***,TCP,1514,9101  >  49231 [ACK] Seq=545990 Ack=14235 Win=65535 Len=1460 [TCP segment of a reassembled PDU]
756,757,184.392398,***.***.***.***,***.***.***.***,TLSv1.2,1514,Application Data [TCP segment of a reassembled PDU]
757,758,184.392399,***.***.***.***,***.***.***.***,TLSv1.2,1514,Application Data [TCP segment of a reassembled PDU]
758,759,184.3924,***.***.***.***,***.***.***.***,TCP,1514,9101  >  49231 [ACK] Seq=550370 Ack=14235 Win=65535 Len=1460 [TCP segment of a reassembled PDU]
759,760,184.392401,***.***.***.***,***.***.***.***,TLSv1.2,1514,Application Data [TCP segment of a reassembled PDU]
760,761,184.392402,***.***.***.***,***.***.***.***,TCP,1514,[TCP Window Full] 9101  >  49231 [ACK] Seq=553290 Ack=14235 Win=65535 Len=1460 [TCP segment of a reassembled PDU]
761,762,184.392799,***.***.***.***,***.***.***.***,TCP,54,49231  >  9101 [ACK] Seq=14235 Ack=540150 Win=14600 Len=0
762,763,184.392892,***.***.***.***,***.***.***.***,TCP,54,[TCP ZeroWindow] 49231  >  9101 [ACK] Seq=14235 Ack=554750 Win=0 Len=0
763,764,184.396912,***.***.***.***,***.***.***.***,TLSv1.2,1111,"[TCP ZeroWindow] , Application Data"
764,765,184.397009,***.***.***.***,***.***.***.***,TCP,54,9101  >  49231 [ACK] Seq=554750 Ack=15292 Win=65535 Len=0
765,766,184.425534,***.***.***.***,***.***.***.***,TLSv1.2,597,"[TCP ZeroWindow] , Application Data"
766,767,184.425666,***.***.***.***,***.***.***.***,TCP,54,9101  >  49231 [ACK] Seq=554750 Ack=15835 Win=65535 Len=0
767,768,184.553363,***.***.***.***,***.***.***.***,TLSv1.2,1111,"[TCP ZeroWindow] , Application Data"
768,769,184.553479,***.***.***.***,***.***.***.***,TCP,54,9101  >  49231 [ACK] Seq=554750 Ack=16892 Win=65535 Len=0
769,770,184.562278,***.***.***.***,***.***.***.***,TCP,54,[TCP Window Update] 49231  >  9101 [ACK] Seq=16892 Ack=554750 Win=3472 Len=0
770,771,184.562416,***.***.***.***,***.***.***.***,TCP,1514,9101  >  49231 [ACK] Seq=554750 Ack=16892 Win=65535 Len=1460 [TCP segment of a reassembled PDU]
771,772,184.562418,***.***.***.***,***.***.***.***,TLSv1.2,1514,Application Data [TCP segment of a reassembled PDU]
772,773,184.562631,***.***.***.***,***.***.***.***,TCP,54,49231  >  9101 [ACK] Seq=16892 Ack=557670 Win=552 Len=0
773,774,184.56843,***.***.***.***,***.***.***.***,TCP,54,[TCP Window Update] 49231  >  9101 [ACK] Seq=16892 Ack=557670 Win=61320 Len=0
774,775,184.568498,***.***.***.***,***.***.***.***,TCP,1514,9101  >  49231 [ACK] Seq=557670 Ack=16892 Win=65535 Len=1460 [TCP segment of a reassembled PDU]
775,776,184.568574,***.***.***.***,***.***.***.***,TCP,1514,9101  >  49231 [ACK] Seq=559130 Ack=16892 Win=65535 Len=1460 [TCP segment of a reassembled PDU]
776,777,184.568582,***.***.***.***,***.***.***.***,TLSv1.2,1514,Application Data [TCP segment of a reassembled PDU]
777,778,184.568583,***.***.***.***,***.***.***.***,TCP,1514,9101  >  49231 [ACK] Seq=562050 Ack=16892 Win=65535 Len=1460 [TCP segment of a reassembled PDU]
778,779,184.568583,***.***.***.***,***.***.***.***,TCP,1514,9101  >  49231 [ACK] Seq=563510 Ack=16892 Win=65535 Len=1460 [TCP segment of a reassembled PDU]
779,780,184.568584,***.***.***.***,***.***.***.***,TLSv1.2,1514,"Application Data, Application Data"
780,781,184.568585,***.***.***.***,***.***.***.***,TCP,1514,9101  >  49231 [ACK] Seq=566430 Ack=16892 Win=65535 Len=1460 [TCP segment of a reassembled PDU]
781,782,184.568586,***.***.***.***,***.***.***.***,TCP,1514,9101  >  49231 [ACK] Seq=567890 Ack=16892 Win=65535 Len=1460 [TCP segment of a reassembled PDU]
782,783,184.568587,***.***.***.***,***.***.***.***,TLSv1.2,1514,Application Data [TCP segment of a reassembled PDU]
783,784,184.568663,***.***.***.***,***.***.***.***,TCP,1514,9101  >  49231 [ACK] Seq=570810 Ack=16892 Win=65535 Len=1460 [TCP segment of a reassembled PDU]
784,785,184.568667,***.***.***.***,***.***.***.***,TLSv1.2,1514,Application Data [TCP segment of a reassembled PDU]
785,786,184.568668,***.***.***.***,***.***.***.***,TLSv1.2,1514,Application Data [TCP segment of a reassembled PDU]
786,787,184.568669,***.***.***.***,***.***.***.***,TCP,1514,9101  >  49231 [ACK] Seq=575190 Ack=16892 Win=65535 Len=1460 [TCP segment of a reassembled PDU]
787,788,184.568669,***.***.***.***,***.***.***.***,TCP,1514,9101  >  49231 [ACK] Seq=576650 Ack=16892 Win=65535 Len=1460 [TCP segment of a reassembled PDU]
788,789,184.56867,***.***.***.***,***.***.***.***,TLSv1.2,1514,Application Data [TCP segment of a reassembled PDU]
789,790,184.568671,***.***.***.***,***.***.***.***,TCP,1514,9101  >  49231 [ACK] Seq=579570 Ack=16892 Win=65535 Len=1460 [TCP segment of a reassembled PDU]
790,791,184.568672,***.***.***.***,***.***.***.***,TCP,1514,9101  >  49231 [ACK] Seq=581030 Ack=16892 Win=65535 Len=1460 [TCP segment of a reassembled PDU]
791,792,184.568673,***.***.***.***,***.***.***.***,TLSv1.2,1514,Application Data [TCP segment of a reassembled PDU]
792,793,184.568673,***.***.***.***,***.***.***.***,TCP,1514,9101  >  49231 [ACK] Seq=583950 Ack=16892 Win=65535 Len=1460 [TCP segment of a reassembled PDU]
793,794,184.568674,***.***.***.***,***.***.***.***,TCP,1514,9101  >  49231 [ACK] Seq=585410 Ack=16892 Win=65535 Len=1460 [TCP segment of a reassembled PDU]
794,795,184.568675,***.***.***.***,***.***.***.***,TLSv1.2,1514,Application Data [TCP segment of a reassembled PDU]
795,796,184.568676,***.***.***.***,***.***.***.***,TCP,1514,9101  >  49231 [ACK] Seq=588330 Ack=16892 Win=65535 Len=1460 [TCP segment of a reassembled PDU]
796,797,184.568676,***.***.***.***,***.***.***.***,TCP,1514,9101  >  49231 [ACK] Seq=589790 Ack=16892 Win=65535 Len=1460 [TCP segment of a reassembled PDU]
797,798,184.568677,***.***.***.***,***.***.***.***,TLSv1.2,1514,"Application Data, Application Data"
798,799,184.568678,***.***.***.***,***.***.***.***,TCP,1514,9101  >  49231 [ACK] Seq=592710 Ack=16892 Win=65535 Len=1460 [TCP segment of a reassembled PDU]
799,800,184.568678,***.***.***.***,***.***.***.***,TLSv1.2,1514,Application Data [TCP segment of a reassembled PDU]
800,801,184.568679,***.***.***.***,***.***.***.***,TCP,1514,9101  >  49231 [ACK] Seq=595630 Ack=16892 Win=65535 Len=1460 [TCP segment of a reassembled PDU]
801,802,184.56868,***.***.***.***,***.***.***.***,TCP,1514,9101  >  49231 [ACK] Seq=597090 Ack=16892 Win=65535 Len=1460 [TCP segment of a reassembled PDU]
802,803,184.568681,***.***.***.***,***.***.***.***,TLSv1.2,1514,Application Data [TCP segment of a reassembled PDU]
803,804,184.568681,***.***.***.***,***.***.***.***,TLSv1.2,1514,Application Data [TCP segment of a reassembled PDU]
804,805,184.568682,***.***.***.***,***.***.***.***,TCP,1514,9101  >  49231 [ACK] Seq=601470 Ack=16892 Win=65535 Len=1460 [TCP segment of a reassembled PDU]
805,806,184.568683,***.***.***.***,***.***.***.***,TLSv1.2,1514,Application Data [TCP segment of a reassembled PDU]
806,807,184.568683,***.***.***.***,***.***.***.***,TCP,1514,9101  >  49231 [ACK] Seq=604390 Ack=16892 Win=65535 Len=1460 [TCP segment of a reassembled PDU]
807,808,184.568755,***.***.***.***,***.***.***.***,TCP,1514,9101  >  49231 [ACK] Seq=605850 Ack=16892 Win=65535 Len=1460 [TCP segment of a reassembled PDU]
808,809,184.56876,***.***.***.***,***.***.***.***,TLSv1.2,1514,Application Data [TCP segment of a reassembled PDU]
809,810,184.568761,***.***.***.***,***.***.***.***,TCP,1514,9101  >  49231 [ACK] Seq=608770 Ack=16892 Win=65535 Len=1460 [TCP segment of a reassembled PDU]
810,811,184.568761,***.***.***.***,***.***.***.***,TCP,1514,9101  >  49231 [ACK] Seq=610230 Ack=16892 Win=65535 Len=1460 [TCP segment of a reassembled PDU]
811,812,184.568762,***.***.***.***,***.***.***.***,TLSv1.2,1514,Application Data [TCP segment of a reassembled PDU]
812,813,184.568763,***.***.***.***,***.***.***.***,TLSv1.2,1265,Application Data
813,814,184.569079,***.***.***.***,***.***.***.***,TCP,54,49231  >  9101 [ACK] Seq=16892 Ack=604390 Win=14600 Len=0
814,815,184.569174,***.***.***.***,***.***.***.***,TCP,54,49231  >  9101 [ACK] Seq=16892 Ack=614361 Win=4629 Len=0
815,816,184.604776,***.***.***.***,***.***.***.***,TLSv1.2,597,Application Data
816,817,184.604914,***.***.***.***,***.***.***.***,TCP,54,9101  >  49231 [ACK] Seq=614361 Ack=17435 Win=65535 Len=0
817,818,184.650057,***.***.***.***,***.***.***.***,TLSv1.2,1111,Application Data
818,819,184.65019,***.***.***.***,***.***.***.***,TCP,54,9101  >  49231 [ACK] Seq=614361 Ack=18492 Win=65535 Len=0
819,820,184.687461,***.***.***.***,***.***.***.***,TCP,54,[TCP Window Update] 49231  >  9101 [ACK] Seq=18492 Ack=614361 Win=8101 Len=0
820,821,184.697244,***.***.***.***,***.***.***.***,TCP,54,[TCP Window Update] 49231  >  9101 [ACK] Seq=18492 Ack=614361 Win=64240 Len=0
821,822,184.701529,***.***.***.***,***.***.***.***,TLSv1.2,597,Application Data
822,823,184.701662,***.***.***.***,***.***.***.***,TCP,54,9101  >  49231 [ACK] Seq=614361 Ack=19035 Win=65535 Len=0
823,824,184.752094,***.***.***.***,***.***.***.***,TLSv1.2,1111,Application Data
824,825,184.752251,***.***.***.***,***.***.***.***,TCP,54,9101  >  49231 [ACK] Seq=614361 Ack=20092 Win=65535 Len=0
825,826,184.78765,***.***.***.***,***.***.***.***,TLSv1.2,597,Application Data
826,827,184.78786,***.***.***.***,***.***.***.***,TCP,54,9101  >  49231 [ACK] Seq=614361 Ack=20635 Win=65535 Len=0
827,828,185.62016,***.***.***.***,***.***.***.***,TCP,66,[TCP Retransmission] [TCP Port numbers reused] 49230  >  9001 [SYN] Seq=0 Win=8192 Len=0 MSS=1460 WS=256 SACK_PERM=1
828,829,191.62035,***.***.***.***,***.***.***.***,TCP,62,[TCP Retransmission] [TCP Port numbers reused] 49230  >  9001 [SYN] Seq=0 Win=8192 Len=0 MSS=1460 SACK_PERM=1
