,ARP Who has ***.***.***.***? Tell ***.***.***.***,ARP Who has ***.***.***.***? (ARP Probe),ARP ***.***.***.*** is at 0a:00:27:00:00:00,LLMNR Standard query 0x4163 A isatap,IGMPv3 Membership Report / Leave group ***.***.***.***,IGMPv3 Membership Report / Join group ***.***.***.*** for any sources,LLMNR Standard query 0x21c1 ANY None,NBNS Registration NB NONE<20>,NBNS Registration NB NONE<00>,NBNS Registration NB WORKGROUP<00>,NBNS Name query NB ISATAP<00>,SSDP M-SEARCH * HTTP/1.1 ,IGMPv3 Membership Report / Join group ***.***.***.*** for any sources / Join group ***.***.***.*** for any sources,UDP 65391  >  3702 Len=624,LLMNR Standard query 0xc4c8 A wpad,NBNS Name query NB WPAD<00>,LLMNR Standard query 0x971a A isatap,DNS Standard query 0xab76 A teredo.ipv6.microsoft.com,DNS Standard query response 0xab76 No such name A teredo.ipv6.microsoft.com SOA ns1-04.azure-dns.com,NBNS Registration NB WORKGROUP<1e>,DNS Standard query 0x025f A www.msftncsi.com,DNS Standard query response 0x025f A www.msftncsi.com CNAME www.msftncsi.com.edgesuite.net CNAME a1961.g2.akamai.net A ***.***.***.*** A ***.***.***.***,TCP 49159  >  80 [SYN] Seq=0 Win=8192 Len=0 MSS=1460 WS=256 SACK_PERM=1,"TCP 80  >  49159 [SYN, ACK] Seq=0 Ack=1 Win=65535 Len=0 MSS=1460",TCP 49159  >  80 [ACK] Seq=1 Ack=1 Win=64240 Len=0,HTTP GET /ncsi.txt HTTP/1.1 ,TCP 80  >  49159 [ACK] Seq=1 Ack=98 Win=65535 Len=0,HTTP HTTP/1.1 200 OK  (text/plain),"TCP 49159  >  80 [FIN, ACK] Seq=98 Ack=180 Win=64061 Len=0",TCP 80  >  49159 [ACK] Seq=180 Ack=99 Win=65535 Len=0,"TCP 80  >  49159 [FIN, ACK] Seq=180 Ack=99 Win=65535 Len=0",TCP 49159  >  80 [ACK] Seq=99 Ack=181 Win=64061 Len=0,LLMNR Standard query 0xc9cb A isatap,BROWSER Request Announcement NONE,"BROWSER Host Announcement NONE, Workstation, Server, NT Workstation, Potential Browser",LLMNR Standard query 0x96f1 A isatap,LLMNR Standard query 0x6e6e A isatap,BROWSER Browser Election Request,NBNS Registration NB WORKGROUP<1d>,NBNS Registration NB <01><02>__MSBROWSE__<02><01>,"BROWSER Domain/Workgroup Announcement WORKGROUP, NT Workstation, Domain Enum","BROWSER Local Master Announcement NONE, Workstation, Server, NT Workstation, Potential Browser, Master Browser",LLMNR Standard query 0x6cfb A wpad,DNS Standard query 0x09c0 A clients2.google.com,DNS Standard query response 0x09c0 A clients2.google.com CNAME clients.l.google.com A ***.***.***.*** A ***.***.***.*** A ***.***.***.*** A ***.***.***.*** A ***.***.***.*** A ***.***.***.***,TCP 49165  >  443 [SYN] Seq=0 Win=8192 Len=0 MSS=1460 WS=256 SACK_PERM=1,"TCP 443  >  49165 [SYN, ACK] Seq=0 Ack=1 Win=65535 Len=0 MSS=1460",TCP 49165  >  443 [ACK] Seq=1 Ack=1 Win=64240 Len=0,TLSv1.2 Client Hello,TCP 443  >  49165 [ACK] Seq=1 Ack=162 Win=65535 Len=0,TLSv1.2 Server Hello,"TCP 443  >  49165 [PSH, ACK] Seq=1413 Ack=162 Win=65535 Len=1412 [TCP segment of a reassembled PDU]",TCP 49165  >  443 [ACK] Seq=162 Ack=2825 Win=64240 Len=0,TCP 443  >  49165 [ACK] Seq=2825 Ack=162 Win=65535 Len=1460 [TCP segment of a reassembled PDU],TCP 443  >  49165 [ACK] Seq=4285 Ack=162 Win=65535 Len=1460 [TCP segment of a reassembled PDU],"TLSv1.2 Certificate, Server Key Exchange, Server Hello Done",TCP 49165  >  443 [ACK] Seq=162 Ack=6661 Win=64240 Len=0,"TLSv1.2 Client Key Exchange, Change Cipher Spec, Encrypted Handshake Message",TCP 443  >  49165 [ACK] Seq=6661 Ack=288 Win=65535 Len=0,"TLSv1.2 Change Cipher Spec, Encrypted Handshake Message",TCP 49165  >  443 [ACK] Seq=288 Ack=6712 Win=64189 Len=0,TLSv1.2 Application Data,TCP 443  >  49165 [ACK] Seq=6712 Ack=811 Win=65535 Len=0,"TCP 49165  >  443 [RST, ACK] Seq=811 Ack=6991 Win=0 Len=0",DNS Standard query 0xea6d A time.windows.com,DNS Standard query response 0xea6d A time.windows.com CNAME twc.trafficmanager.net A ***.***.***.***,"NTP NTP Version 3, client","NTP NTP Version 3, server",LLMNR Standard query 0x69e6 A wpad,DNS Standard query 0xe6e6 A watson.microsoft.com,DNS Standard query response 0xe6e6 A watson.microsoft.com CNAME legacywatson.trafficmanager.net CNAME onedsblobprdcus07.centralus.cloudapp.azure.com A ***.***.***.***,TCP 49175  >  80 [SYN] Seq=0 Win=8192 Len=0 MSS=1460 WS=256 SACK_PERM=1,TCP [TCP Retransmission] [TCP Port numbers reused] 49175  >  80 [SYN] Seq=0 Win=8192 Len=0 MSS=1460 WS=256 SACK_PERM=1,TCP [TCP Retransmission] [TCP Port numbers reused] 49175  >  80 [SYN] Seq=0 Win=8192 Len=0 MSS=1460 SACK_PERM=1,LLMNR Standard query 0xd671 A isatap,LLMNR Standard query 0x4163 ANY None,UDP 57521  >  3702 Len=624,LLMNR Standard query 0x21c1 A wpad,LLMNR Standard query 0xc4c8 A isatap,DNS Standard query 0x971a A teredo.ipv6.microsoft.com,DNS Standard query response 0x971a No such name A teredo.ipv6.microsoft.com SOA ns1-04.azure-dns.com,DNS Standard query 0xab76 A www.msftncsi.com,DNS Standard query response 0xab76 A www.msftncsi.com CNAME www.msftncsi.com.edgesuite.net CNAME a1961.g2.akamai.net A ***.***.***.*** A ***.***.***.***,"TCP 80  >  49159 [FIN, ACK] Seq=180 Ack=98 Win=65535 Len=0",TCP 49159  >  80 [ACK] Seq=98 Ack=181 Win=64061 Len=0,"TCP 49159  >  80 [FIN, ACK] Seq=98 Ack=181 Win=64061 Len=0",TCP 80  >  49159 [ACK] Seq=181 Ack=99 Win=65535 Len=0,LLMNR Standard query 0x025f A isatap,LLMNR Standard query 0x6e6e A wpad,DNS Standard query 0x6cfb A clients2.google.com,DNS Standard query response 0x6cfb A clients2.google.com CNAME clients.l.google.com A ***.***.***.*** A ***.***.***.*** A ***.***.***.*** A ***.***.***.*** A ***.***.***.*** A ***.***.***.***,TCP 49164  >  443 [SYN] Seq=0 Win=8192 Len=0 MSS=1460 WS=256 SACK_PERM=1,"TCP 443  >  49164 [SYN, ACK] Seq=0 Ack=1 Win=65535 Len=0 MSS=1460",TCP 49164  >  443 [ACK] Seq=1 Ack=1 Win=64240 Len=0,TCP 443  >  49164 [ACK] Seq=1 Ack=162 Win=65535 Len=0,"TCP 443  >  49164 [PSH, ACK] Seq=1413 Ack=162 Win=65535 Len=1412 [TCP segment of a reassembled PDU]",TCP 49164  >  443 [ACK] Seq=162 Ack=2825 Win=64240 Len=0,TCP 443  >  49164 [ACK] Seq=2825 Ack=162 Win=65535 Len=1460 [TCP segment of a reassembled PDU],"TCP 443  >  49164 [PSH, ACK] Seq=4285 Ack=162 Win=65535 Len=1364 [TCP segment of a reassembled PDU]",TCP 49164  >  443 [ACK] Seq=162 Ack=5649 Win=64240 Len=0,TCP 443  >  49164 [ACK] Seq=6662 Ack=288 Win=65535 Len=0,TCP 49164  >  443 [ACK] Seq=288 Ack=6713 Win=63176 Len=0,TCP 443  >  49164 [ACK] Seq=6713 Ack=811 Win=65535 Len=0,TCP 49164  >  443 [ACK] Seq=811 Ack=6992 Win=62897 Len=0,"TCP 49164  >  443 [RST, ACK] Seq=811 Ack=6992 Win=0 Len=0",DNS Standard query 0x09c0 A time.windows.com,DNS Standard query response 0x09c0 A time.windows.com CNAME twc.trafficmanager.net A ***.***.***.***,LLMNR Standard query 0xea6d A wpad,DNS Standard query 0x69e6 A update.googleapis.com,DNS Standard query response 0x69e6 A update.googleapis.com A ***.***.***.***,TCP 49172  >  443 [SYN] Seq=0 Win=8192 Len=0 MSS=1460 WS=256 SACK_PERM=1,"TCP 443  >  49172 [SYN, ACK] Seq=0 Ack=1 Win=65535 Len=0 MSS=1460",TCP 49172  >  443 [ACK] Seq=1 Ack=1 Win=64240 Len=0,TCP 443  >  49172 [ACK] Seq=1 Ack=164 Win=65535 Len=0,"TCP 443  >  49172 [PSH, ACK] Seq=1413 Ack=164 Win=65535 Len=1412 [TCP segment of a reassembled PDU]",TCP 49172  >  443 [ACK] Seq=164 Ack=2825 Win=64240 Len=0,TCP 443  >  49172 [ACK] Seq=2825 Ack=164 Win=65535 Len=1460 [TCP segment of a reassembled PDU],TCP 49172  >  443 [ACK] Seq=164 Ack=4650 Win=64240 Len=0,TCP 443  >  49172 [ACK] Seq=4650 Ack=290 Win=65535 Len=0,TCP 443  >  49172 [ACK] Seq=4701 Ack=938 Win=65535 Len=0,TCP 443  >  49172 [ACK] Seq=4701 Ack=2211 Win=65535 Len=0,"TLSv1.2 Application Data, Application Data",TCP 49172  >  443 [ACK] Seq=2211 Ack=8859 Win=64240 Len=0,LLMNR Standard query 0xe6e6 A wpad,LLMNR Standard query 0x04c8 A wpad,DNS Standard query 0x4559 A edgedl.me.gvt1.com,DNS Standard query response 0x4559 A edgedl.me.gvt1.com A ***.***.***.***,TCP 49173  >  80 [SYN] Seq=0 Win=8192 Len=0 MSS=1460 WS=256 SACK_PERM=1,"TCP 80  >  49173 [SYN, ACK] Seq=0 Ack=1 Win=65535 Len=0 MSS=1460",TCP 49173  >  80 [ACK] Seq=1 Ack=1 Win=64240 Len=0,HTTP HEAD /edgedl/release2/update2/acrrl6lnqme3tl434ah5clx3zpma_***.***.***.***/GoogleUpdateSetup.exe HTTP/1.1 ,TCP 80  >  49173 [ACK] Seq=1 Ack=335 Win=65535 Len=0,HTTP HTTP/1.1 200 OK ,TCP 49173  >  80 [ACK] Seq=335 Ack=553 Win=63688 Len=0,DNS Standard query 0xd1eb A watson.microsoft.com,DNS Standard query response 0xd1eb A watson.microsoft.com CNAME legacywatson.trafficmanager.net CNAME onedsblobprdwus16.westus.cloudapp.azure.com A ***.***.***.***,TCP 49174  >  80 [SYN] Seq=0 Win=8192 Len=0 MSS=1460 WS=256 SACK_PERM=1,TCP [TCP Retransmission] [TCP Port numbers reused] 49174  >  80 [SYN] Seq=0 Win=8192 Len=0 MSS=1460 WS=256 SACK_PERM=1,TCP [TCP Retransmission] [TCP Port numbers reused] 49174  >  80 [SYN] Seq=0 Win=8192 Len=0 MSS=1460 SACK_PERM=1,DNS Standard query 0x6cfb A dns.msftncsi.com,DNS Standard query response 0x6cfb A dns.msftncsi.com A ***.***.***.***,DNS Standard query 0x09c0 AAAA dns.msftncsi.com,DNS Standard query response 0x09c0 AAAA dns.msftncsi.com AAAA fd3e:4f5a:5b81::1,DNS Standard query 0x69e6 A clients2.google.com,DNS Standard query response 0x69e6 A clients2.google.com CNAME clients.l.google.com A ***.***.***.***,TCP 49162  >  443 [SYN] Seq=0 Win=8192 Len=0 MSS=1460 WS=256 SACK_PERM=1,"TCP 443  >  49162 [SYN, ACK] Seq=0 Ack=1 Win=65535 Len=0 MSS=1460",TCP 49162  >  443 [ACK] Seq=1 Ack=1 Win=64240 Len=0,TCP 443  >  49162 [ACK] Seq=1 Ack=162 Win=65535 Len=0,"TCP 443  >  49162 [PSH, ACK] Seq=1413 Ack=162 Win=65535 Len=1412 [TCP segment of a reassembled PDU]",TCP 49162  >  443 [ACK] Seq=162 Ack=2825 Win=64240 Len=0,TCP 443  >  49162 [ACK] Seq=2825 Ack=162 Win=65535 Len=1460 [TCP segment of a reassembled PDU],"TCP 443  >  49162 [PSH, ACK] Seq=4285 Ack=162 Win=65535 Len=1364 [TCP segment of a reassembled PDU]",TCP 49162  >  443 [ACK] Seq=162 Ack=6662 Win=64240 Len=0,TCP 443  >  49162 [ACK] Seq=6662 Ack=288 Win=65535 Len=0,TCP 49162  >  443 [ACK] Seq=288 Ack=6713 Win=64189 Len=0,TCP 443  >  49162 [ACK] Seq=6713 Ack=811 Win=65535 Len=0,"TCP 49162  >  443 [RST, ACK] Seq=811 Ack=6992 Win=0 Len=0",DNS Standard query 0xe6e6 A teredo.ipv6.microsoft.com,DNS Standard query response 0xe6e6 No such name A teredo.ipv6.microsoft.com SOA ns1-04.azure-dns.com,DNS Standard query 0x04c8 A time.windows.com,DNS Standard query response 0x04c8 A time.windows.com CNAME twc.trafficmanager.net A ***.***.***.***,LLMNR Standard query 0xe98b A isatap,LLMNR Standard query 0xd671 ANY None,UDP 62407  >  3702 Len=624,LLMNR Standard query 0x4163 A wpad,LLMNR Standard query 0x21c1 A isatap,DNS Standard query 0xc4c8 A teredo.ipv6.microsoft.com,DNS Standard query 0x971a A www.msftncsi.com,LLMNR Standard query 0xab76 A isatap,DNS Standard query 0x96f1 A dns.msftncsi.com,DNS Standard query 0x09c0 A teredo.ipv6.microsoft.com,DNS Standard query 0xe6e6 A clients2.google.com,DNS Standard query 0x04c8 A clients2.google.com,DNS Standard query 0x4559 A teredo.ipv6.microsoft.com,DNS Standard query 0xd1eb A time.windows.com,LLMNR Standard query 0xf66d A wpad,DNS Standard query 0x44c1 A clients2.google.com,DNS Standard query 0xcf1c A time.windows.com,LLMNR Standard query 0x5e83 A wpad,DNS Standard query 0x6ea7 A clients2.google.com,DNS Standard query 0xedb3 A clients2.google.com,DNS Standard query 0xb41c A clients2.google.com,DNS Standard query 0x3e7e A teredo.ipv6.microsoft.com,LLMNR Standard query 0x09c0 A wpad,DNS Standard query 0xea6d A clients2.google.com,DNS Standard query 0x4559 A clients2.google.com,DNS Standard query 0xd1eb A clients2.google.com,DNS Standard query 0x5e83 A teredo.ipv6.microsoft.com,LLMNR Standard query 0x6ea7 A wpad,DNS Standard query 0xedb3 A time.windows.com,DNS Standard query 0x3e7e A clients2.google.com,DNS Standard query response 0x3e7e A clients2.google.com CNAME clients.l.google.com A ***.***.***.***,TCP 49169  >  443 [SYN] Seq=0 Win=8192 Len=0 MSS=1460 WS=256 SACK_PERM=1,"TCP 443  >  49169 [SYN, ACK] Seq=0 Ack=1 Win=65535 Len=0 MSS=1460",TCP 49169  >  443 [ACK] Seq=1 Ack=1 Win=64240 Len=0,TCP 443  >  49169 [ACK] Seq=1 Ack=162 Win=65535 Len=0,"TCP 443  >  49169 [PSH, ACK] Seq=1461 Ack=162 Win=65535 Len=1364 [TCP segment of a reassembled PDU]",TCP 49169  >  443 [ACK] Seq=162 Ack=2825 Win=64240 Len=0,TCP 443  >  49169 [ACK] Seq=2825 Ack=162 Win=65535 Len=1460 [TCP segment of a reassembled PDU],TCP 443  >  49169 [ACK] Seq=4285 Ack=162 Win=65535 Len=1460 [TCP segment of a reassembled PDU],TCP 49169  >  443 [ACK] Seq=162 Ack=6660 Win=64240 Len=0,TCP 443  >  49169 [ACK] Seq=6660 Ack=288 Win=65535 Len=0,TCP 49169  >  443 [ACK] Seq=288 Ack=6711 Win=64189 Len=0,TCP 443  >  49169 [ACK] Seq=6711 Ack=818 Win=65535 Len=0,"TCP 49169  >  443 [RST, ACK] Seq=818 Ack=6990 Win=0 Len=0",DNS Standard query response 0x09c0 A clients2.google.com CNAME clients.l.google.com A ***.***.***.***,TCP 49165  >  443 [ACK] Seq=162 Ack=6660 Win=64240 Len=0,TCP 443  >  49165 [ACK] Seq=6660 Ack=288 Win=65535 Len=0,TCP 49165  >  443 [ACK] Seq=288 Ack=6711 Win=64189 Len=0,TCP 443  >  49165 [ACK] Seq=6711 Ack=811 Win=65535 Len=0,TCP 49165  >  443 [ACK] Seq=811 Ack=6990 Win=63910 Len=0,"TCP 49165  >  443 [RST, ACK] Seq=811 Ack=6990 Win=0 Len=0",DNS Standard query 0x04c8 A dns.msftncsi.com,LLMNR Standard query 0x4559 A wpad,LLMNR Standard query 0xe98b ANY None,DNS Standard query response 0x96f1 A dns.msftncsi.com A ***.***.***.***,DNS Standard query 0x6e6e AAAA dns.msftncsi.com,DNS Standard query response 0x6e6e AAAA dns.msftncsi.com AAAA fd3e:4f5a:5b81::1,TCP 49167  >  443 [SYN] Seq=0 Win=8192 Len=0 MSS=1460 WS=256 SACK_PERM=1,"TCP 443  >  49167 [SYN, ACK] Seq=0 Ack=1 Win=65535 Len=0 MSS=1460",TCP 49167  >  443 [ACK] Seq=1 Ack=1 Win=64240 Len=0,DNS Standard query 0xea6d A teredo.ipv6.microsoft.com,DNS Standard query response 0xea6d No such name A teredo.ipv6.microsoft.com SOA ns1-04.azure-dns.com,TCP 443  >  49167 [ACK] Seq=1 Ack=162 Win=65535 Len=0,TCP 443  >  49167 [ACK] Seq=1461 Ack=162 Win=65535 Len=1460 [TCP segment of a reassembled PDU],TCP 49167  >  443 [ACK] Seq=162 Ack=2921 Win=64240 Len=0,TCP 443  >  49167 [ACK] Seq=2921 Ack=162 Win=65535 Len=1460 [TCP segment of a reassembled PDU],TCP 443  >  49167 [ACK] Seq=4381 Ack=162 Win=65535 Len=1460 [TCP segment of a reassembled PDU],TCP 49167  >  443 [ACK] Seq=162 Ack=6661 Win=64240 Len=0,TCP 443  >  49167 [ACK] Seq=6661 Ack=288 Win=65535 Len=0,TCP 49167  >  443 [ACK] Seq=288 Ack=6712 Win=64189 Len=0,TCP 443  >  49167 [ACK] Seq=6712 Ack=811 Win=65535 Len=0,"TCP 49167  >  443 [RST, ACK] Seq=811 Ack=6991 Win=0 Len=0",DNS Standard query 0x69e6 A time.windows.com,DNS Standard query 0xe6e6 A time.windows.com,ARP ***.***.***.*** is at 5a:94:d2:14:5a:51,TCP 49163  >  443 [SYN] Seq=0 Win=8192 Len=0 MSS=1460 WS=256 SACK_PERM=1,"TCP 443  >  49163 [SYN, ACK] Seq=0 Ack=1 Win=65535 Len=0 MSS=1460",TCP 49163  >  443 [ACK] Seq=1 Ack=1 Win=64240 Len=0,TCP 443  >  49163 [ACK] Seq=1 Ack=162 Win=65535 Len=0,TCP 443  >  49163 [ACK] Seq=1413 Ack=162 Win=65535 Len=1460 [TCP segment of a reassembled PDU],TCP 49163  >  443 [ACK] Seq=162 Ack=2873 Win=64240 Len=0,TCP 443  >  49163 [ACK] Seq=2873 Ack=162 Win=65535 Len=1460 [TCP segment of a reassembled PDU],TCP 443  >  49163 [ACK] Seq=4333 Ack=162 Win=65535 Len=1460 [TCP segment of a reassembled PDU],TCP 49163  >  443 [ACK] Seq=162 Ack=6661 Win=64240 Len=0,TCP 443  >  49163 [ACK] Seq=6661 Ack=288 Win=65535 Len=0,TCP 49163  >  443 [ACK] Seq=288 Ack=6712 Win=64189 Len=0,TCP 443  >  49163 [ACK] Seq=6712 Ack=811 Win=65535 Len=0,"TCP 49163  >  443 [RST, ACK] Seq=811 Ack=6991 Win=0 Len=0",DNS Standard query response 0xe6e6 A watson.microsoft.com CNAME legacywatson.trafficmanager.net CNAME onedsblobprdwus17.westus.cloudapp.azure.com A ***.***.***.***,UDP 49154  >  3702 Len=624,TCP 49160  >  80 [SYN] Seq=0 Win=8192 Len=0 MSS=1460 WS=256 SACK_PERM=1,"TCP 80  >  49160 [SYN, ACK] Seq=0 Ack=1 Win=65535 Len=0 MSS=1460",TCP 49160  >  80 [ACK] Seq=1 Ack=1 Win=64240 Len=0,TCP 80  >  49160 [ACK] Seq=1 Ack=98 Win=65535 Len=0,"TCP 80  >  49160 [FIN, ACK] Seq=180 Ack=98 Win=65535 Len=0",TCP 49160  >  80 [ACK] Seq=98 Ack=181 Win=64061 Len=0,"TCP 49160  >  80 [FIN, ACK] Seq=98 Ack=181 Win=64061 Len=0",TCP 80  >  49160 [ACK] Seq=181 Ack=99 Win=65535 Len=0,TCP 49166  >  443 [SYN] Seq=0 Win=8192 Len=0 MSS=1460 WS=256 SACK_PERM=1,"TCP 443  >  49166 [SYN, ACK] Seq=0 Ack=1 Win=65535 Len=0 MSS=1460",TCP 49166  >  443 [ACK] Seq=1 Ack=1 Win=64240 Len=0,TCP 443  >  49166 [ACK] Seq=1 Ack=162 Win=65535 Len=0,"TCP 443  >  49166 [PSH, ACK] Seq=1413 Ack=162 Win=65535 Len=1412 [TCP segment of a reassembled PDU]",TCP 49166  >  443 [ACK] Seq=162 Ack=2825 Win=64240 Len=0,"TCP 443  >  49166 [PSH, ACK] Seq=2825 Ack=162 Win=65535 Len=1412 [TCP segment of a reassembled PDU]","TCP 443  >  49166 [PSH, ACK] Seq=4237 Ack=162 Win=65535 Len=1412 [TCP segment of a reassembled PDU]",TCP 49166  >  443 [ACK] Seq=162 Ack=6660 Win=64240 Len=0,TCP 443  >  49166 [ACK] Seq=6660 Ack=288 Win=65535 Len=0,TCP 49166  >  443 [ACK] Seq=288 Ack=6711 Win=64189 Len=0,TCP 443  >  49166 [ACK] Seq=6711 Ack=811 Win=65535 Len=0,"TCP 49166  >  443 [RST, ACK] Seq=811 Ack=6990 Win=0 Len=0","TCP [TCP Out-Of-Order] 80  >  49159 [FIN, ACK] Seq=180 Ack=99 Win=65535 Len=0","TCP [TCP Retransmission] 80  >  49159 [FIN, ACK] Seq=180 Ack=99 Win=65535 Len=0",TCP [TCP ZeroWindow] 49159  >  80 [ACK] Seq=99 Ack=181 Win=0 Len=0,TCP 443  >  49165 [ACK] Seq=1413 Ack=162 Win=65535 Len=1460 [TCP segment of a reassembled PDU],TCP 49165  >  443 [ACK] Seq=162 Ack=2873 Win=64240 Len=0,TCP 443  >  49165 [ACK] Seq=2873 Ack=162 Win=65535 Len=1460 [TCP segment of a reassembled PDU],TCP 443  >  49165 [ACK] Seq=4333 Ack=162 Win=65535 Len=1460 [TCP segment of a reassembled PDU],TCP 49181  >  80 [SYN] Seq=0 Win=8192 Len=0 MSS=1460 WS=256 SACK_PERM=1,TCP [TCP Retransmission] [TCP Port numbers reused] 49181  >  80 [SYN] Seq=0 Win=8192 Len=0 MSS=1460 WS=256 SACK_PERM=1,TCP [TCP Retransmission] [TCP Port numbers reused] 49181  >  80 [SYN] Seq=0 Win=8192 Len=0 MSS=1460 SACK_PERM=1,"TCP 443  >  49163 [PSH, ACK] Seq=1413 Ack=162 Win=65535 Len=1412 [TCP segment of a reassembled PDU]",TCP 49163  >  443 [ACK] Seq=162 Ack=2825 Win=64240 Len=0,TCP 443  >  49163 [ACK] Seq=2825 Ack=162 Win=65535 Len=1460 [TCP segment of a reassembled PDU],"TCP 443  >  49163 [PSH, ACK] Seq=4285 Ack=162 Win=65535 Len=1364 [TCP segment of a reassembled PDU]",TCP 49163  >  443 [ACK] Seq=162 Ack=5649 Win=64240 Len=0,TCP 49163  >  443 [ACK] Seq=288 Ack=6712 Win=63177 Len=0,DNS Standard query response 0xc4c8 No such name A teredo.ipv6.microsoft.com SOA ns1-04.azure-dns.com,DNS Standard query response 0x971a A www.msftncsi.com CNAME www.msftncsi.com.edgesuite.net CNAME a1961.g2.akamai.net A ***.***.***.*** A ***.***.***.***,LLMNR Standard query 0x96f1 A wpad,DNS Standard query 0x6e6e A clients2.google.com,DNS Standard query response 0x6e6e A clients2.google.com CNAME clients.l.google.com A ***.***.***.***,TCP 443  >  49163 [ACK] Seq=4285 Ack=162 Win=65535 Len=1460 [TCP segment of a reassembled PDU],TCP 49163  >  443 [ACK] Seq=162 Ack=6660 Win=64240 Len=0,TCP 443  >  49163 [ACK] Seq=6660 Ack=288 Win=65535 Len=0,TCP 49163  >  443 [ACK] Seq=288 Ack=6711 Win=64189 Len=0,TCP 443  >  49163 [ACK] Seq=6711 Ack=811 Win=65535 Len=0,"TCP 49163  >  443 [RST, ACK] Seq=811 Ack=6990 Win=0 Len=0",DNS Standard query 0x6cfb A time.windows.com,DNS Standard query response 0x6cfb A time.windows.com CNAME twc.trafficmanager.net A ***.***.***.***,DNS Standard query 0xea6d A watson.microsoft.com,DNS Standard query response 0xea6d A watson.microsoft.com CNAME legacywatson.trafficmanager.net CNAME onedsblobprdcus16.centralus.cloudapp.azure.com A ***.***.***.***,TCP 49177  >  80 [SYN] Seq=0 Win=8192 Len=0 MSS=1460 WS=256 SACK_PERM=1,TCP [TCP Retransmission] [TCP Port numbers reused] 49177  >  80 [SYN] Seq=0 Win=8192 Len=0 MSS=1460 WS=256 SACK_PERM=1,TCP [TCP Retransmission] [TCP Port numbers reused] 49177  >  80 [SYN] Seq=0 Win=8192 Len=0 MSS=1460 SACK_PERM=1,"TCP 443  >  49165 [PSH, ACK] Seq=2825 Ack=162 Win=65535 Len=1412 [TCP segment of a reassembled PDU]",TCP 443  >  49165 [ACK] Seq=4237 Ack=162 Win=65535 Len=1460 [TCP segment of a reassembled PDU],DNS Standard query 0x69e6 A watson.microsoft.com,DNS Standard query response 0x69e6 A watson.microsoft.com CNAME legacywatson.trafficmanager.net CNAME onedsblobprdcus07.centralus.cloudapp.azure.com A ***.***.***.***,TCP 49172  >  80 [SYN] Seq=0 Win=8192 Len=0 MSS=1460 WS=256 SACK_PERM=1,TCP [TCP Retransmission] [TCP Port numbers reused] 49172  >  80 [SYN] Seq=0 Win=8192 Len=0 MSS=1460 WS=256 SACK_PERM=1,TCP [TCP Retransmission] [TCP Port numbers reused] 49173  >  80 [SYN] Seq=0 Win=8192 Len=0 MSS=1460 WS=256 SACK_PERM=1,TCP [TCP Retransmission] [TCP Port numbers reused] 49172  >  80 [SYN] Seq=0 Win=8192 Len=0 MSS=1460 SACK_PERM=1,TCP [TCP Retransmission] [TCP Port numbers reused] 49173  >  80 [SYN] Seq=0 Win=8192 Len=0 MSS=1460 SACK_PERM=1,TCP 49162  >  80 [SYN] Seq=0 Win=8192 Len=0 MSS=1460 WS=256 SACK_PERM=1,"TCP 80  >  49162 [SYN, ACK] Seq=0 Ack=1 Win=65535 Len=0 MSS=1460",TCP 49162  >  80 [ACK] Seq=1 Ack=1 Win=64240 Len=0,TCP 80  >  49162 [ACK] Seq=1 Ack=98 Win=65535 Len=0,"TCP 80  >  49162 [FIN, ACK] Seq=180 Ack=98 Win=65535 Len=0",TCP 49162  >  80 [ACK] Seq=98 Ack=181 Win=64061 Len=0,"TCP 49162  >  80 [FIN, ACK] Seq=98 Ack=181 Win=64061 Len=0",TCP 80  >  49162 [ACK] Seq=181 Ack=99 Win=65535 Len=0,"TCP 443  >  49167 [PSH, ACK] Seq=1413 Ack=162 Win=65535 Len=1412 [TCP segment of a reassembled PDU]",TCP 49167  >  443 [ACK] Seq=162 Ack=2825 Win=64240 Len=0,"TCP 443  >  49167 [PSH, ACK] Seq=2825 Ack=162 Win=65535 Len=1412 [TCP segment of a reassembled PDU]","TCP 443  >  49167 [PSH, ACK] Seq=4237 Ack=162 Win=65535 Len=1412 [TCP segment of a reassembled PDU]","TCP 443  >  49466 [FIN, ACK] Seq=1 Ack=1 Win=65535 Len=0",TCP 49466  >  443 [RST] Seq=1 Win=0 Len=0,UDP 58809  >  3702 Len=624,LLMNR Standard query 0xd671 A wpad,DNS Standard query 0x21c1 A teredo.ipv6.microsoft.com,DNS Standard query response 0x21c1 No such name A teredo.ipv6.microsoft.com SOA ns1-04.azure-dns.com,DNS Standard query 0xc4c8 A www.msftncsi.com,DNS Standard query response 0xc4c8 A www.msftncsi.com CNAME www.msftncsi.com.edgesuite.net CNAME a1961.g2.akamai.net A ***.***.***.*** A ***.***.***.***,DNS Standard query response 0x6cfb A clients2.google.com CNAME clients.l.google.com A ***.***.***.***,TCP 9001  >  49581 [ACK] Seq=1 Ack=1 Win=65535 Len=1,TCP [TCP Keep-Alive] 9001  >  49581 [ACK] Seq=1 Ack=1 Win=65535 Len=1,"TCP [TCP Retransmission] 443  >  49436 [PSH, ACK] Seq=1 Ack=1 Win=65535 Len=543",TCP 49581  >  9001 [RST] Seq=1 Win=0 Len=0,TCP 49434  >  9010 [RST] Seq=1 Win=0 Len=0,TCP 49435  >  443 [RST] Seq=1 Win=0 Len=0,TCP 49436  >  443 [RST] Seq=1 Win=0 Len=0,UDP 55190  >  3702 Len=624,BROWSER Get Backup List Request,NBNS Name query NB WORKGROUP<1b>,UDP 55192  >  3702 Len=624,LLMNR Standard query 0x6cfb A isatap,DNS Standard query response 0xea6d A clients2.google.com CNAME clients.l.google.com A ***.***.***.***,"TCP 443  >  49165 [PSH, ACK] Seq=1461 Ack=162 Win=65535 Len=1364 [TCP segment of a reassembled PDU]",TCP 49165  >  443 [ACK] Seq=811 Ack=6991 Win=63910 Len=0,TCP 49170  >  80 [SYN] Seq=0 Win=8192 Len=0 MSS=1460 WS=256 SACK_PERM=1,TCP [TCP Retransmission] [TCP Port numbers reused] 49170  >  80 [SYN] Seq=0 Win=8192 Len=0 MSS=1460 WS=256 SACK_PERM=1,TCP [TCP Retransmission] [TCP Port numbers reused] 49170  >  80 [SYN] Seq=0 Win=8192 Len=0 MSS=1460 SACK_PERM=1,TCP 49203  >  9001 [SYN] Seq=0 Win=8192 Len=0 MSS=1460 WS=256 SACK_PERM=1,TCP 49204  >  443 [SYN] Seq=0 Win=8192 Len=0 MSS=1460 WS=256 SACK_PERM=1,TCP 49205  >  9001 [SYN] Seq=0 Win=8192 Len=0 MSS=1460 WS=256 SACK_PERM=1,TCP [TCP Retransmission] [TCP Port numbers reused] 49203  >  9001 [SYN] Seq=0 Win=8192 Len=0 MSS=1460 WS=256 SACK_PERM=1,TCP [TCP Retransmission] [TCP Port numbers reused] 49205  >  9001 [SYN] Seq=0 Win=8192 Len=0 MSS=1460 WS=256 SACK_PERM=1,TCP [TCP Retransmission] [TCP Port numbers reused] 49204  >  443 [SYN] Seq=0 Win=8192 Len=0 MSS=1460 WS=256 SACK_PERM=1,TCP [TCP Retransmission] [TCP Port numbers reused] 49203  >  9001 [SYN] Seq=0 Win=8192 Len=0 MSS=1460 SACK_PERM=1,TCP [TCP Retransmission] [TCP Port numbers reused] 49205  >  9001 [SYN] Seq=0 Win=8192 Len=0 MSS=1460 SACK_PERM=1,TCP [TCP Retransmission] [TCP Port numbers reused] 49204  >  443 [SYN] Seq=0 Win=8192 Len=0 MSS=1460 SACK_PERM=1,TCP 49333  >  9001 [SYN] Seq=0 Win=8192 Len=0 MSS=1460 WS=256 SACK_PERM=1,TCP 49334  >  443 [SYN] Seq=0 Win=8192 Len=0 MSS=1460 WS=256 SACK_PERM=1,"TCP 443  >  49334 [SYN, ACK] Seq=0 Ack=1 Win=65535 Len=0 MSS=1460",TCP 49334  >  443 [ACK] Seq=1 Ack=1 Win=64240 Len=0,TCP 443  >  49334 [ACK] Seq=1 Ack=221 Win=65535 Len=0,"TLSv1.2 Server Hello, Certificate, Server Key Exchange, Server Hello Done",TCP 443  >  49334 [ACK] Seq=1018 Ack=347 Win=65535 Len=0,TCP 443  >  49334 [ACK] Seq=1069 Ack=385 Win=65535 Len=0,TCP 443  >  49334 [ACK] Seq=1069 Ack=385 Win=65535 Len=1460 [TCP segment of a reassembled PDU],TCP 49334  >  443 [ACK] Seq=385 Ack=3149 Win=64240 Len=0,TCP 443  >  49334 [ACK] Seq=3149 Ack=1442 Win=65535 Len=0,TCP 443  >  49334 [ACK] Seq=3692 Ack=2499 Win=65535 Len=0,TCP 443  >  49334 [ACK] Seq=3692 Ack=2499 Win=65535 Len=1460 [TCP segment of a reassembled PDU],TCP 443  >  49334 [ACK] Seq=5152 Ack=2499 Win=65535 Len=1460 [TCP segment of a reassembled PDU],TLSv1.2 Application Data [TCP segment of a reassembled PDU],TCP 443  >  49334 [ACK] Seq=8072 Ack=2499 Win=65535 Len=1460 [TCP segment of a reassembled PDU],"TCP 443  >  49334 [PSH, ACK] Seq=9532 Ack=2499 Win=65535 Len=1157 [TCP segment of a reassembled PDU]",TCP 49334  >  443 [ACK] Seq=2499 Ack=10689 Win=64240 Len=0,TCP 443  >  49334 [ACK] Seq=12149 Ack=2499 Win=65535 Len=1460 [TCP segment of a reassembled PDU],TCP 443  >  49334 [ACK] Seq=15069 Ack=2499 Win=65535 Len=1460 [TCP segment of a reassembled PDU],TCP 443  >  49334 [ACK] Seq=16529 Ack=2499 Win=65535 Len=1460 [TCP segment of a reassembled PDU],TCP 49334  >  443 [ACK] Seq=2499 Ack=19449 Win=56940 Len=0,TCP 443  >  49334 [ACK] Seq=19449 Ack=2499 Win=65535 Len=1460 [TCP segment of a reassembled PDU],"TCP 443  >  49334 [PSH, ACK] Seq=20909 Ack=2499 Win=65535 Len=1460 [TCP segment of a reassembled PDU]",TCP 49334  >  443 [ACK] Seq=2499 Ack=22369 Win=54020 Len=0,"TCP 443  >  49334 [PSH, ACK] Seq=23829 Ack=2499 Win=65535 Len=1460 [TCP segment of a reassembled PDU]",TCP 49334  >  443 [ACK] Seq=2499 Ack=25289 Win=51100 Len=0,TCP [TCP Window Update] 49334  >  443 [ACK] Seq=2499 Ack=25289 Win=64240 Len=0,TCP 443  >  49334 [ACK] Seq=26749 Ack=2499 Win=65535 Len=1460 [TCP segment of a reassembled PDU],"TCP 443  >  49334 [PSH, ACK] Seq=31129 Ack=2499 Win=65535 Len=1460 [TCP segment of a reassembled PDU]",TCP 49334  >  443 [ACK] Seq=2499 Ack=32589 Win=64240 Len=0,TCP 443  >  49334 [ACK] Seq=32589 Ack=2499 Win=65535 Len=1460 [TCP segment of a reassembled PDU],"TCP 443  >  49334 [PSH, ACK] Seq=36969 Ack=2499 Win=65535 Len=1460 [TCP segment of a reassembled PDU]",TCP 49334  >  443 [ACK] Seq=2499 Ack=38429 Win=59860 Len=0,"TCP 443  >  49334 [PSH, ACK] Seq=38429 Ack=2499 Win=65535 Len=1460 [TCP segment of a reassembled PDU]","TCP 443  >  49334 [PSH, ACK] Seq=41349 Ack=2499 Win=65535 Len=1460 [TCP segment of a reassembled PDU]","TCP 443  >  49334 [PSH, ACK] Seq=42809 Ack=2499 Win=65535 Len=1460 [TCP segment of a reassembled PDU]",TCP 49334  >  443 [ACK] Seq=2499 Ack=44269 Win=54020 Len=0,"TCP 443  >  49334 [PSH, ACK] Seq=45729 Ack=2499 Win=65535 Len=1460 [TCP segment of a reassembled PDU]",TCP 49334  >  443 [ACK] Seq=2499 Ack=47189 Win=51100 Len=0,TCP 443  >  49334 [ACK] Seq=47189 Ack=2499 Win=65535 Len=1460 [TCP segment of a reassembled PDU],TCP 443  >  49334 [ACK] Seq=50109 Ack=2499 Win=65535 Len=1460 [TCP segment of a reassembled PDU],"TCP 443  >  49334 [PSH, ACK] Seq=51569 Ack=2499 Win=65535 Len=1460 [TCP segment of a reassembled PDU]",TCP 49334  >  443 [ACK] Seq=2499 Ack=53029 Win=45260 Len=0,TCP [TCP Window Update] 49334  >  443 [ACK] Seq=2499 Ack=53029 Win=64240 Len=0,TCP 443  >  49334 [ACK] Seq=53029 Ack=3042 Win=65535 Len=0,"TCP 443  >  49334 [PSH, ACK] Seq=54489 Ack=3042 Win=65535 Len=1460 [TCP segment of a reassembled PDU]",TCP 49334  >  443 [ACK] Seq=3042 Ack=55949 Win=64240 Len=0,"TCP 443  >  49334 [PSH, ACK] Seq=58869 Ack=3042 Win=65535 Len=1460 [TCP segment of a reassembled PDU]",TCP 49334  >  443 [ACK] Seq=3042 Ack=58869 Win=64240 Len=0,"TCP 443  >  49334 [PSH, ACK] Seq=61789 Ack=3042 Win=65535 Len=1460 [TCP segment of a reassembled PDU]",TCP 49334  >  443 [ACK] Seq=3042 Ack=61789 Win=64240 Len=0,"TCP 443  >  49334 [PSH, ACK] Seq=63249 Ack=3042 Win=65535 Len=1460 [TCP segment of a reassembled PDU]",TCP 49334  >  443 [ACK] Seq=3042 Ack=64709 Win=61320 Len=0,"TCP 443  >  49334 [PSH, ACK] Seq=66169 Ack=3042 Win=65535 Len=1460 [TCP segment of a reassembled PDU]",TCP 49334  >  443 [ACK] Seq=3042 Ack=67629 Win=58400 Len=0,"TCP 443  >  49334 [PSH, ACK] Seq=67629 Ack=3042 Win=65535 Len=1460 [TCP segment of a reassembled PDU]","TCP 443  >  49334 [PSH, ACK] Seq=70549 Ack=3042 Win=65535 Len=1460 [TCP segment of a reassembled PDU]",TCP 49334  >  443 [ACK] Seq=3042 Ack=70549 Win=55480 Len=0,"TCP 443  >  49334 [PSH, ACK] Seq=72009 Ack=3042 Win=65535 Len=1460 [TCP segment of a reassembled PDU]",TCP 49334  >  443 [ACK] Seq=3042 Ack=73469 Win=52560 Len=0,"TCP 443  >  49334 [PSH, ACK] Seq=74929 Ack=3042 Win=65535 Len=1460 [TCP segment of a reassembled PDU]",TCP 49334  >  443 [ACK] Seq=3042 Ack=76389 Win=49640 Len=0,"TCP 443  >  49334 [PSH, ACK] Seq=77849 Ack=3042 Win=65535 Len=1460 [TCP segment of a reassembled PDU]","TCP 443  >  49334 [PSH, ACK] Seq=79309 Ack=3042 Win=65535 Len=1460 [TCP segment of a reassembled PDU]",TCP [TCP Window Update] 49334  >  443 [ACK] Seq=3042 Ack=76389 Win=64240 Len=0,TCP 49334  >  443 [ACK] Seq=3042 Ack=79309 Win=61320 Len=0,"TCP 443  >  49334 [PSH, ACK] Seq=82229 Ack=3042 Win=65535 Len=1460 [TCP segment of a reassembled PDU]",TCP 49334  >  443 [ACK] Seq=3042 Ack=82229 Win=58400 Len=0,"TCP 443  >  49334 [PSH, ACK] Seq=83689 Ack=3042 Win=65535 Len=1460 [TCP segment of a reassembled PDU]",TCP 49334  >  443 [ACK] Seq=3042 Ack=85149 Win=55480 Len=0,"TCP 443  >  49334 [PSH, ACK] Seq=86609 Ack=3042 Win=65535 Len=1460 [TCP segment of a reassembled PDU]",TCP 49334  >  443 [ACK] Seq=3042 Ack=88069 Win=52560 Len=0,"TCP 443  >  49334 [PSH, ACK] Seq=88069 Ack=3042 Win=65535 Len=1460 [TCP segment of a reassembled PDU]",TCP 49334  >  443 [ACK] Seq=3042 Ack=90989 Win=49640 Len=0,TCP 443  >  49334 [ACK] Seq=90989 Ack=3585 Win=65535 Len=0,TCP 443  >  49334 [ACK] Seq=90989 Ack=4128 Win=65535 Len=0,TCP [TCP Window Update] 49334  >  443 [ACK] Seq=4128 Ack=90989 Win=53112 Len=0,TCP [TCP Window Update] 49334  >  443 [ACK] Seq=4128 Ack=90989 Win=64240 Len=0,TCP 443  >  49334 [ACK] Seq=90989 Ack=4671 Win=65535 Len=0,"TCP 443  >  49334 [PSH, ACK] Seq=90989 Ack=4671 Win=65535 Len=1460 [TCP segment of a reassembled PDU]",TCP 443  >  49334 [ACK] Seq=92449 Ack=4671 Win=65535 Len=1460 [TCP segment of a reassembled PDU],TCP 443  >  49334 [ACK] Seq=95369 Ack=4671 Win=65535 Len=1460 [TCP segment of a reassembled PDU],TCP 443  >  49334 [ACK] Seq=98289 Ack=4671 Win=65535 Len=1460 [TCP segment of a reassembled PDU],TCP 443  >  49334 [ACK] Seq=99749 Ack=4671 Win=65535 Len=1460 [TCP segment of a reassembled PDU],TCP 443  >  49334 [ACK] Seq=102669 Ack=4671 Win=65535 Len=1460 [TCP segment of a reassembled PDU],TCP 443  >  49334 [ACK] Seq=104129 Ack=4671 Win=65535 Len=1460 [TCP segment of a reassembled PDU],"TCP 443  >  49334 [PSH, ACK] Seq=107049 Ack=4671 Win=65535 Len=1460 [TCP segment of a reassembled PDU]","TCP 443  >  49334 [PSH, ACK] Seq=108509 Ack=4671 Win=65535 Len=1460 [TCP segment of a reassembled PDU]","TCP 443  >  49334 [PSH, ACK] Seq=111429 Ack=4671 Win=65535 Len=1460 [TCP segment of a reassembled PDU]","TCP 443  >  49334 [PSH, ACK] Seq=112889 Ack=4671 Win=65535 Len=1460 [TCP segment of a reassembled PDU]","TCP 443  >  49334 [PSH, ACK] Seq=115809 Ack=4671 Win=65535 Len=1460 [TCP segment of a reassembled PDU]","TCP 443  >  49334 [PSH, ACK] Seq=118729 Ack=4671 Win=65535 Len=1460 [TCP segment of a reassembled PDU]","TCP 443  >  49334 [PSH, ACK] Seq=120189 Ack=4671 Win=65535 Len=1460 [TCP segment of a reassembled PDU]","TCP 443  >  49334 [PSH, ACK] Seq=124569 Ack=4671 Win=65535 Len=1460 [TCP segment of a reassembled PDU]","TCP 443  >  49334 [PSH, ACK] Seq=127489 Ack=4671 Win=65535 Len=1460 [TCP segment of a reassembled PDU]","TCP 443  >  49334 [PSH, ACK] Seq=128949 Ack=4671 Win=65535 Len=1460 [TCP segment of a reassembled PDU]",TCP 49334  >  443 [ACK] Seq=4671 Ack=131869 Win=33580 Len=0,TCP 443  >  49334 [ACK] Seq=131869 Ack=4671 Win=65535 Len=1460 [TCP segment of a reassembled PDU],TCP 443  >  49334 [ACK] Seq=133329 Ack=4671 Win=65535 Len=1460 [TCP segment of a reassembled PDU],TCP 443  >  49334 [ACK] Seq=136249 Ack=4671 Win=65535 Len=1460 [TCP segment of a reassembled PDU],TCP 443  >  49334 [ACK] Seq=139169 Ack=4671 Win=65535 Len=1460 [TCP segment of a reassembled PDU],TCP 443  >  49334 [ACK] Seq=140629 Ack=4671 Win=65535 Len=1460 [TCP segment of a reassembled PDU],TCP 443  >  49334 [ACK] Seq=143549 Ack=4671 Win=65535 Len=1460 [TCP segment of a reassembled PDU],TCP 443  >  49334 [ACK] Seq=145009 Ack=4671 Win=65535 Len=1460 [TCP segment of a reassembled PDU],TCP 443  >  49334 [ACK] Seq=147929 Ack=4671 Win=65535 Len=1460 [TCP segment of a reassembled PDU],TCP 443  >  49334 [ACK] Seq=149389 Ack=4671 Win=65535 Len=1460 [TCP segment of a reassembled PDU],TCP 443  >  49334 [ACK] Seq=152309 Ack=4671 Win=65535 Len=1460 [TCP segment of a reassembled PDU],TCP 443  >  49334 [ACK] Seq=153769 Ack=4671 Win=65535 Len=1460 [TCP segment of a reassembled PDU],TCP 443  >  49334 [ACK] Seq=156689 Ack=4671 Win=65535 Len=1460 [TCP segment of a reassembled PDU],TCP 443  >  49334 [ACK] Seq=159609 Ack=4671 Win=65535 Len=1460 [TCP segment of a reassembled PDU],TCP 443  >  49334 [ACK] Seq=161069 Ack=4671 Win=65535 Len=1460 [TCP segment of a reassembled PDU],"TLSv1.2 [TCP Window Full] , Application Data [TCP segment of a reassembled PDU]",TCP [TCP ZeroWindow] 49334  >  443 [ACK] Seq=4671 Ack=165449 Win=0 Len=0,TCP [TCP Window Update] 49334  >  443 [ACK] Seq=4671 Ack=165449 Win=3472 Len=0,"TCP 443  >  49334 [PSH, ACK] Seq=165449 Ack=4671 Win=65535 Len=1460 [TCP segment of a reassembled PDU]",TCP 49334  >  443 [ACK] Seq=4671 Ack=166909 Win=62780 Len=0,TCP 443  >  49334 [ACK] Seq=166909 Ack=5728 Win=65535 Len=0,TCP 443  >  49334 [ACK] Seq=166909 Ack=6271 Win=65535 Len=0,TCP 443  >  49334 [ACK] Seq=168369 Ack=6271 Win=65535 Len=1460 [TCP segment of a reassembled PDU],TCP 443  >  49334 [ACK] Seq=169829 Ack=6271 Win=65535 Len=1460 [TCP segment of a reassembled PDU],TCP 443  >  49334 [ACK] Seq=172749 Ack=6271 Win=65535 Len=1460 [TCP segment of a reassembled PDU],"TCP 443  >  49334 [PSH, ACK] Seq=174209 Ack=6271 Win=65535 Len=1460 [TCP segment of a reassembled PDU]",TCP 49334  >  443 [ACK] Seq=6271 Ack=175669 Win=54020 Len=0,TCP 443  >  49334 [ACK] Seq=177129 Ack=6271 Win=65535 Len=1460 [TCP segment of a reassembled PDU],"TCP 443  >  49334 [PSH, ACK] Seq=181509 Ack=6271 Win=65535 Len=1460 [TCP segment of a reassembled PDU]",TCP 49334  >  443 [ACK] Seq=6271 Ack=182969 Win=46720 Len=0,TCP 443  >  49334 [ACK] Seq=182969 Ack=6271 Win=65535 Len=1460 [TCP segment of a reassembled PDU],TCP 443  >  49334 [ACK] Seq=185889 Ack=6271 Win=65535 Len=1460 [TCP segment of a reassembled PDU],TCP 49334  >  443 [ACK] Seq=6271 Ack=185889 Win=43800 Len=0,TCP 49334  >  443 [ACK] Seq=6271 Ack=188809 Win=40880 Len=0,"TCP 443  >  49334 [PSH, ACK] Seq=188809 Ack=6271 Win=65535 Len=1460 [TCP segment of a reassembled PDU]",TCP 443  >  49334 [ACK] Seq=190269 Ack=6271 Win=65535 Len=1460 [TCP segment of a reassembled PDU],TCP 443  >  49334 [ACK] Seq=193189 Ack=6271 Win=65535 Len=1460 [TCP segment of a reassembled PDU],TCP 443  >  49334 [ACK] Seq=194649 Ack=6271 Win=65535 Len=1460 [TCP segment of a reassembled PDU],"TCP 443  >  49334 [PSH, ACK] Seq=197569 Ack=6271 Win=65535 Len=1460 [TCP segment of a reassembled PDU]",TCP 49334  >  443 [ACK] Seq=6271 Ack=199029 Win=30660 Len=0,TCP 443  >  49334 [ACK] Seq=199029 Ack=6271 Win=65535 Len=1460 [TCP segment of a reassembled PDU],"TCP 443  >  49334 [PSH, ACK] Seq=201949 Ack=6271 Win=65535 Len=1460 [TCP segment of a reassembled PDU]",TCP 49334  >  443 [ACK] Seq=6271 Ack=203409 Win=26280 Len=0,TCP 443  >  49334 [ACK] Seq=203409 Ack=6271 Win=65535 Len=1460 [TCP segment of a reassembled PDU],TCP 443  >  49334 [ACK] Seq=206329 Ack=6271 Win=65535 Len=1460 [TCP segment of a reassembled PDU],TCP 443  >  49334 [ACK] Seq=209249 Ack=6271 Win=65535 Len=1460 [TCP segment of a reassembled PDU],"TCP 443  >  49334 [PSH, ACK] Seq=210709 Ack=6271 Win=65535 Len=1460 [TCP segment of a reassembled PDU]",TCP 49334  >  443 [ACK] Seq=6271 Ack=213629 Win=16060 Len=0,TCP 443  >  49334 [ACK] Seq=213629 Ack=6271 Win=65535 Len=1460 [TCP segment of a reassembled PDU],TCP 443  >  49334 [ACK] Seq=215089 Ack=6271 Win=65535 Len=1460 [TCP segment of a reassembled PDU],"TCP 443  >  49334 [PSH, ACK] Seq=218009 Ack=6271 Win=65535 Len=1460 [TCP segment of a reassembled PDU]",TCP 49334  >  443 [ACK] Seq=6271 Ack=219469 Win=10220 Len=0,TCP 443  >  49334 [ACK] Seq=219469 Ack=6271 Win=65535 Len=1460 [TCP segment of a reassembled PDU],TCP 443  >  49334 [ACK] Seq=222389 Ack=6271 Win=65535 Len=1460 [TCP segment of a reassembled PDU],TCP 443  >  49334 [ACK] Seq=223849 Ack=6271 Win=65535 Len=1460 [TCP segment of a reassembled PDU],"TCP 443  >  49334 [PSH, ACK] Seq=226769 Ack=6271 Win=65535 Len=1460 [TCP segment of a reassembled PDU]",TCP 49334  >  443 [ACK] Seq=6271 Ack=228229 Win=1460 Len=0,TCP 49334  >  443 [ACK] Seq=6271 Ack=229689 Win=3472 Len=0,TCP 443  >  49334 [ACK] Seq=229689 Ack=6271 Win=65535 Len=1460 [TCP segment of a reassembled PDU],TCP 443  >  49334 [ACK] Seq=231149 Ack=6271 Win=65535 Len=1460 [TCP segment of a reassembled PDU],TCP 49334  >  443 [ACK] Seq=6271 Ack=232609 Win=552 Len=0,TCP [TCP Window Update] 49334  >  443 [ACK] Seq=6271 Ack=232609 Win=61320 Len=0,TCP 443  >  49334 [ACK] Seq=234069 Ack=6271 Win=65535 Len=1460 [TCP segment of a reassembled PDU],TCP 443  >  49334 [ACK] Seq=235529 Ack=6271 Win=65535 Len=1460 [TCP segment of a reassembled PDU],TCP 443  >  49334 [ACK] Seq=238449 Ack=6271 Win=65535 Len=1460 [TCP segment of a reassembled PDU],TCP 443  >  49334 [ACK] Seq=239909 Ack=6271 Win=65535 Len=1460 [TCP segment of a reassembled PDU],TCP 443  >  49334 [ACK] Seq=242829 Ack=6271 Win=65535 Len=1460 [TCP segment of a reassembled PDU],TCP 443  >  49334 [ACK] Seq=244289 Ack=6271 Win=65535 Len=1460 [TCP segment of a reassembled PDU],TCP 443  >  49334 [ACK] Seq=247209 Ack=6271 Win=65535 Len=1460 [TCP segment of a reassembled PDU],TCP 443  >  49334 [ACK] Seq=250129 Ack=6271 Win=65535 Len=1460 [TCP segment of a reassembled PDU],TCP 443  >  49334 [ACK] Seq=251589 Ack=6271 Win=65535 Len=1460 [TCP segment of a reassembled PDU],TCP 443  >  49334 [ACK] Seq=254509 Ack=6271 Win=65535 Len=1460 [TCP segment of a reassembled PDU],TCP 443  >  49334 [ACK] Seq=255969 Ack=6271 Win=65535 Len=1460 [TCP segment of a reassembled PDU],TCP 443  >  49334 [ACK] Seq=258889 Ack=6271 Win=65535 Len=1460 [TCP segment of a reassembled PDU],TCP 443  >  49334 [ACK] Seq=260349 Ack=6271 Win=65535 Len=1460 [TCP segment of a reassembled PDU],"TLSv1.2 Application Data, Application Data, Application Data",TCP 443  >  49334 [ACK] Seq=263269 Ack=6271 Win=65535 Len=1460 [TCP segment of a reassembled PDU],TCP 443  >  49334 [ACK] Seq=264729 Ack=6271 Win=65535 Len=1460 [TCP segment of a reassembled PDU],TCP 443  >  49334 [ACK] Seq=267649 Ack=6271 Win=65535 Len=1460 [TCP segment of a reassembled PDU],TCP 443  >  49334 [ACK] Seq=269109 Ack=6271 Win=65535 Len=1460 [TCP segment of a reassembled PDU],TCP 443  >  49334 [ACK] Seq=272029 Ack=6271 Win=65535 Len=1460 [TCP segment of a reassembled PDU],TCP 443  >  49334 [ACK] Seq=273489 Ack=6271 Win=65535 Len=1460 [TCP segment of a reassembled PDU],TCP 443  >  49334 [ACK] Seq=276409 Ack=6271 Win=65535 Len=1460 [TCP segment of a reassembled PDU],TCP 443  >  49334 [ACK] Seq=280789 Ack=6271 Win=65535 Len=1460 [TCP segment of a reassembled PDU],TCP 443  >  49334 [ACK] Seq=283709