"No.","Time","Source","Destination","Protocol","Length","Info"
"1","0.000000","162.159.133.234","10.192.58.175","TLSv1.2","170","Application Data"
"2","0.000000","162.159.133.234","10.192.58.175","TLSv1.2","97","Application Data"
"3","0.000000","162.159.133.234","10.192.58.175","TLSv1.2","118","Application Data"
"4","0.000064","10.192.58.175","162.159.133.234","TCP","54","55816  >  443 [ACK] Seq=1 Ack=224 Win=511 Len=0"
"5","0.409451","162.159.133.234","10.192.58.175","TLSv1.2","108","Application Data"
"6","0.452279","10.192.58.175","162.159.133.234","TCP","54","55816  >  443 [ACK] Seq=1 Ack=278 Win=511 Len=0"
"7","1.508381","10.192.58.175","129.207.7.31","DNS","78","Standard query 0xc3b2 A ecourses.pvamu.edu"
"8","1.512777","129.207.7.31","10.192.58.175","DNS","238","Standard query response 0xc3b2 A ecourses.pvamu.edu CNAME pvamu-vanity.instructure.com CNAME canvas-iad-prod-c271-1173765693.us-east-1.elb.amazonaws.com A 54.197.203.68 A 3.217.44.218 A 18.208.51.192"
"9","1.513701","10.192.58.175","54.197.203.68","TCP","66","58588  >  443 [SYN] Seq=0 Win=64240 Len=0 MSS=1460 WS=256 SACK_PERM=1"
"10","1.556102","54.197.203.68","10.192.58.175","TCP","66","443  >  58588 [SYN, ACK] Seq=0 Ack=1 Win=26883 Len=0 MSS=1250 SACK_PERM=1 WS=256"
"11","1.556439","10.192.58.175","54.197.203.68","TCP","54","58588  >  443 [ACK] Seq=1 Ack=1 Win=131072 Len=0"
"12","1.557327","10.192.58.175","54.197.203.68","TLSv1.2","571","Client Hello"
"13","1.599699","54.197.203.68","10.192.58.175","TCP","54","443  >  58588 [ACK] Seq=1 Ack=518 Win=28160 Len=0"
"14","1.601444","54.197.203.68","10.192.58.175","TLSv1.2","3804","Server Hello"
"15","1.601444","54.197.203.68","10.192.58.175","TLSv1.2","759","Certificate, Server Key Exchange, Server Hello Done"
"16","1.601506","10.192.58.175","54.197.203.68","TCP","54","58588  >  443 [ACK] Seq=518 Ack=4456 Win=131072 Len=0"
"17","1.602070","10.192.58.175","54.197.203.68","TLSv1.2","180","Client Key Exchange, Change Cipher Spec, Encrypted Handshake Message"
"18","1.602246","10.192.58.175","54.197.203.68","TLSv1.2","153","Application Data"
"19","1.602546","10.192.58.175","54.197.203.68","TLSv1.2","2124","Application Data"
"20","1.602608","10.192.58.175","54.197.203.68","TLSv1.2","178","Application Data"
"21","1.646207","54.197.203.68","10.192.58.175","TCP","54","443  >  58588 [ACK] Seq=4456 Ack=743 Win=28160 Len=0"
"22","1.646207","54.197.203.68","10.192.58.175","TLSv1.2","105","Change Cipher Spec, Encrypted Handshake Message"
"23","1.646207","54.197.203.68","10.192.58.175","TLSv1.2","132","Application Data"
"24","1.646282","10.192.58.175","54.197.203.68","TCP","54","58588  >  443 [ACK] Seq=2937 Ack=4585 Win=131072 Len=0"
"25","1.646537","54.197.203.68","10.192.58.175","TCP","54","443  >  58588 [ACK] Seq=4585 Ack=2813 Win=64000 Len=0"
"26","1.646603","10.192.58.175","54.197.203.68","TLSv1.2","92","Application Data"
"27","1.688558","54.197.203.68","10.192.58.175","TLSv1.2","389","Application Data"
"28","1.701446","54.197.203.68","10.192.58.175","TLSv1.2","392","Application Data"
"29","1.701506","10.192.58.175","54.197.203.68","TCP","54","58588  >  443 [ACK] Seq=2975 Ack=5258 Win=130304 Len=0"
"30","2.530753","10.192.58.175","142.250.114.188","TCP","55","51946  >  5228 [ACK] Seq=1 Ack=1 Win=510 Len=1"
"31","2.571644","142.250.114.188","10.192.58.175","TCP","66","5228  >  51946 [ACK] Seq=1 Ack=2 Win=265 Len=0 SLE=1 SRE=2"
"32","3.993582","104.192.142.11","10.192.58.175","TLSv1.2","154","Application Data"
"33","3.993729","10.192.58.175","104.192.142.11","TLSv1.2","158","Application Data"
"34","4.036180","104.192.142.11","10.192.58.175","TCP","54","443  >  51249 [ACK] Seq=101 Ack=105 Win=155 Len=0"
"35","4.091942","10.192.58.175","129.207.7.31","DNS","79","Standard query 0xc8a4 A sitecheck.opera.com"
"36","4.125290","10.192.58.175","129.207.7.31","DNS","79","Standard query 0xc8a4 A sitecheck.opera.com"
"37","4.128466","129.207.7.31","10.192.58.175","DNS","206","Standard query response 0xc8a4 A sitecheck.opera.com CNAME sitecheck.geo.opera.com CNAME lati-sitecheck.opera.com CNAME lati.lb.opera.technology A 107.167.110.211 A 107.167.110.216"
"38","4.131169","10.192.58.175","107.167.110.211","TCP","66","58589  >  443 [SYN] Seq=0 Win=64240 Len=0 MSS=1460 WS=256 SACK_PERM=1"
"39","4.164150","107.167.110.211","10.192.58.175","TCP","66","443  >  58589 [SYN, ACK] Seq=0 Ack=1 Win=42340 Len=0 MSS=1250 SACK_PERM=1 WS=512"
"40","4.164536","10.192.58.175","107.167.110.211","TCP","54","58589  >  443 [ACK] Seq=1 Ack=1 Win=131072 Len=0"
"41","4.165189","10.192.58.175","107.167.110.211","TLSv1.3","571","Client Hello"
"42","4.197905","107.167.110.211","10.192.58.175","TCP","54","443  >  58589 [ACK] Seq=1 Ack=518 Win=42496 Len=0"
"43","4.200403","107.167.110.211","10.192.58.175","TLSv1.3","2554","Server Hello, Change Cipher Spec, Application Data"
"44","4.200403","107.167.110.211","10.192.58.175","TLSv1.3","696","Application Data, Application Data, Application Data"
"45","4.200520","10.192.58.175","107.167.110.211","TCP","54","58589  >  443 [ACK] Seq=518 Ack=3143 Win=131072 Len=0"
"46","4.201194","10.192.58.175","107.167.110.211","TLSv1.3","134","Change Cipher Spec, Application Data"
"47","4.201441","10.192.58.175","107.167.110.211","TLSv1.3","464","Application Data"
"48","4.201505","10.192.58.175","107.167.110.211","TLSv1.3","139","Application Data"
"49","4.233816","107.167.110.211","10.192.58.175","TCP","54","443  >  58589 [ACK] Seq=3143 Ack=1093 Win=42496 Len=0"
"50","4.243601","107.167.110.211","10.192.58.175","TLSv1.3","360","Application Data"
"51","4.296821","10.192.58.175","107.167.110.211","TCP","54","58589  >  443 [ACK] Seq=1093 Ack=3449 Win=130816 Len=0"
"52","4.724080","10.192.58.175","107.167.110.211","TLSv1.3","464","Application Data"
"53","4.725010","10.192.58.175","107.167.110.211","TLSv1.3","134","Application Data"
"54","4.758685","107.167.110.211","10.192.58.175","TCP","54","443  >  58589 [ACK] Seq=3449 Ack=1583 Win=42496 Len=0"
"55","4.770979","107.167.110.211","10.192.58.175","TCP","1304","443  >  58589 [ACK] Seq=3449 Ack=1583 Win=42496 Len=1250 [TCP segment of a reassembled PDU]"
"56","4.770979","107.167.110.211","10.192.58.175","TLSv1.3","609","Application Data"
"57","4.771053","10.192.58.175","107.167.110.211","TCP","54","58589  >  443 [ACK] Seq=1583 Ack=5254 Win=131072 Len=0"
"58","4.817936","10.192.58.175","129.207.7.31","DNS","83","Standard query 0x079d A github.githubassets.com"
"59","4.817936","10.192.58.175","129.207.7.31","DNS","70","Standard query 0x98fb A github.com"
"60","4.821795","129.207.7.31","10.192.58.175","DNS","147","Standard query response 0x079d A github.githubassets.com A 185.199.110.154 A 185.199.111.154 A 185.199.108.154 A 185.199.109.154"
"61","4.829512","10.192.58.175","185.199.110.154","TCP","66","58590  >  443 [SYN] Seq=0 Win=64240 Len=0 MSS=1460 WS=256 SACK_PERM=1"
"62","4.832339","129.207.7.31","10.192.58.175","DNS","86","Standard query response 0x98fb A github.com A 140.82.112.4"
"63","4.833155","185.199.110.154","10.192.58.175","TCP","66","443  >  58590 [SYN, ACK] Seq=0 Ack=1 Win=65535 Len=0 MSS=1250 SACK_PERM=1 WS=512"
"64","4.833266","10.192.58.175","185.199.110.154","TCP","54","58590  >  443 [ACK] Seq=1 Ack=1 Win=131072 Len=0"
"65","4.833493","10.192.58.175","185.199.110.154","TLSv1.3","571","Client Hello"
"66","4.833821","10.192.58.175","140.82.112.4","TCP","66","58591  >  443 [SYN] Seq=0 Win=64240 Len=0 MSS=1460 WS=256 SACK_PERM=1"
"67","4.837589","185.199.110.154","10.192.58.175","TCP","54","443  >  58590 [ACK] Seq=1 Ack=518 Win=147456 Len=0"
"68","4.840062","185.199.110.154","10.192.58.175","TLSv1.3","3804","Server Hello, Change Cipher Spec, Application Data, Application Data"
"69","4.840062","185.199.110.154","10.192.58.175","TLSv1.3","503","Application Data, Application Data, Application Data"
"70","4.840197","10.192.58.175","185.199.110.154","TCP","54","58590  >  443 [ACK] Seq=518 Ack=4200 Win=131072 Len=0"
"71","4.866648","140.82.112.4","10.192.58.175","TCP","66","443  >  58591 [SYN, ACK] Seq=0 Ack=1 Win=65535 Len=0 MSS=1250 SACK_PERM=1 WS=1024"
"72","4.866820","10.192.58.175","140.82.112.4","TCP","54","58591  >  443 [ACK] Seq=1 Ack=1 Win=131072 Len=0"
"73","4.867235","10.192.58.175","140.82.112.4","TLSv1.3","571","Client Hello"
"74","4.871512","10.192.58.175","185.199.110.154","TLSv1.3","118","Change Cipher Spec, Application Data"
"75","4.874868","185.199.110.154","10.192.58.175","TCP","54","443  >  58590 [ACK] Seq=4200 Ack=582 Win=147456 Len=0"
"76","4.880613","10.192.58.175","129.207.7.31","DNS","89","Standard query 0x9f3b A avatars.githubusercontent.com"
"77","4.880752","162.159.133.234","10.192.58.175","TLSv1.2","138","Application Data"
"78","4.881062","10.192.58.175","185.199.110.154","TCP","66","58592  >  443 [SYN] Seq=0 Win=64240 Len=0 MSS=1460 WS=256 SACK_PERM=1"
"79","4.893181","129.207.7.31","10.192.58.175","DNS","153","Standard query response 0x9f3b A avatars.githubusercontent.com A 185.199.108.133 A 185.199.109.133 A 185.199.110.133 A 185.199.111.133"
"80","4.893181","185.199.110.154","10.192.58.175","TCP","66","443  >  58592 [SYN, ACK] Seq=0 Ack=1 Win=65535 Len=0 MSS=1250 SACK_PERM=1 WS=512"
"81","4.893464","10.192.58.175","185.199.110.154","TCP","54","58592  >  443 [ACK] Seq=1 Ack=1 Win=131072 Len=0"
"82","4.894857","10.192.58.175","185.199.110.154","TLSv1.3","571","Client Hello"
"83","4.901764","140.82.112.4","10.192.58.175","TLSv1.3","2554","Server Hello, Change Cipher Spec, Application Data"
"84","4.901764","140.82.112.4","10.192.58.175","TLSv1.3","367","Application Data, Application Data, Application Data"
"85","4.901871","10.192.58.175","140.82.112.4","TCP","54","58591  >  443 [ACK] Seq=518 Ack=2814 Win=131072 Len=0"
"86","4.904967","10.192.58.175","185.199.108.133","TCP","66","58593  >  443 [SYN] Seq=0 Win=64240 Len=0 MSS=1460 WS=256 SACK_PERM=1"
"87","4.907808","185.199.110.154","10.192.58.175","TCP","54","443  >  58592 [ACK] Seq=1 Ack=518 Win=147456 Len=0"
"88","4.910665","185.199.110.154","10.192.58.175","TLSv1.3","3804","Server Hello, Change Cipher Spec, Application Data, Application Data"
"89","4.910665","185.199.110.154","10.192.58.175","TLSv1.3","503","Application Data, Application Data, Application Data"
"90","4.911237","10.192.58.175","185.199.110.154","TCP","54","58592  >  443 [ACK] Seq=518 Ack=4200 Win=131072 Len=0"
"91","4.912561","10.192.58.175","185.199.110.154","TLSv1.3","118","Change Cipher Spec, Application Data"
"92","4.917260","185.199.108.133","10.192.58.175","TCP","66","443  >  58593 [SYN, ACK] Seq=0 Ack=1 Win=65535 Len=0 MSS=1250 SACK_PERM=1 WS=512"
"93","4.917703","10.192.58.175","185.199.108.133","TCP","54","58593  >  443 [ACK] Seq=1 Ack=1 Win=131072 Len=0"
"94","4.918430","10.192.58.175","185.199.108.133","TLSv1.3","571","Client Hello"
"95","4.924954","185.199.110.154","10.192.58.175","TCP","54","443  >  58592 [ACK] Seq=4200 Ack=582 Win=147456 Len=0"
"96","4.930725","185.199.108.133","10.192.58.175","TCP","54","443  >  58593 [ACK] Seq=1 Ack=518 Win=147456 Len=0"
"97","4.933964","185.199.108.133","10.192.58.175","TLSv1.3","3804","Server Hello, Change Cipher Spec, Application Data, Application Data"
"98","4.933964","185.199.108.133","10.192.58.175","TLSv1.3","573","Application Data, Application Data, Application Data"
"99","4.934289","10.192.58.175","185.199.108.133","TCP","54","58593  >  443 [ACK] Seq=518 Ack=4270 Win=131072 Len=0"
"100","4.935284","10.192.58.175","162.159.133.234","TCP","54","55816  >  443 [ACK] Seq=1 Ack=362 Win=511 Len=0"
"101","4.976276","10.192.58.175","129.207.7.31","DNS","89","Standard query 0x1a7e A github-cloud.s3.amazonaws.com"
"102","4.990459","129.207.7.31","10.192.58.175","DNS","155","Standard query response 0x1a7e A github-cloud.s3.amazonaws.com CNAME s3-1-w.amazonaws.com CNAME s3-w.us-east-1.amazonaws.com A 52.216.29.204"
"103","5.001698","10.192.58.175","140.82.112.4","TLSv1.3","118","Change Cipher Spec, Application Data"
"104","5.002550","10.192.58.175","185.199.108.133","TLSv1.3","118","Change Cipher Spec, Application Data"
"105","5.014368","185.199.108.133","10.192.58.175","TCP","54","443  >  58593 [ACK] Seq=4270 Ack=582 Win=147456 Len=0"
"106","5.014935","10.192.58.175","129.207.7.31","DNS","93","Standard query 0xc065 A user-images.githubusercontent.com"
"107","5.028317","129.207.7.31","10.192.58.175","DNS","157","Standard query response 0xc065 A user-images.githubusercontent.com A 185.199.110.133 A 185.199.111.133 A 185.199.108.133 A 185.199.109.133"
"108","5.035016","140.82.112.4","10.192.58.175","TLSv1.3","212","Application Data, Application Data"
"109","5.035112","10.192.58.175","140.82.112.4","TCP","54","58591  >  443 [ACK] Seq=582 Ack=2972 Win=131072 Len=0"
"110","5.066121","10.192.58.175","185.199.108.133","TLSv1.3","146","Application Data"
"111","5.066444","10.192.58.175","185.199.108.133","TLSv1.3","572","Application Data"
"112","5.066508","10.192.58.175","185.199.108.133","TLSv1.3","197","Application Data"
"113","5.066549","10.192.58.175","185.199.108.133","TLSv1.3","173","Application Data"
"114","5.078457","185.199.108.133","10.192.58.175","TCP","54","443  >  58593 [ACK] Seq=4270 Ack=674 Win=147456 Len=0"
"115","5.078457","185.199.108.133","10.192.58.175","TLSv1.3","113","Application Data"
"116","5.079143","185.199.108.133","10.192.58.175","TCP","54","443  >  58593 [ACK] Seq=4329 Ack=1192 Win=148480 Len=0"
"117","5.079143","185.199.108.133","10.192.58.175","TCP","54","443  >  58593 [ACK] Seq=4329 Ack=1335 Win=149504 Len=0"
"118","5.079143","185.199.108.133","10.192.58.175","TCP","54","443  >  58593 [ACK] Seq=4329 Ack=1454 Win=149504 Len=0"
"119","5.079178","10.192.58.175","185.199.108.133","TLSv1.3","85","Application Data"
"120","5.081599","185.199.108.133","10.192.58.175","TLSv1.3","377","Application Data"
"121","5.081599","185.199.108.133","10.192.58.175","TLSv1.3","217","Application Data"
"122","5.082424","185.199.108.133","10.192.58.175","TLSv1.3","217","Application Data"
"123","5.091349","10.192.58.175","185.199.108.133","TCP","54","58593  >  443 [ACK] Seq=1485 Ack=4978 Win=130304 Len=0"
"124","5.091741","185.199.108.133","10.192.58.175","TCP","54","443  >  58593 [ACK] Seq=4978 Ack=1485 Win=149504 Len=0"
"125","5.171661","10.192.58.175","52.10.227.191","TLSv1.2","133","Application Data"
"126","5.231009","52.10.227.191","10.192.58.175","TCP","54","443  >  52082 [ACK] Seq=1 Ack=80 Win=308 Len=0"
"127","5.320796","10.192.58.175","140.82.112.4","TLSv1.3","146","Application Data"
"128","5.321067","10.192.58.175","140.82.112.4","TLSv1.3","1473","Application Data"
"129","5.355405","140.82.112.4","10.192.58.175","TLSv1.3","112","Application Data"
"130","5.355405","140.82.112.4","10.192.58.175","TCP","54","443  >  58591 [ACK] Seq=3030 Ack=2093 Win=71680 Len=0"
"131","5.355727","10.192.58.175","140.82.112.4","TLSv1.3","85","Application Data"
"132","5.408910","140.82.112.4","10.192.58.175","TCP","1304","443  >  58591 [ACK] Seq=3030 Ack=2124 Win=71680 Len=1250 [TCP segment of a reassembled PDU]"
"133","5.408910","140.82.112.4","10.192.58.175","TLSv1.3","196","Application Data"
"134","5.408910","140.82.112.4","10.192.58.175","TCP","1304","443  >  58591 [ACK] Seq=4422 Ack=2124 Win=71680 Len=1250 [TCP segment of a reassembled PDU]"
"135","5.408910","140.82.112.4","10.192.58.175","TLSv1.3","196","Application Data"
"136","5.408910","140.82.112.4","10.192.58.175","TLSv1.3","407","Application Data"
"137","5.409048","10.192.58.175","140.82.112.4","TCP","54","58591  >  443 [ACK] Seq=2124 Ack=6167 Win=131072 Len=0"
"138","5.462941","fe80::8898:c0b9:a59e:2fb1","ff02::1","ICMPv6","86","Neighbor Advertisement fe80::8898:c0b9:a59e:2fb1 (ovr) is at e0:0a:f6:93:89:2b"
"139","5.462941","fe80::8898:c0b9:a59e:2fb1","ff02::1","ICMPv6","86","Neighbor Advertisement fe80::8898:c0b9:a59e:2fb1 (ovr) is at e0:0a:f6:93:89:2b"
"140","5.469241","10.192.58.175","107.167.110.211","TLSv1.3","464","Application Data"
"141","5.469702","10.192.58.175","107.167.110.211","TLSv1.3","144","Application Data"
"142","5.512680","107.167.110.211","10.192.58.175","TCP","54","443  >  58589 [ACK] Seq=5254 Ack=2083 Win=42496 Len=0"
"143","5.512680","107.167.110.211","10.192.58.175","TLSv1.3","365","Application Data"
"144","5.559840","10.192.58.175","107.167.110.211","TCP","54","58589  >  443 [ACK] Seq=2083 Ack=5565 Win=130816 Len=0"
"145","5.784017","10.192.58.175","129.207.7.31","DNS","80","Standard query 0xc5d6 A packaging.python.org"
"146","5.786670","10.192.58.175","129.207.7.31","DNS","72","Standard query 0x7fa4 A af.opera.com"
"147","5.810301","10.192.58.175","129.207.7.31","DNS","80","Standard query 0xc5d6 A packaging.python.org"
"148","5.810301","10.192.58.175","129.207.7.31","DNS","72","Standard query 0x7fa4 A af.opera.com"
"149","5.815177","10.192.58.175","129.207.7.31","DNS","74","Standard query 0x08de A api.github.com"
"150","5.817098","129.207.7.31","10.192.58.175","DNS","140","Standard query response 0xc5d6 A packaging.python.org CNAME readthedocs.io A 104.17.32.82 A 104.17.33.82"
"151","5.820062","129.207.7.31","10.192.58.175","DNS","140","Standard query response 0xc5d6 A packaging.python.org CNAME readthedocs.io A 104.17.33.82 A 104.17.32.82"
"152","5.820113","10.192.58.175","129.207.7.31","ICMP","168","Destination unreachable (Port unreachable)"
"153","5.824207","10.192.58.175","129.207.7.31","DNS","80","Standard query 0x4b21 A collector.github.com"
"154","5.826492","129.207.7.31","10.192.58.175","DNS","185","Standard query response 0x7fa4 A af.opera.com CNAME af.geo.opera.com CNAME lati-af.opera.com CNAME lati.lb.opera.technology A 107.167.110.216 A 107.167.110.211"
"155","5.827915","10.192.58.175","104.17.32.82","QUIC","1292","Initial, DCID=ea285590d870eb7b, PKN: 1, PADDING, CRYPTO, PADDING, PING, PADDING, CRYPTO, PING, PING, PING, PADDING, PING, PADDING"
"156","5.828460","10.192.58.175","107.167.110.216","TCP","66","58594  >  443 [SYN] Seq=0 Win=64240 Len=0 MSS=1460 WS=256 SACK_PERM=1"
"157","5.830334","10.192.58.175","140.82.112.4","TLSv1.3","797","Application Data"
"158","5.830463","10.192.58.175","140.82.112.4","TLSv1.3","215","Application Data"
"159","5.830512","10.192.58.175","140.82.112.4","TLSv1.3","205","Application Data"
"160","5.830558","10.192.58.175","140.82.112.4","TLSv1.3","179","Application Data"
"161","5.830606","10.192.58.175","140.82.112.4","TLSv1.3","201","Application Data"
"162","5.830653","10.192.58.175","140.82.112.4","TLSv1.3","175","Application Data"
"163","5.831220","10.192.58.175","140.82.112.4","TLSv1.3","160","Application Data"
"164","5.831295","10.192.58.175","140.82.112.4","TLSv1.3","170","Application Data"
"165","5.831401","10.192.58.175","140.82.112.4","TLSv1.3","144","Application Data"
"166","5.835048","10.192.58.175","129.207.7.31","DNS","80","Standard query 0x4b21 A collector.github.com"
"167","5.835048","10.192.58.175","129.207.7.31","DNS","74","Standard query 0x08de A api.github.com"
"168","5.844543","129.207.7.31","10.192.58.175","DNS","129","Standard query response 0x4b21 A collector.github.com CNAME glb-db52c2cf8be544.github.com A 140.82.112.21"
"169","5.844543","129.207.7.31","10.192.58.175","DNS","90","Standard query response 0x08de A api.github.com A 140.82.114.6"
"170","5.844543","129.207.7.31","10.192.58.175","DNS","129","Standard query response 0x4b21 A collector.github.com CNAME glb-db52c2cf8be544.github.com A 140.82.112.21"
"171","5.847040","10.192.58.175","140.82.114.6","TCP","66","58595  >  443 [SYN] Seq=0 Win=64240 Len=0 MSS=1460 WS=256 SACK_PERM=1"
"172","5.847295","10.192.58.175","140.82.112.21","TCP","66","58596  >  443 [SYN] Seq=0 Win=64240 Len=0 MSS=1460 WS=256 SACK_PERM=1"
"173","5.863986","107.167.110.216","10.192.58.175","TCP","58","443  >  58594 [SYN, ACK] Seq=0 Ack=1 Win=42340 Len=0 MSS=1250"
"174","5.864101","10.192.58.175","107.167.110.216","TCP","54","58594  >  443 [ACK] Seq=1 Ack=1 Win=64240 Len=0"
"175","5.864606","10.192.58.175","107.167.110.216","TLSv1.3","571","Client Hello"
"176","5.867824","10.192.58.175","129.207.7.31","DNS","76","Standard query 0x36d4 A alive.github.com"
"177","5.867962","140.82.112.4","10.192.58.175","TCP","54","443  >  58591 [ACK] Seq=6167 Ack=3179 Win=79872 Len=0"
"178","5.867962","140.82.112.4","10.192.58.175","TCP","54","443  >  58591 [ACK] Seq=6167 Ack=3451 Win=81920 Len=0"
"179","5.870905","140.82.112.4","10.192.58.175","TCP","54","443  >  58591 [ACK] Seq=6167 Ack=3884 Win=81920 Len=0"
"180","5.884925","140.82.112.21","10.192.58.175","TCP","66","443  >  58596 [SYN, ACK] Seq=0 Ack=1 Win=65535 Len=0 MSS=1250 SACK_PERM=1 WS=1024"
"181","5.884925","140.82.114.6","10.192.58.175","TCP","66","443  >  58595 [SYN, ACK] Seq=0 Ack=1 Win=65535 Len=0 MSS=1250 SACK_PERM=1 WS=1024"
"182","5.885062","10.192.58.175","140.82.112.21","TCP","54","58596  >  443 [ACK] Seq=1 Ack=1 Win=131072 Len=0"
"183","5.885130","10.192.58.175","140.82.114.6","TCP","54","58595  >  443 [ACK] Seq=1 Ack=1 Win=131072 Len=0"
"184","5.885262","10.192.58.175","140.82.112.21","TLSv1.3","571","Client Hello"
"185","5.885448","10.192.58.175","140.82.114.6","TLSv1.3","571","Client Hello"
"186","5.887206","10.192.58.175","129.207.7.31","DNS","76","Standard query 0x36d4 A alive.github.com"
"187","5.895784","129.207.7.31","10.192.58.175","DNS","111","Standard query response 0x36d4 A alive.github.com CNAME live.github.com A 140.82.114.25"
"188","5.896238","10.192.58.175","140.82.114.25","TCP","66","58597  >  443 [SYN] Seq=0 Win=64240 Len=0 MSS=1460 WS=256 SACK_PERM=1"
"189","5.901765","10.192.58.175","104.17.32.82","QUIC","1292","Initial, DCID=ea285590d870eb7b, PKN: 3, CRYPTO"
"190","5.903768","107.167.110.216","10.192.58.175","TCP","54","443  >  58594 [ACK] Seq=1 Ack=518 Win=42899 Len=0"
"191","5.908276","107.167.110.216","10.192.58.175","TLSv1.3","1662","Server Hello, Change Cipher Spec, Application Data"
"192","5.908357","10.192.58.175","107.167.110.216","TCP","54","58594  >  443 [ACK] Seq=518 Ack=1609 Win=65000 Len=0"
"193","5.917574","10.192.58.175","129.207.7.31","DNS","84","Standard query 0xf6c9 A www.googletagmanager.com"
"194","5.925991","140.82.114.6","10.192.58.175","TLSv1.3","2554","Server Hello, Change Cipher Spec, Application Data"
"195","5.925991","140.82.114.6","10.192.58.175","TLSv1.3","366","Application Data, Application Data, Application Data"
"196","5.926384","10.192.58.175","140.82.114.6","TCP","54","58595  >  443 [ACK] Seq=518 Ack=2813 Win=131072 Len=0"
"197","5.926963","140.82.112.21","10.192.58.175","TLSv1.3","2554","Server Hello, Change Cipher Spec, Application Data"
"198","5.926963","129.207.7.31","10.192.58.175","DNS","100","Standard query response 0xf6c9 A www.googletagmanager.com A 142.250.138.97"
"199","5.926963","140.82.112.21","10.192.58.175","TLSv1.3","1060","Application Data, Application Data, Application Data"
"200","5.927265","10.192.58.175","140.82.112.21","TCP","54","58596  >  443 [ACK] Seq=518 Ack=2501 Win=131072 Len=0"
"201","5.930731","10.192.58.175","142.250.138.97","TCP","66","58598  >  443 [SYN] Seq=0 Win=64240 Len=0 MSS=1460 WS=256 SACK_PERM=1"
"202","5.931295","140.82.112.4","10.192.58.175","TCP","1304","443  >  58591 [ACK] Seq=6167 Ack=3884 Win=81920 Len=1250 [TCP segment of a reassembled PDU]"
"203","5.931295","140.82.112.4","10.192.58.175","TLSv1.3","196","Application Data"
"204","5.931295","140.82.112.4","10.192.58.175","TCP","1304","443  >  58591 [ACK] Seq=7559 Ack=3884 Win=81920 Len=1250 [TCP segment of a reassembled PDU]"
"205","5.931295","140.82.112.4","10.192.58.175","TLSv1.3","196","Application Data"
"206","5.931295","140.82.112.4","10.192.58.175","TLSv1.3","340","Application Data"
"207","5.931662","10.192.58.175","140.82.112.4","TCP","54","58591  >  443 [ACK] Seq=3884 Ack=9237 Win=131072 Len=0"
"208","5.935319","140.82.114.25","10.192.58.175","TCP","66","443  >  58597 [SYN, ACK] Seq=0 Ack=1 Win=65535 Len=0 MSS=1250 SACK_PERM=1 WS=1024"
"209","5.935702","10.192.58.175","140.82.114.25","TCP","54","58597  >  443 [ACK] Seq=1 Ack=1 Win=131072 Len=0"
"210","5.938833","10.192.58.175","140.82.114.25","TLSv1.3","571","Client Hello"
"211","5.942473","10.192.58.175","140.82.112.21","TLSv1.3","118","Change Cipher Spec, Application Data"
"212","5.943242","10.192.58.175","140.82.112.21","TLSv1.3","146","Application Data"
"213","5.944583","10.192.58.175","140.82.114.6","TLSv1.3","118","Change Cipher Spec, Application Data"
"214","5.949112","10.192.58.175","140.82.112.21","TLSv1.3","732","Application Data"
"215","5.949605","10.192.58.175","140.82.112.21","TLSv1.3","1177","Application Data"
"216","5.951459","10.192.58.175","140.82.114.6","TLSv1.3","146","Application Data"
"217","5.957435","10.192.58.175","140.82.114.6","TLSv1.3","733","Application Data"
"218","5.957804","10.192.58.175","140.82.114.6","TLSv1.3","136","Application Data"
"219","5.959234","10.192.58.175","140.82.114.6","TLSv1.3","134","Application Data"
"220","5.959710","10.192.58.175","140.82.114.6","TLSv1.3","798","Application Data"
"221","5.959819","140.82.112.4","10.192.58.175","TCP","1304","443  >  58591 [ACK] Seq=9237 Ack=3884 Win=81920 Len=1250 [TCP segment of a reassembled PDU]"
"222","5.959819","140.82.112.4","10.192.58.175","TLSv1.3","196","Application Data"
"223","5.959819","140.82.112.4","10.192.58.175","TCP","1304","443  >  58591 [ACK] Seq=10629 Ack=3884 Win=81920 Len=1250 [TCP segment of a reassembled PDU]"
"224","5.959819","140.82.112.4","10.192.58.175","TLSv1.3","196","Application Data"
"225","5.959819","140.82.112.4","10.192.58.175","TLSv1.3","378","Application Data"
"226","5.959981","10.192.58.175","140.82.114.6","TCP","11304","58595  >  443 [ACK] Seq=2259 Ack=2813 Win=131072 Len=11250 [TCP segment of a reassembled PDU]"
"227","5.960029","10.192.58.175","140.82.112.4","TCP","54","58591  >  443 [ACK] Seq=3884 Ack=12345 Win=131072 Len=0"
"228","5.967451","10.192.58.175","129.207.7.31","DNS","75","Standard query 0x38c0 A readthedocs.org"
"229","5.971968","140.82.112.4","10.192.58.175","TLSv1.3","6304","Application Data, Application Data, Application Data, Application Data, Application Data"
"230","5.971968","140.82.112.4","10.192.58.175","TCP","1304","[TCP Previous segment not captured] 443  >  58591 [ACK] Seq=18704 Ack=3884 Win=81920 Len=1250 [TCP segment of a reassembled PDU]"
"231","5.971968","140.82.112.4","10.192.58.175","TLSv1.3","196","Application Data"
"232","5.971968","140.82.112.4","10.192.58.175","TCP","1304","443  >  58591 [ACK] Seq=20096 Ack=3884 Win=81920 Len=1250 [TCP segment of a reassembled PDU]"
"233","5.971968","140.82.112.4","10.192.58.175","TLSv1.3","196","Application Data"
"234","5.972316","10.192.58.175","140.82.112.4","TCP","66","58591  >  443 [ACK] Seq=3884 Ack=18595 Win=131072 Len=0 SLE=18704 SRE=19954"
"235","5.972560","10.192.58.175","140.82.112.4","TCP","66","[TCP Dup ACK 234#1] 58591  >  443 [ACK] Seq=3884 Ack=18595 Win=131072 Len=0 SLE=18704 SRE=20096"
"236","5.972647","10.192.58.175","140.82.112.4","TCP","66","[TCP Dup ACK 234#2] 58591  >  443 [ACK] Seq=3884 Ack=18595 Win=131072 Len=0 SLE=18704 SRE=21346"
"237","5.972703","10.192.58.175","140.82.112.4","TCP","66","[TCP Dup ACK 234#3] 58591  >  443 [ACK] Seq=3884 Ack=18595 Win=131072 Len=0 SLE=18704 SRE=21488"
"238","5.976434","10.192.58.175","129.207.7.31","DNS","79","Standard query 0x3a8a A media.ethicalads.io"
"239","5.976635","142.250.138.97","10.192.58.175","TCP","66","443  >  58598 [SYN, ACK] Seq=0 Ack=1 Win=65535 Len=0 MSS=1250 SACK_PERM=1 WS=256"
"240","5.976933","10.192.58.175","142.250.138.97","TCP","54","58598  >  443 [ACK] Seq=1 Ack=1 Win=131072 Len=0"
"241","5.977492","10.192.58.175","142.250.138.97","TLSv1.3","786","Client Hello"
"242","5.979783","140.82.114.25","10.192.58.175","TLSv1.3","1304","Server Hello, Change Cipher Spec, Application Data"
"243","5.982678","140.82.112.21","10.192.58.175","TLSv1.3","112","[TCP Previous segment not captured] , Application Data"
"244","5.983007","10.192.58.175","140.82.112.21","TCP","66","[TCP Dup ACK 211#1] 58596  >  443 [ACK] Seq=2475 Ack=3507 Win=130048 Len=0 SLE=3665 SRE=3723"
"245","5.986081","129.207.7.31","10.192.58.175","DNS","107","Standard query response 0x38c0 A readthedocs.org A 104.18.7.29 A 104.18.6.29"
"246","5.986081","140.82.114.6","10.192.58.175","TLSv1.3","212","Application Data, Application Data"
"247","5.986465","10.192.58.175","140.82.114.6","TCP","54","58595  >  443 [ACK] Seq=13509 Ack=2971 Win=131072 Len=0"
"248","5.989535","10.192.58.175","104.18.7.29","TCP","66","58599  >  443 [SYN] Seq=0 Win=64240 Len=0 MSS=1460 WS=256 SACK_PERM=1"
"249","5.989871","140.82.112.21","10.192.58.175","TCP","54","443  >  58596 [ACK] Seq=3723 Ack=1352 Win=68608 Len=0"
"250","5.989871","140.82.112.21","10.192.58.175","TCP","54","443  >  58596 [ACK] Seq=3723 Ack=2475 Win=70656 Len=0"
"251","5.989871","140.82.112.21","10.192.58.175","TLSv1.3","102","Application Data"
"252","5.990102","10.192.58.175","140.82.112.21","TCP","66","[TCP Dup ACK 211#2] 58596  >  443 [ACK] Seq=2475 Ack=3507 Win=130048 Len=0 SLE=3665 SRE=3771"
"253","5.991405","140.82.114.6","10.192.58.175","TLSv1.3","112","Application Data"
"254","5.997954","140.82.114.6","10.192.58.175","TCP","54","443  >  58595 [ACK] Seq=3029 Ack=1435 Win=68608 Len=0"
"255","5.997954","140.82.112.21","10.192.58.175","TLSv1.3","581","Application Data"
"256","5.997954","140.82.114.6","10.192.58.175","TCP","54","443  >  58595 [ACK] Seq=3029 Ack=2259 Win=69632 Len=0"
"257","5.997954","140.82.114.6","10.192.58.175","TCP","54","443  >  58595 [ACK] Seq=3029 Ack=3509 Win=72704 Len=0"
"258","5.997954","140.82.114.6","10.192.58.175","TCP","54","443  >  58595 [ACK] Seq=3029 Ack=4759 Win=75776 Len=0"
"259","5.997954","140.82.114.6","10.192.58.175","TCP","54","443  >  58595 [ACK] Seq=3029 Ack=6009 Win=77824 Len=0"
"260","5.997954","140.82.114.6","10.192.58.175","TCP","54","443  >  58595 [ACK] Seq=3029 Ack=7259 Win=80896 Len=0"
"261","5.997954","140.82.114.6","10.192.58.175","TCP","54","443  >  58595 [ACK] Seq=3029 Ack=8509 Win=83968 Len=0"
"262","5.997954","140.82.114.6","10.192.58.175","TCP","54","443  >  58595 [ACK] Seq=3029 Ack=9759 Win=87040 Len=0"
"263","5.997954","140.82.114.6","10.192.58.175","TCP","54","443  >  58595 [ACK] Seq=3029 Ack=11009 Win=90112 Len=0"
"264","5.997954","140.82.114.6","10.192.58.175","TLSv1.3","102","Application Data"
"265","5.997954","140.82.114.6","10.192.58.175","TCP","54","443  >  58595 [ACK] Seq=3077 Ack=13509 Win=95232 Len=0"
"266","5.998228","10.192.58.175","140.82.112.21","TCP","66","[TCP Dup ACK 211#3] 58596  >  443 [ACK] Seq=2475 Ack=3507 Win=130048 Len=0 SLE=3665 SRE=4298"
"267","5.998587","10.192.58.175","140.82.114.6","TLSv1.3","21891","Application Data, Application Data, Application Data, Application Data, Application Data"
"268","6.000238","140.82.112.4","10.192.58.175","TLSv1.3","7554","Application Data, Application Data, Application Data, Application Data, Application Data, Application Data"
"269","6.000238","140.82.112.4","10.192.58.175","TLSv1.3","781","Application Data, Application Data"
"270","6.000238","140.82.112.4","10.192.58.175","TCP","1304","443  >  58591 [ACK] Seq=29715 Ack=3884 Win=81920 Len=1250 [TCP segment of a reassembled PDU]"
"271","6.000238","140.82.112.4","10.192.58.175","TLSv1.3","196","Application Data"
"272","6.000493","10.192.58.175","140.82.112.4","TCP","66","[TCP Dup ACK 234#4] 58591  >  443 [ACK] Seq=3884 Ack=18595 Win=131072 Len=0 SLE=18704 SRE=28988"
"273","6.000603","10.192.58.175","140.82.112.4","TCP","66","[TCP Dup ACK 234#5] 58591  >  443 [ACK] Seq=3884 Ack=18595 Win=131072 Len=0 SLE=18704 SRE=29715"
"274","6.000633","10.192.58.175","140.82.112.4","TCP","66","[TCP Dup ACK 234#6] 58591  >  443 [ACK] Seq=3884 Ack=18595 Win=131072 Len=0 SLE=18704 SRE=30965"
"275","6.000666","10.192.58.175","140.82.112.4","TCP","66","[TCP Dup ACK 234#7] 58591  >  443 [ACK] Seq=3884 Ack=18595 Win=131072 Len=0 SLE=18704 SRE=31107"
"276","6.000753","104.18.7.29","10.192.58.175","TCP","66","443  >  58599 [SYN, ACK] Seq=0 Ack=1 Win=64240 Len=0 MSS=1250 SACK_PERM=1 WS=8192"
"277","6.000903","10.192.58.175","104.18.7.29","TCP","54","58599  >  443 [ACK] Seq=1 Ack=1 Win=131072 Len=0"
"278","6.001749","10.192.58.175","104.18.7.29","TLSv1.3","571","Client Hello"
"279","6.005956","140.82.112.4","10.192.58.175","TCP","1304","443  >  58591 [ACK] Seq=31107 Ack=3884 Win=81920 Len=1250 [TCP segment of a reassembled PDU]"
"280","6.005956","140.82.112.4","10.192.58.175","TLSv1.3","550","Application Data, Application Data"
"281","6.005956","140.82.112.4","10.192.58.175","TLSv1.3","163","[TCP Fast Retransmission] , Application Data"
"282","6.006021","10.192.58.175","140.82.112.4","TCP","66","[TCP Dup ACK 234#8] 58591  >  443 [ACK] Seq=3884 Ack=18595 Win=131072 Len=0 SLE=18704 SRE=32357"
"283","6.006080","10.192.58.175","140.82.112.4","TCP","66","[TCP Dup ACK 234#9] 58591  >  443 [ACK] Seq=3884 Ack=18595 Win=131072 Len=0 SLE=18704 SRE=32853"
"284","6.006116","10.192.58.175","140.82.112.4","TCP","54","58591  >  443 [ACK] Seq=3884 Ack=32853 Win=131072 Len=0"
"285","6.007192","10.192.58.175","129.207.7.31","DNS","79","Standard query 0x3a8a A media.ethicalads.io"
"286","6.008139","10.192.58.175","104.17.32.82","TCP","66","58600  >  443 [SYN] Seq=0 Win=64240 Len=0 MSS=1460 WS=256 SACK_PERM=1"
"287","6.011718","129.207.7.31","10.192.58.175","DNS","111","Standard query response 0x3a8a A media.ethicalads.io A 104.21.94.101 A 172.67.222.88"
"288","6.012579","10.192.58.175","104.21.94.101","QUIC","1292","Initial, DCID=7bbd0e974ee97d5d, PKN: 1, PADDING, CRYPTO, CRYPTO, CRYPTO, PADDING, CRYPTO, PADDING, PING, PING, CRYPTO, PADDING, PING, PADDING, PING, PING, PADDING, PING, CRYPTO"
"289","6.014238","104.18.7.29","10.192.58.175","TCP","54","443  >  58599 [ACK] Seq=1 Ack=518 Win=65536 Len=0"
"290","6.016498","142.250.138.97","10.192.58.175","TCP","54","443  >  58598 [ACK] Seq=1 Ack=733 Win=67072 Len=0"
"291","6.017977","140.82.114.6","10.192.58.175","TLSv1.3","981","Application Data"
"292","6.017977","142.250.138.97","10.192.58.175","TLSv1.3","389","Server Hello, Change Cipher Spec, Application Data"
"293","6.020849","104.18.7.29","10.192.58.175","TLSv1.3","2554","Server Hello, Change Cipher Spec"
"294","6.020849","104.18.7.29","10.192.58.175","TLSv1.3","987","Application Data"
"295","6.020849","104.17.32.82","10.192.58.175","TCP","66","443  >  58600 [SYN, ACK] Seq=0 Ack=1 Win=64240 Len=0 MSS=1250 SACK_PERM=1 WS=8192"
"296","6.021108","10.192.58.175","104.18.7.29","TCP","54","58599  >  443 [ACK] Seq=518 Ack=3434 Win=131072 Len=0"
"297","6.021562","10.192.58.175","104.17.32.82","TCP","54","58600  >  443 [ACK] Seq=1 Ack=1 Win=131072 Len=0"
"298","6.022363","10.192.58.175","104.17.32.82","TLSv1.3","571","Client Hello"
"299","6.030065","10.192.58.175","142.250.138.97","TLSv1.3","128","Change Cipher Spec, Application Data"
"300","6.030378","10.192.58.175","142.250.138.97","TLSv1.3","146","Application Data"
"301","6.030867","10.192.58.175","142.250.138.97","TLSv1.3","504","Application Data"
"302","6.030985","140.82.112.21","10.192.58.175","TCP","212","[TCP Out-Of-Order] 443  >  58596 [PSH, ACK] Seq=3507 Ack=2475 Win=70656 Len=158"
"303","6.031077","10.192.58.175","140.82.112.21","TCP","54","58596  >  443 [ACK] Seq=2475 Ack=4298 Win=131072 Len=0"
"304","6.031882","10.192.58.175","140.82.112.21","TLSv1.3","85","Application Data"
"305","6.032720","10.192.58.175","140.82.114.25","TCP","54","58597  >  443 [ACK] Seq=518 Ack=1251 Win=131072 Len=0"
"306","6.033108","104.17.32.82","10.192.58.175","TCP","54","443  >  58600 [ACK] Seq=1 Ack=518 Win=65536 Len=0"
"307","6.033752","140.82.114.6","10.192.58.175","TCP","54","443  >  58595 [ACK] Seq=4004 Ack=16009 Win=101376 Len=0"
"308","6.035112","140.82.114.6","10.192.58.175","TCP","54","443  >  58595 [ACK] Seq=4004 Ack=18509 Win=106496 Len=0"
"309","6.035112","140.82.114.6","10.192.58.175","TCP","54","443  >  58595 [ACK] Seq=4004 Ack=21009 Win=112640 Len=0"
"310","6.035112","140.82.114.6","10.192.58.175","TCP","54","443  >  58595 [ACK] Seq=4004 Ack=23509 Win=118784 Len=0"
"311","6.036582","140.82.114.6","10.192.58.175","TCP","54","443  >  58595 [ACK] Seq=4004 Ack=26009 Win=123904 Len=0"
"312","6.036582","140.82.114.6","10.192.58.175","TCP","54","443  >  58595 [ACK] Seq=4004 Ack=28509 Win=130048 Len=0"
"313","6.036582","140.82.114.6","10.192.58.175","TLSv1.3","115","Application Data"
"314","6.036582","140.82.114.6","10.192.58.175","TCP","54","443  >  58595 [ACK] Seq=4065 Ack=31009 Win=135168 Len=0"
"315","6.036582","140.82.114.6","10.192.58.175","TCP","54","443  >  58595 [ACK] Seq=4065 Ack=33509 Win=141312 Len=0"
"316","6.036582","140.82.114.6","10.192.58.175","TCP","54","443  >  58595 [ACK] Seq=4065 Ack=35346 Win=146432 Len=0"
"317","6.036752","10.192.58.175","140.82.114.6","TCP","54","58595  >  443 [ACK] Seq=35346 Ack=4065 Win=131072 Len=0"
"318","6.036960","140.82.114.6","10.192.58.175","TLSv1.3","115","Application Data"
"319","6.038135","10.192.58.175","185.199.108.133","TLSv1.3","147","Application Data"
"320","6.038179","140.82.112.4","10.192.58.175","TCP","1304","443  >  58591 [ACK] Seq=32853 Ack=3884 Win=81920 Len=1250 [TCP segment of a reassembled PDU]"
"321","6.038806","104.17.32.82","10.192.58.175","TLSv1.3","1304","Server Hello, Change Cipher Spec"
"322","6.038806","104.17.32.82","10.192.58.175","TLSv1.3","726","Application Data"
"323","6.038904","10.192.58.175","104.17.32.82","TCP","54","58600  >  443 [ACK] Seq=518 Ack=1923 Win=131072 Len=0"
"324","6.040011","140.82.112.4","10.192.58.175","TLSv1.3","1304","Application Data [TCP segment of a reassembled PDU]"
"325","6.040011","140.82.112.4","10.192.58.175","TLSv1.3","740","Application Data, Application Data"
"326","6.040090","10.192.58.175","140.82.112.4","TCP","54","58591  >  443 [ACK] Seq=3884 Ack=36039 Win=131072 Len=0"
"327","6.040158","10.192.58.175","140.82.112.4","TLSv1.3","785","Application Data"
"328","6.050183","185.199.108.133","10.192.58.175","TCP","54","443  >  58593 [ACK] Seq=4978 Ack=1578 Win=149504 Len=0"
"329","6.053437","185.199.108.133","10.192.58.175","TLSv1.3","213","Application Data"
"330","6.053886","10.192.58.175","104.17.32.82","QUIC","1292","Initial, DCID=ea285590d870eb7b, PKN: 5, CRYPTO, PADDING, PING, PADDING, CRYPTO, CRYPTO, PING, PADDING, CRYPTO, CRYPTO, CRYPTO, PADDING, PING, PADDING"
"331","6.055482","10.192.58.175","104.18.7.29","TLSv1.3","118","Change Cipher Spec, Application Data"
"332","6.056259","140.82.114.6","10.192.58.175","TLSv1.3","981","Application Data"
"333","6.056340","10.192.58.175","140.82.114.6","TCP","54","58595  >  443 [ACK] Seq=35346 Ack=5053 Win=130048 Len=0"
"334","6.056370","10.192.58.175","104.18.7.29","TLSv1.3","146","Application Data"
"335","6.056728","10.192.58.175","104.18.7.29","TLSv1.3","557","Application Data"
"336","6.063850","10.192.58.175","104.17.32.82","TLSv1.3","118","Change Cipher Spec, Application Data"
"337","6.064249","10.192.58.175","104.17.32.82","TLSv1.3","146","Application Data"
"338","6.064538","10.192.58.175","104.17.32.82","TLSv1.3","636","Application Data"
"339","6.064599","10.192.58.175","104.17.32.82","TLSv1.3","234","Application Data"
"340","6.066804","104.18.7.29","10.192.58.175","TCP","54","443  >  58599 [ACK] Seq=3434 Ack=582 Win=65536 Len=0"
"341","6.066804","104.18.7.29","10.192.58.175","TLSv1.3","566","Application Data, Application Data"
"342","6.066804","104.18.7.29","10.192.58.175","TCP","54","443  >  58599 [ACK] Seq=3946 Ack=674 Win=65536 Len=0"
"343","6.066804","104.18.7.29","10.192.58.175","TLSv1.3","85","Application Data"
"344","6.066904","10.192.58.175","104.18.7.29","TCP","54","58599  >  443 [ACK] Seq=1177 Ack=3977 Win=130560 Len=0"
"345","6.067057","10.192.58.175","104.18.7.29","TLSv1.3","85","Application Data"
"346","6.067217","104.18.7.29","10.192.58.175","TCP","54","443  >  58599 [ACK] Seq=3977 Ack=1177 Win=65536 Len=0"
"347","6.070187","142.250.138.97","10.192.58.175","TLSv1.3","924","Application Data, Application Data"
"348","6.070187","142.250.138.97","10.192.58.175","TLSv1.3","85","Application Data"
"349","6.070302","10.192.58.175","142.250.138.97","TCP","54","58598  >  443 [ACK] Seq=1349 Ack=1237 Win=129792 Len=0"
"350","6.070468","10.192.58.175","142.250.138.97","TLSv1.3","85","Application Data"
"351","6.074804","104.17.32.82","10.192.58.175","TCP","54","443  >  58600 [ACK] Seq=1923 Ack=582 Win=65536 Len=0"
"352","6.074804","104.17.32.82","10.192.58.175","TLSv1.3","582","Application Data, Application Data"
"353","6.074804","142.250.138.97","10.192.58.175","TCP","54","443  >  58598 [ACK] Seq=1237 Ack=1349 Win=68608 Len=0"
"354","6.074804","104.17.32.82","10.192.58.175","TCP","54","443  >  58600 [ACK] Seq=2451 Ack=674 Win=65536 Len=0"
"355","6.074804","104.17.32.82","10.192.58.175","TLSv1.3","85","Application Data"
"356","6.074804","104.17.32.82","10.192.58.175","TCP","54","443  >  58600 [ACK] Seq=2482 Ack=1256 Win=65536 Len=0"
"357","6.075080","10.192.58.175","104.17.32.82","TCP","54","58600  >  443 [ACK] Seq=1436 Ack=2482 Win=130560 Len=0"
"358","6.075292","104.17.32.82","10.192.58.175","TCP","54","443  >  58600 [ACK] Seq=2482 Ack=1436 Win=65536 Len=0"
"359","6.075445","10.192.58.175","104.17.32.82","TLSv1.3","85","Application Data"
"360","6.077536","104.18.7.29","10.192.58.175","TCP","54","443  >  58599 [ACK] Seq=3977 Ack=1208 Win=65536 Len=0"
"361","6.079039","142.250.138.97","10.192.58.175","TLSv1.3","523","Application Data"
"362","6.079138","10.192.58.175","142.250.138.97","TCP","54","58598  >  443 [ACK] Seq=1380 Ack=1706 Win=131072 Len=0"
"363","6.080321","142.250.138.97","10.192.58.175","TLSv1.3","7554","Application Data, Application Data, Application Data, Application Data, Application Data, Application Data"
"364","6.080431","10.192.58.175","142.250.138.97","TCP","54","58598  >  443 [ACK] Seq=1380 Ack=9206 Win=131072 Len=0"
"365","6.081876","142.250.138.97","10.192.58.175","TLSv1.3","2554","Application Data, Application Data"
"366","6.081960","10.192.58.175","142.250.138.97","TCP","54","58598  >  443 [ACK] Seq=1380 Ack=11706 Win=131072 Len=0"
"367","6.083954","142.250.138.97","10.192.58.175","TLSv1.3","2554","Application Data, Application Data"
"368","6.084039","10.192.58.175","142.250.138.97","TCP","54","58598  >  443 [ACK] Seq=1380 Ack=14206 Win=131072 Len=0"
"369","6.086255","142.250.138.97","10.192.58.175","TLSv1.3","2554","Application Data, Application Data"
"370","6.086255","104.17.32.82","10.192.58.175","TCP","54","443  >  58600 [ACK] Seq=2482 Ack=1467 Win=65536 Len=0"
"371","6.086374","10.192.58.175","142.250.138.97","TCP","54","58598  >  443 [ACK] Seq=1380 Ack=16706 Win=131072 Len=0"
"372","6.088556","142.250.138.97","10.192.58.175","TLSv1.3","2554","Application Data, Application Data"
"373","6.088652","10.192.58.175","142.250.138.97","TCP","54","58598  >  443 [ACK] Seq=1380 Ack=19206 Win=131072 Len=0"
"374","6.092584","142.250.138.97","10.192.58.175","TLSv1.3","2554","Application Data, Application Data"
"375","6.092672","10.192.58.175","142.250.138.97","TCP","54","58598  >  443 [ACK] Seq=1380 Ack=21706 Win=131072 Len=0"
"376","6.092793","142.250.138.97","10.192.58.175","TLSv1.3","1304","Application Data [TCP segment of a reassembled PDU]"
"377","6.092826","10.192.58.175","142.250.138.97","TCP","54","58598  >  443 [ACK] Seq=1380 Ack=22956 Win=131072 Len=0"
"378","6.095437","185.199.108.133","10.192.58.175","TCP","213","[TCP Retransmission] 443  >  58593 [PSH, ACK] Seq=4978 Ack=1578 Win=149504 Len=159"
"379","6.095507","10.192.58.175","185.199.108.133","TCP","66","58593  >  443 [ACK] Seq=1578 Ack=5137 Win=130304 Len=0 SLE=4978 SRE=5137"
"380","6.110280","142.250.138.97","10.192.58.175","TLSv1.3","2554","Application Data, Application Data"
"381","6.110444","10.192.58.175","142.250.138.97","TCP","54","58598  >  443 [ACK] Seq=1380 Ack=25456 Win=131072 Len=0"
"382","6.110730","142.250.138.97","10.192.58.175","TLSv1.3","2554","Application Data, Application Data"
"383","6.110730","140.82.112.21","10.192.58.175","TCP","54","443  >  58596 [ACK] Seq=4298 Ack=2506 Win=70656 Len=0"
"384","6.110931","10.192.58.175","142.250.138.97","TCP","54","58598  >  443 [ACK] Seq=1380 Ack=27956 Win=131072 Len=0"
"385","6.114512","142.250.138.97","10.192.58.175","TCP","54","443  >  58598 [ACK] Seq=27956 Ack=1380 Win=68608 Len=0"
"386","6.115661","140.82.112.4","10.192.58.175","TCP","54","443  >  58591 [ACK] Seq=36039 Ack=4615 Win=84992 Len=0"
"387","6.118397","142.250.138.97","10.192.58.175","TLSv1.3","2554","Application Data, Application Data"
"388","6.118537","10.192.58.175","142.250.138.97","TCP","54","58598  >  443 [ACK] Seq=1380 Ack=30456 Win=131072 Len=0"
"389","6.119810","142.250.138.97","10.192.58.175","TLSv1.3","2554","Application Data, Application Data"
"390","6.120038","10.192.58.175","142.250.138.97","TCP","54","58598  >  443 [ACK] Seq=1380 Ack=32956 Win=131072 Len=0"
"391","6.122133","142.250.138.97","10.192.58.175","TLSv1.3","2554","Application Data, Application Data, Application Data"
"392","6.122410","10.192.58.175","142.250.138.97","TCP","54","58598  >  443 [ACK] Seq=1380 Ack=35456 Win=131072 Len=0"
"393","6.124534","142.250.138.97","10.192.58.175","TLSv1.3","2554","Application Data, Application Data"
"394","6.124812","10.192.58.175","142.250.138.97","TCP","54","58598  >  443 [ACK] Seq=1380 Ack=37956 Win=131072 Len=0"
"395","6.126971","142.250.138.97","10.192.58.175","TLSv1.3","2554","Application Data, Application Data"
"396","6.127502","10.192.58.175","142.250.138.97","TCP","54","58598  >  443 [ACK] Seq=1380 Ack=40456 Win=131072 Len=0"
"397","6.129061","142.250.138.97","10.192.58.175","TLSv1.3","2554","Application Data, Application Data"
"398","6.129316","10.192.58.175","142.250.138.97","TCP","54","58598  >  443 [ACK] Seq=1380 Ack=42956 Win=131072 Len=0"
"399","6.131548","142.250.138.97","10.192.58.175","TLSv1.3","2554","Application Data, Application Data"
"400","6.131917","10.192.58.175","142.250.138.97","TCP","54","58598  >  443 [ACK] Seq=1380 Ack=45456 Win=131072 Len=0"
"401","6.132324","140.82.114.6","10.192.58.175","TLSv1.3","981","Application Data"
"402","6.133803","142.250.138.97","10.192.58.175","TLSv1.3","832","Application Data, Application Data, Application Data, Application Data"
"403","6.134550","10.192.58.175","142.250.138.97","TLSv1.3","93","Application Data"
"404","6.136028","104.18.7.29","10.192.58.175","TLSv1.3","669","Application Data"
"405","6.136028","104.18.7.29","10.192.58.175","TLSv1.3","85","Application Data"
"406","6.136399","10.192.58.175","104.18.7.29","TCP","54","58599  >  443 [ACK] Seq=1208 Ack=4623 Win=130048 Len=0"
"407","6.139906","140.82.112.4","10.192.58.175","TCP","1304","443  >  58591 [ACK] Seq=36039 Ack=4615 Win=84992 Len=1250 [TCP segment of a reassembled PDU]"
"408","6.139906","140.82.112.4","10.192.58.175","TLSv1.3","196","Application Data"
"409","6.139906","140.82.112.4","10.192.58.175","TCP","1304","443  >  58591 [ACK] Seq=37431 Ack=4615 Win=84992 Len=1250 [TCP segment of a reassembled PDU]"
"410","6.139906","140.82.112.4","10.192.58.175","TLSv1.3","196","Application Data"
"411","6.139906","140.82.112.4","10.192.58.175","TLSv1.3","393","Application Data"
"412","6.140177","10.192.58.175","140.82.112.4","TCP","54","58591  >  443 [ACK] Seq=4615 Ack=39162 Win=131072 Len=0"
"413","6.177123","10.192.58.175","140.82.114.6","TCP","54","58595  >  443 [ACK] Seq=35346 Ack=5980 Win=131072 Len=0"
"414","6.178249","140.82.114.25","10.192.58.175","TCP","372","[TCP Previous segment not captured] 443  >  58597 [PSH, ACK] Seq=2501 Ack=518 Win=67584 Len=318 [TCP segment of a reassembled PDU], Application Data, Application Data"
"415","6.178340","10.192.58.175","140.82.114.25","TCP","66","[TCP Dup ACK 305#1] 58597  >  443 [ACK] Seq=518 Ack=1251 Win=131072 Len=0 SLE=2501 SRE=2819"
"416","6.181637","142.250.138.97","10.192.58.175","TCP","54","443  >  58598 [ACK] Seq=46234 Ack=1419 Win=68608 Len=0"
"417","6.193841","107.167.110.216","10.192.58.175","TCP","590","443  >  58594 [ACK] Seq=1609 Ack=518 Win=42899 Len=536 [TCP segment of a reassembled PDU]"
"418","6.196613","10.192.58.175","129.207.7.31","DNS","84","Standard query 0x2247 A www.google-analytics.com"
"419","6.203980","129.207.7.31","10.192.58.175","DNS","180","Standard query response 0x2247 A www.google-analytics.com A 142.250.114.102 A 142.250.114.113 A 142.250.114.138 A 142.250.114.139 A 142.250.114.100 A 142.250.114.101"
"420","6.204478","10.192.58.175","142.250.114.102","TCP","66","58601  >  443 [SYN] Seq=0 Win=64240 Len=0 MSS=1460 WS=256 SACK_PERM=1"
"421","6.237883","10.192.58.175","107.167.110.216","TCP","54","58594  >  443 [ACK] Seq=518 Ack=2145 Win=64464 Len=0"
"422","6.245950","142.250.114.102","10.192.58.175","TCP","66","443  >  58601 [SYN, ACK] Seq=0 Ack=1 Win=65535 Len=0 MSS=1250 SACK_PERM=1 WS=256"
"423","6.246039","10.192.58.175","142.250.114.102","TCP","54","58601  >  443 [ACK] Seq=1 Ack=1 Win=131072 Len=0"
"424","6.246269","10.192.58.175","142.250.114.102","TLSv1.3","786","Client Hello"
"425","6.274616","104.17.32.82","10.192.58.175","TLSv1.3","540","Application Data"
"426","6.276642","107.167.110.216","10.192.58.175","TCP","590","443  >  58594 [ACK] Seq=2145 Ack=518 Win=42899 Len=536 [TCP segment of a reassembled PDU]"
"427","6.276642","107.167.110.216","10.192.58.175","TLSv1.3","514","Application Data, Application Data, Application Data"
"428","6.276725","10.192.58.175","107.167.110.216","TCP","54","58594  >  443 [ACK] Seq=518 Ack=3141 Win=65000 Len=0"
"429","6.277231","10.192.58.175","107.167.110.216","TLSv1.3","134","Change Cipher Spec, Application Data"
"430","6.277436","10.192.58.175","107.167.110.216","TLSv1.3","608","Application Data"
"431","6.285575","104.17.32.82","10.192.58.175","TLSv1.3","1048","Application Data"
"432","6.285688","10.192.58.175","104.17.32.82","TCP","54","58600  >  443 [ACK] Seq=1467 Ack=3962 Win=131072 Len=0"
"433","6.291546","142.250.114.102","10.192.58.175","TCP","54","443  >  58601 [ACK] Seq=1 Ack=733 Win=67072 Len=0"
"434","6.292269","142.250.114.102","10.192.58.175","TLSv1.3","1304","Server Hello, Change Cipher Spec"
"435","6.293432","142.250.114.102","10.192.58.175","TCP","2554","443  >  58601 [PSH, ACK] Seq=1251 Ack=733 Win=67072 Len=2500 [TCP segment of a reassembled PDU]"
"436","6.293432","142.250.114.102","10.192.58.175","TLSv1.3","1068","Application Data"
"437","6.293474","10.192.58.175","142.250.114.102","TCP","54","58601  >  443 [ACK] Seq=733 Ack=4765 Win=131072 Len=0"
"438","6.294036","10.192.58.175","142.250.114.102","TLSv1.3","128","Change Cipher Spec, Application Data"
"439","6.294210","10.192.58.175","142.250.114.102","TLSv1.3","146","Application Data"
"440","6.294360","10.192.58.175","142.250.114.102","TLSv1.3","495","Application Data"
"441","6.316291","10.192.58.175","104.21.94.101","QUIC","1292","Initial, DCID=7bbd0e974ee97d5d, PKN: 3, PADDING, CRYPTO, PADDING, CRYPTO, CRYPTO, CRYPTO, PADDING"
"442","6.316643","107.167.110.216","10.192.58.175","TCP","54","443  >  58594 [ACK] Seq=3141 Ack=1152 Win=42265 Len=0"
"443","6.316676","10.192.58.175","104.21.94.101","TCP","66","58602  >  443 [SYN] Seq=0 Win=64240 Len=0 MSS=1460 WS=256 SACK_PERM=1"
"444","6.319922","107.167.110.216","10.192.58.175","TLSv1.3","254","Application Data"
"445","6.336408","142.250.114.102","10.192.58.175","TLSv1.3","924","Application Data, Application Data"
"446","6.336408","142.250.114.102","10.192.58.175","TCP","54","443  >  58601 [ACK] Seq=5635 Ack=1340 Win=68608 Len=0"
"447","6.336408","142.250.114.102","10.192.58.175","TLSv1.3","85","Application Data"
"448","6.336408","142.250.114.102","10.192.58.175","TLSv1.3","314","Application Data"
"449","6.336522","10.192.58.175","142.250.114.102","TCP","54","58601  >  443 [ACK] Seq=1340 Ack=5926 Win=130048 Len=0"
"450","6.336776","10.192.58.175","142.250.114.102","TLSv1.3","85","Application Data"
"451","6.336818","10.192.58.175","142.250.114.102","TLSv1.3","93","Application Data"
"452","6.343250","104.21.94.101","10.192.58.175","TCP","66","443  >  58602 [SYN, ACK] Seq=0 Ack=1 Win=64240 Len=0 MSS=1250 SACK_PERM=1 WS=8192"
"453","6.343348","10.192.58.175","104.21.94.101","TCP","54","58602  >  443 [ACK] Seq=1 Ack=1 Win=131072 Len=0"
"454","6.343544","10.192.58.175","104.21.94.101","TLSv1.3","571","Client Hello"
"455","6.347483","10.192.58.175","104.17.32.82","QUIC","1292","Initial, DCID=ea285590d870eb7b, PKN: 7, PADDING, CRYPTO, PADDING, CRYPTO, CRYPTO, PADDING, CRYPTO, PADDING, CRYPTO, CRYPTO, PING, PADDING, PING"
"456","6.361367","10.192.58.175","142.250.114.102","TLSv1.3","588","Application Data"
"457","6.362967","10.192.58.175","107.167.110.216","TCP","54","58594  >  443 [ACK] Seq=1152 Ack=3341 Win=64800 Len=0"
"458","6.380751","104.21.94.101","10.192.58.175","TLSv1.3","1304","Server Hello, Change Cipher Spec"
"459","6.380751","104.21.94.101","10.192.58.175","TLSv1.3","744","Application Data"
"460","6.380751","142.250.114.102","10.192.58.175","TCP","54","443  >  58601 [ACK] Seq=5926 Ack=1410 Win=68608 Len=0"
"461","6.380828","10.192.58.175","104.21.94.101","TCP","54","58602  >  443 [ACK] Seq=518 Ack=1941 Win=131072 Len=0"
"462","6.385307","10.192.58.175","104.21.94.101","TLSv1.3","118","Change Cipher Spec, Application Data"
"463","6.385483","10.192.58.175","104.21.94.101","TLSv1.3","146","Application Data"
"464","6.385588","10.192.58.175","104.21.94.101","TLSv1.3","505","Application Data"
"465","6.415515","104.21.94.101","10.192.58.175","TLSv1.3","566","Application Data, Application Data"
"466","6.415859","104.21.94.101","10.192.58.175","TCP","54","443  >  58602 [ACK] Seq=2453 Ack=1125 Win=65536 Len=0"
"467","6.416236","10.192.58.175","104.21.94.101","TLSv1.3","85","Application Data"
"468","6.421571","104.21.94.101","10.192.58.175","TLSv1.3","85","Application Data"
"469","6.422367","142.250.114.102","10.192.58.175","TLSv1.3","327","Application Data"
"470","6.422367","142.250.114.102","10.192.58.175","TLSv1.3","86","Application Data"
"471","6.422367","142.250.114.102","10.192.58.175","TLSv1.3","85","Application Data"
"472","6.422367","142.250.114.102","10.192.58.175","TLSv1.3","93","Application Data"
"473","6.422674","10.192.58.175","142.250.114.102","TCP","54","58601  >  443 [ACK] Seq=1944 Ack=6301 Win=131072 Len=0"
"474","6.423417","10.192.58.175","142.250.114.102","TLSv1.3","93","Application Data"
"475","6.433038","104.21.94.101","10.192.58.175","TLSv1.3","743","Application Data"
"476","6.433377","10.192.58.175","104.21.94.101","TCP","54","58602  >  443 [ACK] Seq=1156 Ack=3173 Win=129792 Len=0"
"477","6.434629","140.82.114.25","10.192.58.175","TCP","1304","[TCP Retransmission] 443  >  58597 [ACK] Seq=1251 Ack=518 Win=67584 Len=1250"
"478","6.435022","10.192.58.175","140.82.114.25","TCP","54","58597  >  443 [ACK] Seq=518 Ack=2819 Win=131072 Len=0"
"479","6.436895","10.192.58.175","140.82.114.25","TLSv1.3","118","Change Cipher Spec, Application Data"
"480","6.437920","10.192.58.175","140.82.114.25","TLSv1.3","1159","Application Data"
"481","6.474138","142.250.114.102","10.192.58.175","TCP","54","443  >  58601 [ACK] Seq=6301 Ack=1983 Win=70144 Len=0"
"482","6.475425","140.82.114.25","10.192.58.175","TLSv1.3","212","Application Data, Application Data"
"483","6.475494","10.192.58.175","140.82.114.25","TCP","54","58597  >  443 [ACK] Seq=1687 Ack=2977 Win=131072 Len=0"
"484","6.482527","104.21.94.101","10.192.58.175","TCP","54","443  >  58602 [ACK] Seq=3173 Ack=1156 Win=65536 Len=0"
"485","6.497560","10.192.58.175","107.167.110.211","TLSv1.3","464","Application Data"
"486","6.497639","10.192.58.175","107.167.110.211","TLSv1.3","141","Application Data"
"487","6.515266","140.82.114.25","10.192.58.175","TLSv1.3","555","Application Data"
"488","6.516875","10.192.58.175","140.82.114.25","TLSv1.3","395","Application Data"
"489","6.520885","104.17.32.82","10.192.58.175","TLSv1.3","85","Application Data"
"490","6.535023","107.167.110.211","10.192.58.175","TCP","54","443  >  58589 [ACK] Seq=5565 Ack=2580 Win=42496 Len=0"
"491","6.536313","107.167.110.211","10.192.58.175","TLSv1.3","362","Application Data"
"492","6.550874","140.82.114.25","10.192.58.175","TLSv1.3","127","Application Data"
"493","6.552460","10.192.58.175","129.207.7.31","DNS","80","Standard query 0x7bd4 A speeddials.opera.com"
"494","6.566167","10.192.58.175","104.17.32.82","TCP","54","58600  >  443 [ACK] Seq=1467 Ack=3993 Win=131072 Len=0"
"495","6.581821","10.192.58.175","107.167.110.211","TCP","54","58589  >  443 [ACK] Seq=2580 Ack=5873 Win=130560 Len=0"
"496","6.582102","10.192.58.175","129.207.7.31","DNS","80","Standard query 0x7bd4 A speeddials.opera.com"
"497","6.583984","129.207.7.31","10.192.58.175","DNS","209","Standard query response 0x7bd4 A speeddials.opera.com CNAME speeddials.geo.opera.com CNAME lati-speeddials.opera.com CNAME lati.lb.opera.technology A 107.167.110.211 A 107.167.110.216"
"498","6.584713","10.192.58.175","107.167.110.211","TCP","66","58603  >  443 [SYN] Seq=0 Win=64240 Len=0 MSS=1460 WS=256 SACK_PERM=1"
"499","6.584725","129.207.7.31","10.192.58.175","DNS","209","Standard query response 0x7bd4 A speeddials.opera.com CNAME speeddials.geo.opera.com CNAME lati-speeddials.opera.com CNAME lati.lb.opera.technology A 107.167.110.216 A 107.167.110.211"
"500","6.597426","10.192.58.175","140.82.114.25","TCP","54","58597  >  443 [ACK] Seq=2028 Ack=3551 Win=130304 Len=0"
"501","6.617223","107.167.110.211","10.192.58.175","TCP","58","443  >  58603 [SYN, ACK] Seq=0 Ack=1 Win=42340 Len=0 MSS=1250"
"502","6.617296","10.192.58.175","107.167.110.211","TCP","54","58603  >  443 [ACK] Seq=1 Ack=1 Win=64240 Len=0"
"503","6.617650","10.192.58.175","107.167.110.211","TLSv1.3","571","Client Hello"
"504","6.650672","107.167.110.211","10.192.58.175","TCP","54","443  >  58603 [ACK] Seq=1 Ack=518 Win=42899 Len=0"
"505","6.652340","107.167.110.211","10.192.58.175","TLSv1.3","2734","Server Hello, Change Cipher Spec, Application Data"
"506","6.652340","107.167.110.211","10.192.58.175","TLSv1.3","515","Application Data, Application Data, Application Data"
"507","6.652448","10.192.58.175","107.167.110.211","TCP","54","58603  >  443 [ACK] Seq=518 Ack=3142 Win=65000 Len=0"
"508","6.653119","10.192.58.175","107.167.110.211","TLSv1.3","134","Change Cipher Spec, Application Data"
"509","6.653331","10.192.58.175","107.167.110.211","TLSv1.3","432","Application Data"
"510","6.686002","107.167.110.211","10.192.58.175","TCP","54","443  >  58603 [ACK] Seq=3142 Ack=976 Win=42441 Len=0"
"511","6.700107","107.167.110.211","10.192.58.175","TLSv1.3","306","Application Data"
"512","6.753661","10.192.58.175","107.167.110.211","TCP","54","58603  >  443 [ACK] Seq=976 Ack=3394 Win=64748 Len=0"
"513","6.815259","107.167.110.216","10.192.58.175","TCP","254","[TCP Spurious Retransmission] 443  >  58594 [PSH, ACK] Seq=3141 Ack=1152 Win=42265 Len=200"
"514","6.815309","10.192.58.175","107.167.110.216","TCP","54","[TCP Dup ACK 457#1] 58594  >  443 [ACK] Seq=1152 Ack=3341 Win=64800 Len=0"
"515","6.925816","10.192.58.175","104.21.94.101","QUIC","1292","Initial, DCID=7bbd0e974ee97d5d, PKN: 5, PADDING, CRYPTO, CRYPTO, CRYPTO, PADDING, PING, PING, PADDING, CRYPTO, PADDING, CRYPTO"
"516","6.941455","10.192.58.175","104.17.32.82","QUIC","1292","Initial, DCID=ea285590d870eb7b, PKN: 9, PING, PING, CRYPTO, PING, PADDING, CRYPTO, PING, PING, PADDING, PING, CRYPTO, CRYPTO, PING"
"517","7.270521","162.159.133.234","10.192.58.175","TLSv1.2","134","Application Data"
"518","7.273711","162.159.133.234","10.192.58.175","TLSv1.2","94","Application Data"
"519","7.273764","10.192.58.175","162.159.133.234","TCP","54","55816  >  443 [ACK] Seq=1 Ack=482 Win=510 Len=0"
"520","7.469102","10.192.58.175","142.250.113.113","TLSv1.2","620","Application Data"
"521","7.469222","10.192.58.175","142.250.113.113","TLSv1.2","513","Application Data"
"522","7.469692","10.192.58.175","142.250.113.113","TLSv1.2","169","Application Data"
"523","7.481387","10.192.58.175","35.169.6.138","TLSv1.2","90","Application Data"
"524","7.511234","142.250.113.113","10.192.58.175","TCP","54","443  >  52025 [ACK] Seq=1 Ack=567 Win=5258 Len=0"
"525","7.511234","142.250.113.113","10.192.58.175","TCP","54","443  >  52025 [ACK] Seq=1 Ack=1026 Win=5258 Len=0"
"526","7.511234","142.250.113.113","10.192.58.175","TCP","54","443  >  52025 [ACK] Seq=1 Ack=1141 Win=5258 Len=0"
"527","7.527938","35.169.6.138","10.192.58.175","TCP","54","443  >  51808 [ACK] Seq=1 Ack=37 Win=259 Len=0"
"528","7.598896","10.192.58.175","107.167.110.216","TCP","54","58594  >  443 [FIN, ACK] Seq=1152 Ack=3341 Win=64800 Len=0"
"529","7.599042","10.192.58.175","185.199.110.154","TCP","54","58590  >  443 [FIN, ACK] Seq=582 Ack=4200 Win=131072 Len=0"
"530","7.599107","10.192.58.175","185.199.110.154","TCP","54","58592  >  443 [FIN, ACK] Seq=582 Ack=4200 Win=131072 Len=0"
"531","7.599242","10.192.58.175","107.167.110.211","TCP","54","58589  >  443 [FIN, ACK] Seq=2580 Ack=5873 Win=130560 Len=0"
"532","7.599293","10.192.58.175","107.167.110.211","TCP","54","58603  >  443 [FIN, ACK] Seq=976 Ack=3394 Win=64748 Len=0"
"533","7.599347","10.192.58.175","142.250.114.102","TCP","54","58601  >  443 [FIN, ACK] Seq=1983 Ack=6301 Win=131072 Len=0"
"534","7.599417","10.192.58.175","104.18.7.29","TCP","54","58599  >  443 [FIN, ACK] Seq=1208 Ack=4623 Win=130048 Len=0"
"535","7.599473","10.192.58.175","104.21.94.101","TCP","54","58602  >  443 [FIN, ACK] Seq=1156 Ack=3173 Win=129792 Len=0"
"536","7.599522","10.192.58.175","140.82.114.6","TCP","54","58595  >  443 [FIN, ACK] Seq=35346 Ack=5980 Win=131072 Len=0"
"537","7.599576","10.192.58.175","104.17.32.82","TCP","54","58600  >  443 [FIN, ACK] Seq=1467 Ack=3993 Win=131072 Len=0"
"538","7.599631","10.192.58.175","54.197.203.68","TCP","54","58588  >  443 [FIN, ACK] Seq=2975 Ack=5258 Win=130304 Len=0"
"539","7.599704","10.192.58.175","185.199.108.133","TCP","54","58593  >  443 [FIN, ACK] Seq=1578 Ack=5137 Win=130304 Len=0"
"540","7.599752","10.192.58.175","142.250.138.97","TCP","54","58598  >  443 [FIN, ACK] Seq=1419 Ack=46234 Win=130304 Len=0"
"541","7.599801","10.192.58.175","140.82.112.4","TCP","54","58591  >  443 [FIN, ACK] Seq=4615 Ack=39162 Win=131072 Len=0"
"542","7.599853","10.192.58.175","140.82.112.21","TCP","54","58596  >  443 [FIN, ACK] Seq=2506 Ack=4298 Win=131072 Len=0"
"543","7.604904","185.199.110.154","10.192.58.175","TCP","54","443  >  58590 [ACK] Seq=4200 Ack=583 Win=147456 Len=0"
"544","7.604904","185.199.110.154","10.192.58.175","TLSv1.3","78","Application Data"
"545","7.604904","185.199.110.154","10.192.58.175","TCP","54","443  >  58590 [FIN, ACK] Seq=4224 Ack=583 Win=147456 Len=0"
"546","7.604988","10.192.58.175","185.199.110.154","TCP","54","58590  >  443 [RST, ACK] Seq=583 Ack=4224 Win=0 Len=0"
"547","7.605042","10.192.58.175","185.199.110.154","TCP","54","58590  >  443 [RST] Seq=583 Win=0 Len=0"
"548","7.618061","142.250.113.113","10.192.58.175","TLSv1.2","565","Application Data"
"549","7.618061","142.250.113.113","10.192.58.175","TLSv1.2","804","Application Data"
"550","7.618061","142.250.113.113","10.192.58.175","TLSv1.2","85","Application Data"
"551","7.618061","142.250.113.113","10.192.58.175","TLSv1.2","93","Application Data"
"552","7.618061","104.18.7.29","10.192.58.175","TCP","54","443  >  58599 [FIN, ACK] Seq=4623 Ack=1209 Win=65536 Len=0"
"553","7.618061","185.199.110.154","10.192.58.175","TCP","54","443  >  58592 [ACK] Seq=4200 Ack=583 Win=147456 Len=0"
"554","7.618061","185.199.110.154","10.192.58.175","TLSv1.3","78","Application Data"
"555","7.618061","185.199.110.154","10.192.58.175","TCP","54","443  >  58592 [FIN, ACK] Seq=4224 Ack=583 Win=147456 Len=0"
"556","7.618061","185.199.108.133","10.192.58.175","TCP","54","443  >  58593 [ACK] Seq=5137 Ack=1579 Win=149504 Len=0"
"557","7.618061","185.199.108.133","10.192.58.175","TLSv1.3","78","Application Data"
"558","7.618061","185.199.108.133","10.192.58.175","TCP","54","443  >  58593 [FIN, ACK] Seq=5161 Ack=1579 Win=149504 Len=0"
"559","7.618061","104.17.32.82","10.192.58.175","TCP","54","443  >  58600 [FIN, ACK] Seq=3993 Ack=1468 Win=65536 Len=0"
"560","7.618777","10.192.58.175","104.18.7.29","TCP","54","58599  >  443 [ACK] Seq=1209 Ack=4624 Win=130048 Len=0"
"561","7.619350","10.192.58.175","185.199.110.154","TCP","54","58592  >  443 [RST, ACK] Seq=583 Ack=4224 Win=0 Len=0"
"562","7.619518","10.192.58.175","185.199.110.154","TCP","54","58592  >  443 [RST] Seq=583 Win=0 Len=0"
"563","7.619693","10.192.58.175","185.199.108.133","TCP","54","58593  >  443 [RST, ACK] Seq=1579 Ack=5161 Win=0 Len=0"
"564","7.619739","10.192.58.175","185.199.108.133","TCP","54","58593  >  443 [RST] Seq=1579 Win=0 Len=0"
"565","7.619825","10.192.58.175","104.17.32.82","TCP","54","58600  >  443 [ACK] Seq=1468 Ack=3994 Win=131072 Len=0"
"566","7.619880","10.192.58.175","142.250.113.113","TCP","54","52025  >  443 [ACK] Seq=1141 Ack=1332 Win=512 Len=0"
"567","7.621509","10.192.58.175","142.250.113.113","TLSv1.2","93","Application Data"
"568","7.624836","104.21.94.101","10.192.58.175","TCP","54","443  >  58602 [FIN, ACK] Seq=3173 Ack=1157 Win=65536 Len=0"
"569","7.625114","10.192.58.175","104.21.94.101","TCP","54","58602  >  443 [ACK] Seq=1157 Ack=3174 Win=129792 Len=0"
"570","7.625497","142.250.113.113","10.192.58.175","TLSv1.2","567","Application Data"
"571","7.625497","142.250.113.113","10.192.58.175","TLSv1.2","87","Application Data"
"572","7.625497","142.250.113.113","10.192.58.175","TLSv1.2","85","Application Data"
"573","7.625678","10.192.58.175","142.250.113.113","TCP","54","52025  >  443 [ACK] Seq=1180 Ack=1909 Win=510 Len=0"
"574","7.628588","10.192.58.175","142.250.113.113","TLSv1.2","89","Application Data"
"575","7.632705","107.167.110.211","10.192.58.175","TCP","54","443  >  58589 [FIN, ACK] Seq=5873 Ack=2581 Win=42496 Len=0"
"576","7.632705","107.167.110.211","10.192.58.175","TCP","54","443  >  58603 [FIN, ACK] Seq=3394 Ack=977 Win=42440 Len=0"
"577","7.632705","140.82.114.6","10.192.58.175","TCP","54","443  >  58595 [FIN, ACK] Seq=5980 Ack=35347 Win=146432 Len=0"
"578","7.632705","107.167.110.216","10.192.58.175","TCP","54","443  >  58594 [FIN, ACK] Seq=3341 Ack=1153 Win=42264 Len=0"
"579","7.633013","10.192.58.175","107.167.110.211","TCP","54","58589  >  443 [ACK] Seq=2581 Ack=5874 Win=130560 Len=0"
"580","7.633328","10.192.58.175","107.167.110.211","TCP","54","58603  >  443 [ACK] Seq=977 Ack=3395 Win=64748 Len=0"
"581","7.633484","10.192.58.175","140.82.114.6","TCP","54","58595  >  443 [ACK] Seq=35347 Ack=5981 Win=131072 Len=0"
"582","7.633569","10.192.58.175","107.167.110.216","TCP","54","58594  >  443 [ACK] Seq=1153 Ack=3342 Win=64800 Len=0"
"583","7.633756","140.82.112.4","10.192.58.175","TCP","54","443  >  58591 [FIN, ACK] Seq=39162 Ack=4616 Win=84992 Len=0"
"584","7.633894","10.192.58.175","140.82.112.4","TCP","54","58591  >  443 [ACK] Seq=4616 Ack=39163 Win=131072 Len=0"
"585","7.634886","140.82.112.21","10.192.58.175","TCP","54","443  >  58596 [FIN, ACK] Seq=4298 Ack=2507 Win=70656 Len=0"
"586","7.635165","10.192.58.175","140.82.112.21","TCP","54","58596  >  443 [ACK] Seq=2507 Ack=4299 Win=131072 Len=0"
"587","7.639393","142.250.114.102","10.192.58.175","TCP","54","443  >  58601 [FIN, ACK] Seq=6301 Ack=1984 Win=70144 Len=0"
"588","7.639393","142.250.138.97","10.192.58.175","TCP","54","443  >  58598 [FIN, ACK] Seq=46234 Ack=1420 Win=68608 Len=0"
"589","7.639606","10.192.58.175","142.250.114.102","TCP","54","58601  >  443 [ACK] Seq=1984 Ack=6302 Win=131072 Len=0"
"590","7.640040","10.192.58.175","142.250.138.97","TCP","54","58598  >  443 [ACK] Seq=1420 Ack=46235 Win=130304 Len=0"
"591","7.642460","54.197.203.68","10.192.58.175","TCP","54","443  >  58588 [FIN, ACK] Seq=5258 Ack=2976 Win=64000 Len=0"
"592","7.642724","10.192.58.175","54.197.203.68","TCP","54","58588  >  443 [ACK] Seq=2976 Ack=5259 Win=130304 Len=0"
"593","7.660586","142.250.113.113","10.192.58.175","TCP","54","443  >  52025 [ACK] Seq=1909 Ack=1180 Win=5258 Len=0"
"594","7.668138","142.250.113.113","10.192.58.175","TCP","54","443  >  52025 [ACK] Seq=1909 Ack=1215 Win=5258 Len=0"
"595","7.681972","142.250.113.113","10.192.58.175","TLSv1.2","565","Application Data"
"596","7.681972","142.250.113.113","10.192.58.175","TLSv1.2","975","Application Data"
"597","7.682208","10.192.58.175","142.250.113.113","TCP","54","52025  >  443 [ACK] Seq=1215 Ack=3341 Win=512 Len=0"
"598","7.682518","142.250.113.113","10.192.58.175","TLSv1.2","85","Application Data"
"599","7.682518","142.250.113.113","10.192.58.175","TLSv1.2","93","Application Data"
"600","7.682638","10.192.58.175","142.250.113.113","TCP","54","52025  >  443 [ACK] Seq=1215 Ack=3411 Win=512 Len=0"
"601","7.682917","10.192.58.175","142.250.113.113","TLSv1.2","93","Application Data"
"602","7.702764","10.192.58.175","142.250.113.113","TLSv1.2","418","Application Data"
"603","7.727223","142.250.113.113","10.192.58.175","TCP","54","443  >  52025 [ACK] Seq=3411 Ack=1254 Win=5258 Len=0"
"604","7.741427","142.250.113.113","10.192.58.175","TCP","54","443  >  52025 [ACK] Seq=3411 Ack=1618 Win=5258 Len=0"
"605","7.886778","142.250.113.113","10.192.58.175","TLSv1.2","566","Application Data"
"606","7.886778","142.250.113.113","10.192.58.175","TLSv1.2","643","Application Data"
"607","7.886778","142.250.113.113","10.192.58.175","TLSv1.2","261","Application Data"
"608","7.886778","142.250.113.113","10.192.58.175","TLSv1.2","93","Application Data"
"609","7.887036","10.192.58.175","142.250.113.113","TCP","54","52025  >  443 [ACK] Seq=1618 Ack=4758 Win=512 Len=0"
"610","7.887774","10.192.58.175","142.250.113.113","TLSv1.2","93","Application Data"
"611","7.915321","10.192.58.175","142.250.113.113","TLSv1.2","435","Application Data"
"612","7.927185","142.250.113.113","10.192.58.175","TCP","54","443  >  52025 [ACK] Seq=4758 Ack=1657 Win=5258 Len=0"
"613","7.954010","142.250.113.113","10.192.58.175","TCP","54","443  >  52025 [ACK] Seq=4758 Ack=2038 Win=5258 Len=0"
"614","8.117223","10.192.58.175","104.17.32.82","QUIC","1292","Initial, DCID=ea285590d870eb7b, PKN: 11, PADDING, CRYPTO, CRYPTO, PING, PADDING, PING, PADDING"
"615","8.141272","10.192.58.175","104.21.94.101","QUIC","1292","Initial, DCID=7bbd0e974ee97d5d, PKN: 7, CRYPTO, PADDING, PING, CRYPTO, PING, PADDING, CRYPTO, PADDING, CRYPTO, CRYPTO, PING, CRYPTO, PADDING, CRYPTO, CRYPTO"
"616","9.828360","10.192.58.175","104.17.32.82","QUIC","1292","Initial, DCID=ea285590d870eb7b, PKN: 12, CC, PADDING"
"617","10.020412","10.192.58.175","104.21.94.101","QUIC","1292","Initial, DCID=7bbd0e974ee97d5d, PKN: 8, CC, PADDING"
"618","10.176426","10.192.58.175","142.251.32.142","TCP","66","58604  >  443 [SYN] Seq=0 Win=64240 Len=0 MSS=1460 WS=256 SACK_PERM=1"
"619","10.215785","142.251.32.142","10.192.58.175","TCP","66","443  >  58604 [SYN, ACK] Seq=0 Ack=1 Win=65535 Len=0 MSS=1250 SACK_PERM=1 WS=256"
"620","10.215868","10.192.58.175","142.251.32.142","TCP","54","58604  >  443 [ACK] Seq=1 Ack=1 Win=131072 Len=0"
"621","10.216097","10.192.58.175","142.251.32.142","TLSv1.3","776","Client Hello"
"622","10.247900","104.192.142.11","10.192.58.175","TLSv1.2","78","Application Data"
"623","10.249356","10.192.58.175","104.192.142.11","TLSv1.2","82","Application Data"
"624","10.254409","142.251.32.142","10.192.58.175","TCP","54","443  >  58604 [ACK] Seq=1 Ack=723 Win=67072 Len=0"
"625","10.256820","142.251.32.142","10.192.58.175","TLSv1.3","384","Server Hello, Change Cipher Spec, Application Data"
"626","10.258307","10.192.58.175","142.251.32.142","TLSv1.3","128","Change Cipher Spec, Application Data"
"627","10.259135","10.192.58.175","142.251.32.142","TLSv1.3","146","Application Data"
"628","10.260248","10.192.58.175","142.251.32.142","TLSv1.3","2309","Application Data"
"629","10.292335","104.192.142.11","10.192.58.175","TCP","54","443  >  51249 [ACK] Seq=125 Ack=133 Win=155 Len=0"
"630","10.297246","142.251.32.142","10.192.58.175","TLSv1.3","914","Application Data, Application Data"
"631","10.297246","142.251.32.142","10.192.58.175","TLSv1.3","85","Application Data"
"632","10.297345","10.192.58.175","142.251.32.142","TCP","54","58604  >  443 [ACK] Seq=3144 Ack=1222 Win=129792 Len=0"
"633","10.297549","10.192.58.175","142.251.32.142","TLSv1.3","85","Application Data"
"634","10.298716","142.251.32.142","10.192.58.175","TCP","54","443  >  58604 [ACK] Seq=1222 Ack=3144 Win=72192 Len=0"
"635","10.340443","142.251.32.142","10.192.58.175","TCP","54","443  >  58604 [ACK] Seq=1222 Ack=3175 Win=72192 Len=0"
"636","10.424776","142.251.32.142","10.192.58.175","TLSv1.3","1036","Application Data"
"637","10.424776","142.251.32.142","10.192.58.175","TLSv1.3","396","Application Data"
"638","10.424776","142.251.32.142","10.192.58.175","TLSv1.3","312","Application Data"
"639","10.424776","142.251.32.142","10.192.58.175","TLSv1.3","93","Application Data"
"640","10.424886","10.192.58.175","142.251.32.142","TCP","54","58604  >  443 [ACK] Seq=3175 Ack=2843 Win=131072 Len=0"
"641","10.425254","10.192.58.175","142.251.32.142","TLSv1.3","93","Application Data"
"642","10.431431","10.192.58.175","142.250.113.113","TLSv1.2","1614","Application Data"
"643","10.431501","10.192.58.175","142.250.113.113","TLSv1.2","372","Application Data"
"644","10.466500","142.251.32.142","10.192.58.175","TCP","54","443  >  58604 [ACK] Seq=2843 Ack=3214 Win=72192 Len=0"
"645","10.474739","142.250.113.113","10.192.58.175","TCP","54","443  >  52025 [ACK] Seq=4758 Ack=3288 Win=5258 Len=0"
"646","10.474739","142.250.113.113","10.192.58.175","TCP","54","443  >  52025 [ACK] Seq=4758 Ack=3598 Win=5258 Len=0"
"647","10.474739","142.250.113.113","10.192.58.175","TCP","54","443  >  52025 [ACK] Seq=4758 Ack=3916 Win=5258 Len=0"
"648","10.504179","142.250.113.113","10.192.58.175","TLSv1.2","560","Application Data"
"649","10.504179","142.250.113.113","10.192.58.175","TLSv1.2","85","Application Data"
"650","10.504179","142.250.113.113","10.192.58.175","TLSv1.2","93","Application Data"
"651","10.504352","10.192.58.175","142.250.113.113","TCP","54","52025  >  443 [ACK] Seq=3916 Ack=5334 Win=510 Len=0"
"652","10.505216","10.192.58.175","142.250.113.113","TLSv1.2","93","Application Data"
"653","10.549698","142.250.113.113","10.192.58.175","TCP","54","443  >  52025 [ACK] Seq=5334 Ack=3955 Win=5258 Len=0"
"654","11.694436","10.192.58.175","162.159.133.234","TLSv1.2","108","Application Data"
"655","11.703777","162.159.133.234","10.192.58.175","TCP","54","443  >  55816 [ACK] Seq=482 Ack=55 Win=8 Len=0"
"656","11.741533","162.159.133.234","10.192.58.175","TLSv1.2","87","Application Data"
"657","11.782163","10.192.58.175","162.159.133.234","TCP","54","55816  >  443 [ACK] Seq=55 Ack=515 Win=510 Len=0"
"658","11.818730","fe80::f542:efbc:27f3:c779","ff02::1","ICMPv6","86","Neighbor Advertisement fe80::f542:efbc:27f3:c779 (ovr) is at ec:63:d7:ae:c7:ac"
"659","12.197922","10.192.58.175","129.207.96.52","TCP","66","58605  >  8443 [SYN] Seq=0 Win=64240 Len=0 MSS=1460 WS=256 SACK_PERM=1"
"660","12.698085","155.133.253.34","10.192.58.175","TLSv1.2","145","Application Data"
"661","12.742006","10.192.58.175","155.133.253.34","TCP","54","51258  >  443 [ACK] Seq=1 Ack=92 Win=510 Len=0"
"662","13.046355","10.192.58.175","44.209.239.90","TLSv1.2","317","Application Data"
"663","13.089315","44.209.239.90","10.192.58.175","TLSv1.2","87","Application Data"
"664","13.090129","44.209.239.90","10.192.58.175","TLSv1.2","301","Application Data"
"665","13.090214","10.192.58.175","44.209.239.90","TCP","54","51798  >  443 [ACK] Seq=264 Ack=281 Win=512 Len=0"
"666","13.205899","10.192.58.175","129.207.96.52","TCP","66","[TCP Retransmission] [TCP Port numbers reused] 58605  >  8443 [SYN] Seq=0 Win=64240 Len=0 MSS=1460 WS=256 SACK_PERM=1"
