,No.,Time,Source,Destination,Protocol,Length,Info
0,1,0.0,0a:00:27:00:00:00,5a:94:d2:14:5a:51,ARP,42,Who has 192.168.56.101? Tell 192.168.56.1
1,2,1.021749,0a:00:27:00:00:00,5a:94:d2:14:5a:51,ARP,42,Who has 192.168.56.101? Tell 192.168.56.1
2,3,2.044526,0a:00:27:00:00:00,5a:94:d2:14:5a:51,ARP,42,Who has 192.168.56.101? Tell 192.168.56.1
3,4,3.891148,0a:00:27:00:00:00,Broadcast,ARP,42,Who has 192.168.56.101? Tell 192.168.56.1
4,5,4.892067,0a:00:27:00:00:00,Broadcast,ARP,42,Who has 192.168.56.101? Tell 192.168.56.1
5,6,5.92046,0a:00:27:00:00:00,Broadcast,ARP,42,Who has 192.168.56.101? Tell 192.168.56.1
6,7,7.943766,0a:00:27:00:00:00,Broadcast,ARP,42,Who has 192.168.56.101? Tell 192.168.56.1
7,8,8.95629,0a:00:27:00:00:00,Broadcast,ARP,42,Who has 192.168.56.101? Tell 192.168.56.1
8,9,9.839106,5a:94:d2:14:5a:51,Broadcast,ARP,42,Who has 192.168.56.101? (ARP Probe)
9,10,9.839108,5a:94:d2:14:5a:51,Broadcast,ARP,42,Who has 192.168.56.101? (ARP Probe)
10,11,9.979967,0a:00:27:00:00:00,Broadcast,ARP,42,Who has 192.168.56.101? Tell 192.168.56.1
11,12,10.839842,5a:94:d2:14:5a:51,Broadcast,ARP,42,Who has 192.168.56.101? (ARP Probe)
12,13,10.839846,5a:94:d2:14:5a:51,Broadcast,ARP,42,Who has 192.168.56.101? (ARP Probe)
13,14,11.838995,5a:94:d2:14:5a:51,Broadcast,ARP,42,Who has 192.168.56.101? (ARP Probe)
14,15,11.838999,5a:94:d2:14:5a:51,Broadcast,ARP,42,Who has 192.168.56.101? (ARP Probe)
15,16,12.008162,0a:00:27:00:00:00,Broadcast,ARP,42,Who has 192.168.56.101? Tell 192.168.56.1
16,17,12.842976,5a:94:d2:14:5a:51,Broadcast,ARP,42,Who has 192.168.56.1? Tell 192.168.56.101
17,18,12.842979,5a:94:d2:14:5a:51,Broadcast,ARP,42,Who has 192.168.56.1? Tell 192.168.56.101
18,19,12.843011,0a:00:27:00:00:00,5a:94:d2:14:5a:51,ARP,42,192.168.56.1 is at 0a:00:27:00:00:00
19,20,12.851427,192.168.56.101,224.0.0.252,LLMNR,66,Standard query 0xd671 A isatap
20,21,12.851428,192.168.56.101,224.0.0.252,LLMNR,66,Standard query 0xd671 A isatap
21,22,12.852795,192.168.56.101,224.0.0.22,IGMPv3,54,Membership Report / Leave group 224.0.0.252
22,23,12.852796,192.168.56.101,224.0.0.22,IGMPv3,54,Membership Report / Leave group 224.0.0.252
23,24,12.876482,192.168.56.101,224.0.0.22,IGMPv3,54,Membership Report / Join group 224.0.0.252 for any sources
24,25,12.876484,192.168.56.101,224.0.0.22,IGMPv3,54,Membership Report / Join group 224.0.0.252 for any sources
25,26,12.878972,192.168.56.101,224.0.0.252,LLMNR,64,Standard query 0x4163 ANY None
26,27,12.878973,192.168.56.101,224.0.0.252,LLMNR,64,Standard query 0x4163 ANY None
27,28,12.929288,192.168.56.101,192.168.56.255,NBNS,110,Registration NB NONE<20>
28,29,12.929291,192.168.56.101,192.168.56.255,NBNS,110,Registration NB NONE<20>
29,30,12.930025,192.168.56.101,192.168.56.255,NBNS,110,Registration NB NONE<00>
30,31,12.930027,192.168.56.101,192.168.56.255,NBNS,110,Registration NB NONE<00>
31,32,12.930081,192.168.56.101,192.168.56.255,NBNS,110,Registration NB WORKGROUP<00>
32,33,12.930082,192.168.56.101,192.168.56.255,NBNS,110,Registration NB WORKGROUP<00>
33,34,12.937097,192.168.56.101,224.0.0.22,IGMPv3,54,Membership Report / Join group 239.255.255.250 for any sources
34,35,12.937099,192.168.56.101,224.0.0.22,IGMPv3,54,Membership Report / Join group 239.255.255.250 for any sources
35,36,12.950899,192.168.56.101,224.0.0.252,LLMNR,66,Standard query 0xd671 A isatap
36,37,12.950916,192.168.56.101,224.0.0.252,LLMNR,66,Standard query 0xd671 A isatap
37,38,12.965834,192.168.56.101,224.0.0.252,LLMNR,64,Standard query 0x4163 ANY None
38,39,12.965836,192.168.56.101,224.0.0.252,LLMNR,64,Standard query 0x4163 ANY None
39,40,13.014385,5a:94:d2:14:5a:51,Broadcast,ARP,42,Who has 192.168.56.1? Tell 192.168.56.101
40,41,13.014387,5a:94:d2:14:5a:51,Broadcast,ARP,42,Who has 192.168.56.1? Tell 192.168.56.101
41,42,13.014397,0a:00:27:00:00:00,5a:94:d2:14:5a:51,ARP,42,192.168.56.1 is at 0a:00:27:00:00:00
42,43,13.153015,192.168.56.101,192.168.56.255,NBNS,92,Name query NB ISATAP<00>
43,44,13.153019,192.168.56.101,192.168.56.255,NBNS,92,Name query NB ISATAP<00>
44,45,13.168359,192.168.56.101,239.255.255.250,SSDP,175,M-SEARCH * HTTP/1.1 
45,46,13.168363,192.168.56.101,239.255.255.250,SSDP,175,M-SEARCH * HTTP/1.1 
46,47,13.340774,192.168.56.101,224.0.0.22,IGMPv3,62,Membership Report / Join group 224.0.0.252 for any sources / Join group 239.255.255.250 for any sources
47,48,13.340778,192.168.56.101,224.0.0.22,IGMPv3,62,Membership Report / Join group 224.0.0.252 for any sources / Join group 239.255.255.250 for any sources
48,49,13.60654,192.168.56.101,239.255.255.250,SSDP,139,M-SEARCH * HTTP/1.1 
49,50,13.606541,192.168.56.101,239.255.255.250,SSDP,139,M-SEARCH * HTTP/1.1 
50,51,13.622059,192.168.56.101,239.255.255.250,SSDP,171,M-SEARCH * HTTP/1.1 
51,52,13.622061,192.168.56.101,239.255.255.250,SSDP,171,M-SEARCH * HTTP/1.1 
52,53,13.669647,192.168.56.101,192.168.56.255,NBNS,110,Registration NB WORKGROUP<00>
53,54,13.669652,192.168.56.101,192.168.56.255,NBNS,110,Registration NB WORKGROUP<00>
54,55,13.669717,192.168.56.101,192.168.56.255,NBNS,110,Registration NB NONE<00>
55,56,13.669718,192.168.56.101,192.168.56.255,NBNS,110,Registration NB NONE<00>
56,57,13.669756,192.168.56.101,192.168.56.255,NBNS,110,Registration NB NONE<20>
57,58,13.669757,192.168.56.101,192.168.56.255,NBNS,110,Registration NB NONE<20>
58,59,13.798921,192.168.56.101,239.255.255.250,UDP,666,57521  >  3702 Len=624
59,60,13.798925,192.168.56.101,239.255.255.250,UDP,666,57521  >  3702 Len=624
60,61,13.887161,192.168.56.101,239.255.255.250,UDP,666,57521  >  3702 Len=624
61,62,13.887168,192.168.56.101,239.255.255.250,UDP,666,57521  >  3702 Len=624
62,63,13.902262,192.168.56.101,192.168.56.255,NBNS,92,Name query NB ISATAP<00>
63,64,13.902266,192.168.56.101,192.168.56.255,NBNS,92,Name query NB ISATAP<00>
64,65,14.311526,192.168.56.101,224.0.0.252,LLMNR,64,Standard query 0x21c1 A wpad
65,66,14.311528,192.168.56.101,224.0.0.252,LLMNR,64,Standard query 0x21c1 A wpad
66,67,14.402994,192.168.56.101,224.0.0.252,LLMNR,64,Standard query 0x21c1 A wpad
67,68,14.402995,192.168.56.101,224.0.0.252,LLMNR,64,Standard query 0x21c1 A wpad
68,69,14.41718,192.168.56.101,192.168.56.255,NBNS,110,Registration NB NONE<20>
69,70,14.417184,192.168.56.101,192.168.56.255,NBNS,110,Registration NB NONE<20>
70,71,14.417276,192.168.56.101,192.168.56.255,NBNS,110,Registration NB NONE<00>
71,72,14.417278,192.168.56.101,192.168.56.255,NBNS,110,Registration NB NONE<00>
72,73,14.417317,192.168.56.101,192.168.56.255,NBNS,110,Registration NB WORKGROUP<00>
73,74,14.417318,192.168.56.101,192.168.56.255,NBNS,110,Registration NB WORKGROUP<00>
74,75,14.606472,192.168.56.101,192.168.56.255,NBNS,92,Name query NB WPAD<00>
75,76,14.606474,192.168.56.101,192.168.56.255,NBNS,92,Name query NB WPAD<00>
76,77,14.65815,192.168.56.101,192.168.56.255,NBNS,92,Name query NB ISATAP<00>
77,78,14.658154,192.168.56.101,192.168.56.255,NBNS,92,Name query NB ISATAP<00>
78,79,15.17217,192.168.56.101,192.168.56.255,NBNS,110,Registration NB WORKGROUP<00>
79,80,15.172174,192.168.56.101,192.168.56.255,NBNS,110,Registration NB WORKGROUP<00>
80,81,15.172233,192.168.56.101,192.168.56.255,NBNS,110,Registration NB NONE<00>
81,82,15.172234,192.168.56.101,192.168.56.255,NBNS,110,Registration NB NONE<00>
82,83,15.17227,192.168.56.101,192.168.56.255,NBNS,110,Registration NB NONE<20>
83,84,15.172271,192.168.56.101,192.168.56.255,NBNS,110,Registration NB NONE<20>
84,85,15.355954,192.168.56.101,192.168.56.255,NBNS,92,Name query NB WPAD<00>
85,86,15.355963,192.168.56.101,192.168.56.255,NBNS,92,Name query NB WPAD<00>
86,87,15.414031,192.168.56.101,224.0.0.252,LLMNR,66,Standard query 0xc4c8 A isatap
87,88,15.414032,192.168.56.101,224.0.0.252,LLMNR,66,Standard query 0xc4c8 A isatap
88,89,15.511544,192.168.56.101,224.0.0.252,LLMNR,66,Standard query 0xc4c8 A isatap
89,90,15.511546,192.168.56.101,224.0.0.252,LLMNR,66,Standard query 0xc4c8 A isatap
90,91,15.722824,192.168.56.101,192.168.56.255,NBNS,92,Name query NB ISATAP<00>
91,92,15.722828,192.168.56.101,192.168.56.255,NBNS,92,Name query NB ISATAP<00>
92,93,15.892909,192.168.56.101,8.8.8.8,DNS,85,Standard query 0x971a A teredo.ipv6.microsoft.com
93,94,15.914656,8.8.8.8,192.168.56.101,DNS,158,Standard query response 0x971a No such name A teredo.ipv6.microsoft.com SOA ns1-04.azure-dns.com
94,95,15.921307,192.168.56.101,192.168.56.255,NBNS,110,Registration NB WORKGROUP<1e>
95,96,15.921312,192.168.56.101,192.168.56.255,NBNS,110,Registration NB WORKGROUP<1e>
96,97,16.105163,192.168.56.101,192.168.56.255,NBNS,92,Name query NB WPAD<00>
97,98,16.105166,192.168.56.101,192.168.56.255,NBNS,92,Name query NB WPAD<00>
98,99,16.168892,192.168.56.101,239.255.255.250,SSDP,175,M-SEARCH * HTTP/1.1 
99,100,16.168896,192.168.56.101,239.255.255.250,SSDP,175,M-SEARCH * HTTP/1.1 
100,101,16.231756,192.168.56.101,239.255.255.250,SSDP,171,M-SEARCH * HTTP/1.1 
101,102,16.231758,192.168.56.101,239.255.255.250,SSDP,171,M-SEARCH * HTTP/1.1 
102,103,16.26311,192.168.56.101,239.255.255.250,SSDP,139,M-SEARCH * HTTP/1.1 
103,104,16.263112,192.168.56.101,239.255.255.250,SSDP,139,M-SEARCH * HTTP/1.1 
104,105,16.294607,192.168.56.101,239.255.255.250,SSDP,175,M-SEARCH * HTTP/1.1 
105,106,16.294609,192.168.56.101,239.255.255.250,SSDP,175,M-SEARCH * HTTP/1.1 
106,107,16.465701,192.168.56.101,192.168.56.255,NBNS,92,Name query NB ISATAP<00>
107,108,16.465705,192.168.56.101,192.168.56.255,NBNS,92,Name query NB ISATAP<00>
108,109,16.606772,192.168.56.101,239.255.255.250,SSDP,139,M-SEARCH * HTTP/1.1 
109,110,16.606774,192.168.56.101,239.255.255.250,SSDP,139,M-SEARCH * HTTP/1.1 
110,111,16.621845,192.168.56.101,239.255.255.250,SSDP,171,M-SEARCH * HTTP/1.1 
111,112,16.621847,192.168.56.101,239.255.255.250,SSDP,171,M-SEARCH * HTTP/1.1 
112,113,16.669954,192.168.56.101,192.168.56.255,NBNS,110,Registration NB WORKGROUP<1e>
113,114,16.669959,192.168.56.101,192.168.56.255,NBNS,110,Registration NB WORKGROUP<1e>
114,115,16.876037,192.168.56.101,8.8.8.8,DNS,76,Standard query 0xab76 A www.msftncsi.com
115,116,16.907991,8.8.8.8,192.168.56.101,DNS,182,Standard query response 0xab76 A www.msftncsi.com CNAME www.msftncsi.com.edgesuite.net CNAME a1961.g2.akamai.net A 96.17.176.171 A 96.17.176.177
116,117,16.916667,192.168.56.101,96.17.176.171,TCP,66,49160  >  80 [SYN] Seq=0 Win=8192 Len=0 MSS=1460 WS=256 SACK_PERM=1
117,118,16.933908,96.17.176.171,192.168.56.101,TCP,58,"80  >  49160 [SYN, ACK] Seq=0 Ack=1 Win=65535 Len=0 MSS=1460"
118,119,16.934088,192.168.56.101,96.17.176.171,TCP,54,49160  >  80 [ACK] Seq=1 Ack=1 Win=64240 Len=0
119,120,16.934983,192.168.56.101,96.17.176.171,HTTP,151,GET /ncsi.txt HTTP/1.1 
120,121,16.936666,96.17.176.171,192.168.56.101,TCP,54,80  >  49160 [ACK] Seq=1 Ack=98 Win=65535 Len=0
121,122,16.953229,96.17.176.171,192.168.56.101,HTTP,233,HTTP/1.1 200 OK  (text/plain)
122,123,16.95324,96.17.176.171,192.168.56.101,TCP,54,"80  >  49160 [FIN, ACK] Seq=180 Ack=98 Win=65535 Len=0"
123,124,16.953489,192.168.56.101,96.17.176.171,TCP,54,49160  >  80 [ACK] Seq=98 Ack=181 Win=64061 Len=0
124,125,16.95396,192.168.56.101,96.17.176.171,TCP,54,"49160  >  80 [FIN, ACK] Seq=98 Ack=181 Win=64061 Len=0"
125,126,16.954087,96.17.176.171,192.168.56.101,TCP,54,80  >  49160 [ACK] Seq=181 Ack=99 Win=65535 Len=0
126,127,17.216176,192.168.56.101,192.168.56.255,NBNS,92,Name query NB ISATAP<00>
127,128,17.21618,192.168.56.101,192.168.56.255,NBNS,92,Name query NB ISATAP<00>
128,129,17.420363,192.168.56.101,192.168.56.255,NBNS,110,Registration NB WORKGROUP<1e>
129,130,17.420365,192.168.56.101,192.168.56.255,NBNS,110,Registration NB WORKGROUP<1e>
130,131,17.971184,192.168.56.101,224.0.0.252,LLMNR,66,Standard query 0x025f A isatap
131,132,17.971186,192.168.56.101,224.0.0.252,LLMNR,66,Standard query 0x025f A isatap
132,133,18.008427,5a:94:d2:14:5a:51,Broadcast,ARP,42,Who has 192.168.56.1? Tell 192.168.56.101
133,134,18.008431,5a:94:d2:14:5a:51,Broadcast,ARP,42,Who has 192.168.56.1? Tell 192.168.56.101
134,135,18.008441,0a:00:27:00:00:00,5a:94:d2:14:5a:51,ARP,42,192.168.56.1 is at 0a:00:27:00:00:00
135,136,18.167296,192.168.56.101,192.168.56.255,NBNS,110,Registration NB WORKGROUP<1e>
136,137,18.1673,192.168.56.101,192.168.56.255,NBNS,110,Registration NB WORKGROUP<1e>
137,138,18.344043,192.168.56.101,224.0.0.252,LLMNR,66,Standard query 0x025f A isatap
138,139,18.344045,192.168.56.101,224.0.0.252,LLMNR,66,Standard query 0x025f A isatap
139,140,18.551977,192.168.56.101,192.168.56.255,NBNS,92,Name query NB ISATAP<00>
140,141,18.551981,192.168.56.101,192.168.56.255,NBNS,92,Name query NB ISATAP<00>
141,142,18.92042,192.168.56.101,192.168.56.255,BROWSER,217,Request Announcement NONE
142,143,18.920424,192.168.56.101,192.168.56.255,BROWSER,217,Request Announcement NONE
143,144,18.936403,192.168.56.101,192.168.56.255,BROWSER,243,"Host Announcement NONE, Workstation, Server, NT Workstation, Potential Browser"
144,145,18.936406,192.168.56.101,192.168.56.255,BROWSER,243,"Host Announcement NONE, Workstation, Server, NT Workstation, Potential Browser"
145,146,19.179293,192.168.56.101,239.255.255.250,SSDP,175,M-SEARCH * HTTP/1.1 
146,147,19.179297,192.168.56.101,239.255.255.250,SSDP,175,M-SEARCH * HTTP/1.1 
147,148,19.292423,192.168.56.101,192.168.56.255,NBNS,92,Name query NB ISATAP<00>
148,149,19.292427,192.168.56.101,192.168.56.255,NBNS,92,Name query NB ISATAP<00>
149,150,19.324681,192.168.56.101,239.255.255.250,SSDP,171,M-SEARCH * HTTP/1.1 
150,151,19.324683,192.168.56.101,239.255.255.250,SSDP,171,M-SEARCH * HTTP/1.1 
151,152,19.370823,192.168.56.101,239.255.255.250,SSDP,139,M-SEARCH * HTTP/1.1 
152,153,19.370825,192.168.56.101,239.255.255.250,SSDP,139,M-SEARCH * HTTP/1.1 
153,154,19.417823,192.168.56.101,239.255.255.250,SSDP,175,M-SEARCH * HTTP/1.1 
154,155,19.417827,192.168.56.101,239.255.255.250,SSDP,175,M-SEARCH * HTTP/1.1 
155,156,19.605739,192.168.56.101,239.255.255.250,SSDP,139,M-SEARCH * HTTP/1.1 
156,157,19.605741,192.168.56.101,239.255.255.250,SSDP,139,M-SEARCH * HTTP/1.1 
157,158,19.6206,192.168.56.101,239.255.255.250,SSDP,171,M-SEARCH * HTTP/1.1 
158,159,19.620602,192.168.56.101,239.255.255.250,SSDP,171,M-SEARCH * HTTP/1.1 
159,160,20.043068,192.168.56.101,192.168.56.255,NBNS,92,Name query NB ISATAP<00>
160,161,20.043072,192.168.56.101,192.168.56.255,NBNS,92,Name query NB ISATAP<00>
161,162,20.417462,192.168.56.101,192.168.56.255,BROWSER,217,Request Announcement NONE
162,163,20.417466,192.168.56.101,192.168.56.255,BROWSER,217,Request Announcement NONE
163,164,20.802656,192.168.56.101,224.0.0.252,LLMNR,66,Standard query 0xc9cb A isatap
164,165,20.802659,192.168.56.101,224.0.0.252,LLMNR,66,Standard query 0xc9cb A isatap
165,166,20.902777,192.168.56.101,224.0.0.252,LLMNR,66,Standard query 0xc9cb A isatap
166,167,20.902779,192.168.56.101,224.0.0.252,LLMNR,66,Standard query 0xc9cb A isatap
167,168,21.105555,192.168.56.101,192.168.56.255,NBNS,92,Name query NB ISATAP<00>
168,169,21.105556,192.168.56.101,192.168.56.255,NBNS,92,Name query NB ISATAP<00>
169,170,21.855288,192.168.56.101,192.168.56.255,NBNS,92,Name query NB ISATAP<00>
170,171,21.855292,192.168.56.101,192.168.56.255,NBNS,92,Name query NB ISATAP<00>
171,172,21.918086,192.168.56.101,192.168.56.255,BROWSER,217,Request Announcement NONE
172,173,21.91809,192.168.56.101,192.168.56.255,BROWSER,217,Request Announcement NONE
173,174,22.176193,192.168.56.101,239.255.255.250,SSDP,175,M-SEARCH * HTTP/1.1 
174,175,22.176197,192.168.56.101,239.255.255.250,SSDP,175,M-SEARCH * HTTP/1.1 
175,176,22.604917,192.168.56.101,192.168.56.255,NBNS,92,Name query NB ISATAP<00>
176,177,22.60492,192.168.56.101,192.168.56.255,NBNS,92,Name query NB ISATAP<00>
177,178,23.360504,192.168.56.101,224.0.0.252,LLMNR,66,Standard query 0x96f1 A isatap
178,179,23.360506,192.168.56.101,224.0.0.252,LLMNR,66,Standard query 0x96f1 A isatap
179,180,23.421372,192.168.56.101,192.168.56.255,BROWSER,217,Request Announcement NONE
180,181,23.421375,192.168.56.101,192.168.56.255,BROWSER,217,Request Announcement NONE
181,182,23.467602,192.168.56.101,224.0.0.252,LLMNR,66,Standard query 0x96f1 A isatap
182,183,23.467603,192.168.56.101,224.0.0.252,LLMNR,66,Standard query 0x96f1 A isatap
183,184,23.668338,192.168.56.101,192.168.56.255,NBNS,92,Name query NB ISATAP<00>
184,185,23.668342,192.168.56.101,192.168.56.255,NBNS,92,Name query NB ISATAP<00>
185,186,24.417301,192.168.56.101,192.168.56.255,NBNS,92,Name query NB ISATAP<00>
186,187,24.417305,192.168.56.101,192.168.56.255,NBNS,92,Name query NB ISATAP<00>
187,188,24.917389,192.168.56.101,192.168.56.255,BROWSER,229,Browser Election Request
188,189,24.917391,192.168.56.101,192.168.56.255,BROWSER,229,Browser Election Request
189,190,25.167983,192.168.56.101,192.168.56.255,NBNS,92,Name query NB ISATAP<00>
190,191,25.167987,192.168.56.101,192.168.56.255,NBNS,92,Name query NB ISATAP<00>
191,192,25.169524,192.168.56.101,239.255.255.250,SSDP,175,M-SEARCH * HTTP/1.1 
192,193,25.169526,192.168.56.101,239.255.255.250,SSDP,175,M-SEARCH * HTTP/1.1 
193,194,25.921083,192.168.56.101,192.168.56.255,BROWSER,229,Browser Election Request
194,195,25.921087,192.168.56.101,192.168.56.255,BROWSER,229,Browser Election Request
195,196,26.919055,192.168.56.101,192.168.56.255,BROWSER,229,Browser Election Request
196,197,26.919059,192.168.56.101,192.168.56.255,BROWSER,229,Browser Election Request
197,198,27.921437,192.168.56.101,192.168.56.255,BROWSER,229,Browser Election Request
198,199,27.921441,192.168.56.101,192.168.56.255,BROWSER,229,Browser Election Request
199,200,28.919281,192.168.56.101,192.168.56.255,NBNS,110,Registration NB WORKGROUP<1d>
200,201,28.919285,192.168.56.101,192.168.56.255,NBNS,110,Registration NB WORKGROUP<1d>
201,202,29.667895,192.168.56.101,192.168.56.255,NBNS,110,Registration NB WORKGROUP<1d>
202,203,29.667902,192.168.56.101,192.168.56.255,NBNS,110,Registration NB WORKGROUP<1d>
203,204,30.41791,192.168.56.101,192.168.56.255,NBNS,110,Registration NB WORKGROUP<1d>
204,205,30.417914,192.168.56.101,192.168.56.255,NBNS,110,Registration NB WORKGROUP<1d>
205,206,31.167176,192.168.56.101,192.168.56.255,NBNS,110,Registration NB WORKGROUP<1d>
206,207,31.16718,192.168.56.101,192.168.56.255,NBNS,110,Registration NB WORKGROUP<1d>
207,208,31.918998,192.168.56.101,192.168.56.255,NBNS,110,Registration NB <01><02>__MSBROWSE__<02><01>
208,209,31.919003,192.168.56.101,192.168.56.255,NBNS,110,Registration NB <01><02>__MSBROWSE__<02><01>
209,210,32.672528,192.168.56.101,192.168.56.255,NBNS,110,Registration NB <01><02>__MSBROWSE__<02><01>
210,211,32.672533,192.168.56.101,192.168.56.255,NBNS,110,Registration NB <01><02>__MSBROWSE__<02><01>
211,212,33.420715,192.168.56.101,192.168.56.255,NBNS,110,Registration NB <01><02>__MSBROWSE__<02><01>
212,213,33.420719,192.168.56.101,192.168.56.255,NBNS,110,Registration NB <01><02>__MSBROWSE__<02><01>
213,214,34.167159,192.168.56.101,192.168.56.255,NBNS,110,Registration NB <01><02>__MSBROWSE__<02><01>
214,215,34.167163,192.168.56.101,192.168.56.255,NBNS,110,Registration NB <01><02>__MSBROWSE__<02><01>
215,216,34.921011,192.168.56.101,192.168.56.255,BROWSER,217,Request Announcement NONE
216,217,34.921015,192.168.56.101,192.168.56.255,BROWSER,217,Request Announcement NONE
217,218,34.921106,192.168.56.101,192.168.56.255,BROWSER,217,Request Announcement NONE
218,219,34.921108,192.168.56.101,192.168.56.255,BROWSER,217,Request Announcement NONE
219,220,34.922054,192.168.56.101,192.168.56.255,BROWSER,247,"Domain/Workgroup Announcement WORKGROUP, NT Workstation, Domain Enum"
220,221,34.922056,192.168.56.101,192.168.56.255,BROWSER,247,"Domain/Workgroup Announcement WORKGROUP, NT Workstation, Domain Enum"
221,222,37.330897,192.168.56.101,192.168.56.255,BROWSER,243,"Local Master Announcement NONE, Workstation, Server, NT Workstation, Potential Browser, Master Browser"
222,223,37.330901,192.168.56.101,192.168.56.255,BROWSER,243,"Local Master Announcement NONE, Workstation, Server, NT Workstation, Potential Browser, Master Browser"
223,224,47.545101,192.168.56.101,239.255.255.250,SSDP,175,M-SEARCH * HTTP/1.1 
224,225,47.545105,192.168.56.101,239.255.255.250,SSDP,175,M-SEARCH * HTTP/1.1 
225,226,48.520014,192.168.56.101,224.0.0.252,LLMNR,64,Standard query 0x6e6e A wpad
226,227,48.520016,192.168.56.101,224.0.0.252,LLMNR,64,Standard query 0x6e6e A wpad
227,228,48.62463,192.168.56.101,224.0.0.252,LLMNR,64,Standard query 0x6e6e A wpad
228,229,48.624631,192.168.56.101,224.0.0.252,LLMNR,64,Standard query 0x6e6e A wpad
229,230,48.832441,192.168.56.101,192.168.56.255,NBNS,92,Name query NB WPAD<00>
230,231,48.832444,192.168.56.101,192.168.56.255,NBNS,92,Name query NB WPAD<00>
231,232,49.574074,192.168.56.101,192.168.56.255,NBNS,92,Name query NB WPAD<00>
232,233,49.574078,192.168.56.101,192.168.56.255,NBNS,92,Name query NB WPAD<00>
233,234,50.328525,192.168.56.101,192.168.56.255,NBNS,92,Name query NB WPAD<00>
234,235,50.328529,192.168.56.101,192.168.56.255,NBNS,92,Name query NB WPAD<00>
235,236,50.543865,192.168.56.101,239.255.255.250,SSDP,175,M-SEARCH * HTTP/1.1 
236,237,50.543869,192.168.56.101,239.255.255.250,SSDP,175,M-SEARCH * HTTP/1.1 
237,238,51.085434,192.168.56.101,8.8.8.8,DNS,79,Standard query 0x6cfb A clients2.google.com
238,239,51.108304,8.8.8.8,192.168.56.101,DNS,199,Standard query response 0x6cfb A clients2.google.com CNAME clients.l.google.com A 142.250.114.102 A 142.250.114.113 A 142.250.114.100 A 142.250.114.138 A 142.250.114.101 A 142.250.114.139
239,240,51.235423,192.168.56.101,142.250.114.102,TCP,66,49167  >  443 [SYN] Seq=0 Win=8192 Len=0 MSS=1460 WS=256 SACK_PERM=1
240,241,51.254592,142.250.114.102,192.168.56.101,TCP,58,"443  >  49167 [SYN, ACK] Seq=0 Ack=1 Win=65535 Len=0 MSS=1460"
241,242,51.254969,192.168.56.101,142.250.114.102,TCP,54,49167  >  443 [ACK] Seq=1 Ack=1 Win=64240 Len=0
242,243,51.375902,192.168.56.101,142.250.114.102,TLSv1.2,215,Client Hello
243,244,51.376389,142.250.114.102,192.168.56.101,TCP,54,443  >  49167 [ACK] Seq=1 Ack=162 Win=65535 Len=0
244,245,51.397377,142.250.114.102,192.168.56.101,TLSv1.2,1466,Server Hello
245,246,51.397872,142.250.114.102,192.168.56.101,TCP,1466,"443  >  49167 [PSH, ACK] Seq=1413 Ack=162 Win=65535 Len=1412 [TCP segment of a reassembled PDU]"
246,247,51.398018,192.168.56.101,142.250.114.102,TCP,54,49167  >  443 [ACK] Seq=162 Ack=2825 Win=64240 Len=0
247,248,51.398192,142.250.114.102,192.168.56.101,TCP,1514,443  >  49167 [ACK] Seq=2825 Ack=162 Win=65535 Len=1460 [TCP segment of a reassembled PDU]
248,249,51.398205,142.250.114.102,192.168.56.101,TCP,1514,443  >  49167 [ACK] Seq=4285 Ack=162 Win=65535 Len=1460 [TCP segment of a reassembled PDU]
249,250,51.398206,142.250.114.102,192.168.56.101,TLSv1.2,970,"Certificate, Server Key Exchange, Server Hello Done"
250,251,51.398307,192.168.56.101,142.250.114.102,TCP,54,49167  >  443 [ACK] Seq=162 Ack=6661 Win=64240 Len=0
251,252,51.432109,192.168.56.101,142.250.114.102,TLSv1.2,180,"Client Key Exchange, Change Cipher Spec, Encrypted Handshake Message"
252,253,51.432293,142.250.114.102,192.168.56.101,TCP,54,443  >  49167 [ACK] Seq=6661 Ack=288 Win=65535 Len=0
253,254,51.457467,142.250.114.102,192.168.56.101,TLSv1.2,105,"Change Cipher Spec, Encrypted Handshake Message"
254,255,51.667416,192.168.56.101,142.250.114.102,TCP,54,49167  >  443 [ACK] Seq=288 Ack=6712 Win=64189 Len=0
255,256,51.863649,192.168.56.101,142.250.114.102,TLSv1.2,577,Application Data
256,257,51.864002,142.250.114.102,192.168.56.101,TCP,54,443  >  49167 [ACK] Seq=6712 Ack=811 Win=65535 Len=0
257,258,51.893493,142.250.114.102,192.168.56.101,TLSv1.2,333,Application Data
258,259,51.922313,192.168.56.101,142.250.114.102,TCP,54,"49167  >  443 [RST, ACK] Seq=811 Ack=6991 Win=0 Len=0"
259,260,53.543308,192.168.56.101,239.255.255.250,SSDP,175,M-SEARCH * HTTP/1.1 
260,261,53.543311,192.168.56.101,239.255.255.250,SSDP,175,M-SEARCH * HTTP/1.1 
261,262,94.92264,192.168.56.101,192.168.56.255,BROWSER,247,"Domain/Workgroup Announcement WORKGROUP, NT Workstation, Domain Enum"
262,263,94.922643,192.168.56.101,192.168.56.255,BROWSER,247,"Domain/Workgroup Announcement WORKGROUP, NT Workstation, Domain Enum"
263,264,107.396769,192.168.56.101,8.8.8.8,DNS,76,Standard query 0x09c0 A time.windows.com
264,265,107.44004,8.8.8.8,192.168.56.101,DNS,128,Standard query response 0x09c0 A time.windows.com CNAME twc.trafficmanager.net A 40.119.6.228
265,266,107.525242,192.168.56.101,40.119.6.228,NTP,90,"NTP Version 3, client"
266,267,107.54594,40.119.6.228,192.168.56.101,NTP,90,"NTP Version 3, server"
267,268,155.01303,192.168.56.101,192.168.56.255,BROWSER,247,"Domain/Workgroup Announcement WORKGROUP, NT Workstation, Domain Enum"
268,269,155.013032,192.168.56.101,192.168.56.255,BROWSER,247,"Domain/Workgroup Announcement WORKGROUP, NT Workstation, Domain Enum"
269,270,182.606796,192.168.56.101,185.13.38.75,TCP,66,49230  >  9001 [SYN] Seq=0 Win=8192 Len=0 MSS=1460 WS=256 SACK_PERM=1
270,271,182.608788,192.168.56.101,128.31.0.39,TCP,66,49231  >  9101 [SYN] Seq=0 Win=8192 Len=0 MSS=1460 WS=256 SACK_PERM=1
271,272,182.671221,128.31.0.39,192.168.56.101,TCP,58,"9101  >  49231 [SYN, ACK] Seq=0 Ack=1 Win=65535 Len=0 MSS=1460"
272,273,182.671413,192.168.56.101,128.31.0.39,TCP,54,49231  >  9101 [ACK] Seq=1 Ack=1 Win=64240 Len=0
273,274,182.69987,192.168.56.101,128.31.0.39,TLSv1.2,267,Client Hello
274,275,182.700062,128.31.0.39,192.168.56.101,TCP,54,9101  >  49231 [ACK] Seq=1 Ack=214 Win=65535 Len=0
275,276,182.752025,128.31.0.39,192.168.56.101,TLSv1.2,1072,"Server Hello, Certificate, Server Key Exchange, Server Hello Done"
276,277,182.758181,192.168.56.101,128.31.0.39,TLSv1.2,180,"Client Key Exchange, Change Cipher Spec, Encrypted Handshake Message"
277,278,182.758353,128.31.0.39,192.168.56.101,TCP,54,9101  >  49231 [ACK] Seq=1019 Ack=340 Win=65535 Len=0
278,279,182.810703,128.31.0.39,192.168.56.101,TLSv1.2,105,"Change Cipher Spec, Encrypted Handshake Message"
279,280,182.813967,192.168.56.101,128.31.0.39,TLSv1.2,92,Application Data
280,281,182.814102,128.31.0.39,192.168.56.101,TCP,54,9101  >  49231 [ACK] Seq=1070 Ack=378 Win=65535 Len=0
281,282,182.864548,128.31.0.39,192.168.56.101,TCP,1514,9101  >  49231 [ACK] Seq=1070 Ack=378 Win=65535 Len=1460 [TCP segment of a reassembled PDU]
282,283,182.864562,128.31.0.39,192.168.56.101,TLSv1.2,680,Application Data
283,284,182.864754,192.168.56.101,128.31.0.39,TCP,54,49231  >  9101 [ACK] Seq=378 Ack=3156 Win=64240 Len=0
284,285,182.871463,192.168.56.101,128.31.0.39,TLSv1.2,1111,Application Data
285,286,182.871615,128.31.0.39,192.168.56.101,TCP,54,9101  >  49231 [ACK] Seq=3156 Ack=1435 Win=65535 Len=0
286,287,182.928986,128.31.0.39,192.168.56.101,TLSv1.2,597,Application Data
287,288,182.951762,192.168.56.101,128.31.0.39,TLSv1.2,1111,Application Data
288,289,182.95191,128.31.0.39,192.168.56.101,TCP,54,9101  >  49231 [ACK] Seq=3699 Ack=2492 Win=65535 Len=0
289,290,183.009064,128.31.0.39,192.168.56.101,TCP,1514,"9101  >  49231 [PSH, ACK] Seq=3699 Ack=2492 Win=65535 Len=1460 [TCP segment of a reassembled PDU]"
290,291,183.009175,128.31.0.39,192.168.56.101,TCP,1514,"9101  >  49231 [PSH, ACK] Seq=5159 Ack=2492 Win=65535 Len=1460 [TCP segment of a reassembled PDU]"
291,292,183.009266,192.168.56.101,128.31.0.39,TCP,54,49231  >  9101 [ACK] Seq=2492 Ack=6619 Win=64240 Len=0
292,293,183.009417,128.31.0.39,192.168.56.101,TLSv1.2,1211,Application Data
293,294,183.009525,128.31.0.39,192.168.56.101,TCP,1514,"9101  >  49231 [PSH, ACK] Seq=7776 Ack=2492 Win=65535 Len=1460 [TCP segment of a reassembled PDU]"
294,295,183.009618,192.168.56.101,128.31.0.39,TCP,54,49231  >  9101 [ACK] Seq=2492 Ack=9236 Win=64240 Len=0
295,296,183.009701,128.31.0.39,192.168.56.101,TCP,1514,"9101  >  49231 [PSH, ACK] Seq=9236 Ack=2492 Win=65535 Len=1460 [TCP segment of a reassembled PDU]"
296,297,183.009984,128.31.0.39,192.168.56.101,TLSv1.2,1514,Application Data [TCP segment of a reassembled PDU]
297,298,183.010105,128.31.0.39,192.168.56.101,TCP,1514,"9101  >  49231 [PSH, ACK] Seq=12156 Ack=2492 Win=65535 Len=1460 [TCP segment of a reassembled PDU]"
298,299,183.010305,128.31.0.39,192.168.56.101,TCP,1514,"9101  >  49231 [PSH, ACK] Seq=13616 Ack=2492 Win=65535 Len=1460 [TCP segment of a reassembled PDU]"
299,300,183.010339,192.168.56.101,128.31.0.39,TCP,54,49231  >  9101 [ACK] Seq=2492 Ack=12156 Win=64240 Len=0
300,301,183.010477,128.31.0.39,192.168.56.101,TLSv1.2,1514,Application Data [TCP segment of a reassembled PDU]
301,302,183.010698,128.31.0.39,192.168.56.101,TLSv1.2,1514,Application Data [TCP segment of a reassembled PDU]
302,303,183.010879,192.168.56.101,128.31.0.39,TCP,54,49231  >  9101 [ACK] Seq=2492 Ack=17996 Win=58400 Len=0
303,304,183.01117,192.168.56.101,128.31.0.39,TCP,54,[TCP Window Update] 49231  >  9101 [ACK] Seq=2492 Ack=17996 Win=64240 Len=0
304,305,183.061756,128.31.0.39,192.168.56.101,TCP,1514,"9101  >  49231 [PSH, ACK] Seq=17996 Ack=2492 Win=65535 Len=1460 [TCP segment of a reassembled PDU]"
305,306,183.061878,128.31.0.39,192.168.56.101,TLSv1.2,1514,Application Data [TCP segment of a reassembled PDU]
306,307,183.062032,128.31.0.39,192.168.56.101,TCP,1514,"9101  >  49231 [PSH, ACK] Seq=20916 Ack=2492 Win=65535 Len=1460 [TCP segment of a reassembled PDU]"
307,308,183.062192,192.168.56.101,128.31.0.39,TCP,54,49231  >  9101 [ACK] Seq=2492 Ack=20916 Win=64240 Len=0
308,309,183.062246,128.31.0.39,192.168.56.101,TLSv1.2,1514,Application Data [TCP segment of a reassembled PDU]
309,310,183.062413,192.168.56.101,128.31.0.39,TCP,54,49231  >  9101 [ACK] Seq=2492 Ack=23836 Win=64240 Len=0
310,311,183.062433,128.31.0.39,192.168.56.101,TCP,1514,"9101  >  49231 [PSH, ACK] Seq=23836 Ack=2492 Win=65535 Len=1460 [TCP segment of a reassembled PDU]"
311,312,183.06262,128.31.0.39,192.168.56.101,TCP,1514,"9101  >  49231 [PSH, ACK] Seq=25296 Ack=2492 Win=65535 Len=1460 [TCP segment of a reassembled PDU]"
312,313,183.062807,128.31.0.39,192.168.56.101,TLSv1.2,1514,Application Data [TCP segment of a reassembled PDU]
313,314,183.062884,192.168.56.101,128.31.0.39,TCP,54,49231  >  9101 [ACK] Seq=2492 Ack=26756 Win=64240 Len=0
314,315,183.063048,128.31.0.39,192.168.56.101,TCP,1514,"9101  >  49231 [PSH, ACK] Seq=28216 Ack=2492 Win=65535 Len=1460 [TCP segment of a reassembled PDU]"
315,316,183.063204,128.31.0.39,192.168.56.101,TLSv1.2,1514,Application Data [TCP segment of a reassembled PDU]
316,317,183.063224,192.168.56.101,128.31.0.39,TCP,54,49231  >  9101 [ACK] Seq=2492 Ack=29676 Win=64240 Len=0
317,318,183.063409,128.31.0.39,192.168.56.101,TLSv1.2,1177,"Application Data, Application Data"
318,319,183.063506,192.168.56.101,128.31.0.39,TCP,54,49231  >  9101 [ACK] Seq=2492 Ack=32259 Win=61657 Len=0
319,320,183.066678,192.168.56.101,128.31.0.39,TCP,54,[TCP Window Update] 49231  >  9101 [ACK] Seq=2492 Ack=32259 Win=64240 Len=0
320,321,183.067411,128.31.0.39,192.168.56.101,TCP,1514,"9101  >  49231 [PSH, ACK] Seq=32259 Ack=2492 Win=65535 Len=1460 [TCP segment of a reassembled PDU]"
321,322,183.067581,128.31.0.39,192.168.56.101,TCP,1514,"9101  >  49231 [PSH, ACK] Seq=33719 Ack=2492 Win=65535 Len=1460 [TCP segment of a reassembled PDU]"
322,323,183.067672,192.168.56.101,128.31.0.39,TCP,54,49231  >  9101 [ACK] Seq=2492 Ack=35179 Win=61320 Len=0
323,324,183.067799,128.31.0.39,192.168.56.101,TLSv1.2,1514,Application Data [TCP segment of a reassembled PDU]
324,325,183.067993,128.31.0.39,192.168.56.101,TCP,1514,"9101  >  49231 [PSH, ACK] Seq=36639 Ack=2492 Win=65535 Len=1460 [TCP segment of a reassembled PDU]"
325,326,183.068156,128.31.0.39,192.168.56.101,TCP,1514,"9101  >  49231 [PSH, ACK] Seq=38099 Ack=2492 Win=65535 Len=1460 [TCP segment of a reassembled PDU]"
326,327,183.068272,192.168.56.101,128.31.0.39,TCP,54,49231  >  9101 [ACK] Seq=2492 Ack=39559 Win=56940 Len=0
327,328,183.068979,128.31.0.39,192.168.56.101,TLSv1.2,1514,Application Data [TCP segment of a reassembled PDU]
328,329,183.070697,192.168.56.101,128.31.0.39,TCP,54,49231  >  9101 [ACK] Seq=2492 Ack=41019 Win=58952 Len=0
329,330,183.075421,192.168.56.101,128.31.0.39,TCP,54,[TCP Window Update] 49231  >  9101 [ACK] Seq=2492 Ack=41019 Win=64240 Len=0
330,331,183.07606,128.31.0.39,192.168.56.101,TCP,1514,"9101  >  49231 [PSH, ACK] Seq=41019 Ack=2492 Win=65535 Len=1460 [TCP segment of a reassembled PDU]"
331,332,183.07625,128.31.0.39,192.168.56.101,TCP,1514,"9101  >  49231 [PSH, ACK] Seq=42479 Ack=2492 Win=65535 Len=1460 [TCP segment of a reassembled PDU]"
332,333,183.076415,128.31.0.39,192.168.56.101,TLSv1.2,1514,"Application Data, Application Data"
333,334,183.076561,192.168.56.101,128.31.0.39,TCP,54,49231  >  9101 [ACK] Seq=2492 Ack=43939 Win=61320 Len=0
334,335,183.076637,128.31.0.39,192.168.56.101,TCP,1514,"9101  >  49231 [PSH, ACK] Seq=45399 Ack=2492 Win=65535 Len=1460 [TCP segment of a reassembled PDU]"
335,336,183.076776,192.168.56.101,128.31.0.39,TCP,54,49231  >  9101 [ACK] Seq=2492 Ack=46859 Win=58400 Len=0
336,337,183.082027,192.168.56.101,128.31.0.39,TLSv1.2,597,Application Data
337,338,183.082122,128.31.0.39,192.168.56.101,TCP,54,9101  >  49231 [ACK] Seq=46859 Ack=3035 Win=65535 Len=0
338,339,183.085016,192.168.56.101,128.31.0.39,TCP,54,[TCP Window Update] 49231  >  9101 [ACK] Seq=3035 Ack=46859 Win=64240 Len=0
339,340,183.117967,128.31.0.39,192.168.56.101,TCP,1514,"9101  >  49231 [PSH, ACK] Seq=46859 Ack=3035 Win=65535 Len=1460 [TCP segment of a reassembled PDU]"
340,341,183.118892,128.31.0.39,192.168.56.101,TLSv1.2,1514,Application Data [TCP segment of a reassembled PDU]
341,342,183.118904,128.31.0.39,192.168.56.101,TCP,1514,9101  >  49231 [ACK] Seq=49779 Ack=3035 Win=65535 Len=1460 [TCP segment of a reassembled PDU]
342,343,183.118905,128.31.0.39,192.168.56.101,TCP,1514,9101  >  49231 [ACK] Seq=51239 Ack=3035 Win=65535 Len=1460 [TCP segment of a reassembled PDU]
343,344,183.118906,128.31.0.39,192.168.56.101,TLSv1.2,1514,Application Data [TCP segment of a reassembled PDU]
344,345,183.118907,128.31.0.39,192.168.56.101,TCP,1514,"9101  >  49231 [PSH, ACK] Seq=54159 Ack=3035 Win=65535 Len=1460 [TCP segment of a reassembled PDU]"
345,346,183.11916,192.168.56.101,128.31.0.39,TCP,54,49231  >  9101 [ACK] Seq=3035 Ack=55619 Win=64240 Len=0
346,347,183.119801,128.31.0.39,192.168.56.101,TCP,1514,9101  >  49231 [ACK] Seq=55619 Ack=3035 Win=65535 Len=1460 [TCP segment of a reassembled PDU]
347,348,183.119811,128.31.0.39,192.168.56.101,TLSv1.2,1514,Application Data [TCP segment of a reassembled PDU]
348,349,183.119812,128.31.0.39,192.168.56.101,TCP,1514,9101  >  49231 [ACK] Seq=58539 Ack=3035 Win=65535 Len=1460 [TCP segment of a reassembled PDU]
349,350,183.119813,128.31.0.39,192.168.56.101,TCP,1514,9101  >  49231 [ACK] Seq=59999 Ack=3035 Win=65535 Len=1460 [TCP segment of a reassembled PDU]
350,351,183.119813,128.31.0.39,192.168.56.101,TLSv1.2,1514,"Application Data, Application Data"
351,352,183.120001,192.168.56.101,128.31.0.39,TCP,54,49231  >  9101 [ACK] Seq=3035 Ack=62919 Win=56940 Len=0
352,353,183.12186,128.31.0.39,192.168.56.101,TCP,1514,9101  >  49231 [ACK] Seq=62919 Ack=3035 Win=65535 Len=1460 [TCP segment of a reassembled PDU]
353,354,183.121868,128.31.0.39,192.168.56.101,TLSv1.2,1514,Application Data [TCP segment of a reassembled PDU]
354,355,183.121869,128.31.0.39,192.168.56.101,TLSv1.2,1514,Application Data [TCP segment of a reassembled PDU]
355,356,183.121959,192.168.56.101,128.31.0.39,TCP,54,49231  >  9101 [ACK] Seq=3035 Ack=67299 Win=52560 Len=0
356,357,183.122799,128.31.0.39,192.168.56.101,TCP,1514,9101  >  49231 [ACK] Seq=67299 Ack=3035 Win=65535 Len=1460 [TCP segment of a reassembled PDU]
357,358,183.122808,128.31.0.39,192.168.56.101,TCP,1514,9101  >  49231 [ACK] Seq=68759 Ack=3035 Win=65535 Len=1460 [TCP segment of a reassembled PDU]
358,359,183.122809,128.31.0.39,192.168.56.101,TLSv1.2,1514,Application Data [TCP segment of a reassembled PDU]
359,360,183.12281,128.31.0.39,192.168.56.101,TCP,1514,9101  >  49231 [ACK] Seq=71679 Ack=3035 Win=65535 Len=1460 [TCP segment of a reassembled PDU]
360,361,183.12281,128.31.0.39,192.168.56.101,TCP,1514,"9101  >  49231 [PSH, ACK] Seq=73139 Ack=3035 Win=65535 Len=1460 [TCP segment of a reassembled PDU]"
361,362,183.122971,192.168.56.101,128.31.0.39,TCP,54,49231  >  9101 [ACK] Seq=3035 Ack=74599 Win=45260 Len=0
362,363,183.127694,128.31.0.39,192.168.56.101,TLSv1.2,1325,"Application Data, Application Data, Application Data"
363,364,183.128651,128.31.0.39,192.168.56.101,TCP,1514,9101  >  49231 [ACK] Seq=75870 Ack=3035 Win=65535 Len=1460 [TCP segment of a reassembled PDU]
364,365,183.128661,128.31.0.39,192.168.56.101,TCP,1514,9101  >  49231 [ACK] Seq=77330 Ack=3035 Win=65535 Len=1460 [TCP segment of a reassembled PDU]
365,366,183.128662,128.31.0.39,192.168.56.101,TLSv1.2,1514,Application Data [TCP segment of a reassembled PDU]
366,367,183.128663,128.31.0.39,192.168.56.101,TLSv1.2,1514,Application Data [TCP segment of a reassembled PDU]
367,368,183.128663,128.31.0.39,192.168.56.101,TCP,1514,"9101  >  49231 [PSH, ACK] Seq=81710 Ack=3035 Win=65535 Len=1460 [TCP segment of a reassembled PDU]"
368,369,183.128861,192.168.56.101,128.31.0.39,TCP,54,49231  >  9101 [ACK] Seq=3035 Ack=83170 Win=36689 Len=0
369,370,183.129611,128.31.0.39,192.168.56.101,TCP,1514,9101  >  49231 [ACK] Seq=83170 Ack=3035 Win=65535 Len=1460 [TCP segment of a reassembled PDU]
370,371,183.12962,128.31.0.39,192.168.56.101,TLSv1.2,1514,Application Data [TCP segment of a reassembled PDU]
371,372,183.129621,128.31.0.39,192.168.56.101,TCP,1514,9101  >  49231 [ACK] Seq=86090 Ack=3035 Win=65535 Len=1460 [TCP segment of a reassembled PDU]
372,373,183.129622,128.31.0.39,192.168.56.101,TCP,1514,9101  >  49231 [ACK] Seq=87550 Ack=3035 Win=65535 Len=1460 [TCP segment of a reassembled PDU]
373,374,183.129623,128.31.0.39,192.168.56.101,TLSv1.2,1514,Application Data [TCP segment of a reassembled PDU]
374,375,183.129788,192.168.56.101,128.31.0.39,TCP,54,49231  >  9101 [ACK] Seq=3035 Ack=90470 Win=29389 Len=0
375,376,183.13389,128.31.0.39,192.168.56.101,TCP,1514,9101  >  49231 [ACK] Seq=90470 Ack=3035 Win=65535 Len=1460 [TCP segment of a reassembled PDU]
376,377,183.133899,128.31.0.39,192.168.56.101,TCP,1514,"9101  >  49231 [PSH, ACK] Seq=91930 Ack=3035 Win=65535 Len=1460 [TCP segment of a reassembled PDU]"
377,378,183.134011,192.168.56.101,128.31.0.39,TCP,54,49231  >  9101 [ACK] Seq=3035 Ack=93390 Win=26469 Len=0
378,379,183.134453,128.31.0.39,192.168.56.101,TLSv1.2,1514,Application Data [TCP segment of a reassembled PDU]
379,380,183.134463,128.31.0.39,192.168.56.101,TLSv1.2,1514,Application Data [TCP segment of a reassembled PDU]
380,381,183.134464,128.31.0.39,192.168.56.101,TCP,1514,9101  >  49231 [ACK] Seq=96310 Ack=3035 Win=65535 Len=1460 [TCP segment of a reassembled PDU]
381,382,183.134465,128.31.0.39,192.168.56.101,TLSv1.2,1514,Application Data [TCP segment of a reassembled PDU]
382,383,183.134559,192.168.56.101,128.31.0.39,TCP,54,49231  >  9101 [ACK] Seq=3035 Ack=99230 Win=20629 Len=0
383,384,183.137399,128.31.0.39,192.168.56.101,TCP,1514,9101  >  49231 [ACK] Seq=99230 Ack=3035 Win=65535 Len=1460 [TCP segment of a reassembled PDU]
384,385,183.137408,128.31.0.39,192.168.56.101,TCP,1514,9101  >  49231 [ACK] Seq=100690 Ack=3035 Win=65535 Len=1460 [TCP segment of a reassembled PDU]
385,386,183.137409,128.31.0.39,192.168.56.101,TLSv1.2,1514,Application Data [TCP segment of a reassembled PDU]
386,387,183.13741,128.31.0.39,192.168.56.101,TCP,1514,"9101  >  49231 [PSH, ACK] Seq=103610 Ack=3035 Win=65535 Len=1460 [TCP segment of a reassembled PDU]"
387,388,183.137582,192.168.56.101,128.31.0.39,TCP,54,49231  >  9101 [ACK] Seq=3035 Ack=105070 Win=14789 Len=0
388,389,183.137764,192.168.56.101,128.31.0.39,TCP,54,[TCP Window Update] 49231  >  9101 [ACK] Seq=3035 Ack=105070 Win=18261 Len=0
389,390,183.140243,192.168.56.101,128.31.0.39,TCP,54,[TCP Window Update] 49231  >  9101 [ACK] Seq=3035 Ack=105070 Win=64240 Len=0
390,391,183.150504,192.168.56.101,128.31.0.39,TLSv1.2,1111,Application Data
391,392,183.150591,128.31.0.39,192.168.56.101,TCP,54,9101  >  49231 [ACK] Seq=105070 Ack=4092 Win=65535 Len=0
392,393,183.178532,128.31.0.39,192.168.56.101,TLSv1.2,1514,Application Data [TCP segment of a reassembled PDU]
393,394,183.17942,128.31.0.39,192.168.56.101,TCP,1514,9101  >  49231 [ACK] Seq=106530 Ack=4092 Win=65535 Len=1460 [TCP segment of a reassembled PDU]
394,395,183.179432,128.31.0.39,192.168.56.101,TCP,1514,9101  >  49231 [ACK] Seq=107990 Ack=4092 Win=65535 Len=1460 [TCP segment of a reassembled PDU]
395,396,183.179433,128.31.0.39,192.168.56.101,TLSv1.2,1514,Application Data [TCP segment of a reassembled PDU]
396,397,183.179434,128.31.0.39,192.168.56.101,TLSv1.2,1514,Application Data [TCP segment of a reassembled PDU]
397,398,183.179434,128.31.0.39,192.168.56.101,TCP,1514,"9101  >  49231 [PSH, ACK] Seq=112370 Ack=4092 Win=65535 Len=1460 [TCP segment of a reassembled PDU]"
398,399,183.179537,192.168.56.101,128.31.0.39,TCP,54,49231  >  9101 [ACK] Seq=4092 Ack=113830 Win=55480 Len=0
399,400,183.180551,128.31.0.39,192.168.56.101,TCP,1514,9101  >  49231 [ACK] Seq=113830 Ack=4092 Win=65535 Len=1460 [TCP segment of a reassembled PDU]
400,401,183.180563,128.31.0.39,192.168.56.101,TLSv1.2,1514,Application Data [TCP segment of a reassembled PDU]
401,402,183.18058,128.31.0.39,192.168.56.101,TLSv1.2,1514,Application Data [TCP segment of a reassembled PDU]
402,403,183.180588,128.31.0.39,192.168.56.101,TLSv1.2,1514,Application Data [TCP segment of a reassembled PDU]
403,404,183.180589,128.31.0.39,192.168.56.101,TCP,1514,"9101  >  49231 [PSH, ACK] Seq=119670 Ack=4092 Win=65535 Len=1460 [TCP segment of a reassembled PDU]"
404,405,183.180681,192.168.56.101,128.31.0.39,TCP,54,49231  >  9101 [ACK] Seq=4092 Ack=121130 Win=48180 Len=0
405,406,183.181507,128.31.0.39,192.168.56.101,TCP,1514,9101  >  49231 [ACK] Seq=121130 Ack=4092 Win=65535 Len=1460 [TCP segment of a reassembled PDU]
406,407,183.181519,128.31.0.39,192.168.56.101,TLSv1.2,1514,Application Data [TCP segment of a reassembled PDU]
407,408,183.18152,128.31.0.39,192.168.56.101,TCP,1514,9101  >  49231 [ACK] Seq=124050 Ack=4092 Win=65535 Len=1460 [TCP segment of a reassembled PDU]
408,409,183.181521,128.31.0.39,192.168.56.101,TCP,1514,9101  >  49231 [ACK] Seq=125510 Ack=4092 Win=65535 Len=1460 [TCP segment of a reassembled PDU]
409,410,183.181521,128.31.0.39,192.168.56.101,TLSv1.2,1514,Application Data [TCP segment of a reassembled PDU]
410,411,183.181609,192.168.56.101,128.31.0.39,TCP,54,49231  >  9101 [ACK] Seq=4092 Ack=128430 Win=40880 Len=0
411,412,183.182356,128.31.0.39,192.168.56.101,TCP,1514,9101  >  49231 [ACK] Seq=128430 Ack=4092 Win=65535 Len=1460 [TCP segment of a reassembled PDU]
412,413,183.182367,128.31.0.39,192.168.56.101,TCP,1514,9101  >  49231 [ACK] Seq=129890 Ack=4092 Win=65535 Len=1460 [TCP segment of a reassembled PDU]
413,414,183.182368,128.31.0.39,192.168.56.101,TLSv1.2,1514,Application Data [TCP segment of a reassembled PDU]
414,415,183.182369,128.31.0.39,192.168.56.101,TCP,1514,"9101  >  49231 [PSH, ACK] Seq=132810 Ack=4092 Win=65535 Len=1460 [TCP segment of a reassembled PDU]"
415,416,183.182452,192.168.56.101,128.31.0.39,TCP,54,49231  >  9101 [ACK] Seq=4092 Ack=134270 Win=35040 Len=0
416,417,183.183421,128.31.0.39,192.168.56.101,TCP,1514,9101  >  49231 [ACK] Seq=134270 Ack=4092 Win=65535 Len=1460 [TCP segment of a reassembled PDU]
417,418,183.183432,128.31.0.39,192.168.56.101,TLSv1.2,1514,"Application Data, Application Data"
418,419,183.183446,128.31.0.39,192.168.56.101,TCP,1514,9101  >  49231 [ACK] Seq=137190 Ack=4092 Win=65535 Len=1460 [TCP segment of a reassembled PDU]
419,420,183.183457,128.31.0.39,192.168.56.101,TLSv1.2,1514,Application Data [TCP segment of a reassembled PDU]
420,421,183.183458,128.31.0.39,192.168.56.101,TCP,1514,9101  >  49231 [ACK] Seq=140110 Ack=4092 Win=65535 Len=1460 [TCP segment of a reassembled PDU]
421,422,183.183459,128.31.0.39,192.168.56.101,TCP,1514,"9101  >  49231 [PSH, ACK] Seq=141570 Ack=4092 Win=65535 Len=1460 [TCP segment of a reassembled PDU]"
422,423,183.183551,192.168.56.101,128.31.0.39,TCP,54,49231  >  9101 [ACK] Seq=4092 Ack=143030 Win=26280 Len=0
423,424,183.184273,128.31.0.39,192.168.56.101,TLSv1.2,1514,"Application Data, Application Data"
424,425,183.184305,128.31.0.39,192.168.56.101,TLSv1.2,1514,Application Data [TCP segment of a reassembled PDU]
425,426,183.184306,128.31.0.39,192.168.56.101,TCP,1514,9101  >  49231 [ACK] Seq=145950 Ack=4092 Win=65535 Len=1460 [TCP segment of a reassembled PDU]
426,427,183.184307,128.31.0.39,192.168.56.101,TCP,1514,9101  >  49231 [ACK] Seq=147410 Ack=4092 Win=65535 Len=1460 [TCP segment of a reassembled PDU]
427,428,183.184308,128.31.0.39,192.168.56.101,TLSv1.2,1514,Application Data [TCP segment of a reassembled PDU]
428,429,183.18439,192.168.56.101,128.31.0.39,TCP,54,49231  >  9101 [ACK] Seq=4092 Ack=150330 Win=18980 Len=0
429,430,183.185419,128.31.0.39,192.168.56.101,TCP,1514,9101  >  49231 [ACK] Seq=150330 Ack=4092 Win=65535 Len=1460 [TCP segment of a reassembled PDU]
430,431,183.185431,128.31.0.39,192.168.56.101,TCP,1514,9101  >  49231 [ACK] Seq=151790 Ack=4092 Win=65535 Len=1460 [TCP segment of a reassembled PDU]
431,432,183.185432,128.31.0.39,192.168.56.101,TLSv1.2,1514,Application Data [TCP segment of a reassembled PDU]
432,433,183.185446,128.31.0.39,192.168.56.101,TCP,1514,9101  >  49231 [ACK] Seq=154710 Ack=4092 Win=65535 Len=1460 [TCP segment of a reassembled PDU]
433,434,183.185447,128.31.0.39,192.168.56.101,TCP,1514,9101  >  49231 [ACK] Seq=156170 Ack=4092 Win=65535 Len=1460 [TCP segment of a reassembled PDU]
434,435,183.185449,128.31.0.39,192.168.56.101,TLSv1.2,1514,Application Data [TCP segment of a reassembled PDU]
435,436,183.185529,192.168.56.101,128.31.0.39,TCP,54,49231  >  9101 [ACK] Seq=4092 Ack=159090 Win=10220 Len=0
436,437,183.186407,128.31.0.39,192.168.56.101,TCP,1514,9101  >  49231 [ACK] Seq=159090 Ack=4092 Win=65535 Len=1460 [TCP segment of a reassembled PDU]
437,438,183.186418,128.31.0.39,192.168.56.101,TLSv1.2,1514,"Application Data, Application Data"
438,439,183.186419,128.31.0.39,192.168.56.101,TLSv1.2,1514,"Application Data, Application Data"
439,440,183.18642,128.31.0.39,192.168.56.101,TCP,1514,9101  >  49231 [ACK] Seq=163470 Ack=4092 Win=65535 Len=1460 [TCP segment of a reassembled PDU]
440,441,183.186421,128.31.0.39,192.168.56.101,TCP,1514,"9101  >  49231 [PSH, ACK] Seq=164930 Ack=4092 Win=65535 Len=1460 [TCP segment of a reassembled PDU]"
441,442,183.186537,192.168.56.101,128.31.0.39,TCP,54,49231  >  9101 [ACK] Seq=4092 Ack=166390 Win=2920 Len=0
442,443,183.187249,128.31.0.39,192.168.56.101,TLSv1.2,1514,Application Data [TCP segment of a reassembled PDU]
443,444,183.187259,128.31.0.39,192.168.56.101,TCP,1514,[TCP Window Full] 9101  >  49231 [ACK] Seq=167850 Ack=4092 Win=65535 Len=1460 [TCP segment of a reassembled PDU]
444,445,183.18754,192.168.56.101,128.31.0.39,TCP,54,[TCP ZeroWindow] 49231  >  9101 [ACK] Seq=4092 Ack=169310 Win=0 Len=0
445,446,183.306204,192.168.56.101,128.31.0.39,TLSv1.2,597,"[TCP ZeroWindow] , Application Data"
446,447,183.306348,128.31.0.39,192.168.56.101,TCP,54,9101  >  49231 [ACK] Seq=169310 Ack=4635 Win=65535 Len=0
447,448,183.314054,192.168.56.101,128.31.0.39,TCP,54,[TCP Window Update] 49231  >  9101 [ACK] Seq=4635 Ack=169310 Win=3472 Len=0
448,449,183.314223,128.31.0.39,192.168.56.101,TCP,1514,9101  >  49231 [ACK] Seq=169310 Ack=4635 Win=65535 Len=1460 [TCP segment of a reassembled PDU]
449,450,183.314232,128.31.0.39,192.168.56.101,TLSv1.2,1514,Application Data [TCP segment of a reassembled PDU]
450,451,183.314424,192.168.56.101,128.31.0.39,TCP,54,49231  >  9101 [ACK] Seq=4635 Ack=172230 Win=552 Len=0
451,452,183.3205,192.168.56.101,128.31.0.39,TCP,54,[TCP Window Update] 49231  >  9101 [ACK] Seq=4635 Ack=172230 Win=61320 Len=0
452,453,183.320618,128.31.0.39,192.168.56.101,TCP,1514,9101  >  49231 [ACK] Seq=172230 Ack=4635 Win=65535 Len=1460 [TCP segment of a reassembled PDU]
453,454,183.320627,128.31.0.39,192.168.56.101,TCP,1514,9101  >  49231 [ACK] Seq=173690 Ack=4635 Win=65535 Len=1460 [TCP segment of a reassembled PDU]
454,455,183.320627,128.31.0.39,192.168.56.101,TLSv1.2,1514,Application Data [TCP segment of a reassembled PDU]
455,456,183.320628,128.31.0.39,192.168.56.101,TCP,1514,9101  >  49231 [ACK] Seq=176610 Ack=4635 Win=65535 Len=1460 [TCP segment of a reassembled PDU]
456,457,183.320658,128.31.0.39,192.168.56.101,TLSv1.2,1514,Application Data [TCP segment of a reassembled PDU]
457,458,183.32066,128.31.0.39,192.168.56.101,TLSv1.2,1514,Application Data [TCP segment of a reassembled PDU]
458,459,183.32066,128.31.0.39,192.168.56.101,TCP,1514,9101  >  49231 [ACK] Seq=180990 Ack=4635 Win=65535 Len=1460 [TCP segment of a reassembled PDU]
459,460,183.320661,128.31.0.39,192.168.56.101,TLSv1.2,1514,Application Data [TCP segment of a reassembled PDU]
460,461,183.320663,128.31.0.39,192.168.56.101,TCP,1514,9101  >  49231 [ACK] Seq=183910 Ack=4635 Win=65535 Len=1460 [TCP segment of a reassembled PDU]
461,462,183.320664,128.31.0.39,192.168.56.101,TCP,1514,9101  >  49231 [ACK] Seq=185370 Ack=4635 Win=65535 Len=1460 [TCP segment of a reassembled PDU]
462,463,183.320665,128.31.0.39,192.168.56.101,TLSv1.2,1514,Application Data [TCP segment of a reassembled PDU]
463,464,183.320666,128.31.0.39,192.168.56.101,TCP,1514,9101  >  49231 [ACK] Seq=188290 Ack=4635 Win=65535 Len=1460 [TCP segment of a reassembled PDU]
464,465,183.320716,128.31.0.39,192.168.56.101,TCP,1514,9101  >  49231 [ACK] Seq=189750 Ack=4635 Win=65535 Len=1460 [TCP segment of a reassembled PDU]
465,466,183.320724,128.31.0.39,192.168.56.101,TLSv1.2,1514,Application Data [TCP segment of a reassembled PDU]
466,467,183.320725,128.31.0.39,192.168.56.101,TCP,1514,9101  >  49231 [ACK] Seq=192670 Ack=4635 Win=65535 Len=1460 [TCP segment of a reassembled PDU]
467,468,183.320725,128.31.0.39,192.168.56.101,TCP,1514,9101  >  49231 [ACK] Seq=194130 Ack=4635 Win=65535 Len=1460 [TCP segment of a reassembled PDU]
468,469,183.320726,128.31.0.39,192.168.56.101,TLSv1.2,1514,"Application Data, Application Data"
469,470,183.320727,128.31.0.39,192.168.56.101,TCP,1514,9101  >  49231 [ACK] Seq=197050 Ack=4635 Win=65535 Len=1460 [TCP segment of a reassembled PDU]
470,471,183.320728,128.31.0.39,192.168.56.101,TLSv1.2,1514,Application Data [TCP segment of a reassembled PDU]
471,472,183.320728,128.31.0.39,192.168.56.101,TCP,1514,9101  >  49231 [ACK] Seq=199970 Ack=4635 Win=65535 Len=1460 [TCP segment of a reassembled PDU]
472,473,183.320729,128.31.0.39,192.168.56.101,TCP,1514,9101  >  49231 [ACK] Seq=201430 Ack=4635 Win=65535 Len=1460 [TCP segment of a reassembled PDU]
473,474,183.32073,128.31.0.39,192.168.56.101,TLSv1.2,1514,Application Data [TCP segment of a reassembled PDU]
474,475,183.320731,128.31.0.39,192.168.56.101,TCP,1514,9101  >  49231 [ACK] Seq=204350 Ack=4635 Win=65535 Len=1460 [TCP segment of a reassembled PDU]
475,476,183.320778,128.31.0.39,192.168.56.101,TCP,1514,9101  >  49231 [ACK] Seq=205810 Ack=4635 Win=65535 Len=1460 [TCP segment of a reassembled PDU]
476,477,183.320783,128.31.0.39,192.168.56.101,TLSv1.2,1514,Application Data [TCP segment of a reassembled PDU]
477,478,183.320785,128.31.0.39,192.168.56.101,TCP,1514,9101  >  49231 [ACK] Seq=208730 Ack=4635 Win=65535 Len=1460 [TCP segment of a reassembled PDU]
478,479,183.320786,128.31.0.39,192.168.56.101,TCP,1514,9101  >  49231 [ACK] Seq=210190 Ack=4635 Win=65535 Len=1460 [TCP segment of a reassembled PDU]
479,480,183.320786,128.31.0.39,192.168.56.101,TLSv1.2,1514,"Application Data, Application Data"
480,481,183.320788,128.31.0.39,192.168.56.101,TCP,1514,9101  >  49231 [ACK] Seq=213110 Ack=4635 Win=65535 Len=1460 [TCP segment of a reassembled PDU]
481,482,183.320788,128.31.0.39,192.168.56.101,TCP,1514,9101  >  49231 [ACK] Seq=214570 Ack=4635 Win=65535 Len=1460 [TCP segment of a reassembled PDU]
482,483,183.320789,128.31.0.39,192.168.56.101,TLSv1.2,1514,Application Data [TCP segment of a reassembled PDU]
483,484,183.32079,128.31.0.39,192.168.56.101,TCP,1514,9101  >  49231 [ACK] Seq=217490 Ack=4635 Win=65535 Len=1460 [TCP segment of a reassembled PDU]
484,485,183.320791,128.31.0.39,192.168.56.101,TLSv1.2,1514,Application Data [TCP segment of a reassembled PDU]
485,486,183.320791,128.31.0.39,192.168.56.101,TCP,1514,9101  >  49231 [ACK] Seq=220410 Ack=4635 Win=65535 Len=1460 [TCP segment of a reassembled PDU]
486,487,183.320792,128.31.0.39,192.168.56.101,TCP,1514,9101  >  49231 [ACK] Seq=221870 Ack=4635 Win=65535 Len=1460 [TCP segment of a reassembled PDU]
487,488,183.320793,128.31.0.39,192.168.56.101,TLSv1.2,1514,Application Data [TCP segment of a reassembled PDU]
488,489,183.320794,128.31.0.39,192.168.56.101,TCP,1514,9101  >  49231 [ACK] Seq=224790 Ack=4635 Win=65535 Len=1460 [TCP segment of a reassembled PDU]
489,490,183.320797,128.31.0.39,192.168.56.101,TCP,1514,9101  >  49231 [ACK] Seq=226250 Ack=4635 Win=65535 Len=1460 [TCP segment of a reassembled PDU]
490,491,183.320799,128.31.0.39,192.168.56.101,TLSv1.2,1514,Application Data [TCP segment of a reassembled PDU]
491,492,183.321041,192.168.56.101,128.31.0.39,TCP,54,49231  >  9101 [ACK] Seq=4635 Ack=218950 Win=14600 Len=0
492,493,183.321136,128.31.0.39,192.168.56.101,TLSv1.2,1514,Application Data [TCP segment of a reassembled PDU]
493,494,183.321147,128.31.0.39,192.168.56.101,TCP,1514,9101  >  49231 [ACK] Seq=230630 Ack=4635 Win=65535 Len=1460 [TCP segment of a reassembled PDU]
494,495,183.321148,128.31.0.39,192.168.56.101,TLSv1.2,1514,"[TCP Window Full] , Application Data [TCP segment of a reassembled PDU]"
495,496,183.321162,192.168.56.101,128.31.0.39,TCP,54,49231  >  9101 [ACK] Seq=4635 Ack=229170 Win=4380 Len=0
496,497,183.32131,192.168.56.101,128.31.0.39,TCP,54,[TCP ZeroWindow] 49231  >  9101 [ACK] Seq=4635 Ack=233550 Win=0 Len=0
497,498,183.335348,192.168.56.101,128.31.0.39,TLSv1.2,1111,"[TCP ZeroWindow] , Application Data"
498,499,183.335462,128.31.0.39,192.168.56.101,TCP,54,9101  >  49231 [ACK] Seq=233550 Ack=5692 Win=65535 Len=0
499,500,183.432424,192.168.56.101,128.31.0.39,TLSv1.2,597,"[TCP ZeroWindow] , Application Data"
500,501,183.432563,128.31.0.39,192.168.56.101,TCP,54,9101  >  49231 [ACK] Seq=233550 Ack=6235 Win=65535 Len=0
501,502,183.45503,192.168.56.101,128.31.0.39,TCP,54,[TCP Window Update] 49231  >  9101 [ACK] Seq=6235 Ack=233550 Win=3472 Len=0
502,503,183.455161,128.31.0.39,192.168.56.101,TCP,1514,9101  >  49231 [ACK] Seq=233550 Ack=6235 Win=65535 Len=1460 [TCP segment of a reassembled PDU]
503,504,183.455169,128.31.0.39,192.168.56.101,TCP,1514,9101  >  49231 [ACK] Seq=235010 Ack=6235 Win=65535 Len=1460 [TCP segment of a reassembled PDU]
504,505,183.456231,192.168.56.101,128.31.0.39,TCP,54,49231  >  9101 [ACK] Seq=6235 Ack=236470 Win=552 Len=0
505,506,183.460842,192.168.56.101,128.31.0.39,TLSv1.2,1111,Application Data
506,507,183.460982,128.31.0.39,192.168.56.101,TLSv1.2,606,"[TCP Window Full] , Application Data [TCP segment of a reassembled PDU]"
507,508,183.467075,192.168.56.101,128.31.0.39,TCP,54,49231  >  9101 [ACK] Seq=7292 Ack=237022 Win=60768 Len=0
508,509,183.467188,128.31.0.39,192.168.56.101,TCP,1514,9101  >  49231 [ACK] Seq=237022 Ack=7292 Win=65535 Len=1460 [TCP segment of a reassembled PDU]
509,510,183.467197,128.31.0.39,192.168.56.101,TCP,1514,9101  >  49231 [ACK] Seq=238482 Ack=7292 Win=65535 Len=1460 [TCP segment of a reassembled PDU]
510,511,183.467198,128.31.0.39,192.168.56.101,TLSv1.2,1514,Application Data [TCP segment of a reassembled PDU]
511,512,183.467199,128.31.0.39,192.168.56.101,TLSv1.2,1514,Application Data [TCP segment of a reassembled PDU]
512,513,183.4672,128.31.0.39,192.168.56.101,TCP,1514,9101  >  49231 [ACK] Seq=242862 Ack=7292 Win=65535 Len=1460 [TCP segment of a reassembled PDU]
513,514,183.467251,128.31.0.39,192.168.56.101,TCP,1514,9101  >  49231 [ACK] Seq=244322 Ack=7292 Win=65535 Len=1460 [TCP segment of a reassembled PDU]
514,515,183.467258,128.31.0.39,192.168.56.101,TLSv1.2,1514,Application Data [TCP segment of a reassembled PDU]
515,516,183.467259,128.31.0.39,192.168.56.101,TCP,1514,9101  >  49231 [ACK] Seq=247242 Ack=7292 Win=65535 Len=1460 [TCP segment of a reassembled PDU]
516,517,183.467259,128.31.0.39,192.168.56.101,TLSv1.2,1514,Application Data [TCP segment of a reassembled PDU]
517,518,183.46726,128.31.0.39,192.168.56.101,TCP,1514,9101  >  49231 [ACK] Seq=250162 Ack=7292 Win=65535 Len=1460 [TCP segment of a reassembled PDU]
518,519,183.467261,128.31.0.39,192.168.56.101,TLSv1.2,1514,Application Data [TCP segment of a reassembled PDU]
519,520,183.467262,128.31.0.39,192.168.56.101,TCP,1514,9101  >  49231 [ACK] Seq=253082 Ack=7292 Win=65535 Len=1460 [TCP segment of a reassembled PDU]
520,521,183.467263,128.31.0.39,192.168.56.101,TLSv1.2,1514,Application Data [TCP segment of a reassembled PDU]
521,522,183.467264,128.31.0.39,192.168.56.101,TCP,1514,9101  >  49231 [ACK] Seq=256002 Ack=7292 Win=65535 Len=1460 [TCP segment of a reassembled PDU]
522,523,183.467264,128.31.0.39,192.168.56.101,TCP,1514,9101  >  49231 [ACK] Seq=257462 Ack=7292 Win=65535 Len=1460 [TCP segment of a reassembled PDU]
523,524,183.467265,128.31.0.39,192.168.56.101,TLSv1.2,1514,Application Data [TCP segment of a reassembled PDU]
524,525,183.467303,128.31.0.39,192.168.56.101,TLSv1.2,1514,Application Data [TCP segment of a reassembled PDU]
525,526,183.467309,128.31.0.39,192.168.56.101,TCP,1514,9101  >  49231 [ACK] Seq=261842 Ack=7292 Win=65535 Len=1460 [TCP segment of a reassembled PDU]
526,527,183.467309,128.31.0.39,192.168.56.101,TCP,1514,9101  >  49231 [ACK] Seq=263302 Ack=7292 Win=65535 Len=1460 [TCP segment of a reassembled PDU]
527,528,183.46731,128.31.0.39,192.168.56.101,TLSv1.2,1514,Application Data [TCP segment of a reassembled PDU]
528,529,183.467311,128.31.0.39,192.168.56.101,TLSv1.2,1514,Application Data [TCP segment of a reassembled PDU]
529,530,183.467312,128.31.0.39,192.168.56.101,TCP,1514,9101  >  49231 [ACK] Seq=267682 Ack=7292 Win=65535 Len=1460 [TCP segment of a reassembled PDU]
530,531,183.467313,128.31.0.39,192.168.56.101,TCP,1514,9101  >  49231 [ACK] Seq=269142 Ack=7292 Win=65535 Len=1460 [TCP segment of a reassembled PDU]
531,532,183.467313,128.31.0.39,192.168.56.101,TLSv1.2,1514,Application Data [TCP segment of a reassembled PDU]
532,533,183.467314,128.31.0.39,192.168.56.101,TCP,1514,9101  >  49231 [ACK] Seq=272062 Ack=7292 Win=65535 Len=1460 [TCP segment of a reassembled PDU]
533,534,183.467315,128.31.0.39,192.168.56.101,TLSv1.2,1514,Application Data [TCP segment of a reassembled PDU]
534,535,183.467316,128.31.0.39,192.168.56.101,TCP,1514,9101  >  49231 [ACK] Seq=274982 Ack=7292 Win=65535 Len=1460 [TCP segment of a reassembled PDU]
535,536,183.467317,128.31.0.39,192.168.56.101,TCP,1514,9101  >  49231 [ACK] Seq=276442 Ack=7292 Win=65535 Len=1460 [TCP segment of a reassembled PDU]
536,537,183.467318,128.31.0.39,192.168.56.101,TLSv1.2,1514,Application Data [TCP segment of a reassembled PDU]
537,538,183.467318,128.31.0.39,192.168.56.101,TCP,1514,9101  >  49231 [ACK] Seq=279362 Ack=7292 Win=65535 Len=1460 [TCP segment of a reassembled PDU]
538,539,183.467319,128.31.0.39,192.168.56.101,TCP,1514,9101  >  49231 [ACK] Seq=280822 Ack=7292 Win=65535 Len=1460 [TCP segment of a reassembled PDU]
539,540,183.467359,128.31.0.39,192.168.56.101,TLSv1.2,1514,"Application Data, Application Data"
540,541,183.467363,128.31.0.39,192.168.56.101,TCP,1514,9101  >  49231 [ACK] Seq=283742 Ack=7292 Win=65535 Len=1460 [TCP segment of a reassembled PDU]
541,542,183.467364,128.31.0.39,192.168.56.101,TCP,1514,9101  >  49231 [ACK] Seq=285202 Ack=7292 Win=65535 Len=1460 [TCP segment of a reassembled PDU]
542,543,183.467365,128.31.0.39,192.168.56.101,TLSv1.2,1514,Application Data [TCP segment of a reassembled PDU]
543,544,183.467366,128.31.0.39,192.168.56.101,TCP,1514,9101  >  49231 [ACK] Seq=288122 Ack=7292 Win=65535 Len=1460 [TCP segment of a reassembled PDU]
544,545,183.467366,128.31.0.39,192.168.56.101,TLSv1.2,1514,Application Data [TCP segment of a reassembled PDU]
545,546,183.467367,128.31.0.39,192.168.56.101,TCP,1514,9101  >  49231 [ACK] Seq=291042 Ack=7292 Win=65535 Len=1460 [TCP segment of a reassembled PDU]
546,547,183.467368,128.31.0.39,192.168.56.101,TLSv1.2,1514,Application Data [TCP segment of a reassembled PDU]
547,548,183.467369,128.31.0.39,192.168.56.101,TLSv1.2,1514,Application Data [TCP segment of a reassembled PDU]
548,549,183.46737,128.31.0.39,192.168.56.101,TCP,1514,9101  >  49231 [ACK] Seq=295422 Ack=7292 Win=65535 Len=1460 [TCP segment of a reassembled PDU]
549,550,183.467913,192.168.56.101,128.31.0.39,TCP,54,49231  >  9101 [ACK] Seq=7292 Ack=283742 Win=14048 Len=0
550,551,183.467961,192.168.56.101,128.31.0.39,TCP,54,49231  >  9101 [ACK] Seq=7292 Ack=296882 Win=908 Len=0
551,552,183.671163,192.168.56.101,128.31.0.39,TLSv1.2,597,Application Data
552,553,183.671349,128.31.0.39,192.168.56.101,TCP,962,[TCP Window Full] 9101  >  49231 [ACK] Seq=296882 Ack=7835 Win=65535 Len=908 [TCP segment of a reassembled PDU]
553,554,183.710695,192.168.56.101,128.31.0.39,TLSv1.2,1111,"[TCP ZeroWindow] , Application Data"
554,555,183.710844,128.31.0.39,192.168.56.101,TCP,54,9101  >  49231 [ACK] Seq=297790 Ack=8892 Win=65535 Len=0
555,556,183.721137,192.168.56.101,128.31.0.39,TCP,54,[TCP Window Update] 49231  >  9101 [ACK] Seq=8892 Ack=297790 Win=3472 Len=0
556,557,183.721244,128.31.0.39,192.168.56.101,TCP,1514,9101  >  49231 [ACK] Seq=297790 Ack=8892 Win=65535 Len=1460 [TCP segment of a reassembled PDU]
557,558,183.721253,128.31.0.39,192.168.56.101,TLSv1.2,1514,Application Data [TCP segment of a reassembled PDU]
558,559,183.721395,192.168.56.101,128.31.0.39,TCP,54,49231  >  9101 [ACK] Seq=8892 Ack=300710 Win=552 Len=0
559,560,183.725065,192.168.56.101,128.31.0.39,TCP,54,[TCP Window Update] 49231  >  9101 [ACK] Seq=8892 Ack=300710 Win=61320 Len=0
560,561,183.725179,128.31.0.39,192.168.56.101,TCP,1514,9101  >  49231 [ACK] Seq=300710 Ack=8892 Win=65535 Len=1460 [TCP segment of a reassembled PDU]
561,562,183.725186,128.31.0.39,192.168.56.101,TLSv1.2,1514,Application Data [TCP segment of a reassembled PDU]
562,563,183.725187,128.31.0.39,192.168.56.101,TLSv1.2,1514,Application Data [TCP segment of a reassembled PDU]
563,564,183.725188,128.31.0.39,192.168.56.101,TCP,1514,9101  >  49231 [ACK] Seq=305090 Ack=8892 Win=65535 Len=1460 [TCP segment of a reassembled PDU]
564,565,183.725189,128.31.0.39,192.168.56.101,TCP,1514,9101  >  49231 [ACK] Seq=306550 Ack=8892 Win=65535 Len=1460 [TCP segment of a reassembled PDU]
565,566,183.72519,128.31.0.39,192.168.56.101,TLSv1.2,1514,Application Data [TCP segment of a reassembled PDU]
566,567,183.725254,128.31.0.39,192.168.56.101,TCP,1514,9101  >  49231 [ACK] Seq=309470 Ack=8892 Win=65535 Len=1460 [TCP segment of a reassembled PDU]
567,568,183.725259,128.31.0.39,192.168.56.101,TCP,1514,9101  >  49231 [ACK] Seq=310930 Ack=8892 Win=65535 Len=1460 [TCP segment of a reassembled PDU]
568,569,183.72526,128.31.0.39,192.168.56.101,TLSv1.2,1514,Application Data [TCP segment of a reassembled PDU]
569,570,183.72526,128.31.0.39,192.168.56.101,TCP,1514,9101  >  49231 [ACK] Seq=313850 Ack=8892 Win=65535 Len=1460 [TCP segment of a reassembled PDU]
570,571,183.725261,128.31.0.39,192.168.56.101,TLSv1.2,1514,Application Data [TCP segment of a reassembled PDU]
571,572,183.725262,128.31.0.39,192.168.56.101,TCP,1514,9101  >  49231 [ACK] Seq=316770 Ack=8892 Win=65535 Len=1460 [TCP segment of a reassembled PDU]
572,573,183.725263,128.31.0.39,192.168.56.101,TLSv1.2,1514,Application Data [TCP segment of a reassembled PDU]
573,574,183.725264,128.31.0.39,192.168.56.101,TCP,1514,9101  >  49231 [ACK] Seq=319690 Ack=8892 Win=65535 Len=1460 [TCP segment of a reassembled PDU]
574,575,183.725264,128.31.0.39,192.168.56.101,TLSv1.2,1514,Application Data [TCP segment of a reassembled PDU]
575,576,183.725265,128.31.0.39,192.168.56.101,TCP,1514,9101  >  49231 [ACK] Seq=322610 Ack=8892 Win=65535 Len=1460 [TCP segment of a reassembled PDU]
576,577,183.725266,128.31.0.39,192.168.56.101,TCP,1514,9101  >  49231 [ACK] Seq=324070 Ack=8892 Win=65535 Len=1460 [TCP segment of a reassembled PDU]
577,578,183.725267,128.31.0.39,192.168.56.101,TLSv1.2,1514,Application Data [TCP segment of a reassembled PDU]
578,579,183.725267,128.31.0.39,192.168.56.101,TCP,1514,9101  >  49231 [ACK] Seq=326990 Ack=8892 Win=65535 Len=1460 [TCP segment of a reassembled PDU]
579,580,183.725268,128.31.0.39,192.168.56.101,TCP,1514,9101  >  49231 [ACK] Seq=328450 Ack=8892 Win=65535 Len=1460 [TCP segment of a reassembled PDU]
580,581,183.725269,128.31.0.39,192.168.56.101,TLSv1.2,1514,Application Data [TCP segment of a reassembled PDU]
581,582,183.72527,128.31.0.39,192.168.56.101,TCP,1514,9101  >  49231 [ACK] Seq=331370 Ack=8892 Win=65535 Len=1460 [TCP segment of a reassembled PDU]
582,583,183.725271,128.31.0.39,192.168.56.101,TLSv1.2,1514,Application Data [TCP segment of a reassembled PDU]
583,584,183.725271,128.31.0.39,192.168.56.101,TCP,1514,9101  >  49231 [ACK] Seq=334290 Ack=8892 Win=65535 Len=1460 [TCP segment of a reassembled PDU]
584,585,183.725272,128.31.0.39,192.168.56.101,TCP,1514,9101  >  49231 [ACK] Seq=335750 Ack=8892 Win=65535 Len=1460 [TCP segment of a reassembled PDU]
585,586,183.725273,128.31.0.39,192.168.56.101,TLSv1.2,1514,"Application Data, Application Data"
586,587,183.725329,128.31.0.39,192.168.56.101,TCP,1514,9101  >  49231 [ACK] Seq=338670 Ack=8892 Win=65535 Len=1460 [TCP segment of a reassembled PDU]
587,588,183.725333,128.31.0.39,192.168.56.101,TLSv1.2,1514,Application Data [TCP segment of a reassembled PDU]
588,589,183.725334,128.31.0.39,192.168.56.101,TCP,1514,9101  >  49231 [ACK] Seq=341590 Ack=8892 Win=65535 Len=1460 [TCP segment of a reassembled PDU]
589,590,183.725335,128.31.0.39,192.168.56.101,TCP,1514,9101  >  49231 [ACK] Seq=343050 Ack=8892 Win=65535 Len=1460 [TCP segment of a reassembled PDU]
590,591,183.725335,128.31.0.39,192.168.56.101,TLSv1.2,1514,Application Data [TCP segment of a reassembled PDU]
591,592,183.725336,128.31.0.39,192.168.56.101,TCP,1514,9101  >  49231 [ACK] Seq=345970 Ack=8892 Win=65535 Len=1460 [TCP segment of a reassembled PDU]
592,593,183.725337,128.31.0.39,192.168.56.101,TCP,1514,9101  >  49231 [ACK] Seq=347430 Ack=8892 Win=65535 Len=1460 [TCP segment of a reassembled PDU]
593,594,183.725338,128.31.0.39,192.168.56.101,TLSv1.2,1514,Application Data [TCP segment of a reassembled PDU]
594,595,183.725338,128.31.0.39,192.168.56.101,TCP,1514,9101  >  49231 [ACK] Seq=350350 Ack=8892 Win=65535 Len=1460 [TCP segment of a reassembled PDU]
595,596,183.725339,128.31.0.39,192.168.56.101,TCP,1514,9101  >  49231 [ACK] Seq=351810 Ack=8892 Win=65535 Len=1460 [TCP segment of a reassembled PDU]
596,597,183.72534,128.31.0.39,192.168.56.101,TLSv1.2,1514,Application Data [TCP segment of a reassembled PDU]
597,598,183.725341,128.31.0.39,192.168.56.101,TCP,1514,9101  >  49231 [ACK] Seq=354730 Ack=8892 Win=65535 Len=1460 [TCP segment of a reassembled PDU]
598,599,183.725341,128.31.0.39,192.168.56.101,TCP,1514,9101  >  49231 [ACK] Seq=356190 Ack=8892 Win=65535 Len=1460 [TCP segment of a reassembled PDU]
599,600,183.725342,128.31.0.39,192.168.56.101,TLSv1.2,1514,"Application Data, Application Data"
600,601,183.725343,128.31.0.39,192.168.56.101,TCP,1514,9101  >  49231 [ACK] Seq=359110 Ack=8892 Win=65535 Len=1460 [TCP segment of a reassembled PDU]
601,602,183.725344,128.31.0.39,192.168.56.101,TLSv1.2,1514,"[TCP Window Full] , Application Data [TCP segment of a reassembled PDU]"
602,603,183.725875,192.168.56.101,128.31.0.39,TCP,54,49231  >  9101 [ACK] Seq=8892 Ack=347430 Win=14600 Len=0
603,604,183.725957,192.168.56.101,128.31.0.39,TCP,54,[TCP ZeroWindow] 49231  >  9101 [ACK] Seq=8892 Ack=362030 Win=0 Len=0
604,605,183.741256,192.168.56.101,128.31.0.39,TLSv1.2,597,"[TCP ZeroWindow] , Application Data"
605,606,183.74139,128.31.0.39,192.168.56.101,TCP,54,9101  >  49231 [ACK] Seq=362030 Ack=9435 Win=65535 Len=0
606,607,183.833875,192.168.56.101,128.31.0.39,TLSv1.2,1111,"[TCP ZeroWindow] , Application Data"
607,608,183.834013,128.31.0.39,192.168.56.101,TCP,54,9101  >  49231 [ACK] Seq=362030 Ack=10492 Win=65535 Len=0
608,609,183.874326,192.168.56.101,128.31.0.39,TCP,54,[TCP Window Update] 49231  >  9101 [ACK] Seq=10492 Ack=362030 Win=3472 Len=0
609,610,183.874444,128.31.0.39,192.168.56.101,TCP,1514,9101  >  49231 [ACK] Seq=362030 Ack=10492 Win=65535 Len=1460 [TCP segment of a reassembled PDU]
610,611,183.874451,128.31.0.39,192.168.56.101,TCP,1514,9101  >  49231 [ACK] Seq=363490 Ack=10492 Win=65535 Len=1460 [TCP segment of a reassembled PDU]
611,612,183.874598,192.168.56.101,128.31.0.39,TCP,54,49231  >  9101 [ACK] Seq=10492 Ack=364950 Win=552 Len=0
612,613,183.877922,192.168.56.101,128.31.0.39,TCP,54,[TCP Window Update] 49231  >  9101 [ACK] Seq=10492 Ack=364950 Win=61320 Len=0
613,614,183.878065,128.31.0.39,192.168.56.101,TLSv1.2,1514,Application Data [TCP segment of a reassembled PDU]
614,615,183.878073,128.31.0.39,192.168.56.101,TLSv1.2,1514,Application Data [TCP segment of a reassembled PDU]
615,616,183.878074,128.31.0.39,192.168.56.101,TCP,1514,9101  >  49231 [ACK] Seq=367870 Ack=10492 Win=65535 Len=1460 [TCP segment of a reassembled PDU]
616,617,183.878075,128.31.0.39,192.168.56.101,TCP,1514,9101  >  49231 [ACK] Seq=369330 Ack=10492 Win=65535 Len=1460 [TCP segment of a reassembled PDU]
617,618,183.878076,128.31.0.39,192.168.56.101,TLSv1.2,1514,Application Data [TCP segment of a reassembled PDU]
618,619,183.878126,128.31.0.39,192.168.56.101,TCP,1514,9101  >  49231 [ACK] Seq=372250 Ack=10492 Win=65535 Len=1460 [TCP segment of a reassembled PDU]
619,620,183.878135,128.31.0.39,192.168.56.101,TCP,1514,9101  >  49231 [ACK] Seq=373710 Ack=10492 Win=65535 Len=1460 [TCP segment of a reassembled PDU]
620,621,183.878135,128.31.0.39,192.168.56.101,TLSv1.2,1514,Application Data [TCP segment of a reassembled PDU]
621,622,183.878136,128.31.0.39,192.168.56.101,TCP,1514,9101  >  49231 [ACK] Seq=376630 Ack=10492 Win=65535 Len=1460 [TCP segment of a reassembled PDU]
622,623,183.878137,128.31.0.39,192.168.56.101,TCP,1514,9101  >  49231 [ACK] Seq=378090 Ack=10492 Win=65535 Len=1460 [TCP segment of a reassembled PDU]
623,624,183.878138,128.31.0.39,192.168.56.101,TLSv1.2,1514,Application Data [TCP segment of a reassembled PDU]
624,625,183.878139,128.31.0.39,192.168.56.101,TCP,1514,9101  >  49231 [ACK] Seq=381010 Ack=10492 Win=65535 Len=1460 [TCP segment of a reassembled PDU]
625,626,183.878139,128.31.0.39,192.168.56.101,TLSv1.2,1514,Application Data [TCP segment of a reassembled PDU]
626,627,183.87814,128.31.0.39,192.168.56.101,TLSv1.2,1514,Application Data [TCP segment of a reassembled PDU]
627,628,183.878176,128.31.0.39,192.168.56.101,TCP,1514,9101  >  49231 [ACK] Seq=385390 Ack=10492 Win=65535 Len=1460 [TCP segment of a reassembled PDU]
628,629,183.87818,128.31.0.39,192.168.56.101,TLSv1.2,1514,Application Data [TCP segment of a reassembled PDU]
629,630,183.878181,128.31.0.39,192.168.56.101,TCP,1514,9101  >  49231 [ACK] Seq=388310 Ack=10492 Win=65535 Len=1460 [TCP segment of a reassembled PDU]
630,631,183.878182,128.31.0.39,192.168.56.101,TCP,1514,9101  >  49231 [ACK] Seq=389770 Ack=10492 Win=65535 Len=1460 [TCP segment of a reassembled PDU]
631,632,183.878182,128.31.0.39,192.168.56.101,TLSv1.2,1514,Application Data [TCP segment of a reassembled PDU]
632,633,183.878183,128.31.0.39,192.168.56.101,TLSv1.2,1514,Application Data [TCP segment of a reassembled PDU]
633,634,183.878184,128.31.0.39,192.168.56.101,TCP,1514,9101  >  49231 [ACK] Seq=394150 Ack=10492 Win=65535 Len=1460 [TCP segment of a reassembled PDU]
634,635,183.878185,128.31.0.39,192.168.56.101,TCP,1514,9101  >  49231 [ACK] Seq=395610 Ack=10492 Win=65535 Len=1460 [TCP segment of a reassembled PDU]
635,636,183.878185,128.31.0.39,192.168.56.101,TLSv1.2,1514,Application Data [TCP segment of a reassembled PDU]
636,637,183.878186,128.31.0.39,192.168.56.101,TCP,1514,9101  >  49231 [ACK] Seq=398530 Ack=10492 Win=65535 Len=1460 [TCP segment of a reassembled PDU]
637,638,183.878187,128.31.0.39,192.168.56.101,TLSv1.2,1514,Application Data [TCP segment of a reassembled PDU]
638,639,183.878188,128.31.0.39,192.168.56.101,TCP,1514,9101  >  49231 [ACK] Seq=401450 Ack=10492 Win=65535 Len=1460 [TCP segment of a reassembled PDU]
639,640,183.878225,128.31.0.39,192.168.56.101,TCP,1514,9101  >  49231 [ACK] Seq=402910 Ack=10492 Win=65535 Len=1460 [TCP segment of a reassembled PDU]
640,641,183.878229,128.31.0.39,192.168.56.101,TLSv1.2,1514,Application Data [TCP segment of a reassembled PDU]
641,642,183.87823,128.31.0.39,192.168.56.101,TCP,1514,9101  >  49231 [ACK] Seq=405830 Ack=10492 Win=65535 Len=1460 [TCP segment of a reassembled PDU]
642,643,183.878231,128.31.0.39,192.168.56.101,TCP,1514,9101  >  49231 [ACK] Seq=407290 Ack=10492 Win=65535 Len=1460 [TCP segment of a reassembled PDU]
643,644,183.878232,128.31.0.39,192.168.56.101,TLSv1.2,1514,Application Data [TCP segment of a reassembled PDU]
644,645,183.878233,128.31.0.39,192.168.56.101,TCP,1514,9101  >  49231 [ACK] Seq=410210 Ack=10492 Win=65535 Len=1460 [TCP segment of a reassembled PDU]
645,646,183.878234,128.31.0.39,192.168.56.101,TCP,1514,9101  >  49231 [ACK] Seq=411670 Ack=10492 Win=65535 Len=1460 [TCP segment of a reassembled PDU]
646,647,183.878235,128.31.0.39,192.168.56.101,TLSv1.2,1514,Application Data [TCP segment of a reassembled PDU]
647,648,183.878235,128.31.0.39,192.168.56.101,TCP,1514,9101  >  49231 [ACK] Seq=414590 Ack=10492 Win=65535 Len=1460 [TCP segment of a reassembled PDU]
648,649,183.878236,128.31.0.39,192.168.56.101,TLSv1.2,1514,Application Data [TCP segment of a reassembled PDU]
649,650,183.878237,128.31.0.39,192.168.56.101,TLSv1.2,1514,Application Data [TCP segment of a reassembled PDU]
650,651,183.878238,128.31.0.39,192.168.56.101,TLSv1.2,1514,Application Data [TCP segment of a reassembled PDU]
651,652,183.878239,128.31.0.39,192.168.56.101,TCP,1514,9101  >  49231 [ACK] Seq=420430 Ack=10492 Win=65535 Len=1460 [TCP segment of a reassembled PDU]
652,653,183.87824,128.31.0.39,192.168.56.101,TCP,1514,9101  >  49231 [ACK] Seq=421890 Ack=10492 Win=65535 Len=1460 [TCP segment of a reassembled PDU]
653,654,183.878351,128.31.0.39,192.168.56.101,TLSv1.2,1514,Application Data [TCP segment of a reassembled PDU]
654,655,183.878357,128.31.0.39,192.168.56.101,TCP,1514,[TCP Window Full] 9101  >  49231 [ACK] Seq=424810 Ack=10492 Win=65535 Len=1460 [TCP segment of a reassembled PDU]
655,656,183.878986,192.168.56.101,128.31.0.39,TCP,54,49231  >  9101 [ACK] Seq=10492 Ack=411670 Win=14600 Len=0
656,657,183.879096,192.168.56.101,128.31.0.39,TCP,54,[TCP ZeroWindow] 49231  >  9101 [ACK] Seq=10492 Ack=426270 Win=0 Len=0
657,658,183.881562,192.168.56.101,128.31.0.39,TLSv1.2,597,"[TCP ZeroWindow] , Application Data"
658,659,183.882013,128.31.0.39,192.168.56.101,TCP,54,9101  >  49231 [ACK] Seq=426270 Ack=11035 Win=65535 Len=0
659,660,183.91201,192.168.56.101,128.31.0.39,TLSv1.2,1111,"[TCP ZeroWindow] , Application Data"
660,661,183.912156,128.31.0.39,192.168.56.101,TCP,54,9101  >  49231 [ACK] Seq=426270 Ack=12092 Win=65535 Len=0
661,662,183.967144,192.168.56.101,128.31.0.39,TLSv1.2,597,"[TCP ZeroWindow] , Application Data"
662,663,183.967296,128.31.0.39,192.168.56.101,TCP,54,9101  >  49231 [ACK] Seq=426270 Ack=12635 Win=65535 Len=0
663,664,183.97979,192.168.56.101,128.31.0.39,TCP,54,[TCP Window Update] 49231  >  9101 [ACK] Seq=12635 Ack=426270 Win=64240 Len=0
664,665,183.979941,128.31.0.39,192.168.56.101,TLSv1.2,1514,"Application Data, Application Data"
665,666,183.979952,128.31.0.39,192.168.56.101,TCP,1514,9101  >  49231 [ACK] Seq=427730 Ack=12635 Win=65535 Len=1460 [TCP segment of a reassembled PDU]
666,667,183.979953,128.31.0.39,192.168.56.101,TCP,1514,9101  >  49231 [ACK] Seq=429190 Ack=12635 Win=65535 Len=1460 [TCP segment of a reassembled PDU]
667,668,183.979955,128.31.0.39,192.168.56.101,TLSv1.2,1514,Application Data [TCP segment of a reassembled PDU]
668,669,183.98,128.31.0.39,192.168.56.101,TCP,1514,9101  >  49231 [ACK] Seq=432110 Ack=12635 Win=65535 Len=1460 [TCP segment of a reassembled PDU]
669,670,183.980004,128.31.0.39,192.168.56.101,TCP,1514,9101  >  49231 [ACK] Seq=433570 Ack=12635 Win=65535 Len=1460 [TCP segment of a reassembled PDU]
670,671,183.980005,128.31.0.39,192.168.56.101,TLSv1.2,1514,Application Data [TCP segment of a reassembled PDU]
671,672,183.980006,128.31.0.39,192.168.56.101,TCP,1514,9101  >  49231 [ACK] Seq=436490 Ack=12635 Win=65535 Len=1460 [TCP segment of a reassembled PDU]
672,673,183.980006,128.31.0.39,192.168.56.101,TCP,1514,9101  >  49231 [ACK] Seq=437950 Ack=12635 Win=65535 Len=1460 [TCP segment of a reassembled PDU]
673,674,183.980007,128.31.0.39,192.168.56.101,TLSv1.2,1514,Application Data [TCP segment of a reassembled PDU]
674,675,183.980008,128.31.0.39,192.168.56.101,TCP,1514,9101  >  49231 [ACK] Seq=440870 Ack=12635 Win=65535 Len=1460 [TCP segment of a reassembled PDU]
675,676,183.980009,128.31.0.39,192.168.56.101,TCP,1514,9101  >  49231 [ACK] Seq=442330 Ack=12635 Win=65535 Len=1460 [TCP segment of a reassembled PDU]
676,677,183.98001,128.31.0.39,192.168.56.101,TLSv1.2,1514,"Application Data, Application Data"
677,678,183.980011,128.31.0.39,192.168.56.101,TLSv1.2,1514,Application Data [TCP segment of a reassembled PDU]
678,679,183.980011,128.31.0.39,192.168.56.101,TCP,1514,9101  >  49231 [ACK] Seq=446710 Ack=12635 Win=65535 Len=1460 [TCP segment of a reassembled PDU]
679,680,183.980012,128.31.0.39,192.168.56.101,TLSv1.2,1514,Application Data [TCP segment of a reassembled PDU]
680,681,183.980013,128.31.0.39,192.168.56.101,TCP,1514,9101  >  49231 [ACK] Seq=449630 Ack=12635 Win=65535 Len=1460 [TCP segment of a reassembled PDU]
681,682,183.980049,128.31.0.39,192.168.56.101,TCP,1514,9101  >  49231 [ACK] Seq=451090 Ack=12635 Win=65535 Len=1460 [TCP segment of a reassembled PDU]
682,683,183.980054,128.31.0.39,192.168.56.101,TLSv1.2,1514,Application Data [TCP segment of a reassembled PDU]
683,684,183.980058,128.31.0.39,192.168.56.101,TLSv1.2,1514,Application Data [TCP segment of a reassembled PDU]
684,685,183.980059,128.31.0.39,192.168.56.101,TCP,1514,9101  >  49231 [ACK] Seq=455470 Ack=12635 Win=65535 Len=1460 [TCP segment of a reassembled PDU]
685,686,183.98006,128.31.0.39,192.168.56.101,TLSv1.2,1514,Application Data [TCP segment of a reassembled PDU]
686,687,183.98006,128.31.0.39,192.168.56.101,TCP,1514,9101  >  49231 [ACK] Seq=458390 Ack=12635 Win=65535 Len=1460 [TCP segment of a reassembled PDU]
687,688,183.980061,128.31.0.39,192.168.56.101,TCP,1514,9101  >  49231 [ACK] Seq=459850 Ack=12635 Win=65535 Len=1460 [TCP segment of a reassembled PDU]
688,689,183.980062,128.31.0.39,192.168.56.101,TLSv1.2,1514,Application Data [TCP segment of a reassembled PDU]
689,690,183.980063,128.31.0.39,192.168.56.101,TCP,1514,9101  >  49231 [ACK] Seq=462770 Ack=12635 Win=65535 Len=1460 [TCP segment of a reassembled PDU]
690,691,183.980064,128.31.0.39,192.168.56.101,TCP,1514,9101  >  49231 [ACK] Seq=464230 Ack=12635 Win=65535 Len=1460 [TCP segment of a reassembled PDU]
691,692,183.980065,128.31.0.39,192.168.56.101,TLSv1.2,1514,Application Data [TCP segment of a reassembled PDU]
692,693,183.980097,128.31.0.39,192.168.56.101,TCP,1514,9101  >  49231 [ACK] Seq=467150 Ack=12635 Win=65535 Len=1460 [TCP segment of a reassembled PDU]
693,694,183.9801,128.31.0.39,192.168.56.101,TCP,1514,9101  >  49231 [ACK] Seq=468610 Ack=12635 Win=65535 Len=1460 [TCP segment of a reassembled PDU]
694,695,183.980101,128.31.0.39,192.168.56.101,TLSv1.2,1514,"Application Data, Application Data, Application Data"
695,696,183.980102,128.31.0.39,192.168.56.101,TCP,1514,9101  >  49231 [ACK] Seq=471530 Ack=12635 Win=65535 Len=1460 [TCP segment of a reassembled PDU]
696,697,183.980103,128.31.0.39,192.168.56.101,TCP,1514,9101  >  49231 [ACK] Seq=472990 Ack=12635 Win=65535 Len=1460 [TCP segment of a reassembled PDU]
697,698,183.980103,128.31.0.39,192.168.56.101,TLSv1.2,1514,Application Data [TCP segment of a reassembled PDU]
698,699,183.980104,128.31.0.39,192.168.56.101,TCP,1514,9101  >  49231 [ACK] Seq=475910 Ack=12635 Win=65535 Len=1460 [TCP segment of a reassembled PDU]
699,700,183.980105,128.31.0.39,192.168.56.101,TCP,1514,9101  >  49231 [ACK] Seq=477370 Ack=12635 Win=65535 Len=1460 [TCP segment of a reassembled PDU]
700,701,183.980106,128.31.0.39,192.168.56.101,TLSv1.2,1514,Application Data [TCP segment of a reassembled PDU]
701,702,183.980106,128.31.0.39,192.168.56.101,TCP,1514,9101  >  49231 [ACK] Seq=480290 Ack=12635 Win=65535 Len=1460 [TCP segment of a reassembled PDU]
702,703,183.980107,128.31.0.39,192.168.56.101,TCP,1514,9101  >  49231 [ACK] Seq=481750 Ack=12635 Win=65535 Len=1460 [TCP segment of a reassembled PDU]
703,704,183.980108,128.31.0.39,192.168.56.101,TLSv1.2,1514,Application Data [TCP segment of a reassembled PDU]
704,705,183.980109,128.31.0.39,192.168.56.101,TCP,1514,9101  >  49231 [ACK] Seq=484670 Ack=12635 Win=65535 Len=1460 [TCP segment of a reassembled PDU]
705,706,183.98011,128.31.0.39,192.168.56.101,TLSv1.2,1514,Application Data [TCP segment of a reassembled PDU]
706,707,183.980532,128.31.0.39,192.168.56.101,TLSv1.2,1514,Application Data [TCP segment of a reassembled PDU]
707,708,183.980537,128.31.0.39,192.168.56.101,TCP,1514,[TCP Window Full] 9101  >  49231 [ACK] Seq=489050 Ack=12635 Win=65535 Len=1460 [TCP segment of a reassembled PDU]
708,709,183.980692,192.168.56.101,128.31.0.39,TCP,54,49231  >  9101 [ACK] Seq=12635 Ack=465690 Win=24820 Len=0
709,710,183.981165,192.168.56.101,128.31.0.39,TCP,54,[TCP ZeroWindow] 49231  >  9101 [ACK] Seq=12635 Ack=490510 Win=0 Len=0
710,711,184.172036,192.168.56.101,128.31.0.39,TLSv1.2,1111,"[TCP ZeroWindow] , Application Data"
711,712,184.1723,128.31.0.39,192.168.56.101,TCP,54,9101  >  49231 [ACK] Seq=490510 Ack=13692 Win=65535 Len=0
712,713,184.34406,192.168.56.101,128.31.0.39,TLSv1.2,597,"[TCP ZeroWindow] , Application Data"
713,714,184.344229,128.31.0.39,192.168.56.101,TCP,54,9101  >  49231 [ACK] Seq=490510 Ack=14235 Win=65535 Len=0
714,715,184.383548,192.168.56.101,128.31.0.39,TCP,54,[TCP Window Update] 49231  >  9101 [ACK] Seq=14235 Ack=490510 Win=3472 Len=0
715,716,184.383671,128.31.0.39,192.168.56.101,TLSv1.2,1514,Application Data [TCP segment of a reassembled PDU]
716,717,184.383676,128.31.0.39,192.168.56.101,TCP,1514,9101  >  49231 [ACK] Seq=491970 Ack=14235 Win=65535 Len=1460 [TCP segment of a reassembled PDU]
717,718,184.383893,192.168.56.101,128.31.0.39,TCP,54,49231  >  9101 [ACK] Seq=14235 Ack=493430 Win=552 Len=0
718,719,184.392111,192.168.56.101,128.31.0.39,TCP,54,[TCP Window Update] 49231  >  9101 [ACK] Seq=14235 Ack=493430 Win=61320 Len=0
719,720,184.392234,128.31.0.39,192.168.56.101,TCP,1514,9101  >  49231 [ACK] Seq=493430 Ack=14235 Win=65535 Len=1460 [TCP segment of a reassembled PDU]
720,721,184.392243,128.31.0.39,192.168.56.101,TLSv1.2,1514,Application Data [TCP segment of a reassembled PDU]
721,722,184.392243,128.31.0.39,192.168.56.101,TLSv1.2,1514,Application Data [TCP segment of a reassembled PDU]
722,723,184.392244,128.31.0.39,192.168.56.101,TCP,1514,9101  >  49231 [ACK] Seq=497810 Ack=14235 Win=65535 Len=1460 [TCP segment of a reassembled PDU]
723,724,184.392245,128.31.0.39,192.168.56.101,TCP,1514,9101  >  49231 [ACK] Seq=499270 Ack=14235 Win=65535 Len=1460 [TCP segment of a reassembled PDU]
724,725,184.392246,128.31.0.39,192.168.56.101,TLSv1.2,1514,Application Data [TCP segment of a reassembled PDU]
725,726,184.392291,128.31.0.39,192.168.56.101,TCP,1514,9101  >  49231 [ACK] Seq=502190 Ack=14235 Win=65535 Len=1460 [TCP segment of a reassembled PDU]
726,727,184.392295,128.31.0.39,192.168.56.101,TCP,1514,9101  >  49231 [ACK] Seq=503650 Ack=14235 Win=65535 Len=1460 [TCP segment of a reassembled PDU]
727,728,184.392295,128.31.0.39,192.168.56.101,TLSv1.2,1514,Application Data [TCP segment of a reassembled PDU]
728,729,184.392296,128.31.0.39,192.168.56.101,TCP,1514,9101  >  49231 [ACK] Seq=506570 Ack=14235 Win=65535 Len=1460 [TCP segment of a reassembled PDU]
729,730,184.392297,128.31.0.39,192.168.56.101,TLSv1.2,1514,Application Data [TCP segment of a reassembled PDU]
730,731,184.392298,128.31.0.39,192.168.56.101,TCP,1514,9101  >  49231 [ACK] Seq=509490 Ack=14235 Win=65535 Len=1460 [TCP segment of a reassembled PDU]
731,732,184.392299,128.31.0.39,192.168.56.101,TCP,1514,9101  >  49231 [ACK] Seq=510950 Ack=14235 Win=65535 Len=1460 [TCP segment of a reassembled PDU]
732,733,184.392299,128.31.0.39,192.168.56.101,TLSv1.2,1514,"Application Data, Application Data"
733,734,184.392301,128.31.0.39,192.168.56.101,TCP,1514,9101  >  49231 [ACK] Seq=513870 Ack=14235 Win=65535 Len=1460 [TCP segment of a reassembled PDU]
734,735,184.392301,128.31.0.39,192.168.56.101,TCP,1514,9101  >  49231 [ACK] Seq=515330 Ack=14235 Win=65535 Len=1460 [TCP segment of a reassembled PDU]
735,736,184.392302,128.31.0.39,192.168.56.101,TLSv1.2,1514,Application Data [TCP segment of a reassembled PDU]
736,737,184.392303,128.31.0.39,192.168.56.101,TCP,1514,9101  >  49231 [ACK] Seq=518250 Ack=14235 Win=65535 Len=1460 [TCP segment of a reassembled PDU]
737,738,184.392304,128.31.0.39,192.168.56.101,TCP,1514,9101  >  49231 [ACK] Seq=519710 Ack=14235 Win=65535 Len=1460 [TCP segment of a reassembled PDU]
738,739,184.392306,128.31.0.39,192.168.56.101,TLSv1.2,1514,Application Data [TCP segment of a reassembled PDU]
739,740,184.392378,128.31.0.39,192.168.56.101,TLSv1.2,1514,Application Data [TCP segment of a reassembled PDU]
740,741,184.392386,128.31.0.39,192.168.56.101,TCP,1514,9101  >  49231 [ACK] Seq=524090 Ack=14235 Win=65535 Len=1460 [TCP segment of a reassembled PDU]
741,742,184.392387,128.31.0.39,192.168.56.101,TCP,1514,9101  >  49231 [ACK] Seq=525550 Ack=14235 Win=65535 Len=1460 [TCP segment of a reassembled PDU]
742,743,184.392388,128.31.0.39,192.168.56.101,TLSv1.2,1514,Application Data [TCP segment of a reassembled PDU]
743,744,184.392389,128.31.0.39,192.168.56.101,TCP,1514,9101  >  49231 [ACK] Seq=528470 Ack=14235 Win=65535 Len=1460 [TCP segment of a reassembled PDU]
744,745,184.392389,128.31.0.39,192.168.56.101,TLSv1.2,1514,Application Data [TCP segment of a reassembled PDU]
745,746,184.39239,128.31.0.39,192.168.56.101,TCP,1514,9101  >  49231 [ACK] Seq=531390 Ack=14235 Win=65535 Len=1460 [TCP segment of a reassembled PDU]
746,747,184.392391,128.31.0.39,192.168.56.101,TCP,1514,9101  >  49231 [ACK] Seq=532850 Ack=14235 Win=65535 Len=1460 [TCP segment of a reassembled PDU]
747,748,184.392391,128.31.0.39,192.168.56.101,TLSv1.2,1514,Application Data [TCP segment of a reassembled PDU]
748,749,184.392392,128.31.0.39,192.168.56.101,TCP,1514,9101  >  49231 [ACK] Seq=535770 Ack=14235 Win=65535 Len=1460 [TCP segment of a reassembled PDU]
749,750,184.392393,128.31.0.39,192.168.56.101,TCP,1514,9101  >  49231 [ACK] Seq=537230 Ack=14235 Win=65535 Len=1460 [TCP segment of a reassembled PDU]
750,751,184.392393,128.31.0.39,192.168.56.101,TLSv1.2,1514,"Application Data, Application Data"
751,752,184.392395,128.31.0.39,192.168.56.101,TCP,1514,9101  >  49231 [ACK] Seq=540150 Ack=14235 Win=65535 Len=1460 [TCP segment of a reassembled PDU]
752,753,184.392395,128.31.0.39,192.168.56.101,TCP,1514,9101  >  49231 [ACK] Seq=541610 Ack=14235 Win=65535 Len=1460 [TCP segment of a reassembled PDU]
753,754,184.392396,128.31.0.39,192.168.56.101,TLSv1.2,1514,Application Data [TCP segment of a reassembled PDU]
754,755,184.392397,128.31.0.39,192.168.56.101,TCP,1514,9101  >  49231 [ACK] Seq=544530 Ack=14235 Win=65535 Len=1460 [TCP segment of a reassembled PDU]
755,756,184.392397,128.31.0.39,192.168.56.101,TCP,1514,9101  >  49231 [ACK] Seq=545990 Ack=14235 Win=65535 Len=1460 [TCP segment of a reassembled PDU]
756,757,184.392398,128.31.0.39,192.168.56.101,TLSv1.2,1514,Application Data [TCP segment of a reassembled PDU]
757,758,184.392399,128.31.0.39,192.168.56.101,TLSv1.2,1514,Application Data [TCP segment of a reassembled PDU]
758,759,184.3924,128.31.0.39,192.168.56.101,TCP,1514,9101  >  49231 [ACK] Seq=550370 Ack=14235 Win=65535 Len=1460 [TCP segment of a reassembled PDU]
759,760,184.392401,128.31.0.39,192.168.56.101,TLSv1.2,1514,Application Data [TCP segment of a reassembled PDU]
760,761,184.392402,128.31.0.39,192.168.56.101,TCP,1514,[TCP Window Full] 9101  >  49231 [ACK] Seq=553290 Ack=14235 Win=65535 Len=1460 [TCP segment of a reassembled PDU]
761,762,184.392799,192.168.56.101,128.31.0.39,TCP,54,49231  >  9101 [ACK] Seq=14235 Ack=540150 Win=14600 Len=0
762,763,184.392892,192.168.56.101,128.31.0.39,TCP,54,[TCP ZeroWindow] 49231  >  9101 [ACK] Seq=14235 Ack=554750 Win=0 Len=0
763,764,184.396912,192.168.56.101,128.31.0.39,TLSv1.2,1111,"[TCP ZeroWindow] , Application Data"
764,765,184.397009,128.31.0.39,192.168.56.101,TCP,54,9101  >  49231 [ACK] Seq=554750 Ack=15292 Win=65535 Len=0
765,766,184.425534,192.168.56.101,128.31.0.39,TLSv1.2,597,"[TCP ZeroWindow] , Application Data"
766,767,184.425666,128.31.0.39,192.168.56.101,TCP,54,9101  >  49231 [ACK] Seq=554750 Ack=15835 Win=65535 Len=0
767,768,184.553363,192.168.56.101,128.31.0.39,TLSv1.2,1111,"[TCP ZeroWindow] , Application Data"
768,769,184.553479,128.31.0.39,192.168.56.101,TCP,54,9101  >  49231 [ACK] Seq=554750 Ack=16892 Win=65535 Len=0
769,770,184.562278,192.168.56.101,128.31.0.39,TCP,54,[TCP Window Update] 49231  >  9101 [ACK] Seq=16892 Ack=554750 Win=3472 Len=0
770,771,184.562416,128.31.0.39,192.168.56.101,TCP,1514,9101  >  49231 [ACK] Seq=554750 Ack=16892 Win=65535 Len=1460 [TCP segment of a reassembled PDU]
771,772,184.562418,128.31.0.39,192.168.56.101,TLSv1.2,1514,Application Data [TCP segment of a reassembled PDU]
772,773,184.562631,192.168.56.101,128.31.0.39,TCP,54,49231  >  9101 [ACK] Seq=16892 Ack=557670 Win=552 Len=0
773,774,184.56843,192.168.56.101,128.31.0.39,TCP,54,[TCP Window Update] 49231  >  9101 [ACK] Seq=16892 Ack=557670 Win=61320 Len=0
774,775,184.568498,128.31.0.39,192.168.56.101,TCP,1514,9101  >  49231 [ACK] Seq=557670 Ack=16892 Win=65535 Len=1460 [TCP segment of a reassembled PDU]
775,776,184.568574,128.31.0.39,192.168.56.101,TCP,1514,9101  >  49231 [ACK] Seq=559130 Ack=16892 Win=65535 Len=1460 [TCP segment of a reassembled PDU]
776,777,184.568582,128.31.0.39,192.168.56.101,TLSv1.2,1514,Application Data [TCP segment of a reassembled PDU]
777,778,184.568583,128.31.0.39,192.168.56.101,TCP,1514,9101  >  49231 [ACK] Seq=562050 Ack=16892 Win=65535 Len=1460 [TCP segment of a reassembled PDU]
778,779,184.568583,128.31.0.39,192.168.56.101,TCP,1514,9101  >  49231 [ACK] Seq=563510 Ack=16892 Win=65535 Len=1460 [TCP segment of a reassembled PDU]
779,780,184.568584,128.31.0.39,192.168.56.101,TLSv1.2,1514,"Application Data, Application Data"
780,781,184.568585,128.31.0.39,192.168.56.101,TCP,1514,9101  >  49231 [ACK] Seq=566430 Ack=16892 Win=65535 Len=1460 [TCP segment of a reassembled PDU]
781,782,184.568586,128.31.0.39,192.168.56.101,TCP,1514,9101  >  49231 [ACK] Seq=567890 Ack=16892 Win=65535 Len=1460 [TCP segment of a reassembled PDU]
782,783,184.568587,128.31.0.39,192.168.56.101,TLSv1.2,1514,Application Data [TCP segment of a reassembled PDU]
783,784,184.568663,128.31.0.39,192.168.56.101,TCP,1514,9101  >  49231 [ACK] Seq=570810 Ack=16892 Win=65535 Len=1460 [TCP segment of a reassembled PDU]
784,785,184.568667,128.31.0.39,192.168.56.101,TLSv1.2,1514,Application Data [TCP segment of a reassembled PDU]
785,786,184.568668,128.31.0.39,192.168.56.101,TLSv1.2,1514,Application Data [TCP segment of a reassembled PDU]
786,787,184.568669,128.31.0.39,192.168.56.101,TCP,1514,9101  >  49231 [ACK] Seq=575190 Ack=16892 Win=65535 Len=1460 [TCP segment of a reassembled PDU]
787,788,184.568669,128.31.0.39,192.168.56.101,TCP,1514,9101  >  49231 [ACK] Seq=576650 Ack=16892 Win=65535 Len=1460 [TCP segment of a reassembled PDU]
788,789,184.56867,128.31.0.39,192.168.56.101,TLSv1.2,1514,Application Data [TCP segment of a reassembled PDU]
789,790,184.568671,128.31.0.39,192.168.56.101,TCP,1514,9101  >  49231 [ACK] Seq=579570 Ack=16892 Win=65535 Len=1460 [TCP segment of a reassembled PDU]
790,791,184.568672,128.31.0.39,192.168.56.101,TCP,1514,9101  >  49231 [ACK] Seq=581030 Ack=16892 Win=65535 Len=1460 [TCP segment of a reassembled PDU]
791,792,184.568673,128.31.0.39,192.168.56.101,TLSv1.2,1514,Application Data [TCP segment of a reassembled PDU]
792,793,184.568673,128.31.0.39,192.168.56.101,TCP,1514,9101  >  49231 [ACK] Seq=583950 Ack=16892 Win=65535 Len=1460 [TCP segment of a reassembled PDU]
793,794,184.568674,128.31.0.39,192.168.56.101,TCP,1514,9101  >  49231 [ACK] Seq=585410 Ack=16892 Win=65535 Len=1460 [TCP segment of a reassembled PDU]
794,795,184.568675,128.31.0.39,192.168.56.101,TLSv1.2,1514,Application Data [TCP segment of a reassembled PDU]
795,796,184.568676,128.31.0.39,192.168.56.101,TCP,1514,9101  >  49231 [ACK] Seq=588330 Ack=16892 Win=65535 Len=1460 [TCP segment of a reassembled PDU]
796,797,184.568676,128.31.0.39,192.168.56.101,TCP,1514,9101  >  49231 [ACK] Seq=589790 Ack=16892 Win=65535 Len=1460 [TCP segment of a reassembled PDU]
797,798,184.568677,128.31.0.39,192.168.56.101,TLSv1.2,1514,"Application Data, Application Data"
798,799,184.568678,128.31.0.39,192.168.56.101,TCP,1514,9101  >  49231 [ACK] Seq=592710 Ack=16892 Win=65535 Len=1460 [TCP segment of a reassembled PDU]
799,800,184.568678,128.31.0.39,192.168.56.101,TLSv1.2,1514,Application Data [TCP segment of a reassembled PDU]
800,801,184.568679,128.31.0.39,192.168.56.101,TCP,1514,9101  >  49231 [ACK] Seq=595630 Ack=16892 Win=65535 Len=1460 [TCP segment of a reassembled PDU]
801,802,184.56868,128.31.0.39,192.168.56.101,TCP,1514,9101  >  49231 [ACK] Seq=597090 Ack=16892 Win=65535 Len=1460 [TCP segment of a reassembled PDU]
802,803,184.568681,128.31.0.39,192.168.56.101,TLSv1.2,1514,Application Data [TCP segment of a reassembled PDU]
803,804,184.568681,128.31.0.39,192.168.56.101,TLSv1.2,1514,Application Data [TCP segment of a reassembled PDU]
804,805,184.568682,128.31.0.39,192.168.56.101,TCP,1514,9101  >  49231 [ACK] Seq=601470 Ack=16892 Win=65535 Len=1460 [TCP segment of a reassembled PDU]
805,806,184.568683,128.31.0.39,192.168.56.101,TLSv1.2,1514,Application Data [TCP segment of a reassembled PDU]
806,807,184.568683,128.31.0.39,192.168.56.101,TCP,1514,9101  >  49231 [ACK] Seq=604390 Ack=16892 Win=65535 Len=1460 [TCP segment of a reassembled PDU]
807,808,184.568755,128.31.0.39,192.168.56.101,TCP,1514,9101  >  49231 [ACK] Seq=605850 Ack=16892 Win=65535 Len=1460 [TCP segment of a reassembled PDU]
808,809,184.56876,128.31.0.39,192.168.56.101,TLSv1.2,1514,Application Data [TCP segment of a reassembled PDU]
809,810,184.568761,128.31.0.39,192.168.56.101,TCP,1514,9101  >  49231 [ACK] Seq=608770 Ack=16892 Win=65535 Len=1460 [TCP segment of a reassembled PDU]
810,811,184.568761,128.31.0.39,192.168.56.101,TCP,1514,9101  >  49231 [ACK] Seq=610230 Ack=16892 Win=65535 Len=1460 [TCP segment of a reassembled PDU]
811,812,184.568762,128.31.0.39,192.168.56.101,TLSv1.2,1514,Application Data [TCP segment of a reassembled PDU]
812,813,184.568763,128.31.0.39,192.168.56.101,TLSv1.2,1265,Application Data
813,814,184.569079,192.168.56.101,128.31.0.39,TCP,54,49231  >  9101 [ACK] Seq=16892 Ack=604390 Win=14600 Len=0
814,815,184.569174,192.168.56.101,128.31.0.39,TCP,54,49231  >  9101 [ACK] Seq=16892 Ack=614361 Win=4629 Len=0
815,816,184.604776,192.168.56.101,128.31.0.39,TLSv1.2,597,Application Data
816,817,184.604914,128.31.0.39,192.168.56.101,TCP,54,9101  >  49231 [ACK] Seq=614361 Ack=17435 Win=65535 Len=0
817,818,184.650057,192.168.56.101,128.31.0.39,TLSv1.2,1111,Application Data
818,819,184.65019,128.31.0.39,192.168.56.101,TCP,54,9101  >  49231 [ACK] Seq=614361 Ack=18492 Win=65535 Len=0
819,820,184.687461,192.168.56.101,128.31.0.39,TCP,54,[TCP Window Update] 49231  >  9101 [ACK] Seq=18492 Ack=614361 Win=8101 Len=0
820,821,184.697244,192.168.56.101,128.31.0.39,TCP,54,[TCP Window Update] 49231  >  9101 [ACK] Seq=18492 Ack=614361 Win=64240 Len=0
821,822,184.701529,192.168.56.101,128.31.0.39,TLSv1.2,597,Application Data
822,823,184.701662,128.31.0.39,192.168.56.101,TCP,54,9101  >  49231 [ACK] Seq=614361 Ack=19035 Win=65535 Len=0
823,824,184.752094,192.168.56.101,128.31.0.39,TLSv1.2,1111,Application Data
824,825,184.752251,128.31.0.39,192.168.56.101,TCP,54,9101  >  49231 [ACK] Seq=614361 Ack=20092 Win=65535 Len=0
825,826,184.78765,192.168.56.101,128.31.0.39,TLSv1.2,597,Application Data
826,827,184.78786,128.31.0.39,192.168.56.101,TCP,54,9101  >  49231 [ACK] Seq=614361 Ack=20635 Win=65535 Len=0
827,828,185.62016,192.168.56.101,185.13.38.75,TCP,66,[TCP Retransmission] [TCP Port numbers reused] 49230  >  9001 [SYN] Seq=0 Win=8192 Len=0 MSS=1460 WS=256 SACK_PERM=1
828,829,191.62035,192.168.56.101,185.13.38.75,TCP,62,[TCP Retransmission] [TCP Port numbers reused] 49230  >  9001 [SYN] Seq=0 Win=8192 Len=0 MSS=1460 SACK_PERM=1
