,Source,Destination,Protocol,Info
0,0a:00:27:00:00:00,5a:94:d2:14:5a:51,ARP,Who has 192.168.56.101? Tell 192.168.56.1
1,0a:00:27:00:00:00,5a:94:d2:14:5a:51,ARP,Who has 192.168.56.101? Tell 192.168.56.1
2,0a:00:27:00:00:00,5a:94:d2:14:5a:51,ARP,Who has 192.168.56.101? Tell 192.168.56.1
3,0a:00:27:00:00:00,Broadcast,ARP,Who has 192.168.56.101? Tell 192.168.56.1
4,0a:00:27:00:00:00,Broadcast,ARP,Who has 192.168.56.101? Tell 192.168.56.1
5,0a:00:27:00:00:00,Broadcast,ARP,Who has 192.168.56.101? Tell 192.168.56.1
6,0a:00:27:00:00:00,Broadcast,ARP,Who has 192.168.56.101? Tell 192.168.56.1
7,0a:00:27:00:00:00,Broadcast,ARP,Who has 192.168.56.101? Tell 192.168.56.1
8,0a:00:27:00:00:00,Broadcast,ARP,Who has 192.168.56.101? Tell 192.168.56.1
9,0a:00:27:00:00:00,Broadcast,ARP,Who has 192.168.56.101? Tell 192.168.56.1
10,0a:00:27:00:00:00,Broadcast,ARP,Who has 192.168.56.101? Tell 192.168.56.1
11,0a:00:27:00:00:00,Broadcast,ARP,Who has 192.168.56.101? Tell 192.168.56.1
12,0a:00:27:00:00:00,Broadcast,ARP,Who has 192.168.56.101? Tell 192.168.56.1
13,0a:00:27:00:00:00,Broadcast,ARP,Who has 192.168.56.101? Tell 192.168.56.1
14,5a:94:d2:14:5a:51,Broadcast,ARP,Who has 192.168.56.101? Tell 0.0.0.0
15,5a:94:d2:14:5a:51,Broadcast,ARP,Who has 192.168.56.101? Tell 0.0.0.0
16,0a:00:27:00:00:00,Broadcast,ARP,Who has 192.168.56.101? Tell 192.168.56.1
17,5a:94:d2:14:5a:51,Broadcast,ARP,Who has 192.168.56.101? Tell 0.0.0.0
18,5a:94:d2:14:5a:51,Broadcast,ARP,Who has 192.168.56.101? Tell 0.0.0.0
19,5a:94:d2:14:5a:51,Broadcast,ARP,Who has 192.168.56.101? Tell 0.0.0.0
20,5a:94:d2:14:5a:51,Broadcast,ARP,Who has 192.168.56.101? Tell 0.0.0.0
21,0a:00:27:00:00:00,Broadcast,ARP,Who has 192.168.56.101? Tell 192.168.56.1
22,5a:94:d2:14:5a:51,Broadcast,ARP,Who has 192.168.56.1? Tell 192.168.56.101
23,5a:94:d2:14:5a:51,Broadcast,ARP,Who has 192.168.56.1? Tell 192.168.56.101
24,0a:00:27:00:00:00,5a:94:d2:14:5a:51,ARP,192.168.56.1 is at 0a:00:27:00:00:00
25,5a:94:d2:14:5a:51,Broadcast,ARP,Who has 192.168.56.1? Tell 192.168.56.101
26,5a:94:d2:14:5a:51,Broadcast,ARP,Who has 192.168.56.1? Tell 192.168.56.101
27,0a:00:27:00:00:00,5a:94:d2:14:5a:51,ARP,192.168.56.1 is at 0a:00:27:00:00:00
28,5a:94:d2:14:5a:51,Broadcast,ARP,Who has 192.168.56.1? Tell 192.168.56.101
29,5a:94:d2:14:5a:51,Broadcast,ARP,Who has 192.168.56.1? Tell 192.168.56.101
30,0a:00:27:00:00:00,5a:94:d2:14:5a:51,ARP,192.168.56.1 is at 0a:00:27:00:00:00
31,148.251.190.229,192.168.56.101,TLSv1.2,Application Data
32,192.168.56.101,148.251.190.229,TCP,49434  >  9010 [RST] Seq=1 Win=0 Len=0
33,192.168.56.101,104.208.16.93,TCP,49170  >  80 [SYN] Seq=0 Win=8192 Len=0 MSS=1460 WS=256 SACK_PERM=1
34,192.168.56.101,104.208.16.93,TCP,[TCP Retransmission] 49170  >  80 [SYN] Seq=0 Win=8192 Len=0 MSS=1460 WS=256 SACK_PERM=1
35,192.168.56.101,104.208.16.93,TCP,[TCP Retransmission] 49170  >  80 [SYN] Seq=0 Win=8192 Len=0 MSS=1460 SACK_PERM=1
36,192.168.56.101,142.251.33.14,TCP,49165  >  443 [SYN] Seq=0 Win=8192 Len=0 MSS=1460 WS=256 SACK_PERM=1
37,142.251.33.14,192.168.56.101,TCP,"443  >  49165 [SYN, ACK] Seq=0 Ack=1 Win=65535 Len=0 MSS=1460"
38,192.168.56.101,142.251.33.14,TCP,49165  >  443 [ACK] Seq=1 Ack=1 Win=64240 Len=0
39,192.168.56.101,142.251.33.14,TLSv1.2,Client Hello
40,142.251.33.14,192.168.56.101,TCP,443  >  49165 [ACK] Seq=1 Ack=162 Win=65535 Len=0
41,142.251.33.14,192.168.56.101,TLSv1.2,Server Hello
42,142.251.33.14,192.168.56.101,TCP,"443  >  49165 [PSH, ACK] Seq=1461 Ack=162 Win=65535 Len=1364 [TCP segment of a reassembled PDU]"
43,192.168.56.101,142.251.33.14,TCP,49165  >  443 [ACK] Seq=162 Ack=2825 Win=64240 Len=0
44,142.251.33.14,192.168.56.101,TCP,443  >  49165 [ACK] Seq=2825 Ack=162 Win=65535 Len=1460 [TCP segment of a reassembled PDU]
45,142.251.33.14,192.168.56.101,TCP,443  >  49165 [ACK] Seq=4285 Ack=162 Win=65535 Len=1460 [TCP segment of a reassembled PDU]
46,142.251.33.14,192.168.56.101,TLSv1.2,"Certificate, Server Key Exchange, Server Hello Done"
47,192.168.56.101,142.251.33.14,TCP,49165  >  443 [ACK] Seq=162 Ack=6661 Win=64240 Len=0
48,192.168.56.101,142.251.33.14,TLSv1.2,"Client Key Exchange, Change Cipher Spec, Encrypted Handshake Message"
49,142.251.33.14,192.168.56.101,TCP,443  >  49165 [ACK] Seq=6661 Ack=288 Win=65535 Len=0
50,142.251.33.14,192.168.56.101,TLSv1.2,"Change Cipher Spec, Encrypted Handshake Message"
51,192.168.56.101,142.251.33.14,TCP,49165  >  443 [ACK] Seq=288 Ack=6712 Win=64189 Len=0
52,192.168.56.101,142.251.33.14,TLSv1.2,Application Data
53,142.251.33.14,192.168.56.101,TCP,443  >  49165 [ACK] Seq=6712 Ack=811 Win=65535 Len=0
54,142.251.33.14,192.168.56.101,TLSv1.2,Application Data
55,192.168.56.101,142.251.33.14,TCP,49165  >  443 [ACK] Seq=811 Ack=6991 Win=63910 Len=0
56,192.168.56.101,142.251.33.14,TCP,"49165  >  443 [RST, ACK] Seq=811 Ack=6991 Win=0 Len=0"
57,192.168.56.101,163.172.194.53,TCP,49205  >  9001 [SYN] Seq=0 Win=8192 Len=0 MSS=1460 WS=256 SACK_PERM=1
58,192.168.56.101,163.172.194.53,TCP,[TCP Retransmission] 49205  >  9001 [SYN] Seq=0 Win=8192 Len=0 MSS=1460 WS=256 SACK_PERM=1
59,192.168.56.101,163.172.194.53,TCP,[TCP Retransmission] 49205  >  9001 [SYN] Seq=0 Win=8192 Len=0 MSS=1460 SACK_PERM=1
60,192.168.56.101,192.168.56.255,NBNS,Registration NB NONE<20>
61,192.168.56.101,192.168.56.255,NBNS,Registration NB NONE<20>
62,192.168.56.101,192.168.56.255,NBNS,Registration NB NONE<00>
63,192.168.56.101,192.168.56.255,NBNS,Registration NB NONE<00>
64,192.168.56.101,192.168.56.255,NBNS,Registration NB WORKGROUP<00>
65,192.168.56.101,192.168.56.255,NBNS,Registration NB WORKGROUP<00>
66,192.168.56.101,192.168.56.255,NBNS,Name query NB ISATAP<00>
67,192.168.56.101,192.168.56.255,NBNS,Name query NB ISATAP<00>
68,192.168.56.101,192.168.56.255,NBNS,Registration NB WORKGROUP<00>
69,192.168.56.101,192.168.56.255,NBNS,Registration NB WORKGROUP<00>
70,192.168.56.101,192.168.56.255,NBNS,Registration NB NONE<00>
71,192.168.56.101,192.168.56.255,NBNS,Registration NB NONE<00>
72,192.168.56.101,192.168.56.255,NBNS,Registration NB NONE<20>
73,192.168.56.101,192.168.56.255,NBNS,Registration NB NONE<20>
74,192.168.56.101,192.168.56.255,NBNS,Name query NB ISATAP<00>
75,192.168.56.101,192.168.56.255,NBNS,Name query NB ISATAP<00>
76,192.168.56.101,192.168.56.255,NBNS,Registration NB NONE<20>
77,192.168.56.101,192.168.56.255,NBNS,Registration NB NONE<20>
78,192.168.56.101,192.168.56.255,NBNS,Registration NB NONE<00>
79,192.168.56.101,192.168.56.255,NBNS,Registration NB NONE<00>
80,192.168.56.101,192.168.56.255,NBNS,Registration NB WORKGROUP<00>
81,192.168.56.101,192.168.56.255,NBNS,Registration NB WORKGROUP<00>
82,192.168.56.101,192.168.56.255,NBNS,Name query NB WPAD<00>
83,192.168.56.101,192.168.56.255,NBNS,Name query NB WPAD<00>
84,192.168.56.101,192.168.56.255,NBNS,Name query NB ISATAP<00>
85,192.168.56.101,192.168.56.255,NBNS,Name query NB ISATAP<00>
86,192.168.56.101,192.168.56.255,NBNS,Registration NB WORKGROUP<00>
87,192.168.56.101,192.168.56.255,NBNS,Registration NB WORKGROUP<00>
88,192.168.56.101,192.168.56.255,NBNS,Registration NB NONE<00>
89,192.168.56.101,192.168.56.255,NBNS,Registration NB NONE<00>
90,192.168.56.101,192.168.56.255,NBNS,Registration NB NONE<20>
91,192.168.56.101,192.168.56.255,NBNS,Registration NB NONE<20>
92,192.168.56.101,192.168.56.255,NBNS,Name query NB WPAD<00>
93,192.168.56.101,192.168.56.255,NBNS,Name query NB WPAD<00>
94,192.168.56.101,192.168.56.255,NBNS,Name query NB ISATAP<00>
95,192.168.56.101,192.168.56.255,NBNS,Name query NB ISATAP<00>
96,192.168.56.101,192.168.56.255,NBNS,Registration NB WORKGROUP<1e>
97,192.168.56.101,192.168.56.255,NBNS,Registration NB WORKGROUP<1e>
98,192.168.56.101,192.168.56.255,NBNS,Name query NB WPAD<00>
99,192.168.56.101,192.168.56.255,NBNS,Name query NB WPAD<00>
100,192.168.56.101,192.168.56.255,NBNS,Name query NB ISATAP<00>
101,192.168.56.101,192.168.56.255,NBNS,Name query NB ISATAP<00>
102,192.168.56.101,192.168.56.255,NBNS,Registration NB WORKGROUP<1e>
103,192.168.56.101,192.168.56.255,NBNS,Registration NB WORKGROUP<1e>
104,192.168.56.101,192.168.56.255,NBNS,Name query NB ISATAP<00>
105,192.168.56.101,192.168.56.255,NBNS,Name query NB ISATAP<00>
106,192.168.56.101,192.168.56.255,NBNS,Registration NB WORKGROUP<1e>
107,192.168.56.101,192.168.56.255,NBNS,Registration NB WORKGROUP<1e>
108,192.168.56.101,192.168.56.255,NBNS,Registration NB WORKGROUP<1e>
109,192.168.56.101,192.168.56.255,NBNS,Registration NB WORKGROUP<1e>
110,192.168.56.101,192.168.56.255,NBNS,Name query NB ISATAP<00>
111,192.168.56.101,192.168.56.255,NBNS,Name query NB ISATAP<00>
112,192.168.56.101,192.168.56.255,NBNS,Name query NB WORKGROUP<1b>
113,192.168.56.101,192.168.56.255,NBNS,Name query NB WORKGROUP<1b>
114,192.168.56.101,192.168.56.255,NBNS,Name query NB ISATAP<00>
115,192.168.56.101,192.168.56.255,NBNS,Name query NB ISATAP<00>
116,192.168.56.101,192.168.56.255,NBNS,Name query NB WORKGROUP<1b>
117,192.168.56.101,192.168.56.255,NBNS,Name query NB WORKGROUP<1b>
118,192.168.56.101,192.168.56.255,NBNS,Name query NB ISATAP<00>
119,192.168.56.101,192.168.56.255,NBNS,Name query NB ISATAP<00>
120,192.168.56.101,192.168.56.255,NBNS,Name query NB WORKGROUP<1b>
121,192.168.56.101,192.168.56.255,NBNS,Name query NB WORKGROUP<1b>
122,192.168.56.101,192.168.56.255,NBNS,Name query NB ISATAP<00>
123,192.168.56.101,192.168.56.255,NBNS,Name query NB ISATAP<00>
124,192.168.56.101,192.168.56.255,NBNS,Name query NB ISATAP<00>
125,192.168.56.101,192.168.56.255,NBNS,Name query NB ISATAP<00>
126,192.168.56.101,192.168.56.255,NBNS,Name query NB WORKGROUP<1b>
127,192.168.56.101,192.168.56.255,NBNS,Name query NB WORKGROUP<1b>
128,192.168.56.101,192.168.56.255,NBNS,Name query NB ISATAP<00>
129,192.168.56.101,192.168.56.255,NBNS,Name query NB ISATAP<00>
130,192.168.56.101,192.168.56.255,NBNS,Name query NB WORKGROUP<1b>
131,192.168.56.101,192.168.56.255,NBNS,Name query NB WORKGROUP<1b>
132,192.168.56.101,192.168.56.255,NBNS,Name query NB WORKGROUP<1b>
133,192.168.56.101,192.168.56.255,NBNS,Name query NB WORKGROUP<1b>
134,192.168.56.101,192.168.56.255,NBNS,Name query NB ISATAP<00>
135,192.168.56.101,192.168.56.255,NBNS,Name query NB ISATAP<00>
136,192.168.56.101,192.168.56.255,NBNS,Name query NB ISATAP<00>
137,192.168.56.101,192.168.56.255,NBNS,Name query NB ISATAP<00>
138,192.168.56.101,192.168.56.255,NBNS,Name query NB ISATAP<00>
139,192.168.56.101,192.168.56.255,NBNS,Name query NB ISATAP<00>
140,192.168.56.101,192.168.56.255,NBNS,Name query NB WORKGROUP<1b>
141,192.168.56.101,192.168.56.255,NBNS,Name query NB WORKGROUP<1b>
142,192.168.56.101,192.168.56.255,NBNS,Name query NB WORKGROUP<1b>
143,192.168.56.101,192.168.56.255,NBNS,Name query NB WORKGROUP<1b>
144,192.168.56.101,192.168.56.255,NBNS,Name query NB ISATAP<00>
145,192.168.56.101,192.168.56.255,NBNS,Name query NB ISATAP<00>
146,192.168.56.101,192.168.56.255,NBNS,Name query NB WORKGROUP<1b>
147,192.168.56.101,192.168.56.255,NBNS,Name query NB WORKGROUP<1b>
148,192.168.56.101,192.168.56.255,NBNS,Name query NB ISATAP<00>
149,192.168.56.101,192.168.56.255,NBNS,Name query NB ISATAP<00>
150,192.168.56.101,192.168.56.255,NBNS,Name query NB ISATAP<00>
151,192.168.56.101,192.168.56.255,NBNS,Name query NB ISATAP<00>
152,192.168.56.101,192.168.56.255,NBNS,Name query NB WORKGROUP<1b>
153,192.168.56.101,192.168.56.255,NBNS,Name query NB WORKGROUP<1b>
154,192.168.56.101,192.168.56.255,NBNS,Registration NB WORKGROUP<1d>
155,192.168.56.101,192.168.56.255,NBNS,Registration NB WORKGROUP<1d>
156,192.168.56.101,192.168.56.255,NBNS,Name query NB WORKGROUP<1b>
157,192.168.56.101,192.168.56.255,NBNS,Name query NB WORKGROUP<1b>
158,192.168.56.101,192.168.56.255,NBNS,Registration NB WORKGROUP<1d>
159,192.168.56.101,192.168.56.255,NBNS,Registration NB WORKGROUP<1d>
160,192.168.56.101,192.168.56.255,NBNS,Name query NB WORKGROUP<1b>
161,192.168.56.101,192.168.56.255,NBNS,Name query NB WORKGROUP<1b>
162,192.168.56.101,192.168.56.255,NBNS,Registration NB WORKGROUP<1d>
163,192.168.56.101,192.168.56.255,NBNS,Registration NB WORKGROUP<1d>
164,192.168.56.101,192.168.56.255,NBNS,Registration NB WORKGROUP<1d>
165,192.168.56.101,192.168.56.255,NBNS,Registration NB WORKGROUP<1d>
166,192.168.56.101,192.168.56.255,NBNS,Name query NB WORKGROUP<1b>
167,192.168.56.101,192.168.56.255,NBNS,Name query NB WORKGROUP<1b>
168,192.168.56.101,192.168.56.255,NBNS,Registration NB <01><02>__MSBROWSE__<02><01>
169,192.168.56.101,192.168.56.255,NBNS,Registration NB <01><02>__MSBROWSE__<02><01>
170,192.168.56.101,192.168.56.255,NBNS,Name query NB WORKGROUP<1b>
171,192.168.56.101,192.168.56.255,NBNS,Name query NB WORKGROUP<1b>
172,192.168.56.101,192.168.56.255,NBNS,Registration NB <01><02>__MSBROWSE__<02><01>
173,192.168.56.101,192.168.56.255,NBNS,Registration NB <01><02>__MSBROWSE__<02><01>
174,192.168.56.101,192.168.56.255,NBNS,Name query NB WORKGROUP<1b>
175,192.168.56.101,192.168.56.255,NBNS,Name query NB WORKGROUP<1b>
176,192.168.56.101,192.168.56.255,NBNS,Registration NB <01><02>__MSBROWSE__<02><01>
177,192.168.56.101,192.168.56.255,NBNS,Registration NB <01><02>__MSBROWSE__<02><01>
178,192.168.56.101,192.168.56.255,NBNS,Registration NB <01><02>__MSBROWSE__<02><01>
179,192.168.56.101,192.168.56.255,NBNS,Registration NB <01><02>__MSBROWSE__<02><01>
180,192.168.56.101,192.168.56.255,NBNS,Name query NB WORKGROUP<1b>
181,192.168.56.101,192.168.56.255,NBNS,Name query NB WORKGROUP<1b>
182,192.168.56.101,192.168.56.255,NBNS,Name query NB WORKGROUP<1b>
183,192.168.56.101,192.168.56.255,NBNS,Name query NB WORKGROUP<1b>
184,192.168.56.101,192.168.56.255,NBNS,Name query NB WORKGROUP<1b>
185,192.168.56.101,192.168.56.255,NBNS,Name query NB WORKGROUP<1b>
186,192.168.56.101,192.168.56.255,NBNS,Name query NB WPAD<00>
187,192.168.56.101,192.168.56.255,NBNS,Name query NB WPAD<00>
188,192.168.56.101,192.168.56.255,NBNS,Name query NB WPAD<00>
189,192.168.56.101,192.168.56.255,NBNS,Name query NB WPAD<00>
190,192.168.56.101,192.168.56.255,NBNS,Name query NB WPAD<00>
191,192.168.56.101,192.168.56.255,NBNS,Name query NB WPAD<00>
192,192.168.56.101,192.168.56.255,NBNS,Name query NB WPAD<00>
193,192.168.56.101,192.168.56.255,NBNS,Name query NB WPAD<00>
194,192.168.56.101,192.168.56.255,NBNS,Name query NB WPAD<00>
195,192.168.56.101,192.168.56.255,NBNS,Name query NB WPAD<00>
196,192.168.56.101,192.168.56.255,NBNS,Name query NB WPAD<00>
197,192.168.56.101,192.168.56.255,NBNS,Name query NB WPAD<00>
198,192.168.56.101,192.168.56.255,BROWSER,Get Backup List Request
199,192.168.56.101,192.168.56.255,BROWSER,Get Backup List Request
200,192.168.56.101,192.168.56.255,BROWSER,Request Announcement NONE
201,192.168.56.101,192.168.56.255,BROWSER,Request Announcement NONE
202,192.168.56.101,192.168.56.255,BROWSER,"Host Announcement NONE, Workstation, Server, NT Workstation, Potential Browser"
203,192.168.56.101,192.168.56.255,BROWSER,"Host Announcement NONE, Workstation, Server, NT Workstation, Potential Browser"
204,192.168.56.101,192.168.56.255,BROWSER,Request Announcement NONE
205,192.168.56.101,192.168.56.255,BROWSER,Request Announcement NONE
206,192.168.56.101,192.168.56.255,BROWSER,Request Announcement NONE
207,192.168.56.101,192.168.56.255,BROWSER,Request Announcement NONE
208,192.168.56.101,192.168.56.255,BROWSER,Get Backup List Request
209,192.168.56.101,192.168.56.255,BROWSER,Get Backup List Request
210,192.168.56.101,192.168.56.255,BROWSER,Request Announcement NONE
211,192.168.56.101,192.168.56.255,BROWSER,Request Announcement NONE
212,192.168.56.101,192.168.56.255,BROWSER,Browser Election Request
213,192.168.56.101,192.168.56.255,BROWSER,Browser Election Request
214,192.168.56.101,192.168.56.255,BROWSER,Get Backup List Request
215,192.168.56.101,192.168.56.255,BROWSER,Get Backup List Request
216,192.168.56.101,192.168.56.255,BROWSER,Browser Election Request
217,192.168.56.101,192.168.56.255,BROWSER,Browser Election Request
218,192.168.56.101,192.168.56.255,BROWSER,Browser Election Request
219,192.168.56.101,192.168.56.255,BROWSER,Browser Election Request
220,192.168.56.101,192.168.56.255,BROWSER,Browser Election Request
221,192.168.56.101,192.168.56.255,BROWSER,Browser Election Request
222,192.168.56.101,192.168.56.255,BROWSER,Get Backup List Request
223,192.168.56.101,192.168.56.255,BROWSER,Get Backup List Request
224,192.168.56.101,192.168.56.255,BROWSER,Get Backup List Request
225,192.168.56.101,192.168.56.255,BROWSER,Get Backup List Request
226,192.168.56.101,192.168.56.255,BROWSER,Request Announcement NONE
227,192.168.56.101,192.168.56.255,BROWSER,Request Announcement NONE
228,192.168.56.101,192.168.56.255,BROWSER,Request Announcement NONE
229,192.168.56.101,192.168.56.255,BROWSER,Request Announcement NONE
230,192.168.56.101,192.168.56.255,BROWSER,Get Backup List Request
231,192.168.56.101,192.168.56.255,BROWSER,Get Backup List Request
232,192.168.56.101,192.168.56.255,BROWSER,"Domain/Workgroup Announcement WORKGROUP, NT Workstation, Domain Enum"
233,192.168.56.101,192.168.56.255,BROWSER,"Domain/Workgroup Announcement WORKGROUP, NT Workstation, Domain Enum"
234,192.168.56.101,192.168.56.255,BROWSER,"Local Master Announcement NONE, Workstation, Server, NT Workstation, Potential Browser, Master Browser"
235,192.168.56.101,192.168.56.255,BROWSER,"Local Master Announcement NONE, Workstation, Server, NT Workstation, Potential Browser, Master Browser"
236,192.168.56.101,192.168.56.255,BROWSER,"Domain/Workgroup Announcement WORKGROUP, NT Workstation, Domain Enum"
237,192.168.56.101,192.168.56.255,BROWSER,"Domain/Workgroup Announcement WORKGROUP, NT Workstation, Domain Enum"
238,192.168.56.101,192.168.56.255,BROWSER,"Domain/Workgroup Announcement WORKGROUP, NT Workstation, Domain Enum"
239,192.168.56.101,192.168.56.255,BROWSER,"Domain/Workgroup Announcement WORKGROUP, NT Workstation, Domain Enum"
240,192.168.56.101,193.23.244.244,TCP,49334  >  443 [SYN] Seq=0 Win=8192 Len=0 MSS=1460 WS=256 SACK_PERM=1
241,193.23.244.244,192.168.56.101,TCP,"443  >  49334 [SYN, ACK] Seq=0 Ack=1 Win=65535 Len=0 MSS=1460"
242,192.168.56.101,193.23.244.244,TCP,49334  >  443 [ACK] Seq=1 Ack=1 Win=64240 Len=0
243,192.168.56.101,193.23.244.244,TLSv1.2,Client Hello
244,193.23.244.244,192.168.56.101,TCP,443  >  49334 [ACK] Seq=1 Ack=221 Win=65535 Len=0
245,193.23.244.244,192.168.56.101,TLSv1.2,"Server Hello, Certificate, Server Key Exchange, Server Hello Done"
246,192.168.56.101,193.23.244.244,TLSv1.2,"Client Key Exchange, Change Cipher Spec, Encrypted Handshake Message"
247,193.23.244.244,192.168.56.101,TCP,443  >  49334 [ACK] Seq=1018 Ack=347 Win=65535 Len=0
248,193.23.244.244,192.168.56.101,TLSv1.2,"Change Cipher Spec, Encrypted Handshake Message"
249,192.168.56.101,193.23.244.244,TLSv1.2,Application Data
250,193.23.244.244,192.168.56.101,TCP,443  >  49334 [ACK] Seq=1069 Ack=385 Win=65535 Len=0
251,193.23.244.244,192.168.56.101,TCP,443  >  49334 [ACK] Seq=1069 Ack=385 Win=65535 Len=1460 [TCP segment of a reassembled PDU]
252,193.23.244.244,192.168.56.101,TLSv1.2,Application Data
253,192.168.56.101,193.23.244.244,TCP,49334  >  443 [ACK] Seq=385 Ack=3149 Win=64240 Len=0
254,192.168.56.101,193.23.244.244,TLSv1.2,Application Data
255,193.23.244.244,192.168.56.101,TCP,443  >  49334 [ACK] Seq=3149 Ack=1442 Win=65535 Len=0
256,193.23.244.244,192.168.56.101,TLSv1.2,Application Data
257,192.168.56.101,193.23.244.244,TLSv1.2,Application Data
258,193.23.244.244,192.168.56.101,TCP,443  >  49334 [ACK] Seq=3692 Ack=2499 Win=65535 Len=0
259,193.23.244.244,192.168.56.101,TCP,443  >  49334 [ACK] Seq=3692 Ack=2499 Win=65535 Len=1460 [TCP segment of a reassembled PDU]
260,193.23.244.244,192.168.56.101,TCP,443  >  49334 [ACK] Seq=5152 Ack=2499 Win=65535 Len=1460 [TCP segment of a reassembled PDU]
261,193.23.244.244,192.168.56.101,TLSv1.2,Application Data [TCP segment of a reassembled PDU]
262,193.23.244.244,192.168.56.101,TCP,443  >  49334 [ACK] Seq=8072 Ack=2499 Win=65535 Len=1460 [TCP segment of a reassembled PDU]
263,193.23.244.244,192.168.56.101,TCP,"443  >  49334 [PSH, ACK] Seq=9532 Ack=2499 Win=65535 Len=1157 [TCP segment of a reassembled PDU]"
264,192.168.56.101,193.23.244.244,TCP,49334  >  443 [ACK] Seq=2499 Ack=10689 Win=64240 Len=0
265,193.23.244.244,192.168.56.101,TLSv1.2,Application Data [TCP segment of a reassembled PDU]
266,193.23.244.244,192.168.56.101,TCP,443  >  49334 [ACK] Seq=12149 Ack=2499 Win=65535 Len=1460 [TCP segment of a reassembled PDU]
267,193.23.244.244,192.168.56.101,TLSv1.2,Application Data [TCP segment of a reassembled PDU]
268,193.23.244.244,192.168.56.101,TCP,443  >  49334 [ACK] Seq=15069 Ack=2499 Win=65535 Len=1460 [TCP segment of a reassembled PDU]
269,193.23.244.244,192.168.56.101,TCP,443  >  49334 [ACK] Seq=16529 Ack=2499 Win=65535 Len=1460 [TCP segment of a reassembled PDU]
270,193.23.244.244,192.168.56.101,TLSv1.2,"Application Data, Application Data"
271,192.168.56.101,193.23.244.244,TCP,49334  >  443 [ACK] Seq=2499 Ack=19449 Win=56940 Len=0
272,193.23.244.244,192.168.56.101,TCP,443  >  49334 [ACK] Seq=19449 Ack=2499 Win=65535 Len=1460 [TCP segment of a reassembled PDU]
273,193.23.244.244,192.168.56.101,TCP,"443  >  49334 [PSH, ACK] Seq=20909 Ack=2499 Win=65535 Len=1460 [TCP segment of a reassembled PDU]"
274,192.168.56.101,193.23.244.244,TCP,49334  >  443 [ACK] Seq=2499 Ack=22369 Win=54020 Len=0
275,193.23.244.244,192.168.56.101,TLSv1.2,Application Data [TCP segment of a reassembled PDU]
276,193.23.244.244,192.168.56.101,TCP,"443  >  49334 [PSH, ACK] Seq=23829 Ack=2499 Win=65535 Len=1460 [TCP segment of a reassembled PDU]"
277,192.168.56.101,193.23.244.244,TCP,49334  >  443 [ACK] Seq=2499 Ack=25289 Win=51100 Len=0
278,192.168.56.101,193.23.244.244,TCP,[TCP Window Update] 49334  >  443 [ACK] Seq=2499 Ack=25289 Win=64240 Len=0
279,193.23.244.244,192.168.56.101,TLSv1.2,Application Data [TCP segment of a reassembled PDU]
280,193.23.244.244,192.168.56.101,TCP,443  >  49334 [ACK] Seq=26749 Ack=2499 Win=65535 Len=1460 [TCP segment of a reassembled PDU]
281,193.23.244.244,192.168.56.101,TLSv1.2,Application Data [TCP segment of a reassembled PDU]
282,193.23.244.244,192.168.56.101,TLSv1.2,Application Data [TCP segment of a reassembled PDU]
283,193.23.244.244,192.168.56.101,TCP,"443  >  49334 [PSH, ACK] Seq=31129 Ack=2499 Win=65535 Len=1460 [TCP segment of a reassembled PDU]"
284,192.168.56.101,193.23.244.244,TCP,49334  >  443 [ACK] Seq=2499 Ack=32589 Win=64240 Len=0
285,193.23.244.244,192.168.56.101,TCP,443  >  49334 [ACK] Seq=32589 Ack=2499 Win=65535 Len=1460 [TCP segment of a reassembled PDU]
286,193.23.244.244,192.168.56.101,TLSv1.2,Application Data [TCP segment of a reassembled PDU]
287,193.23.244.244,192.168.56.101,TLSv1.2,"Application Data, Application Data"
288,193.23.244.244,192.168.56.101,TCP,"443  >  49334 [PSH, ACK] Seq=36969 Ack=2499 Win=65535 Len=1460 [TCP segment of a reassembled PDU]"
289,192.168.56.101,193.23.244.244,TCP,49334  >  443 [ACK] Seq=2499 Ack=38429 Win=59860 Len=0
290,193.23.244.244,192.168.56.101,TCP,"443  >  49334 [PSH, ACK] Seq=38429 Ack=2499 Win=65535 Len=1460 [TCP segment of a reassembled PDU]"
291,193.23.244.244,192.168.56.101,TLSv1.2,Application Data [TCP segment of a reassembled PDU]
292,193.23.244.244,192.168.56.101,TCP,"443  >  49334 [PSH, ACK] Seq=41349 Ack=2499 Win=65535 Len=1460 [TCP segment of a reassembled PDU]"
293,193.23.244.244,192.168.56.101,TCP,"443  >  49334 [PSH, ACK] Seq=42809 Ack=2499 Win=65535 Len=1460 [TCP segment of a reassembled PDU]"
294,192.168.56.101,193.23.244.244,TCP,49334  >  443 [ACK] Seq=2499 Ack=44269 Win=54020 Len=0
295,193.23.244.244,192.168.56.101,TLSv1.2,"Application Data, Application Data"
296,193.23.244.244,192.168.56.101,TCP,"443  >  49334 [PSH, ACK] Seq=45729 Ack=2499 Win=65535 Len=1460 [TCP segment of a reassembled PDU]"
297,192.168.56.101,193.23.244.244,TCP,49334  >  443 [ACK] Seq=2499 Ack=47189 Win=51100 Len=0
298,193.23.244.244,192.168.56.101,TCP,443  >  49334 [ACK] Seq=47189 Ack=2499 Win=65535 Len=1460 [TCP segment of a reassembled PDU]
299,193.23.244.244,192.168.56.101,TLSv1.2,Application Data [TCP segment of a reassembled PDU]
300,193.23.244.244,192.168.56.101,TCP,443  >  49334 [ACK] Seq=50109 Ack=2499 Win=65535 Len=1460 [TCP segment of a reassembled PDU]
301,193.23.244.244,192.168.56.101,TCP,"443  >  49334 [PSH, ACK] Seq=51569 Ack=2499 Win=65535 Len=1460 [TCP segment of a reassembled PDU]"
302,192.168.56.101,193.23.244.244,TCP,49334  >  443 [ACK] Seq=2499 Ack=53029 Win=45260 Len=0
303,192.168.56.101,193.23.244.244,TCP,[TCP Window Update] 49334  >  443 [ACK] Seq=2499 Ack=53029 Win=64240 Len=0
304,192.168.56.101,193.23.244.244,TLSv1.2,Application Data
305,193.23.244.244,192.168.56.101,TCP,443  >  49334 [ACK] Seq=53029 Ack=3042 Win=65535 Len=0
306,193.23.244.244,192.168.56.101,TLSv1.2,Application Data [TCP segment of a reassembled PDU]
307,193.23.244.244,192.168.56.101,TCP,"443  >  49334 [PSH, ACK] Seq=54489 Ack=3042 Win=65535 Len=1460 [TCP segment of a reassembled PDU]"
308,192.168.56.101,193.23.244.244,TCP,49334  >  443 [ACK] Seq=3042 Ack=55949 Win=64240 Len=0
309,193.23.244.244,192.168.56.101,TLSv1.2,Application Data [TCP segment of a reassembled PDU]
310,193.23.244.244,192.168.56.101,TLSv1.2,Application Data [TCP segment of a reassembled PDU]
311,193.23.244.244,192.168.56.101,TCP,"443  >  49334 [PSH, ACK] Seq=58869 Ack=3042 Win=65535 Len=1460 [TCP segment of a reassembled PDU]"
312,192.168.56.101,193.23.244.244,TCP,49334  >  443 [ACK] Seq=3042 Ack=58869 Win=64240 Len=0
313,193.23.244.244,192.168.56.101,TLSv1.2,Application Data [TCP segment of a reassembled PDU]
314,193.23.244.244,192.168.56.101,TCP,"443  >  49334 [PSH, ACK] Seq=61789 Ack=3042 Win=65535 Len=1460 [TCP segment of a reassembled PDU]"
315,192.168.56.101,193.23.244.244,TCP,49334  >  443 [ACK] Seq=3042 Ack=61789 Win=64240 Len=0
316,193.23.244.244,192.168.56.101,TCP,"443  >  49334 [PSH, ACK] Seq=63249 Ack=3042 Win=65535 Len=1460 [TCP segment of a reassembled PDU]"
317,192.168.56.101,193.23.244.244,TCP,49334  >  443 [ACK] Seq=3042 Ack=64709 Win=61320 Len=0
318,193.23.244.244,192.168.56.101,TLSv1.2,Application Data [TCP segment of a reassembled PDU]
319,193.23.244.244,192.168.56.101,TCP,"443  >  49334 [PSH, ACK] Seq=66169 Ack=3042 Win=65535 Len=1460 [TCP segment of a reassembled PDU]"
320,192.168.56.101,193.23.244.244,TCP,49334  >  443 [ACK] Seq=3042 Ack=67629 Win=58400 Len=0
321,193.23.244.244,192.168.56.101,TCP,"443  >  49334 [PSH, ACK] Seq=67629 Ack=3042 Win=65535 Len=1460 [TCP segment of a reassembled PDU]"
322,193.23.244.244,192.168.56.101,TLSv1.2,Application Data [TCP segment of a reassembled PDU]
323,193.23.244.244,192.168.56.101,TCP,"443  >  49334 [PSH, ACK] Seq=70549 Ack=3042 Win=65535 Len=1460 [TCP segment of a reassembled PDU]"
324,192.168.56.101,193.23.244.244,TCP,49334  >  443 [ACK] Seq=3042 Ack=70549 Win=55480 Len=0
325,193.23.244.244,192.168.56.101,TCP,"443  >  49334 [PSH, ACK] Seq=72009 Ack=3042 Win=65535 Len=1460 [TCP segment of a reassembled PDU]"
326,192.168.56.101,193.23.244.244,TCP,49334  >  443 [ACK] Seq=3042 Ack=73469 Win=52560 Len=0
327,193.23.244.244,192.168.56.101,TLSv1.2,Application Data [TCP segment of a reassembled PDU]
328,193.23.244.244,192.168.56.101,TCP,"443  >  49334 [PSH, ACK] Seq=74929 Ack=3042 Win=65535 Len=1460 [TCP segment of a reassembled PDU]"
329,192.168.56.101,193.23.244.244,TCP,49334  >  443 [ACK] Seq=3042 Ack=76389 Win=49640 Len=0
330,193.23.244.244,192.168.56.101,TLSv1.2,Application Data [TCP segment of a reassembled PDU]
331,193.23.244.244,192.168.56.101,TCP,"443  >  49334 [PSH, ACK] Seq=77849 Ack=3042 Win=65535 Len=1460 [TCP segment of a reassembled PDU]"
332,193.23.244.244,192.168.56.101,TCP,"443  >  49334 [PSH, ACK] Seq=79309 Ack=3042 Win=65535 Len=1460 [TCP segment of a reassembled PDU]"
333,192.168.56.101,193.23.244.244,TCP,[TCP Window Update] 49334  >  443 [ACK] Seq=3042 Ack=76389 Win=64240 Len=0
334,192.168.56.101,193.23.244.244,TCP,49334  >  443 [ACK] Seq=3042 Ack=79309 Win=61320 Len=0
335,193.23.244.244,192.168.56.101,TLSv1.2,Application Data [TCP segment of a reassembled PDU]
336,193.23.244.244,192.168.56.101,TCP,"443  >  49334 [PSH, ACK] Seq=82229 Ack=3042 Win=65535 Len=1460 [TCP segment of a reassembled PDU]"
337,192.168.56.101,193.23.244.244,TCP,49334  >  443 [ACK] Seq=3042 Ack=82229 Win=58400 Len=0
338,193.23.244.244,192.168.56.101,TCP,"443  >  49334 [PSH, ACK] Seq=83689 Ack=3042 Win=65535 Len=1460 [TCP segment of a reassembled PDU]"
339,192.168.56.101,193.23.244.244,TCP,49334  >  443 [ACK] Seq=3042 Ack=85149 Win=55480 Len=0
340,193.23.244.244,192.168.56.101,TLSv1.2,"Application Data, Application Data"
341,193.23.244.244,192.168.56.101,TCP,"443  >  49334 [PSH, ACK] Seq=86609 Ack=3042 Win=65535 Len=1460 [TCP segment of a reassembled PDU]"
342,192.168.56.101,193.23.244.244,TCP,49334  >  443 [ACK] Seq=3042 Ack=88069 Win=52560 Len=0
343,193.23.244.244,192.168.56.101,TCP,"443  >  49334 [PSH, ACK] Seq=88069 Ack=3042 Win=65535 Len=1460 [TCP segment of a reassembled PDU]"
344,193.23.244.244,192.168.56.101,TLSv1.2,Application Data [TCP segment of a reassembled PDU]
345,192.168.56.101,193.23.244.244,TCP,49334  >  443 [ACK] Seq=3042 Ack=90989 Win=49640 Len=0
346,192.168.56.101,193.23.244.244,TLSv1.2,Application Data
347,193.23.244.244,192.168.56.101,TCP,443  >  49334 [ACK] Seq=90989 Ack=3585 Win=65535 Len=0
348,192.168.56.101,193.23.244.244,TLSv1.2,Application Data
349,193.23.244.244,192.168.56.101,TCP,443  >  49334 [ACK] Seq=90989 Ack=4128 Win=65535 Len=0
350,192.168.56.101,193.23.244.244,TCP,[TCP Window Update] 49334  >  443 [ACK] Seq=4128 Ack=90989 Win=53112 Len=0
351,192.168.56.101,193.23.244.244,TCP,[TCP Window Update] 49334  >  443 [ACK] Seq=4128 Ack=90989 Win=64240 Len=0
352,192.168.56.101,193.23.244.244,TLSv1.2,Application Data
353,193.23.244.244,192.168.56.101,TCP,443  >  49334 [ACK] Seq=90989 Ack=4671 Win=65535 Len=0
354,193.23.244.244,192.168.56.101,TCP,"443  >  49334 [PSH, ACK] Seq=90989 Ack=4671 Win=65535 Len=1460 [TCP segment of a reassembled PDU]"
355,193.23.244.244,192.168.56.101,TCP,443  >  49334 [ACK] Seq=92449 Ack=4671 Win=65535 Len=1460 [TCP segment of a reassembled PDU]
356,193.23.244.244,192.168.56.101,TLSv1.2,Application Data [TCP segment of a reassembled PDU]
357,193.23.244.244,192.168.56.101,TCP,443  >  49334 [ACK] Seq=95369 Ack=4671 Win=65535 Len=1460 [TCP segment of a reassembled PDU]
358,193.23.244.244,192.168.56.101,TLSv1.2,Application Data [TCP segment of a reassembled PDU]
359,193.23.244.244,192.168.56.101,TCP,443  >  49334 [ACK] Seq=98289 Ack=4671 Win=65535 Len=1460 [TCP segment of a reassembled PDU]
360,193.23.244.244,192.168.56.101,TCP,443  >  49334 [ACK] Seq=99749 Ack=4671 Win=65535 Len=1460 [TCP segment of a reassembled PDU]
361,193.23.244.244,192.168.56.101,TLSv1.2,Application Data [TCP segment of a reassembled PDU]
362,193.23.244.244,192.168.56.101,TCP,443  >  49334 [ACK] Seq=102669 Ack=4671 Win=65535 Len=1460 [TCP segment of a reassembled PDU]
363,193.23.244.244,192.168.56.101,TCP,443  >  49334 [ACK] Seq=104129 Ack=4671 Win=65535 Len=1460 [TCP segment of a reassembled PDU]
364,193.23.244.244,192.168.56.101,TLSv1.2,"Application Data, Application Data"
365,193.23.244.244,192.168.56.101,TCP,"443  >  49334 [PSH, ACK] Seq=107049 Ack=4671 Win=65535 Len=1460 [TCP segment of a reassembled PDU]"
366,193.23.244.244,192.168.56.101,TCP,"443  >  49334 [PSH, ACK] Seq=108509 Ack=4671 Win=65535 Len=1460 [TCP segment of a reassembled PDU]"
367,193.23.244.244,192.168.56.101,TLSv1.2,Application Data [TCP segment of a reassembled PDU]
368,193.23.244.244,192.168.56.101,TCP,"443  >  49334 [PSH, ACK] Seq=111429 Ack=4671 Win=65535 Len=1460 [TCP segment of a reassembled PDU]"
369,193.23.244.244,192.168.56.101,TCP,"443  >  49334 [PSH, ACK] Seq=112889 Ack=4671 Win=65535 Len=1460 [TCP segment of a reassembled PDU]"
370,193.23.244.244,192.168.56.101,TLSv1.2,Application Data [TCP segment of a reassembled PDU]
371,193.23.244.244,192.168.56.101,TCP,"443  >  49334 [PSH, ACK] Seq=115809 Ack=4671 Win=65535 Len=1460 [TCP segment of a reassembled PDU]"
372,193.23.244.244,192.168.56.101,TLSv1.2,Application Data [TCP segment of a reassembled PDU]
373,193.23.244.244,192.168.56.101,TCP,"443  >  49334 [PSH, ACK] Seq=118729 Ack=4671 Win=65535 Len=1460 [TCP segment of a reassembled PDU]"
374,193.23.244.244,192.168.56.101,TCP,"443  >  49334 [PSH, ACK] Seq=120189 Ack=4671 Win=65535 Len=1460 [TCP segment of a reassembled PDU]"
375,193.23.244.244,192.168.56.101,TLSv1.2,Application Data [TCP segment of a reassembled PDU]
376,193.23.244.244,192.168.56.101,TLSv1.2,Application Data [TCP segment of a reassembled PDU]
377,193.23.244.244,192.168.56.101,TCP,"443  >  49334 [PSH, ACK] Seq=124569 Ack=4671 Win=65535 Len=1460 [TCP segment of a reassembled PDU]"
378,193.23.244.244,192.168.56.101,TLSv1.2,Application Data [TCP segment of a reassembled PDU]
379,193.23.244.244,192.168.56.101,TCP,"443  >  49334 [PSH, ACK] Seq=127489 Ack=4671 Win=65535 Len=1460 [TCP segment of a reassembled PDU]"
380,193.23.244.244,192.168.56.101,TCP,"443  >  49334 [PSH, ACK] Seq=128949 Ack=4671 Win=65535 Len=1460 [TCP segment of a reassembled PDU]"
381,193.23.244.244,192.168.56.101,TLSv1.2,Application Data [TCP segment of a reassembled PDU]
382,192.168.56.101,193.23.244.244,TCP,49334  >  443 [ACK] Seq=4671 Ack=131869 Win=33580 Len=0
383,193.23.244.244,192.168.56.101,TCP,443  >  49334 [ACK] Seq=131869 Ack=4671 Win=65535 Len=1460 [TCP segment of a reassembled PDU]
384,193.23.244.244,192.168.56.101,TCP,443  >  49334 [ACK] Seq=133329 Ack=4671 Win=65535 Len=1460 [TCP segment of a reassembled PDU]
385,193.23.244.244,192.168.56.101,TLSv1.2,Application Data [TCP segment of a reassembled PDU]
386,193.23.244.244,192.168.56.101,TCP,443  >  49334 [ACK] Seq=136249 Ack=4671 Win=65535 Len=1460 [TCP segment of a reassembled PDU]
387,193.23.244.244,192.168.56.101,TLSv1.2,Application Data [TCP segment of a reassembled PDU]
388,193.23.244.244,192.168.56.101,TCP,443  >  49334 [ACK] Seq=139169 Ack=4671 Win=65535 Len=1460 [TCP segment of a reassembled PDU]
389,193.23.244.244,192.168.56.101,TCP,443  >  49334 [ACK] Seq=140629 Ack=4671 Win=65535 Len=1460 [TCP segment of a reassembled PDU]
390,193.23.244.244,192.168.56.101,TLSv1.2,Application Data [TCP segment of a reassembled PDU]
391,193.23.244.244,192.168.56.101,TCP,443  >  49334 [ACK] Seq=143549 Ack=4671 Win=65535 Len=1460 [TCP segment of a reassembled PDU]
392,193.23.244.244,192.168.56.101,TCP,443  >  49334 [ACK] Seq=145009 Ack=4671 Win=65535 Len=1460 [TCP segment of a reassembled PDU]
393,193.23.244.244,192.168.56.101,TLSv1.2,"Application Data, Application Data"
394,193.23.244.244,192.168.56.101,TCP,443  >  49334 [ACK] Seq=147929 Ack=4671 Win=65535 Len=1460 [TCP segment of a reassembled PDU]
395,193.23.244.244,192.168.56.101,TCP,443  >  49334 [ACK] Seq=149389 Ack=4671 Win=65535 Len=1460 [TCP segment of a reassembled PDU]
396,193.23.244.244,192.168.56.101,TLSv1.2,Application Data [TCP segment of a reassembled PDU]
397,193.23.244.244,192.168.56.101,TCP,443  >  49334 [ACK] Seq=152309 Ack=4671 Win=65535 Len=1460 [TCP segment of a reassembled PDU]
398,193.23.244.244,192.168.56.101,TCP,443  >  49334 [ACK] Seq=153769 Ack=4671 Win=65535 Len=1460 [TCP segment of a reassembled PDU]
399,193.23.244.244,192.168.56.101,TLSv1.2,Application Data [TCP segment of a reassembled PDU]
400,193.23.244.244,192.168.56.101,TCP,443  >  49334 [ACK] Seq=156689 Ack=4671 Win=65535 Len=1460 [TCP segment of a reassembled PDU]
401,193.23.244.244,192.168.56.101,TLSv1.2,Application Data [TCP segment of a reassembled PDU]
402,193.23.244.244,192.168.56.101,TCP,443  >  49334 [ACK] Seq=159609 Ack=4671 Win=65535 Len=1460 [TCP segment of a reassembled PDU]
403,193.23.244.244,192.168.56.101,TCP,443  >  49334 [ACK] Seq=161069 Ack=4671 Win=65535 Len=1460 [TCP segment of a reassembled PDU]
404,193.23.244.244,192.168.56.101,TLSv1.2,Application Data [TCP segment of a reassembled PDU]
405,193.23.244.244,192.168.56.101,TLSv1.2,"[TCP Window Full] , Application Data [TCP segment of a reassembled PDU]"
406,192.168.56.101,193.23.244.244,TCP,[TCP ZeroWindow] 49334  >  443 [ACK] Seq=4671 Ack=165449 Win=0 Len=0
407,192.168.56.101,193.23.244.244,TCP,[TCP Window Update] 49334  >  443 [ACK] Seq=4671 Ack=165449 Win=3472 Len=0
408,193.23.244.244,192.168.56.101,TCP,"443  >  49334 [PSH, ACK] Seq=165449 Ack=4671 Win=65535 Len=1460 [TCP segment of a reassembled PDU]"
409,192.168.56.101,193.23.244.244,TCP,49334  >  443 [ACK] Seq=4671 Ack=166909 Win=62780 Len=0
410,192.168.56.101,193.23.244.244,TLSv1.2,Application Data
411,193.23.244.244,192.168.56.101,TCP,443  >  49334 [ACK] Seq=166909 Ack=5728 Win=65535 Len=0
412,192.168.56.101,193.23.244.244,TLSv1.2,Application Data
413,193.23.244.244,192.168.56.101,TCP,443  >  49334 [ACK] Seq=166909 Ack=6271 Win=65535 Len=0
414,193.23.244.244,192.168.56.101,TLSv1.2,Application Data [TCP segment of a reassembled PDU]
415,193.23.244.244,192.168.56.101,TCP,443  >  49334 [ACK] Seq=168369 Ack=6271 Win=65535 Len=1460 [TCP segment of a reassembled PDU]
416,193.23.244.244,192.168.56.101,TCP,443  >  49334 [ACK] Seq=169829 Ack=6271 Win=65535 Len=1460 [TCP segment of a reassembled PDU]
417,193.23.244.244,192.168.56.101,TLSv1.2,Application Data [TCP segment of a reassembled PDU]
418,193.23.244.244,192.168.56.101,TCP,443  >  49334 [ACK] Seq=172749 Ack=6271 Win=65535 Len=1460 [TCP segment of a reassembled PDU]
419,193.23.244.244,192.168.56.101,TCP,"443  >  49334 [PSH, ACK] Seq=174209 Ack=6271 Win=65535 Len=1460 [TCP segment of a reassembled PDU]"
420,192.168.56.101,193.23.244.244,TCP,49334  >  443 [ACK] Seq=6271 Ack=175669 Win=54020 Len=0
421,193.23.244.244,192.168.56.101,TLSv1.2,Application Data [TCP segment of a reassembled PDU]
422,193.23.244.244,192.168.56.101,TCP,443  >  49334 [ACK] Seq=177129 Ack=6271 Win=65535 Len=1460 [TCP segment of a reassembled PDU]
423,193.23.244.244,192.168.56.101,TLSv1.2,Application Data [TCP segment of a reassembled PDU]
424,193.23.244.244,192.168.56.101,TLSv1.2,Application Data [TCP segment of a reassembled PDU]
425,193.23.244.244,192.168.56.101,TCP,"443  >  49334 [PSH, ACK] Seq=181509 Ack=6271 Win=65535 Len=1460 [TCP segment of a reassembled PDU]"
426,192.168.56.101,193.23.244.244,TCP,49334  >  443 [ACK] Seq=6271 Ack=182969 Win=46720 Len=0
427,193.23.244.244,192.168.56.101,TCP,443  >  49334 [ACK] Seq=182969 Ack=6271 Win=65535 Len=1460 [TCP segment of a reassembled PDU]
428,193.23.244.244,192.168.56.101,TLSv1.2,Application Data [TCP segment of a reassembled PDU]
429,193.23.244.244,192.168.56.101,TCP,443  >  49334 [ACK] Seq=185889 Ack=6271 Win=65535 Len=1460 [TCP segment of a reassembled PDU]
430,193.23.244.244,192.168.56.101,TLSv1.2,Application Data [TCP segment of a reassembled PDU]
431,192.168.56.101,193.23.244.244,TCP,49334  >  443 [ACK] Seq=6271 Ack=185889 Win=43800 Len=0
432,192.168.56.101,193.23.244.244,TCP,49334  >  443 [ACK] Seq=6271 Ack=188809 Win=40880 Len=0
433,193.23.244.244,192.168.56.101,TCP,"443  >  49334 [PSH, ACK] Seq=188809 Ack=6271 Win=65535 Len=1460 [TCP segment of a reassembled PDU]"
434,193.23.244.244,192.168.56.101,TCP,443  >  49334 [ACK] Seq=190269 Ack=6271 Win=65535 Len=1460 [TCP segment of a reassembled PDU]
435,193.23.244.244,192.168.56.101,TLSv1.2,Application Data [TCP segment of a reassembled PDU]
436,193.23.244.244,192.168.56.101,TCP,443  >  49334 [ACK] Seq=193189 Ack=6271 Win=65535 Len=1460 [TCP segment of a reassembled PDU]
437,193.23.244.244,192.168.56.101,TCP,443  >  49334 [ACK] Seq=194649 Ack=6271 Win=65535 Len=1460 [TCP segment of a reassembled PDU]
438,193.23.244.244,192.168.56.101,TLSv1.2,"Application Data, Application Data"
439,193.23.244.244,192.168.56.101,TCP,"443  >  49334 [PSH, ACK] Seq=197569 Ack=6271 Win=65535 Len=1460 [TCP segment of a reassembled PDU]"
440,192.168.56.101,193.23.244.244,TCP,49334  >  443 [ACK] Seq=6271 Ack=199029 Win=30660 Len=0
441,193.23.244.244,192.168.56.101,TCP,443  >  49334 [ACK] Seq=199029 Ack=6271 Win=65535 Len=1460 [TCP segment of a reassembled PDU]
442,193.23.244.244,192.168.56.101,TLSv1.2,Application Data [TCP segment of a reassembled PDU]
443,193.23.244.244,192.168.56.101,TCP,"443  >  49334 [PSH, ACK] Seq=201949 Ack=6271 Win=65535 Len=1460 [TCP segment of a reassembled PDU]"
444,192.168.56.101,193.23.244.244,TCP,49334  >  443 [ACK] Seq=6271 Ack=203409 Win=26280 Len=0
445,193.23.244.244,192.168.56.101,TCP,443  >  49334 [ACK] Seq=203409 Ack=6271 Win=65535 Len=1460 [TCP segment of a reassembled PDU]
446,193.23.244.244,192.168.56.101,TLSv1.2,Application Data [TCP segment of a reassembled PDU]
447,193.23.244.244,192.168.56.101,TCP,443  >  49334 [ACK] Seq=206329 Ack=6271 Win=65535 Len=1460 [TCP segment of a reassembled PDU]
448,193.23.244.244,192.168.56.101,TLSv1.2,Application Data [TCP segment of a reassembled PDU]
449,193.23.244.244,192.168.56.101,TCP,443  >  49334 [ACK] Seq=209249 Ack=6271 Win=65535 Len=1460 [TCP segment of a reassembled PDU]
450,193.23.244.244,192.168.56.101,TCP,"443  >  49334 [PSH, ACK] Seq=210709 Ack=6271 Win=65535 Len=1460 [TCP segment of a reassembled PDU]"
451,193.23.244.244,192.168.56.101,TLSv1.2,Application Data [TCP segment of a reassembled PDU]
452,192.168.56.101,193.23.244.244,TCP,49334  >  443 [ACK] Seq=6271 Ack=213629 Win=16060 Len=0
453,193.23.244.244,192.168.56.101,TCP,443  >  49334 [ACK] Seq=213629 Ack=6271 Win=65535 Len=1460 [TCP segment of a reassembled PDU]
454,193.23.244.244,192.168.56.101,TCP,443  >  49334 [ACK] Seq=215089 Ack=6271 Win=65535 Len=1460 [TCP segment of a reassembled PDU]
455,193.23.244.244,192.168.56.101,TLSv1.2,Application Data [TCP segment of a reassembled PDU]
456,193.23.244.244,192.168.56.101,TCP,"443  >  49334 [PSH, ACK] Seq=218009 Ack=6271 Win=65535 Len=1460 [TCP segment of a reassembled PDU]"
457,192.168.56.101,193.23.244.244,TCP,49334  >  443 [ACK] Seq=6271 Ack=219469 Win=10220 Len=0
458,193.23.244.244,192.168.56.101,TCP,443  >  49334 [ACK] Seq=219469 Ack=6271 Win=65535 Len=1460 [TCP segment of a reassembled PDU]
459,193.23.244.244,192.168.56.101,TLSv1.2,"Application Data, Application Data"
460,193.23.244.244,192.168.56.101,TCP,443  >  49334 [ACK] Seq=222389 Ack=6271 Win=65535 Len=1460 [TCP segment of a reassembled PDU]
461,193.23.244.244,192.168.56.101,TCP,443  >  49334 [ACK] Seq=223849 Ack=6271 Win=65535 Len=1460 [TCP segment of a reassembled PDU]
462,193.23.244.244,192.168.56.101,TLSv1.2,Application Data [TCP segment of a reassembled PDU]
463,193.23.244.244,192.168.56.101,TCP,"443  >  49334 [PSH, ACK] Seq=226769 Ack=6271 Win=65535 Len=1460 [TCP segment of a reassembled PDU]"
464,192.168.56.101,193.23.244.244,TCP,49334  >  443 [ACK] Seq=6271 Ack=228229 Win=1460 Len=0
465,193.23.244.244,192.168.56.101,TLSv1.2,"[TCP Window Full] , Application Data [TCP segment of a reassembled PDU]"
466,192.168.56.101,193.23.244.244,TCP,49334  >  443 [ACK] Seq=6271 Ack=229689 Win=3472 Len=0
467,193.23.244.244,192.168.56.101,TCP,443  >  49334 [ACK] Seq=229689 Ack=6271 Win=65535 Len=1460 [TCP segment of a reassembled PDU]
468,193.23.244.244,192.168.56.101,TCP,443  >  49334 [ACK] Seq=231149 Ack=6271 Win=65535 Len=1460 [TCP segment of a reassembled PDU]
469,192.168.56.101,193.23.244.244,TCP,49334  >  443 [ACK] Seq=6271 Ack=232609 Win=552 Len=0
470,192.168.56.101,193.23.244.244,TCP,[TCP Window Update] 49334  >  443 [ACK] Seq=6271 Ack=232609 Win=61320 Len=0
471,193.23.244.244,192.168.56.101,TLSv1.2,Application Data [TCP segment of a reassembled PDU]
472,193.23.244.244,192.168.56.101,TCP,443  >  49334 [ACK] Seq=234069 Ack=6271 Win=65535 Len=1460 [TCP segment of a reassembled PDU]
473,193.23.244.244,192.168.56.101,TCP,443  >  49334 [ACK] Seq=235529 Ack=6271 Win=65535 Len=1460 [TCP segment of a reassembled PDU]
474,193.23.244.244,192.168.56.101,TLSv1.2,Application Data [TCP segment of a reassembled PDU]
475,193.23.244.244,192.168.56.101,TCP,443  >  49334 [ACK] Seq=238449 Ack=6271 Win=65535 Len=1460 [TCP segment of a reassembled PDU]
476,193.23.244.244,192.168.56.101,TCP,443  >  49334 [ACK] Seq=239909 Ack=6271 Win=65535 Len=1460 [TCP segment of a reassembled PDU]
477,193.23.244.244,192.168.56.101,TLSv1.2,Application Data [TCP segment of a reassembled PDU]
478,193.23.244.244,192.168.56.101,TCP,443  >  49334 [ACK] Seq=242829 Ack=6271 Win=65535 Len=1460 [TCP segment of a reassembled PDU]
479,193.23.244.244,192.168.56.101,TCP,443  >  49334 [ACK] Seq=244289 Ack=6271 Win=65535 Len=1460 [TCP segment of a reassembled PDU]
480,193.23.244.244,192.168.56.101,TLSv1.2,"Application Data, Application Data"
481,193.23.244.244,192.168.56.101,TCP,443  >  49334 [ACK] Seq=247209 Ack=6271 Win=65535 Len=1460 [TCP segment of a reassembled PDU]
482,193.23.244.244,192.168.56.101,TLSv1.2,Application Data [TCP segment of a reassembled PDU]
483,193.23.244.244,192.168.56.101,TCP,443  >  49334 [ACK] Seq=250129 Ack=6271 Win=65535 Len=1460 [TCP segment of a reassembled PDU]
484,193.23.244.244,192.168.56.101,TCP,443  >  49334 [ACK] Seq=251589 Ack=6271 Win=65535 Len=1460 [TCP segment of a reassembled PDU]
485,193.23.244.244,192.168.56.101,TLSv1.2,Application Data [TCP segment of a reassembled PDU]
486,193.23.244.244,192.168.56.101,TCP,443  >  49334 [ACK] Seq=254509 Ack=6271 Win=65535 Len=1460 [TCP segment of a reassembled PDU]
487,193.23.244.244,192.168.56.101,TCP,443  >  49334 [ACK] Seq=255969 Ack=6271 Win=65535 Len=1460 [TCP segment of a reassembled PDU]
488,193.23.244.244,192.168.56.101,TLSv1.2,Application Data [TCP segment of a reassembled PDU]
489,193.23.244.244,192.168.56.101,TCP,443  >  49334 [ACK] Seq=258889 Ack=6271 Win=65535 Len=1460 [TCP segment of a reassembled PDU]
490,193.23.244.244,192.168.56.101,TCP,443  >  49334 [ACK] Seq=260349 Ack=6271 Win=65535 Len=1460 [TCP segment of a reassembled PDU]
491,193.23.244.244,192.168.56.101,TLSv1.2,"Application Data, Application Data, Application Data"
492,193.23.244.244,192.168.56.101,TCP,443  >  49334 [ACK] Seq=263269 Ack=6271 Win=65535 Len=1460 [TCP segment of a reassembled PDU]
493,193.23.244.244,192.168.56.101,TCP,443  >  49334 [ACK] Seq=264729 Ack=6271 Win=65535 Len=1460 [TCP segment of a reassembled PDU]
494,193.23.244.244,192.168.56.101,TLSv1.2,Application Data [TCP segment of a reassembled PDU]
495,193.23.244.244,192.168.56.101,TCP,443  >  49334 [ACK] Seq=267649 Ack=6271 Win=65535 Len=1460 [TCP segment of a reassembled PDU]
496,193.23.244.244,192.168.56.101,TCP,443  >  49334 [ACK] Seq=269109 Ack=6271 Win=65535 Len=1460 [TCP segment of a reassembled PDU]
497,193.23.244.244,192.168.56.101,TLSv1.2,Application Data [TCP segment of a reassembled PDU]
498,193.23.244.244,192.168.56.101,TCP,443  >  49334 [ACK] Seq=272029 Ack=6271 Win=65535 Len=1460 [TCP segment of a reassembled PDU]
499,193.23.244.244,192.168.56.101,TCP,443  >  49334 [ACK] Seq=273489 Ack=6271 Win=65535 Len=1460 [TCP segment of a reassembled PDU]
500,193.23.244.244,192.168.56.101,TLSv1.2,Application Data [TCP segment of a reassembled PDU]
501,193.23.244.244,192.168.56.101,TCP,443  >  49334 [ACK] Seq=276409 Ack=6271 Win=65535 Len=1460 [TCP segment of a reassembled PDU]
502,193.23.244.244,192.168.56.101,TLSv1.2,Application Data [TCP segment of a reassembled PDU]
503,193.23.244.244,192.168.56.101,TLSv1.2,Application Data [TCP segment of a reassembled PDU]
504,193.23.244.244,192.168.56.101,TCP,443  >  49334 [ACK] Seq=280789 Ack=6271 Win=65535 Len=1460 [TCP segment of a reassembled PDU]
505,193.23.244.244,192.168.56.101,TLSv1.2,Application Data [TCP segment of a reassembled PDU]
506,193.23.244.244,192.168.56.101,TCP,443  >  49334 [ACK] Seq=283709 Ack=6271 Win=65535 Len=1460 [TCP segment of a reassembled PDU]
507,193.23.244.244,192.168.56.101,TCP,443  >  49334 [ACK] Seq=285169 Ack=6271 Win=65535 Len=1460 [TCP segment of a reassembled PDU]
508,193.23.244.244,192.168.56.101,TLSv1.2,Application Data [TCP segment of a reassembled PDU]
509,193.23.244.244,192.168.56.101,TCP,443  >  49334 [ACK] Seq=288089 Ack=6271 Win=65535 Len=1460 [TCP segment of a reassembled PDU]
510,193.23.244.244,192.168.56.101,TCP,443  >  49334 [ACK] Seq=289549 Ack=6271 Win=65535 Len=1460 [TCP segment of a reassembled PDU]
511,193.23.244.244,192.168.56.101,TLSv1.2,Application Data [TCP segment of a reassembled PDU]
512,193.23.244.244,192.168.56.101,TCP,[TCP Window Full] 443  >  49334 [ACK] Seq=292469 Ack=6271 Win=65535 Len=1460 [TCP segment of a reassembled PDU]
513,192.168.56.101,193.23.244.244,TCP,49334  >  443 [ACK] Seq=6271 Ack=279329 Win=14600 Len=0
514,192.168.56.101,193.23.244.244,TCP,49334  >  443 [ACK] Seq=6271 Ack=289549 Win=4380 Len=0
515,192.168.56.101,193.23.244.244,TCP,[TCP ZeroWindow] 49334  >  443 [ACK] Seq=6271 Ack=293929 Win=0 Len=0
516,192.168.56.101,193.23.244.244,TLSv1.2,"[TCP ZeroWindow] , Application Data"
517,193.23.244.244,192.168.56.101,TCP,443  >  49334 [ACK] Seq=293929 Ack=7328 Win=65535 Len=0
518,192.168.56.101,193.23.244.244,TLSv1.2,"[TCP ZeroWindow] , Application Data"
519,193.23.244.244,192.168.56.101,TCP,443  >  49334 [ACK] Seq=293929 Ack=7871 Win=65535 Len=0
520,192.168.56.101,193.23.244.244,TLSv1.2,"[TCP ZeroWindow] , Application Data"
521,193.23.244.244,192.168.56.101,TCP,443  >  49334 [ACK] Seq=293929 Ack=8928 Win=65535 Len=0
522,192.168.56.101,193.23.244.244,TCP,[TCP Window Update] 49334  >  443 [ACK] Seq=8928 Ack=293929 Win=3472 Len=0
523,193.23.244.244,192.168.56.101,TCP,443  >  49334 [ACK] Seq=293929 Ack=8928 Win=65535 Len=1460 [TCP segment of a reassembled PDU]
524,193.23.244.244,192.168.56.101,TLSv1.2,"Application Data, Application Data"
525,192.168.56.101,193.23.244.244,TCP,49334  >  443 [ACK] Seq=8928 Ack=296849 Win=552 Len=0
526,192.168.56.101,193.23.244.244,TCP,[TCP Window Update] 49334  >  443 [ACK] Seq=8928 Ack=296849 Win=61320 Len=0
527,193.23.244.244,192.168.56.101,TCP,443  >  49334 [ACK] Seq=296849 Ack=8928 Win=65535 Len=1460 [TCP segment of a reassembled PDU]
528,193.23.244.244,192.168.56.101,TCP,443  >  49334 [ACK] Seq=298309 Ack=8928 Win=65535 Len=1460 [TCP segment of a reassembled PDU]
529,193.23.244.244,192.168.56.101,TLSv1.2,Application Data [TCP segment of a reassembled PDU]
530,193.23.244.244,192.168.56.101,TCP,443  >  49334 [ACK] Seq=301229 Ack=8928 Win=65535 Len=1460 [TCP segment of a reassembled PDU]
531,193.23.244.244,192.168.56.101,TCP,443  >  49334 [ACK] Seq=302689 Ack=8928 Win=65535 Len=1460 [TCP segment of a reassembled PDU]
532,193.23.244.244,192.168.56.101,TLSv1.2,Application Data [TCP segment of a reassembled PDU]
533,193.23.244.244,192.168.56.101,TCP,443  >  49334 [ACK] Seq=305609 Ack=8928 Win=65535 Len=1460 [TCP segment of a reassembled PDU]
534,193.23.244.244,192.168.56.101,TLSv1.2,Application Data [TCP segment of a reassembled PDU]
535,193.23.244.244,192.168.56.101,TCP,443  >  49334 [ACK] Seq=308529 Ack=8928 Win=65535 Len=1460 [TCP segment of a reassembled PDU]
536,193.23.244.244,192.168.56.101,TCP,443  >  49334 [ACK] Seq=309989 Ack=8928 Win=65535 Len=1460 [TCP segment of a reassembled PDU]
537,193.23.244.244,192.168.56.101,TLSv1.2,Application Data [TCP segment of a reassembled PDU]
538,193.23.244.244,192.168.56.101,TCP,443  >  49334 [ACK] Seq=312909 Ack=8928 Win=65535 Len=1460 [TCP segment of a reassembled PDU]
539,193.23.244.244,192.168.56.101,TCP,443  >  49334 [ACK] Seq=314369 Ack=8928 Win=65535 Len=1460 [TCP segment of a reassembled PDU]
540,193.23.244.244,192.168.56.101,TLSv1.2,Application Data [TCP segment of a reassembled PDU]
541,193.23.244.244,192.168.56.101,TCP,443  >  49334 [ACK] Seq=317289 Ack=8928 Win=65535 Len=1460 [TCP segment of a reassembled PDU]
542,193.23.244.244,192.168.56.101,TCP,443  >  49334 [ACK] Seq=318749 Ack=8928 Win=65535 Len=1460 [TCP segment of a reassembled PDU]
543,193.23.244.244,192.168.56.101,TLSv1.2,Application Data [TCP segment of a reassembled PDU]
544,193.23.244.244,192.168.56.101,TCP,443  >  49334 [ACK] Seq=321669 Ack=8928 Win=65535 Len=1460 [TCP segment of a reassembled PDU]
545,193.23.244.244,192.168.56.101,TCP,443  >  49334 [ACK] Seq=323129 Ack=8928 Win=65535 Len=1460 [TCP segment of a reassembled PDU]
546,193.23.244.244,192.168.56.101,TLSv1.2,Application Data [TCP segment of a reassembled PDU]
547,193.23.244.244,192.168.56.101,TCP,443  >  49334 [ACK] Seq=326049 Ack=8928 Win=65535 Len=1460 [TCP segment of a reassembled PDU]
548,193.23.244.244,192.168.56.101,TLSv1.2,Application Data [TCP segment of a reassembled PDU]
549,193.23.244.244,192.168.56.101,TLSv1.2,Application Data [TCP segment of a reassembled PDU]
550,193.23.244.244,192.168.56.101,TCP,443  >  49334 [ACK] Seq=330429 Ack=8928 Win=65535 Len=1460 [TCP segment of a reassembled PDU]
551,193.23.244.244,192.168.56.101,TLSv1.2,Application Data [TCP segment of a reassembled PDU]
552,193.23.244.244,192.168.56.101,TCP,443  >  49334 [ACK] Seq=333349 Ack=8928 Win=65535 Len=1460 [TCP segment of a reassembled PDU]
553,193.23.244.244,192.168.56.101,TCP,443  >  49334 [ACK] Seq=334809 Ack=8928 Win=65535 Len=1460 [TCP segment of a reassembled PDU]
554,193.23.244.244,192.168.56.101,TLSv1.2,Application Data [TCP segment of a reassembled PDU]
555,193.23.244.244,192.168.56.101,TCP,443  >  49334 [ACK] Seq=337729 Ack=8928 Win=65535 Len=1460 [TCP segment of a reassembled PDU]
556,193.23.244.244,192.168.56.101,TCP,443  >  49334 [ACK] Seq=339189 Ack=8928 Win=65535 Len=1460 [TCP segment of a reassembled PDU]
557,193.23.244.244,192.168.56.101,TLSv1.2,Application Data [TCP segment of a reassembled PDU]
558,193.23.244.244,192.168.56.101,TCP,443  >  49334 [ACK] Seq=342109 Ack=8928 Win=65535 Len=1460 [TCP segment of a reassembled PDU]
559,193.23.244.244,192.168.56.101,TCP,443  >  49334 [ACK] Seq=343569 Ack=8928 Win=65535 Len=1460 [TCP segment of a reassembled PDU]
560,193.23.244.244,192.168.56.101,TLSv1.2,Application Data [TCP segment of a reassembled PDU]
561,193.23.244.244,192.168.56.101,TCP,443  >  49334 [ACK] Seq=346489 Ack=8928 Win=65535 Len=1460 [TCP segment of a reassembled PDU]
562,193.23.244.244,192.168.56.101,TLSv1.2,Application Data [TCP segment of a reassembled PDU]
563,193.23.244.244,192.168.56.101,TCP,443  >  49334 [ACK] Seq=349409 Ack=8928 Win=65535 Len=1460 [TCP segment of a reassembled PDU]
564,193.23.244.244,192.168.56.101,TCP,443  >  49334 [ACK] Seq=350869 Ack=8928 Win=65535 Len=1460 [TCP segment of a reassembled PDU]
565,193.23.244.244,192.168.56.101,TLSv1.2,"Application Data, Application Data"
566,193.23.244.244,192.168.56.101,TCP,443  >  49334 [ACK] Seq=353789 Ack=8928 Win=65535 Len=1460 [TCP segment of a reassembled PDU]
567,193.23.244.244,192.168.56.101,TCP,443  >  49334 [ACK] Seq=355249 Ack=8928 Win=65535 Len=1460 [TCP segment of a reassembled PDU]
568,193.23.244.244,192.168.56.101,TLSv1.2,"[TCP Window Full] , Application Data [TCP segment of a reassembled PDU]"
569,192.168.56.101,193.23.244.244,TCP,49334  >  443 [ACK] Seq=8928 Ack=328969 Win=29200 Len=0
570,192.168.56.101,193.23.244.244,TCP,[TCP ZeroWindow] 49334  >  443 [ACK] Seq=8928 Ack=358169 Win=0 Len=0
571,192.168.56.101,193.23.244.244,TLSv1.2,"[TCP ZeroWindow] , Application Data"
572,193.23.244.244,192.168.56.101,TCP,443  >  49334 [ACK] Seq=358169 Ack=9471 Win=65535 Len=0
573,192.168.56.101,193.23.244.244,TLSv1.2,"[TCP ZeroWindow] , Application Data"
574,193.23.244.244,192.168.56.101,TCP,443  >  49334 [ACK] Seq=358169 Ack=10528 Win=65535 Len=0
575,192.168.56.101,193.23.244.244,TCP,[TCP Window Update] 49334  >  443 [ACK] Seq=10528 Ack=358169 Win=3472 Len=0
576,193.23.244.244,192.168.56.101,TCP,443  >  49334 [ACK] Seq=358169 Ack=10528 Win=65535 Len=1460 [TCP segment of a reassembled PDU]
577,193.23.244.244,192.168.56.101,TCP,443  >  49334 [ACK] Seq=359629 Ack=10528 Win=65535 Len=1460 [TCP segment of a reassembled PDU]
578,192.168.56.101,193.23.244.244,TCP,49334  >  443 [ACK] Seq=10528 Ack=361089 Win=552 Len=0
579,192.168.56.101,193.23.244.244,TCP,[TCP Window Update] 49334  >  443 [ACK] Seq=10528 Ack=361089 Win=61320 Len=0
580,193.23.244.244,192.168.56.101,TLSv1.2,Application Data [TCP segment of a reassembled PDU]
581,193.23.244.244,192.168.56.101,TCP,443  >  49334 [ACK] Seq=362549 Ack=10528 Win=65535 Len=1460 [TCP segment of a reassembled PDU]
582,193.23.244.244,192.168.56.101,TCP,443  >  49334 [ACK] Seq=364009 Ack=10528 Win=65535 Len=1460 [TCP segment of a reassembled PDU]
583,193.23.244.244,192.168.56.101,TLSv1.2,Application Data [TCP segment of a reassembled PDU]
584,193.23.244.244,192.168.56.101,TCP,443  >  49334 [ACK] Seq=366929 Ack=10528 Win=65535 Len=1460 [TCP segment of a reassembled PDU]
585,193.23.244.244,192.168.56.101,TLSv1.2,Application Data [TCP segment of a reassembled PDU]
586,193.23.244.244,192.168.56.101,TCP,443  >  49334 [ACK] Seq=369849 Ack=10528 Win=65535 Len=1460 [TCP segment of a reassembled PDU]
587,193.23.244.244,192.168.56.101,TCP,443  >  49334 [ACK] Seq=371309 Ack=10528 Win=65535 Len=1460 [TCP segment of a reassembled PDU]
588,193.23.244.244,192.168.56.101,TLSv1.2,Application Data [TCP segment of a reassembled PDU]
589,193.23.244.244,192.168.56.101,TCP,443  >  49334 [ACK] Seq=374229 Ack=10528 Win=65535 Len=1460 [TCP segment of a reassembled PDU]
590,193.23.244.244,192.168.56.101,TCP,443  >  49334 [ACK] Seq=375689 Ack=10528 Win=65535 Len=1460 [TCP segment of a reassembled PDU]
591,193.23.244.244,192.168.56.101,TLSv1.2,"Application Data, Application Data"
592,193.23.244.244,192.168.56.101,TCP,443  >  49334 [ACK] Seq=378609 Ack=10528 Win=65535 Len=1460 [TCP segment of a reassembled PDU]
593,193.23.244.244,192.168.56.101,TCP,443  >  49334 [ACK] Seq=380069 Ack=10528 Win=65535 Len=1460 [TCP segment of a reassembled PDU]
594,193.23.244.244,192.168.56.101,TLSv1.2,Application Data [TCP segment of a reassembled PDU]
595,193.23.244.244,192.168.56.101,TCP,443  >  49334 [ACK] Seq=382989 Ack=10528 Win=65535 Len=1460 [TCP segment of a reassembled PDU]
596,193.23.244.244,192.168.56.101,TCP,443  >  49334 [ACK] Seq=384449 Ack=10528 Win=65535 Len=1460 [TCP segment of a reassembled PDU]
597,193.23.244.244,192.168.56.101,TLSv1.2,Application Data [TCP segment of a reassembled PDU]
598,193.23.244.244,192.168.56.101,TCP,443  >  49334 [ACK] Seq=387369 Ack=10528 Win=65535 Len=1460 [TCP segment of a reassembled PDU]
599,193.23.244.244,192.168.56.101,TLSv1.2,Application Data [TCP segment of a reassembled PDU]
600,193.23.244.244,192.168.56.101,TCP,443  >  49334 [ACK] Seq=390289 Ack=10528 Win=65535 Len=1460 [TCP segment of a reassembled PDU]
601,193.23.244.244,192.168.56.101,TLSv1.2,Application Data [TCP segment of a reassembled PDU]
602,193.23.244.244,192.168.56.101,TCP,443  >  49334 [ACK] Seq=393209 Ack=10528 Win=65535 Len=1460 [TCP segment of a reassembled PDU]
603,193.23.244.244,192.168.56.101,TCP,443  >  49334 [ACK] Seq=394669 Ack=10528 Win=65535 Len=1460 [TCP segment of a reassembled PDU]
604,193.23.244.244,192.168.56.101,TLSv1.2,Application Data [TCP segment of a reassembled PDU]
605,193.23.244.244,192.168.56.101,TCP,443  >  49334 [ACK] Seq=397589 Ack=10528 Win=65535 Len=1460 [TCP segment of a reassembled PDU]
606,193.23.244.244,192.168.56.101,TCP,443  >  49334 [ACK] Seq=399049 Ack=10528 Win=65535 Len=1460 [TCP segment of a reassembled PDU]
607,193.23.244.244,192.168.56.101,TLSv1.2,Application Data [TCP segment of a reassembled PDU]
608,193.23.244.244,192.168.56.101,TCP,443  >  49334 [ACK] Seq=401969 Ack=10528 Win=65535 Len=1460 [TCP segment of a reassembled PDU]
609,193.23.244.244,192.168.56.101,TCP,443  >  49334 [ACK] Seq=403429 Ack=10528 Win=65535 Len=1460 [TCP segment of a reassembled PDU]
610,193.23.244.244,192.168.56.101,TLSv1.2,Application Data [TCP segment of a reassembled PDU]
611,193.23.244.244,192.168.56.101,TCP,443  >  49334 [ACK] Seq=406349 Ack=10528 Win=65535 Len=1460 [TCP segment of a reassembled PDU]
612,193.23.244.244,192.168.56.101,TCP,443  >  49334 [ACK] Seq=407809 Ack=10528 Win=65535 Len=1460 [TCP segment of a reassembled PDU]
613,193.23.244.244,192.168.56.101,TLSv1.2,"Application Data, Application Data"
614,193.23.244.244,192.168.56.101,TCP,443  >  49334 [ACK] Seq=410729 Ack=10528 Win=65535 Len=1460 [TCP segment of a reassembled PDU]
615,193.23.244.244,192.168.56.101,TLSv1.2,Application Data [TCP segment of a reassembled PDU]
616,193.23.244.244,192.168.56.101,TCP,443  >  49334 [ACK] Seq=413649 Ack=10528 Win=65535 Len=1460 [TCP segment of a reassembled PDU]
617,193.23.244.244,192.168.56.101,TCP,443  >  49334 [ACK] Seq=415109 Ack=10528 Win=65535 Len=1460 [TCP segment of a reassembled PDU]
618,193.23.244.244,192.168.56.101,TLSv1.2,Application Data [TCP segment of a reassembled PDU]
619,193.23.244.244,192.168.56.101,TLSv1.2,Application Data [TCP segment of a reassembled PDU]
620,193.23.244.244,192.168.56.101,TCP,443  >  49334 [ACK] Seq=419489 Ack=10528 Win=65535 Len=1460 [TCP segment of a reassembled PDU]
621,193.23.244.244,192.168.56.101,TCP,[TCP Window Full] 443  >  49334 [ACK] Seq=420949 Ack=10528 Win=65535 Len=1460 [TCP segment of a reassembled PDU]
622,192.168.56.101,193.23.244.244,TCP,49334  >  443 [ACK] Seq=10528 Ack=407809 Win=14600 Len=0
623,192.168.56.101,193.23.244.244,TCP,[TCP ZeroWindow] 49334  >  443 [ACK] Seq=10528 Ack=422409 Win=0 Len=0
624,192.168.56.101,193.23.244.244,TLSv1.2,"[TCP ZeroWindow] , Application Data"
625,193.23.244.244,192.168.56.101,TCP,443  >  49334 [ACK] Seq=422409 Ack=11071 Win=65535 Len=0
626,192.168.56.101,193.23.244.244,TLSv1.2,"[TCP ZeroWindow] , Application Data"
627,193.23.244.244,192.168.56.101,TCP,443  >  49334 [ACK] Seq=422409 Ack=12128 Win=65535 Len=0
628,192.168.56.101,193.23.244.244,TLSv1.2,"[TCP ZeroWindow] , Application Data"
629,193.23.244.244,192.168.56.101,TCP,443  >  49334 [ACK] Seq=422409 Ack=12671 Win=65535 Len=0
630,192.168.56.101,193.23.244.244,TCP,[TCP Window Update] 49334  >  443 [ACK] Seq=12671 Ack=422409 Win=3472 Len=0
631,193.23.244.244,192.168.56.101,TLSv1.2,Application Data [TCP segment of a reassembled PDU]
632,193.23.244.244,192.168.56.101,TCP,443  >  49334 [ACK] Seq=423869 Ack=12671 Win=65535 Len=1460 [TCP segment of a reassembled PDU]
633,192.168.56.101,193.23.244.244,TCP,49334  >  443 [ACK] Seq=12671 Ack=425329 Win=552 Len=0
634,192.168.56.101,193.23.244.244,TCP,[TCP Window Update] 49334  >  443 [ACK] Seq=12671 Ack=425329 Win=61320 Len=0
635,193.23.244.244,192.168.56.101,TCP,443  >  49334 [ACK] Seq=425329 Ack=12671 Win=65535 Len=1460 [TCP segment of a reassembled PDU]
636,193.23.244.244,192.168.56.101,TLSv1.2,Application Data [TCP segment of a reassembled PDU]
637,193.23.244.244,192.168.56.101,TCP,443  >  49334 [ACK] Seq=428249 Ack=12671 Win=65535 Len=1460 [TCP segment of a reassembled PDU]
638,193.23.244.244,192.168.56.101,TCP,443  >  49334 [ACK] Seq=429709 Ack=12671 Win=65535 Len=1460 [TCP segment of a reassembled PDU]
639,193.23.244.244,192.168.56.101,TLSv1.2,Application Data [TCP segment of a reassembled PDU]
640,193.23.244.244,192.168.56.101,TCP,443  >  49334 [ACK] Seq=432629 Ack=12671 Win=65535 Len=1460 [TCP segment of a reassembled PDU]
641,193.23.244.244,192.168.56.101,TLSv1.2,Application Data [TCP segment of a reassembled PDU]
642,193.23.244.244,192.168.56.101,TLSv1.2,Application Data [TCP segment of a reassembled PDU]
643,193.23.244.244,192.168.56.101,TCP,443  >  49334 [ACK] Seq=437009 Ack=12671 Win=65535 Len=1460 [TCP segment of a reassembled PDU]
644,193.23.244.244,192.168.56.101,TLSv1.2,Application Data [TCP segment of a reassembled PDU]
645,193.23.244.244,192.168.56.101,TCP,443  >  49334 [ACK] Seq=439929 Ack=12671 Win=65535 Len=1460 [TCP segment of a reassembled PDU]
646,193.23.244.244,192.168.56.101,TCP,443  >  49334 [ACK] Seq=441389 Ack=12671 Win=65535 Len=1460 [TCP segment of a reassembled PDU]
647,193.23.244.244,192.168.56.101,TLSv1.2,Application Data [TCP segment of a reassembled PDU]
648,193.23.244.244,192.168.56.101,TLSv1.2,Application Data [TCP segment of a reassembled PDU]
649,193.23.244.244,192.168.56.101,TCP,443  >  49334 [ACK] Seq=445769 Ack=12671 Win=65535 Len=1460 [TCP segment of a reassembled PDU]
650,193.23.244.244,192.168.56.101,TCP,443  >  49334 [ACK] Seq=447229 Ack=12671 Win=65535 Len=1460 [TCP segment of a reassembled PDU]
651,193.23.244.244,192.168.56.101,TLSv1.2,Application Data [TCP segment of a reassembled PDU]
652,193.23.244.244,192.168.56.101,TCP,443  >  49334 [ACK] Seq=450149 Ack=12671 Win=65535 Len=1460 [TCP segment of a reassembled PDU]
653,193.23.244.244,192.168.56.101,TCP,443  >  49334 [ACK] Seq=451609 Ack=12671 Win=65535 Len=1460 [TCP segment of a reassembled PDU]
654,193.23.244.244,192.168.56.101,TLSv1.2,Application Data [TCP segment of a reassembled PDU]
655,193.23.244.244,192.168.56.101,TCP,443  >  49334 [ACK] Seq=454529 Ack=12671 Win=65535 Len=1460 [TCP segment of a reassembled PDU]
656,193.23.244.244,192.168.56.101,TLSv1.2,Application Data [TCP segment of a reassembled PDU]
657,193.23.244.244,192.168.56.101,TCP,443  >  49334 [ACK] Seq=457449 Ack=12671 Win=65535 Len=1460 [TCP segment of a reassembled PDU]
658,193.23.244.244,192.168.56.101,TCP,443  >  49334 [ACK] Seq=458909 Ack=12671 Win=65535 Len=1460 [TCP segment of a reassembled PDU]
659,193.23.244.244,192.168.56.101,TLSv1.2,"Application Data, Application Data"
660,193.23.244.244,192.168.56.101,TCP,443  >  49334 [ACK] Seq=461829 Ack=12671 Win=65535 Len=1460 [TCP segment of a reassembled PDU]
661,193.23.244.244,192.168.56.101,TCP,443  >  49334 [ACK] Seq=463289 Ack=12671 Win=65535 Len=1460 [TCP segment of a reassembled PDU]
662,193.23.244.244,192.168.56.101,TLSv1.2,Application Data [TCP segment of a reassembled PDU]
663,193.23.244.244,192.168.56.101,TCP,443  >  49334 [ACK] Seq=466209 Ack=12671 Win=65535 Len=1460 [TCP segment of a reassembled PDU]
664,193.23.244.244,192.168.56.101,TCP,443  >  49334 [ACK] Seq=467669 Ack=12671 Win=65535 Len=1460 [TCP segment of a reassembled PDU]
665,193.23.244.244,192.168.56.101,TLSv1.2,Application Data [TCP segment of a reassembled PDU]
666,193.23.244.244,192.168.56.101,TLSv1.2,Application Data [TCP segment of a reassembled PDU]
667,193.23.244.244,192.168.56.101,TCP,443  >  49334 [ACK] Seq=472049 Ack=12671 Win=65535 Len=1460 [TCP segment of a reassembled PDU]
668,193.23.244.244,192.168.56.101,TCP,443  >  49334 [ACK] Seq=473509 Ack=12671 Win=65535 Len=1460 [TCP segment of a reassembled PDU]
669,193.23.244.244,192.168.56.101,TLSv1.2,Application Data [TCP segment of a reassembled PDU]
670,193.23.244.244,192.168.56.101,TCP,443  >  49334 [ACK] Seq=476429 Ack=12671 Win=65535 Len=1460 [TCP segment of a reassembled PDU]
671,193.23.244.244,192.168.56.101,TLSv1.2,Application Data [TCP segment of a reassembled PDU]
672,193.23.244.244,192.168.56.101,TCP,443  >  49334 [ACK] Seq=479349 Ack=12671 Win=65535 Len=1460 [TCP segment of a reassembled PDU]
673,193.23.244.244,192.168.56.101,TCP,443  >  49334 [ACK] Seq=480809 Ack=12671 Win=65535 Len=1460 [TCP segment of a reassembled PDU]
674,193.23.244.244,192.168.56.101,TLSv1.2,Application Data [TCP segment of a reassembled PDU]
675,193.23.244.244,192.168.56.101,TCP,443  >  49334 [ACK] Seq=483729 Ack=12671 Win=65535 Len=1460 [TCP segment of a reassembled PDU]
676,193.23.244.244,192.168.56.101,TCP,[TCP Window Full] 443  >  49334 [ACK] Seq=485189 Ack=12671 Win=65535 Len=1460 [TCP segment of a reassembled PDU]
677,192.168.56.101,193.23.244.244,TCP,49334  >  443 [ACK] Seq=12671 Ack=472049 Win=14600 Len=0
678,192.168.56.101,193.23.244.244,TCP,49334  >  443 [ACK] Seq=12671 Ack=477889 Win=8760 Len=0
679,192.168.56.101,193.23.244.244,TCP,[TCP ZeroWindow] 49334  >  443 [ACK] Seq=12671 Ack=486649 Win=0 Len=0
680,192.168.56.101,193.23.244.244,TLSv1.2,"[TCP ZeroWindow] , Application Data"
681,193.23.244.244,192.168.56.101,TCP,443  >  49334 [ACK] Seq=486649 Ack=13728 Win=65535 Len=0
682,192.168.56.101,193.23.244.244,TLSv1.2,"[TCP ZeroWindow] , Application Data"
683,193.23.244.244,192.168.56.101,TCP,443  >  49334 [ACK] Seq=486649 Ack=14271 Win=65535 Len=0
684,192.168.56.101,193.23.244.244,TCP,[TCP Window Update] 49334  >  443 [ACK] Seq=14271 Ack=486649 Win=3472 Len=0
685,193.23.244.244,192.168.56.101,TLSv1.2,"Application Data, Application Data"
686,193.23.244.244,192.168.56.101,TCP,443  >  49334 [ACK] Seq=488109 Ack=14271 Win=65535 Len=1460 [TCP segment of a reassembled PDU]
687,192.168.56.101,193.23.244.244,TCP,49334  >  443 [ACK] Seq=14271 Ack=489569 Win=552 Len=0
688,192.168.56.101,193.23.244.244,TCP,[TCP Window Update] 49334  >  443 [ACK] Seq=14271 Ack=489569 Win=61320 Len=0
689,193.23.244.244,192.168.56.101,TCP,443  >  49334 [ACK] Seq=489569 Ack=14271 Win=65535 Len=1460 [TCP segment of a reassembled PDU]
690,193.23.244.244,192.168.56.101,TLSv1.2,Application Data [TCP segment of a reassembled PDU]
691,193.23.244.244,192.168.56.101,TCP,443  >  49334 [ACK] Seq=492489 Ack=14271 Win=65535 Len=1460 [TCP segment of a reassembled PDU]
692,193.23.244.244,192.168.56.101,TLSv1.2,Application Data [TCP segment of a reassembled PDU]
693,193.23.244.244,192.168.56.101,TLSv1.2,Application Data [TCP segment of a reassembled PDU]
694,193.23.244.244,192.168.56.101,TCP,443  >  49334 [ACK] Seq=496869 Ack=14271 Win=65535 Len=1460 [TCP segment of a reassembled PDU]
695,193.23.244.244,192.168.56.101,TCP,443  >  49334 [ACK] Seq=498329 Ack=14271 Win=65535 Len=1460 [TCP segment of a reassembled PDU]
696,193.23.244.244,192.168.56.101,TLSv1.2,Application Data [TCP segment of a reassembled PDU]
697,193.23.244.244,192.168.56.101,TCP,443  >  49334 [ACK] Seq=501249 Ack=14271 Win=65535 Len=1460 [TCP segment of a reassembled PDU]
698,193.23.244.244,192.168.56.101,TCP,443  >  49334 [ACK] Seq=502709 Ack=14271 Win=65535 Len=1460 [TCP segment of a reassembled PDU]
699,193.23.244.244,192.168.56.101,TLSv1.2,Application Data [TCP segment of a reassembled PDU]
700,193.23.244.244,192.168.56.101,TCP,443  >  49334 [ACK] Seq=505629 Ack=14271 Win=65535 Len=1460 [TCP segment of a reassembled PDU]
701,193.23.244.244,192.168.56.101,TCP,443  >  49334 [ACK] Seq=507089 Ack=14271 Win=65535 Len=1460 [TCP segment of a reassembled PDU]
702,193.23.244.244,192.168.56.101,TLSv1.2,Application Data [TCP segment of a reassembled PDU]
703,193.23.244.244,192.168.56.101,TCP,443  >  49334 [ACK] Seq=510009 Ack=14271 Win=65535 Len=1460 [TCP segment of a reassembled PDU]
704,193.23.244.244,192.168.56.101,TCP,443  >  49334 [ACK] Seq=511469 Ack=14271 Win=65535 Len=1460 [TCP segment of a reassembled PDU]
705,193.23.244.244,192.168.56.101,TLSv1.2,"Application Data, Application Data"
706,193.23.244.244,192.168.56.101,TCP,443  >  49334 [ACK] Seq=514389 Ack=14271 Win=65535 Len=1460 [TCP segment of a reassembled PDU]
707,193.23.244.244,192.168.56.101,TLSv1.2,Application Data [TCP segment of a reassembled PDU]
708,193.23.244.244,192.168.56.101,TCP,443  >  49334 [ACK] Seq=517309 Ack=14271 Win=65535 Len=1460 [TCP segment of a reassembled PDU]
709,193.23.244.244,192.168.56.101,TCP,443  >  49334 [ACK] Seq=518769 Ack=14271 Win=65535 Len=1460 [TCP segment of a reassembled PDU]
710,193.23.244.244,192.168.56.101,TLSv1.2,Application Data [TCP segment of a reassembled PDU]
711,193.23.244.244,192.168.56.101,TLSv1.2,Application Data [TCP segment of a reassembled PDU]
712,193.23.244.244,192.168.56.101,TCP,443  >  49334 [ACK] Seq=523149 Ack=14271 Win=65535 Len=1460 [TCP segment of a reassembled PDU]
713,193.23.244.244,192.168.56.101,TCP,443  >  49334 [ACK] Seq=524609 Ack=14271 Win=65535 Len=1460 [TCP segment of a reassembled PDU]
714,193.23.244.244,192.168.56.101,TLSv1.2,Application Data [TCP segment of a reassembled PDU]
715,193.23.244.244,192.168.56.101,TCP,443  >  49334 [ACK] Seq=527529 Ack=14271 Win=65535 Len=1460 [TCP segment of a reassembled PDU]
716,193.23.244.244,192.168.56.101,TCP,443  >  49334 [ACK] Seq=528989 Ack=14271 Win=65535 Len=1460 [TCP segment of a reassembled PDU]
717,193.23.244.244,192.168.56.101,TLSv1.2,Application Data [TCP segment of a reassembled PDU]
718,193.23.244.244,192.168.56.101,TCP,443  >  49334 [ACK] Seq=531909 Ack=14271 Win=65535 Len=1460 [TCP segment of a reassembled PDU]
719,193.23.244.244,192.168.56.101,TCP,443  >  49334 [ACK] Seq=533369 Ack=14271 Win=65535 Len=1460 [TCP segment of a reassembled PDU]
720,193.23.244.244,192.168.56.101,TLSv1.2,Application Data [TCP segment of a reassembled PDU]
721,193.23.244.244,192.168.56.101,TCP,443  >  49334 [ACK] Seq=536289 Ack=14271 Win=65535 Len=1460 [TCP segment of a reassembled PDU]
722,193.23.244.244,192.168.56.101,TLSv1.2,Application Data [TCP segment of a reassembled PDU]
723,193.23.244.244,192.168.56.101,TLSv1.2,Application Data [TCP segment of a reassembled PDU]
724,193.23.244.244,192.168.56.101,TCP,443  >  49334 [ACK] Seq=540669 Ack=14271 Win=65535 Len=1460 [TCP segment of a reassembled PDU]
725,193.23.244.244,192.168.56.101,TLSv1.2,Application Data [TCP segment of a reassembled PDU]
726,193.23.244.244,192.168.56.101,TCP,443  >  49334 [ACK] Seq=543589 Ack=14271 Win=65535 Len=1460 [TCP segment of a reassembled PDU]
727,193.23.244.244,192.168.56.101,TCP,443  >  49334 [ACK] Seq=545049 Ack=14271 Win=65535 Len=1460 [TCP segment of a reassembled PDU]
728,193.23.244.244,192.168.56.101,TLSv1.2,Application Data [TCP segment of a reassembled PDU]
729,193.23.244.244,192.168.56.101,TLSv1.2,Application Data [TCP segment of a reassembled PDU]
730,193.23.244.244,192.168.56.101,TCP,[TCP Window Full] 443  >  49334 [ACK] Seq=549429 Ack=14271 Win=65535 Len=1460 [TCP segment of a reassembled PDU]
731,192.168.56.101,193.23.244.244,TCP,49334  >  443 [ACK] Seq=14271 Ack=536289 Win=14600 Len=0
732,192.168.56.101,193.23.244.244,TCP,[TCP ZeroWindow] 49334  >  443 [ACK] Seq=14271 Ack=550889 Win=0 Len=0
733,192.168.56.101,193.23.244.244,TLSv1.2,"[TCP ZeroWindow] , Application Data"
734,193.23.244.244,192.168.56.101,TCP,443  >  49334 [ACK] Seq=550889 Ack=15328 Win=65535 Len=0
735,192.168.56.101,193.23.244.244,TLSv1.2,"[TCP ZeroWindow] , Application Data"
736,193.23.244.244,192.168.56.101,TCP,443  >  49334 [ACK] Seq=550889 Ack=15871 Win=65535 Len=0
737,192.168.56.101,193.23.244.244,TLSv1.2,"[TCP ZeroWindow] , Application Data"
738,193.23.244.244,192.168.56.101,TCP,443  >  49334 [ACK] Seq=550889 Ack=16928 Win=65535 Len=0
739,192.168.56.101,193.23.244.244,TCP,[TCP Window Update] 49334  >  443 [ACK] Seq=16928 Ack=550889 Win=3472 Len=0
740,193.23.244.244,192.168.56.101,TCP,443  >  49334 [ACK] Seq=550889 Ack=16928 Win=65535 Len=1460 [TCP segment of a reassembled PDU]
741,193.23.244.244,192.168.56.101,TLSv1.2,Application Data [TCP segment of a reassembled PDU]
742,192.168.56.101,193.23.244.244,TCP,49334  >  443 [ACK] Seq=16928 Ack=553809 Win=552 Len=0
743,192.168.56.101,193.23.244.244,TCP,[TCP Window Update] 49334  >  443 [ACK] Seq=16928 Ack=553809 Win=61320 Len=0
744,193.23.244.244,192.168.56.101,TCP,443  >  49334 [ACK] Seq=553809 Ack=16928 Win=65535 Len=1460 [TCP segment of a reassembled PDU]
745,193.23.244.244,192.168.56.101,TCP,443  >  49334 [ACK] Seq=555269 Ack=16928 Win=65535 Len=1460 [TCP segment of a reassembled PDU]
746,193.23.244.244,192.168.56.101,TLSv1.2,Application Data [TCP segment of a reassembled PDU]
747,193.23.244.244,192.168.56.101,TCP,443  >  49334 [ACK] Seq=558189 Ack=16928 Win=65535 Len=1460 [TCP segment of a reassembled PDU]
748,193.23.244.244,192.168.56.101,TLSv1.2,Application Data [TCP segment of a reassembled PDU]
749,193.23.244.244,192.168.56.101,TCP,443  >  49334 [ACK] Seq=561109 Ack=16928 Win=65535 Len=1460 [TCP segment of a reassembled PDU]
750,193.23.244.244,192.168.56.101,TCP,443  >  49334 [ACK] Seq=562569 Ack=16928 Win=65535 Len=1460 [TCP segment of a reassembled PDU]
751,193.23.244.244,192.168.56.101,TLSv1.2,"Application Data, Application Data"
752,193.23.244.244,192.168.56.101,TCP,443  >  49334 [ACK] Seq=565489 Ack=16928 Win=65535 Len=1460 [TCP segment of a reassembled PDU]
753,193.23.244.244,192.168.56.101,TCP,443  >  49334 [ACK] Seq=566949 Ack=16928 Win=65535 Len=1460 [TCP segment of a reassembled PDU]
754,193.23.244.244,192.168.56.101,TLSv1.2,Application Data [TCP segment of a reassembled PDU]
755,193.23.244.244,192.168.56.101,TCP,443  >  49334 [ACK] Seq=569869 Ack=16928 Win=65535 Len=1460 [TCP segment of a reassembled PDU]
756,193.23.244.244,192.168.56.101,TCP,443  >  49334 [ACK] Seq=571329 Ack=16928 Win=65535 Len=1460 [TCP segment of a reassembled PDU]
757,193.23.244.244,192.168.56.101,TLSv1.2,Application Data [TCP segment of a reassembled PDU]
758,193.23.244.244,192.168.56.101,TLSv1.2,Application Data [TCP segment of a reassembled PDU]
759,193.23.244.244,192.168.56.101,TCP,443  >  49334 [ACK] Seq=575709 Ack=16928 Win=65535 Len=1460 [TCP segment of a reassembled PDU]
760,193.23.244.244,192.168.56.101,TCP,443  >  49334 [ACK] Seq=577169 Ack=16928 Win=65535 Len=1460 [TCP segment of a reassembled PDU]
761,193.23.244.244,192.168.56.101,TLSv1.2,Application Data [TCP segment of a reassembled PDU]
762,193.23.244.244,192.168.56.101,TCP,443  >  49334 [ACK] Seq=580089 Ack=16928 Win=65535 Len=1460 [TCP segment of a reassembled PDU]
763,193.23.244.244,192.168.56.101,TLSv1.2,Application Data [TCP segment of a reassembled PDU]
764,193.23.244.244,192.168.56.101,TCP,443  >  49334 [ACK] Seq=583009 Ack=16928 Win=65535 Len=1460 [TCP segment of a reassembled PDU]
765,193.23.244.244,192.168.56.101,TCP,443  >  49334 [ACK] Seq=584469 Ack=16928 Win=65535 Len=1460 [TCP segment of a reassembled PDU]
766,193.23.244.244,192.168.56.101,TLSv1.2,Application Data [TCP segment of a reassembled PDU]
767,193.23.244.244,192.168.56.101,TCP,443  >  49334 [ACK] Seq=587389 Ack=16928 Win=65535 Len=1460 [TCP segment of a reassembled PDU]
768,193.23.244.244,192.168.56.101,TCP,443  >  49334 [ACK] Seq=588849 Ack=16928 Win=65535 Len=1460 [TCP segment of a reassembled PDU]
769,193.23.244.244,192.168.56.101,TLSv1.2,"Application Data, Application Data"
770,193.23.244.244,192.168.56.101,TCP,443  >  49334 [ACK] Seq=591769 Ack=16928 Win=65535 Len=1460 [TCP segment of a reassembled PDU]
771,193.23.244.244,192.168.56.101,TCP,443  >  49334 [ACK] Seq=593229 Ack=16928 Win=65535 Len=1460 [TCP segment of a reassembled PDU]
772,193.23.244.244,192.168.56.101,TLSv1.2,Application Data [TCP segment of a reassembled PDU]
773,193.23.244.244,192.168.56.101,TCP,443  >  49334 [ACK] Seq=596149 Ack=16928 Win=65535 Len=1460 [TCP segment of a reassembled PDU]
774,193.23.244.244,192.168.56.101,TCP,443  >  49334 [ACK] Seq=597609 Ack=16928 Win=65535 Len=1460 [TCP segment of a reassembled PDU]
775,193.23.244.244,192.168.56.101,TLSv1.2,Application Data [TCP segment of a reassembled PDU]
776,193.23.244.244,192.168.56.101,TLSv1.2,Application Data [TCP segment of a reassembled PDU]
777,193.23.244.244,192.168.56.101,TCP,443  >  49334 [ACK] Seq=601989 Ack=16928 Win=65535 Len=1460 [TCP segment of a reassembled PDU]
778,193.23.244.244,192.168.56.101,TLSv1.2,Application Data [TCP segment of a reassembled PDU]
779,193.23.244.244,192.168.56.101,TCP,443  >  49334 [ACK] Seq=604909 Ack=16928 Win=65535 Len=1460 [TCP segment of a reassembled PDU]
780,193.23.244.244,192.168.56.101,TCP,443  >  49334 [ACK] Seq=606369 Ack=16928 Win=65535 Len=1460 [TCP segment of a reassembled PDU]
781,193.23.244.244,192.168.56.101,TLSv1.2,Application Data [TCP segment of a reassembled PDU]
782,193.23.244.244,192.168.56.101,TCP,443  >  49334 [ACK] Seq=609289 Ack=16928 Win=65535 Len=1460 [TCP segment of a reassembled PDU]
783,193.23.244.244,192.168.56.101,TCP,"443  >  49334 [PSH, ACK] Seq=610749 Ack=16928 Win=65535 Len=419 [TCP segment of a reassembled PDU]"
784,192.168.56.101,193.23.244.244,TCP,49334  >  443 [ACK] Seq=16928 Ack=600529 Win=14600 Len=0
785,192.168.56.101,193.23.244.244,TCP,49334  >  443 [ACK] Seq=16928 Ack=611168 Win=3961 Len=0
786,193.23.244.244,192.168.56.101,TLSv1.2,Application Data
787,192.168.56.101,193.23.244.244,TLSv1.2,Application Data
788,193.23.244.244,192.168.56.101,TCP,443  >  49334 [ACK] Seq=611436 Ack=17471 Win=65535 Len=0
789,192.168.56.101,193.23.244.244,TLSv1.2,Application Data
790,193.23.244.244,192.168.56.101,TCP,443  >  49334 [ACK] Seq=611436 Ack=18528 Win=65535 Len=0
791,192.168.56.101,193.23.244.244,TCP,[TCP Window Update] 49334  >  443 [ACK] Seq=18528 Ack=611436 Win=7165 Len=0
792,192.168.56.101,193.23.244.244,TCP,[TCP Window Update] 49334  >  443 [ACK] Seq=18528 Ack=611436 Win=64240 Len=0
793,192.168.56.101,193.23.244.244,TLSv1.2,Application Data
794,193.23.244.244,192.168.56.101,TCP,443  >  49334 [ACK] Seq=611436 Ack=19071 Win=65535 Len=0
795,192.168.56.101,193.23.244.244,TLSv1.2,Application Data
796,193.23.244.244,192.168.56.101,TCP,443  >  49334 [ACK] Seq=611436 Ack=20128 Win=65535 Len=0
797,192.168.56.101,193.23.244.244,TLSv1.2,Application Data
798,193.23.244.244,192.168.56.101,TCP,443  >  49334 [ACK] Seq=611436 Ack=20671 Win=65535 Len=0
799,192.168.56.101,193.23.244.244,TLSv1.2,Application Data
800,193.23.244.244,192.168.56.101,TCP,443  >  49334 [ACK] Seq=611436 Ack=22131 Win=65535 Len=0
801,193.23.244.244,192.168.56.101,TCP,443  >  49334 [ACK] Seq=611436 Ack=22242 Win=65535 Len=0
802,193.23.244.244,192.168.56.101,TLSv1.2,Application Data
803,193.23.244.244,192.168.56.101,TCP,"443  >  49334 [PSH, ACK] Seq=611979 Ack=22242 Win=65535 Len=1460 [TCP segment of a reassembled PDU]"
804,193.23.244.244,192.168.56.101,TCP,"443  >  49334 [PSH, ACK] Seq=613439 Ack=22242 Win=65535 Len=1460 [TCP segment of a reassembled PDU]"
805,193.23.244.244,192.168.56.101,TLSv1.2,Application Data [TCP segment of a reassembled PDU]
806,192.168.56.101,193.23.244.244,TCP,49334  >  443 [ACK] Seq=22242 Ack=614899 Win=64240 Len=0
807,193.23.244.244,192.168.56.101,TCP,"443  >  49334 [PSH, ACK] Seq=616359 Ack=22242 Win=65535 Len=1460 [TCP segment of a reassembled PDU]"
808,193.23.244.244,192.168.56.101,TCP,"443  >  49334 [PSH, ACK] Seq=617819 Ack=22242 Win=65535 Len=1460 [TCP segment of a reassembled PDU]"
809,192.168.56.101,193.23.244.244,TCP,49334  >  443 [ACK] Seq=22242 Ack=617819 Win=64240 Len=0
810,193.23.244.244,192.168.56.101,TLSv1.2,Application Data [TCP segment of a reassembled PDU]
811,193.23.244.244,192.168.56.101,TCP,"443  >  49334 [PSH, ACK] Seq=620739 Ack=22242 Win=65535 Len=1460 [TCP segment of a reassembled PDU]"
812,192.168.56.101,193.23.244.244,TCP,49334  >  443 [ACK] Seq=22242 Ack=622199 Win=62780 Len=0
813,193.23.244.244,192.168.56.101,TCP,443  >  49334 [ACK] Seq=622199 Ack=22242 Win=65535 Len=1460 [TCP segment of a reassembled PDU]
814,193.23.244.244,192.168.56.101,TLSv1.2,Application Data [TCP segment of a reassembled PDU]
815,193.23.244.244,192.168.56.101,TCP,443  >  49334 [ACK] Seq=625119 Ack=22242 Win=65535 Len=1460 [TCP segment of a reassembled PDU]
816,193.23.244.244,192.168.56.101,TCP,"443  >  49334 [PSH, ACK] Seq=626579 Ack=22242 Win=65535 Len=1460 [TCP segment of a reassembled PDU]"
817,193.23.244.244,192.168.56.101,TLSv1.2,"Application Data, Application Data"
818,192.168.56.101,193.23.244.244,TCP,49334  >  443 [ACK] Seq=22242 Ack=629499 Win=55480 Len=0
819,192.168.56.101,193.23.244.244,TCP,[TCP Window Update] 49334  >  443 [ACK] Seq=22242 Ack=629499 Win=64240 Len=0
820,192.168.56.101,193.23.244.244,TLSv1.2,Application Data
821,193.23.244.244,192.168.56.101,TCP,443  >  49334 [ACK] Seq=629499 Ack=22785 Win=65535 Len=0
822,193.23.244.244,192.168.56.101,TLSv1.2,Application Data
823,192.168.56.101,193.23.244.244,TCP,49334  >  443 [ACK] Seq=22785 Ack=629629 Win=64110 Len=0
824,192.168.56.101,194.109.206.212,TCP,49204  >  443 [SYN] Seq=0 Win=8192 Len=0 MSS=1460 WS=256 SACK_PERM=1
825,192.168.56.101,194.109.206.212,TCP,[TCP Retransmission] 49204  >  443 [SYN] Seq=0 Win=8192 Len=0 MSS=1460 WS=256 SACK_PERM=1
826,192.168.56.101,194.109.206.212,TCP,[TCP Retransmission] 49204  >  443 [SYN] Seq=0 Win=8192 Len=0 MSS=1460 SACK_PERM=1
827,192.168.56.101,213.61.66.118,TCP,49203  >  9001 [SYN] Seq=0 Win=8192 Len=0 MSS=1460 WS=256 SACK_PERM=1
828,192.168.56.101,213.61.66.118,TCP,[TCP Retransmission] 49203  >  9001 [SYN] Seq=0 Win=8192 Len=0 MSS=1460 WS=256 SACK_PERM=1
829,192.168.56.101,213.61.66.118,TCP,[TCP Retransmission] 49203  >  9001 [SYN] Seq=0 Win=8192 Len=0 MSS=1460 SACK_PERM=1
830,192.168.56.101,224.0.0.22,IGMPv3,Membership Report / Leave group 224.0.0.252
831,192.168.56.101,224.0.0.22,IGMPv3,Membership Report / Leave group 224.0.0.252
832,192.168.56.101,224.0.0.22,IGMPv3,Membership Report / Join group 224.0.0.252 for any sources
833,192.168.56.101,224.0.0.22,IGMPv3,Membership Report / Join group 224.0.0.252 for any sources
834,192.168.56.101,224.0.0.22,IGMPv3,Membership Report / Join group 239.255.255.250 for any sources
835,192.168.56.101,224.0.0.22,IGMPv3,Membership Report / Join group 239.255.255.250 for any sources
836,192.168.56.101,224.0.0.22,IGMPv3,Membership Report / Join group 224.0.0.252 for any sources / Join group 239.255.255.250 for any sources
837,192.168.56.101,224.0.0.22,IGMPv3,Membership Report / Join group 224.0.0.252 for any sources / Join group 239.255.255.250 for any sources
838,192.168.56.101,224.0.0.252,LLMNR,Standard query 0x6cfb A isatap
839,192.168.56.101,224.0.0.252,LLMNR,Standard query 0x6cfb A isatap
840,192.168.56.101,224.0.0.252,LLMNR,Standard query 0x6cfb A isatap
841,192.168.56.101,224.0.0.252,LLMNR,Standard query 0x6cfb A isatap
842,192.168.56.101,224.0.0.252,LLMNR,Standard query 0xc9cb A isatap
843,192.168.56.101,224.0.0.252,LLMNR,Standard query 0xc9cb A isatap
844,192.168.56.101,224.0.0.252,LLMNR,Standard query 0xc9cb A isatap
845,192.168.56.101,224.0.0.252,LLMNR,Standard query 0xc9cb A isatap
846,192.168.56.101,224.0.0.252,LLMNR,Standard query 0x971a A isatap
847,192.168.56.101,224.0.0.252,LLMNR,Standard query 0x971a A isatap
848,192.168.56.101,224.0.0.252,LLMNR,Standard query 0x971a A isatap
849,192.168.56.101,224.0.0.252,LLMNR,Standard query 0x971a A isatap
850,192.168.56.101,224.0.0.252,LLMNR,Standard query 0x09c0 A wpad
851,192.168.56.101,224.0.0.252,LLMNR,Standard query 0x09c0 A wpad
852,192.168.56.101,224.0.0.252,LLMNR,Standard query 0x09c0 A wpad
853,192.168.56.101,224.0.0.252,LLMNR,Standard query 0x09c0 A wpad
854,192.168.56.101,224.0.0.252,LLMNR,Standard query 0xc4c8 A wpad
855,192.168.56.101,224.0.0.252,LLMNR,Standard query 0xc4c8 A wpad
856,192.168.56.101,224.0.0.252,LLMNR,Standard query 0xc4c8 A wpad
857,192.168.56.101,224.0.0.252,LLMNR,Standard query 0xc4c8 A wpad
858,192.168.56.101,224.0.0.252,LLMNR,Standard query 0x4163 A isatap
859,192.168.56.101,224.0.0.252,LLMNR,Standard query 0x4163 A isatap
860,192.168.56.101,224.0.0.252,LLMNR,Standard query 0x4163 A isatap
861,192.168.56.101,224.0.0.252,LLMNR,Standard query 0x4163 A isatap
862,192.168.56.101,224.0.0.252,LLMNR,Standard query 0x96f1 A isatap
863,192.168.56.101,224.0.0.252,LLMNR,Standard query 0x96f1 A isatap
864,192.168.56.101,224.0.0.252,LLMNR,Standard query 0x96f1 A isatap
865,192.168.56.101,224.0.0.252,LLMNR,Standard query 0x96f1 A isatap
866,192.168.56.101,224.0.0.252,LLMNR,Standard query 0x6e6e A isatap
867,192.168.56.101,224.0.0.252,LLMNR,Standard query 0x6e6e A isatap
868,192.168.56.101,224.0.0.252,LLMNR,Standard query 0x6e6e A isatap
869,192.168.56.101,224.0.0.252,LLMNR,Standard query 0x6e6e A isatap
870,192.168.56.101,224.0.0.252,LLMNR,Standard query 0x69e6 A wpad
871,192.168.56.101,224.0.0.252,LLMNR,Standard query 0x69e6 A wpad
872,192.168.56.101,224.0.0.252,LLMNR,Standard query 0x69e6 A wpad
873,192.168.56.101,224.0.0.252,LLMNR,Standard query 0x69e6 A wpad
874,192.168.56.101,224.0.0.252,LLMNR,Standard query 0x21c1 ANY None
875,192.168.56.101,224.0.0.252,LLMNR,Standard query 0x21c1 ANY None
876,192.168.56.101,224.0.0.252,LLMNR,Standard query 0x21c1 ANY None
877,192.168.56.101,224.0.0.252,LLMNR,Standard query 0x21c1 ANY None
878,192.168.56.101,239.255.255.250,UDP,55190  >  3702 Len=624
879,192.168.56.101,239.255.255.250,UDP,55190  >  3702 Len=624
880,192.168.56.101,239.255.255.250,UDP,55190  >  3702 Len=624
881,192.168.56.101,239.255.255.250,UDP,55190  >  3702 Len=624
882,192.168.56.101,239.255.255.250,UDP,55192  >  3702 Len=624
883,192.168.56.101,239.255.255.250,UDP,55192  >  3702 Len=624
884,192.168.56.101,239.255.255.250,UDP,55192  >  3702 Len=624
885,192.168.56.101,239.255.255.250,UDP,55192  >  3702 Len=624
886,192.168.56.101,239.255.255.250,SSDP,M-SEARCH * HTTP/1.1 
887,192.168.56.101,239.255.255.250,SSDP,M-SEARCH * HTTP/1.1 
888,192.168.56.101,239.255.255.250,SSDP,M-SEARCH * HTTP/1.1 
889,192.168.56.101,239.255.255.250,SSDP,M-SEARCH * HTTP/1.1 
890,192.168.56.101,239.255.255.250,SSDP,M-SEARCH * HTTP/1.1 
891,192.168.56.101,239.255.255.250,SSDP,M-SEARCH * HTTP/1.1 
892,192.168.56.101,239.255.255.250,SSDP,M-SEARCH * HTTP/1.1 
893,192.168.56.101,239.255.255.250,SSDP,M-SEARCH * HTTP/1.1 
894,192.168.56.101,239.255.255.250,SSDP,M-SEARCH * HTTP/1.1 
895,192.168.56.101,239.255.255.250,SSDP,M-SEARCH * HTTP/1.1 
896,192.168.56.101,239.255.255.250,SSDP,M-SEARCH * HTTP/1.1 
897,192.168.56.101,239.255.255.250,SSDP,M-SEARCH * HTTP/1.1 
898,192.168.56.101,239.255.255.250,SSDP,M-SEARCH * HTTP/1.1 
899,192.168.56.101,239.255.255.250,SSDP,M-SEARCH * HTTP/1.1 
900,192.168.56.101,239.255.255.250,SSDP,M-SEARCH * HTTP/1.1 
901,192.168.56.101,239.255.255.250,SSDP,M-SEARCH * HTTP/1.1 
902,192.168.56.101,239.255.255.250,SSDP,M-SEARCH * HTTP/1.1 
903,192.168.56.101,239.255.255.250,SSDP,M-SEARCH * HTTP/1.1 
904,192.168.56.101,239.255.255.250,SSDP,M-SEARCH * HTTP/1.1 
905,192.168.56.101,239.255.255.250,SSDP,M-SEARCH * HTTP/1.1 
906,192.168.56.101,239.255.255.250,SSDP,M-SEARCH * HTTP/1.1 
907,192.168.56.101,239.255.255.250,SSDP,M-SEARCH * HTTP/1.1 
908,192.168.56.101,239.255.255.250,SSDP,M-SEARCH * HTTP/1.1 
909,192.168.56.101,239.255.255.250,SSDP,M-SEARCH * HTTP/1.1 
910,192.168.56.101,239.255.255.250,SSDP,M-SEARCH * HTTP/1.1 
911,192.168.56.101,239.255.255.250,SSDP,M-SEARCH * HTTP/1.1 
912,192.168.56.101,239.255.255.250,SSDP,M-SEARCH * HTTP/1.1 
913,192.168.56.101,239.255.255.250,SSDP,M-SEARCH * HTTP/1.1 
914,192.168.56.101,239.255.255.250,SSDP,M-SEARCH * HTTP/1.1 
915,192.168.56.101,239.255.255.250,SSDP,M-SEARCH * HTTP/1.1 
916,192.168.56.101,239.255.255.250,SSDP,M-SEARCH * HTTP/1.1 
917,192.168.56.101,239.255.255.250,SSDP,M-SEARCH * HTTP/1.1 
918,192.168.56.101,239.255.255.250,SSDP,M-SEARCH * HTTP/1.1 
919,192.168.56.101,239.255.255.250,SSDP,M-SEARCH * HTTP/1.1 
920,192.168.56.101,239.255.255.250,SSDP,M-SEARCH * HTTP/1.1 
921,192.168.56.101,239.255.255.250,SSDP,M-SEARCH * HTTP/1.1 
922,192.168.56.101,239.255.255.250,SSDP,M-SEARCH * HTTP/1.1 
923,192.168.56.101,239.255.255.250,SSDP,M-SEARCH * HTTP/1.1 
924,192.168.56.101,239.255.255.250,SSDP,M-SEARCH * HTTP/1.1 
925,192.168.56.101,239.255.255.250,SSDP,M-SEARCH * HTTP/1.1 
926,192.168.56.101,239.255.255.250,SSDP,M-SEARCH * HTTP/1.1 
927,192.168.56.101,239.255.255.250,SSDP,M-SEARCH * HTTP/1.1 
928,192.168.56.101,239.255.255.250,SSDP,M-SEARCH * HTTP/1.1 
929,192.168.56.101,239.255.255.250,SSDP,M-SEARCH * HTTP/1.1 
930,192.168.56.101,239.255.255.250,SSDP,M-SEARCH * HTTP/1.1 
931,192.168.56.101,239.255.255.250,SSDP,M-SEARCH * HTTP/1.1 
932,192.168.56.101,239.255.255.250,UDP,65391  >  3702 Len=624
933,192.168.56.101,239.255.255.250,UDP,65391  >  3702 Len=624
934,192.168.56.101,239.255.255.250,UDP,65391  >  3702 Len=624
935,192.168.56.101,239.255.255.250,UDP,65391  >  3702 Len=624
936,192.168.56.101,40.119.6.228,NTP,"NTP Version 3, client"
937,40.119.6.228,192.168.56.101,NTP,"NTP Version 3, server"
938,192.168.56.101,5.199.142.236,TCP,49333  >  9001 [SYN] Seq=0 Win=8192 Len=0 MSS=1460 WS=256 SACK_PERM=1
939,192.168.56.101,5.199.142.236,TCP,[TCP Retransmission] 49333  >  9001 [SYN] Seq=0 Win=8192 Len=0 MSS=1460 WS=256 SACK_PERM=1
940,192.168.56.101,5.199.142.236,TCP,[TCP Retransmission] 49333  >  9001 [SYN] Seq=0 Win=8192 Len=0 MSS=1460 SACK_PERM=1
941,192.168.56.101,8.8.8.8,DNS,Standard query 0x025f A www.msftncsi.com
942,8.8.8.8,192.168.56.101,DNS,Standard query response 0x025f A www.msftncsi.com CNAME www.msftncsi.com.edgesuite.net CNAME a1961.g2.akamai.net A 96.17.176.171 A 96.17.176.177
943,192.168.56.101,8.8.8.8,DNS,Standard query 0xea6d A clients2.google.com
944,8.8.8.8,192.168.56.101,DNS,Standard query response 0xea6d A clients2.google.com CNAME clients.l.google.com A 142.251.33.14
945,192.168.56.101,8.8.8.8,DNS,Standard query 0x04c8 A time.windows.com
946,8.8.8.8,192.168.56.101,DNS,Standard query response 0x04c8 A time.windows.com CNAME twc.trafficmanager.net A 40.119.6.228
947,192.168.56.101,8.8.8.8,DNS,Standard query 0xe6e6 A watson.microsoft.com
948,8.8.8.8,192.168.56.101,DNS,Standard query response 0xe6e6 A watson.microsoft.com CNAME legacywatson.trafficmanager.net CNAME onedsblobprdcus07.centralus.cloudapp.azure.com A 104.208.16.93
949,192.168.56.101,8.8.8.8,DNS,Standard query 0xab76 A teredo.ipv6.microsoft.com
950,8.8.8.8,192.168.56.101,DNS,Standard query response 0xab76 No such name A teredo.ipv6.microsoft.com SOA ns1-04.azure-dns.com
951,192.168.56.101,95.128.43.164,TCP,49466  >  443 [SYN] Seq=0 Win=8192 Len=0 MSS=1460 WS=256 SACK_PERM=1
952,95.128.43.164,192.168.56.101,TCP,"443  >  49466 [SYN, ACK] Seq=0 Ack=1 Win=65535 Len=0 MSS=1460"
953,192.168.56.101,95.128.43.164,TCP,49466  >  443 [ACK] Seq=1 Ack=1 Win=64240 Len=0
954,192.168.56.101,95.128.43.164,TLSv1.2,Client Hello
955,95.128.43.164,192.168.56.101,TCP,443  >  49466 [ACK] Seq=1 Ack=219 Win=65535 Len=0
956,95.128.43.164,192.168.56.101,TLSv1.2,"Server Hello, Certificate, Server Key Exchange, Server Hello Done"
957,192.168.56.101,95.128.43.164,TLSv1.2,"Client Key Exchange, Change Cipher Spec, Encrypted Handshake Message"
958,95.128.43.164,192.168.56.101,TCP,443  >  49466 [ACK] Seq=1010 Ack=345 Win=65535 Len=0
959,95.128.43.164,192.168.56.101,TLSv1.2,"Change Cipher Spec, Encrypted Handshake Message"
960,192.168.56.101,95.128.43.164,TCP,49466  >  443 [ACK] Seq=345 Ack=1061 Win=63180 Len=0
961,192.168.56.101,96.17.176.171,TCP,49160  >  80 [SYN] Seq=0 Win=8192 Len=0 MSS=1460 WS=256 SACK_PERM=1
962,96.17.176.171,192.168.56.101,TCP,"80  >  49160 [SYN, ACK] Seq=0 Ack=1 Win=65535 Len=0 MSS=1460"
963,192.168.56.101,96.17.176.171,TCP,49160  >  80 [ACK] Seq=1 Ack=1 Win=64240 Len=0
964,192.168.56.101,96.17.176.171,HTTP,GET /ncsi.txt HTTP/1.1 
965,96.17.176.171,192.168.56.101,TCP,80  >  49160 [ACK] Seq=1 Ack=98 Win=65535 Len=0
966,96.17.176.171,192.168.56.101,HTTP,HTTP/1.1 200 OK  (text/plain)
967,96.17.176.171,192.168.56.101,TCP,"80  >  49160 [FIN, ACK] Seq=180 Ack=98 Win=65535 Len=0"
968,192.168.56.101,96.17.176.171,TCP,49160  >  80 [ACK] Seq=98 Ack=181 Win=64061 Len=0
969,192.168.56.101,96.17.176.171,TCP,"49160  >  80 [FIN, ACK] Seq=98 Ack=181 Win=64061 Len=0"
970,96.17.176.171,192.168.56.101,TCP,80  >  49160 [ACK] Seq=181 Ack=99 Win=65535 Len=0
971,37.153.1.10,192.168.56.101,TCP,9001  >  49581 [ACK] Seq=1 Ack=1 Win=65535 Len=1
972,37.153.1.10,192.168.56.101,TCP,[TCP Keep-Alive] 9001  >  49581 [ACK] Seq=1 Ack=1 Win=65535 Len=1
973,37.153.1.10,192.168.56.101,TCP,[TCP Keep-Alive] 9001  >  49581 [ACK] Seq=1 Ack=1 Win=65535 Len=1
974,37.153.1.10,192.168.56.101,TCP,[TCP Keep-Alive] 9001  >  49581 [ACK] Seq=1 Ack=1 Win=65535 Len=1
975,192.168.56.101,37.153.1.10,TCP,49581  >  9001 [RST] Seq=1 Win=0 Len=0
976,46.28.110.244,192.168.56.101,TLSv1.2,Application Data
977,46.28.110.244,192.168.56.101,TCP,"[TCP Retransmission] 443  >  49436 [PSH, ACK] Seq=1 Ack=1 Win=65535 Len=543"
978,46.28.110.244,192.168.56.101,TCP,"[TCP Retransmission] 443  >  49436 [PSH, ACK] Seq=1 Ack=1 Win=65535 Len=543"
979,192.168.56.101,46.28.110.244,TCP,49436  >  443 [RST] Seq=1 Win=0 Len=0
980,86.59.21.38,192.168.56.101,TLSv1.2,Application Data
981,192.168.56.101,86.59.21.38,TCP,49435  >  443 [RST] Seq=1 Win=0 Len=0
