,Source,Destination,Protocol,Info
0,0a:00:27:00:00:00,5a:94:d2:14:5a:51,ARP,Who has 192.168.56.101? Tell 192.168.56.1
1,0a:00:27:00:00:00,5a:94:d2:14:5a:51,ARP,Who has 192.168.56.101? Tell 192.168.56.1
2,0a:00:27:00:00:00,5a:94:d2:14:5a:51,ARP,Who has 192.168.56.101? Tell 192.168.56.1
3,0a:00:27:00:00:00,Broadcast,ARP,Who has 192.168.56.101? Tell 192.168.56.1
4,0a:00:27:00:00:00,Broadcast,ARP,Who has 192.168.56.101? Tell 192.168.56.1
5,0a:00:27:00:00:00,Broadcast,ARP,Who has 192.168.56.101? Tell 192.168.56.1
6,0a:00:27:00:00:00,Broadcast,ARP,Who has 192.168.56.101? Tell 192.168.56.1
7,0a:00:27:00:00:00,Broadcast,ARP,Who has 192.168.56.101? Tell 192.168.56.1
8,5a:94:d2:14:5a:51,Broadcast,ARP,Who has 192.168.56.101? Tell 0.0.0.0
9,5a:94:d2:14:5a:51,Broadcast,ARP,Who has 192.168.56.101? Tell 0.0.0.0
10,0a:00:27:00:00:00,Broadcast,ARP,Who has 192.168.56.101? Tell 192.168.56.1
11,5a:94:d2:14:5a:51,Broadcast,ARP,Who has 192.168.56.101? Tell 0.0.0.0
12,5a:94:d2:14:5a:51,Broadcast,ARP,Who has 192.168.56.101? Tell 0.0.0.0
13,5a:94:d2:14:5a:51,Broadcast,ARP,Who has 192.168.56.101? Tell 0.0.0.0
14,5a:94:d2:14:5a:51,Broadcast,ARP,Who has 192.168.56.101? Tell 0.0.0.0
15,0a:00:27:00:00:00,Broadcast,ARP,Who has 192.168.56.101? Tell 192.168.56.1
16,5a:94:d2:14:5a:51,Broadcast,ARP,Who has 192.168.56.1? Tell 192.168.56.101
17,5a:94:d2:14:5a:51,Broadcast,ARP,Who has 192.168.56.1? Tell 192.168.56.101
18,0a:00:27:00:00:00,5a:94:d2:14:5a:51,ARP,192.168.56.1 is at 0a:00:27:00:00:00
19,5a:94:d2:14:5a:51,Broadcast,ARP,Who has 192.168.56.1? Tell 192.168.56.101
20,5a:94:d2:14:5a:51,Broadcast,ARP,Who has 192.168.56.1? Tell 192.168.56.101
21,0a:00:27:00:00:00,5a:94:d2:14:5a:51,ARP,192.168.56.1 is at 0a:00:27:00:00:00
22,5a:94:d2:14:5a:51,Broadcast,ARP,Who has 192.168.56.1? Tell 192.168.56.101
23,5a:94:d2:14:5a:51,Broadcast,ARP,Who has 192.168.56.1? Tell 192.168.56.101
24,0a:00:27:00:00:00,5a:94:d2:14:5a:51,ARP,192.168.56.1 is at 0a:00:27:00:00:00
25,192.168.56.101,128.31.0.39,TCP,49231  >  9101 [SYN] Seq=0 Win=8192 Len=0 MSS=1460 WS=256 SACK_PERM=1
26,128.31.0.39,192.168.56.101,TCP,"9101  >  49231 [SYN, ACK] Seq=0 Ack=1 Win=65535 Len=0 MSS=1460"
27,192.168.56.101,128.31.0.39,TCP,49231  >  9101 [ACK] Seq=1 Ack=1 Win=64240 Len=0
28,192.168.56.101,128.31.0.39,TLSv1.2,Client Hello
29,128.31.0.39,192.168.56.101,TCP,9101  >  49231 [ACK] Seq=1 Ack=214 Win=65535 Len=0
30,128.31.0.39,192.168.56.101,TLSv1.2,"Server Hello, Certificate, Server Key Exchange, Server Hello Done"
31,192.168.56.101,128.31.0.39,TLSv1.2,"Client Key Exchange, Change Cipher Spec, Encrypted Handshake Message"
32,128.31.0.39,192.168.56.101,TCP,9101  >  49231 [ACK] Seq=1019 Ack=340 Win=65535 Len=0
33,128.31.0.39,192.168.56.101,TLSv1.2,"Change Cipher Spec, Encrypted Handshake Message"
34,192.168.56.101,128.31.0.39,TLSv1.2,Application Data
35,128.31.0.39,192.168.56.101,TCP,9101  >  49231 [ACK] Seq=1070 Ack=378 Win=65535 Len=0
36,128.31.0.39,192.168.56.101,TCP,9101  >  49231 [ACK] Seq=1070 Ack=378 Win=65535 Len=1460 [TCP segment of a reassembled PDU]
37,128.31.0.39,192.168.56.101,TLSv1.2,Application Data
38,192.168.56.101,128.31.0.39,TCP,49231  >  9101 [ACK] Seq=378 Ack=3156 Win=64240 Len=0
39,192.168.56.101,128.31.0.39,TLSv1.2,Application Data
40,128.31.0.39,192.168.56.101,TCP,9101  >  49231 [ACK] Seq=3156 Ack=1435 Win=65535 Len=0
41,128.31.0.39,192.168.56.101,TLSv1.2,Application Data
42,192.168.56.101,128.31.0.39,TLSv1.2,Application Data
43,128.31.0.39,192.168.56.101,TCP,9101  >  49231 [ACK] Seq=3699 Ack=2492 Win=65535 Len=0
44,128.31.0.39,192.168.56.101,TCP,"9101  >  49231 [PSH, ACK] Seq=3699 Ack=2492 Win=65535 Len=1460 [TCP segment of a reassembled PDU]"
45,128.31.0.39,192.168.56.101,TCP,"9101  >  49231 [PSH, ACK] Seq=5159 Ack=2492 Win=65535 Len=1460 [TCP segment of a reassembled PDU]"
46,192.168.56.101,128.31.0.39,TCP,49231  >  9101 [ACK] Seq=2492 Ack=6619 Win=64240 Len=0
47,128.31.0.39,192.168.56.101,TLSv1.2,Application Data
48,128.31.0.39,192.168.56.101,TCP,"9101  >  49231 [PSH, ACK] Seq=7776 Ack=2492 Win=65535 Len=1460 [TCP segment of a reassembled PDU]"
49,192.168.56.101,128.31.0.39,TCP,49231  >  9101 [ACK] Seq=2492 Ack=9236 Win=64240 Len=0
50,128.31.0.39,192.168.56.101,TCP,"9101  >  49231 [PSH, ACK] Seq=9236 Ack=2492 Win=65535 Len=1460 [TCP segment of a reassembled PDU]"
51,128.31.0.39,192.168.56.101,TLSv1.2,Application Data [TCP segment of a reassembled PDU]
52,128.31.0.39,192.168.56.101,TCP,"9101  >  49231 [PSH, ACK] Seq=12156 Ack=2492 Win=65535 Len=1460 [TCP segment of a reassembled PDU]"
53,128.31.0.39,192.168.56.101,TCP,"9101  >  49231 [PSH, ACK] Seq=13616 Ack=2492 Win=65535 Len=1460 [TCP segment of a reassembled PDU]"
54,192.168.56.101,128.31.0.39,TCP,49231  >  9101 [ACK] Seq=2492 Ack=12156 Win=64240 Len=0
55,128.31.0.39,192.168.56.101,TLSv1.2,Application Data [TCP segment of a reassembled PDU]
56,128.31.0.39,192.168.56.101,TLSv1.2,Application Data [TCP segment of a reassembled PDU]
57,192.168.56.101,128.31.0.39,TCP,49231  >  9101 [ACK] Seq=2492 Ack=17996 Win=58400 Len=0
58,192.168.56.101,128.31.0.39,TCP,[TCP Window Update] 49231  >  9101 [ACK] Seq=2492 Ack=17996 Win=64240 Len=0
59,128.31.0.39,192.168.56.101,TCP,"9101  >  49231 [PSH, ACK] Seq=17996 Ack=2492 Win=65535 Len=1460 [TCP segment of a reassembled PDU]"
60,128.31.0.39,192.168.56.101,TLSv1.2,Application Data [TCP segment of a reassembled PDU]
61,128.31.0.39,192.168.56.101,TCP,"9101  >  49231 [PSH, ACK] Seq=20916 Ack=2492 Win=65535 Len=1460 [TCP segment of a reassembled PDU]"
62,192.168.56.101,128.31.0.39,TCP,49231  >  9101 [ACK] Seq=2492 Ack=20916 Win=64240 Len=0
63,128.31.0.39,192.168.56.101,TLSv1.2,Application Data [TCP segment of a reassembled PDU]
64,192.168.56.101,128.31.0.39,TCP,49231  >  9101 [ACK] Seq=2492 Ack=23836 Win=64240 Len=0
65,128.31.0.39,192.168.56.101,TCP,"9101  >  49231 [PSH, ACK] Seq=23836 Ack=2492 Win=65535 Len=1460 [TCP segment of a reassembled PDU]"
66,128.31.0.39,192.168.56.101,TCP,"9101  >  49231 [PSH, ACK] Seq=25296 Ack=2492 Win=65535 Len=1460 [TCP segment of a reassembled PDU]"
67,128.31.0.39,192.168.56.101,TLSv1.2,Application Data [TCP segment of a reassembled PDU]
68,192.168.56.101,128.31.0.39,TCP,49231  >  9101 [ACK] Seq=2492 Ack=26756 Win=64240 Len=0
69,128.31.0.39,192.168.56.101,TCP,"9101  >  49231 [PSH, ACK] Seq=28216 Ack=2492 Win=65535 Len=1460 [TCP segment of a reassembled PDU]"
70,128.31.0.39,192.168.56.101,TLSv1.2,Application Data [TCP segment of a reassembled PDU]
71,192.168.56.101,128.31.0.39,TCP,49231  >  9101 [ACK] Seq=2492 Ack=29676 Win=64240 Len=0
72,128.31.0.39,192.168.56.101,TLSv1.2,"Application Data, Application Data"
73,192.168.56.101,128.31.0.39,TCP,49231  >  9101 [ACK] Seq=2492 Ack=32259 Win=61657 Len=0
74,192.168.56.101,128.31.0.39,TCP,[TCP Window Update] 49231  >  9101 [ACK] Seq=2492 Ack=32259 Win=64240 Len=0
75,128.31.0.39,192.168.56.101,TCP,"9101  >  49231 [PSH, ACK] Seq=32259 Ack=2492 Win=65535 Len=1460 [TCP segment of a reassembled PDU]"
76,128.31.0.39,192.168.56.101,TCP,"9101  >  49231 [PSH, ACK] Seq=33719 Ack=2492 Win=65535 Len=1460 [TCP segment of a reassembled PDU]"
77,192.168.56.101,128.31.0.39,TCP,49231  >  9101 [ACK] Seq=2492 Ack=35179 Win=61320 Len=0
78,128.31.0.39,192.168.56.101,TLSv1.2,Application Data [TCP segment of a reassembled PDU]
79,128.31.0.39,192.168.56.101,TCP,"9101  >  49231 [PSH, ACK] Seq=36639 Ack=2492 Win=65535 Len=1460 [TCP segment of a reassembled PDU]"
80,128.31.0.39,192.168.56.101,TCP,"9101  >  49231 [PSH, ACK] Seq=38099 Ack=2492 Win=65535 Len=1460 [TCP segment of a reassembled PDU]"
81,192.168.56.101,128.31.0.39,TCP,49231  >  9101 [ACK] Seq=2492 Ack=39559 Win=56940 Len=0
82,128.31.0.39,192.168.56.101,TLSv1.2,Application Data [TCP segment of a reassembled PDU]
83,192.168.56.101,128.31.0.39,TCP,49231  >  9101 [ACK] Seq=2492 Ack=41019 Win=58952 Len=0
84,192.168.56.101,128.31.0.39,TCP,[TCP Window Update] 49231  >  9101 [ACK] Seq=2492 Ack=41019 Win=64240 Len=0
85,128.31.0.39,192.168.56.101,TCP,"9101  >  49231 [PSH, ACK] Seq=41019 Ack=2492 Win=65535 Len=1460 [TCP segment of a reassembled PDU]"
86,128.31.0.39,192.168.56.101,TCP,"9101  >  49231 [PSH, ACK] Seq=42479 Ack=2492 Win=65535 Len=1460 [TCP segment of a reassembled PDU]"
87,128.31.0.39,192.168.56.101,TLSv1.2,"Application Data, Application Data"
88,192.168.56.101,128.31.0.39,TCP,49231  >  9101 [ACK] Seq=2492 Ack=43939 Win=61320 Len=0
89,128.31.0.39,192.168.56.101,TCP,"9101  >  49231 [PSH, ACK] Seq=45399 Ack=2492 Win=65535 Len=1460 [TCP segment of a reassembled PDU]"
90,192.168.56.101,128.31.0.39,TCP,49231  >  9101 [ACK] Seq=2492 Ack=46859 Win=58400 Len=0
91,192.168.56.101,128.31.0.39,TLSv1.2,Application Data
92,128.31.0.39,192.168.56.101,TCP,9101  >  49231 [ACK] Seq=46859 Ack=3035 Win=65535 Len=0
93,192.168.56.101,128.31.0.39,TCP,[TCP Window Update] 49231  >  9101 [ACK] Seq=3035 Ack=46859 Win=64240 Len=0
94,128.31.0.39,192.168.56.101,TCP,"9101  >  49231 [PSH, ACK] Seq=46859 Ack=3035 Win=65535 Len=1460 [TCP segment of a reassembled PDU]"
95,128.31.0.39,192.168.56.101,TLSv1.2,Application Data [TCP segment of a reassembled PDU]
96,128.31.0.39,192.168.56.101,TCP,9101  >  49231 [ACK] Seq=49779 Ack=3035 Win=65535 Len=1460 [TCP segment of a reassembled PDU]
97,128.31.0.39,192.168.56.101,TCP,9101  >  49231 [ACK] Seq=51239 Ack=3035 Win=65535 Len=1460 [TCP segment of a reassembled PDU]
98,128.31.0.39,192.168.56.101,TLSv1.2,Application Data [TCP segment of a reassembled PDU]
99,128.31.0.39,192.168.56.101,TCP,"9101  >  49231 [PSH, ACK] Seq=54159 Ack=3035 Win=65535 Len=1460 [TCP segment of a reassembled PDU]"
100,192.168.56.101,128.31.0.39,TCP,49231  >  9101 [ACK] Seq=3035 Ack=55619 Win=64240 Len=0
101,128.31.0.39,192.168.56.101,TCP,9101  >  49231 [ACK] Seq=55619 Ack=3035 Win=65535 Len=1460 [TCP segment of a reassembled PDU]
102,128.31.0.39,192.168.56.101,TLSv1.2,Application Data [TCP segment of a reassembled PDU]
103,128.31.0.39,192.168.56.101,TCP,9101  >  49231 [ACK] Seq=58539 Ack=3035 Win=65535 Len=1460 [TCP segment of a reassembled PDU]
104,128.31.0.39,192.168.56.101,TCP,9101  >  49231 [ACK] Seq=59999 Ack=3035 Win=65535 Len=1460 [TCP segment of a reassembled PDU]
105,128.31.0.39,192.168.56.101,TLSv1.2,"Application Data, Application Data"
106,192.168.56.101,128.31.0.39,TCP,49231  >  9101 [ACK] Seq=3035 Ack=62919 Win=56940 Len=0
107,128.31.0.39,192.168.56.101,TCP,9101  >  49231 [ACK] Seq=62919 Ack=3035 Win=65535 Len=1460 [TCP segment of a reassembled PDU]
108,128.31.0.39,192.168.56.101,TLSv1.2,Application Data [TCP segment of a reassembled PDU]
109,128.31.0.39,192.168.56.101,TLSv1.2,Application Data [TCP segment of a reassembled PDU]
110,192.168.56.101,128.31.0.39,TCP,49231  >  9101 [ACK] Seq=3035 Ack=67299 Win=52560 Len=0
111,128.31.0.39,192.168.56.101,TCP,9101  >  49231 [ACK] Seq=67299 Ack=3035 Win=65535 Len=1460 [TCP segment of a reassembled PDU]
112,128.31.0.39,192.168.56.101,TCP,9101  >  49231 [ACK] Seq=68759 Ack=3035 Win=65535 Len=1460 [TCP segment of a reassembled PDU]
113,128.31.0.39,192.168.56.101,TLSv1.2,Application Data [TCP segment of a reassembled PDU]
114,128.31.0.39,192.168.56.101,TCP,9101  >  49231 [ACK] Seq=71679 Ack=3035 Win=65535 Len=1460 [TCP segment of a reassembled PDU]
115,128.31.0.39,192.168.56.101,TCP,"9101  >  49231 [PSH, ACK] Seq=73139 Ack=3035 Win=65535 Len=1460 [TCP segment of a reassembled PDU]"
116,192.168.56.101,128.31.0.39,TCP,49231  >  9101 [ACK] Seq=3035 Ack=74599 Win=45260 Len=0
117,128.31.0.39,192.168.56.101,TLSv1.2,"Application Data, Application Data, Application Data"
118,128.31.0.39,192.168.56.101,TCP,9101  >  49231 [ACK] Seq=75870 Ack=3035 Win=65535 Len=1460 [TCP segment of a reassembled PDU]
119,128.31.0.39,192.168.56.101,TCP,9101  >  49231 [ACK] Seq=77330 Ack=3035 Win=65535 Len=1460 [TCP segment of a reassembled PDU]
120,128.31.0.39,192.168.56.101,TLSv1.2,Application Data [TCP segment of a reassembled PDU]
121,128.31.0.39,192.168.56.101,TLSv1.2,Application Data [TCP segment of a reassembled PDU]
122,128.31.0.39,192.168.56.101,TCP,"9101  >  49231 [PSH, ACK] Seq=81710 Ack=3035 Win=65535 Len=1460 [TCP segment of a reassembled PDU]"
123,192.168.56.101,128.31.0.39,TCP,49231  >  9101 [ACK] Seq=3035 Ack=83170 Win=36689 Len=0
124,128.31.0.39,192.168.56.101,TCP,9101  >  49231 [ACK] Seq=83170 Ack=3035 Win=65535 Len=1460 [TCP segment of a reassembled PDU]
125,128.31.0.39,192.168.56.101,TLSv1.2,Application Data [TCP segment of a reassembled PDU]
126,128.31.0.39,192.168.56.101,TCP,9101  >  49231 [ACK] Seq=86090 Ack=3035 Win=65535 Len=1460 [TCP segment of a reassembled PDU]
127,128.31.0.39,192.168.56.101,TCP,9101  >  49231 [ACK] Seq=87550 Ack=3035 Win=65535 Len=1460 [TCP segment of a reassembled PDU]
128,128.31.0.39,192.168.56.101,TLSv1.2,Application Data [TCP segment of a reassembled PDU]
129,192.168.56.101,128.31.0.39,TCP,49231  >  9101 [ACK] Seq=3035 Ack=90470 Win=29389 Len=0
130,128.31.0.39,192.168.56.101,TCP,9101  >  49231 [ACK] Seq=90470 Ack=3035 Win=65535 Len=1460 [TCP segment of a reassembled PDU]
131,128.31.0.39,192.168.56.101,TCP,"9101  >  49231 [PSH, ACK] Seq=91930 Ack=3035 Win=65535 Len=1460 [TCP segment of a reassembled PDU]"
132,192.168.56.101,128.31.0.39,TCP,49231  >  9101 [ACK] Seq=3035 Ack=93390 Win=26469 Len=0
133,128.31.0.39,192.168.56.101,TLSv1.2,Application Data [TCP segment of a reassembled PDU]
134,128.31.0.39,192.168.56.101,TLSv1.2,Application Data [TCP segment of a reassembled PDU]
135,128.31.0.39,192.168.56.101,TCP,9101  >  49231 [ACK] Seq=96310 Ack=3035 Win=65535 Len=1460 [TCP segment of a reassembled PDU]
136,128.31.0.39,192.168.56.101,TLSv1.2,Application Data [TCP segment of a reassembled PDU]
137,192.168.56.101,128.31.0.39,TCP,49231  >  9101 [ACK] Seq=3035 Ack=99230 Win=20629 Len=0
138,128.31.0.39,192.168.56.101,TCP,9101  >  49231 [ACK] Seq=99230 Ack=3035 Win=65535 Len=1460 [TCP segment of a reassembled PDU]
139,128.31.0.39,192.168.56.101,TCP,9101  >  49231 [ACK] Seq=100690 Ack=3035 Win=65535 Len=1460 [TCP segment of a reassembled PDU]
140,128.31.0.39,192.168.56.101,TLSv1.2,Application Data [TCP segment of a reassembled PDU]
141,128.31.0.39,192.168.56.101,TCP,"9101  >  49231 [PSH, ACK] Seq=103610 Ack=3035 Win=65535 Len=1460 [TCP segment of a reassembled PDU]"
142,192.168.56.101,128.31.0.39,TCP,49231  >  9101 [ACK] Seq=3035 Ack=105070 Win=14789 Len=0
143,192.168.56.101,128.31.0.39,TCP,[TCP Window Update] 49231  >  9101 [ACK] Seq=3035 Ack=105070 Win=18261 Len=0
144,192.168.56.101,128.31.0.39,TCP,[TCP Window Update] 49231  >  9101 [ACK] Seq=3035 Ack=105070 Win=64240 Len=0
145,192.168.56.101,128.31.0.39,TLSv1.2,Application Data
146,128.31.0.39,192.168.56.101,TCP,9101  >  49231 [ACK] Seq=105070 Ack=4092 Win=65535 Len=0
147,128.31.0.39,192.168.56.101,TLSv1.2,Application Data [TCP segment of a reassembled PDU]
148,128.31.0.39,192.168.56.101,TCP,9101  >  49231 [ACK] Seq=106530 Ack=4092 Win=65535 Len=1460 [TCP segment of a reassembled PDU]
149,128.31.0.39,192.168.56.101,TCP,9101  >  49231 [ACK] Seq=107990 Ack=4092 Win=65535 Len=1460 [TCP segment of a reassembled PDU]
150,128.31.0.39,192.168.56.101,TLSv1.2,Application Data [TCP segment of a reassembled PDU]
151,128.31.0.39,192.168.56.101,TLSv1.2,Application Data [TCP segment of a reassembled PDU]
152,128.31.0.39,192.168.56.101,TCP,"9101  >  49231 [PSH, ACK] Seq=112370 Ack=4092 Win=65535 Len=1460 [TCP segment of a reassembled PDU]"
153,192.168.56.101,128.31.0.39,TCP,49231  >  9101 [ACK] Seq=4092 Ack=113830 Win=55480 Len=0
154,128.31.0.39,192.168.56.101,TCP,9101  >  49231 [ACK] Seq=113830 Ack=4092 Win=65535 Len=1460 [TCP segment of a reassembled PDU]
155,128.31.0.39,192.168.56.101,TLSv1.2,Application Data [TCP segment of a reassembled PDU]
156,128.31.0.39,192.168.56.101,TLSv1.2,Application Data [TCP segment of a reassembled PDU]
157,128.31.0.39,192.168.56.101,TLSv1.2,Application Data [TCP segment of a reassembled PDU]
158,128.31.0.39,192.168.56.101,TCP,"9101  >  49231 [PSH, ACK] Seq=119670 Ack=4092 Win=65535 Len=1460 [TCP segment of a reassembled PDU]"
159,192.168.56.101,128.31.0.39,TCP,49231  >  9101 [ACK] Seq=4092 Ack=121130 Win=48180 Len=0
160,128.31.0.39,192.168.56.101,TCP,9101  >  49231 [ACK] Seq=121130 Ack=4092 Win=65535 Len=1460 [TCP segment of a reassembled PDU]
161,128.31.0.39,192.168.56.101,TLSv1.2,Application Data [TCP segment of a reassembled PDU]
162,128.31.0.39,192.168.56.101,TCP,9101  >  49231 [ACK] Seq=124050 Ack=4092 Win=65535 Len=1460 [TCP segment of a reassembled PDU]
163,128.31.0.39,192.168.56.101,TCP,9101  >  49231 [ACK] Seq=125510 Ack=4092 Win=65535 Len=1460 [TCP segment of a reassembled PDU]
164,128.31.0.39,192.168.56.101,TLSv1.2,Application Data [TCP segment of a reassembled PDU]
165,192.168.56.101,128.31.0.39,TCP,49231  >  9101 [ACK] Seq=4092 Ack=128430 Win=40880 Len=0
166,128.31.0.39,192.168.56.101,TCP,9101  >  49231 [ACK] Seq=128430 Ack=4092 Win=65535 Len=1460 [TCP segment of a reassembled PDU]
167,128.31.0.39,192.168.56.101,TCP,9101  >  49231 [ACK] Seq=129890 Ack=4092 Win=65535 Len=1460 [TCP segment of a reassembled PDU]
168,128.31.0.39,192.168.56.101,TLSv1.2,Application Data [TCP segment of a reassembled PDU]
169,128.31.0.39,192.168.56.101,TCP,"9101  >  49231 [PSH, ACK] Seq=132810 Ack=4092 Win=65535 Len=1460 [TCP segment of a reassembled PDU]"
170,192.168.56.101,128.31.0.39,TCP,49231  >  9101 [ACK] Seq=4092 Ack=134270 Win=35040 Len=0
171,128.31.0.39,192.168.56.101,TCP,9101  >  49231 [ACK] Seq=134270 Ack=4092 Win=65535 Len=1460 [TCP segment of a reassembled PDU]
172,128.31.0.39,192.168.56.101,TLSv1.2,"Application Data, Application Data"
173,128.31.0.39,192.168.56.101,TCP,9101  >  49231 [ACK] Seq=137190 Ack=4092 Win=65535 Len=1460 [TCP segment of a reassembled PDU]
174,128.31.0.39,192.168.56.101,TLSv1.2,Application Data [TCP segment of a reassembled PDU]
175,128.31.0.39,192.168.56.101,TCP,9101  >  49231 [ACK] Seq=140110 Ack=4092 Win=65535 Len=1460 [TCP segment of a reassembled PDU]
176,128.31.0.39,192.168.56.101,TCP,"9101  >  49231 [PSH, ACK] Seq=141570 Ack=4092 Win=65535 Len=1460 [TCP segment of a reassembled PDU]"
177,192.168.56.101,128.31.0.39,TCP,49231  >  9101 [ACK] Seq=4092 Ack=143030 Win=26280 Len=0
178,128.31.0.39,192.168.56.101,TLSv1.2,"Application Data, Application Data"
179,128.31.0.39,192.168.56.101,TLSv1.2,Application Data [TCP segment of a reassembled PDU]
180,128.31.0.39,192.168.56.101,TCP,9101  >  49231 [ACK] Seq=145950 Ack=4092 Win=65535 Len=1460 [TCP segment of a reassembled PDU]
181,128.31.0.39,192.168.56.101,TCP,9101  >  49231 [ACK] Seq=147410 Ack=4092 Win=65535 Len=1460 [TCP segment of a reassembled PDU]
182,128.31.0.39,192.168.56.101,TLSv1.2,Application Data [TCP segment of a reassembled PDU]
183,192.168.56.101,128.31.0.39,TCP,49231  >  9101 [ACK] Seq=4092 Ack=150330 Win=18980 Len=0
184,128.31.0.39,192.168.56.101,TCP,9101  >  49231 [ACK] Seq=150330 Ack=4092 Win=65535 Len=1460 [TCP segment of a reassembled PDU]
185,128.31.0.39,192.168.56.101,TCP,9101  >  49231 [ACK] Seq=151790 Ack=4092 Win=65535 Len=1460 [TCP segment of a reassembled PDU]
186,128.31.0.39,192.168.56.101,TLSv1.2,Application Data [TCP segment of a reassembled PDU]
187,128.31.0.39,192.168.56.101,TCP,9101  >  49231 [ACK] Seq=154710 Ack=4092 Win=65535 Len=1460 [TCP segment of a reassembled PDU]
188,128.31.0.39,192.168.56.101,TCP,9101  >  49231 [ACK] Seq=156170 Ack=4092 Win=65535 Len=1460 [TCP segment of a reassembled PDU]
189,128.31.0.39,192.168.56.101,TLSv1.2,Application Data [TCP segment of a reassembled PDU]
190,192.168.56.101,128.31.0.39,TCP,49231  >  9101 [ACK] Seq=4092 Ack=159090 Win=10220 Len=0
191,128.31.0.39,192.168.56.101,TCP,9101  >  49231 [ACK] Seq=159090 Ack=4092 Win=65535 Len=1460 [TCP segment of a reassembled PDU]
192,128.31.0.39,192.168.56.101,TLSv1.2,"Application Data, Application Data"
193,128.31.0.39,192.168.56.101,TLSv1.2,"Application Data, Application Data"
194,128.31.0.39,192.168.56.101,TCP,9101  >  49231 [ACK] Seq=163470 Ack=4092 Win=65535 Len=1460 [TCP segment of a reassembled PDU]
195,128.31.0.39,192.168.56.101,TCP,"9101  >  49231 [PSH, ACK] Seq=164930 Ack=4092 Win=65535 Len=1460 [TCP segment of a reassembled PDU]"
196,192.168.56.101,128.31.0.39,TCP,49231  >  9101 [ACK] Seq=4092 Ack=166390 Win=2920 Len=0
197,128.31.0.39,192.168.56.101,TLSv1.2,Application Data [TCP segment of a reassembled PDU]
198,128.31.0.39,192.168.56.101,TCP,[TCP Window Full] 9101  >  49231 [ACK] Seq=167850 Ack=4092 Win=65535 Len=1460 [TCP segment of a reassembled PDU]
199,192.168.56.101,128.31.0.39,TCP,[TCP ZeroWindow] 49231  >  9101 [ACK] Seq=4092 Ack=169310 Win=0 Len=0
200,192.168.56.101,128.31.0.39,TLSv1.2,"[TCP ZeroWindow] , Application Data"
201,128.31.0.39,192.168.56.101,TCP,9101  >  49231 [ACK] Seq=169310 Ack=4635 Win=65535 Len=0
202,192.168.56.101,128.31.0.39,TCP,[TCP Window Update] 49231  >  9101 [ACK] Seq=4635 Ack=169310 Win=3472 Len=0
203,128.31.0.39,192.168.56.101,TCP,9101  >  49231 [ACK] Seq=169310 Ack=4635 Win=65535 Len=1460 [TCP segment of a reassembled PDU]
204,128.31.0.39,192.168.56.101,TLSv1.2,Application Data [TCP segment of a reassembled PDU]
205,192.168.56.101,128.31.0.39,TCP,49231  >  9101 [ACK] Seq=4635 Ack=172230 Win=552 Len=0
206,192.168.56.101,128.31.0.39,TCP,[TCP Window Update] 49231  >  9101 [ACK] Seq=4635 Ack=172230 Win=61320 Len=0
207,128.31.0.39,192.168.56.101,TCP,9101  >  49231 [ACK] Seq=172230 Ack=4635 Win=65535 Len=1460 [TCP segment of a reassembled PDU]
208,128.31.0.39,192.168.56.101,TCP,9101  >  49231 [ACK] Seq=173690 Ack=4635 Win=65535 Len=1460 [TCP segment of a reassembled PDU]
209,128.31.0.39,192.168.56.101,TLSv1.2,Application Data [TCP segment of a reassembled PDU]
210,128.31.0.39,192.168.56.101,TCP,9101  >  49231 [ACK] Seq=176610 Ack=4635 Win=65535 Len=1460 [TCP segment of a reassembled PDU]
211,128.31.0.39,192.168.56.101,TLSv1.2,Application Data [TCP segment of a reassembled PDU]
212,128.31.0.39,192.168.56.101,TLSv1.2,Application Data [TCP segment of a reassembled PDU]
213,128.31.0.39,192.168.56.101,TCP,9101  >  49231 [ACK] Seq=180990 Ack=4635 Win=65535 Len=1460 [TCP segment of a reassembled PDU]
214,128.31.0.39,192.168.56.101,TLSv1.2,Application Data [TCP segment of a reassembled PDU]
215,128.31.0.39,192.168.56.101,TCP,9101  >  49231 [ACK] Seq=183910 Ack=4635 Win=65535 Len=1460 [TCP segment of a reassembled PDU]
216,128.31.0.39,192.168.56.101,TCP,9101  >  49231 [ACK] Seq=185370 Ack=4635 Win=65535 Len=1460 [TCP segment of a reassembled PDU]
217,128.31.0.39,192.168.56.101,TLSv1.2,Application Data [TCP segment of a reassembled PDU]
218,128.31.0.39,192.168.56.101,TCP,9101  >  49231 [ACK] Seq=188290 Ack=4635 Win=65535 Len=1460 [TCP segment of a reassembled PDU]
219,128.31.0.39,192.168.56.101,TCP,9101  >  49231 [ACK] Seq=189750 Ack=4635 Win=65535 Len=1460 [TCP segment of a reassembled PDU]
220,128.31.0.39,192.168.56.101,TLSv1.2,Application Data [TCP segment of a reassembled PDU]
221,128.31.0.39,192.168.56.101,TCP,9101  >  49231 [ACK] Seq=192670 Ack=4635 Win=65535 Len=1460 [TCP segment of a reassembled PDU]
222,128.31.0.39,192.168.56.101,TCP,9101  >  49231 [ACK] Seq=194130 Ack=4635 Win=65535 Len=1460 [TCP segment of a reassembled PDU]
223,128.31.0.39,192.168.56.101,TLSv1.2,"Application Data, Application Data"
224,128.31.0.39,192.168.56.101,TCP,9101  >  49231 [ACK] Seq=197050 Ack=4635 Win=65535 Len=1460 [TCP segment of a reassembled PDU]
225,128.31.0.39,192.168.56.101,TLSv1.2,Application Data [TCP segment of a reassembled PDU]
226,128.31.0.39,192.168.56.101,TCP,9101  >  49231 [ACK] Seq=199970 Ack=4635 Win=65535 Len=1460 [TCP segment of a reassembled PDU]
227,128.31.0.39,192.168.56.101,TCP,9101  >  49231 [ACK] Seq=201430 Ack=4635 Win=65535 Len=1460 [TCP segment of a reassembled PDU]
228,128.31.0.39,192.168.56.101,TLSv1.2,Application Data [TCP segment of a reassembled PDU]
229,128.31.0.39,192.168.56.101,TCP,9101  >  49231 [ACK] Seq=204350 Ack=4635 Win=65535 Len=1460 [TCP segment of a reassembled PDU]
230,128.31.0.39,192.168.56.101,TCP,9101  >  49231 [ACK] Seq=205810 Ack=4635 Win=65535 Len=1460 [TCP segment of a reassembled PDU]
231,128.31.0.39,192.168.56.101,TLSv1.2,Application Data [TCP segment of a reassembled PDU]
232,128.31.0.39,192.168.56.101,TCP,9101  >  49231 [ACK] Seq=208730 Ack=4635 Win=65535 Len=1460 [TCP segment of a reassembled PDU]
233,128.31.0.39,192.168.56.101,TCP,9101  >  49231 [ACK] Seq=210190 Ack=4635 Win=65535 Len=1460 [TCP segment of a reassembled PDU]
234,128.31.0.39,192.168.56.101,TLSv1.2,"Application Data, Application Data"
235,128.31.0.39,192.168.56.101,TCP,9101  >  49231 [ACK] Seq=213110 Ack=4635 Win=65535 Len=1460 [TCP segment of a reassembled PDU]
236,128.31.0.39,192.168.56.101,TCP,9101  >  49231 [ACK] Seq=214570 Ack=4635 Win=65535 Len=1460 [TCP segment of a reassembled PDU]
237,128.31.0.39,192.168.56.101,TLSv1.2,Application Data [TCP segment of a reassembled PDU]
238,128.31.0.39,192.168.56.101,TCP,9101  >  49231 [ACK] Seq=217490 Ack=4635 Win=65535 Len=1460 [TCP segment of a reassembled PDU]
239,128.31.0.39,192.168.56.101,TLSv1.2,Application Data [TCP segment of a reassembled PDU]
240,128.31.0.39,192.168.56.101,TCP,9101  >  49231 [ACK] Seq=220410 Ack=4635 Win=65535 Len=1460 [TCP segment of a reassembled PDU]
241,128.31.0.39,192.168.56.101,TCP,9101  >  49231 [ACK] Seq=221870 Ack=4635 Win=65535 Len=1460 [TCP segment of a reassembled PDU]
242,128.31.0.39,192.168.56.101,TLSv1.2,Application Data [TCP segment of a reassembled PDU]
243,128.31.0.39,192.168.56.101,TCP,9101  >  49231 [ACK] Seq=224790 Ack=4635 Win=65535 Len=1460 [TCP segment of a reassembled PDU]
244,128.31.0.39,192.168.56.101,TCP,9101  >  49231 [ACK] Seq=226250 Ack=4635 Win=65535 Len=1460 [TCP segment of a reassembled PDU]
245,128.31.0.39,192.168.56.101,TLSv1.2,Application Data [TCP segment of a reassembled PDU]
246,192.168.56.101,128.31.0.39,TCP,49231  >  9101 [ACK] Seq=4635 Ack=218950 Win=14600 Len=0
247,128.31.0.39,192.168.56.101,TLSv1.2,Application Data [TCP segment of a reassembled PDU]
248,128.31.0.39,192.168.56.101,TCP,9101  >  49231 [ACK] Seq=230630 Ack=4635 Win=65535 Len=1460 [TCP segment of a reassembled PDU]
249,128.31.0.39,192.168.56.101,TLSv1.2,"[TCP Window Full] , Application Data [TCP segment of a reassembled PDU]"
250,192.168.56.101,128.31.0.39,TCP,49231  >  9101 [ACK] Seq=4635 Ack=229170 Win=4380 Len=0
251,192.168.56.101,128.31.0.39,TCP,[TCP ZeroWindow] 49231  >  9101 [ACK] Seq=4635 Ack=233550 Win=0 Len=0
252,192.168.56.101,128.31.0.39,TLSv1.2,"[TCP ZeroWindow] , Application Data"
253,128.31.0.39,192.168.56.101,TCP,9101  >  49231 [ACK] Seq=233550 Ack=5692 Win=65535 Len=0
254,192.168.56.101,128.31.0.39,TLSv1.2,"[TCP ZeroWindow] , Application Data"
255,128.31.0.39,192.168.56.101,TCP,9101  >  49231 [ACK] Seq=233550 Ack=6235 Win=65535 Len=0
256,192.168.56.101,128.31.0.39,TCP,[TCP Window Update] 49231  >  9101 [ACK] Seq=6235 Ack=233550 Win=3472 Len=0
257,128.31.0.39,192.168.56.101,TCP,9101  >  49231 [ACK] Seq=233550 Ack=6235 Win=65535 Len=1460 [TCP segment of a reassembled PDU]
258,128.31.0.39,192.168.56.101,TCP,9101  >  49231 [ACK] Seq=235010 Ack=6235 Win=65535 Len=1460 [TCP segment of a reassembled PDU]
259,192.168.56.101,128.31.0.39,TCP,49231  >  9101 [ACK] Seq=6235 Ack=236470 Win=552 Len=0
260,192.168.56.101,128.31.0.39,TLSv1.2,Application Data
261,128.31.0.39,192.168.56.101,TLSv1.2,"[TCP Window Full] , Application Data [TCP segment of a reassembled PDU]"
262,192.168.56.101,128.31.0.39,TCP,49231  >  9101 [ACK] Seq=7292 Ack=237022 Win=60768 Len=0
263,128.31.0.39,192.168.56.101,TCP,9101  >  49231 [ACK] Seq=237022 Ack=7292 Win=65535 Len=1460 [TCP segment of a reassembled PDU]
264,128.31.0.39,192.168.56.101,TCP,9101  >  49231 [ACK] Seq=238482 Ack=7292 Win=65535 Len=1460 [TCP segment of a reassembled PDU]
265,128.31.0.39,192.168.56.101,TLSv1.2,Application Data [TCP segment of a reassembled PDU]
266,128.31.0.39,192.168.56.101,TLSv1.2,Application Data [TCP segment of a reassembled PDU]
267,128.31.0.39,192.168.56.101,TCP,9101  >  49231 [ACK] Seq=242862 Ack=7292 Win=65535 Len=1460 [TCP segment of a reassembled PDU]
268,128.31.0.39,192.168.56.101,TCP,9101  >  49231 [ACK] Seq=244322 Ack=7292 Win=65535 Len=1460 [TCP segment of a reassembled PDU]
269,128.31.0.39,192.168.56.101,TLSv1.2,Application Data [TCP segment of a reassembled PDU]
270,128.31.0.39,192.168.56.101,TCP,9101  >  49231 [ACK] Seq=247242 Ack=7292 Win=65535 Len=1460 [TCP segment of a reassembled PDU]
271,128.31.0.39,192.168.56.101,TLSv1.2,Application Data [TCP segment of a reassembled PDU]
272,128.31.0.39,192.168.56.101,TCP,9101  >  49231 [ACK] Seq=250162 Ack=7292 Win=65535 Len=1460 [TCP segment of a reassembled PDU]
273,128.31.0.39,192.168.56.101,TLSv1.2,Application Data [TCP segment of a reassembled PDU]
274,128.31.0.39,192.168.56.101,TCP,9101  >  49231 [ACK] Seq=253082 Ack=7292 Win=65535 Len=1460 [TCP segment of a reassembled PDU]
275,128.31.0.39,192.168.56.101,TLSv1.2,Application Data [TCP segment of a reassembled PDU]
276,128.31.0.39,192.168.56.101,TCP,9101  >  49231 [ACK] Seq=256002 Ack=7292 Win=65535 Len=1460 [TCP segment of a reassembled PDU]
277,128.31.0.39,192.168.56.101,TCP,9101  >  49231 [ACK] Seq=257462 Ack=7292 Win=65535 Len=1460 [TCP segment of a reassembled PDU]
278,128.31.0.39,192.168.56.101,TLSv1.2,Application Data [TCP segment of a reassembled PDU]
279,128.31.0.39,192.168.56.101,TLSv1.2,Application Data [TCP segment of a reassembled PDU]
280,128.31.0.39,192.168.56.101,TCP,9101  >  49231 [ACK] Seq=261842 Ack=7292 Win=65535 Len=1460 [TCP segment of a reassembled PDU]
281,128.31.0.39,192.168.56.101,TCP,9101  >  49231 [ACK] Seq=263302 Ack=7292 Win=65535 Len=1460 [TCP segment of a reassembled PDU]
282,128.31.0.39,192.168.56.101,TLSv1.2,Application Data [TCP segment of a reassembled PDU]
283,128.31.0.39,192.168.56.101,TLSv1.2,Application Data [TCP segment of a reassembled PDU]
284,128.31.0.39,192.168.56.101,TCP,9101  >  49231 [ACK] Seq=267682 Ack=7292 Win=65535 Len=1460 [TCP segment of a reassembled PDU]
285,128.31.0.39,192.168.56.101,TCP,9101  >  49231 [ACK] Seq=269142 Ack=7292 Win=65535 Len=1460 [TCP segment of a reassembled PDU]
286,128.31.0.39,192.168.56.101,TLSv1.2,Application Data [TCP segment of a reassembled PDU]
287,128.31.0.39,192.168.56.101,TCP,9101  >  49231 [ACK] Seq=272062 Ack=7292 Win=65535 Len=1460 [TCP segment of a reassembled PDU]
288,128.31.0.39,192.168.56.101,TLSv1.2,Application Data [TCP segment of a reassembled PDU]
289,128.31.0.39,192.168.56.101,TCP,9101  >  49231 [ACK] Seq=274982 Ack=7292 Win=65535 Len=1460 [TCP segment of a reassembled PDU]
290,128.31.0.39,192.168.56.101,TCP,9101  >  49231 [ACK] Seq=276442 Ack=7292 Win=65535 Len=1460 [TCP segment of a reassembled PDU]
291,128.31.0.39,192.168.56.101,TLSv1.2,Application Data [TCP segment of a reassembled PDU]
292,128.31.0.39,192.168.56.101,TCP,9101  >  49231 [ACK] Seq=279362 Ack=7292 Win=65535 Len=1460 [TCP segment of a reassembled PDU]
293,128.31.0.39,192.168.56.101,TCP,9101  >  49231 [ACK] Seq=280822 Ack=7292 Win=65535 Len=1460 [TCP segment of a reassembled PDU]
294,128.31.0.39,192.168.56.101,TLSv1.2,"Application Data, Application Data"
295,128.31.0.39,192.168.56.101,TCP,9101  >  49231 [ACK] Seq=283742 Ack=7292 Win=65535 Len=1460 [TCP segment of a reassembled PDU]
296,128.31.0.39,192.168.56.101,TCP,9101  >  49231 [ACK] Seq=285202 Ack=7292 Win=65535 Len=1460 [TCP segment of a reassembled PDU]
297,128.31.0.39,192.168.56.101,TLSv1.2,Application Data [TCP segment of a reassembled PDU]
298,128.31.0.39,192.168.56.101,TCP,9101  >  49231 [ACK] Seq=288122 Ack=7292 Win=65535 Len=1460 [TCP segment of a reassembled PDU]
299,128.31.0.39,192.168.56.101,TLSv1.2,Application Data [TCP segment of a reassembled PDU]
300,128.31.0.39,192.168.56.101,TCP,9101  >  49231 [ACK] Seq=291042 Ack=7292 Win=65535 Len=1460 [TCP segment of a reassembled PDU]
301,128.31.0.39,192.168.56.101,TLSv1.2,Application Data [TCP segment of a reassembled PDU]
302,128.31.0.39,192.168.56.101,TLSv1.2,Application Data [TCP segment of a reassembled PDU]
303,128.31.0.39,192.168.56.101,TCP,9101  >  49231 [ACK] Seq=295422 Ack=7292 Win=65535 Len=1460 [TCP segment of a reassembled PDU]
304,192.168.56.101,128.31.0.39,TCP,49231  >  9101 [ACK] Seq=7292 Ack=283742 Win=14048 Len=0
305,192.168.56.101,128.31.0.39,TCP,49231  >  9101 [ACK] Seq=7292 Ack=296882 Win=908 Len=0
306,192.168.56.101,128.31.0.39,TLSv1.2,Application Data
307,128.31.0.39,192.168.56.101,TCP,[TCP Window Full] 9101  >  49231 [ACK] Seq=296882 Ack=7835 Win=65535 Len=908 [TCP segment of a reassembled PDU]
308,192.168.56.101,128.31.0.39,TLSv1.2,"[TCP ZeroWindow] , Application Data"
309,128.31.0.39,192.168.56.101,TCP,9101  >  49231 [ACK] Seq=297790 Ack=8892 Win=65535 Len=0
310,192.168.56.101,128.31.0.39,TCP,[TCP Window Update] 49231  >  9101 [ACK] Seq=8892 Ack=297790 Win=3472 Len=0
311,128.31.0.39,192.168.56.101,TCP,9101  >  49231 [ACK] Seq=297790 Ack=8892 Win=65535 Len=1460 [TCP segment of a reassembled PDU]
312,128.31.0.39,192.168.56.101,TLSv1.2,Application Data [TCP segment of a reassembled PDU]
313,192.168.56.101,128.31.0.39,TCP,49231  >  9101 [ACK] Seq=8892 Ack=300710 Win=552 Len=0
314,192.168.56.101,128.31.0.39,TCP,[TCP Window Update] 49231  >  9101 [ACK] Seq=8892 Ack=300710 Win=61320 Len=0
315,128.31.0.39,192.168.56.101,TCP,9101  >  49231 [ACK] Seq=300710 Ack=8892 Win=65535 Len=1460 [TCP segment of a reassembled PDU]
316,128.31.0.39,192.168.56.101,TLSv1.2,Application Data [TCP segment of a reassembled PDU]
317,128.31.0.39,192.168.56.101,TLSv1.2,Application Data [TCP segment of a reassembled PDU]
318,128.31.0.39,192.168.56.101,TCP,9101  >  49231 [ACK] Seq=305090 Ack=8892 Win=65535 Len=1460 [TCP segment of a reassembled PDU]
319,128.31.0.39,192.168.56.101,TCP,9101  >  49231 [ACK] Seq=306550 Ack=8892 Win=65535 Len=1460 [TCP segment of a reassembled PDU]
320,128.31.0.39,192.168.56.101,TLSv1.2,Application Data [TCP segment of a reassembled PDU]
321,128.31.0.39,192.168.56.101,TCP,9101  >  49231 [ACK] Seq=309470 Ack=8892 Win=65535 Len=1460 [TCP segment of a reassembled PDU]
322,128.31.0.39,192.168.56.101,TCP,9101  >  49231 [ACK] Seq=310930 Ack=8892 Win=65535 Len=1460 [TCP segment of a reassembled PDU]
323,128.31.0.39,192.168.56.101,TLSv1.2,Application Data [TCP segment of a reassembled PDU]
324,128.31.0.39,192.168.56.101,TCP,9101  >  49231 [ACK] Seq=313850 Ack=8892 Win=65535 Len=1460 [TCP segment of a reassembled PDU]
325,128.31.0.39,192.168.56.101,TLSv1.2,Application Data [TCP segment of a reassembled PDU]
326,128.31.0.39,192.168.56.101,TCP,9101  >  49231 [ACK] Seq=316770 Ack=8892 Win=65535 Len=1460 [TCP segment of a reassembled PDU]
327,128.31.0.39,192.168.56.101,TLSv1.2,Application Data [TCP segment of a reassembled PDU]
328,128.31.0.39,192.168.56.101,TCP,9101  >  49231 [ACK] Seq=319690 Ack=8892 Win=65535 Len=1460 [TCP segment of a reassembled PDU]
329,128.31.0.39,192.168.56.101,TLSv1.2,Application Data [TCP segment of a reassembled PDU]
330,128.31.0.39,192.168.56.101,TCP,9101  >  49231 [ACK] Seq=322610 Ack=8892 Win=65535 Len=1460 [TCP segment of a reassembled PDU]
331,128.31.0.39,192.168.56.101,TCP,9101  >  49231 [ACK] Seq=324070 Ack=8892 Win=65535 Len=1460 [TCP segment of a reassembled PDU]
332,128.31.0.39,192.168.56.101,TLSv1.2,Application Data [TCP segment of a reassembled PDU]
333,128.31.0.39,192.168.56.101,TCP,9101  >  49231 [ACK] Seq=326990 Ack=8892 Win=65535 Len=1460 [TCP segment of a reassembled PDU]
334,128.31.0.39,192.168.56.101,TCP,9101  >  49231 [ACK] Seq=328450 Ack=8892 Win=65535 Len=1460 [TCP segment of a reassembled PDU]
335,128.31.0.39,192.168.56.101,TLSv1.2,Application Data [TCP segment of a reassembled PDU]
336,128.31.0.39,192.168.56.101,TCP,9101  >  49231 [ACK] Seq=331370 Ack=8892 Win=65535 Len=1460 [TCP segment of a reassembled PDU]
337,128.31.0.39,192.168.56.101,TLSv1.2,Application Data [TCP segment of a reassembled PDU]
338,128.31.0.39,192.168.56.101,TCP,9101  >  49231 [ACK] Seq=334290 Ack=8892 Win=65535 Len=1460 [TCP segment of a reassembled PDU]
339,128.31.0.39,192.168.56.101,TCP,9101  >  49231 [ACK] Seq=335750 Ack=8892 Win=65535 Len=1460 [TCP segment of a reassembled PDU]
340,128.31.0.39,192.168.56.101,TLSv1.2,"Application Data, Application Data"
341,128.31.0.39,192.168.56.101,TCP,9101  >  49231 [ACK] Seq=338670 Ack=8892 Win=65535 Len=1460 [TCP segment of a reassembled PDU]
342,128.31.0.39,192.168.56.101,TLSv1.2,Application Data [TCP segment of a reassembled PDU]
343,128.31.0.39,192.168.56.101,TCP,9101  >  49231 [ACK] Seq=341590 Ack=8892 Win=65535 Len=1460 [TCP segment of a reassembled PDU]
344,128.31.0.39,192.168.56.101,TCP,9101  >  49231 [ACK] Seq=343050 Ack=8892 Win=65535 Len=1460 [TCP segment of a reassembled PDU]
345,128.31.0.39,192.168.56.101,TLSv1.2,Application Data [TCP segment of a reassembled PDU]
346,128.31.0.39,192.168.56.101,TCP,9101  >  49231 [ACK] Seq=345970 Ack=8892 Win=65535 Len=1460 [TCP segment of a reassembled PDU]
347,128.31.0.39,192.168.56.101,TCP,9101  >  49231 [ACK] Seq=347430 Ack=8892 Win=65535 Len=1460 [TCP segment of a reassembled PDU]
348,128.31.0.39,192.168.56.101,TLSv1.2,Application Data [TCP segment of a reassembled PDU]
349,128.31.0.39,192.168.56.101,TCP,9101  >  49231 [ACK] Seq=350350 Ack=8892 Win=65535 Len=1460 [TCP segment of a reassembled PDU]
350,128.31.0.39,192.168.56.101,TCP,9101  >  49231 [ACK] Seq=351810 Ack=8892 Win=65535 Len=1460 [TCP segment of a reassembled PDU]
351,128.31.0.39,192.168.56.101,TLSv1.2,Application Data [TCP segment of a reassembled PDU]
352,128.31.0.39,192.168.56.101,TCP,9101  >  49231 [ACK] Seq=354730 Ack=8892 Win=65535 Len=1460 [TCP segment of a reassembled PDU]
353,128.31.0.39,192.168.56.101,TCP,9101  >  49231 [ACK] Seq=356190 Ack=8892 Win=65535 Len=1460 [TCP segment of a reassembled PDU]
354,128.31.0.39,192.168.56.101,TLSv1.2,"Application Data, Application Data"
355,128.31.0.39,192.168.56.101,TCP,9101  >  49231 [ACK] Seq=359110 Ack=8892 Win=65535 Len=1460 [TCP segment of a reassembled PDU]
356,128.31.0.39,192.168.56.101,TLSv1.2,"[TCP Window Full] , Application Data [TCP segment of a reassembled PDU]"
357,192.168.56.101,128.31.0.39,TCP,49231  >  9101 [ACK] Seq=8892 Ack=347430 Win=14600 Len=0
358,192.168.56.101,128.31.0.39,TCP,[TCP ZeroWindow] 49231  >  9101 [ACK] Seq=8892 Ack=362030 Win=0 Len=0
359,192.168.56.101,128.31.0.39,TLSv1.2,"[TCP ZeroWindow] , Application Data"
360,128.31.0.39,192.168.56.101,TCP,9101  >  49231 [ACK] Seq=362030 Ack=9435 Win=65535 Len=0
361,192.168.56.101,128.31.0.39,TLSv1.2,"[TCP ZeroWindow] , Application Data"
362,128.31.0.39,192.168.56.101,TCP,9101  >  49231 [ACK] Seq=362030 Ack=10492 Win=65535 Len=0
363,192.168.56.101,128.31.0.39,TCP,[TCP Window Update] 49231  >  9101 [ACK] Seq=10492 Ack=362030 Win=3472 Len=0
364,128.31.0.39,192.168.56.101,TCP,9101  >  49231 [ACK] Seq=362030 Ack=10492 Win=65535 Len=1460 [TCP segment of a reassembled PDU]
365,128.31.0.39,192.168.56.101,TCP,9101  >  49231 [ACK] Seq=363490 Ack=10492 Win=65535 Len=1460 [TCP segment of a reassembled PDU]
366,192.168.56.101,128.31.0.39,TCP,49231  >  9101 [ACK] Seq=10492 Ack=364950 Win=552 Len=0
367,192.168.56.101,128.31.0.39,TCP,[TCP Window Update] 49231  >  9101 [ACK] Seq=10492 Ack=364950 Win=61320 Len=0
368,128.31.0.39,192.168.56.101,TLSv1.2,Application Data [TCP segment of a reassembled PDU]
369,128.31.0.39,192.168.56.101,TLSv1.2,Application Data [TCP segment of a reassembled PDU]
370,128.31.0.39,192.168.56.101,TCP,9101  >  49231 [ACK] Seq=367870 Ack=10492 Win=65535 Len=1460 [TCP segment of a reassembled PDU]
371,128.31.0.39,192.168.56.101,TCP,9101  >  49231 [ACK] Seq=369330 Ack=10492 Win=65535 Len=1460 [TCP segment of a reassembled PDU]
372,128.31.0.39,192.168.56.101,TLSv1.2,Application Data [TCP segment of a reassembled PDU]
373,128.31.0.39,192.168.56.101,TCP,9101  >  49231 [ACK] Seq=372250 Ack=10492 Win=65535 Len=1460 [TCP segment of a reassembled PDU]
374,128.31.0.39,192.168.56.101,TCP,9101  >  49231 [ACK] Seq=373710 Ack=10492 Win=65535 Len=1460 [TCP segment of a reassembled PDU]
375,128.31.0.39,192.168.56.101,TLSv1.2,Application Data [TCP segment of a reassembled PDU]
376,128.31.0.39,192.168.56.101,TCP,9101  >  49231 [ACK] Seq=376630 Ack=10492 Win=65535 Len=1460 [TCP segment of a reassembled PDU]
377,128.31.0.39,192.168.56.101,TCP,9101  >  49231 [ACK] Seq=378090 Ack=10492 Win=65535 Len=1460 [TCP segment of a reassembled PDU]
378,128.31.0.39,192.168.56.101,TLSv1.2,Application Data [TCP segment of a reassembled PDU]
379,128.31.0.39,192.168.56.101,TCP,9101  >  49231 [ACK] Seq=381010 Ack=10492 Win=65535 Len=1460 [TCP segment of a reassembled PDU]
380,128.31.0.39,192.168.56.101,TLSv1.2,Application Data [TCP segment of a reassembled PDU]
381,128.31.0.39,192.168.56.101,TLSv1.2,Application Data [TCP segment of a reassembled PDU]
382,128.31.0.39,192.168.56.101,TCP,9101  >  49231 [ACK] Seq=385390 Ack=10492 Win=65535 Len=1460 [TCP segment of a reassembled PDU]
383,128.31.0.39,192.168.56.101,TLSv1.2,Application Data [TCP segment of a reassembled PDU]
384,128.31.0.39,192.168.56.101,TCP,9101  >  49231 [ACK] Seq=388310 Ack=10492 Win=65535 Len=1460 [TCP segment of a reassembled PDU]
385,128.31.0.39,192.168.56.101,TCP,9101  >  49231 [ACK] Seq=389770 Ack=10492 Win=65535 Len=1460 [TCP segment of a reassembled PDU]
386,128.31.0.39,192.168.56.101,TLSv1.2,Application Data [TCP segment of a reassembled PDU]
387,128.31.0.39,192.168.56.101,TLSv1.2,Application Data [TCP segment of a reassembled PDU]
388,128.31.0.39,192.168.56.101,TCP,9101  >  49231 [ACK] Seq=394150 Ack=10492 Win=65535 Len=1460 [TCP segment of a reassembled PDU]
389,128.31.0.39,192.168.56.101,TCP,9101  >  49231 [ACK] Seq=395610 Ack=10492 Win=65535 Len=1460 [TCP segment of a reassembled PDU]
390,128.31.0.39,192.168.56.101,TLSv1.2,Application Data [TCP segment of a reassembled PDU]
391,128.31.0.39,192.168.56.101,TCP,9101  >  49231 [ACK] Seq=398530 Ack=10492 Win=65535 Len=1460 [TCP segment of a reassembled PDU]
392,128.31.0.39,192.168.56.101,TLSv1.2,Application Data [TCP segment of a reassembled PDU]
393,128.31.0.39,192.168.56.101,TCP,9101  >  49231 [ACK] Seq=401450 Ack=10492 Win=65535 Len=1460 [TCP segment of a reassembled PDU]
394,128.31.0.39,192.168.56.101,TCP,9101  >  49231 [ACK] Seq=402910 Ack=10492 Win=65535 Len=1460 [TCP segment of a reassembled PDU]
395,128.31.0.39,192.168.56.101,TLSv1.2,Application Data [TCP segment of a reassembled PDU]
396,128.31.0.39,192.168.56.101,TCP,9101  >  49231 [ACK] Seq=405830 Ack=10492 Win=65535 Len=1460 [TCP segment of a reassembled PDU]
397,128.31.0.39,192.168.56.101,TCP,9101  >  49231 [ACK] Seq=407290 Ack=10492 Win=65535 Len=1460 [TCP segment of a reassembled PDU]
398,128.31.0.39,192.168.56.101,TLSv1.2,Application Data [TCP segment of a reassembled PDU]
399,128.31.0.39,192.168.56.101,TCP,9101  >  49231 [ACK] Seq=410210 Ack=10492 Win=65535 Len=1460 [TCP segment of a reassembled PDU]
400,128.31.0.39,192.168.56.101,TCP,9101  >  49231 [ACK] Seq=411670 Ack=10492 Win=65535 Len=1460 [TCP segment of a reassembled PDU]
401,128.31.0.39,192.168.56.101,TLSv1.2,Application Data [TCP segment of a reassembled PDU]
402,128.31.0.39,192.168.56.101,TCP,9101  >  49231 [ACK] Seq=414590 Ack=10492 Win=65535 Len=1460 [TCP segment of a reassembled PDU]
403,128.31.0.39,192.168.56.101,TLSv1.2,Application Data [TCP segment of a reassembled PDU]
404,128.31.0.39,192.168.56.101,TLSv1.2,Application Data [TCP segment of a reassembled PDU]
405,128.31.0.39,192.168.56.101,TLSv1.2,Application Data [TCP segment of a reassembled PDU]
406,128.31.0.39,192.168.56.101,TCP,9101  >  49231 [ACK] Seq=420430 Ack=10492 Win=65535 Len=1460 [TCP segment of a reassembled PDU]
407,128.31.0.39,192.168.56.101,TCP,9101  >  49231 [ACK] Seq=421890 Ack=10492 Win=65535 Len=1460 [TCP segment of a reassembled PDU]
408,128.31.0.39,192.168.56.101,TLSv1.2,Application Data [TCP segment of a reassembled PDU]
409,128.31.0.39,192.168.56.101,TCP,[TCP Window Full] 9101  >  49231 [ACK] Seq=424810 Ack=10492 Win=65535 Len=1460 [TCP segment of a reassembled PDU]
410,192.168.56.101,128.31.0.39,TCP,49231  >  9101 [ACK] Seq=10492 Ack=411670 Win=14600 Len=0
411,192.168.56.101,128.31.0.39,TCP,[TCP ZeroWindow] 49231  >  9101 [ACK] Seq=10492 Ack=426270 Win=0 Len=0
412,192.168.56.101,128.31.0.39,TLSv1.2,"[TCP ZeroWindow] , Application Data"
413,128.31.0.39,192.168.56.101,TCP,9101  >  49231 [ACK] Seq=426270 Ack=11035 Win=65535 Len=0
414,192.168.56.101,128.31.0.39,TLSv1.2,"[TCP ZeroWindow] , Application Data"
415,128.31.0.39,192.168.56.101,TCP,9101  >  49231 [ACK] Seq=426270 Ack=12092 Win=65535 Len=0
416,192.168.56.101,128.31.0.39,TLSv1.2,"[TCP ZeroWindow] , Application Data"
417,128.31.0.39,192.168.56.101,TCP,9101  >  49231 [ACK] Seq=426270 Ack=12635 Win=65535 Len=0
418,192.168.56.101,128.31.0.39,TCP,[TCP Window Update] 49231  >  9101 [ACK] Seq=12635 Ack=426270 Win=64240 Len=0
419,128.31.0.39,192.168.56.101,TLSv1.2,"Application Data, Application Data"
420,128.31.0.39,192.168.56.101,TCP,9101  >  49231 [ACK] Seq=427730 Ack=12635 Win=65535 Len=1460 [TCP segment of a reassembled PDU]
421,128.31.0.39,192.168.56.101,TCP,9101  >  49231 [ACK] Seq=429190 Ack=12635 Win=65535 Len=1460 [TCP segment of a reassembled PDU]
422,128.31.0.39,192.168.56.101,TLSv1.2,Application Data [TCP segment of a reassembled PDU]
423,128.31.0.39,192.168.56.101,TCP,9101  >  49231 [ACK] Seq=432110 Ack=12635 Win=65535 Len=1460 [TCP segment of a reassembled PDU]
424,128.31.0.39,192.168.56.101,TCP,9101  >  49231 [ACK] Seq=433570 Ack=12635 Win=65535 Len=1460 [TCP segment of a reassembled PDU]
425,128.31.0.39,192.168.56.101,TLSv1.2,Application Data [TCP segment of a reassembled PDU]
426,128.31.0.39,192.168.56.101,TCP,9101  >  49231 [ACK] Seq=436490 Ack=12635 Win=65535 Len=1460 [TCP segment of a reassembled PDU]
427,128.31.0.39,192.168.56.101,TCP,9101  >  49231 [ACK] Seq=437950 Ack=12635 Win=65535 Len=1460 [TCP segment of a reassembled PDU]
428,128.31.0.39,192.168.56.101,TLSv1.2,Application Data [TCP segment of a reassembled PDU]
429,128.31.0.39,192.168.56.101,TCP,9101  >  49231 [ACK] Seq=440870 Ack=12635 Win=65535 Len=1460 [TCP segment of a reassembled PDU]
430,128.31.0.39,192.168.56.101,TCP,9101  >  49231 [ACK] Seq=442330 Ack=12635 Win=65535 Len=1460 [TCP segment of a reassembled PDU]
431,128.31.0.39,192.168.56.101,TLSv1.2,"Application Data, Application Data"
432,128.31.0.39,192.168.56.101,TLSv1.2,Application Data [TCP segment of a reassembled PDU]
433,128.31.0.39,192.168.56.101,TCP,9101  >  49231 [ACK] Seq=446710 Ack=12635 Win=65535 Len=1460 [TCP segment of a reassembled PDU]
434,128.31.0.39,192.168.56.101,TLSv1.2,Application Data [TCP segment of a reassembled PDU]
435,128.31.0.39,192.168.56.101,TCP,9101  >  49231 [ACK] Seq=449630 Ack=12635 Win=65535 Len=1460 [TCP segment of a reassembled PDU]
436,128.31.0.39,192.168.56.101,TCP,9101  >  49231 [ACK] Seq=451090 Ack=12635 Win=65535 Len=1460 [TCP segment of a reassembled PDU]
437,128.31.0.39,192.168.56.101,TLSv1.2,Application Data [TCP segment of a reassembled PDU]
438,128.31.0.39,192.168.56.101,TLSv1.2,Application Data [TCP segment of a reassembled PDU]
439,128.31.0.39,192.168.56.101,TCP,9101  >  49231 [ACK] Seq=455470 Ack=12635 Win=65535 Len=1460 [TCP segment of a reassembled PDU]
440,128.31.0.39,192.168.56.101,TLSv1.2,Application Data [TCP segment of a reassembled PDU]
441,128.31.0.39,192.168.56.101,TCP,9101  >  49231 [ACK] Seq=458390 Ack=12635 Win=65535 Len=1460 [TCP segment of a reassembled PDU]
442,128.31.0.39,192.168.56.101,TCP,9101  >  49231 [ACK] Seq=459850 Ack=12635 Win=65535 Len=1460 [TCP segment of a reassembled PDU]
443,128.31.0.39,192.168.56.101,TLSv1.2,Application Data [TCP segment of a reassembled PDU]
444,128.31.0.39,192.168.56.101,TCP,9101  >  49231 [ACK] Seq=462770 Ack=12635 Win=65535 Len=1460 [TCP segment of a reassembled PDU]
445,128.31.0.39,192.168.56.101,TCP,9101  >  49231 [ACK] Seq=464230 Ack=12635 Win=65535 Len=1460 [TCP segment of a reassembled PDU]
446,128.31.0.39,192.168.56.101,TLSv1.2,Application Data [TCP segment of a reassembled PDU]
447,128.31.0.39,192.168.56.101,TCP,9101  >  49231 [ACK] Seq=467150 Ack=12635 Win=65535 Len=1460 [TCP segment of a reassembled PDU]
448,128.31.0.39,192.168.56.101,TCP,9101  >  49231 [ACK] Seq=468610 Ack=12635 Win=65535 Len=1460 [TCP segment of a reassembled PDU]
449,128.31.0.39,192.168.56.101,TLSv1.2,"Application Data, Application Data, Application Data"
450,128.31.0.39,192.168.56.101,TCP,9101  >  49231 [ACK] Seq=471530 Ack=12635 Win=65535 Len=1460 [TCP segment of a reassembled PDU]
451,128.31.0.39,192.168.56.101,TCP,9101  >  49231 [ACK] Seq=472990 Ack=12635 Win=65535 Len=1460 [TCP segment of a reassembled PDU]
452,128.31.0.39,192.168.56.101,TLSv1.2,Application Data [TCP segment of a reassembled PDU]
453,128.31.0.39,192.168.56.101,TCP,9101  >  49231 [ACK] Seq=475910 Ack=12635 Win=65535 Len=1460 [TCP segment of a reassembled PDU]
454,128.31.0.39,192.168.56.101,TCP,9101  >  49231 [ACK] Seq=477370 Ack=12635 Win=65535 Len=1460 [TCP segment of a reassembled PDU]
455,128.31.0.39,192.168.56.101,TLSv1.2,Application Data [TCP segment of a reassembled PDU]
456,128.31.0.39,192.168.56.101,TCP,9101  >  49231 [ACK] Seq=480290 Ack=12635 Win=65535 Len=1460 [TCP segment of a reassembled PDU]
457,128.31.0.39,192.168.56.101,TCP,9101  >  49231 [ACK] Seq=481750 Ack=12635 Win=65535 Len=1460 [TCP segment of a reassembled PDU]
458,128.31.0.39,192.168.56.101,TLSv1.2,Application Data [TCP segment of a reassembled PDU]
459,128.31.0.39,192.168.56.101,TCP,9101  >  49231 [ACK] Seq=484670 Ack=12635 Win=65535 Len=1460 [TCP segment of a reassembled PDU]
460,128.31.0.39,192.168.56.101,TLSv1.2,Application Data [TCP segment of a reassembled PDU]
461,128.31.0.39,192.168.56.101,TLSv1.2,Application Data [TCP segment of a reassembled PDU]
462,128.31.0.39,192.168.56.101,TCP,[TCP Window Full] 9101  >  49231 [ACK] Seq=489050 Ack=12635 Win=65535 Len=1460 [TCP segment of a reassembled PDU]
463,192.168.56.101,128.31.0.39,TCP,49231  >  9101 [ACK] Seq=12635 Ack=465690 Win=24820 Len=0
464,192.168.56.101,128.31.0.39,TCP,[TCP ZeroWindow] 49231  >  9101 [ACK] Seq=12635 Ack=490510 Win=0 Len=0
465,192.168.56.101,128.31.0.39,TLSv1.2,"[TCP ZeroWindow] , Application Data"
466,128.31.0.39,192.168.56.101,TCP,9101  >  49231 [ACK] Seq=490510 Ack=13692 Win=65535 Len=0
467,192.168.56.101,128.31.0.39,TLSv1.2,"[TCP ZeroWindow] , Application Data"
468,128.31.0.39,192.168.56.101,TCP,9101  >  49231 [ACK] Seq=490510 Ack=14235 Win=65535 Len=0
469,192.168.56.101,128.31.0.39,TCP,[TCP Window Update] 49231  >  9101 [ACK] Seq=14235 Ack=490510 Win=3472 Len=0
470,128.31.0.39,192.168.56.101,TLSv1.2,Application Data [TCP segment of a reassembled PDU]
471,128.31.0.39,192.168.56.101,TCP,9101  >  49231 [ACK] Seq=491970 Ack=14235 Win=65535 Len=1460 [TCP segment of a reassembled PDU]
472,192.168.56.101,128.31.0.39,TCP,49231  >  9101 [ACK] Seq=14235 Ack=493430 Win=552 Len=0
473,192.168.56.101,128.31.0.39,TCP,[TCP Window Update] 49231  >  9101 [ACK] Seq=14235 Ack=493430 Win=61320 Len=0
474,128.31.0.39,192.168.56.101,TCP,9101  >  49231 [ACK] Seq=493430 Ack=14235 Win=65535 Len=1460 [TCP segment of a reassembled PDU]
475,128.31.0.39,192.168.56.101,TLSv1.2,Application Data [TCP segment of a reassembled PDU]
476,128.31.0.39,192.168.56.101,TLSv1.2,Application Data [TCP segment of a reassembled PDU]
477,128.31.0.39,192.168.56.101,TCP,9101  >  49231 [ACK] Seq=497810 Ack=14235 Win=65535 Len=1460 [TCP segment of a reassembled PDU]
478,128.31.0.39,192.168.56.101,TCP,9101  >  49231 [ACK] Seq=499270 Ack=14235 Win=65535 Len=1460 [TCP segment of a reassembled PDU]
479,128.31.0.39,192.168.56.101,TLSv1.2,Application Data [TCP segment of a reassembled PDU]
480,128.31.0.39,192.168.56.101,TCP,9101  >  49231 [ACK] Seq=502190 Ack=14235 Win=65535 Len=1460 [TCP segment of a reassembled PDU]
481,128.31.0.39,192.168.56.101,TCP,9101  >  49231 [ACK] Seq=503650 Ack=14235 Win=65535 Len=1460 [TCP segment of a reassembled PDU]
482,128.31.0.39,192.168.56.101,TLSv1.2,Application Data [TCP segment of a reassembled PDU]
483,128.31.0.39,192.168.56.101,TCP,9101  >  49231 [ACK] Seq=506570 Ack=14235 Win=65535 Len=1460 [TCP segment of a reassembled PDU]
484,128.31.0.39,192.168.56.101,TLSv1.2,Application Data [TCP segment of a reassembled PDU]
485,128.31.0.39,192.168.56.101,TCP,9101  >  49231 [ACK] Seq=509490 Ack=14235 Win=65535 Len=1460 [TCP segment of a reassembled PDU]
486,128.31.0.39,192.168.56.101,TCP,9101  >  49231 [ACK] Seq=510950 Ack=14235 Win=65535 Len=1460 [TCP segment of a reassembled PDU]
487,128.31.0.39,192.168.56.101,TLSv1.2,"Application Data, Application Data"
488,128.31.0.39,192.168.56.101,TCP,9101  >  49231 [ACK] Seq=513870 Ack=14235 Win=65535 Len=1460 [TCP segment of a reassembled PDU]
489,128.31.0.39,192.168.56.101,TCP,9101  >  49231 [ACK] Seq=515330 Ack=14235 Win=65535 Len=1460 [TCP segment of a reassembled PDU]
490,128.31.0.39,192.168.56.101,TLSv1.2,Application Data [TCP segment of a reassembled PDU]
491,128.31.0.39,192.168.56.101,TCP,9101  >  49231 [ACK] Seq=518250 Ack=14235 Win=65535 Len=1460 [TCP segment of a reassembled PDU]
492,128.31.0.39,192.168.56.101,TCP,9101  >  49231 [ACK] Seq=519710 Ack=14235 Win=65535 Len=1460 [TCP segment of a reassembled PDU]
493,128.31.0.39,192.168.56.101,TLSv1.2,Application Data [TCP segment of a reassembled PDU]
494,128.31.0.39,192.168.56.101,TLSv1.2,Application Data [TCP segment of a reassembled PDU]
495,128.31.0.39,192.168.56.101,TCP,9101  >  49231 [ACK] Seq=524090 Ack=14235 Win=65535 Len=1460 [TCP segment of a reassembled PDU]
496,128.31.0.39,192.168.56.101,TCP,9101  >  49231 [ACK] Seq=525550 Ack=14235 Win=65535 Len=1460 [TCP segment of a reassembled PDU]
497,128.31.0.39,192.168.56.101,TLSv1.2,Application Data [TCP segment of a reassembled PDU]
498,128.31.0.39,192.168.56.101,TCP,9101  >  49231 [ACK] Seq=528470 Ack=14235 Win=65535 Len=1460 [TCP segment of a reassembled PDU]
499,128.31.0.39,192.168.56.101,TLSv1.2,Application Data [TCP segment of a reassembled PDU]
500,128.31.0.39,192.168.56.101,TCP,9101  >  49231 [ACK] Seq=531390 Ack=14235 Win=65535 Len=1460 [TCP segment of a reassembled PDU]
501,128.31.0.39,192.168.56.101,TCP,9101  >  49231 [ACK] Seq=532850 Ack=14235 Win=65535 Len=1460 [TCP segment of a reassembled PDU]
502,128.31.0.39,192.168.56.101,TLSv1.2,Application Data [TCP segment of a reassembled PDU]
503,128.31.0.39,192.168.56.101,TCP,9101  >  49231 [ACK] Seq=535770 Ack=14235 Win=65535 Len=1460 [TCP segment of a reassembled PDU]
504,128.31.0.39,192.168.56.101,TCP,9101  >  49231 [ACK] Seq=537230 Ack=14235 Win=65535 Len=1460 [TCP segment of a reassembled PDU]
505,128.31.0.39,192.168.56.101,TLSv1.2,"Application Data, Application Data"
506,128.31.0.39,192.168.56.101,TCP,9101  >  49231 [ACK] Seq=540150 Ack=14235 Win=65535 Len=1460 [TCP segment of a reassembled PDU]
507,128.31.0.39,192.168.56.101,TCP,9101  >  49231 [ACK] Seq=541610 Ack=14235 Win=65535 Len=1460 [TCP segment of a reassembled PDU]
508,128.31.0.39,192.168.56.101,TLSv1.2,Application Data [TCP segment of a reassembled PDU]
509,128.31.0.39,192.168.56.101,TCP,9101  >  49231 [ACK] Seq=544530 Ack=14235 Win=65535 Len=1460 [TCP segment of a reassembled PDU]
510,128.31.0.39,192.168.56.101,TCP,9101  >  49231 [ACK] Seq=545990 Ack=14235 Win=65535 Len=1460 [TCP segment of a reassembled PDU]
511,128.31.0.39,192.168.56.101,TLSv1.2,Application Data [TCP segment of a reassembled PDU]
512,128.31.0.39,192.168.56.101,TLSv1.2,Application Data [TCP segment of a reassembled PDU]
513,128.31.0.39,192.168.56.101,TCP,9101  >  49231 [ACK] Seq=550370 Ack=14235 Win=65535 Len=1460 [TCP segment of a reassembled PDU]
514,128.31.0.39,192.168.56.101,TLSv1.2,Application Data [TCP segment of a reassembled PDU]
515,128.31.0.39,192.168.56.101,TCP,[TCP Window Full] 9101  >  49231 [ACK] Seq=553290 Ack=14235 Win=65535 Len=1460 [TCP segment of a reassembled PDU]
516,192.168.56.101,128.31.0.39,TCP,49231  >  9101 [ACK] Seq=14235 Ack=540150 Win=14600 Len=0
517,192.168.56.101,128.31.0.39,TCP,[TCP ZeroWindow] 49231  >  9101 [ACK] Seq=14235 Ack=554750 Win=0 Len=0
518,192.168.56.101,128.31.0.39,TLSv1.2,"[TCP ZeroWindow] , Application Data"
519,128.31.0.39,192.168.56.101,TCP,9101  >  49231 [ACK] Seq=554750 Ack=15292 Win=65535 Len=0
520,192.168.56.101,128.31.0.39,TLSv1.2,"[TCP ZeroWindow] , Application Data"
521,128.31.0.39,192.168.56.101,TCP,9101  >  49231 [ACK] Seq=554750 Ack=15835 Win=65535 Len=0
522,192.168.56.101,128.31.0.39,TLSv1.2,"[TCP ZeroWindow] , Application Data"
523,128.31.0.39,192.168.56.101,TCP,9101  >  49231 [ACK] Seq=554750 Ack=16892 Win=65535 Len=0
524,192.168.56.101,128.31.0.39,TCP,[TCP Window Update] 49231  >  9101 [ACK] Seq=16892 Ack=554750 Win=3472 Len=0
525,128.31.0.39,192.168.56.101,TCP,9101  >  49231 [ACK] Seq=554750 Ack=16892 Win=65535 Len=1460 [TCP segment of a reassembled PDU]
526,128.31.0.39,192.168.56.101,TLSv1.2,Application Data [TCP segment of a reassembled PDU]
527,192.168.56.101,128.31.0.39,TCP,49231  >  9101 [ACK] Seq=16892 Ack=557670 Win=552 Len=0
528,192.168.56.101,128.31.0.39,TCP,[TCP Window Update] 49231  >  9101 [ACK] Seq=16892 Ack=557670 Win=61320 Len=0
529,128.31.0.39,192.168.56.101,TCP,9101  >  49231 [ACK] Seq=557670 Ack=16892 Win=65535 Len=1460 [TCP segment of a reassembled PDU]
530,128.31.0.39,192.168.56.101,TCP,9101  >  49231 [ACK] Seq=559130 Ack=16892 Win=65535 Len=1460 [TCP segment of a reassembled PDU]
531,128.31.0.39,192.168.56.101,TLSv1.2,Application Data [TCP segment of a reassembled PDU]
532,128.31.0.39,192.168.56.101,TCP,9101  >  49231 [ACK] Seq=562050 Ack=16892 Win=65535 Len=1460 [TCP segment of a reassembled PDU]
533,128.31.0.39,192.168.56.101,TCP,9101  >  49231 [ACK] Seq=563510 Ack=16892 Win=65535 Len=1460 [TCP segment of a reassembled PDU]
534,128.31.0.39,192.168.56.101,TLSv1.2,"Application Data, Application Data"
535,128.31.0.39,192.168.56.101,TCP,9101  >  49231 [ACK] Seq=566430 Ack=16892 Win=65535 Len=1460 [TCP segment of a reassembled PDU]
536,128.31.0.39,192.168.56.101,TCP,9101  >  49231 [ACK] Seq=567890 Ack=16892 Win=65535 Len=1460 [TCP segment of a reassembled PDU]
537,128.31.0.39,192.168.56.101,TLSv1.2,Application Data [TCP segment of a reassembled PDU]
538,128.31.0.39,192.168.56.101,TCP,9101  >  49231 [ACK] Seq=570810 Ack=16892 Win=65535 Len=1460 [TCP segment of a reassembled PDU]
539,128.31.0.39,192.168.56.101,TLSv1.2,Application Data [TCP segment of a reassembled PDU]
540,128.31.0.39,192.168.56.101,TLSv1.2,Application Data [TCP segment of a reassembled PDU]
541,128.31.0.39,192.168.56.101,TCP,9101  >  49231 [ACK] Seq=575190 Ack=16892 Win=65535 Len=1460 [TCP segment of a reassembled PDU]
542,128.31.0.39,192.168.56.101,TCP,9101  >  49231 [ACK] Seq=576650 Ack=16892 Win=65535 Len=1460 [TCP segment of a reassembled PDU]
543,128.31.0.39,192.168.56.101,TLSv1.2,Application Data [TCP segment of a reassembled PDU]
544,128.31.0.39,192.168.56.101,TCP,9101  >  49231 [ACK] Seq=579570 Ack=16892 Win=65535 Len=1460 [TCP segment of a reassembled PDU]
545,128.31.0.39,192.168.56.101,TCP,9101  >  49231 [ACK] Seq=581030 Ack=16892 Win=65535 Len=1460 [TCP segment of a reassembled PDU]
546,128.31.0.39,192.168.56.101,TLSv1.2,Application Data [TCP segment of a reassembled PDU]
547,128.31.0.39,192.168.56.101,TCP,9101  >  49231 [ACK] Seq=583950 Ack=16892 Win=65535 Len=1460 [TCP segment of a reassembled PDU]
548,128.31.0.39,192.168.56.101,TCP,9101  >  49231 [ACK] Seq=585410 Ack=16892 Win=65535 Len=1460 [TCP segment of a reassembled PDU]
549,128.31.0.39,192.168.56.101,TLSv1.2,Application Data [TCP segment of a reassembled PDU]
550,128.31.0.39,192.168.56.101,TCP,9101  >  49231 [ACK] Seq=588330 Ack=16892 Win=65535 Len=1460 [TCP segment of a reassembled PDU]
551,128.31.0.39,192.168.56.101,TCP,9101  >  49231 [ACK] Seq=589790 Ack=16892 Win=65535 Len=1460 [TCP segment of a reassembled PDU]
552,128.31.0.39,192.168.56.101,TLSv1.2,"Application Data, Application Data"
553,128.31.0.39,192.168.56.101,TCP,9101  >  49231 [ACK] Seq=592710 Ack=16892 Win=65535 Len=1460 [TCP segment of a reassembled PDU]
554,128.31.0.39,192.168.56.101,TLSv1.2,Application Data [TCP segment of a reassembled PDU]
555,128.31.0.39,192.168.56.101,TCP,9101  >  49231 [ACK] Seq=595630 Ack=16892 Win=65535 Len=1460 [TCP segment of a reassembled PDU]
556,128.31.0.39,192.168.56.101,TCP,9101  >  49231 [ACK] Seq=597090 Ack=16892 Win=65535 Len=1460 [TCP segment of a reassembled PDU]
557,128.31.0.39,192.168.56.101,TLSv1.2,Application Data [TCP segment of a reassembled PDU]
558,128.31.0.39,192.168.56.101,TLSv1.2,Application Data [TCP segment of a reassembled PDU]
559,128.31.0.39,192.168.56.101,TCP,9101  >  49231 [ACK] Seq=601470 Ack=16892 Win=65535 Len=1460 [TCP segment of a reassembled PDU]
560,128.31.0.39,192.168.56.101,TLSv1.2,Application Data [TCP segment of a reassembled PDU]
561,128.31.0.39,192.168.56.101,TCP,9101  >  49231 [ACK] Seq=604390 Ack=16892 Win=65535 Len=1460 [TCP segment of a reassembled PDU]
562,128.31.0.39,192.168.56.101,TCP,9101  >  49231 [ACK] Seq=605850 Ack=16892 Win=65535 Len=1460 [TCP segment of a reassembled PDU]
563,128.31.0.39,192.168.56.101,TLSv1.2,Application Data [TCP segment of a reassembled PDU]
564,128.31.0.39,192.168.56.101,TCP,9101  >  49231 [ACK] Seq=608770 Ack=16892 Win=65535 Len=1460 [TCP segment of a reassembled PDU]
565,128.31.0.39,192.168.56.101,TCP,9101  >  49231 [ACK] Seq=610230 Ack=16892 Win=65535 Len=1460 [TCP segment of a reassembled PDU]
566,128.31.0.39,192.168.56.101,TLSv1.2,Application Data [TCP segment of a reassembled PDU]
567,128.31.0.39,192.168.56.101,TLSv1.2,Application Data
568,192.168.56.101,128.31.0.39,TCP,49231  >  9101 [ACK] Seq=16892 Ack=604390 Win=14600 Len=0
569,192.168.56.101,128.31.0.39,TCP,49231  >  9101 [ACK] Seq=16892 Ack=614361 Win=4629 Len=0
570,192.168.56.101,128.31.0.39,TLSv1.2,Application Data
571,128.31.0.39,192.168.56.101,TCP,9101  >  49231 [ACK] Seq=614361 Ack=17435 Win=65535 Len=0
572,192.168.56.101,128.31.0.39,TLSv1.2,Application Data
573,128.31.0.39,192.168.56.101,TCP,9101  >  49231 [ACK] Seq=614361 Ack=18492 Win=65535 Len=0
574,192.168.56.101,128.31.0.39,TCP,[TCP Window Update] 49231  >  9101 [ACK] Seq=18492 Ack=614361 Win=8101 Len=0
575,192.168.56.101,128.31.0.39,TCP,[TCP Window Update] 49231  >  9101 [ACK] Seq=18492 Ack=614361 Win=64240 Len=0
576,192.168.56.101,128.31.0.39,TLSv1.2,Application Data
577,128.31.0.39,192.168.56.101,TCP,9101  >  49231 [ACK] Seq=614361 Ack=19035 Win=65535 Len=0
578,192.168.56.101,128.31.0.39,TLSv1.2,Application Data
579,128.31.0.39,192.168.56.101,TCP,9101  >  49231 [ACK] Seq=614361 Ack=20092 Win=65535 Len=0
580,192.168.56.101,128.31.0.39,TLSv1.2,Application Data
581,128.31.0.39,192.168.56.101,TCP,9101  >  49231 [ACK] Seq=614361 Ack=20635 Win=65535 Len=0
582,192.168.56.101,142.250.114.102,TCP,49167  >  443 [SYN] Seq=0 Win=8192 Len=0 MSS=1460 WS=256 SACK_PERM=1
583,142.250.114.102,192.168.56.101,TCP,"443  >  49167 [SYN, ACK] Seq=0 Ack=1 Win=65535 Len=0 MSS=1460"
584,192.168.56.101,142.250.114.102,TCP,49167  >  443 [ACK] Seq=1 Ack=1 Win=64240 Len=0
585,192.168.56.101,142.250.114.102,TLSv1.2,Client Hello
586,142.250.114.102,192.168.56.101,TCP,443  >  49167 [ACK] Seq=1 Ack=162 Win=65535 Len=0
587,142.250.114.102,192.168.56.101,TLSv1.2,Server Hello
588,142.250.114.102,192.168.56.101,TCP,"443  >  49167 [PSH, ACK] Seq=1413 Ack=162 Win=65535 Len=1412 [TCP segment of a reassembled PDU]"
589,192.168.56.101,142.250.114.102,TCP,49167  >  443 [ACK] Seq=162 Ack=2825 Win=64240 Len=0
590,142.250.114.102,192.168.56.101,TCP,443  >  49167 [ACK] Seq=2825 Ack=162 Win=65535 Len=1460 [TCP segment of a reassembled PDU]
591,142.250.114.102,192.168.56.101,TCP,443  >  49167 [ACK] Seq=4285 Ack=162 Win=65535 Len=1460 [TCP segment of a reassembled PDU]
592,142.250.114.102,192.168.56.101,TLSv1.2,"Certificate, Server Key Exchange, Server Hello Done"
593,192.168.56.101,142.250.114.102,TCP,49167  >  443 [ACK] Seq=162 Ack=6661 Win=64240 Len=0
594,192.168.56.101,142.250.114.102,TLSv1.2,"Client Key Exchange, Change Cipher Spec, Encrypted Handshake Message"
595,142.250.114.102,192.168.56.101,TCP,443  >  49167 [ACK] Seq=6661 Ack=288 Win=65535 Len=0
596,142.250.114.102,192.168.56.101,TLSv1.2,"Change Cipher Spec, Encrypted Handshake Message"
597,192.168.56.101,142.250.114.102,TCP,49167  >  443 [ACK] Seq=288 Ack=6712 Win=64189 Len=0
598,192.168.56.101,142.250.114.102,TLSv1.2,Application Data
599,142.250.114.102,192.168.56.101,TCP,443  >  49167 [ACK] Seq=6712 Ack=811 Win=65535 Len=0
600,142.250.114.102,192.168.56.101,TLSv1.2,Application Data
601,192.168.56.101,142.250.114.102,TCP,"49167  >  443 [RST, ACK] Seq=811 Ack=6991 Win=0 Len=0"
602,192.168.56.101,185.13.38.75,TCP,49230  >  9001 [SYN] Seq=0 Win=8192 Len=0 MSS=1460 WS=256 SACK_PERM=1
603,192.168.56.101,185.13.38.75,TCP,[TCP Retransmission] 49230  >  9001 [SYN] Seq=0 Win=8192 Len=0 MSS=1460 WS=256 SACK_PERM=1
604,192.168.56.101,185.13.38.75,TCP,[TCP Retransmission] 49230  >  9001 [SYN] Seq=0 Win=8192 Len=0 MSS=1460 SACK_PERM=1
605,192.168.56.101,192.168.56.255,NBNS,Registration NB NONE<20>
606,192.168.56.101,192.168.56.255,NBNS,Registration NB NONE<20>
607,192.168.56.101,192.168.56.255,NBNS,Registration NB NONE<00>
608,192.168.56.101,192.168.56.255,NBNS,Registration NB NONE<00>
609,192.168.56.101,192.168.56.255,NBNS,Registration NB WORKGROUP<00>
610,192.168.56.101,192.168.56.255,NBNS,Registration NB WORKGROUP<00>
611,192.168.56.101,192.168.56.255,NBNS,Name query NB ISATAP<00>
612,192.168.56.101,192.168.56.255,NBNS,Name query NB ISATAP<00>
613,192.168.56.101,192.168.56.255,NBNS,Registration NB WORKGROUP<00>
614,192.168.56.101,192.168.56.255,NBNS,Registration NB WORKGROUP<00>
615,192.168.56.101,192.168.56.255,NBNS,Registration NB NONE<00>
616,192.168.56.101,192.168.56.255,NBNS,Registration NB NONE<00>
617,192.168.56.101,192.168.56.255,NBNS,Registration NB NONE<20>
618,192.168.56.101,192.168.56.255,NBNS,Registration NB NONE<20>
619,192.168.56.101,192.168.56.255,NBNS,Name query NB ISATAP<00>
620,192.168.56.101,192.168.56.255,NBNS,Name query NB ISATAP<00>
621,192.168.56.101,192.168.56.255,NBNS,Registration NB NONE<20>
622,192.168.56.101,192.168.56.255,NBNS,Registration NB NONE<20>
623,192.168.56.101,192.168.56.255,NBNS,Registration NB NONE<00>
624,192.168.56.101,192.168.56.255,NBNS,Registration NB NONE<00>
625,192.168.56.101,192.168.56.255,NBNS,Registration NB WORKGROUP<00>
626,192.168.56.101,192.168.56.255,NBNS,Registration NB WORKGROUP<00>
627,192.168.56.101,192.168.56.255,NBNS,Name query NB WPAD<00>
628,192.168.56.101,192.168.56.255,NBNS,Name query NB WPAD<00>
629,192.168.56.101,192.168.56.255,NBNS,Name query NB ISATAP<00>
630,192.168.56.101,192.168.56.255,NBNS,Name query NB ISATAP<00>
631,192.168.56.101,192.168.56.255,NBNS,Registration NB WORKGROUP<00>
632,192.168.56.101,192.168.56.255,NBNS,Registration NB WORKGROUP<00>
633,192.168.56.101,192.168.56.255,NBNS,Registration NB NONE<00>
634,192.168.56.101,192.168.56.255,NBNS,Registration NB NONE<00>
635,192.168.56.101,192.168.56.255,NBNS,Registration NB NONE<20>
636,192.168.56.101,192.168.56.255,NBNS,Registration NB NONE<20>
637,192.168.56.101,192.168.56.255,NBNS,Name query NB WPAD<00>
638,192.168.56.101,192.168.56.255,NBNS,Name query NB WPAD<00>
639,192.168.56.101,192.168.56.255,NBNS,Name query NB ISATAP<00>
640,192.168.56.101,192.168.56.255,NBNS,Name query NB ISATAP<00>
641,192.168.56.101,192.168.56.255,NBNS,Registration NB WORKGROUP<1e>
642,192.168.56.101,192.168.56.255,NBNS,Registration NB WORKGROUP<1e>
643,192.168.56.101,192.168.56.255,NBNS,Name query NB WPAD<00>
644,192.168.56.101,192.168.56.255,NBNS,Name query NB WPAD<00>
645,192.168.56.101,192.168.56.255,NBNS,Name query NB ISATAP<00>
646,192.168.56.101,192.168.56.255,NBNS,Name query NB ISATAP<00>
647,192.168.56.101,192.168.56.255,NBNS,Registration NB WORKGROUP<1e>
648,192.168.56.101,192.168.56.255,NBNS,Registration NB WORKGROUP<1e>
649,192.168.56.101,192.168.56.255,NBNS,Name query NB ISATAP<00>
650,192.168.56.101,192.168.56.255,NBNS,Name query NB ISATAP<00>
651,192.168.56.101,192.168.56.255,NBNS,Registration NB WORKGROUP<1e>
652,192.168.56.101,192.168.56.255,NBNS,Registration NB WORKGROUP<1e>
653,192.168.56.101,192.168.56.255,NBNS,Registration NB WORKGROUP<1e>
654,192.168.56.101,192.168.56.255,NBNS,Registration NB WORKGROUP<1e>
655,192.168.56.101,192.168.56.255,NBNS,Name query NB ISATAP<00>
656,192.168.56.101,192.168.56.255,NBNS,Name query NB ISATAP<00>
657,192.168.56.101,192.168.56.255,NBNS,Name query NB ISATAP<00>
658,192.168.56.101,192.168.56.255,NBNS,Name query NB ISATAP<00>
659,192.168.56.101,192.168.56.255,NBNS,Name query NB ISATAP<00>
660,192.168.56.101,192.168.56.255,NBNS,Name query NB ISATAP<00>
661,192.168.56.101,192.168.56.255,NBNS,Name query NB ISATAP<00>
662,192.168.56.101,192.168.56.255,NBNS,Name query NB ISATAP<00>
663,192.168.56.101,192.168.56.255,NBNS,Name query NB ISATAP<00>
664,192.168.56.101,192.168.56.255,NBNS,Name query NB ISATAP<00>
665,192.168.56.101,192.168.56.255,NBNS,Name query NB ISATAP<00>
666,192.168.56.101,192.168.56.255,NBNS,Name query NB ISATAP<00>
667,192.168.56.101,192.168.56.255,NBNS,Name query NB ISATAP<00>
668,192.168.56.101,192.168.56.255,NBNS,Name query NB ISATAP<00>
669,192.168.56.101,192.168.56.255,NBNS,Name query NB ISATAP<00>
670,192.168.56.101,192.168.56.255,NBNS,Name query NB ISATAP<00>
671,192.168.56.101,192.168.56.255,NBNS,Name query NB ISATAP<00>
672,192.168.56.101,192.168.56.255,NBNS,Name query NB ISATAP<00>
673,192.168.56.101,192.168.56.255,NBNS,Registration NB WORKGROUP<1d>
674,192.168.56.101,192.168.56.255,NBNS,Registration NB WORKGROUP<1d>
675,192.168.56.101,192.168.56.255,NBNS,Registration NB WORKGROUP<1d>
676,192.168.56.101,192.168.56.255,NBNS,Registration NB WORKGROUP<1d>
677,192.168.56.101,192.168.56.255,NBNS,Registration NB WORKGROUP<1d>
678,192.168.56.101,192.168.56.255,NBNS,Registration NB WORKGROUP<1d>
679,192.168.56.101,192.168.56.255,NBNS,Registration NB WORKGROUP<1d>
680,192.168.56.101,192.168.56.255,NBNS,Registration NB WORKGROUP<1d>
681,192.168.56.101,192.168.56.255,NBNS,Registration NB <01><02>__MSBROWSE__<02><01>
682,192.168.56.101,192.168.56.255,NBNS,Registration NB <01><02>__MSBROWSE__<02><01>
683,192.168.56.101,192.168.56.255,NBNS,Registration NB <01><02>__MSBROWSE__<02><01>
684,192.168.56.101,192.168.56.255,NBNS,Registration NB <01><02>__MSBROWSE__<02><01>
685,192.168.56.101,192.168.56.255,NBNS,Registration NB <01><02>__MSBROWSE__<02><01>
686,192.168.56.101,192.168.56.255,NBNS,Registration NB <01><02>__MSBROWSE__<02><01>
687,192.168.56.101,192.168.56.255,NBNS,Registration NB <01><02>__MSBROWSE__<02><01>
688,192.168.56.101,192.168.56.255,NBNS,Registration NB <01><02>__MSBROWSE__<02><01>
689,192.168.56.101,192.168.56.255,NBNS,Name query NB WPAD<00>
690,192.168.56.101,192.168.56.255,NBNS,Name query NB WPAD<00>
691,192.168.56.101,192.168.56.255,NBNS,Name query NB WPAD<00>
692,192.168.56.101,192.168.56.255,NBNS,Name query NB WPAD<00>
693,192.168.56.101,192.168.56.255,NBNS,Name query NB WPAD<00>
694,192.168.56.101,192.168.56.255,NBNS,Name query NB WPAD<00>
695,192.168.56.101,192.168.56.255,BROWSER,Request Announcement NONE
696,192.168.56.101,192.168.56.255,BROWSER,Request Announcement NONE
697,192.168.56.101,192.168.56.255,BROWSER,"Host Announcement NONE, Workstation, Server, NT Workstation, Potential Browser"
698,192.168.56.101,192.168.56.255,BROWSER,"Host Announcement NONE, Workstation, Server, NT Workstation, Potential Browser"
699,192.168.56.101,192.168.56.255,BROWSER,Request Announcement NONE
700,192.168.56.101,192.168.56.255,BROWSER,Request Announcement NONE
701,192.168.56.101,192.168.56.255,BROWSER,Request Announcement NONE
702,192.168.56.101,192.168.56.255,BROWSER,Request Announcement NONE
703,192.168.56.101,192.168.56.255,BROWSER,Request Announcement NONE
704,192.168.56.101,192.168.56.255,BROWSER,Request Announcement NONE
705,192.168.56.101,192.168.56.255,BROWSER,Browser Election Request
706,192.168.56.101,192.168.56.255,BROWSER,Browser Election Request
707,192.168.56.101,192.168.56.255,BROWSER,Browser Election Request
708,192.168.56.101,192.168.56.255,BROWSER,Browser Election Request
709,192.168.56.101,192.168.56.255,BROWSER,Browser Election Request
710,192.168.56.101,192.168.56.255,BROWSER,Browser Election Request
711,192.168.56.101,192.168.56.255,BROWSER,Browser Election Request
712,192.168.56.101,192.168.56.255,BROWSER,Browser Election Request
713,192.168.56.101,192.168.56.255,BROWSER,Request Announcement NONE
714,192.168.56.101,192.168.56.255,BROWSER,Request Announcement NONE
715,192.168.56.101,192.168.56.255,BROWSER,Request Announcement NONE
716,192.168.56.101,192.168.56.255,BROWSER,Request Announcement NONE
717,192.168.56.101,192.168.56.255,BROWSER,"Domain/Workgroup Announcement WORKGROUP, NT Workstation, Domain Enum"
718,192.168.56.101,192.168.56.255,BROWSER,"Domain/Workgroup Announcement WORKGROUP, NT Workstation, Domain Enum"
719,192.168.56.101,192.168.56.255,BROWSER,"Local Master Announcement NONE, Workstation, Server, NT Workstation, Potential Browser, Master Browser"
720,192.168.56.101,192.168.56.255,BROWSER,"Local Master Announcement NONE, Workstation, Server, NT Workstation, Potential Browser, Master Browser"
721,192.168.56.101,192.168.56.255,BROWSER,"Domain/Workgroup Announcement WORKGROUP, NT Workstation, Domain Enum"
722,192.168.56.101,192.168.56.255,BROWSER,"Domain/Workgroup Announcement WORKGROUP, NT Workstation, Domain Enum"
723,192.168.56.101,192.168.56.255,BROWSER,"Domain/Workgroup Announcement WORKGROUP, NT Workstation, Domain Enum"
724,192.168.56.101,192.168.56.255,BROWSER,"Domain/Workgroup Announcement WORKGROUP, NT Workstation, Domain Enum"
725,192.168.56.101,224.0.0.22,IGMPv3,Membership Report / Leave group 224.0.0.252
726,192.168.56.101,224.0.0.22,IGMPv3,Membership Report / Leave group 224.0.0.252
727,192.168.56.101,224.0.0.22,IGMPv3,Membership Report / Join group 224.0.0.252 for any sources
728,192.168.56.101,224.0.0.22,IGMPv3,Membership Report / Join group 224.0.0.252 for any sources
729,192.168.56.101,224.0.0.22,IGMPv3,Membership Report / Join group 239.255.255.250 for any sources
730,192.168.56.101,224.0.0.22,IGMPv3,Membership Report / Join group 239.255.255.250 for any sources
731,192.168.56.101,224.0.0.22,IGMPv3,Membership Report / Join group 224.0.0.252 for any sources / Join group 239.255.255.250 for any sources
732,192.168.56.101,224.0.0.22,IGMPv3,Membership Report / Join group 224.0.0.252 for any sources / Join group 239.255.255.250 for any sources
733,192.168.56.101,224.0.0.252,LLMNR,Standard query 0x025f A isatap
734,192.168.56.101,224.0.0.252,LLMNR,Standard query 0x025f A isatap
735,192.168.56.101,224.0.0.252,LLMNR,Standard query 0x025f A isatap
736,192.168.56.101,224.0.0.252,LLMNR,Standard query 0x025f A isatap
737,192.168.56.101,224.0.0.252,LLMNR,Standard query 0xc9cb A isatap
738,192.168.56.101,224.0.0.252,LLMNR,Standard query 0xc9cb A isatap
739,192.168.56.101,224.0.0.252,LLMNR,Standard query 0xc9cb A isatap
740,192.168.56.101,224.0.0.252,LLMNR,Standard query 0xc9cb A isatap
741,192.168.56.101,224.0.0.252,LLMNR,Standard query 0xc4c8 A isatap
742,192.168.56.101,224.0.0.252,LLMNR,Standard query 0xc4c8 A isatap
743,192.168.56.101,224.0.0.252,LLMNR,Standard query 0xc4c8 A isatap
744,192.168.56.101,224.0.0.252,LLMNR,Standard query 0xc4c8 A isatap
745,192.168.56.101,224.0.0.252,LLMNR,Standard query 0x4163 ANY None
746,192.168.56.101,224.0.0.252,LLMNR,Standard query 0x4163 ANY None
747,192.168.56.101,224.0.0.252,LLMNR,Standard query 0x4163 ANY None
748,192.168.56.101,224.0.0.252,LLMNR,Standard query 0x4163 ANY None
749,192.168.56.101,224.0.0.252,LLMNR,Standard query 0x96f1 A isatap
750,192.168.56.101,224.0.0.252,LLMNR,Standard query 0x96f1 A isatap
751,192.168.56.101,224.0.0.252,LLMNR,Standard query 0x96f1 A isatap
752,192.168.56.101,224.0.0.252,LLMNR,Standard query 0x96f1 A isatap
753,192.168.56.101,224.0.0.252,LLMNR,Standard query 0x6e6e A wpad
754,192.168.56.101,224.0.0.252,LLMNR,Standard query 0x6e6e A wpad
755,192.168.56.101,224.0.0.252,LLMNR,Standard query 0x6e6e A wpad
756,192.168.56.101,224.0.0.252,LLMNR,Standard query 0x6e6e A wpad
757,192.168.56.101,224.0.0.252,LLMNR,Standard query 0xd671 A isatap
758,192.168.56.101,224.0.0.252,LLMNR,Standard query 0xd671 A isatap
759,192.168.56.101,224.0.0.252,LLMNR,Standard query 0xd671 A isatap
760,192.168.56.101,224.0.0.252,LLMNR,Standard query 0xd671 A isatap
761,192.168.56.101,224.0.0.252,LLMNR,Standard query 0x21c1 A wpad
762,192.168.56.101,224.0.0.252,LLMNR,Standard query 0x21c1 A wpad
763,192.168.56.101,224.0.0.252,LLMNR,Standard query 0x21c1 A wpad
764,192.168.56.101,224.0.0.252,LLMNR,Standard query 0x21c1 A wpad
765,192.168.56.101,239.255.255.250,SSDP,M-SEARCH * HTTP/1.1 
766,192.168.56.101,239.255.255.250,SSDP,M-SEARCH * HTTP/1.1 
767,192.168.56.101,239.255.255.250,SSDP,M-SEARCH * HTTP/1.1 
768,192.168.56.101,239.255.255.250,SSDP,M-SEARCH * HTTP/1.1 
769,192.168.56.101,239.255.255.250,SSDP,M-SEARCH * HTTP/1.1 
770,192.168.56.101,239.255.255.250,SSDP,M-SEARCH * HTTP/1.1 
771,192.168.56.101,239.255.255.250,SSDP,M-SEARCH * HTTP/1.1 
772,192.168.56.101,239.255.255.250,SSDP,M-SEARCH * HTTP/1.1 
773,192.168.56.101,239.255.255.250,SSDP,M-SEARCH * HTTP/1.1 
774,192.168.56.101,239.255.255.250,SSDP,M-SEARCH * HTTP/1.1 
775,192.168.56.101,239.255.255.250,SSDP,M-SEARCH * HTTP/1.1 
776,192.168.56.101,239.255.255.250,SSDP,M-SEARCH * HTTP/1.1 
777,192.168.56.101,239.255.255.250,SSDP,M-SEARCH * HTTP/1.1 
778,192.168.56.101,239.255.255.250,SSDP,M-SEARCH * HTTP/1.1 
779,192.168.56.101,239.255.255.250,SSDP,M-SEARCH * HTTP/1.1 
780,192.168.56.101,239.255.255.250,SSDP,M-SEARCH * HTTP/1.1 
781,192.168.56.101,239.255.255.250,SSDP,M-SEARCH * HTTP/1.1 
782,192.168.56.101,239.255.255.250,SSDP,M-SEARCH * HTTP/1.1 
783,192.168.56.101,239.255.255.250,SSDP,M-SEARCH * HTTP/1.1 
784,192.168.56.101,239.255.255.250,SSDP,M-SEARCH * HTTP/1.1 
785,192.168.56.101,239.255.255.250,SSDP,M-SEARCH * HTTP/1.1 
786,192.168.56.101,239.255.255.250,SSDP,M-SEARCH * HTTP/1.1 
787,192.168.56.101,239.255.255.250,SSDP,M-SEARCH * HTTP/1.1 
788,192.168.56.101,239.255.255.250,SSDP,M-SEARCH * HTTP/1.1 
789,192.168.56.101,239.255.255.250,SSDP,M-SEARCH * HTTP/1.1 
790,192.168.56.101,239.255.255.250,SSDP,M-SEARCH * HTTP/1.1 
791,192.168.56.101,239.255.255.250,SSDP,M-SEARCH * HTTP/1.1 
792,192.168.56.101,239.255.255.250,SSDP,M-SEARCH * HTTP/1.1 
793,192.168.56.101,239.255.255.250,SSDP,M-SEARCH * HTTP/1.1 
794,192.168.56.101,239.255.255.250,SSDP,M-SEARCH * HTTP/1.1 
795,192.168.56.101,239.255.255.250,SSDP,M-SEARCH * HTTP/1.1 
796,192.168.56.101,239.255.255.250,SSDP,M-SEARCH * HTTP/1.1 
797,192.168.56.101,239.255.255.250,SSDP,M-SEARCH * HTTP/1.1 
798,192.168.56.101,239.255.255.250,SSDP,M-SEARCH * HTTP/1.1 
799,192.168.56.101,239.255.255.250,SSDP,M-SEARCH * HTTP/1.1 
800,192.168.56.101,239.255.255.250,SSDP,M-SEARCH * HTTP/1.1 
801,192.168.56.101,239.255.255.250,SSDP,M-SEARCH * HTTP/1.1 
802,192.168.56.101,239.255.255.250,SSDP,M-SEARCH * HTTP/1.1 
803,192.168.56.101,239.255.255.250,SSDP,M-SEARCH * HTTP/1.1 
804,192.168.56.101,239.255.255.250,SSDP,M-SEARCH * HTTP/1.1 
805,192.168.56.101,239.255.255.250,UDP,57521  >  3702 Len=624
806,192.168.56.101,239.255.255.250,UDP,57521  >  3702 Len=624
807,192.168.56.101,239.255.255.250,UDP,57521  >  3702 Len=624
808,192.168.56.101,239.255.255.250,UDP,57521  >  3702 Len=624
809,192.168.56.101,40.119.6.228,NTP,"NTP Version 3, client"
810,40.119.6.228,192.168.56.101,NTP,"NTP Version 3, server"
811,192.168.56.101,8.8.8.8,DNS,Standard query 0x09c0 A time.windows.com
812,8.8.8.8,192.168.56.101,DNS,Standard query response 0x09c0 A time.windows.com CNAME twc.trafficmanager.net A 40.119.6.228
813,192.168.56.101,8.8.8.8,DNS,Standard query 0xab76 A www.msftncsi.com
814,8.8.8.8,192.168.56.101,DNS,Standard query response 0xab76 A www.msftncsi.com CNAME www.msftncsi.com.edgesuite.net CNAME a1961.g2.akamai.net A 96.17.176.171 A 96.17.176.177
815,192.168.56.101,8.8.8.8,DNS,Standard query 0x6cfb A clients2.google.com
816,8.8.8.8,192.168.56.101,DNS,Standard query response 0x6cfb A clients2.google.com CNAME clients.l.google.com A 142.250.114.102 A 142.250.114.113 A 142.250.114.100 A 142.250.114.138 A 142.250.114.101 A 142.250.114.139
817,192.168.56.101,8.8.8.8,DNS,Standard query 0x971a A teredo.ipv6.microsoft.com
818,8.8.8.8,192.168.56.101,DNS,Standard query response 0x971a No such name A teredo.ipv6.microsoft.com SOA ns1-04.azure-dns.com
819,192.168.56.101,96.17.176.171,TCP,49160  >  80 [SYN] Seq=0 Win=8192 Len=0 MSS=1460 WS=256 SACK_PERM=1
820,96.17.176.171,192.168.56.101,TCP,"80  >  49160 [SYN, ACK] Seq=0 Ack=1 Win=65535 Len=0 MSS=1460"
821,192.168.56.101,96.17.176.171,TCP,49160  >  80 [ACK] Seq=1 Ack=1 Win=64240 Len=0
822,192.168.56.101,96.17.176.171,HTTP,GET /ncsi.txt HTTP/1.1 
823,96.17.176.171,192.168.56.101,TCP,80  >  49160 [ACK] Seq=1 Ack=98 Win=65535 Len=0
824,96.17.176.171,192.168.56.101,HTTP,HTTP/1.1 200 OK  (text/plain)
825,96.17.176.171,192.168.56.101,TCP,"80  >  49160 [FIN, ACK] Seq=180 Ack=98 Win=65535 Len=0"
826,192.168.56.101,96.17.176.171,TCP,49160  >  80 [ACK] Seq=98 Ack=181 Win=64061 Len=0
827,192.168.56.101,96.17.176.171,TCP,"49160  >  80 [FIN, ACK] Seq=98 Ack=181 Win=64061 Len=0"
828,96.17.176.171,192.168.56.101,TCP,80  >  49160 [ACK] Seq=181 Ack=99 Win=65535 Len=0
