,Source,Destination,Protocol,Info
0,0a:00:27:00:00:00,5a:94:d2:14:5a:51,ARP,Who has 192.168.56.101? Tell 192.168.56.1
1,0a:00:27:00:00:00,5a:94:d2:14:5a:51,ARP,Who has 192.168.56.101? Tell 192.168.56.1
2,0a:00:27:00:00:00,5a:94:d2:14:5a:51,ARP,Who has 192.168.56.101? Tell 192.168.56.1
3,0a:00:27:00:00:00,Broadcast,ARP,Who has 192.168.56.101? Tell 192.168.56.1
4,0a:00:27:00:00:00,Broadcast,ARP,Who has 192.168.56.101? Tell 192.168.56.1
5,0a:00:27:00:00:00,Broadcast,ARP,Who has 192.168.56.101? Tell 192.168.56.1
6,5a:94:d2:14:5a:51,Broadcast,ARP,Who has 192.168.56.101? Tell 0.0.0.0
7,5a:94:d2:14:5a:51,Broadcast,ARP,Who has 192.168.56.101? Tell 0.0.0.0
8,0a:00:27:00:00:00,Broadcast,ARP,Who has 192.168.56.101? Tell 192.168.56.1
9,5a:94:d2:14:5a:51,Broadcast,ARP,Who has 192.168.56.101? Tell 0.0.0.0
10,5a:94:d2:14:5a:51,Broadcast,ARP,Who has 192.168.56.101? Tell 0.0.0.0
11,0a:00:27:00:00:00,Broadcast,ARP,Who has 192.168.56.101? Tell 192.168.56.1
12,5a:94:d2:14:5a:51,Broadcast,ARP,Who has 192.168.56.101? Tell 0.0.0.0
13,5a:94:d2:14:5a:51,Broadcast,ARP,Who has 192.168.56.101? Tell 0.0.0.0
14,0a:00:27:00:00:00,Broadcast,ARP,Who has 192.168.56.101? Tell 192.168.56.1
15,5a:94:d2:14:5a:51,Broadcast,ARP,Who has 192.168.56.1? Tell 192.168.56.101
16,5a:94:d2:14:5a:51,Broadcast,ARP,Who has 192.168.56.1? Tell 192.168.56.101
17,0a:00:27:00:00:00,5a:94:d2:14:5a:51,ARP,192.168.56.1 is at 0a:00:27:00:00:00
18,5a:94:d2:14:5a:51,Broadcast,ARP,Who has 192.168.56.1? Tell 192.168.56.101
19,5a:94:d2:14:5a:51,Broadcast,ARP,Who has 192.168.56.1? Tell 192.168.56.101
20,0a:00:27:00:00:00,5a:94:d2:14:5a:51,ARP,192.168.56.1 is at 0a:00:27:00:00:00
21,5a:94:d2:14:5a:51,Broadcast,ARP,Who has 192.168.56.1? Tell 192.168.56.101
22,5a:94:d2:14:5a:51,Broadcast,ARP,Who has 192.168.56.1? Tell 192.168.56.101
23,0a:00:27:00:00:00,5a:94:d2:14:5a:51,ARP,192.168.56.1 is at 0a:00:27:00:00:00
24,5a:94:d2:14:5a:51,Broadcast,ARP,Who has 192.168.56.1? Tell 192.168.56.101
25,5a:94:d2:14:5a:51,Broadcast,ARP,Who has 192.168.56.1? Tell 192.168.56.101
26,0a:00:27:00:00:00,5a:94:d2:14:5a:51,ARP,192.168.56.1 is at 0a:00:27:00:00:00
27,5a:94:d2:14:5a:51,Broadcast,ARP,Who has 192.168.56.1? Tell 192.168.56.101
28,5a:94:d2:14:5a:51,Broadcast,ARP,Who has 192.168.56.1? Tell 192.168.56.101
29,0a:00:27:00:00:00,5a:94:d2:14:5a:51,ARP,192.168.56.1 is at 0a:00:27:00:00:00
30,192.168.56.101,104.208.16.93,TCP,49189  >  80 [SYN] Seq=0 Win=8192 Len=0 MSS=1460 WS=256 SACK_PERM=1
31,192.168.56.101,104.208.16.93,TCP,[TCP Retransmission] 49189  >  80 [SYN] Seq=0 Win=8192 Len=0 MSS=1460 WS=256 SACK_PERM=1
32,192.168.56.101,104.208.16.93,TCP,[TCP Retransmission] 49189  >  80 [SYN] Seq=0 Win=8192 Len=0 MSS=1460 SACK_PERM=1
33,192.168.56.101,142.251.33.14,TCP,49167  >  443 [SYN] Seq=0 Win=8192 Len=0 MSS=1460 WS=256 SACK_PERM=1
34,142.251.33.14,192.168.56.101,TCP,"443  >  49167 [SYN, ACK] Seq=0 Ack=1 Win=65535 Len=0 MSS=1460"
35,192.168.56.101,142.251.33.14,TCP,49167  >  443 [ACK] Seq=1 Ack=1 Win=64240 Len=0
36,192.168.56.101,142.251.33.14,TLSv1.2,Client Hello
37,142.251.33.14,192.168.56.101,TCP,443  >  49167 [ACK] Seq=1 Ack=162 Win=65535 Len=0
38,142.251.33.14,192.168.56.101,TLSv1.2,Server Hello
39,142.251.33.14,192.168.56.101,TCP,"443  >  49167 [PSH, ACK] Seq=1461 Ack=162 Win=65535 Len=1364 [TCP segment of a reassembled PDU]"
40,192.168.56.101,142.251.33.14,TCP,49167  >  443 [ACK] Seq=162 Ack=2825 Win=64240 Len=0
41,142.251.33.14,192.168.56.101,TCP,443  >  49167 [ACK] Seq=2825 Ack=162 Win=65535 Len=1460 [TCP segment of a reassembled PDU]
42,142.251.33.14,192.168.56.101,TCP,443  >  49167 [ACK] Seq=4285 Ack=162 Win=65535 Len=1460 [TCP segment of a reassembled PDU]
43,142.251.33.14,192.168.56.101,TLSv1.2,"Certificate, Server Key Exchange, Server Hello Done"
44,192.168.56.101,142.251.33.14,TCP,49167  >  443 [ACK] Seq=162 Ack=6661 Win=64240 Len=0
45,192.168.56.101,142.251.33.14,TLSv1.2,"Client Key Exchange, Change Cipher Spec, Encrypted Handshake Message"
46,142.251.33.14,192.168.56.101,TCP,443  >  49167 [ACK] Seq=6661 Ack=288 Win=65535 Len=0
47,142.251.33.14,192.168.56.101,TLSv1.2,"Change Cipher Spec, Encrypted Handshake Message"
48,192.168.56.101,142.251.33.14,TCP,49167  >  443 [ACK] Seq=288 Ack=6712 Win=64189 Len=0
49,192.168.56.101,142.251.33.14,TLSv1.2,Application Data
50,142.251.33.14,192.168.56.101,TCP,443  >  49167 [ACK] Seq=6712 Ack=811 Win=65535 Len=0
51,142.251.33.14,192.168.56.101,TCP,"443  >  49167 [RST, ACK] Seq=6712 Ack=811 Win=65535 Len=0"
52,192.168.56.101,146.185.177.103,TCP,49334  >  9030 [SYN] Seq=0 Win=8192 Len=0 MSS=1460 WS=256 SACK_PERM=1
53,192.168.56.101,146.185.177.103,TCP,[TCP Retransmission] 49334  >  9030 [SYN] Seq=0 Win=8192 Len=0 MSS=1460 WS=256 SACK_PERM=1
54,192.168.56.101,146.185.177.103,TCP,[TCP Retransmission] 49334  >  9030 [SYN] Seq=0 Win=8192 Len=0 MSS=1460 SACK_PERM=1
55,192.168.56.101,148.251.190.229,TCP,49406  >  9010 [SYN] Seq=0 Win=8192 Len=0 MSS=1460 WS=256 SACK_PERM=1
56,148.251.190.229,192.168.56.101,TCP,"9010  >  49406 [SYN, ACK] Seq=0 Ack=1 Win=65535 Len=0 MSS=1460"
57,192.168.56.101,148.251.190.229,TCP,49406  >  9010 [ACK] Seq=1 Ack=1 Win=64240 Len=0
58,192.168.56.101,148.251.190.229,TLSv1.2,Client Hello
59,148.251.190.229,192.168.56.101,TCP,9010  >  49406 [ACK] Seq=1 Ack=207 Win=65535 Len=0
60,148.251.190.229,192.168.56.101,TLSv1.2,"Server Hello, Certificate, Server Key Exchange, Server Hello Done"
61,192.168.56.101,148.251.190.229,TLSv1.2,"Client Key Exchange, Change Cipher Spec, Encrypted Handshake Message"
62,148.251.190.229,192.168.56.101,TCP,9010  >  49406 [ACK] Seq=1012 Ack=333 Win=65535 Len=0
63,148.251.190.229,192.168.56.101,TLSv1.2,"Change Cipher Spec, Encrypted Handshake Message"
64,192.168.56.101,148.251.190.229,TLSv1.2,Application Data
65,148.251.190.229,192.168.56.101,TCP,9010  >  49406 [ACK] Seq=1063 Ack=371 Win=65535 Len=0
66,148.251.190.229,192.168.56.101,TCP,"9010  >  49406 [PSH, ACK] Seq=1063 Ack=371 Win=65535 Len=1460 [TCP segment of a reassembled PDU]"
67,148.251.190.229,192.168.56.101,TLSv1.2,Application Data
68,192.168.56.101,148.251.190.229,TCP,49406  >  9010 [ACK] Seq=371 Ack=3121 Win=64240 Len=0
69,192.168.56.101,172.217.14.174,TCP,49188  >  443 [SYN] Seq=0 Win=8192 Len=0 MSS=1460 WS=256 SACK_PERM=1
70,172.217.14.174,192.168.56.101,TCP,"443  >  49188 [SYN, ACK] Seq=0 Ack=1 Win=65535 Len=0 MSS=1460"
71,192.168.56.101,172.217.14.174,TCP,49188  >  443 [ACK] Seq=1 Ack=1 Win=64240 Len=0
72,192.168.56.101,172.217.14.174,TLSv1,Client Hello
73,172.217.14.174,192.168.56.101,TCP,443  >  49188 [ACK] Seq=1 Ack=124 Win=65535 Len=0
74,172.217.14.174,192.168.56.101,TLSv1,Server Hello
75,172.217.14.174,192.168.56.101,TCP,"443  >  49188 [PSH, ACK] Seq=1413 Ack=124 Win=65535 Len=1412 [TCP segment of a reassembled PDU]"
76,192.168.56.101,172.217.14.174,TCP,49188  >  443 [ACK] Seq=124 Ack=2825 Win=64240 Len=0
77,172.217.14.174,192.168.56.101,TCP,"443  >  49188 [PSH, ACK] Seq=2825 Ack=124 Win=65535 Len=1412 [TCP segment of a reassembled PDU]"
78,172.217.14.174,192.168.56.101,TCP,"443  >  49188 [PSH, ACK] Seq=4237 Ack=124 Win=65535 Len=1412 [TCP segment of a reassembled PDU]"
79,172.217.14.174,192.168.56.101,TLSv1,"Certificate, Server Key Exchange, Server Hello Done"
80,192.168.56.101,172.217.14.174,TCP,49188  >  443 [ACK] Seq=124 Ack=6660 Win=64240 Len=0
81,192.168.56.101,172.217.14.174,TLSv1,"Client Key Exchange, Change Cipher Spec, Encrypted Handshake Message"
82,172.217.14.174,192.168.56.101,TCP,443  >  49188 [ACK] Seq=6660 Ack=258 Win=65535 Len=0
83,172.217.14.174,192.168.56.101,TLSv1,"Change Cipher Spec, Encrypted Handshake Message"
84,192.168.56.101,172.217.14.174,TLSv1,Application Data
85,172.217.14.174,192.168.56.101,TCP,443  >  49188 [ACK] Seq=6719 Ack=775 Win=65535 Len=0
86,172.217.14.174,192.168.56.101,TLSv1,Application Data
87,192.168.56.101,172.217.14.174,TCP,49188  >  443 [ACK] Seq=775 Ack=6996 Win=63904 Len=0
88,192.168.56.101,176.10.104.240,TCP,49325  >  8443 [SYN] Seq=0 Win=8192 Len=0 MSS=1460 WS=256 SACK_PERM=1
89,192.168.56.101,176.10.104.240,TCP,[TCP Retransmission] 49325  >  8443 [SYN] Seq=0 Win=8192 Len=0 MSS=1460 WS=256 SACK_PERM=1
90,192.168.56.101,176.10.104.240,TCP,[TCP Retransmission] 49325  >  8443 [SYN] Seq=0 Win=8192 Len=0 MSS=1460 SACK_PERM=1
91,192.168.56.101,192.168.56.255,NBNS,Registration NB NONE<00>
92,192.168.56.101,192.168.56.255,NBNS,Registration NB NONE<00>
93,192.168.56.101,192.168.56.255,NBNS,Registration NB WORKGROUP<00>
94,192.168.56.101,192.168.56.255,NBNS,Registration NB WORKGROUP<00>
95,192.168.56.101,192.168.56.255,NBNS,Registration NB NONE<20>
96,192.168.56.101,192.168.56.255,NBNS,Registration NB NONE<20>
97,192.168.56.101,192.168.56.255,NBNS,Name query NB ISATAP<00>
98,192.168.56.101,192.168.56.255,NBNS,Name query NB ISATAP<00>
99,192.168.56.101,192.168.56.255,NBNS,Registration NB NONE<00>
100,192.168.56.101,192.168.56.255,NBNS,Registration NB NONE<00>
101,192.168.56.101,192.168.56.255,NBNS,Registration NB WORKGROUP<00>
102,192.168.56.101,192.168.56.255,NBNS,Registration NB WORKGROUP<00>
103,192.168.56.101,192.168.56.255,NBNS,Registration NB NONE<20>
104,192.168.56.101,192.168.56.255,NBNS,Registration NB NONE<20>
105,192.168.56.101,192.168.56.255,NBNS,Name query NB ISATAP<00>
106,192.168.56.101,192.168.56.255,NBNS,Name query NB ISATAP<00>
107,192.168.56.101,192.168.56.255,NBNS,Registration NB NONE<00>
108,192.168.56.101,192.168.56.255,NBNS,Registration NB NONE<00>
109,192.168.56.101,192.168.56.255,NBNS,Registration NB WORKGROUP<00>
110,192.168.56.101,192.168.56.255,NBNS,Registration NB WORKGROUP<00>
111,192.168.56.101,192.168.56.255,NBNS,Registration NB NONE<20>
112,192.168.56.101,192.168.56.255,NBNS,Registration NB NONE<20>
113,192.168.56.101,192.168.56.255,NBNS,Name query NB WPAD<00>
114,192.168.56.101,192.168.56.255,NBNS,Name query NB WPAD<00>
115,192.168.56.101,192.168.56.255,NBNS,Name query NB ISATAP<00>
116,192.168.56.101,192.168.56.255,NBNS,Name query NB ISATAP<00>
117,192.168.56.101,192.168.56.255,NBNS,Registration NB NONE<00>
118,192.168.56.101,192.168.56.255,NBNS,Registration NB NONE<00>
119,192.168.56.101,192.168.56.255,NBNS,Registration NB WORKGROUP<00>
120,192.168.56.101,192.168.56.255,NBNS,Registration NB WORKGROUP<00>
121,192.168.56.101,192.168.56.255,NBNS,Registration NB NONE<20>
122,192.168.56.101,192.168.56.255,NBNS,Registration NB NONE<20>
123,192.168.56.101,192.168.56.255,NBNS,Name query NB WPAD<00>
124,192.168.56.101,192.168.56.255,NBNS,Name query NB WPAD<00>
125,192.168.56.101,192.168.56.255,NBNS,Name query NB ISATAP<00>
126,192.168.56.101,192.168.56.255,NBNS,Name query NB ISATAP<00>
127,192.168.56.101,192.168.56.255,NBNS,Registration NB WORKGROUP<1e>
128,192.168.56.101,192.168.56.255,NBNS,Registration NB WORKGROUP<1e>
129,192.168.56.101,192.168.56.255,NBNS,Name query NB WPAD<00>
130,192.168.56.101,192.168.56.255,NBNS,Name query NB WPAD<00>
131,192.168.56.101,192.168.56.255,NBNS,Name query NB ISATAP<00>
132,192.168.56.101,192.168.56.255,NBNS,Name query NB ISATAP<00>
133,192.168.56.101,192.168.56.255,NBNS,Registration NB WORKGROUP<1e>
134,192.168.56.101,192.168.56.255,NBNS,Registration NB WORKGROUP<1e>
135,192.168.56.101,192.168.56.255,NBNS,Name query NB ISATAP<00>
136,192.168.56.101,192.168.56.255,NBNS,Name query NB ISATAP<00>
137,192.168.56.101,192.168.56.255,NBNS,Registration NB WORKGROUP<1e>
138,192.168.56.101,192.168.56.255,NBNS,Registration NB WORKGROUP<1e>
139,192.168.56.101,192.168.56.255,NBNS,Registration NB WORKGROUP<1e>
140,192.168.56.101,192.168.56.255,NBNS,Registration NB WORKGROUP<1e>
141,192.168.56.101,192.168.56.255,NBNS,Name query NB ISATAP<00>
142,192.168.56.101,192.168.56.255,NBNS,Name query NB ISATAP<00>
143,192.168.56.101,192.168.56.255,NBNS,Name query NB ISATAP<00>
144,192.168.56.101,192.168.56.255,NBNS,Name query NB ISATAP<00>
145,192.168.56.101,192.168.56.255,NBNS,Name query NB ISATAP<00>
146,192.168.56.101,192.168.56.255,NBNS,Name query NB ISATAP<00>
147,192.168.56.101,192.168.56.255,NBNS,Name query NB ISATAP<00>
148,192.168.56.101,192.168.56.255,NBNS,Name query NB ISATAP<00>
149,192.168.56.101,192.168.56.255,NBNS,Name query NB ISATAP<00>
150,192.168.56.101,192.168.56.255,NBNS,Name query NB ISATAP<00>
151,192.168.56.101,192.168.56.255,NBNS,Name query NB ISATAP<00>
152,192.168.56.101,192.168.56.255,NBNS,Name query NB ISATAP<00>
153,192.168.56.101,192.168.56.255,NBNS,Name query NB ISATAP<00>
154,192.168.56.101,192.168.56.255,NBNS,Name query NB ISATAP<00>
155,192.168.56.101,192.168.56.255,NBNS,Name query NB ISATAP<00>
156,192.168.56.101,192.168.56.255,NBNS,Name query NB ISATAP<00>
157,192.168.56.101,192.168.56.255,NBNS,Name query NB ISATAP<00>
158,192.168.56.101,192.168.56.255,NBNS,Name query NB ISATAP<00>
159,192.168.56.101,192.168.56.255,NBNS,Registration NB WORKGROUP<1d>
160,192.168.56.101,192.168.56.255,NBNS,Registration NB WORKGROUP<1d>
161,192.168.56.101,192.168.56.255,NBNS,Registration NB WORKGROUP<1d>
162,192.168.56.101,192.168.56.255,NBNS,Registration NB WORKGROUP<1d>
163,192.168.56.101,192.168.56.255,NBNS,Registration NB WORKGROUP<1d>
164,192.168.56.101,192.168.56.255,NBNS,Registration NB WORKGROUP<1d>
165,192.168.56.101,192.168.56.255,NBNS,Registration NB WORKGROUP<1d>
166,192.168.56.101,192.168.56.255,NBNS,Registration NB WORKGROUP<1d>
167,192.168.56.101,192.168.56.255,NBNS,Registration NB <01><02>__MSBROWSE__<02><01>
168,192.168.56.101,192.168.56.255,NBNS,Registration NB <01><02>__MSBROWSE__<02><01>
169,192.168.56.101,192.168.56.255,NBNS,Registration NB <01><02>__MSBROWSE__<02><01>
170,192.168.56.101,192.168.56.255,NBNS,Registration NB <01><02>__MSBROWSE__<02><01>
171,192.168.56.101,192.168.56.255,NBNS,Registration NB <01><02>__MSBROWSE__<02><01>
172,192.168.56.101,192.168.56.255,NBNS,Registration NB <01><02>__MSBROWSE__<02><01>
173,192.168.56.101,192.168.56.255,NBNS,Registration NB <01><02>__MSBROWSE__<02><01>
174,192.168.56.101,192.168.56.255,NBNS,Registration NB <01><02>__MSBROWSE__<02><01>
175,192.168.56.101,192.168.56.255,NBNS,Name query NB WPAD<00>
176,192.168.56.101,192.168.56.255,NBNS,Name query NB WPAD<00>
177,192.168.56.101,192.168.56.255,NBNS,Name query NB WPAD<00>
178,192.168.56.101,192.168.56.255,NBNS,Name query NB WPAD<00>
179,192.168.56.101,192.168.56.255,NBNS,Name query NB WPAD<00>
180,192.168.56.101,192.168.56.255,NBNS,Name query NB WPAD<00>
181,192.168.56.101,192.168.56.255,NBNS,Name query NB WPAD<00>
182,192.168.56.101,192.168.56.255,NBNS,Name query NB WPAD<00>
183,192.168.56.101,192.168.56.255,NBNS,Name query NB WPAD<00>
184,192.168.56.101,192.168.56.255,NBNS,Name query NB WPAD<00>
185,192.168.56.101,192.168.56.255,NBNS,Name query NB WPAD<00>
186,192.168.56.101,192.168.56.255,NBNS,Name query NB WPAD<00>
187,192.168.56.101,192.168.56.255,NBNS,Name query NB WPAD<00>
188,192.168.56.101,192.168.56.255,NBNS,Name query NB WPAD<00>
189,192.168.56.101,192.168.56.255,NBNS,Name query NB WPAD<00>
190,192.168.56.101,192.168.56.255,NBNS,Name query NB WPAD<00>
191,192.168.56.101,192.168.56.255,NBNS,Name query NB WPAD<00>
192,192.168.56.101,192.168.56.255,NBNS,Name query NB WPAD<00>
193,192.168.56.101,192.168.56.255,NBNS,Name query NB WPAD<00>
194,192.168.56.101,192.168.56.255,NBNS,Name query NB WPAD<00>
195,192.168.56.101,192.168.56.255,NBNS,Name query NB WPAD<00>
196,192.168.56.101,192.168.56.255,NBNS,Name query NB WPAD<00>
197,192.168.56.101,192.168.56.255,NBNS,Name query NB WPAD<00>
198,192.168.56.101,192.168.56.255,NBNS,Name query NB WPAD<00>
199,192.168.56.101,192.168.56.255,BROWSER,Request Announcement NONE
200,192.168.56.101,192.168.56.255,BROWSER,Request Announcement NONE
201,192.168.56.101,192.168.56.255,BROWSER,"Host Announcement NONE, Workstation, Server, NT Workstation, Potential Browser"
202,192.168.56.101,192.168.56.255,BROWSER,"Host Announcement NONE, Workstation, Server, NT Workstation, Potential Browser"
203,192.168.56.101,192.168.56.255,BROWSER,Request Announcement NONE
204,192.168.56.101,192.168.56.255,BROWSER,Request Announcement NONE
205,192.168.56.101,192.168.56.255,BROWSER,Request Announcement NONE
206,192.168.56.101,192.168.56.255,BROWSER,Request Announcement NONE
207,192.168.56.101,192.168.56.255,BROWSER,Request Announcement NONE
208,192.168.56.101,192.168.56.255,BROWSER,Request Announcement NONE
209,192.168.56.101,192.168.56.255,BROWSER,Browser Election Request
210,192.168.56.101,192.168.56.255,BROWSER,Browser Election Request
211,192.168.56.101,192.168.56.255,BROWSER,Browser Election Request
212,192.168.56.101,192.168.56.255,BROWSER,Browser Election Request
213,192.168.56.101,192.168.56.255,BROWSER,Browser Election Request
214,192.168.56.101,192.168.56.255,BROWSER,Browser Election Request
215,192.168.56.101,192.168.56.255,BROWSER,Browser Election Request
216,192.168.56.101,192.168.56.255,BROWSER,Browser Election Request
217,192.168.56.101,192.168.56.255,BROWSER,Request Announcement NONE
218,192.168.56.101,192.168.56.255,BROWSER,Request Announcement NONE
219,192.168.56.101,192.168.56.255,BROWSER,Request Announcement NONE
220,192.168.56.101,192.168.56.255,BROWSER,Request Announcement NONE
221,192.168.56.101,192.168.56.255,BROWSER,"Domain/Workgroup Announcement WORKGROUP, NT Workstation, Domain Enum"
222,192.168.56.101,192.168.56.255,BROWSER,"Domain/Workgroup Announcement WORKGROUP, NT Workstation, Domain Enum"
223,192.168.56.101,192.168.56.255,BROWSER,"Local Master Announcement NONE, Workstation, Server, NT Workstation, Potential Browser, Master Browser"
224,192.168.56.101,192.168.56.255,BROWSER,"Local Master Announcement NONE, Workstation, Server, NT Workstation, Potential Browser, Master Browser"
225,192.168.56.101,192.168.56.255,BROWSER,"Domain/Workgroup Announcement WORKGROUP, NT Workstation, Domain Enum"
226,192.168.56.101,192.168.56.255,BROWSER,"Domain/Workgroup Announcement WORKGROUP, NT Workstation, Domain Enum"
227,192.168.56.101,192.168.56.255,BROWSER,"Domain/Workgroup Announcement WORKGROUP, NT Workstation, Domain Enum"
228,192.168.56.101,192.168.56.255,BROWSER,"Domain/Workgroup Announcement WORKGROUP, NT Workstation, Domain Enum"
229,192.168.56.101,193.23.244.244,TCP,49326  >  443 [SYN] Seq=0 Win=8192 Len=0 MSS=1460 WS=256 SACK_PERM=1
230,193.23.244.244,192.168.56.101,TCP,"443  >  49326 [SYN, ACK] Seq=0 Ack=1 Win=65535 Len=0 MSS=1460"
231,192.168.56.101,193.23.244.244,TCP,49326  >  443 [ACK] Seq=1 Ack=1 Win=64240 Len=0
232,192.168.56.101,193.23.244.244,TLSv1.2,Client Hello
233,193.23.244.244,192.168.56.101,TCP,443  >  49326 [ACK] Seq=1 Ack=226 Win=65535 Len=0
234,193.23.244.244,192.168.56.101,TLSv1.2,"Server Hello, Certificate, Server Key Exchange, Server Hello Done"
235,192.168.56.101,193.23.244.244,TLSv1.2,"Client Key Exchange, Change Cipher Spec, Encrypted Handshake Message"
236,193.23.244.244,192.168.56.101,TCP,443  >  49326 [ACK] Seq=1018 Ack=352 Win=65535 Len=0
237,193.23.244.244,192.168.56.101,TLSv1.2,"Change Cipher Spec, Encrypted Handshake Message"
238,192.168.56.101,193.23.244.244,TLSv1.2,Application Data
239,193.23.244.244,192.168.56.101,TCP,443  >  49326 [ACK] Seq=1069 Ack=390 Win=65535 Len=0
240,193.23.244.244,192.168.56.101,TCP,443  >  49326 [ACK] Seq=1069 Ack=390 Win=65535 Len=1460 [TCP segment of a reassembled PDU]
241,193.23.244.244,192.168.56.101,TLSv1.2,Application Data
242,192.168.56.101,193.23.244.244,TCP,49326  >  443 [ACK] Seq=390 Ack=3149 Win=64240 Len=0
243,192.168.56.101,193.23.244.244,TLSv1.2,Application Data
244,193.23.244.244,192.168.56.101,TCP,443  >  49326 [ACK] Seq=3149 Ack=1447 Win=65535 Len=0
245,193.23.244.244,192.168.56.101,TLSv1.2,Application Data
246,192.168.56.101,193.23.244.244,TLSv1.2,Application Data
247,193.23.244.244,192.168.56.101,TCP,443  >  49326 [ACK] Seq=3692 Ack=2504 Win=65535 Len=0
248,193.23.244.244,192.168.56.101,TLSv1.2,Application Data
249,193.23.244.244,192.168.56.101,TCP,"443  >  49326 [PSH, ACK] Seq=4235 Ack=2504 Win=65535 Len=1460 [TCP segment of a reassembled PDU]"
250,193.23.244.244,192.168.56.101,TCP,"443  >  49326 [PSH, ACK] Seq=5695 Ack=2504 Win=65535 Len=1460 [TCP segment of a reassembled PDU]"
251,193.23.244.244,192.168.56.101,TLSv1.2,Application Data
252,192.168.56.101,193.23.244.244,TCP,49326  >  443 [ACK] Seq=2504 Ack=7155 Win=64240 Len=0
253,193.23.244.244,192.168.56.101,TCP,"443  >  49326 [PSH, ACK] Seq=8312 Ack=2504 Win=65535 Len=1460 [TCP segment of a reassembled PDU]"
254,193.23.244.244,192.168.56.101,TCP,"443  >  49326 [PSH, ACK] Seq=9772 Ack=2504 Win=65535 Len=1460 [TCP segment of a reassembled PDU]"
255,192.168.56.101,193.23.244.244,TCP,49326  >  443 [ACK] Seq=2504 Ack=9772 Win=64240 Len=0
256,193.23.244.244,192.168.56.101,TLSv1.2,Application Data [TCP segment of a reassembled PDU]
257,193.23.244.244,192.168.56.101,TCP,"443  >  49326 [PSH, ACK] Seq=12692 Ack=2504 Win=65535 Len=1460 [TCP segment of a reassembled PDU]"
258,192.168.56.101,193.23.244.244,TCP,49326  >  443 [ACK] Seq=2504 Ack=12692 Win=64240 Len=0
259,193.23.244.244,192.168.56.101,TLSv1.2,Application Data [TCP segment of a reassembled PDU]
260,193.23.244.244,192.168.56.101,TLSv1.2,Application Data [TCP segment of a reassembled PDU]
261,192.168.56.101,193.23.244.244,TCP,49326  >  443 [ACK] Seq=2504 Ack=15612 Win=61320 Len=0
262,193.23.244.244,192.168.56.101,TCP,"443  >  49326 [PSH, ACK] Seq=17072 Ack=2504 Win=65535 Len=1460 [TCP segment of a reassembled PDU]"
263,192.168.56.101,193.23.244.244,TCP,[TCP Window Update] 49326  >  443 [ACK] Seq=2504 Ack=15612 Win=64240 Len=0
264,192.168.56.101,193.23.244.244,TCP,49326  >  443 [ACK] Seq=2504 Ack=18532 Win=62780 Len=0
265,193.23.244.244,192.168.56.101,TCP,"443  >  49326 [PSH, ACK] Seq=18532 Ack=2504 Win=65535 Len=1460 [TCP segment of a reassembled PDU]"
266,193.23.244.244,192.168.56.101,TLSv1.2,Application Data [TCP segment of a reassembled PDU]
267,192.168.56.101,193.23.244.244,TCP,49326  >  443 [ACK] Seq=2504 Ack=21452 Win=59860 Len=0
268,192.168.56.101,193.23.244.244,TCP,[TCP Window Update] 49326  >  443 [ACK] Seq=2504 Ack=21452 Win=63332 Len=0
269,193.23.244.244,192.168.56.101,TLSv1.2,Application Data [TCP segment of a reassembled PDU]
270,193.23.244.244,192.168.56.101,TCP,"443  >  49326 [PSH, ACK] Seq=22912 Ack=2504 Win=65535 Len=1460 [TCP segment of a reassembled PDU]"
271,192.168.56.101,193.23.244.244,TCP,49326  >  443 [ACK] Seq=2504 Ack=24372 Win=64240 Len=0
272,193.23.244.244,192.168.56.101,TCP,"443  >  49326 [PSH, ACK] Seq=24372 Ack=2504 Win=65535 Len=1460 [TCP segment of a reassembled PDU]"
273,193.23.244.244,192.168.56.101,TLSv1.2,"Application Data, Application Data"
274,192.168.56.101,193.23.244.244,TCP,49326  >  443 [ACK] Seq=2504 Ack=27292 Win=64240 Len=0
275,193.23.244.244,192.168.56.101,TCP,"443  >  49326 [PSH, ACK] Seq=27292 Ack=2504 Win=65535 Len=1460 [TCP segment of a reassembled PDU]"
276,193.23.244.244,192.168.56.101,TCP,"443  >  49326 [PSH, ACK] Seq=28752 Ack=2504 Win=65535 Len=1460 [TCP segment of a reassembled PDU]"
277,193.23.244.244,192.168.56.101,TLSv1.2,Application Data [TCP segment of a reassembled PDU]
278,192.168.56.101,193.23.244.244,TCP,49326  >  443 [ACK] Seq=2504 Ack=31672 Win=64240 Len=0
279,193.23.244.244,192.168.56.101,TCP,"443  >  49326 [PSH, ACK] Seq=31672 Ack=2504 Win=65535 Len=1460 [TCP segment of a reassembled PDU]"
280,193.23.244.244,192.168.56.101,TLSv1.2,Application Data [TCP segment of a reassembled PDU]
281,192.168.56.101,193.23.244.244,TCP,49326  >  443 [ACK] Seq=2504 Ack=34592 Win=64240 Len=0
282,193.23.244.244,192.168.56.101,TCP,443  >  49326 [ACK] Seq=34592 Ack=2504 Win=65535 Len=1460 [TCP segment of a reassembled PDU]
283,193.23.244.244,192.168.56.101,TCP,443  >  49326 [ACK] Seq=36052 Ack=2504 Win=65535 Len=1460 [TCP segment of a reassembled PDU]
284,193.23.244.244,192.168.56.101,TLSv1.2,Application Data [TCP segment of a reassembled PDU]
285,193.23.244.244,192.168.56.101,TLSv1.2,Application Data [TCP segment of a reassembled PDU]
286,193.23.244.244,192.168.56.101,TCP,443  >  49326 [ACK] Seq=40432 Ack=2504 Win=65535 Len=1460 [TCP segment of a reassembled PDU]
287,193.23.244.244,192.168.56.101,TCP,443  >  49326 [ACK] Seq=41892 Ack=2504 Win=65535 Len=1460 [TCP segment of a reassembled PDU]
288,193.23.244.244,192.168.56.101,TLSv1.2,Application Data [TCP segment of a reassembled PDU]
289,193.23.244.244,192.168.56.101,TCP,443  >  49326 [ACK] Seq=44812 Ack=2504 Win=65535 Len=1460 [TCP segment of a reassembled PDU]
290,193.23.244.244,192.168.56.101,TLSv1.2,Application Data [TCP segment of a reassembled PDU]
291,193.23.244.244,192.168.56.101,TCP,"443  >  49326 [PSH, ACK] Seq=47732 Ack=2504 Win=65535 Len=1460 [TCP segment of a reassembled PDU]"
292,192.168.56.101,193.23.244.244,TCP,49326  >  443 [ACK] Seq=2504 Ack=43352 Win=59860 Len=0
293,192.168.56.101,193.23.244.244,TCP,49326  >  443 [ACK] Seq=2504 Ack=49192 Win=54020 Len=0
294,192.168.56.101,193.23.244.244,TCP,[TCP Window Update] 49326  >  443 [ACK] Seq=2504 Ack=49192 Win=64240 Len=0
295,193.23.244.244,192.168.56.101,TCP,"443  >  49326 [PSH, ACK] Seq=49192 Ack=2504 Win=65535 Len=1460 [TCP segment of a reassembled PDU]"
296,193.23.244.244,192.168.56.101,TLSv1.2,Application Data [TCP segment of a reassembled PDU]
297,192.168.56.101,193.23.244.244,TCP,49326  >  443 [ACK] Seq=2504 Ack=52112 Win=61320 Len=0
298,193.23.244.244,192.168.56.101,TCP,"443  >  49326 [PSH, ACK] Seq=52112 Ack=2504 Win=65535 Len=1460 [TCP segment of a reassembled PDU]"
299,192.168.56.101,193.23.244.244,TLSv1.2,Application Data
300,193.23.244.244,192.168.56.101,TCP,443  >  49326 [ACK] Seq=53572 Ack=3047 Win=65535 Len=0
301,192.168.56.101,193.23.244.244,TCP,[TCP Window Update] 49326  >  443 [ACK] Seq=3047 Ack=53572 Win=63332 Len=0
302,193.23.244.244,192.168.56.101,TCP,"443  >  49326 [PSH, ACK] Seq=53572 Ack=3047 Win=65535 Len=1460 [TCP segment of a reassembled PDU]"
303,193.23.244.244,192.168.56.101,TLSv1.2,Application Data [TCP segment of a reassembled PDU]
304,192.168.56.101,193.23.244.244,TCP,49326  >  443 [ACK] Seq=3047 Ack=56492 Win=64240 Len=0
305,193.23.244.244,192.168.56.101,TCP,"443  >  49326 [PSH, ACK] Seq=56492 Ack=3047 Win=65535 Len=1460 [TCP segment of a reassembled PDU]"
306,193.23.244.244,192.168.56.101,TCP,"443  >  49326 [PSH, ACK] Seq=57952 Ack=3047 Win=65535 Len=1460 [TCP segment of a reassembled PDU]"
307,192.168.56.101,193.23.244.244,TCP,49326  >  443 [ACK] Seq=3047 Ack=59412 Win=64240 Len=0
308,193.23.244.244,192.168.56.101,TLSv1.2,"Application Data, Application Data"
309,193.23.244.244,192.168.56.101,TCP,"443  >  49326 [PSH, ACK] Seq=60872 Ack=3047 Win=65535 Len=1460 [TCP segment of a reassembled PDU]"
310,192.168.56.101,193.23.244.244,TCP,49326  >  443 [ACK] Seq=3047 Ack=62332 Win=64240 Len=0
311,192.168.56.101,193.23.244.244,TLSv1.2,Application Data
312,193.23.244.244,192.168.56.101,TCP,443  >  49326 [ACK] Seq=62332 Ack=4104 Win=65535 Len=0
313,193.23.244.244,192.168.56.101,TCP,"443  >  49326 [PSH, ACK] Seq=62332 Ack=4104 Win=65535 Len=1460 [TCP segment of a reassembled PDU]"
314,193.23.244.244,192.168.56.101,TLSv1.2,Application Data [TCP segment of a reassembled PDU]
315,193.23.244.244,192.168.56.101,TCP,"443  >  49326 [PSH, ACK] Seq=65252 Ack=4104 Win=65535 Len=1460 [TCP segment of a reassembled PDU]"
316,193.23.244.244,192.168.56.101,TLSv1.2,Application Data [TCP segment of a reassembled PDU]
317,192.168.56.101,193.23.244.244,TCP,49326  >  443 [ACK] Seq=4104 Ack=66712 Win=64240 Len=0
318,193.23.244.244,192.168.56.101,TCP,"443  >  49326 [PSH, ACK] Seq=68172 Ack=4104 Win=65535 Len=1460 [TCP segment of a reassembled PDU]"
319,192.168.56.101,193.23.244.244,TCP,49326  >  443 [ACK] Seq=4104 Ack=69632 Win=64240 Len=0
320,193.23.244.244,192.168.56.101,TCP,"443  >  49326 [PSH, ACK] Seq=69632 Ack=4104 Win=65535 Len=1460 [TCP segment of a reassembled PDU]"
321,193.23.244.244,192.168.56.101,TLSv1.2,Application Data [TCP segment of a reassembled PDU]
322,192.168.56.101,193.23.244.244,TCP,49326  >  443 [ACK] Seq=4104 Ack=72552 Win=62780 Len=0
323,193.23.244.244,192.168.56.101,TCP,"443  >  49326 [PSH, ACK] Seq=72552 Ack=4104 Win=65535 Len=1460 [TCP segment of a reassembled PDU]"
324,193.23.244.244,192.168.56.101,TCP,"443  >  49326 [PSH, ACK] Seq=74012 Ack=4104 Win=65535 Len=1460 [TCP segment of a reassembled PDU]"
325,193.23.244.244,192.168.56.101,TLSv1.2,Application Data [TCP segment of a reassembled PDU]
326,192.168.56.101,193.23.244.244,TCP,49326  >  443 [ACK] Seq=4104 Ack=75472 Win=59860 Len=0
327,192.168.56.101,193.23.244.244,TCP,[TCP Window Update] 49326  >  443 [ACK] Seq=4104 Ack=75472 Win=63332 Len=0
328,193.23.244.244,192.168.56.101,TCP,"443  >  49326 [PSH, ACK] Seq=76932 Ack=4104 Win=65535 Len=1460 [TCP segment of a reassembled PDU]"
329,192.168.56.101,193.23.244.244,TCP,49326  >  443 [ACK] Seq=4104 Ack=78392 Win=60412 Len=0
330,193.23.244.244,192.168.56.101,TCP,"443  >  49326 [PSH, ACK] Seq=78392 Ack=4104 Win=65535 Len=1460 [TCP segment of a reassembled PDU]"
331,193.23.244.244,192.168.56.101,TLSv1.2,Application Data [TCP segment of a reassembled PDU]
332,192.168.56.101,193.23.244.244,TCP,49326  >  443 [ACK] Seq=4104 Ack=81312 Win=57492 Len=0
333,193.23.244.244,192.168.56.101,TCP,"443  >  49326 [PSH, ACK] Seq=81312 Ack=4104 Win=65535 Len=1460 [TCP segment of a reassembled PDU]"
334,193.23.244.244,192.168.56.101,TCP,"443  >  49326 [PSH, ACK] Seq=82772 Ack=4104 Win=65535 Len=1460 [TCP segment of a reassembled PDU]"
335,192.168.56.101,193.23.244.244,TCP,49326  >  443 [ACK] Seq=4104 Ack=84232 Win=54572 Len=0
336,192.168.56.101,193.23.244.244,TCP,[TCP Window Update] 49326  >  443 [ACK] Seq=4104 Ack=84232 Win=58044 Len=0
337,193.23.244.244,192.168.56.101,TLSv1.2,Application Data [TCP segment of a reassembled PDU]
338,193.23.244.244,192.168.56.101,TCP,"443  >  49326 [PSH, ACK] Seq=85692 Ack=4104 Win=65535 Len=1460 [TCP segment of a reassembled PDU]"
339,193.23.244.244,192.168.56.101,TLSv1.2,Application Data [TCP segment of a reassembled PDU]
340,192.168.56.101,193.23.244.244,TCP,49326  >  443 [ACK] Seq=4104 Ack=87152 Win=55124 Len=0
341,193.23.244.244,192.168.56.101,TCP,"443  >  49326 [PSH, ACK] Seq=88612 Ack=4104 Win=65535 Len=1460 [TCP segment of a reassembled PDU]"
342,192.168.56.101,193.23.244.244,TCP,49326  >  443 [ACK] Seq=4104 Ack=90072 Win=52204 Len=0
343,193.23.244.244,192.168.56.101,TCP,"443  >  49326 [PSH, ACK] Seq=90072 Ack=4104 Win=65535 Len=1460 [TCP segment of a reassembled PDU]"
344,193.23.244.244,192.168.56.101,TLSv1.2,"Application Data, Application Data"
345,193.23.244.244,192.168.56.101,TCP,"443  >  49326 [PSH, ACK] Seq=92992 Ack=4104 Win=65535 Len=1460 [TCP segment of a reassembled PDU]"
346,192.168.56.101,193.23.244.244,TCP,49326  >  443 [ACK] Seq=4104 Ack=92992 Win=49284 Len=0
347,193.23.244.244,192.168.56.101,TCP,"443  >  49326 [PSH, ACK] Seq=94452 Ack=4104 Win=65535 Len=1460 [TCP segment of a reassembled PDU]"
348,192.168.56.101,193.23.244.244,TCP,49326  >  443 [ACK] Seq=4104 Ack=95912 Win=46364 Len=0
349,193.23.244.244,192.168.56.101,TLSv1.2,Application Data [TCP segment of a reassembled PDU]
350,193.23.244.244,192.168.56.101,TCP,"443  >  49326 [PSH, ACK] Seq=97372 Ack=4104 Win=65535 Len=1460 [TCP segment of a reassembled PDU]"
351,193.23.244.244,192.168.56.101,TCP,"443  >  49326 [PSH, ACK] Seq=98832 Ack=4104 Win=65535 Len=1460 [TCP segment of a reassembled PDU]"
352,192.168.56.101,193.23.244.244,TCP,49326  >  443 [ACK] Seq=4104 Ack=98832 Win=43444 Len=0
353,192.168.56.101,193.23.244.244,TCP,49326  >  443 [ACK] Seq=4104 Ack=100292 Win=48180 Len=0
354,193.23.244.244,192.168.56.101,TLSv1.2,Application Data [TCP segment of a reassembled PDU]
355,192.168.56.101,193.23.244.244,TCP,49326  >  443 [ACK] Seq=4104 Ack=101752 Win=62780 Len=0
356,192.168.56.101,193.23.244.244,TLSv1.2,Application Data
357,193.23.244.244,192.168.56.101,TCP,443  >  49326 [ACK] Seq=101752 Ack=4647 Win=65535 Len=0
358,193.23.244.244,192.168.56.101,TCP,"443  >  49326 [PSH, ACK] Seq=101752 Ack=4647 Win=65535 Len=1460 [TCP segment of a reassembled PDU]"
359,193.23.244.244,192.168.56.101,TCP,"443  >  49326 [PSH, ACK] Seq=103212 Ack=4647 Win=65535 Len=1460 [TCP segment of a reassembled PDU]"
360,193.23.244.244,192.168.56.101,TLSv1.2,Application Data [TCP segment of a reassembled PDU]
361,193.23.244.244,192.168.56.101,TCP,"443  >  49326 [PSH, ACK] Seq=106132 Ack=4647 Win=65535 Len=1460 [TCP segment of a reassembled PDU]"
362,193.23.244.244,192.168.56.101,TLSv1.2,Application Data [TCP segment of a reassembled PDU]
363,193.23.244.244,192.168.56.101,TCP,"443  >  49326 [PSH, ACK] Seq=109052 Ack=4647 Win=65535 Len=1460 [TCP segment of a reassembled PDU]"
364,192.168.56.101,193.23.244.244,TCP,49326  >  443 [ACK] Seq=4647 Ack=110512 Win=54020 Len=0
365,192.168.56.101,193.23.244.244,TCP,[TCP Window Update] 49326  >  443 [ACK] Seq=4647 Ack=110512 Win=57492 Len=0
366,193.23.244.244,192.168.56.101,TCP,"443  >  49326 [PSH, ACK] Seq=110512 Ack=4647 Win=65535 Len=1460 [TCP segment of a reassembled PDU]"
367,193.23.244.244,192.168.56.101,TLSv1.2,Application Data [TCP segment of a reassembled PDU]
368,193.23.244.244,192.168.56.101,TCP,"443  >  49326 [PSH, ACK] Seq=113432 Ack=4647 Win=65535 Len=1460 [TCP segment of a reassembled PDU]"
369,192.168.56.101,193.23.244.244,TCP,49326  >  443 [ACK] Seq=4647 Ack=114892 Win=53112 Len=0
370,193.23.244.244,192.168.56.101,TCP,"443  >  49326 [PSH, ACK] Seq=114892 Ack=4647 Win=65535 Len=1460 [TCP segment of a reassembled PDU]"
371,193.23.244.244,192.168.56.101,TLSv1.2,"Application Data, Application Data"
372,193.23.244.244,192.168.56.101,TCP,"443  >  49326 [PSH, ACK] Seq=117812 Ack=4647 Win=65535 Len=1460 [TCP segment of a reassembled PDU]"
373,192.168.56.101,193.23.244.244,TCP,49326  >  443 [ACK] Seq=4647 Ack=117812 Win=50192 Len=0
374,192.168.56.101,193.23.244.244,TCP,49326  >  443 [ACK] Seq=4647 Ack=119272 Win=55480 Len=0
375,192.168.56.101,193.23.244.244,TCP,[TCP Window Update] 49326  >  443 [ACK] Seq=4647 Ack=119272 Win=64240 Len=0
376,192.168.56.101,193.23.244.244,TLSv1.2,Application Data
377,193.23.244.244,192.168.56.101,TCP,443  >  49326 [ACK] Seq=119272 Ack=5704 Win=65535 Len=0
378,193.23.244.244,192.168.56.101,TCP,443  >  49326 [ACK] Seq=119272 Ack=5704 Win=65535 Len=1460 [TCP segment of a reassembled PDU]
379,193.23.244.244,192.168.56.101,TLSv1.2,Application Data [TCP segment of a reassembled PDU]
380,193.23.244.244,192.168.56.101,TCP,"443  >  49326 [PSH, ACK] Seq=122192 Ack=5704 Win=65535 Len=1460 [TCP segment of a reassembled PDU]"
381,192.168.56.101,193.23.244.244,TCP,49326  >  443 [ACK] Seq=5704 Ack=123652 Win=64240 Len=0
382,193.23.244.244,192.168.56.101,TCP,"443  >  49326 [PSH, ACK] Seq=123652 Ack=5704 Win=65535 Len=1460 [TCP segment of a reassembled PDU]"
383,193.23.244.244,192.168.56.101,TLSv1.2,Application Data [TCP segment of a reassembled PDU]
384,192.168.56.101,193.23.244.244,TCP,49326  >  443 [ACK] Seq=5704 Ack=126572 Win=64240 Len=0
385,193.23.244.244,192.168.56.101,TCP,443  >  49326 [ACK] Seq=126572 Ack=5704 Win=65535 Len=1460 [TCP segment of a reassembled PDU]
386,193.23.244.244,192.168.56.101,TLSv1.2,Application Data [TCP segment of a reassembled PDU]
387,193.23.244.244,192.168.56.101,TCP,"443  >  49326 [PSH, ACK] Seq=129492 Ack=5704 Win=65535 Len=1460 [TCP segment of a reassembled PDU]"
388,192.168.56.101,193.23.244.244,TCP,49326  >  443 [ACK] Seq=5704 Ack=130952 Win=62780 Len=0
389,193.23.244.244,192.168.56.101,TCP,443  >  49326 [ACK] Seq=130952 Ack=5704 Win=65535 Len=1460 [TCP segment of a reassembled PDU]
390,193.23.244.244,192.168.56.101,TLSv1.2,Application Data [TCP segment of a reassembled PDU]
391,193.23.244.244,192.168.56.101,TCP,"443  >  49326 [PSH, ACK] Seq=133872 Ack=5704 Win=65535 Len=1460 [TCP segment of a reassembled PDU]"
392,192.168.56.101,193.23.244.244,TCP,49326  >  443 [ACK] Seq=5704 Ack=135332 Win=58400 Len=0
393,192.168.56.101,193.23.244.244,TCP,[TCP Window Update] 49326  >  443 [ACK] Seq=5704 Ack=135332 Win=64240 Len=0
394,193.23.244.244,192.168.56.101,TCP,443  >  49326 [ACK] Seq=135332 Ack=5704 Win=65535 Len=1460 [TCP segment of a reassembled PDU]
395,193.23.244.244,192.168.56.101,TLSv1.2,Application Data [TCP segment of a reassembled PDU]
396,193.23.244.244,192.168.56.101,TCP,443  >  49326 [ACK] Seq=138252 Ack=5704 Win=65535 Len=1460 [TCP segment of a reassembled PDU]
397,193.23.244.244,192.168.56.101,TCP,443  >  49326 [ACK] Seq=139712 Ack=5704 Win=65535 Len=1460 [TCP segment of a reassembled PDU]
398,193.23.244.244,192.168.56.101,TLSv1.2,Application Data [TCP segment of a reassembled PDU]
399,193.23.244.244,192.168.56.101,TCP,"443  >  49326 [PSH, ACK] Seq=142632 Ack=5704 Win=65535 Len=1460 [TCP segment of a reassembled PDU]"
400,192.168.56.101,193.23.244.244,TCP,49326  >  443 [ACK] Seq=5704 Ack=144092 Win=55480 Len=0
401,193.23.244.244,192.168.56.101,TCP,443  >  49326 [ACK] Seq=144092 Ack=5704 Win=65535 Len=1460 [TCP segment of a reassembled PDU]
402,193.23.244.244,192.168.56.101,TLSv1.2,Application Data [TCP segment of a reassembled PDU]
403,193.23.244.244,192.168.56.101,TCP,443  >  49326 [ACK] Seq=147012 Ack=5704 Win=65535 Len=1460 [TCP segment of a reassembled PDU]
404,193.23.244.244,192.168.56.101,TLSv1.2,Application Data [TCP segment of a reassembled PDU]
405,192.168.56.101,193.23.244.244,TCP,49326  >  443 [ACK] Seq=5704 Ack=149932 Win=49640 Len=0
406,193.23.244.244,192.168.56.101,TCP,443  >  49326 [ACK] Seq=149932 Ack=5704 Win=65535 Len=1460 [TCP segment of a reassembled PDU]
407,193.23.244.244,192.168.56.101,TCP,443  >  49326 [ACK] Seq=151392 Ack=5704 Win=65535 Len=1460 [TCP segment of a reassembled PDU]
408,193.23.244.244,192.168.56.101,TLSv1.2,Application Data [TCP segment of a reassembled PDU]
409,193.23.244.244,192.168.56.101,TCP,443  >  49326 [ACK] Seq=154312 Ack=5704 Win=65535 Len=1460 [TCP segment of a reassembled PDU]
410,193.23.244.244,192.168.56.101,TCP,"443  >  49326 [PSH, ACK] Seq=155772 Ack=5704 Win=65535 Len=1460 [TCP segment of a reassembled PDU]"
411,192.168.56.101,193.23.244.244,TCP,49326  >  443 [ACK] Seq=5704 Ack=157232 Win=42340 Len=0
412,193.23.244.244,192.168.56.101,TLSv1.2,Application Data [TCP segment of a reassembled PDU]
413,193.23.244.244,192.168.56.101,TCP,443  >  49326 [ACK] Seq=158692 Ack=5704 Win=65535 Len=1460 [TCP segment of a reassembled PDU]
414,193.23.244.244,192.168.56.101,TCP,443  >  49326 [ACK] Seq=160152 Ack=5704 Win=65535 Len=1460 [TCP segment of a reassembled PDU]
415,193.23.244.244,192.168.56.101,TLSv1.2,"Application Data, Application Data"
416,193.23.244.244,192.168.56.101,TCP,"443  >  49326 [PSH, ACK] Seq=163072 Ack=5704 Win=65535 Len=1460 [TCP segment of a reassembled PDU]"
417,192.168.56.101,193.23.244.244,TCP,49326  >  443 [ACK] Seq=5704 Ack=164532 Win=35040 Len=0
418,193.23.244.244,192.168.56.101,TCP,443  >  49326 [ACK] Seq=164532 Ack=5704 Win=65535 Len=1460 [TCP segment of a reassembled PDU]
419,193.23.244.244,192.168.56.101,TLSv1.2,Application Data [TCP segment of a reassembled PDU]
420,193.23.244.244,192.168.56.101,TCP,443  >  49326 [ACK] Seq=167452 Ack=5704 Win=65535 Len=1460 [TCP segment of a reassembled PDU]
421,193.23.244.244,192.168.56.101,TLSv1.2,Application Data [TCP segment of a reassembled PDU]
422,193.23.244.244,192.168.56.101,TCP,443  >  49326 [ACK] Seq=170372 Ack=5704 Win=65535 Len=1460 [TCP segment of a reassembled PDU]
423,193.23.244.244,192.168.56.101,TCP,"443  >  49326 [PSH, ACK] Seq=171832 Ack=5704 Win=65535 Len=1460 [TCP segment of a reassembled PDU]"
424,192.168.56.101,193.23.244.244,TCP,49326  >  443 [ACK] Seq=5704 Ack=173292 Win=26280 Len=0
425,193.23.244.244,192.168.56.101,TLSv1.2,Application Data [TCP segment of a reassembled PDU]
426,193.23.244.244,192.168.56.101,TCP,443  >  49326 [ACK] Seq=174752 Ack=5704 Win=65535 Len=1460 [TCP segment of a reassembled PDU]
427,193.23.244.244,192.168.56.101,TCP,443  >  49326 [ACK] Seq=176212 Ack=5704 Win=65535 Len=1460 [TCP segment of a reassembled PDU]
428,193.23.244.244,192.168.56.101,TLSv1.2,"Application Data, Application Data"
429,193.23.244.244,192.168.56.101,TCP,443  >  49326 [ACK] Seq=179132 Ack=5704 Win=65535 Len=1460 [TCP segment of a reassembled PDU]
430,193.23.244.244,192.168.56.101,TCP,"443  >  49326 [PSH, ACK] Seq=180592 Ack=5704 Win=65535 Len=1460 [TCP segment of a reassembled PDU]"
431,193.23.244.244,192.168.56.101,TLSv1.2,Application Data [TCP segment of a reassembled PDU]
432,193.23.244.244,192.168.56.101,TCP,"443  >  49326 [PSH, ACK] Seq=183512 Ack=5704 Win=65535 Len=1460 [TCP segment of a reassembled PDU]"
433,192.168.56.101,193.23.244.244,TCP,49326  >  443 [ACK] Seq=5704 Ack=183512 Win=16060 Len=0
434,193.23.244.244,192.168.56.101,TCP,"443  >  49326 [PSH, ACK] Seq=184972 Ack=5704 Win=65535 Len=1460 [TCP segment of a reassembled PDU]"
435,193.23.244.244,192.168.56.101,TLSv1.2,Application Data [TCP segment of a reassembled PDU]
436,192.168.56.101,193.23.244.244,TCP,49326  >  443 [ACK] Seq=5704 Ack=187892 Win=11680 Len=0
437,193.23.244.244,192.168.56.101,TCP,"443  >  49326 [PSH, ACK] Seq=187892 Ack=5704 Win=65535 Len=1460 [TCP segment of a reassembled PDU]"
438,193.23.244.244,192.168.56.101,TLSv1.2,Application Data [TCP segment of a reassembled PDU]
439,192.168.56.101,193.23.244.244,TCP,49326  >  443 [ACK] Seq=5704 Ack=190812 Win=8760 Len=0
440,193.23.244.244,192.168.56.101,TCP,"443  >  49326 [PSH, ACK] Seq=190812 Ack=5704 Win=65535 Len=1460 [TCP segment of a reassembled PDU]"
441,193.23.244.244,192.168.56.101,TCP,"443  >  49326 [PSH, ACK] Seq=192272 Ack=5704 Win=65535 Len=1460 [TCP segment of a reassembled PDU]"
442,193.23.244.244,192.168.56.101,TLSv1.2,Application Data [TCP segment of a reassembled PDU]
443,192.168.56.101,193.23.244.244,TCP,49326  >  443 [ACK] Seq=5704 Ack=193732 Win=5840 Len=0
444,193.23.244.244,192.168.56.101,TLSv1.2,Application Data [TCP segment of a reassembled PDU]
445,192.168.56.101,193.23.244.244,TCP,49326  >  443 [ACK] Seq=5704 Ack=196652 Win=2920 Len=0
446,193.23.244.244,192.168.56.101,TCP,"443  >  49326 [PSH, ACK] Seq=196652 Ack=5704 Win=65535 Len=1460 [TCP segment of a reassembled PDU]"
447,192.168.56.101,193.23.244.244,TCP,49326  >  443 [ACK] Seq=5704 Ack=198112 Win=4932 Len=0
448,192.168.56.101,193.23.244.244,TCP,[TCP Window Update] 49326  >  443 [ACK] Seq=5704 Ack=198112 Win=64240 Len=0
449,192.168.56.101,193.23.244.244,TLSv1.2,Application Data
450,193.23.244.244,192.168.56.101,TCP,443  >  49326 [ACK] Seq=198112 Ack=6247 Win=65535 Len=0
451,193.23.244.244,192.168.56.101,TLSv1.2,Application Data [TCP segment of a reassembled PDU]
452,193.23.244.244,192.168.56.101,TCP,"443  >  49326 [PSH, ACK] Seq=199572 Ack=6247 Win=65535 Len=1460 [TCP segment of a reassembled PDU]"
453,193.23.244.244,192.168.56.101,TCP,"443  >  49326 [PSH, ACK] Seq=201032 Ack=6247 Win=65535 Len=1460 [TCP segment of a reassembled PDU]"
454,193.23.244.244,192.168.56.101,TLSv1.2,Application Data [TCP segment of a reassembled PDU]
455,192.168.56.101,193.23.244.244,TCP,49326  >  443 [ACK] Seq=6247 Ack=202492 Win=59860 Len=0
456,193.23.244.244,192.168.56.101,TCP,"443  >  49326 [PSH, ACK] Seq=203952 Ack=6247 Win=65535 Len=1460 [TCP segment of a reassembled PDU]"
457,193.23.244.244,192.168.56.101,TLSv1.2,Application Data [TCP segment of a reassembled PDU]
458,193.23.244.244,192.168.56.101,TCP,"443  >  49326 [PSH, ACK] Seq=206872 Ack=6247 Win=65535 Len=1460 [TCP segment of a reassembled PDU]"
459,192.168.56.101,193.23.244.244,TCP,49326  >  443 [ACK] Seq=6247 Ack=206872 Win=55480 Len=0
460,193.23.244.244,192.168.56.101,TCP,"443  >  49326 [PSH, ACK] Seq=208332 Ack=6247 Win=65535 Len=1460 [TCP segment of a reassembled PDU]"
461,192.168.56.101,193.23.244.244,TCP,49326  >  443 [ACK] Seq=6247 Ack=209792 Win=52560 Len=0
462,193.23.244.244,192.168.56.101,TLSv1.2,Application Data [TCP segment of a reassembled PDU]
463,193.23.244.244,192.168.56.101,TLSv1.2,"Application Data, Application Data"
464,193.23.244.244,192.168.56.101,TCP,"443  >  49326 [PSH, ACK] Seq=212712 Ack=6247 Win=65535 Len=1460 [TCP segment of a reassembled PDU]"
465,192.168.56.101,193.23.244.244,TCP,49326  >  443 [ACK] Seq=6247 Ack=212712 Win=49640 Len=0
466,193.23.244.244,192.168.56.101,TCP,"443  >  49326 [PSH, ACK] Seq=214172 Ack=6247 Win=65535 Len=1460 [TCP segment of a reassembled PDU]"
467,192.168.56.101,193.23.244.244,TCP,49326  >  443 [ACK] Seq=6247 Ack=215632 Win=46720 Len=0
468,193.23.244.244,192.168.56.101,TLSv1.2,Application Data [TCP segment of a reassembled PDU]
469,193.23.244.244,192.168.56.101,TCP,"443  >  49326 [PSH, ACK] Seq=217092 Ack=6247 Win=65535 Len=1460 [TCP segment of a reassembled PDU]"
470,193.23.244.244,192.168.56.101,TCP,"443  >  49326 [PSH, ACK] Seq=218552 Ack=6247 Win=65535 Len=1460 [TCP segment of a reassembled PDU]"
471,192.168.56.101,193.23.244.244,TCP,49326  >  443 [ACK] Seq=6247 Ack=218552 Win=43800 Len=0
472,193.23.244.244,192.168.56.101,TLSv1.2,Application Data [TCP segment of a reassembled PDU]
473,193.23.244.244,192.168.56.101,TCP,"443  >  49326 [PSH, ACK] Seq=221472 Ack=6247 Win=65535 Len=1460 [TCP segment of a reassembled PDU]"
474,192.168.56.101,193.23.244.244,TCP,49326  >  443 [ACK] Seq=6247 Ack=221472 Win=40880 Len=0
475,193.23.244.244,192.168.56.101,TLSv1.2,Application Data [TCP segment of a reassembled PDU]
476,193.23.244.244,192.168.56.101,TCP,"443  >  49326 [PSH, ACK] Seq=224392 Ack=6247 Win=65535 Len=1460 [TCP segment of a reassembled PDU]"
477,192.168.56.101,193.23.244.244,TCP,49326  >  443 [ACK] Seq=6247 Ack=225852 Win=36500 Len=0
478,193.23.244.244,192.168.56.101,TCP,443  >  49326 [ACK] Seq=225852 Ack=6247 Win=65535 Len=1460 [TCP segment of a reassembled PDU]
479,193.23.244.244,192.168.56.101,TLSv1.2,"Application Data, Application Data"
480,192.168.56.101,193.23.244.244,TCP,49326  >  443 [ACK] Seq=6247 Ack=228772 Win=33580 Len=0
481,193.23.244.244,192.168.56.101,TCP,443  >  49326 [ACK] Seq=228772 Ack=6247 Win=65535 Len=1460 [TCP segment of a reassembled PDU]
482,193.23.244.244,192.168.56.101,TCP,443  >  49326 [ACK] Seq=230232 Ack=6247 Win=65535 Len=1460 [TCP segment of a reassembled PDU]
483,193.23.244.244,192.168.56.101,TLSv1.2,Application Data [TCP segment of a reassembled PDU]
484,192.168.56.101,193.23.244.244,TCP,49326  >  443 [ACK] Seq=6247 Ack=233152 Win=29200 Len=0
485,192.168.56.101,193.23.244.244,TLSv1.2,Application Data
486,193.23.244.244,192.168.56.101,TCP,443  >  49326 [ACK] Seq=233152 Ack=7304 Win=65535 Len=0
487,192.168.56.101,193.23.244.244,TCP,[TCP Window Update] 49326  >  443 [ACK] Seq=7304 Ack=233152 Win=32672 Len=0
488,192.168.56.101,193.23.244.244,TLSv1.2,Application Data
489,193.23.244.244,192.168.56.101,TCP,443  >  49326 [ACK] Seq=233152 Ack=7847 Win=65535 Len=0
490,193.23.244.244,192.168.56.101,TCP,443  >  49326 [ACK] Seq=233152 Ack=7847 Win=65535 Len=1460 [TCP segment of a reassembled PDU]
491,193.23.244.244,192.168.56.101,TCP,443  >  49326 [ACK] Seq=234612 Ack=7847 Win=65535 Len=1460 [TCP segment of a reassembled PDU]
492,193.23.244.244,192.168.56.101,TLSv1.2,Application Data [TCP segment of a reassembled PDU]
493,192.168.56.101,193.23.244.244,TCP,49326  >  443 [ACK] Seq=7847 Ack=237532 Win=28292 Len=0
494,192.168.56.101,193.23.244.244,TCP,[TCP Window Update] 49326  >  443 [ACK] Seq=7847 Ack=237532 Win=59860 Len=0
495,193.23.244.244,192.168.56.101,TCP,443  >  49326 [ACK] Seq=237532 Ack=7847 Win=65535 Len=1460 [TCP segment of a reassembled PDU]
496,193.23.244.244,192.168.56.101,TCP,443  >  49326 [ACK] Seq=238992 Ack=7847 Win=65535 Len=1460 [TCP segment of a reassembled PDU]
497,193.23.244.244,192.168.56.101,TLSv1.2,Application Data [TCP segment of a reassembled PDU]
498,193.23.244.244,192.168.56.101,TCP,443  >  49326 [ACK] Seq=241912 Ack=7847 Win=65535 Len=1460 [TCP segment of a reassembled PDU]
499,193.23.244.244,192.168.56.101,TLSv1.2,Application Data [TCP segment of a reassembled PDU]
500,193.23.244.244,192.168.56.101,TCP,"443  >  49326 [PSH, ACK] Seq=244832 Ack=7847 Win=65535 Len=1460 [TCP segment of a reassembled PDU]"
501,192.168.56.101,193.23.244.244,TCP,49326  >  443 [ACK] Seq=7847 Ack=246292 Win=51100 Len=0
502,193.23.244.244,192.168.56.101,TCP,443  >  49326 [ACK] Seq=246292 Ack=7847 Win=65535 Len=1460 [TCP segment of a reassembled PDU]
503,193.23.244.244,192.168.56.101,TLSv1.2,"Application Data, Application Data"
504,192.168.56.101,193.23.244.244,TCP,49326  >  443 [ACK] Seq=7847 Ack=249212 Win=48180 Len=0
505,193.23.244.244,192.168.56.101,TCP,443  >  49326 [ACK] Seq=249212 Ack=7847 Win=65535 Len=1460 [TCP segment of a reassembled PDU]
506,193.23.244.244,192.168.56.101,TCP,"443  >  49326 [PSH, ACK] Seq=250672 Ack=7847 Win=65535 Len=1460 [TCP segment of a reassembled PDU]"
507,192.168.56.101,193.23.244.244,TCP,49326  >  443 [ACK] Seq=7847 Ack=252132 Win=45260 Len=0
508,193.23.244.244,192.168.56.101,TLSv1.2,Application Data [TCP segment of a reassembled PDU]
509,193.23.244.244,192.168.56.101,TCP,"443  >  49326 [PSH, ACK] Seq=253592 Ack=7847 Win=65535 Len=1460 [TCP segment of a reassembled PDU]"
510,192.168.56.101,193.23.244.244,TCP,49326  >  443 [ACK] Seq=7847 Ack=255052 Win=42340 Len=0
511,193.23.244.244,192.168.56.101,TCP,"443  >  49326 [PSH, ACK] Seq=255052 Ack=7847 Win=65535 Len=1460 [TCP segment of a reassembled PDU]"
512,193.23.244.244,192.168.56.101,TLSv1.2,Application Data [TCP segment of a reassembled PDU]
513,192.168.56.101,193.23.244.244,TCP,49326  >  443 [ACK] Seq=7847 Ack=257972 Win=39420 Len=0
514,193.23.244.244,192.168.56.101,TCP,443  >  49326 [ACK] Seq=257972 Ack=7847 Win=65535 Len=1460 [TCP segment of a reassembled PDU]
515,193.23.244.244,192.168.56.101,TCP,443  >  49326 [ACK] Seq=259432 Ack=7847 Win=65535 Len=1460 [TCP segment of a reassembled PDU]
516,193.23.244.244,192.168.56.101,TLSv1.2,Application Data [TCP segment of a reassembled PDU]
517,193.23.244.244,192.168.56.101,TCP,443  >  49326 [ACK] Seq=262352 Ack=7847 Win=65535 Len=1460 [TCP segment of a reassembled PDU]
518,193.23.244.244,192.168.56.101,TLSv1.2,Application Data [TCP segment of a reassembled PDU]
519,193.23.244.244,192.168.56.101,TLSv1.2,Application Data [TCP segment of a reassembled PDU]
520,193.23.244.244,192.168.56.101,TCP,443  >  49326 [ACK] Seq=266732 Ack=7847 Win=65535 Len=1460 [TCP segment of a reassembled PDU]
521,193.23.244.244,192.168.56.101,TLSv1.2,Application Data [TCP segment of a reassembled PDU]
522,193.23.244.244,192.168.56.101,TCP,443  >  49326 [ACK] Seq=269652 Ack=7847 Win=65535 Len=1460 [TCP segment of a reassembled PDU]
523,193.23.244.244,192.168.56.101,TCP,443  >  49326 [ACK] Seq=271112 Ack=7847 Win=65535 Len=1460 [TCP segment of a reassembled PDU]
524,193.23.244.244,192.168.56.101,TLSv1.2,Application Data [TCP segment of a reassembled PDU]
525,193.23.244.244,192.168.56.101,TCP,"443  >  49326 [PSH, ACK] Seq=274032 Ack=7847 Win=65535 Len=1460 [TCP segment of a reassembled PDU]"
526,193.23.244.244,192.168.56.101,TCP,"443  >  49326 [PSH, ACK] Seq=275492 Ack=7847 Win=65535 Len=1460 [TCP segment of a reassembled PDU]"
527,192.168.56.101,193.23.244.244,TCP,49326  >  443 [ACK] Seq=7847 Ack=276952 Win=20440 Len=0
528,193.23.244.244,192.168.56.101,TLSv1.2,Application Data [TCP segment of a reassembled PDU]
529,193.23.244.244,192.168.56.101,TCP,"443  >  49326 [PSH, ACK] Seq=278412 Ack=7847 Win=65535 Len=1460 [TCP segment of a reassembled PDU]"
530,193.23.244.244,192.168.56.101,TCP,"443  >  49326 [PSH, ACK] Seq=279872 Ack=7847 Win=65535 Len=1460 [TCP segment of a reassembled PDU]"
531,192.168.56.101,193.23.244.244,TCP,49326  >  443 [ACK] Seq=7847 Ack=279872 Win=17520 Len=0
532,193.23.244.244,192.168.56.101,TLSv1.2,Application Data [TCP segment of a reassembled PDU]
533,192.168.56.101,193.23.244.244,TCP,49326  >  443 [ACK] Seq=7847 Ack=282792 Win=14600 Len=0
534,193.23.244.244,192.168.56.101,TCP,"443  >  49326 [PSH, ACK] Seq=282792 Ack=7847 Win=65535 Len=1460 [TCP segment of a reassembled PDU]"
535,193.23.244.244,192.168.56.101,TLSv1.2,Application Data [TCP segment of a reassembled PDU]
536,192.168.56.101,193.23.244.244,TCP,49326  >  443 [ACK] Seq=7847 Ack=285712 Win=11680 Len=0
537,193.23.244.244,192.168.56.101,TLSv1.2,Application Data [TCP segment of a reassembled PDU]
538,193.23.244.244,192.168.56.101,TCP,"443  >  49326 [PSH, ACK] Seq=287172 Ack=7847 Win=65535 Len=1460 [TCP segment of a reassembled PDU]"
539,192.168.56.101,193.23.244.244,TCP,49326  >  443 [ACK] Seq=7847 Ack=288632 Win=8760 Len=0
540,193.23.244.244,192.168.56.101,TLSv1.2,Application Data [TCP segment of a reassembled PDU]
541,193.23.244.244,192.168.56.101,TCP,"443  >  49326 [PSH, ACK] Seq=290092 Ack=7847 Win=65535 Len=1460 [TCP segment of a reassembled PDU]"
542,192.168.56.101,193.23.244.244,TCP,49326  >  443 [ACK] Seq=7847 Ack=291552 Win=5840 Len=0
543,193.23.244.244,192.168.56.101,TCP,"443  >  49326 [PSH, ACK] Seq=291552 Ack=7847 Win=65535 Len=1460 [TCP segment of a reassembled PDU]"
544,193.23.244.244,192.168.56.101,TLSv1.2,Application Data [TCP segment of a reassembled PDU]
545,192.168.56.101,193.23.244.244,TCP,49326  >  443 [ACK] Seq=7847 Ack=294472 Win=2920 Len=0
546,193.23.244.244,192.168.56.101,TCP,"443  >  49326 [PSH, ACK] Seq=294472 Ack=7847 Win=65535 Len=1460 [TCP segment of a reassembled PDU]"
547,193.23.244.244,192.168.56.101,TCP,"[TCP Window Full] 443  >  49326 [PSH, ACK] Seq=295932 Ack=7847 Win=65535 Len=1460 [TCP segment of a reassembled PDU]"
548,192.168.56.101,193.23.244.244,TCP,[TCP ZeroWindow] 49326  >  443 [ACK] Seq=7847 Ack=297392 Win=0 Len=0
549,192.168.56.101,193.23.244.244,TLSv1.2,"[TCP ZeroWindow] , Application Data"
550,193.23.244.244,192.168.56.101,TCP,443  >  49326 [ACK] Seq=297392 Ack=8904 Win=65535 Len=0
551,192.168.56.101,193.23.244.244,TCP,[TCP Window Update] 49326  >  443 [ACK] Seq=8904 Ack=297392 Win=4380 Len=0
552,193.23.244.244,192.168.56.101,TLSv1.2,Application Data [TCP segment of a reassembled PDU]
553,193.23.244.244,192.168.56.101,TCP,443  >  49326 [ACK] Seq=298852 Ack=8904 Win=65535 Len=1460 [TCP segment of a reassembled PDU]
554,193.23.244.244,192.168.56.101,TCP,[TCP Window Full] 443  >  49326 [ACK] Seq=300312 Ack=8904 Win=65535 Len=1460 [TCP segment of a reassembled PDU]
555,192.168.56.101,193.23.244.244,TCP,[TCP ZeroWindow] 49326  >  443 [ACK] Seq=8904 Ack=301772 Win=0 Len=0
556,192.168.56.101,193.23.244.244,TCP,[TCP Window Update] 49326  >  443 [ACK] Seq=8904 Ack=301772 Win=59860 Len=0
557,193.23.244.244,192.168.56.101,TLSv1.2,"Application Data, Application Data, Application Data"
558,193.23.244.244,192.168.56.101,TCP,443  >  49326 [ACK] Seq=303232 Ack=8904 Win=65535 Len=1460 [TCP segment of a reassembled PDU]
559,193.23.244.244,192.168.56.101,TCP,443  >  49326 [ACK] Seq=304692 Ack=8904 Win=65535 Len=1460 [TCP segment of a reassembled PDU]
560,193.23.244.244,192.168.56.101,TLSv1.2,Application Data [TCP segment of a reassembled PDU]
561,193.23.244.244,192.168.56.101,TCP,443  >  49326 [ACK] Seq=307612 Ack=8904 Win=65535 Len=1460 [TCP segment of a reassembled PDU]
562,193.23.244.244,192.168.56.101,TCP,443  >  49326 [ACK] Seq=309072 Ack=8904 Win=65535 Len=1460 [TCP segment of a reassembled PDU]
563,193.23.244.244,192.168.56.101,TLSv1.2,Application Data [TCP segment of a reassembled PDU]
564,193.23.244.244,192.168.56.101,TCP,443  >  49326 [ACK] Seq=311992 Ack=8904 Win=65535 Len=1460 [TCP segment of a reassembled PDU]
565,193.23.244.244,192.168.56.101,TCP,443  >  49326 [ACK] Seq=313452 Ack=8904 Win=65535 Len=1460 [TCP segment of a reassembled PDU]
566,193.23.244.244,192.168.56.101,TLSv1.2,Application Data [TCP segment of a reassembled PDU]
567,193.23.244.244,192.168.56.101,TCP,443  >  49326 [ACK] Seq=316372 Ack=8904 Win=65535 Len=1460 [TCP segment of a reassembled PDU]
568,193.23.244.244,192.168.56.101,TLSv1.2,Application Data [TCP segment of a reassembled PDU]
569,193.23.244.244,192.168.56.101,TLSv1.2,Application Data [TCP segment of a reassembled PDU]
570,193.23.244.244,192.168.56.101,TCP,443  >  49326 [ACK] Seq=320752 Ack=8904 Win=65535 Len=1460 [TCP segment of a reassembled PDU]
571,193.23.244.244,192.168.56.101,TLSv1.2,Application Data [TCP segment of a reassembled PDU]
572,193.23.244.244,192.168.56.101,TCP,443  >  49326 [ACK] Seq=323672 Ack=8904 Win=65535 Len=1460 [TCP segment of a reassembled PDU]
573,193.23.244.244,192.168.56.101,TCP,443  >  49326 [ACK] Seq=325132 Ack=8904 Win=65535 Len=1460 [TCP segment of a reassembled PDU]
574,193.23.244.244,192.168.56.101,TLSv1.2,Application Data [TCP segment of a reassembled PDU]
575,193.23.244.244,192.168.56.101,TCP,443  >  49326 [ACK] Seq=328052 Ack=8904 Win=65535 Len=1460 [TCP segment of a reassembled PDU]
576,193.23.244.244,192.168.56.101,TCP,443  >  49326 [ACK] Seq=329512 Ack=8904 Win=65535 Len=1460 [TCP segment of a reassembled PDU]
577,193.23.244.244,192.168.56.101,TLSv1.2,Application Data [TCP segment of a reassembled PDU]
578,193.23.244.244,192.168.56.101,TCP,443  >  49326 [ACK] Seq=332432 Ack=8904 Win=65535 Len=1460 [TCP segment of a reassembled PDU]
579,193.23.244.244,192.168.56.101,TCP,443  >  49326 [ACK] Seq=333892 Ack=8904 Win=65535 Len=1460 [TCP segment of a reassembled PDU]
580,193.23.244.244,192.168.56.101,TLSv1.2,"Application Data, Application Data"
581,193.23.244.244,192.168.56.101,TCP,443  >  49326 [ACK] Seq=336812 Ack=8904 Win=65535 Len=1460 [TCP segment of a reassembled PDU]
582,193.23.244.244,192.168.56.101,TLSv1.2,Application Data [TCP segment of a reassembled PDU]
583,193.23.244.244,192.168.56.101,TCP,443  >  49326 [ACK] Seq=339732 Ack=8904 Win=65535 Len=1460 [TCP segment of a reassembled PDU]
584,193.23.244.244,192.168.56.101,TCP,443  >  49326 [ACK] Seq=341192 Ack=8904 Win=65535 Len=1460 [TCP segment of a reassembled PDU]
585,193.23.244.244,192.168.56.101,TLSv1.2,Application Data [TCP segment of a reassembled PDU]
586,193.23.244.244,192.168.56.101,TCP,443  >  49326 [ACK] Seq=344112 Ack=8904 Win=65535 Len=1460 [TCP segment of a reassembled PDU]
587,193.23.244.244,192.168.56.101,TCP,443  >  49326 [ACK] Seq=345572 Ack=8904 Win=65535 Len=1460 [TCP segment of a reassembled PDU]
588,193.23.244.244,192.168.56.101,TLSv1.2,Application Data [TCP segment of a reassembled PDU]
589,193.23.244.244,192.168.56.101,TCP,443  >  49326 [ACK] Seq=348492 Ack=8904 Win=65535 Len=1460 [TCP segment of a reassembled PDU]
590,193.23.244.244,192.168.56.101,TCP,443  >  49326 [ACK] Seq=349952 Ack=8904 Win=65535 Len=1460 [TCP segment of a reassembled PDU]
591,193.23.244.244,192.168.56.101,TLSv1.2,Application Data [TCP segment of a reassembled PDU]
592,193.23.244.244,192.168.56.101,TCP,443  >  49326 [ACK] Seq=352872 Ack=8904 Win=65535 Len=1460 [TCP segment of a reassembled PDU]
593,193.23.244.244,192.168.56.101,TCP,443  >  49326 [ACK] Seq=354332 Ack=8904 Win=65535 Len=1460 [TCP segment of a reassembled PDU]
594,193.23.244.244,192.168.56.101,TLSv1.2,Application Data [TCP segment of a reassembled PDU]
595,193.23.244.244,192.168.56.101,TCP,443  >  49326 [ACK] Seq=357252 Ack=8904 Win=65535 Len=1460 [TCP segment of a reassembled PDU]
596,193.23.244.244,192.168.56.101,TLSv1.2,Application Data [TCP segment of a reassembled PDU]
597,193.23.244.244,192.168.56.101,TLSv1.2,"[TCP Window Full] , Application Data [TCP segment of a reassembled PDU]"
598,192.168.56.101,193.23.244.244,TCP,49326  >  443 [ACK] Seq=8904 Ack=348492 Win=13140 Len=0
599,192.168.56.101,193.23.244.244,TCP,[TCP ZeroWindow] 49326  >  443 [ACK] Seq=8904 Ack=361632 Win=0 Len=0
600,192.168.56.101,193.23.244.244,TLSv1.2,"[TCP ZeroWindow] , Application Data"
601,193.23.244.244,192.168.56.101,TCP,443  >  49326 [ACK] Seq=361632 Ack=9447 Win=65535 Len=0
602,192.168.56.101,193.23.244.244,TLSv1.2,"[TCP ZeroWindow] , Application Data"
603,193.23.244.244,192.168.56.101,TCP,443  >  49326 [ACK] Seq=361632 Ack=10504 Win=65535 Len=0
604,192.168.56.101,193.23.244.244,TCP,[TCP Window Update] 49326  >  443 [ACK] Seq=10504 Ack=361632 Win=4380 Len=0
605,193.23.244.244,192.168.56.101,TCP,443  >  49326 [ACK] Seq=361632 Ack=10504 Win=65535 Len=1460 [TCP segment of a reassembled PDU]
606,193.23.244.244,192.168.56.101,TLSv1.2,Application Data [TCP segment of a reassembled PDU]
607,193.23.244.244,192.168.56.101,TCP,[TCP Window Full] 443  >  49326 [ACK] Seq=364552 Ack=10504 Win=65535 Len=1460 [TCP segment of a reassembled PDU]
608,192.168.56.101,193.23.244.244,TCP,[TCP ZeroWindow] 49326  >  443 [ACK] Seq=10504 Ack=366012 Win=0 Len=0
609,192.168.56.101,193.23.244.244,TCP,[TCP Window Update] 49326  >  443 [ACK] Seq=10504 Ack=366012 Win=59860 Len=0
610,193.23.244.244,192.168.56.101,TLSv1.2,Application Data [TCP segment of a reassembled PDU]
611,193.23.244.244,192.168.56.101,TCP,443  >  49326 [ACK] Seq=367472 Ack=10504 Win=65535 Len=1460 [TCP segment of a reassembled PDU]
612,193.23.244.244,192.168.56.101,TCP,443  >  49326 [ACK] Seq=368932 Ack=10504 Win=65535 Len=1460 [TCP segment of a reassembled PDU]
613,193.23.244.244,192.168.56.101,TLSv1.2,Application Data [TCP segment of a reassembled PDU]
614,193.23.244.244,192.168.56.101,TCP,443  >  49326 [ACK] Seq=371852 Ack=10504 Win=65535 Len=1460 [TCP segment of a reassembled PDU]
615,193.23.244.244,192.168.56.101,TCP,443  >  49326 [ACK] Seq=373312 Ack=10504 Win=65535 Len=1460 [TCP segment of a reassembled PDU]
616,193.23.244.244,192.168.56.101,TLSv1.2,Application Data [TCP segment of a reassembled PDU]
617,193.23.244.244,192.168.56.101,TCP,443  >  49326 [ACK] Seq=376232 Ack=10504 Win=65535 Len=1460 [TCP segment of a reassembled PDU]
618,193.23.244.244,192.168.56.101,TCP,443  >  49326 [ACK] Seq=377692 Ack=10504 Win=65535 Len=1460 [TCP segment of a reassembled PDU]
619,193.23.244.244,192.168.56.101,TLSv1.2,Application Data [TCP segment of a reassembled PDU]
620,193.23.244.244,192.168.56.101,TCP,443  >  49326 [ACK] Seq=380612 Ack=10504 Win=65535 Len=1460 [TCP segment of a reassembled PDU]
621,193.23.244.244,192.168.56.101,TLSv1.2,Application Data [TCP segment of a reassembled PDU]
622,193.23.244.244,192.168.56.101,TCP,443  >  49326 [ACK] Seq=383532 Ack=10504 Win=65535 Len=1460 [TCP segment of a reassembled PDU]
623,193.23.244.244,192.168.56.101,TCP,443  >  49326 [ACK] Seq=384992 Ack=10504 Win=65535 Len=1460 [TCP segment of a reassembled PDU]
624,193.23.244.244,192.168.56.101,TLSv1.2,Application Data [TCP segment of a reassembled PDU]
625,193.23.244.244,192.168.56.101,TCP,443  >  49326 [ACK] Seq=387912 Ack=10504 Win=65535 Len=1460 [TCP segment of a reassembled PDU]
626,193.23.244.244,192.168.56.101,TCP,443  >  49326 [ACK] Seq=389372 Ack=10504 Win=65535 Len=1460 [TCP segment of a reassembled PDU]
627,193.23.244.244,192.168.56.101,TLSv1.2,"Application Data, Application Data"
628,193.23.244.244,192.168.56.101,TLSv1.2,Application Data [TCP segment of a reassembled PDU]
629,193.23.244.244,192.168.56.101,TCP,443  >  49326 [ACK] Seq=393752 Ack=10504 Win=65535 Len=1460 [TCP segment of a reassembled PDU]
630,193.23.244.244,192.168.56.101,TCP,443  >  49326 [ACK] Seq=395212 Ack=10504 Win=65535 Len=1460 [TCP segment of a reassembled PDU]
631,193.23.244.244,192.168.56.101,TLSv1.2,Application Data [TCP segment of a reassembled PDU]
632,193.23.244.244,192.168.56.101,TCP,443  >  49326 [ACK] Seq=398132 Ack=10504 Win=65535 Len=1460 [TCP segment of a reassembled PDU]
633,193.23.244.244,192.168.56.101,TLSv1.2,Application Data [TCP segment of a reassembled PDU]
634,193.23.244.244,192.168.56.101,TCP,443  >  49326 [ACK] Seq=401052 Ack=10504 Win=65535 Len=1460 [TCP segment of a reassembled PDU]
635,193.23.244.244,192.168.56.101,TCP,443  >  49326 [ACK] Seq=402512 Ack=10504 Win=65535 Len=1460 [TCP segment of a reassembled PDU]
636,193.23.244.244,192.168.56.101,TLSv1.2,Application Data [TCP segment of a reassembled PDU]
637,193.23.244.244,192.168.56.101,TCP,443  >  49326 [ACK] Seq=405432 Ack=10504 Win=65535 Len=1460 [TCP segment of a reassembled PDU]
638,193.23.244.244,192.168.56.101,TCP,443  >  49326 [ACK] Seq=406892 Ack=10504 Win=65535 Len=1460 [TCP segment of a reassembled PDU]
639,193.23.244.244,192.168.56.101,TLSv1.2,Application Data [TCP segment of a reassembled PDU]
640,193.23.244.244,192.168.56.101,TCP,443  >  49326 [ACK] Seq=409812 Ack=10504 Win=65535 Len=1460 [TCP segment of a reassembled PDU]
641,193.23.244.244,192.168.56.101,TCP,443  >  49326 [ACK] Seq=411272 Ack=10504 Win=65535 Len=1460 [TCP segment of a reassembled PDU]
642,193.23.244.244,192.168.56.101,TLSv1.2,Application Data [TCP segment of a reassembled PDU]
643,193.23.244.244,192.168.56.101,TCP,443  >  49326 [ACK] Seq=414192 Ack=10504 Win=65535 Len=1460 [TCP segment of a reassembled PDU]
644,193.23.244.244,192.168.56.101,TCP,443  >  49326 [ACK] Seq=415652 Ack=10504 Win=65535 Len=1460 [TCP segment of a reassembled PDU]
645,193.23.244.244,192.168.56.101,TLSv1.2,Application Data [TCP segment of a reassembled PDU]
646,193.23.244.244,192.168.56.101,TCP,443  >  49326 [ACK] Seq=418572 Ack=10504 Win=65535 Len=1460 [TCP segment of a reassembled PDU]
647,193.23.244.244,192.168.56.101,TLSv1.2,Application Data [TCP segment of a reassembled PDU]
648,193.23.244.244,192.168.56.101,TCP,443  >  49326 [ACK] Seq=421492 Ack=10504 Win=65535 Len=1460 [TCP segment of a reassembled PDU]
649,193.23.244.244,192.168.56.101,TCP,443  >  49326 [ACK] Seq=422952 Ack=10504 Win=65535 Len=1460 [TCP segment of a reassembled PDU]
650,193.23.244.244,192.168.56.101,TLSv1.2,"[TCP Window Full] , Application Data, Application Data"
651,192.168.56.101,193.23.244.244,TCP,49326  >  443 [ACK] Seq=10504 Ack=411272 Win=14600 Len=0
652,192.168.56.101,193.23.244.244,TCP,[TCP ZeroWindow] 49326  >  443 [ACK] Seq=10504 Ack=425872 Win=0 Len=0
653,192.168.56.101,193.23.244.244,TLSv1.2,"[TCP ZeroWindow] , Application Data"
654,193.23.244.244,192.168.56.101,TCP,443  >  49326 [ACK] Seq=425872 Ack=11047 Win=65535 Len=0
655,192.168.56.101,193.23.244.244,TLSv1.2,"[TCP ZeroWindow] , Application Data"
656,193.23.244.244,192.168.56.101,TCP,443  >  49326 [ACK] Seq=425872 Ack=12104 Win=65535 Len=0
657,192.168.56.101,193.23.244.244,TLSv1.2,"[TCP ZeroWindow] , Application Data"
658,193.23.244.244,192.168.56.101,TCP,443  >  49326 [ACK] Seq=425872 Ack=12647 Win=65535 Len=0
659,192.168.56.101,193.23.244.244,TCP,[TCP Window Update] 49326  >  443 [ACK] Seq=12647 Ack=425872 Win=4380 Len=0
660,193.23.244.244,192.168.56.101,TCP,443  >  49326 [ACK] Seq=425872 Ack=12647 Win=65535 Len=1460 [TCP segment of a reassembled PDU]
661,193.23.244.244,192.168.56.101,TCP,443  >  49326 [ACK] Seq=427332 Ack=12647 Win=65535 Len=1460 [TCP segment of a reassembled PDU]
662,193.23.244.244,192.168.56.101,TLSv1.2,"[TCP Window Full] , Application Data [TCP segment of a reassembled PDU]"
663,192.168.56.101,193.23.244.244,TCP,[TCP ZeroWindow] 49326  >  443 [ACK] Seq=12647 Ack=430252 Win=0 Len=0
664,192.168.56.101,193.23.244.244,TCP,[TCP Window Update] 49326  >  443 [ACK] Seq=12647 Ack=430252 Win=59860 Len=0
665,193.23.244.244,192.168.56.101,TCP,443  >  49326 [ACK] Seq=430252 Ack=12647 Win=65535 Len=1460 [TCP segment of a reassembled PDU]
666,193.23.244.244,192.168.56.101,TCP,443  >  49326 [ACK] Seq=431712 Ack=12647 Win=65535 Len=1460 [TCP segment of a reassembled PDU]
667,193.23.244.244,192.168.56.101,TLSv1.2,Application Data [TCP segment of a reassembled PDU]
668,193.23.244.244,192.168.56.101,TCP,443  >  49326 [ACK] Seq=434632 Ack=12647 Win=65535 Len=1460 [TCP segment of a reassembled PDU]
669,193.23.244.244,192.168.56.101,TCP,443  >  49326 [ACK] Seq=436092 Ack=12647 Win=65535 Len=1460 [TCP segment of a reassembled PDU]
670,193.23.244.244,192.168.56.101,TLSv1.2,Application Data [TCP segment of a reassembled PDU]
671,193.23.244.244,192.168.56.101,TCP,443  >  49326 [ACK] Seq=439012 Ack=12647 Win=65535 Len=1460 [TCP segment of a reassembled PDU]
672,193.23.244.244,192.168.56.101,TLSv1.2,Application Data [TCP segment of a reassembled PDU]
673,193.23.244.244,192.168.56.101,TCP,443  >  49326 [ACK] Seq=441932 Ack=12647 Win=65535 Len=1460 [TCP segment of a reassembled PDU]
674,193.23.244.244,192.168.56.101,TCP,443  >  49326 [ACK] Seq=443392 Ack=12647 Win=65535 Len=1460 [TCP segment of a reassembled PDU]
675,193.23.244.244,192.168.56.101,TLSv1.2,Application Data [TCP segment of a reassembled PDU]
676,193.23.244.244,192.168.56.101,TCP,443  >  49326 [ACK] Seq=446312 Ack=12647 Win=65535 Len=1460 [TCP segment of a reassembled PDU]
677,193.23.244.244,192.168.56.101,TLSv1.2,Application Data [TCP segment of a reassembled PDU]
678,193.23.244.244,192.168.56.101,TCP,443  >  49326 [ACK] Seq=449232 Ack=12647 Win=65535 Len=1460 [TCP segment of a reassembled PDU]
679,193.23.244.244,192.168.56.101,TCP,443  >  49326 [ACK] Seq=450692 Ack=12647 Win=65535 Len=1460 [TCP segment of a reassembled PDU]
680,193.23.244.244,192.168.56.101,TLSv1.2,Application Data [TCP segment of a reassembled PDU]
681,193.23.244.244,192.168.56.101,TCP,443  >  49326 [ACK] Seq=453612 Ack=12647 Win=65535 Len=1460 [TCP segment of a reassembled PDU]
682,193.23.244.244,192.168.56.101,TCP,443  >  49326 [ACK] Seq=455072 Ack=12647 Win=65535 Len=1460 [TCP segment of a reassembled PDU]
683,193.23.244.244,192.168.56.101,TLSv1.2,Application Data [TCP segment of a reassembled PDU]
684,193.23.244.244,192.168.56.101,TCP,443  >  49326 [ACK] Seq=457992 Ack=12647 Win=65535 Len=1460 [TCP segment of a reassembled PDU]
685,193.23.244.244,192.168.56.101,TCP,443  >  49326 [ACK] Seq=459452 Ack=12647 Win=65535 Len=1460 [TCP segment of a reassembled PDU]
686,193.23.244.244,192.168.56.101,TLSv1.2,"Application Data, Application Data"
687,193.23.244.244,192.168.56.101,TCP,443  >  49326 [ACK] Seq=462372 Ack=12647 Win=65535 Len=1460 [TCP segment of a reassembled PDU]
688,193.23.244.244,192.168.56.101,TCP,443  >  49326 [ACK] Seq=463832 Ack=12647 Win=65535 Len=1460 [TCP segment of a reassembled PDU]
689,193.23.244.244,192.168.56.101,TLSv1.2,Application Data [TCP segment of a reassembled PDU]
690,193.23.244.244,192.168.56.101,TCP,443  >  49326 [ACK] Seq=466752 Ack=12647 Win=65535 Len=1460 [TCP segment of a reassembled PDU]
691,193.23.244.244,192.168.56.101,TLSv1.2,Application Data [TCP segment of a reassembled PDU]
692,193.23.244.244,192.168.56.101,TLSv1.2,Application Data [TCP segment of a reassembled PDU]
693,193.23.244.244,192.168.56.101,TCP,443  >  49326 [ACK] Seq=471132 Ack=12647 Win=65535 Len=1460 [TCP segment of a reassembled PDU]
694,193.23.244.244,192.168.56.101,TCP,443  >  49326 [ACK] Seq=472592 Ack=12647 Win=65535 Len=1460 [TCP segment of a reassembled PDU]
695,193.23.244.244,192.168.56.101,TLSv1.2,Application Data [TCP segment of a reassembled PDU]
696,193.23.244.244,192.168.56.101,TCP,443  >  49326 [ACK] Seq=475512 Ack=12647 Win=65535 Len=1460 [TCP segment of a reassembled PDU]
697,193.23.244.244,192.168.56.101,TCP,443  >  49326 [ACK] Seq=476972 Ack=12647 Win=65535 Len=1460 [TCP segment of a reassembled PDU]
698,193.23.244.244,192.168.56.101,TLSv1.2,Application Data [TCP segment of a reassembled PDU]
699,193.23.244.244,192.168.56.101,TCP,443  >  49326 [ACK] Seq=479892 Ack=12647 Win=65535 Len=1460 [TCP segment of a reassembled PDU]
700,193.23.244.244,192.168.56.101,TCP,443  >  49326 [ACK] Seq=481352 Ack=12647 Win=65535 Len=1460 [TCP segment of a reassembled PDU]
701,193.23.244.244,192.168.56.101,TLSv1.2,Application Data [TCP segment of a reassembled PDU]
702,193.23.244.244,192.168.56.101,TCP,443  >  49326 [ACK] Seq=484272 Ack=12647 Win=65535 Len=1460 [TCP segment of a reassembled PDU]
703,193.23.244.244,192.168.56.101,TLSv1.2,Application Data [TCP segment of a reassembled PDU]
704,193.23.244.244,192.168.56.101,TLSv1.2,Application Data [TCP segment of a reassembled PDU]
705,193.23.244.244,192.168.56.101,TCP,[TCP Window Full] 443  >  49326 [ACK] Seq=488652 Ack=12647 Win=65535 Len=1460 [TCP segment of a reassembled PDU]
706,192.168.56.101,193.23.244.244,TCP,49326  >  443 [ACK] Seq=12647 Ack=453612 Win=36500 Len=0
707,192.168.56.101,193.23.244.244,TCP,[TCP ZeroWindow] 49326  >  443 [ACK] Seq=12647 Ack=490112 Win=0 Len=0
708,192.168.56.101,193.23.244.244,TLSv1.2,"[TCP ZeroWindow] , Application Data"
709,193.23.244.244,192.168.56.101,TCP,443  >  49326 [ACK] Seq=490112 Ack=13190 Win=65535 Len=0
710,192.168.56.101,193.23.244.244,TLSv1.2,"[TCP ZeroWindow] , Application Data"
711,193.23.244.244,192.168.56.101,TCP,443  >  49326 [ACK] Seq=490112 Ack=13733 Win=65535 Len=0
712,192.168.56.101,193.23.244.244,TLSv1.2,"[TCP ZeroWindow] , Application Data"
713,193.23.244.244,192.168.56.101,TCP,443  >  49326 [ACK] Seq=490112 Ack=14276 Win=65535 Len=0
714,192.168.56.101,193.23.244.244,TCP,[TCP Window Update] 49326  >  443 [ACK] Seq=14276 Ack=490112 Win=4380 Len=0
715,193.23.244.244,192.168.56.101,TLSv1.2,Application Data [TCP segment of a reassembled PDU]
716,193.23.244.244,192.168.56.101,TCP,443  >  49326 [ACK] Seq=491572 Ack=14276 Win=65535 Len=1460 [TCP segment of a reassembled PDU]
717,193.23.244.244,192.168.56.101,TCP,[TCP Window Full] 443  >  49326 [ACK] Seq=493032 Ack=14276 Win=65535 Len=1460 [TCP segment of a reassembled PDU]
718,192.168.56.101,193.23.244.244,TCP,[TCP ZeroWindow] 49326  >  443 [ACK] Seq=14276 Ack=494492 Win=0 Len=0
719,192.168.56.101,193.23.244.244,TCP,[TCP Window Update] 49326  >  443 [ACK] Seq=14276 Ack=494492 Win=59860 Len=0
720,193.23.244.244,192.168.56.101,TLSv1.2,Application Data [TCP segment of a reassembled PDU]
721,193.23.244.244,192.168.56.101,TLSv1.2,Application Data [TCP segment of a reassembled PDU]
722,193.23.244.244,192.168.56.101,TCP,443  >  49326 [ACK] Seq=497412 Ack=14276 Win=65535 Len=1460 [TCP segment of a reassembled PDU]
723,193.23.244.244,192.168.56.101,TCP,443  >  49326 [ACK] Seq=498872 Ack=14276 Win=65535 Len=1460 [TCP segment of a reassembled PDU]
724,193.23.244.244,192.168.56.101,TLSv1.2,Application Data [TCP segment of a reassembled PDU]
725,193.23.244.244,192.168.56.101,TCP,443  >  49326 [ACK] Seq=501792 Ack=14276 Win=65535 Len=1460 [TCP segment of a reassembled PDU]
726,193.23.244.244,192.168.56.101,TCP,443  >  49326 [ACK] Seq=503252 Ack=14276 Win=65535 Len=1460 [TCP segment of a reassembled PDU]
727,193.23.244.244,192.168.56.101,TLSv1.2,Application Data [TCP segment of a reassembled PDU]
728,193.23.244.244,192.168.56.101,TCP,443  >  49326 [ACK] Seq=506172 Ack=14276 Win=65535 Len=1460 [TCP segment of a reassembled PDU]
729,193.23.244.244,192.168.56.101,TLSv1.2,Application Data [TCP segment of a reassembled PDU]
730,193.23.244.244,192.168.56.101,TCP,443  >  49326 [ACK] Seq=509092 Ack=14276 Win=65535 Len=1460 [TCP segment of a reassembled PDU]
731,193.23.244.244,192.168.56.101,TCP,443  >  49326 [ACK] Seq=510552 Ack=14276 Win=65535 Len=1460 [TCP segment of a reassembled PDU]
732,193.23.244.244,192.168.56.101,TLSv1.2,"Application Data, Application Data"
733,193.23.244.244,192.168.56.101,TCP,443  >  49326 [ACK] Seq=513472 Ack=14276 Win=65535 Len=1460 [TCP segment of a reassembled PDU]
734,193.23.244.244,192.168.56.101,TCP,443  >  49326 [ACK] Seq=514932 Ack=14276 Win=65535 Len=1460 [TCP segment of a reassembled PDU]
735,193.23.244.244,192.168.56.101,TLSv1.2,Application Data [TCP segment of a reassembled PDU]
736,193.23.244.244,192.168.56.101,TCP,443  >  49326 [ACK] Seq=517852 Ack=14276 Win=65535 Len=1460 [TCP segment of a reassembled PDU]
737,193.23.244.244,192.168.56.101,TCP,443  >  49326 [ACK] Seq=519312 Ack=14276 Win=65535 Len=1460 [TCP segment of a reassembled PDU]
738,193.23.244.244,192.168.56.101,TLSv1.2,Application Data [TCP segment of a reassembled PDU]
739,193.23.244.244,192.168.56.101,TLSv1.2,Application Data [TCP segment of a reassembled PDU]
740,193.23.244.244,192.168.56.101,TCP,443  >  49326 [ACK] Seq=523692 Ack=14276 Win=65535 Len=1460 [TCP segment of a reassembled PDU]
741,193.23.244.244,192.168.56.101,TCP,443  >  49326 [ACK] Seq=525152 Ack=14276 Win=65535 Len=1460 [TCP segment of a reassembled PDU]
742,193.23.244.244,192.168.56.101,TLSv1.2,Application Data [TCP segment of a reassembled PDU]
743,193.23.244.244,192.168.56.101,TCP,443  >  49326 [ACK] Seq=528072 Ack=14276 Win=65535 Len=1460 [TCP segment of a reassembled PDU]
744,193.23.244.244,192.168.56.101,TLSv1.2,Application Data [TCP segment of a reassembled PDU]
745,193.23.244.244,192.168.56.101,TCP,443  >  49326 [ACK] Seq=530992 Ack=14276 Win=65535 Len=1460 [TCP segment of a reassembled PDU]
746,193.23.244.244,192.168.56.101,TCP,443  >  49326 [ACK] Seq=532452 Ack=14276 Win=65535 Len=1460 [TCP segment of a reassembled PDU]
747,193.23.244.244,192.168.56.101,TLSv1.2,Application Data [TCP segment of a reassembled PDU]
748,193.23.244.244,192.168.56.101,TCP,443  >  49326 [ACK] Seq=535372 Ack=14276 Win=65535 Len=1460 [TCP segment of a reassembled PDU]
749,193.23.244.244,192.168.56.101,TCP,443  >  49326 [ACK] Seq=536832 Ack=14276 Win=65535 Len=1460 [TCP segment of a reassembled PDU]
750,193.23.244.244,192.168.56.101,TLSv1.2,"Application Data, Application Data"
751,193.23.244.244,192.168.56.101,TCP,443  >  49326 [ACK] Seq=539752 Ack=14276 Win=65535 Len=1460 [TCP segment of a reassembled PDU]
752,193.23.244.244,192.168.56.101,TCP,443  >  49326 [ACK] Seq=541212 Ack=14276 Win=65535 Len=1460 [TCP segment of a reassembled PDU]
753,193.23.244.244,192.168.56.101,TLSv1.2,Application Data [TCP segment of a reassembled PDU]
754,193.23.244.244,192.168.56.101,TCP,443  >  49326 [ACK] Seq=544132 Ack=14276 Win=65535 Len=1460 [TCP segment of a reassembled PDU]
755,193.23.244.244,192.168.56.101,TCP,443  >  49326 [ACK] Seq=545592 Ack=14276 Win=65535 Len=1460 [TCP segment of a reassembled PDU]
756,193.23.244.244,192.168.56.101,TLSv1.2,Application Data [TCP segment of a reassembled PDU]
757,193.23.244.244,192.168.56.101,TLSv1.2,Application Data [TCP segment of a reassembled PDU]
758,193.23.244.244,192.168.56.101,TCP,443  >  49326 [ACK] Seq=549972 Ack=14276 Win=65535 Len=1460 [TCP segment of a reassembled PDU]
759,193.23.244.244,192.168.56.101,TLSv1.2,Application Data [TCP segment of a reassembled PDU]
760,193.23.244.244,192.168.56.101,TCP,[TCP Window Full] 443  >  49326 [ACK] Seq=552892 Ack=14276 Win=65535 Len=1460 [TCP segment of a reassembled PDU]
761,192.168.56.101,193.23.244.244,TCP,49326  >  443 [ACK] Seq=14276 Ack=541212 Win=13140 Len=0
762,192.168.56.101,193.23.244.244,TCP,[TCP ZeroWindow] 49326  >  443 [ACK] Seq=14276 Ack=554352 Win=0 Len=0
763,192.168.56.101,193.23.244.244,TLSv1.2,"[TCP ZeroWindow] , Application Data"
764,193.23.244.244,192.168.56.101,TCP,443  >  49326 [ACK] Seq=554352 Ack=15333 Win=65535 Len=0
765,192.168.56.101,193.23.244.244,TLSv1.2,"[TCP ZeroWindow] , Application Data"
766,193.23.244.244,192.168.56.101,TCP,443  >  49326 [ACK] Seq=554352 Ack=15876 Win=65535 Len=0
767,192.168.56.101,193.23.244.244,TLSv1.2,"[TCP ZeroWindow] , Application Data"
768,193.23.244.244,192.168.56.101,TCP,443  >  49326 [ACK] Seq=554352 Ack=16933 Win=65535 Len=0
769,192.168.56.101,193.23.244.244,TCP,[TCP Window Update] 49326  >  443 [ACK] Seq=16933 Ack=554352 Win=4380 Len=0
770,193.23.244.244,192.168.56.101,TCP,443  >  49326 [ACK] Seq=554352 Ack=16933 Win=65535 Len=1460 [TCP segment of a reassembled PDU]
771,193.23.244.244,192.168.56.101,TLSv1.2,Application Data [TCP segment of a reassembled PDU]
772,193.23.244.244,192.168.56.101,TCP,[TCP Window Full] 443  >  49326 [ACK] Seq=557272 Ack=16933 Win=65535 Len=1460 [TCP segment of a reassembled PDU]
773,192.168.56.101,193.23.244.244,TCP,[TCP ZeroWindow] 49326  >  443 [ACK] Seq=16933 Ack=558732 Win=0 Len=0
774,192.168.56.101,193.23.244.244,TCP,[TCP Window Update] 49326  >  443 [ACK] Seq=16933 Ack=558732 Win=59860 Len=0
775,193.23.244.244,192.168.56.101,TCP,443  >  49326 [ACK] Seq=558732 Ack=16933 Win=65535 Len=1460 [TCP segment of a reassembled PDU]
776,193.23.244.244,192.168.56.101,TLSv1.2,Application Data [TCP segment of a reassembled PDU]
777,193.23.244.244,192.168.56.101,TCP,443  >  49326 [ACK] Seq=561652 Ack=16933 Win=65535 Len=1460 [TCP segment of a reassembled PDU]
778,193.23.244.244,192.168.56.101,TCP,443  >  49326 [ACK] Seq=563112 Ack=16933 Win=65535 Len=1460 [TCP segment of a reassembled PDU]
779,193.23.244.244,192.168.56.101,TLSv1.2,"Application Data, Application Data"
780,193.23.244.244,192.168.56.101,TCP,443  >  49326 [ACK] Seq=566032 Ack=16933 Win=65535 Len=1460 [TCP segment of a reassembled PDU]
781,193.23.244.244,192.168.56.101,TCP,443  >  49326 [ACK] Seq=567492 Ack=16933 Win=65535 Len=1460 [TCP segment of a reassembled PDU]
782,193.23.244.244,192.168.56.101,TLSv1.2,Application Data [TCP segment of a reassembled PDU]
783,193.23.244.244,192.168.56.101,TCP,443  >  49326 [ACK] Seq=570412 Ack=16933 Win=65535 Len=1460 [TCP segment of a reassembled PDU]
784,193.23.244.244,192.168.56.101,TLSv1.2,Application Data [TCP segment of a reassembled PDU]
785,193.23.244.244,192.168.56.101,TLSv1.2,Application Data [TCP segment of a reassembled PDU]
786,193.23.244.244,192.168.56.101,TCP,443  >  49326 [ACK] Seq=574792 Ack=16933 Win=65535 Len=1460 [TCP segment of a reassembled PDU]
787,193.23.244.244,192.168.56.101,TCP,443  >  49326 [ACK] Seq=576252 Ack=16933 Win=65535 Len=1460 [TCP segment of a reassembled PDU]
788,193.23.244.244,192.168.56.101,TLSv1.2,Application Data [TCP segment of a reassembled PDU]
789,193.23.244.244,192.168.56.101,TCP,443  >  49326 [ACK] Seq=579172 Ack=16933 Win=65535 Len=1460 [TCP segment of a reassembled PDU]
790,193.23.244.244,192.168.56.101,TCP,443  >  49326 [ACK] Seq=580632 Ack=16933 Win=65535 Len=1460 [TCP segment of a reassembled PDU]
791,193.23.244.244,192.168.56.101,TLSv1.2,Application Data [TCP segment of a reassembled PDU]
792,193.23.244.244,192.168.56.101,TCP,443  >  49326 [ACK] Seq=583552 Ack=16933 Win=65535 Len=1460 [TCP segment of a reassembled PDU]
793,193.23.244.244,192.168.56.101,TCP,443  >  49326 [ACK] Seq=585012 Ack=16933 Win=65535 Len=1460 [TCP segment of a reassembled PDU]
794,193.23.244.244,192.168.56.101,TLSv1.2,Application Data [TCP segment of a reassembled PDU]
795,193.23.244.244,192.168.56.101,TCP,443  >  49326 [ACK] Seq=587932 Ack=16933 Win=65535 Len=1460 [TCP segment of a reassembled PDU]
796,193.23.244.244,192.168.56.101,TCP,443  >  49326 [ACK] Seq=589392 Ack=16933 Win=65535 Len=1460 [TCP segment of a reassembled PDU]
797,193.23.244.244,192.168.56.101,TLSv1.2,"Application Data, Application Data"
798,193.23.244.244,192.168.56.101,TCP,443  >  49326 [ACK] Seq=592312 Ack=16933 Win=65535 Len=1460 [TCP segment of a reassembled PDU]
799,193.23.244.244,192.168.56.101,TLSv1.2,Application Data [TCP segment of a reassembled PDU]
800,193.23.244.244,192.168.56.101,TCP,443  >  49326 [ACK] Seq=595232 Ack=16933 Win=65535 Len=1460 [TCP segment of a reassembled PDU]
801,193.23.244.244,192.168.56.101,TCP,443  >  49326 [ACK] Seq=596692 Ack=16933 Win=65535 Len=1460 [TCP segment of a reassembled PDU]
802,193.23.244.244,192.168.56.101,TLSv1.2,Application Data [TCP segment of a reassembled PDU]
803,193.23.244.244,192.168.56.101,TLSv1.2,Application Data [TCP segment of a reassembled PDU]
804,193.23.244.244,192.168.56.101,TCP,443  >  49326 [ACK] Seq=601072 Ack=16933 Win=65535 Len=1460 [TCP segment of a reassembled PDU]
805,193.23.244.244,192.168.56.101,TCP,443  >  49326 [ACK] Seq=602532 Ack=16933 Win=65535 Len=1460 [TCP segment of a reassembled PDU]
806,193.23.244.244,192.168.56.101,TLSv1.2,Application Data [TCP segment of a reassembled PDU]
807,193.23.244.244,192.168.56.101,TCP,443  >  49326 [ACK] Seq=605452 Ack=16933 Win=65535 Len=1460 [TCP segment of a reassembled PDU]
808,193.23.244.244,192.168.56.101,TCP,443  >  49326 [ACK] Seq=606912 Ack=16933 Win=65535 Len=1460 [TCP segment of a reassembled PDU]
809,193.23.244.244,192.168.56.101,TLSv1.2,Application Data [TCP segment of a reassembled PDU]
810,193.23.244.244,192.168.56.101,TCP,443  >  49326 [ACK] Seq=609832 Ack=16933 Win=65535 Len=1460 [TCP segment of a reassembled PDU]
811,193.23.244.244,192.168.56.101,TLSv1.2,Application Data
812,192.168.56.101,193.23.244.244,TCP,49326  >  443 [ACK] Seq=16933 Ack=605452 Win=13140 Len=0
813,192.168.56.101,193.23.244.244,TCP,49326  >  443 [ACK] Seq=16933 Ack=611407 Win=7185 Len=0
814,192.168.56.101,193.23.244.244,TLSv1.2,Application Data
815,193.23.244.244,192.168.56.101,TCP,443  >  49326 [ACK] Seq=611407 Ack=17476 Win=65535 Len=0
816,192.168.56.101,193.23.244.244,TLSv1.2,Application Data
817,193.23.244.244,192.168.56.101,TCP,443  >  49326 [ACK] Seq=611407 Ack=18533 Win=65535 Len=0
818,192.168.56.101,193.23.244.244,TCP,[TCP Window Update] 49326  >  443 [ACK] Seq=18533 Ack=611407 Win=11565 Len=0
819,192.168.56.101,193.23.244.244,TCP,[TCP Window Update] 49326  >  443 [ACK] Seq=18533 Ack=611407 Win=64240 Len=0
820,192.168.56.101,193.23.244.244,TLSv1.2,Application Data
821,193.23.244.244,192.168.56.101,TCP,443  >  49326 [ACK] Seq=611407 Ack=19076 Win=65535 Len=0
822,192.168.56.101,193.23.244.244,TLSv1.2,Application Data
823,193.23.244.244,192.168.56.101,TCP,443  >  49326 [ACK] Seq=611407 Ack=20133 Win=65535 Len=0
824,192.168.56.101,193.23.244.244,TLSv1.2,Application Data
825,193.23.244.244,192.168.56.101,TCP,443  >  49326 [ACK] Seq=611407 Ack=20676 Win=65535 Len=0
826,192.168.56.101,193.23.244.244,TLSv1.2,Application Data
827,193.23.244.244,192.168.56.101,TCP,443  >  49326 [ACK] Seq=611407 Ack=22136 Win=65535 Len=0
828,193.23.244.244,192.168.56.101,TCP,443  >  49326 [ACK] Seq=611407 Ack=22247 Win=65535 Len=0
829,193.23.244.244,192.168.56.101,TLSv1.2,Application Data
830,193.23.244.244,192.168.56.101,TCP,"443  >  49326 [PSH, ACK] Seq=611950 Ack=22247 Win=65535 Len=1460 [TCP segment of a reassembled PDU]"
831,193.23.244.244,192.168.56.101,TCP,"443  >  49326 [PSH, ACK] Seq=613410 Ack=22247 Win=65535 Len=1460 [TCP segment of a reassembled PDU]"
832,192.168.56.101,193.23.244.244,TCP,49326  >  443 [ACK] Seq=22247 Ack=614870 Win=64240 Len=0
833,193.23.244.244,192.168.56.101,TLSv1.2,Application Data [TCP segment of a reassembled PDU]
834,193.23.244.244,192.168.56.101,TCP,"443  >  49326 [PSH, ACK] Seq=616330 Ack=22247 Win=65535 Len=1460 [TCP segment of a reassembled PDU]"
835,193.23.244.244,192.168.56.101,TCP,"443  >  49326 [PSH, ACK] Seq=617790 Ack=22247 Win=65535 Len=1460 [TCP segment of a reassembled PDU]"
836,193.23.244.244,192.168.56.101,TLSv1.2,Application Data [TCP segment of a reassembled PDU]
837,192.168.56.101,193.23.244.244,TCP,49326  >  443 [ACK] Seq=22247 Ack=619250 Win=64240 Len=0
838,193.23.244.244,192.168.56.101,TCP,"443  >  49326 [PSH, ACK] Seq=620710 Ack=22247 Win=65535 Len=1460 [TCP segment of a reassembled PDU]"
839,193.23.244.244,192.168.56.101,TCP,"443  >  49326 [PSH, ACK] Seq=622170 Ack=22247 Win=65535 Len=1460 [TCP segment of a reassembled PDU]"
840,192.168.56.101,193.23.244.244,TCP,49326  >  443 [ACK] Seq=22247 Ack=622170 Win=62780 Len=0
841,193.23.244.244,192.168.56.101,TLSv1.2,Application Data [TCP segment of a reassembled PDU]
842,192.168.56.101,193.23.244.244,TCP,49326  >  443 [ACK] Seq=22247 Ack=625090 Win=59860 Len=0
843,193.23.244.244,192.168.56.101,TCP,"443  >  49326 [PSH, ACK] Seq=625090 Ack=22247 Win=65535 Len=1460 [TCP segment of a reassembled PDU]"
844,193.23.244.244,192.168.56.101,TCP,"443  >  49326 [PSH, ACK] Seq=626550 Ack=22247 Win=65535 Len=1460 [TCP segment of a reassembled PDU]"
845,192.168.56.101,193.23.244.244,TCP,49326  >  443 [ACK] Seq=22247 Ack=628010 Win=56940 Len=0
846,192.168.56.101,193.23.244.244,TCP,[TCP Window Update] 49326  >  443 [ACK] Seq=22247 Ack=628010 Win=64240 Len=0
847,193.23.244.244,192.168.56.101,TLSv1.2,"Application Data, Application Data"
848,192.168.56.101,193.23.244.244,TCP,49326  >  443 [ACK] Seq=22247 Ack=629470 Win=64240 Len=0
849,192.168.56.101,193.23.244.244,TLSv1.2,Application Data
850,193.23.244.244,192.168.56.101,TCP,443  >  49326 [ACK] Seq=629470 Ack=22790 Win=65535 Len=0
851,193.23.244.244,192.168.56.101,TLSv1.2,Application Data
852,192.168.56.101,193.23.244.244,TCP,49326  >  443 [ACK] Seq=22790 Ack=629600 Win=64110 Len=0
853,192.168.56.101,224.0.0.22,IGMPv3,Membership Report / Leave group 224.0.0.252
854,192.168.56.101,224.0.0.22,IGMPv3,Membership Report / Leave group 224.0.0.252
855,192.168.56.101,224.0.0.22,IGMPv3,Membership Report / Join group 224.0.0.252 for any sources
856,192.168.56.101,224.0.0.22,IGMPv3,Membership Report / Join group 224.0.0.252 for any sources
857,192.168.56.101,224.0.0.22,IGMPv3,Membership Report / Join group 239.255.255.250 for any sources
858,192.168.56.101,224.0.0.22,IGMPv3,Membership Report / Join group 239.255.255.250 for any sources
859,192.168.56.101,224.0.0.22,IGMPv3,Membership Report / Join group 224.0.0.252 for any sources / Join group 239.255.255.250 for any sources
860,192.168.56.101,224.0.0.22,IGMPv3,Membership Report / Join group 224.0.0.252 for any sources / Join group 239.255.255.250 for any sources
861,192.168.56.101,224.0.0.252,LLMNR,Standard query 0x6cfb A wpad
862,192.168.56.101,224.0.0.252,LLMNR,Standard query 0x6cfb A wpad
863,192.168.56.101,224.0.0.252,LLMNR,Standard query 0x6cfb A wpad
864,192.168.56.101,224.0.0.252,LLMNR,Standard query 0x6cfb A wpad
865,192.168.56.101,224.0.0.252,LLMNR,Standard query 0xd1eb A wpad
866,192.168.56.101,224.0.0.252,LLMNR,Standard query 0xd1eb A wpad
867,192.168.56.101,224.0.0.252,LLMNR,Standard query 0xd1eb A wpad
868,192.168.56.101,224.0.0.252,LLMNR,Standard query 0xd1eb A wpad
869,192.168.56.101,224.0.0.252,LLMNR,Standard query 0xea6d A wpad
870,192.168.56.101,224.0.0.252,LLMNR,Standard query 0xea6d A wpad
871,192.168.56.101,224.0.0.252,LLMNR,Standard query 0xea6d A wpad
872,192.168.56.101,224.0.0.252,LLMNR,Standard query 0xea6d A wpad
873,192.168.56.101,224.0.0.252,LLMNR,Standard query 0xc9cb A isatap
874,192.168.56.101,224.0.0.252,LLMNR,Standard query 0xc9cb A isatap
875,192.168.56.101,224.0.0.252,LLMNR,Standard query 0xc9cb A isatap
876,192.168.56.101,224.0.0.252,LLMNR,Standard query 0xc9cb A isatap
877,192.168.56.101,224.0.0.252,LLMNR,Standard query 0x971a A isatap
878,192.168.56.101,224.0.0.252,LLMNR,Standard query 0x971a A isatap
879,192.168.56.101,224.0.0.252,LLMNR,Standard query 0x971a A isatap
880,192.168.56.101,224.0.0.252,LLMNR,Standard query 0x971a A isatap
881,192.168.56.101,224.0.0.252,LLMNR,Standard query 0xc4c8 A wpad
882,192.168.56.101,224.0.0.252,LLMNR,Standard query 0xc4c8 A wpad
883,192.168.56.101,224.0.0.252,LLMNR,Standard query 0xc4c8 A wpad
884,192.168.56.101,224.0.0.252,LLMNR,Standard query 0xc4c8 A wpad
885,192.168.56.101,224.0.0.252,LLMNR,Standard query 0x4163 A isatap
886,192.168.56.101,224.0.0.252,LLMNR,Standard query 0x4163 A isatap
887,192.168.56.101,224.0.0.252,LLMNR,Standard query 0x4163 A isatap
888,192.168.56.101,224.0.0.252,LLMNR,Standard query 0x4163 A isatap
889,192.168.56.101,224.0.0.252,LLMNR,Standard query 0x96f1 A isatap
890,192.168.56.101,224.0.0.252,LLMNR,Standard query 0x96f1 A isatap
891,192.168.56.101,224.0.0.252,LLMNR,Standard query 0x96f1 A isatap
892,192.168.56.101,224.0.0.252,LLMNR,Standard query 0x96f1 A isatap
893,192.168.56.101,224.0.0.252,LLMNR,Standard query 0x6e6e A isatap
894,192.168.56.101,224.0.0.252,LLMNR,Standard query 0x6e6e A isatap
895,192.168.56.101,224.0.0.252,LLMNR,Standard query 0x6e6e A isatap
896,192.168.56.101,224.0.0.252,LLMNR,Standard query 0x6e6e A isatap
897,192.168.56.101,224.0.0.252,LLMNR,Standard query 0x4559 A wpad
898,192.168.56.101,224.0.0.252,LLMNR,Standard query 0x4559 A wpad
899,192.168.56.101,224.0.0.252,LLMNR,Standard query 0x4559 A wpad
900,192.168.56.101,224.0.0.252,LLMNR,Standard query 0x4559 A wpad
901,192.168.56.101,224.0.0.252,LLMNR,Standard query 0x21c1 ANY None
902,192.168.56.101,224.0.0.252,LLMNR,Standard query 0x21c1 ANY None
903,192.168.56.101,224.0.0.252,LLMNR,Standard query 0x21c1 ANY None
904,192.168.56.101,224.0.0.252,LLMNR,Standard query 0x21c1 ANY None
905,192.168.56.101,239.255.255.250,SSDP,M-SEARCH * HTTP/1.1 
906,192.168.56.101,239.255.255.250,SSDP,M-SEARCH * HTTP/1.1 
907,192.168.56.101,239.255.255.250,SSDP,M-SEARCH * HTTP/1.1 
908,192.168.56.101,239.255.255.250,SSDP,M-SEARCH * HTTP/1.1 
909,192.168.56.101,239.255.255.250,SSDP,M-SEARCH * HTTP/1.1 
910,192.168.56.101,239.255.255.250,SSDP,M-SEARCH * HTTP/1.1 
911,192.168.56.101,239.255.255.250,SSDP,M-SEARCH * HTTP/1.1 
912,192.168.56.101,239.255.255.250,SSDP,M-SEARCH * HTTP/1.1 
913,192.168.56.101,239.255.255.250,SSDP,M-SEARCH * HTTP/1.1 
914,192.168.56.101,239.255.255.250,SSDP,M-SEARCH * HTTP/1.1 
915,192.168.56.101,239.255.255.250,SSDP,M-SEARCH * HTTP/1.1 
916,192.168.56.101,239.255.255.250,SSDP,M-SEARCH * HTTP/1.1 
917,192.168.56.101,239.255.255.250,SSDP,M-SEARCH * HTTP/1.1 
918,192.168.56.101,239.255.255.250,SSDP,M-SEARCH * HTTP/1.1 
919,192.168.56.101,239.255.255.250,SSDP,M-SEARCH * HTTP/1.1 
920,192.168.56.101,239.255.255.250,SSDP,M-SEARCH * HTTP/1.1 
921,192.168.56.101,239.255.255.250,SSDP,M-SEARCH * HTTP/1.1 
922,192.168.56.101,239.255.255.250,SSDP,M-SEARCH * HTTP/1.1 
923,192.168.56.101,239.255.255.250,SSDP,M-SEARCH * HTTP/1.1 
924,192.168.56.101,239.255.255.250,SSDP,M-SEARCH * HTTP/1.1 
925,192.168.56.101,239.255.255.250,SSDP,M-SEARCH * HTTP/1.1 
926,192.168.56.101,239.255.255.250,SSDP,M-SEARCH * HTTP/1.1 
927,192.168.56.101,239.255.255.250,SSDP,M-SEARCH * HTTP/1.1 
928,192.168.56.101,239.255.255.250,SSDP,M-SEARCH * HTTP/1.1 
929,192.168.56.101,239.255.255.250,SSDP,M-SEARCH * HTTP/1.1 
930,192.168.56.101,239.255.255.250,SSDP,M-SEARCH * HTTP/1.1 
931,192.168.56.101,239.255.255.250,SSDP,M-SEARCH * HTTP/1.1 
932,192.168.56.101,239.255.255.250,SSDP,M-SEARCH * HTTP/1.1 
933,192.168.56.101,239.255.255.250,SSDP,M-SEARCH * HTTP/1.1 
934,192.168.56.101,239.255.255.250,SSDP,M-SEARCH * HTTP/1.1 
935,192.168.56.101,239.255.255.250,SSDP,M-SEARCH * HTTP/1.1 
936,192.168.56.101,239.255.255.250,SSDP,M-SEARCH * HTTP/1.1 
937,192.168.56.101,239.255.255.250,SSDP,M-SEARCH * HTTP/1.1 
938,192.168.56.101,239.255.255.250,SSDP,M-SEARCH * HTTP/1.1 
939,192.168.56.101,239.255.255.250,SSDP,M-SEARCH * HTTP/1.1 
940,192.168.56.101,239.255.255.250,SSDP,M-SEARCH * HTTP/1.1 
941,192.168.56.101,239.255.255.250,SSDP,M-SEARCH * HTTP/1.1 
942,192.168.56.101,239.255.255.250,SSDP,M-SEARCH * HTTP/1.1 
943,192.168.56.101,239.255.255.250,SSDP,M-SEARCH * HTTP/1.1 
944,192.168.56.101,239.255.255.250,SSDP,M-SEARCH * HTTP/1.1 
945,192.168.56.101,239.255.255.250,UDP,65391  >  3702 Len=624
946,192.168.56.101,239.255.255.250,UDP,65391  >  3702 Len=624
947,192.168.56.101,239.255.255.250,UDP,65391  >  3702 Len=624
948,192.168.56.101,239.255.255.250,UDP,65391  >  3702 Len=624
949,192.168.56.101,8.8.8.8,DNS,Standard query 0xcf1c A watson.microsoft.com
950,192.168.56.101,8.8.8.8,DNS,Standard query 0xcf1c A watson.microsoft.com
951,192.168.56.101,8.8.8.8,DNS,Standard query 0xcf1c A watson.microsoft.com
952,192.168.56.101,8.8.8.8,DNS,Standard query 0xcf1c A watson.microsoft.com
953,192.168.56.101,8.8.8.8,DNS,Standard query 0xcf1c A watson.microsoft.com
954,8.8.8.8,192.168.56.101,DNS,Standard query response 0xcf1c A watson.microsoft.com CNAME legacywatson.trafficmanager.net CNAME onedsblobprdcus07.centralus.cloudapp.azure.com A 104.208.16.93
955,192.168.56.101,8.8.8.8,DNS,Standard query 0x025f A www.msftncsi.com
956,8.8.8.8,192.168.56.101,DNS,Standard query response 0x025f A www.msftncsi.com CNAME www.msftncsi.com.edgesuite.net CNAME a1961.g2.akamai.net A 96.17.176.171 A 96.17.176.177
957,192.168.56.101,8.8.8.8,DNS,Standard query 0x69e6 A watson.microsoft.com
958,192.168.56.101,8.8.8.8,DNS,Standard query 0x69e6 A watson.microsoft.com
959,192.168.56.101,8.8.8.8,DNS,Standard query 0x69e6 A watson.microsoft.com
960,192.168.56.101,8.8.8.8,DNS,Standard query 0x69e6 A watson.microsoft.com
961,192.168.56.101,8.8.8.8,DNS,Standard query 0x69e6 A watson.microsoft.com
962,192.168.56.101,8.8.8.8,DNS,Standard query 0x04c8 A time.windows.com
963,192.168.56.101,8.8.8.8,DNS,Standard query 0x04c8 A time.windows.com
964,192.168.56.101,8.8.8.8,DNS,Standard query 0x04c8 A time.windows.com
965,192.168.56.101,8.8.8.8,DNS,Standard query 0x04c8 A time.windows.com
966,192.168.56.101,8.8.8.8,DNS,Standard query 0x04c8 A time.windows.com
967,192.168.56.101,8.8.8.8,DNS,Standard query 0xab76 A teredo.ipv6.microsoft.com
968,8.8.8.8,192.168.56.101,DNS,Standard query response 0xab76 No such name A teredo.ipv6.microsoft.com SOA ns1-04.azure-dns.com
969,192.168.56.101,8.8.8.8,DNS,Standard query 0x09c0 A clients2.google.com
970,192.168.56.101,8.8.8.8,DNS,Standard query 0x09c0 A clients2.google.com
971,192.168.56.101,8.8.8.8,DNS,Standard query 0x09c0 A clients2.google.com
972,192.168.56.101,8.8.8.8,DNS,Standard query 0x09c0 A clients2.google.com
973,192.168.56.101,8.8.8.8,DNS,Standard query 0x09c0 A clients2.google.com
974,8.8.8.8,192.168.56.101,DNS,Standard query response 0x09c0 A clients2.google.com CNAME clients.l.google.com A 142.251.33.14
975,192.168.56.101,8.8.8.8,DNS,Standard query 0xf66d A time.windows.com
976,192.168.56.101,8.8.8.8,DNS,Standard query 0xf66d A time.windows.com
977,192.168.56.101,8.8.8.8,DNS,Standard query 0xf66d A time.windows.com
978,192.168.56.101,8.8.8.8,DNS,Standard query 0xf66d A time.windows.com
979,192.168.56.101,8.8.8.8,DNS,Standard query 0xf66d A time.windows.com
980,192.168.56.101,8.8.8.8,DNS,Standard query 0xe6e6 A dns.msftncsi.com
981,192.168.56.101,8.8.8.8,DNS,Standard query 0xe6e6 A dns.msftncsi.com
982,192.168.56.101,8.8.8.8,DNS,Standard query 0xe6e6 A dns.msftncsi.com
983,192.168.56.101,8.8.8.8,DNS,Standard query 0xe6e6 A dns.msftncsi.com
984,192.168.56.101,8.8.8.8,DNS,Standard query 0xe6e6 A dns.msftncsi.com
985,192.168.56.101,8.8.8.8,DNS,Standard query 0x44c1 A clients2.google.com
986,192.168.56.101,8.8.8.8,DNS,Standard query 0x44c1 A clients2.google.com
987,192.168.56.101,8.8.8.8,DNS,Standard query 0x44c1 A clients2.google.com
988,192.168.56.101,8.8.8.8,DNS,Standard query 0x44c1 A clients2.google.com
989,192.168.56.101,8.8.8.8,DNS,Standard query 0x44c1 A clients2.google.com
990,8.8.8.8,192.168.56.101,DNS,Standard query response 0x44c1 A clients2.google.com CNAME clients.l.google.com A 172.217.14.174
991,192.168.56.101,96.17.176.171,TCP,49160  >  80 [SYN] Seq=0 Win=8192 Len=0 MSS=1460 WS=256 SACK_PERM=1
992,96.17.176.171,192.168.56.101,TCP,"80  >  49160 [SYN, ACK] Seq=0 Ack=1 Win=65535 Len=0 MSS=1460"
993,192.168.56.101,96.17.176.171,TCP,49160  >  80 [ACK] Seq=1 Ack=1 Win=64240 Len=0
994,192.168.56.101,96.17.176.171,HTTP,GET /ncsi.txt HTTP/1.1 
995,96.17.176.171,192.168.56.101,TCP,80  >  49160 [ACK] Seq=1 Ack=98 Win=65535 Len=0
996,96.17.176.171,192.168.56.101,HTTP,HTTP/1.1 200 OK  (text/plain)
997,96.17.176.171,192.168.56.101,TCP,"80  >  49160 [FIN, ACK] Seq=180 Ack=98 Win=65535 Len=0"
998,192.168.56.101,96.17.176.171,TCP,49160  >  80 [ACK] Seq=98 Ack=181 Win=64061 Len=0
999,192.168.56.101,96.17.176.171,TCP,"49160  >  80 [FIN, ACK] Seq=98 Ack=181 Win=64061 Len=0"
1000,96.17.176.171,192.168.56.101,TCP,80  >  49160 [ACK] Seq=181 Ack=99 Win=65535 Len=0
