No.     Time           Source                Destination           Protocol Length Info
      1 0.000000       0a:00:27:00:00:00     Broadcast             ARP      42     Who has 192.168.56.101? Tell 192.168.56.1

Frame 1: 42 bytes on wire (336 bits), 42 bytes captured (336 bits)
Ethernet II, Src: 0a:00:27:00:00:00 (0a:00:27:00:00:00), Dst: Broadcast (ff:ff:ff:ff:ff:ff)
Address Resolution Protocol (request)

No.     Time           Source                Destination           Protocol Length Info
      2 1.019541       0a:00:27:00:00:00     Broadcast             ARP      42     Who has 192.168.56.101? Tell 192.168.56.1

Frame 2: 42 bytes on wire (336 bits), 42 bytes captured (336 bits)
Ethernet II, Src: 0a:00:27:00:00:00 (0a:00:27:00:00:00), Dst: Broadcast (ff:ff:ff:ff:ff:ff)
Address Resolution Protocol (request)

No.     Time           Source                Destination           Protocol Length Info
      3 2.040818       0a:00:27:00:00:00     Broadcast             ARP      42     Who has 192.168.56.101? Tell 192.168.56.1

Frame 3: 42 bytes on wire (336 bits), 42 bytes captured (336 bits)
Ethernet II, Src: 0a:00:27:00:00:00 (0a:00:27:00:00:00), Dst: Broadcast (ff:ff:ff:ff:ff:ff)
Address Resolution Protocol (request)

No.     Time           Source                Destination           Protocol Length Info
      4 4.068586       0a:00:27:00:00:00     Broadcast             ARP      42     Who has 192.168.56.101? Tell 192.168.56.1

Frame 4: 42 bytes on wire (336 bits), 42 bytes captured (336 bits)
Ethernet II, Src: 0a:00:27:00:00:00 (0a:00:27:00:00:00), Dst: Broadcast (ff:ff:ff:ff:ff:ff)
Address Resolution Protocol (request)

No.     Time           Source                Destination           Protocol Length Info
      5 5.081338       0a:00:27:00:00:00     Broadcast             ARP      42     Who has 192.168.56.101? Tell 192.168.56.1

Frame 5: 42 bytes on wire (336 bits), 42 bytes captured (336 bits)
Ethernet II, Src: 0a:00:27:00:00:00 (0a:00:27:00:00:00), Dst: Broadcast (ff:ff:ff:ff:ff:ff)
Address Resolution Protocol (request)

No.     Time           Source                Destination           Protocol Length Info
      6 6.104806       0a:00:27:00:00:00     Broadcast             ARP      42     Who has 192.168.56.101? Tell 192.168.56.1

Frame 6: 42 bytes on wire (336 bits), 42 bytes captured (336 bits)
Ethernet II, Src: 0a:00:27:00:00:00 (0a:00:27:00:00:00), Dst: Broadcast (ff:ff:ff:ff:ff:ff)
Address Resolution Protocol (request)

No.     Time           Source                Destination           Protocol Length Info
      7 7.601814       0a:00:27:00:00:00     Broadcast             ARP      42     Who has 192.168.56.101? Tell 192.168.56.1

Frame 7: 42 bytes on wire (336 bits), 42 bytes captured (336 bits)
Ethernet II, Src: 0a:00:27:00:00:00 (0a:00:27:00:00:00), Dst: Broadcast (ff:ff:ff:ff:ff:ff)
Address Resolution Protocol (request)

No.     Time           Source                Destination           Protocol Length Info
      8 8.633628       0a:00:27:00:00:00     Broadcast             ARP      42     Who has 192.168.56.101? Tell 192.168.56.1

Frame 8: 42 bytes on wire (336 bits), 42 bytes captured (336 bits)
Ethernet II, Src: 0a:00:27:00:00:00 (0a:00:27:00:00:00), Dst: Broadcast (ff:ff:ff:ff:ff:ff)
Address Resolution Protocol (request)

No.     Time           Source                Destination           Protocol Length Info
      9 9.661246       0a:00:27:00:00:00     Broadcast             ARP      42     Who has 192.168.56.101? Tell 192.168.56.1

Frame 9: 42 bytes on wire (336 bits), 42 bytes captured (336 bits)
Ethernet II, Src: 0a:00:27:00:00:00 (0a:00:27:00:00:00), Dst: Broadcast (ff:ff:ff:ff:ff:ff)
Address Resolution Protocol (request)

No.     Time           Source                Destination           Protocol Length Info
     10 11.683878      0a:00:27:00:00:00     Broadcast             ARP      42     Who has 192.168.56.101? Tell 192.168.56.1

Frame 10: 42 bytes on wire (336 bits), 42 bytes captured (336 bits)
Ethernet II, Src: 0a:00:27:00:00:00 (0a:00:27:00:00:00), Dst: Broadcast (ff:ff:ff:ff:ff:ff)
Address Resolution Protocol (request)

No.     Time           Source                Destination           Protocol Length Info
     11 12.696803      0a:00:27:00:00:00     Broadcast             ARP      42     Who has 192.168.56.101? Tell 192.168.56.1

Frame 11: 42 bytes on wire (336 bits), 42 bytes captured (336 bits)
Ethernet II, Src: 0a:00:27:00:00:00 (0a:00:27:00:00:00), Dst: Broadcast (ff:ff:ff:ff:ff:ff)
Address Resolution Protocol (request)

No.     Time           Source                Destination           Protocol Length Info
     12 13.721695      0a:00:27:00:00:00     Broadcast             ARP      42     Who has 192.168.56.101? Tell 192.168.56.1

Frame 12: 42 bytes on wire (336 bits), 42 bytes captured (336 bits)
Ethernet II, Src: 0a:00:27:00:00:00 (0a:00:27:00:00:00), Dst: Broadcast (ff:ff:ff:ff:ff:ff)
Address Resolution Protocol (request)

No.     Time           Source                Destination           Protocol Length Info
     13 15.749337      0a:00:27:00:00:00     Broadcast             ARP      42     Who has 192.168.56.101? Tell 192.168.56.1

Frame 13: 42 bytes on wire (336 bits), 42 bytes captured (336 bits)
Ethernet II, Src: 0a:00:27:00:00:00 (0a:00:27:00:00:00), Dst: Broadcast (ff:ff:ff:ff:ff:ff)
Address Resolution Protocol (request)

No.     Time           Source                Destination           Protocol Length Info
     14 16.761703      0a:00:27:00:00:00     Broadcast             ARP      42     Who has 192.168.56.101? Tell 192.168.56.1

Frame 14: 42 bytes on wire (336 bits), 42 bytes captured (336 bits)
Ethernet II, Src: 0a:00:27:00:00:00 (0a:00:27:00:00:00), Dst: Broadcast (ff:ff:ff:ff:ff:ff)
Address Resolution Protocol (request)

No.     Time           Source                Destination           Protocol Length Info
     15 17.786044      0a:00:27:00:00:00     Broadcast             ARP      42     Who has 192.168.56.101? Tell 192.168.56.1

Frame 15: 42 bytes on wire (336 bits), 42 bytes captured (336 bits)
Ethernet II, Src: 0a:00:27:00:00:00 (0a:00:27:00:00:00), Dst: Broadcast (ff:ff:ff:ff:ff:ff)
Address Resolution Protocol (request)

No.     Time           Source                Destination           Protocol Length Info
     16 19.811582      0a:00:27:00:00:00     Broadcast             ARP      42     Who has 192.168.56.101? Tell 192.168.56.1

Frame 16: 42 bytes on wire (336 bits), 42 bytes captured (336 bits)
Ethernet II, Src: 0a:00:27:00:00:00 (0a:00:27:00:00:00), Dst: Broadcast (ff:ff:ff:ff:ff:ff)
Address Resolution Protocol (request)

No.     Time           Source                Destination           Protocol Length Info
     17 20.824788      0a:00:27:00:00:00     Broadcast             ARP      42     Who has 192.168.56.101? Tell 192.168.56.1

Frame 17: 42 bytes on wire (336 bits), 42 bytes captured (336 bits)
Ethernet II, Src: 0a:00:27:00:00:00 (0a:00:27:00:00:00), Dst: Broadcast (ff:ff:ff:ff:ff:ff)
Address Resolution Protocol (request)

No.     Time           Source                Destination           Protocol Length Info
     18 21.848961      0a:00:27:00:00:00     Broadcast             ARP      42     Who has 192.168.56.101? Tell 192.168.56.1

Frame 18: 42 bytes on wire (336 bits), 42 bytes captured (336 bits)
Ethernet II, Src: 0a:00:27:00:00:00 (0a:00:27:00:00:00), Dst: Broadcast (ff:ff:ff:ff:ff:ff)
Address Resolution Protocol (request)

No.     Time           Source                Destination           Protocol Length Info
     19 23.877887      0a:00:27:00:00:00     Broadcast             ARP      42     Who has 192.168.56.101? Tell 192.168.56.1

Frame 19: 42 bytes on wire (336 bits), 42 bytes captured (336 bits)
Ethernet II, Src: 0a:00:27:00:00:00 (0a:00:27:00:00:00), Dst: Broadcast (ff:ff:ff:ff:ff:ff)
Address Resolution Protocol (request)

No.     Time           Source                Destination           Protocol Length Info
     20 24.894669      0a:00:27:00:00:00     Broadcast             ARP      42     Who has 192.168.56.101? Tell 192.168.56.1

Frame 20: 42 bytes on wire (336 bits), 42 bytes captured (336 bits)
Ethernet II, Src: 0a:00:27:00:00:00 (0a:00:27:00:00:00), Dst: Broadcast (ff:ff:ff:ff:ff:ff)
Address Resolution Protocol (request)

No.     Time           Source                Destination           Protocol Length Info
     21 25.913174      0a:00:27:00:00:00     Broadcast             ARP      42     Who has 192.168.56.101? Tell 192.168.56.1

Frame 21: 42 bytes on wire (336 bits), 42 bytes captured (336 bits)
Ethernet II, Src: 0a:00:27:00:00:00 (0a:00:27:00:00:00), Dst: Broadcast (ff:ff:ff:ff:ff:ff)
Address Resolution Protocol (request)

No.     Time           Source                Destination           Protocol Length Info
     22 27.942646      0a:00:27:00:00:00     Broadcast             ARP      42     Who has 192.168.56.101? Tell 192.168.56.1

Frame 22: 42 bytes on wire (336 bits), 42 bytes captured (336 bits)
Ethernet II, Src: 0a:00:27:00:00:00 (0a:00:27:00:00:00), Dst: Broadcast (ff:ff:ff:ff:ff:ff)
Address Resolution Protocol (request)

No.     Time           Source                Destination           Protocol Length Info
     23 28.953402      0a:00:27:00:00:00     Broadcast             ARP      42     Who has 192.168.56.101? Tell 192.168.56.1

Frame 23: 42 bytes on wire (336 bits), 42 bytes captured (336 bits)
Ethernet II, Src: 0a:00:27:00:00:00 (0a:00:27:00:00:00), Dst: Broadcast (ff:ff:ff:ff:ff:ff)
Address Resolution Protocol (request)

No.     Time           Source                Destination           Protocol Length Info
     24 29.977621      0a:00:27:00:00:00     Broadcast             ARP      42     Who has 192.168.56.101? Tell 192.168.56.1

Frame 24: 42 bytes on wire (336 bits), 42 bytes captured (336 bits)
Ethernet II, Src: 0a:00:27:00:00:00 (0a:00:27:00:00:00), Dst: Broadcast (ff:ff:ff:ff:ff:ff)
Address Resolution Protocol (request)

No.     Time           Source                Destination           Protocol Length Info
     25 32.006603      0a:00:27:00:00:00     Broadcast             ARP      42     Who has 192.168.56.101? Tell 192.168.56.1

Frame 25: 42 bytes on wire (336 bits), 42 bytes captured (336 bits)
Ethernet II, Src: 0a:00:27:00:00:00 (0a:00:27:00:00:00), Dst: Broadcast (ff:ff:ff:ff:ff:ff)
Address Resolution Protocol (request)

No.     Time           Source                Destination           Protocol Length Info
     26 33.017909      0a:00:27:00:00:00     Broadcast             ARP      42     Who has 192.168.56.101? Tell 192.168.56.1

Frame 26: 42 bytes on wire (336 bits), 42 bytes captured (336 bits)
Ethernet II, Src: 0a:00:27:00:00:00 (0a:00:27:00:00:00), Dst: Broadcast (ff:ff:ff:ff:ff:ff)
Address Resolution Protocol (request)

No.     Time           Source                Destination           Protocol Length Info
     27 33.184217      5a:94:d2:14:5a:51     Broadcast             ARP      42     Who has 192.168.56.101? (ARP Probe)

Frame 27: 42 bytes on wire (336 bits), 42 bytes captured (336 bits)
Ethernet II, Src: 5a:94:d2:14:5a:51 (5a:94:d2:14:5a:51), Dst: Broadcast (ff:ff:ff:ff:ff:ff)
Address Resolution Protocol (ARP Probe)

No.     Time           Source                Destination           Protocol Length Info
     28 33.184220      5a:94:d2:14:5a:51     Broadcast             ARP      42     Who has 192.168.56.101? (ARP Probe)

Frame 28: 42 bytes on wire (336 bits), 42 bytes captured (336 bits)
Ethernet II, Src: 5a:94:d2:14:5a:51 (5a:94:d2:14:5a:51), Dst: Broadcast (ff:ff:ff:ff:ff:ff)
Address Resolution Protocol (ARP Probe)

No.     Time           Source                Destination           Protocol Length Info
     29 34.040871      0a:00:27:00:00:00     Broadcast             ARP      42     Who has 192.168.56.101? Tell 192.168.56.1

Frame 29: 42 bytes on wire (336 bits), 42 bytes captured (336 bits)
Ethernet II, Src: 0a:00:27:00:00:00 (0a:00:27:00:00:00), Dst: Broadcast (ff:ff:ff:ff:ff:ff)
Address Resolution Protocol (request)

No.     Time           Source                Destination           Protocol Length Info
     30 34.186611      5a:94:d2:14:5a:51     Broadcast             ARP      42     Who has 192.168.56.101? (ARP Probe)

Frame 30: 42 bytes on wire (336 bits), 42 bytes captured (336 bits)
Ethernet II, Src: 5a:94:d2:14:5a:51 (5a:94:d2:14:5a:51), Dst: Broadcast (ff:ff:ff:ff:ff:ff)
Address Resolution Protocol (ARP Probe)

No.     Time           Source                Destination           Protocol Length Info
     31 34.186615      5a:94:d2:14:5a:51     Broadcast             ARP      42     Who has 192.168.56.101? (ARP Probe)

Frame 31: 42 bytes on wire (336 bits), 42 bytes captured (336 bits)
Ethernet II, Src: 5a:94:d2:14:5a:51 (5a:94:d2:14:5a:51), Dst: Broadcast (ff:ff:ff:ff:ff:ff)
Address Resolution Protocol (ARP Probe)

No.     Time           Source                Destination           Protocol Length Info
     32 35.187555      5a:94:d2:14:5a:51     Broadcast             ARP      42     Who has 192.168.56.101? (ARP Probe)

Frame 32: 42 bytes on wire (336 bits), 42 bytes captured (336 bits)
Ethernet II, Src: 5a:94:d2:14:5a:51 (5a:94:d2:14:5a:51), Dst: Broadcast (ff:ff:ff:ff:ff:ff)
Address Resolution Protocol (ARP Probe)

No.     Time           Source                Destination           Protocol Length Info
     33 35.187559      5a:94:d2:14:5a:51     Broadcast             ARP      42     Who has 192.168.56.101? (ARP Probe)

Frame 33: 42 bytes on wire (336 bits), 42 bytes captured (336 bits)
Ethernet II, Src: 5a:94:d2:14:5a:51 (5a:94:d2:14:5a:51), Dst: Broadcast (ff:ff:ff:ff:ff:ff)
Address Resolution Protocol (ARP Probe)

No.     Time           Source                Destination           Protocol Length Info
     34 35.322073      0a:00:27:00:00:00     Broadcast             ARP      42     Who has 192.168.56.101? Tell 192.168.56.1

Frame 34: 42 bytes on wire (336 bits), 42 bytes captured (336 bits)
Ethernet II, Src: 0a:00:27:00:00:00 (0a:00:27:00:00:00), Dst: Broadcast (ff:ff:ff:ff:ff:ff)
Address Resolution Protocol (request)

No.     Time           Source                Destination           Protocol Length Info
     35 36.193342      5a:94:d2:14:5a:51     Broadcast             ARP      42     Who has 192.168.56.1? Tell 192.168.56.101

Frame 35: 42 bytes on wire (336 bits), 42 bytes captured (336 bits)
Ethernet II, Src: 5a:94:d2:14:5a:51 (5a:94:d2:14:5a:51), Dst: Broadcast (ff:ff:ff:ff:ff:ff)
Address Resolution Protocol (request)

No.     Time           Source                Destination           Protocol Length Info
     36 36.193347      5a:94:d2:14:5a:51     Broadcast             ARP      42     Who has 192.168.56.1? Tell 192.168.56.101

Frame 36: 42 bytes on wire (336 bits), 42 bytes captured (336 bits)
Ethernet II, Src: 5a:94:d2:14:5a:51 (5a:94:d2:14:5a:51), Dst: Broadcast (ff:ff:ff:ff:ff:ff)
Address Resolution Protocol (request)

No.     Time           Source                Destination           Protocol Length Info
     37 36.193359      185.100.84.212        192.168.56.101        TCP      145    443 → 49197 [ACK] Seq=1 Ack=1 Win=65535 Len=91 [TCP segment of a reassembled PDU]

Frame 37: 145 bytes on wire (1160 bits), 145 bytes captured (1160 bits)
Ethernet II, Src: 0a:00:27:00:00:00 (0a:00:27:00:00:00), Dst: 5a:94:d2:14:5a:51 (5a:94:d2:14:5a:51)
Internet Protocol Version 4, Src: 185.100.84.212, Dst: 192.168.56.101
Transmission Control Protocol, Src Port: 443, Dst Port: 49197, Seq: 1, Ack: 1, Len: 91

No.     Time           Source                Destination           Protocol Length Info
     38 36.193384      0a:00:27:00:00:00     5a:94:d2:14:5a:51     ARP      42     192.168.56.1 is at 0a:00:27:00:00:00

Frame 38: 42 bytes on wire (336 bits), 42 bytes captured (336 bits)
Ethernet II, Src: 0a:00:27:00:00:00 (0a:00:27:00:00:00), Dst: 5a:94:d2:14:5a:51 (5a:94:d2:14:5a:51)
Address Resolution Protocol (reply)

No.     Time           Source                Destination           Protocol Length Info
     39 36.196279      192.168.56.101        224.0.0.252           LLMNR    66     Standard query 0xd671 A isatap

Frame 39: 66 bytes on wire (528 bits), 66 bytes captured (528 bits)
Ethernet II, Src: 5a:94:d2:14:5a:51 (5a:94:d2:14:5a:51), Dst: IPv4mcast_fc (01:00:5e:00:00:fc)
Internet Protocol Version 4, Src: 192.168.56.101, Dst: 224.0.0.252
User Datagram Protocol, Src Port: 62402, Dst Port: 5355
Link-local Multicast Name Resolution (query)

No.     Time           Source                Destination           Protocol Length Info
     40 36.196281      192.168.56.101        224.0.0.252           LLMNR    66     Standard query 0xd671 A isatap

Frame 40: 66 bytes on wire (528 bits), 66 bytes captured (528 bits)
Ethernet II, Src: 5a:94:d2:14:5a:51 (5a:94:d2:14:5a:51), Dst: IPv4mcast_fc (01:00:5e:00:00:fc)
Internet Protocol Version 4, Src: 192.168.56.101, Dst: 224.0.0.252
User Datagram Protocol, Src Port: 62402, Dst Port: 5355
Link-local Multicast Name Resolution (query)

No.     Time           Source                Destination           Protocol Length Info
     41 36.211528      192.168.56.101        224.0.0.22            IGMPv3   54     Membership Report / Leave group 224.0.0.252

Frame 41: 54 bytes on wire (432 bits), 54 bytes captured (432 bits)
Ethernet II, Src: 5a:94:d2:14:5a:51 (5a:94:d2:14:5a:51), Dst: IPv4mcast_16 (01:00:5e:00:00:16)
Internet Protocol Version 4, Src: 192.168.56.101, Dst: 224.0.0.22
Internet Group Management Protocol

No.     Time           Source                Destination           Protocol Length Info
     42 36.211530      192.168.56.101        224.0.0.22            IGMPv3   54     Membership Report / Leave group 224.0.0.252

Frame 42: 54 bytes on wire (432 bits), 54 bytes captured (432 bits)
Ethernet II, Src: 5a:94:d2:14:5a:51 (5a:94:d2:14:5a:51), Dst: IPv4mcast_16 (01:00:5e:00:00:16)
Internet Protocol Version 4, Src: 192.168.56.101, Dst: 224.0.0.22
Internet Group Management Protocol

No.     Time           Source                Destination           Protocol Length Info
     43 36.229945      192.168.56.101        224.0.0.22            IGMPv3   54     Membership Report / Join group 224.0.0.252 for any sources

Frame 43: 54 bytes on wire (432 bits), 54 bytes captured (432 bits)
Ethernet II, Src: 5a:94:d2:14:5a:51 (5a:94:d2:14:5a:51), Dst: IPv4mcast_16 (01:00:5e:00:00:16)
Internet Protocol Version 4, Src: 192.168.56.101, Dst: 224.0.0.22
Internet Group Management Protocol

No.     Time           Source                Destination           Protocol Length Info
     44 36.229947      192.168.56.101        224.0.0.22            IGMPv3   54     Membership Report / Join group 224.0.0.252 for any sources

Frame 44: 54 bytes on wire (432 bits), 54 bytes captured (432 bits)
Ethernet II, Src: 5a:94:d2:14:5a:51 (5a:94:d2:14:5a:51), Dst: IPv4mcast_16 (01:00:5e:00:00:16)
Internet Protocol Version 4, Src: 192.168.56.101, Dst: 224.0.0.22
Internet Group Management Protocol

No.     Time           Source                Destination           Protocol Length Info
     45 36.232354      192.168.56.101        224.0.0.252           LLMNR    64     Standard query 0x4163 ANY None

Frame 45: 64 bytes on wire (512 bits), 64 bytes captured (512 bits)
Ethernet II, Src: 5a:94:d2:14:5a:51 (5a:94:d2:14:5a:51), Dst: IPv4mcast_fc (01:00:5e:00:00:fc)
Internet Protocol Version 4, Src: 192.168.56.101, Dst: 224.0.0.252
User Datagram Protocol, Src Port: 57516, Dst Port: 5355
Link-local Multicast Name Resolution (query)

No.     Time           Source                Destination           Protocol Length Info
     46 36.232356      192.168.56.101        224.0.0.252           LLMNR    64     Standard query 0x4163 ANY None

Frame 46: 64 bytes on wire (512 bits), 64 bytes captured (512 bits)
Ethernet II, Src: 5a:94:d2:14:5a:51 (5a:94:d2:14:5a:51), Dst: IPv4mcast_fc (01:00:5e:00:00:fc)
Internet Protocol Version 4, Src: 192.168.56.101, Dst: 224.0.0.252
User Datagram Protocol, Src Port: 57516, Dst Port: 5355
Link-local Multicast Name Resolution (query)

No.     Time           Source                Destination           Protocol Length Info
     47 36.247186      192.168.56.101        224.0.0.22            IGMPv3   54     Membership Report / Join group 239.255.255.250 for any sources

Frame 47: 54 bytes on wire (432 bits), 54 bytes captured (432 bits)
Ethernet II, Src: 5a:94:d2:14:5a:51 (5a:94:d2:14:5a:51), Dst: IPv4mcast_16 (01:00:5e:00:00:16)
Internet Protocol Version 4, Src: 192.168.56.101, Dst: 224.0.0.22
Internet Group Management Protocol

No.     Time           Source                Destination           Protocol Length Info
     48 36.247190      192.168.56.101        224.0.0.22            IGMPv3   54     Membership Report / Join group 239.255.255.250 for any sources

Frame 48: 54 bytes on wire (432 bits), 54 bytes captured (432 bits)
Ethernet II, Src: 5a:94:d2:14:5a:51 (5a:94:d2:14:5a:51), Dst: IPv4mcast_16 (01:00:5e:00:00:16)
Internet Protocol Version 4, Src: 192.168.56.101, Dst: 224.0.0.22
Internet Group Management Protocol

No.     Time           Source                Destination           Protocol Length Info
     49 36.266165      192.168.56.101        192.168.56.255        NBNS     110    Registration NB NONE<20>

Frame 49: 110 bytes on wire (880 bits), 110 bytes captured (880 bits)
Ethernet II, Src: 5a:94:d2:14:5a:51 (5a:94:d2:14:5a:51), Dst: Broadcast (ff:ff:ff:ff:ff:ff)
Internet Protocol Version 4, Src: 192.168.56.101, Dst: 192.168.56.255
User Datagram Protocol, Src Port: 137, Dst Port: 137
NetBIOS Name Service

No.     Time           Source                Destination           Protocol Length Info
     50 36.266169      192.168.56.101        192.168.56.255        NBNS     110    Registration NB NONE<20>

Frame 50: 110 bytes on wire (880 bits), 110 bytes captured (880 bits)
Ethernet II, Src: 5a:94:d2:14:5a:51 (5a:94:d2:14:5a:51), Dst: Broadcast (ff:ff:ff:ff:ff:ff)
Internet Protocol Version 4, Src: 192.168.56.101, Dst: 192.168.56.255
User Datagram Protocol, Src Port: 137, Dst Port: 137
NetBIOS Name Service

No.     Time           Source                Destination           Protocol Length Info
     51 36.266781      192.168.56.101        192.168.56.255        NBNS     110    Registration NB NONE<00>

Frame 51: 110 bytes on wire (880 bits), 110 bytes captured (880 bits)
Ethernet II, Src: 5a:94:d2:14:5a:51 (5a:94:d2:14:5a:51), Dst: Broadcast (ff:ff:ff:ff:ff:ff)
Internet Protocol Version 4, Src: 192.168.56.101, Dst: 192.168.56.255
User Datagram Protocol, Src Port: 137, Dst Port: 137
NetBIOS Name Service

No.     Time           Source                Destination           Protocol Length Info
     52 36.266783      192.168.56.101        192.168.56.255        NBNS     110    Registration NB NONE<00>

Frame 52: 110 bytes on wire (880 bits), 110 bytes captured (880 bits)
Ethernet II, Src: 5a:94:d2:14:5a:51 (5a:94:d2:14:5a:51), Dst: Broadcast (ff:ff:ff:ff:ff:ff)
Internet Protocol Version 4, Src: 192.168.56.101, Dst: 192.168.56.255
User Datagram Protocol, Src Port: 137, Dst Port: 137
NetBIOS Name Service

No.     Time           Source                Destination           Protocol Length Info
     53 36.267127      192.168.56.101        192.168.56.255        NBNS     110    Registration NB WORKGROUP<00>

Frame 53: 110 bytes on wire (880 bits), 110 bytes captured (880 bits)
Ethernet II, Src: 5a:94:d2:14:5a:51 (5a:94:d2:14:5a:51), Dst: Broadcast (ff:ff:ff:ff:ff:ff)
Internet Protocol Version 4, Src: 192.168.56.101, Dst: 192.168.56.255
User Datagram Protocol, Src Port: 137, Dst Port: 137
NetBIOS Name Service

No.     Time           Source                Destination           Protocol Length Info
     54 36.267129      192.168.56.101        192.168.56.255        NBNS     110    Registration NB WORKGROUP<00>

Frame 54: 110 bytes on wire (880 bits), 110 bytes captured (880 bits)
Ethernet II, Src: 5a:94:d2:14:5a:51 (5a:94:d2:14:5a:51), Dst: Broadcast (ff:ff:ff:ff:ff:ff)
Internet Protocol Version 4, Src: 192.168.56.101, Dst: 192.168.56.255
User Datagram Protocol, Src Port: 137, Dst Port: 137
NetBIOS Name Service

No.     Time           Source                Destination           Protocol Length Info
     55 36.294056      192.168.56.101        224.0.0.252           LLMNR    66     Standard query 0xd671 A isatap

Frame 55: 66 bytes on wire (528 bits), 66 bytes captured (528 bits)
Ethernet II, Src: 5a:94:d2:14:5a:51 (5a:94:d2:14:5a:51), Dst: IPv4mcast_fc (01:00:5e:00:00:fc)
Internet Protocol Version 4, Src: 192.168.56.101, Dst: 224.0.0.252
User Datagram Protocol, Src Port: 62402, Dst Port: 5355
Link-local Multicast Name Resolution (query)

No.     Time           Source                Destination           Protocol Length Info
     56 36.294057      192.168.56.101        224.0.0.252           LLMNR    66     Standard query 0xd671 A isatap

Frame 56: 66 bytes on wire (528 bits), 66 bytes captured (528 bits)
Ethernet II, Src: 5a:94:d2:14:5a:51 (5a:94:d2:14:5a:51), Dst: IPv4mcast_fc (01:00:5e:00:00:fc)
Internet Protocol Version 4, Src: 192.168.56.101, Dst: 224.0.0.252
User Datagram Protocol, Src Port: 62402, Dst Port: 5355
Link-local Multicast Name Resolution (query)

No.     Time           Source                Destination           Protocol Length Info
     57 36.342562      192.168.56.101        224.0.0.252           LLMNR    64     Standard query 0x4163 ANY None

Frame 57: 64 bytes on wire (512 bits), 64 bytes captured (512 bits)
Ethernet II, Src: 5a:94:d2:14:5a:51 (5a:94:d2:14:5a:51), Dst: IPv4mcast_fc (01:00:5e:00:00:fc)
Internet Protocol Version 4, Src: 192.168.56.101, Dst: 224.0.0.252
User Datagram Protocol, Src Port: 57516, Dst Port: 5355
Link-local Multicast Name Resolution (query)

No.     Time           Source                Destination           Protocol Length Info
     58 36.342564      192.168.56.101        224.0.0.252           LLMNR    64     Standard query 0x4163 ANY None

Frame 58: 64 bytes on wire (512 bits), 64 bytes captured (512 bits)
Ethernet II, Src: 5a:94:d2:14:5a:51 (5a:94:d2:14:5a:51), Dst: IPv4mcast_fc (01:00:5e:00:00:fc)
Internet Protocol Version 4, Src: 192.168.56.101, Dst: 224.0.0.252
User Datagram Protocol, Src Port: 57516, Dst Port: 5355
Link-local Multicast Name Resolution (query)

No.     Time           Source                Destination           Protocol Length Info
     59 36.359176      5a:94:d2:14:5a:51     Broadcast             ARP      42     Who has 192.168.56.1? Tell 192.168.56.101

Frame 59: 42 bytes on wire (336 bits), 42 bytes captured (336 bits)
Ethernet II, Src: 5a:94:d2:14:5a:51 (5a:94:d2:14:5a:51), Dst: Broadcast (ff:ff:ff:ff:ff:ff)
Address Resolution Protocol (request)

No.     Time           Source                Destination           Protocol Length Info
     60 36.359179      5a:94:d2:14:5a:51     Broadcast             ARP      42     Who has 192.168.56.1? Tell 192.168.56.101

Frame 60: 42 bytes on wire (336 bits), 42 bytes captured (336 bits)
Ethernet II, Src: 5a:94:d2:14:5a:51 (5a:94:d2:14:5a:51), Dst: Broadcast (ff:ff:ff:ff:ff:ff)
Address Resolution Protocol (request)

No.     Time           Source                Destination           Protocol Length Info
     61 36.359187      0a:00:27:00:00:00     5a:94:d2:14:5a:51     ARP      42     192.168.56.1 is at 0a:00:27:00:00:00

Frame 61: 42 bytes on wire (336 bits), 42 bytes captured (336 bits)
Ethernet II, Src: 0a:00:27:00:00:00 (0a:00:27:00:00:00), Dst: 5a:94:d2:14:5a:51 (5a:94:d2:14:5a:51)
Address Resolution Protocol (reply)

No.     Time           Source                Destination           Protocol Length Info
     62 36.498035      192.168.56.101        192.168.56.255        NBNS     92     Name query NB ISATAP<00>

Frame 62: 92 bytes on wire (736 bits), 92 bytes captured (736 bits)
Ethernet II, Src: 5a:94:d2:14:5a:51 (5a:94:d2:14:5a:51), Dst: Broadcast (ff:ff:ff:ff:ff:ff)
Internet Protocol Version 4, Src: 192.168.56.101, Dst: 192.168.56.255
User Datagram Protocol, Src Port: 137, Dst Port: 137
NetBIOS Name Service

No.     Time           Source                Destination           Protocol Length Info
     63 36.498040      192.168.56.101        192.168.56.255        NBNS     92     Name query NB ISATAP<00>

Frame 63: 92 bytes on wire (736 bits), 92 bytes captured (736 bits)
Ethernet II, Src: 5a:94:d2:14:5a:51 (5a:94:d2:14:5a:51), Dst: Broadcast (ff:ff:ff:ff:ff:ff)
Internet Protocol Version 4, Src: 192.168.56.101, Dst: 192.168.56.255
User Datagram Protocol, Src Port: 137, Dst Port: 137
NetBIOS Name Service

No.     Time           Source                Destination           Protocol Length Info
     64 36.498173      192.168.56.101        239.255.255.250       SSDP     175    M-SEARCH * HTTP/1.1 

Frame 64: 175 bytes on wire (1400 bits), 175 bytes captured (1400 bits)
Ethernet II, Src: 5a:94:d2:14:5a:51 (5a:94:d2:14:5a:51), Dst: IPv4mcast_7f:ff:fa (01:00:5e:7f:ff:fa)
Internet Protocol Version 4, Src: 192.168.56.101, Dst: 239.255.255.250
User Datagram Protocol, Src Port: 57519, Dst Port: 1900
Simple Service Discovery Protocol

No.     Time           Source                Destination           Protocol Length Info
     65 36.498175      192.168.56.101        239.255.255.250       SSDP     175    M-SEARCH * HTTP/1.1 

Frame 65: 175 bytes on wire (1400 bits), 175 bytes captured (1400 bits)
Ethernet II, Src: 5a:94:d2:14:5a:51 (5a:94:d2:14:5a:51), Dst: IPv4mcast_7f:ff:fa (01:00:5e:7f:ff:fa)
Internet Protocol Version 4, Src: 192.168.56.101, Dst: 239.255.255.250
User Datagram Protocol, Src Port: 57519, Dst Port: 1900
Simple Service Discovery Protocol

No.     Time           Source                Destination           Protocol Length Info
     66 36.684786      192.168.56.101        224.0.0.22            IGMPv3   62     Membership Report / Join group 224.0.0.252 for any sources / Join group 239.255.255.250 for any sources

Frame 66: 62 bytes on wire (496 bits), 62 bytes captured (496 bits)
Ethernet II, Src: 5a:94:d2:14:5a:51 (5a:94:d2:14:5a:51), Dst: IPv4mcast_16 (01:00:5e:00:00:16)
Internet Protocol Version 4, Src: 192.168.56.101, Dst: 224.0.0.22
Internet Group Management Protocol

No.     Time           Source                Destination           Protocol Length Info
     67 36.684789      192.168.56.101        224.0.0.22            IGMPv3   62     Membership Report / Join group 224.0.0.252 for any sources / Join group 239.255.255.250 for any sources

Frame 67: 62 bytes on wire (496 bits), 62 bytes captured (496 bits)
Ethernet II, Src: 5a:94:d2:14:5a:51 (5a:94:d2:14:5a:51), Dst: IPv4mcast_16 (01:00:5e:00:00:16)
Internet Protocol Version 4, Src: 192.168.56.101, Dst: 224.0.0.22
Internet Group Management Protocol

No.     Time           Source                Destination           Protocol Length Info
     68 36.822089      192.168.56.101        239.255.255.250       SSDP     139    M-SEARCH * HTTP/1.1 

Frame 68: 139 bytes on wire (1112 bits), 139 bytes captured (1112 bits)
Ethernet II, Src: 5a:94:d2:14:5a:51 (5a:94:d2:14:5a:51), Dst: IPv4mcast_7f:ff:fa (01:00:5e:7f:ff:fa)
Internet Protocol Version 4, Src: 192.168.56.101, Dst: 239.255.255.250
User Datagram Protocol, Src Port: 57519, Dst Port: 1900
Simple Service Discovery Protocol

No.     Time           Source                Destination           Protocol Length Info
     69 36.822091      192.168.56.101        239.255.255.250       SSDP     139    M-SEARCH * HTTP/1.1 

Frame 69: 139 bytes on wire (1112 bits), 139 bytes captured (1112 bits)
Ethernet II, Src: 5a:94:d2:14:5a:51 (5a:94:d2:14:5a:51), Dst: IPv4mcast_7f:ff:fa (01:00:5e:7f:ff:fa)
Internet Protocol Version 4, Src: 192.168.56.101, Dst: 239.255.255.250
User Datagram Protocol, Src Port: 57519, Dst Port: 1900
Simple Service Discovery Protocol

No.     Time           Source                Destination           Protocol Length Info
     70 36.837923      192.168.56.101        239.255.255.250       SSDP     171    M-SEARCH * HTTP/1.1 

Frame 70: 171 bytes on wire (1368 bits), 171 bytes captured (1368 bits)
Ethernet II, Src: 5a:94:d2:14:5a:51 (5a:94:d2:14:5a:51), Dst: IPv4mcast_7f:ff:fa (01:00:5e:7f:ff:fa)
Internet Protocol Version 4, Src: 192.168.56.101, Dst: 239.255.255.250
User Datagram Protocol, Src Port: 57519, Dst Port: 1900
Simple Service Discovery Protocol

No.     Time           Source                Destination           Protocol Length Info
     71 36.837926      192.168.56.101        239.255.255.250       SSDP     171    M-SEARCH * HTTP/1.1 

Frame 71: 171 bytes on wire (1368 bits), 171 bytes captured (1368 bits)
Ethernet II, Src: 5a:94:d2:14:5a:51 (5a:94:d2:14:5a:51), Dst: IPv4mcast_7f:ff:fa (01:00:5e:7f:ff:fa)
Internet Protocol Version 4, Src: 192.168.56.101, Dst: 239.255.255.250
User Datagram Protocol, Src Port: 57519, Dst Port: 1900
Simple Service Discovery Protocol

No.     Time           Source                Destination           Protocol Length Info
     72 36.996950      192.168.56.101        239.255.255.250       UDP      666    57521 → 3702 Len=624

Frame 72: 666 bytes on wire (5328 bits), 666 bytes captured (5328 bits)
Ethernet II, Src: 5a:94:d2:14:5a:51 (5a:94:d2:14:5a:51), Dst: IPv4mcast_7f:ff:fa (01:00:5e:7f:ff:fa)
Internet Protocol Version 4, Src: 192.168.56.101, Dst: 239.255.255.250
User Datagram Protocol, Src Port: 57521, Dst Port: 3702
Data (624 bytes)

0000  3c 3f 78 6d 6c 20 76 65 72 73 69 6f 6e 3d 22 31   <?xml version="1
0010  2e 30 22 20 65 6e 63 6f 64 69 6e 67 3d 22 75 74   .0" encoding="ut
0020  66 2d 38 22 3f 3e 3c 73 6f 61 70 3a 45 6e 76 65   f-8"?><soap:Enve
0030  6c 6f 70 65 20 78 6d 6c 6e 73 3a 73 6f 61 70 3d   lope xmlns:soap=
0040  22 68 74 74 70 3a 2f 2f 77 77 77 2e 77 33 2e 6f   "http://www.w3.o
0050  72 67 2f 32 30 30 33 2f 30 35 2f 73 6f 61 70 2d   rg/2003/05/soap-
0060  65 6e 76 65 6c 6f 70 65 22 20 78 6d 6c 6e 73 3a   envelope" xmlns:
0070  77 73 61 3d 22 68 74 74 70 3a 2f 2f 73 63 68 65   wsa="http://sche
0080  6d 61 73 2e 78 6d 6c 73 6f 61 70 2e 6f 72 67 2f   mas.xmlsoap.org/
0090  77 73 2f 32 30 30 34 2f 30 38 2f 61 64 64 72 65   ws/2004/08/addre
00a0  73 73 69 6e 67 22 20 78 6d 6c 6e 73 3a 77 73 64   ssing" xmlns:wsd
00b0  3d 22 68 74 74 70 3a 2f 2f 73 63 68 65 6d 61 73   ="http://schemas
00c0  2e 78 6d 6c 73 6f 61 70 2e 6f 72 67 2f 77 73 2f   .xmlsoap.org/ws/
00d0  32 30 30 35 2f 30 34 2f 64 69 73 63 6f 76 65 72   2005/04/discover
00e0  79 22 20 78 6d 6c 6e 73 3a 77 73 64 70 3d 22 68   y" xmlns:wsdp="h
00f0  74 74 70 3a 2f 2f 73 63 68 65 6d 61 73 2e 78 6d   ttp://schemas.xm
0100  6c 73 6f 61 70 2e 6f 72 67 2f 77 73 2f 32 30 30   lsoap.org/ws/200
0110  36 2f 30 32 2f 64 65 76 70 72 6f 66 22 3e 3c 73   6/02/devprof"><s
0120  6f 61 70 3a 48 65 61 64 65 72 3e 3c 77 73 61 3a   oap:Header><wsa:
0130  54 6f 3e 75 72 6e 3a 73 63 68 65 6d 61 73 2d 78   To>urn:schemas-x
0140  6d 6c 73 6f 61 70 2d 6f 72 67 3a 77 73 3a 32 30   mlsoap-org:ws:20
0150  30 35 3a 30 34 3a 64 69 73 63 6f 76 65 72 79 3c   05:04:discovery<
0160  2f 77 73 61 3a 54 6f 3e 3c 77 73 61 3a 41 63 74   /wsa:To><wsa:Act
0170  69 6f 6e 3e 68 74 74 70 3a 2f 2f 73 63 68 65 6d   ion>http://schem
0180  61 73 2e 78 6d 6c 73 6f 61 70 2e 6f 72 67 2f 77   as.xmlsoap.org/w
0190  73 2f 32 30 30 35 2f 30 34 2f 64 69 73 63 6f 76   s/2005/04/discov
01a0  65 72 79 2f 50 72 6f 62 65 3c 2f 77 73 61 3a 41   ery/Probe</wsa:A
01b0  63 74 69 6f 6e 3e 3c 77 73 61 3a 4d 65 73 73 61   ction><wsa:Messa
01c0  67 65 49 44 3e 75 72 6e 3a 75 75 69 64 3a 30 31   geID>urn:uuid:01
01d0  39 35 32 31 61 65 2d 38 64 31 66 2d 34 37 39 38   9521ae-8d1f-4798
01e0  2d 61 63 38 31 2d 37 63 66 63 61 65 35 66 35 33   -ac81-7cfcae5f53
01f0  64 61 3c 2f 77 73 61 3a 4d 65 73 73 61 67 65 49   da</wsa:MessageI
0200  44 3e 3c 2f 73 6f 61 70 3a 48 65 61 64 65 72 3e   D></soap:Header>
0210  3c 73 6f 61 70 3a 42 6f 64 79 3e 3c 77 73 64 3a   <soap:Body><wsd:
0220  50 72 6f 62 65 3e 3c 77 73 64 3a 54 79 70 65 73   Probe><wsd:Types
0230  3e 77 73 64 70 3a 44 65 76 69 63 65 3c 2f 77 73   >wsdp:Device</ws
0240  64 3a 54 79 70 65 73 3e 3c 2f 77 73 64 3a 50 72   d:Types></wsd:Pr
0250  6f 62 65 3e 3c 2f 73 6f 61 70 3a 42 6f 64 79 3e   obe></soap:Body>
0260  3c 2f 73 6f 61 70 3a 45 6e 76 65 6c 6f 70 65 3e   </soap:Envelope>

No.     Time           Source                Destination           Protocol Length Info
     73 36.996954      192.168.56.101        239.255.255.250       UDP      666    57521 → 3702 Len=624

Frame 73: 666 bytes on wire (5328 bits), 666 bytes captured (5328 bits)
Ethernet II, Src: 5a:94:d2:14:5a:51 (5a:94:d2:14:5a:51), Dst: IPv4mcast_7f:ff:fa (01:00:5e:7f:ff:fa)
Internet Protocol Version 4, Src: 192.168.56.101, Dst: 239.255.255.250
User Datagram Protocol, Src Port: 57521, Dst Port: 3702
Data (624 bytes)

0000  3c 3f 78 6d 6c 20 76 65 72 73 69 6f 6e 3d 22 31   <?xml version="1
0010  2e 30 22 20 65 6e 63 6f 64 69 6e 67 3d 22 75 74   .0" encoding="ut
0020  66 2d 38 22 3f 3e 3c 73 6f 61 70 3a 45 6e 76 65   f-8"?><soap:Enve
0030  6c 6f 70 65 20 78 6d 6c 6e 73 3a 73 6f 61 70 3d   lope xmlns:soap=
0040  22 68 74 74 70 3a 2f 2f 77 77 77 2e 77 33 2e 6f   "http://www.w3.o
0050  72 67 2f 32 30 30 33 2f 30 35 2f 73 6f 61 70 2d   rg/2003/05/soap-
0060  65 6e 76 65 6c 6f 70 65 22 20 78 6d 6c 6e 73 3a   envelope" xmlns:
0070  77 73 61 3d 22 68 74 74 70 3a 2f 2f 73 63 68 65   wsa="http://sche
0080  6d 61 73 2e 78 6d 6c 73 6f 61 70 2e 6f 72 67 2f   mas.xmlsoap.org/
0090  77 73 2f 32 30 30 34 2f 30 38 2f 61 64 64 72 65   ws/2004/08/addre
00a0  73 73 69 6e 67 22 20 78 6d 6c 6e 73 3a 77 73 64   ssing" xmlns:wsd
00b0  3d 22 68 74 74 70 3a 2f 2f 73 63 68 65 6d 61 73   ="http://schemas
00c0  2e 78 6d 6c 73 6f 61 70 2e 6f 72 67 2f 77 73 2f   .xmlsoap.org/ws/
00d0  32 30 30 35 2f 30 34 2f 64 69 73 63 6f 76 65 72   2005/04/discover
00e0  79 22 20 78 6d 6c 6e 73 3a 77 73 64 70 3d 22 68   y" xmlns:wsdp="h
00f0  74 74 70 3a 2f 2f 73 63 68 65 6d 61 73 2e 78 6d   ttp://schemas.xm
0100  6c 73 6f 61 70 2e 6f 72 67 2f 77 73 2f 32 30 30   lsoap.org/ws/200
0110  36 2f 30 32 2f 64 65 76 70 72 6f 66 22 3e 3c 73   6/02/devprof"><s
0120  6f 61 70 3a 48 65 61 64 65 72 3e 3c 77 73 61 3a   oap:Header><wsa:
0130  54 6f 3e 75 72 6e 3a 73 63 68 65 6d 61 73 2d 78   To>urn:schemas-x
0140  6d 6c 73 6f 61 70 2d 6f 72 67 3a 77 73 3a 32 30   mlsoap-org:ws:20
0150  30 35 3a 30 34 3a 64 69 73 63 6f 76 65 72 79 3c   05:04:discovery<
0160  2f 77 73 61 3a 54 6f 3e 3c 77 73 61 3a 41 63 74   /wsa:To><wsa:Act
0170  69 6f 6e 3e 68 74 74 70 3a 2f 2f 73 63 68 65 6d   ion>http://schem
0180  61 73 2e 78 6d 6c 73 6f 61 70 2e 6f 72 67 2f 77   as.xmlsoap.org/w
0190  73 2f 32 30 30 35 2f 30 34 2f 64 69 73 63 6f 76   s/2005/04/discov
01a0  65 72 79 2f 50 72 6f 62 65 3c 2f 77 73 61 3a 41   ery/Probe</wsa:A
01b0  63 74 69 6f 6e 3e 3c 77 73 61 3a 4d 65 73 73 61   ction><wsa:Messa
01c0  67 65 49 44 3e 75 72 6e 3a 75 75 69 64 3a 30 31   geID>urn:uuid:01
01d0  39 35 32 31 61 65 2d 38 64 31 66 2d 34 37 39 38   9521ae-8d1f-4798
01e0  2d 61 63 38 31 2d 37 63 66 63 61 65 35 66 35 33   -ac81-7cfcae5f53
01f0  64 61 3c 2f 77 73 61 3a 4d 65 73 73 61 67 65 49   da</wsa:MessageI
0200  44 3e 3c 2f 73 6f 61 70 3a 48 65 61 64 65 72 3e   D></soap:Header>
0210  3c 73 6f 61 70 3a 42 6f 64 79 3e 3c 77 73 64 3a   <soap:Body><wsd:
0220  50 72 6f 62 65 3e 3c 77 73 64 3a 54 79 70 65 73   Probe><wsd:Types
0230  3e 77 73 64 70 3a 44 65 76 69 63 65 3c 2f 77 73   >wsdp:Device</ws
0240  64 3a 54 79 70 65 73 3e 3c 2f 77 73 64 3a 50 72   d:Types></wsd:Pr
0250  6f 62 65 3e 3c 2f 73 6f 61 70 3a 42 6f 64 79 3e   obe></soap:Body>
0260  3c 2f 73 6f 61 70 3a 45 6e 76 65 6c 6f 70 65 3e   </soap:Envelope>

No.     Time           Source                Destination           Protocol Length Info
     74 37.014000      192.168.56.101        192.168.56.255        NBNS     110    Registration NB WORKGROUP<00>

Frame 74: 110 bytes on wire (880 bits), 110 bytes captured (880 bits)
Ethernet II, Src: 5a:94:d2:14:5a:51 (5a:94:d2:14:5a:51), Dst: Broadcast (ff:ff:ff:ff:ff:ff)
Internet Protocol Version 4, Src: 192.168.56.101, Dst: 192.168.56.255
User Datagram Protocol, Src Port: 137, Dst Port: 137
NetBIOS Name Service

No.     Time           Source                Destination           Protocol Length Info
